ID,Type,Story,Parent,Points,Comments,Author,Title,URL,Content,Created
8592056,comment,8590085,8591347,0,0,incision,,,"><i>&quot;Apparently, the $5k minimum order was too small for them to care (at least that&#x27;s what my side says).&quot;</i><p>I find this to be pretty typical behavior when representing Government to vendors.<p>It doesn&#x27;t impress me as being dismissive so much as indirect sales pressure.<p>A vendor knows that the typical Government agency can and does regularly piss away 10-100x that amount on systems that never see the light of day.<p>They&#x27;re betting that if the initiative has any real support someone will find the funding to make it happen.<p>Problem is, this is probably worst possible tactic to take with someone in your position who is trying to enact change without substantial/any budget to command.<p>The people on your end are happy to walk away, they&#x27;ve already done it twice and they were surely just looking for a reason to do it a third time.<p>Word to salespeople working with Government:<p>When you&#x27;re dealing with a lone &quot;champion&quot; inside some organization you should be thinking in terms of cheaply seeding for the future and having friendly eyes and ears inside - not booking a sale this quarter.<p>Also, as the OP points out, you&#x27;re going to be dealing with entirely segregated procurement departments who are likely out of their comfort zone to be handling the task at all - not the sort you should be at all impatient, demanding or upselling with.<p>Now, to be fair I should point out that I think there are some valid reasons for vendors to avoid small deals.<p>The main thing is perception. The naysayers are going to attack any new installation the moment it hits the floor. If a minimal install isn&#x27;t defensible against a hostile environment like that seeing it fail will kill any potential future business for the vendor.<p>A simple way to mitigate this is sign an agency up and leave them fully-featured and uncapped - no friction to grow the product internally. Then, this is important, resist the urge to demand a huge true-up once things have taken root, just ramp up gradually and understand that the social proof of your having your product fully-established in one such agency will open the door to sales elsewhere.",1415738827
8592055,comment,8591756,8592022,0,0,yuhong,,,"Well, Server 2003 is very similar to WinXP and I think <a href=""http://support.microsoft.com/kb/894199"" rel=""nofollow"">http://support.microsoft.com/kb/894199</a> lists a WEPOS/POSReady 2009 version.",1415738824
8592054,comment,8580007,8581911,0,0,sedachv,,,"> But there are other legitimate destinations that are rather expensive.<p>What would those be today? I can&#x27;t see how long-distance reselling could be worth it anymore.",1415738799
8592053,comment,8589969,8589969,0,0,adamfeldman,,,"Please change the submission to a secure URL: <a href=""https://securelist.com/analysis/publications/67483/stuxnet-zero-victims/"" rel=""nofollow"">https://securelist.com/analysis/publications/67483/stuxnet-z...</a>",1415738772
8592052,comment,8589747,8590898,0,0,pessimizer,,,"That&#x27;s Amazon&#x27;s PR, yes.<p><a href=""http://www.cepr.net/index.php/blogs/beat-the-press/franklin-foer-confuses-amazons-subsidies-from-the-govvernment-with-profits"" rel=""nofollow"">http://www.cepr.net/index.php/blogs/beat-the-press/franklin-...</a><p>&quot;The people who say that this is due to the fact that they are investing in building up their business are showing their ignorance. Reinvesting and profits are two separate issues. Profits reflect the difference between revenues and costs on current business operations. These can all be used for investment in expansion (as opposed to being paid out as dividends and share buybacks), but they should still show up as profits. Amazon doesn&#x27;t show profits or at least not much. This means that it costs them as much to run their business as they are getting from customers in revenue. That is not viable as a long-term model even if they are always expanding.&quot;<p>-----<p>edit:<p>[from a comment on that page]<p>Title: &quot;Nothing Depreciates In Less Than 5 Years&quot;<p>&quot;Sorry folks, there is no way that would keep Jeff Bezos out of jail where their greater investment would explain the lack of accounting profit. There is nothing that depreciates in less than 5 years (20 percent annual rate) and most items at a considerably faster rate. This means the difference in re-investment rates could at best knock off a small share of Amazon&#x27;s profits if they are not committing fraud.<p>&quot;The math on this is simple. Assume Amazon&#x27;s &#x27;true&#x27; profits are rising 15 percent a year. Assume that they re-invest 100 percent of their profits, as oppose to the 30-40 percent that would be more typical. The higher depreciation over the last five years in this case would account for just 47 percent of Amazon&#x27;s current year profits. The number would fall sharply if we assume the true rate of profit growth is 20 percent or higher and that some of Amazon&#x27;s investments depreciate in more than 5 years.&quot;",1415738753
8592051,comment,8589709,8591952,0,0,Bognar,,,"Set is the corollary to SetItem on ImmutableList<T>, not Insert.",1415738727
8592050,story,,,1,0,webhat,"Parkinson's law of triviality",https://en.wikipedia.org/wiki/Parkinson%27s_law_of_triviality,,1415738714
8592049,comment,8589835,8591478,0,0,slig,,,"You&#x27;re correct.<p>It looks like they&#x27;re using Django. You can configure it to add the md5 of static files to each name. [1]<p>[1] <a href=""https://docs.djangoproject.com/en/1.7/ref/contrib/staticfiles/#django.contrib.staticfiles.storage.ManifestStaticFilesStorage"" rel=""nofollow"">https://docs.djangoproject.com/en/1.7/ref/contrib/staticfile...</a>",1415738697
8592048,comment,8590368,8590368,0,0,rsync,,,"This reminds me of the practice of implanting a very small, very powerful magnet into the tip of your finger - which then allows you to feel magnetic fields.<p><a href=""http://discuss.biohack.me/discussion/278/so-you-want-to-put-a-magnet-in-your-finger/p1"" rel=""nofollow"">http://discuss.biohack.me/discussion/278/so-you-want-to-put-...</a><p><a href=""http://io9.com/what-you-need-to-know-about-getting-magnetic-finger-imp-813537993"" rel=""nofollow"">http://io9.com/what-you-need-to-know-about-getting-magnetic-...</a>",1415738686
8592047,comment,8590036,8591716,0,0,bkeroack,,,"Why bother?<p>I see two possibilities:<p>- Two separate address spaces, one volatile (RAM) and one persistent (SSD). &quot;Writing&quot; to persistent storage is as simple as &quot;mov [src],[dst]&quot;.<p>- One global address space, with a page attribute of &quot;volatile&quot; (true/false). Writing is just as simple as above.<p>At that point the OS and userspace are free to create whatever abstractions are necessary on top. They don&#x27;t necessarily need to be filesystems or files per se.",1415738683
8592046,story,,,1,0,jj-abram,"How to Reclaim Time by Saying No",http://www.jacobrogelberg.com/reclaim-your-time-by-saying-no/,,1415738678
8592045,comment,8589674,8589674,0,0,abqio,,,"If anyone&#x27;s interested in working in this space, Lavu is looking for developers and DevOps people.[1]<p>Full disclaimer: I work for them.<p>[1] <a href=""http://www.poslavu.com/en/ipad-pos-jobs"" rel=""nofollow"">http://www.poslavu.com/en/ipad-pos-jobs</a>",1415738669
8592044,comment,8591123,8591503,0,0,jacobr,,,"React works fine without JSX. var DOM = React.DOM; DOM.div() etc.",1415738669
8592043,comment,8589709,8591952,0,0,danbruc,,,"But Set can just overwrites the specified element while Insert will insert the element at the specified position by pushing the element and all following elements out of the way.",1415738654
8592042,comment,8591372,8591372,0,0,moocow01,,,"I&#x27;d ask your boss how the bonuses are calculated and ask how you can reach some target (say... 3k for satisfactory performance).<p>If $200 is par for the course and there is no real explanation as to why, Id personally start packing my bags in that it likely indicates that they either... like to bait and switch on employees and don&#x27;t care about morale or they are in the hole financially.<p>I personally have seen a lot of bait and switch to get people in the door in the startup world and from my experience its usually a sign that your going to be a glutton for punishment more or less.",1415738647
8592041,comment,8591684,8591684,0,0,kellros,,,"I find the hardest part in any project is avoiding and getting rid of technical debt early on.<p>Technical debt, simply put, is the result of poor choices made due to the lack of understanding (mostly the business domain; including current and future requirements) at implementation time. &quot;Gold plating&quot;, not validating or being able to validate assumptions early on and not following best practices are the major contributors of technical debt. (overdoing it and not knowing what you&#x27;re doing)<p>Determining scope is essential to any project. Adding unnecessary layers (e.g. localization, internationalization, n-tier architectures, following patterns blindly such as CQRS, leaky abstractions), insufficient layers/abstractions and not validating important assumptions lead to dramatic increase in lead times.<p>Apart from learning from others&#x27; experiences, I found that being accountable to someone you can trust to provide you with advice and scrutinize your approach to be invaluable.<p>As you gain more experience you will start trusting your gut more in regards to technical and business decisions. The other party can&#x27;t always provide you with correct, complete or sometimes any answers at all and they trust you to do what&#x27;s best for them.<p>In regards to the discovery process, it&#x27;s all about communication. Ask them to describe in a document what they want (functional requirements), what problems they are trying to solve and what constraints are in place. If it involves workflow, ask them to describe their workflow and distinguish different roles and responsibilities. 
This should at least open up some avenues of discussion to resolve ambiguity.<p>Once you have a good idea of what&#x27;s going on, start to compartmentalize the different contexts and iterate over each. See: <a href=""http://www.productbreakdownstructure.com/"" rel=""nofollow"">http://www.productbreakdownstructure.com/</a>",1415738644
8592040,story,,,54,53,benbreen,"The Twilight of the Indoor Mall",http://www.theawl.com/2014/11/the-twilight-of-the-indoor-mall,,1415738644
8592039,comment,8591486,8591913,0,0,adventured,,,"With a very small start-up of, say, one founder and one investor... you can simply assign the founder to the board, give the investor the right to appoint one seat, and then have the founder hold the right to appoint a third seat. And then expand it as required.<p>A similar concept can be used in the case of one founder + multiple investors. The founder holds the legal right to appoint numerous board seats (eg 3), and the two investors get a right to appoint one seat each. In a case of coup or other problems - and assuming everything is done properly legally - the founder appoints the remaining seats to their loyal faction and removes any of the other problematic board members. That&#x27;s not to say things won&#x27;t be messy regardless in a bad version of that scenario, in which one or more investors on the board tries to oust the founder.",1415738619
8592038,comment,8590280,8590280,0,0,pdkl95,,,"<a href=""https://gist.github.com/pdkl95/e97749edc3ba58825a16#file-bash_only_mergesort-bash"" rel=""nofollow"">https://gist.github.com/pdkl95/e97749edc3ba58825a16#file-bas...</a><p>I what must be a lapse of sanity, I wrote mergesort. It is quite a bit more than 3 - err, 14 - lines, but it does include an option to see view the array nesting.<p>It uses slightly better array management... and then throws out any gains by rebuilding a new array every time an element is shift off the front.<p>// for when you <i>really</i> don&#x27;t want to use sort(1)",1415738618
8592037,comment,8590335,8591996,0,0,naner,,,"Was the naming an honest mistake or deliberate marketing move? :)<p>I&#x27;ve heard absolutely nothing about Groupon recently (they are selling a POS now?!) until this happened.<p>Probably an honest mistake, though. Gnome seems an odd choice for a deliberate trademark conflict.",1415738598
8592035,comment,8590481,8591512,0,0,josteink,,,"To be fair, if you want contributors, removing every needless roadblock they may encounter is certainly a worthwhile goal.<p>Using some archaic VCS which nobody has heard of, and which may or may not be available on your platform of choice, certainly doesn&#x27;t <i>help</i> herd contributors to your project.",1415738577
8592034,comment,8590036,8590036,0,0,kcarnold,,,"For all of us who are thinking &quot;it&#x27;s just like RAM, just persistent!&quot;, here&#x27;s some perspectives about what persistent RAM means for OSes and applications: <a href=""http://lwn.net/Articles/610174/"" rel=""nofollow"">http://lwn.net/Articles/610174/</a>",1415738553
8592033,comment,8591209,8591956,0,0,gabrtv,,,"Deis and Kubernetes are solving different problems.  Deis is a PaaS that provides a developer self-service capability a la Heroku.  Kubernetes is a declarative container manager that provides lower-level orchestration features.  Both are complimentary.  For example, Red Hat is using Kubernetes to deliver their OpenShift v3 PaaS.  We&#x27;ve explored a similar integration with Kubernetes but are currently more focused on integrating with Mesos a next step.",1415738531
8592032,story,,,5,0,palidanx,"Ask HN: Does anyone have any quick amazon architecture questions?",,"I have an amazon appointment with an amazon architect at 4pm pst 11/11 and if anyone had any quick architecture questions I can ask them on your behalf if anyone is interested.",1415738499
8592031,comment,8589747,8590080,0,0,guybrushT,,,"I recently read [1] that one of the fastest company/startup to reach $1B in revenue is the Chinese mobile phone maker Xiaomi. This brand is #3 in global smartphone market [2]. All of this accomplished without having any big customer base in the US, Europe or Japan (traditionally large markets for tech). Personally, I find this amazing at so many levels. So yeah, I agree with you, China: &quot;the largest everything&quot;.<p>[1] <a href=""http://www.ogilvydo.com/topics/mobile/the-secrets-of-the-fastest-billion-dollar-company/"" rel=""nofollow"">http://www.ogilvydo.com/topics/mobile/the-secrets-of-the-fas...</a><p>[2] <a href=""http://www.scmp.com/business/china-business/article/1628622/xiaomi-takes-no-3-spot-global-smartphone-market-share"" rel=""nofollow"">http://www.scmp.com/business/china-business/article/1628622/...</a>",1415738499
8592030,story,,,61,29,orochi,"The Ladies Vanish",http://thenewinquiry.com/essays/the-ladies-vanish/,,1415738497
8592029,story,,,3,0,aigm,"How to Prepare for Space Exploration",http://juntostudio.tumblr.com/post/102381333351/5-ways-to-prepare-for-space-exploration,,1415738492
8592028,comment,8589676,8590724,0,0,mng2,,,"I was expecting this to be about Silego products since that&#x27;s what was featured in a recent newsletter. All of these parts seem pretty niche though.",1415738481
8592027,comment,8590659,8591596,0,0,mrspeaker,,,"There are quite a few &quot;canvas-only&quot; environments now (like Create.js that they built it for)... my favourite in Ejecta <a href=""http://impactjs.com/ejecta"" rel=""nofollow"">http://impactjs.com/ejecta</a> - that let&#x27;s you wrap up your canvas games/experiments in an iOS app that run really fast (for canvas!)... the guy re-implemented most of the canvas API on top of openGL.<p>I used to get a good frame rate even on my ancient iPhone 3G. I used simple old-school style bitmap fonts there, though. More retro ;)",1415738481
8592026,comment,8590481,8591964,0,0,kinghajj,,,"The definition of &#x27;object&#x27; is outside of the scope of the documentation for the &#x27;push&#x27; command. Similarly with &#x27;ref&#x27;.<p>From &quot;man git&quot;:<p>&quot;The object database contains objects of three main types: blobs, which hold file data;
       trees, which point to blobs and other trees to build up directory hierarchies; and commits,
       which each reference a single tree and some number of parent commits.<p><pre><code>       The commit, equivalent to what other systems call a &quot;changeset&quot; or &quot;version&quot;, represents a
       step in the project&#x27;s history, and each parent represents an immediately preceding step.
       Commits with more than one parent represent merges of independent lines of development.

       All objects are named by the SHA-1 hash of their contents, normally written as a string of
       40 hex digits. Such names are globally unique. The entire history leading up to a commit can
       be vouched for by signing just that commit. A fourth object type, the tag, is provided for
       this purpose.

       When first created, objects are stored in individual files, but for efficiency may later be
       compressed together into &quot;pack files&quot;.

       Named pointers called refs mark interesting points in history. A ref may contain the SHA-1
       name of an object or the name of another ref. Refs with names beginning ref/head/ contain
       the SHA-1 name of the most recent commit (or &quot;head&quot;) of a branch under development. SHA-1
       names of tags of interest are stored under ref/tags/. A special ref named HEAD contains the
       name of the currently checked-out branch.&quot;</code></pre>",1415738471
8592025,comment,8590481,8590866,0,0,josteink,,,"Thank you for challenging these other fine gentlemen on this one point.<p>Just today I was just looking into why I wasn&#x27;t getting automatic flyspell-mode activated on my Git commits. Now it seems I wont even need to research it further :)",1415738465
8592024,comment,8591123,8591123,0,0,hardwaresofton,,,"Looking at the todo example, I don&#x27;t see any of the usual React code for creating/managing components...<p>Is it just React the pattern (without the component part)?",1415738455
8592023,story,,,2,0,tmlee,"Mounting Evidence Penguin 3.0 Doesn't Work How You Think",http://www.northcutt.com/blog/2014/11/mounting-evidence-penguin-3-0-doesnt-work-how-you-think,,1415738445
8592022,comment,8591756,8591756,0,0,codys,,,"I&#x27;m interested in knowing if this affects Windows XP. From the page:<p>> Other versions or editions are either past their support life cycle or are not affected<p>And XP is unlisted. Seems to imply that it could be either one.",1415738443
8592021,comment,8591684,8591684,0,0,brd,,,"Initial planning is hard, especially when working out scope with other parties.<p>Starting the code is hard, you either have to choose to be very careful in your original design or knowingly forfeit the code to future rewrites, both choices induce a certain amount of paralysis.<p>Then things get easy. Welcome to the flow inducing fun part.<p>Then the project is 95% done but you know massive amounts of effort will need to be expended buttoning this up. Knowing the abysmal ROI on this stage of the project tends to demotivate a lot of programmers. Its also the part of the project when most of the fun problems have been solved which  demotivates even more programmers. This is where you identify who the finishers are (I&#x27;m not one) and man is it nice to have some finishers on your team, regardless of how little weight they carry through the first 3 phases.<p>I really only have experience with larger applications. In the few small projects I&#x27;ve worked on the first two phases were virtually non-existent since I, by default, have no problem throwing away something small.<p>Fortunately I really enjoy the first 3 phases. A lot of developers only like one or two... Welcome to the not so rosy world of getting things done.",1415738438
8592020,story,,,2,0,travisto88,"19 Famous Buildings Made Out of Jenga Blocks",http://year26.com/2014/11/05/famous-buildings-made-entirely-of-jenga-blocks/,,1415738418
8592019,comment,8591486,8591697,0,0,ChuckMcM,,,"Board members that have impressed me are ones that both care about the business and they are willing to invest time in making it successful. Bad board members don&#x27;t show up for meetings, or don&#x27;t contribute anything when they are at the meeting or between meetings. These folks are, in theory, either experienced at getting the company to the next level or connected to people who can help there.",1415738412
8592018,comment,8591756,8592005,0,0,13,,,"Go with the assumption that it does.",1415738411
8592017,comment,8590036,8590036,0,0,imaginenore,,,"We have PCIe SSDs approaching 7.2 GB/s. While that&#x27;s lower than DDR3 speeds, it&#x27;s not that far off.<p><a href=""http://hothardware.com/Reviews/OCZ-CES-2012-Product-Tour-ZDrive-R5-Everest-2-Step-Out/"" rel=""nofollow"">http://hothardware.com/Reviews/OCZ-CES-2012-Product-Tour-ZDr...</a>",1415738399
8592016,story,,,1,0,schrofer,"AT&T axes in-flight wi-fi project",http://www.bbc.com/news/business-30011133,,1415738394
8592015,comment,8583738,8591854,0,0,JoeAltmaier,,,"I didn&#x27;t make my self clear then. Its absolutely poisoned. They had to go to special trouble to disable browsing anything but the services they wanted you to see. Like putting on blinders.  Or to use the food analogy, to destroy the food value of the bread so as to influence your subsequent behavior.<p>The lowest rung, the only rung, on the internet ladder is - a connection. Nothing costs more or less than that. The rest is an attempt to charge rent on property that isn&#x27;t theirs. To mix the metaphors. They are a carrier; they don&#x27;t provide web sites and its none of their blessed business which ones you visit using their precious phone.",1415738374
8592014,comment,8591209,8591965,0,0,bacongobbler,,,"That&#x27;s ancient documentation -- v0.3.0!<p>That being said, we support any provider which runs CoreOS. Deis is just an platform which utilizes Fleet, Etcd and Docker. The best place to start would be to take a look at the Quick Start documentation: <a href=""http://docs.deis.io/en/latest/installing_deis/quick-start/"" rel=""nofollow"">http://docs.deis.io/en/latest/installing_deis/quick-start/</a>",1415738362
8592012,comment,8587447,8589181,0,0,GFischer,,,"I&#x27;m not an American libertarian, but the (non-american) libertarians I know agree with most of the points you mention.<p>- a settled body of law, with a justice system to enforce it<p>yes, and they want more of it. What they don&#x27;t want is codifying morals and customs into law (eg: gay marriage or not, anti-abortion, anti-most stuff), except for the very basics (thou shalt not kill and stuff).<p>- a more or less ordered and peaceful society
- a more or less stable currency<p>well, actually that&#x27;s one of the central points for most libertarians. Giving the government the power to print money  (and to punish private transactions) is very problematic. See: Argentina right now. Or Venezuela.<p>- civil infrastructure, including transport, utilities and communications<p>well, yes, but they can be privatized and work as well.<p>- public health (private medicine will only go so far in protecting the rich in a society rife with infection; plus employees and customers dying of preventable conditions is bad for business)<p>this one&#x27;s very debatable, yeah, most libertarians are against public health. I still don&#x27;t know which is the best option (insurance companies certainly aren&#x27;t)<p>- public education (all but the most menial jobs require at least basic literacy and numeracy, and most require significantly more)<p>most libertarians are against public education, but that does not translate to not helping everyone get basic literacy, it can be archieved through grants or coupons or stuff. Plus at least in my country there are several free private schools available (paid for by religious or other NGOs), of much better quality than public ones.<p>- some kind of safety net for the poor<p>some are in favor of that one, they disagree on the how (and very especially on the how it&#x27;s done now).",1415738335
8592011,comment,8590036,8591957,0,0,13,,,"I couldn&#x27;t find any when I looked recently, even the one you&#x27;ve linked to is quite old (2009) and has the same 4GB (presumably 32bit) limit. If they were more common and in more realistic sizes I&#x27;d love to get my hands on one.",1415738306
8592010,comment,8590481,8591711,0,0,sedachv,,,"You are forgetting darcs, which IMO is a lot better than bzr and hg.",1415738306
8592009,comment,8589747,8591729,0,0,DieBuche,,,"Please remove this url or wrap it in a pre tag, it breaks the page",1415738300
8592008,comment,8591486,8591486,0,0,dude_abides,,,">> As a side note, bad board members are disastrous.<p>This is too important a point to be left as a side note; I&#x27;m sure this is the primary reason founders prefer not to have external board members.<p>&quot;How to choose an external board member&quot; would be a great follow-up essay.",1415738277
8592007,story,,,137,38,jdoliner,Hack.summit(),https://hacksummit.org/,,1415738274
8592006,comment,8590183,8590183,0,0,deadfall,,,"Everytime I see pictures or video of the Sun I feel very small. Some of the solar flares are bigger than our planet. I  am not even going to mention the Hubble Ultra-Deep Field poster on my wall that has around 10,000 galaxies.",1415738268
8592005,comment,8591756,8591756,0,0,executive,,,"could allow? or allows?",1415738257
