ID,Type,Story,Parent,Points,Comments,Author,Title,URL,Content,Created
8592004,comment,8591123,8591743,0,0,weego,,,"There is a Controller class, but in the demo app you can see that both App and ToDoItem extend Controller, which makes be believe that Controller is perhaps not what you&#x27;d expect.<p>Having said that, I much prefer Backbones presenter idiom over MVC.",1415738251
8592003,comment,8591486,8591913,0,0,ChuckMcM,,,"In the single founder case you could do investor + founder + outside member (3 members) presumably the outside member would vote in the company&#x27;s interest. I don&#x27;t have much experience dealing with boards, but of the ones I have dealt with they generally are all trying to do the same thing (make the company reach its maximum potential). The issues come when the CEO has a different idea about how to go about that and it puts the board and CEO at odds.<p>There is also no constraint on &#x27;founderness&#x27; vs &#x27;boardness&#x27; which is to say, if you&#x27;re a small company with a 3 person board and you hire a CTO or a CMO or some other C level position you can put them on the board as well.",1415738244
8592002,comment,8585483,8591888,0,0,enneff,,,"Java&#x27;s sin is a fetish for over abstraction. Go has a strong cultural emphasis on avoiding unnecessary abstraction.",1415738236
8592001,story,,,3,0,jgeewax,"Dart SDK is now apt-gettable",https://www.dartlang.org/tools/debian.html,,1415738215
8592000,comment,8590481,8591682,0,0,kinghajj,,,"And you could argue that it&#x27;s better to use new terms rather than existing ones that carry possibly-incorrect assumptions, no? &quot;Leaky abstractions&quot; and all that.",1415738212
8591999,comment,8576791,8576791,0,0,rgovind,,,"Hi,
I am thinking on three ideas.I am not able to proceed as my CSS skills are very bad so my output webpage looks ugly.<p>1) Stackoverflow is reactive. You have to wait  for someone else to post a question before you can answer. As a developer, whenever I solve a difficult problem, I want to be able to tweet or write a blog about it so others can find it. However, unlike twitter, it will not be limited to 140 characters. This is mainly useful for proprietary softwares where senior developers/managers often need to train new comers. Essentially, this is yammer for developers.<p>2) When buying a home, commute time is a big factor but very few tools  let you compare commute times over an extended period of time. For example, if I have 3-4 areas in my mind, I would like an app which sends traffic updates for these areas everyday at 8:00am and at 5:00pm. After a few ideas, I will have an idea of which place would be a better commute<p>3) A job search engine which is sorts jobs based on &quot;Commute distance&quot; from your home address rather than from city centre. This also takes public transport and spouse&#x27;s commute also into consideration.<p>If you are interested, drop me a line at rgovind@cadence.com",1415738205
8591998,comment,8590992,8591679,0,0,unicornporn,,,"4 g each day for 12 years? May I ask why?",1415738183
8591997,comment,8585597,8585597,0,0,lexcorvus,,,"I&#x27;m cautiously optimistic about this, but the reference to &quot;inappropriate comments&quot; gives me pause. I&#x27;m reminded of this analysis [1]:<p><i>We have such labels [for heresy] today, of course, quite a lot of them, from the all-purpose &quot;inappropriate&quot; to the dreaded &quot;divisive.&quot; In any period, it should be easy to figure out what such labels are, simply by looking at what people call ideas they disagree with besides untrue. When a politician says his opponent is mistaken, that&#x27;s a straightforward criticism, but when he attacks a statement as &quot;divisive&quot; or &quot;racially insensitive&quot; instead of arguing that it&#x27;s false, we should start paying attention.</i><p>Especially when paired with coded language like &quot;historically marginalized users&quot; (I&#x27;m pretty sure Sam isn&#x27;t talking about Republicans here [2]), targeting &quot;inappropriate comments&quot; suggests that Hacker News it at risk of becoming a progressive echo-chamber. (Of course, there are those [3] who fret that HN is insufficiently progressive, but the same people probably think Harvard and the New York Times aren&#x27;t progressive enough, either.) I can understand flagging <i>uncivil</i> comments, but &quot;inappropriate&quot; comments? I&#x27;m not even sure what that means. Please proceed with caution.<p>[1]: <a href=""http://paulgraham.com/say.html"" rel=""nofollow"">http://paulgraham.com/say.html</a><p>[2]: If you don&#x27;t think tech is hostile to Republicans, you&#x27;ve probably never been a Republican in tech. Indeed, who&#x27;s more underrepresented in tech: women, or Romney voters? (<i>Note</i>: I didn&#x27;t vote for Romney, and I am not now nor have I ever been a member of the Republican party.)<p>[2]: See, e.g., <a href=""https://twitter.com/shit_hn_says"" rel=""nofollow"">https://twitter.com/shit_hn_says</a>.",1415738181
8591996,comment,8590335,8590335,0,0,alasdair_,,,"<a href=""https://twitter.com/Groupon/status/532268238621921280"" rel=""nofollow"">https://twitter.com/Groupon/status/532268238621921280</a><p>&quot;We have decided to abandon our pending trademark applications for #Gnome. Read more: <a href=""http://gr.pn/gnomeupdate"" rel=""nofollow"">http://gr.pn/gnomeupdate</a>  #defendGNOME&quot;",1415738174
8591994,comment,8591756,8591756,0,0,yuhong,,,"Wonder why didn&#x27;t they add GCM with ECDHE even though it is already in Win10 preview. I considered it strange that they added GCM with DHE in the first place when all the rest of the suites are ECDHE.",1415738131
8591993,comment,8590444,8590444,0,0,kenjackson,,,"This is better than I thought it would be (I read the comments here first).  I do agree that some of the content can be glossed over (move some of the internals discussion later in the document), and some figures <i>might</i> be useful -- but you must be careful.  I&#x27;ve been fooled by figures more often than I&#x27;d like.<p>Overall I feel like this is a good addition to the Git introduction space.<p>One big piece of feedback is that would be useful to have a section on obtaining and setting Git up the first time.  Especially for Windows users, it may not be obvious.",1415738123
8591992,comment,8589674,8591962,0,0,Someone1234,,,"I&#x27;ve been in an Apple store where their customized iPod Touches (or iPhones?) POS terminals couldn&#x27;t get online. Irony of ironies.",1415738120
8591991,comment,8591486,8591486,0,0,sethbannon,,,"Especially for first time founders, not inviting an investor to sit on your board when you raise is a mistake. I can speak from personal experience here. The many upsides of an outside board member (mentorship, a cadence to the business, outside perspective, pattern recognition, real investor buy-in) outweigh the few downsides (loss of control, investment of time in board management).<p>It&#x27;s an especially insidious mistake for founders, because not giving up control (i.e. not giving up any board seats) seems like a victory during fundraising, and you only see the downsides when things start to turn sour.<p>Here&#x27;s another great post about the value of outside board members: <a href=""http://allthingsd.com/20130927/the-value-of-a-board-at-the-seed-stage/"" rel=""nofollow"">http://allthingsd.com/20130927/the-value-of-a-board-at-the-s...</a>",1415738097
8591990,comment,8591193,8591832,0,0,jdoliner,,,"> Very neat. Btrfs is a practical choice. Looks like the Go http server listens for both changes and jobs?<p>Right now pfs is just a file system so servers only listen for changes. However longterm this is going to be the case because submitting a job is actually going to be implemented as making a commit in the file system that tells pfs which data to run the job over and the container to use to do so.<p>> Could you tell me about the advantages git semantics add to MapReduce?<p>One is that it gives you an audit log which is very useful for debugging. I often find myself with data in HDFS that doesn&#x27;t look like what I expect it to and wish that I know what process changed it.<p>Another killer feature is that it removes the distinction between stream processing and static MapReduce. Since our file system is commit based we think of MapReduce as an operation over a stream of commits rather than a static set of files. When more commits come in you can recompute your job for only the changes.<p>> Last, how does Pfs choose to distribute data across containers?<p>Right now pfs uses a simple static hashing algorithm based on filename. This probably isn&#x27;t going to work for production deployments. We&#x27;re planning to improve it soon.<p>> You&#x27;ve inspired me to put up an Unbounce page. Let&#x27;s talk ZFS soon!<p>Yes please.",1415738094
8591989,comment,8590422,8591889,0,0,waterlesscloud,,,"Not the overall deer population, but around the margins, on the edges of settlements. Seems like it could make a difference there.",1415738079
8591988,comment,8591756,8591756,0,0,0x0,,,"Is this the beginning of another sasser/codered worm?",1415738078
8591987,comment,8591209,8591927,0,0,bacongobbler,,,"Hi, I&#x27;m also a maintainer :) to answer your questions:<p>1) we expose ceph in the router, so your apps could use it. This will have to be managed by you however as we don&#x27;t have a user story for plugging apps into backing services asides from `deis config:set`[1]... Yet.<p>2) Performance is still something we&#x27;re working on. When you deploy an application using a Heroku buildpack[2], your app is compiled into a container which sits on top of Heroku&#x27;s cedar stack, which is around 800MB[3]. It&#x27;s a beefy stack so fleet will take some time deploying that image. This should only occur the first time it&#x27;s scheduled onto a new host as future images will just use the cache for that image, significantly speeding up deployment times. If you deploy an app using a Dockerfile and it&#x27;s been optimized correctly (we have an app sitting under 5MB for test purposes)[4], deployment times should be very speedy.<p>Hope that answers your question!<p>[1]: <a href=""https://github.com/deis/deis/issues/231"" rel=""nofollow"">https://github.com/deis/deis/issues/231</a><p>[2]: <a href=""http://docs.deis.io/en/latest/using_deis/using-buildpacks/"" rel=""nofollow"">http://docs.deis.io/en/latest/using_deis/using-buildpacks/</a><p>[3]: <a href=""https://github.com/progrium/cedarish"" rel=""nofollow"">https://github.com/progrium/cedarish</a><p>[4]: <a href=""https://registry.hub.docker.com/u/deis/example-go/"" rel=""nofollow"">https://registry.hub.docker.com/u/deis/example-go/</a>",1415738075
8591986,comment,8589835,8589835,0,0,rmsaksida,,,"I have search history disabled in my Google account settings. I guess that probably disables the login for me as well. I search for Python related stuff dozens of times a day.",1415738069
8591985,comment,8591193,8591193,0,0,Yacoby,,,"I am not sure I see the point in implementing MapReduce when most of the current work seems to be in generalising MapReduce - i.e. Apache Spark and YARN. Is there any reasoning behind this?",1415738067
8591984,comment,8591905,8591977,0,0,mmastrac,,,"Yeah, that&#x27;s one thing that irked me here. I imagine that Adafruit and/or Sparkfun and/or Chinese resellers on eBay will fill the void and we&#x27;ll end up with a dip-like breadboard.<p>From the datasheet, it looks like they&#x27;ve explicitly dedicated those four extra pins to I/O, so I imagine this means there will never be a DIP equivalent. Is a sign that DIP packages are on the way out?",1415738051
8591983,comment,8590692,8591975,0,0,christophilus,,,"You&#x27;ll also notice that between the black stripes, there is a somewhat denser white stripe. A while back, I calculated the number of primes in those white stripes, and the number was a good bit higher than the over all average.",1415738032
8591982,comment,8590922,8591884,0,0,sdouglas,,,"Hi ascorbic. Thanks for pointing us in the direction of the FCA, it’s good to get as many opinions on this as possible. Yes, we have consulted a lawyer specialising in English financial services regulation, as well as closely reading the FSMA Act 2000. I agree that bitcoin isn’t a ‘no-rules’ money, but I disagree that there is no difference in the requirements. This is because bitcoin and other digital currencies are not specified investments under FSMA (the relevant section of FSMA is 22). In our opinion it would be good for digital currencies if they were a specified investment, but currently they are not, and therefore they are not subject to the same regulations as cash or other traditional financial instruments. If you think I’m wrong please push back. This is an important point to clarify not just for us but other businesses in this space.",1415738026
8591981,comment,8591756,8591756,0,0,aluhut,,,"4 hours for 5MB? Wow...",1415738020
8591980,comment,8590659,8590659,0,0,james33,,,"This is pretty great! We&#x27;ve put a lot of work into text for our HTML5 game development, yet our canvas-rendered text is still quite limited in functionality. Using a library like this is going to save us loads of time and really open things up for us.",1415738017
8591979,comment,8590036,8590238,0,0,jhallenworld,,,"Well at the interface level it has to look like memory since it&#x27;s attached to a memory bus.  But that does not mean it looks like a single large DIMM.  There is no way in the DRAM protocol to delay a transaction while data is read from the flash chips into the buffer, so you need a protocol on top of the simple memory model.<p>&quot;nvDIMMs&quot; on the other hand do look like and are as fast as plain memory.  Disadvantage is that they are not big.",1415738001
8591978,comment,8589080,8589625,0,0,gregsadetsky,,,"&quot;milli lightsecond&quot; doesn&#x27;t work on OSX unfortunately (under 10.6 at least). One value which does work is &quot;3 c-millisecond&quot;.<p>(I learned this by reading the /usr/share/misc/units.lib file and finding the lightyear definition: &quot;c-yr&quot;)",1415737988
8591977,comment,8591905,8591916,0,0,pdknsk,,,"The very low cost evaluation boards almost make up for not providing DIP packages.",1415737949
8591976,comment,8590772,8591914,0,0,alttab,,,"The article likened the job to food critics, none of which is double-blind, randomized, or performed with the scientific method.<p>For a local newspaper in Denver, an article that says &quot;Go down to ye ol mary pub, and get this nug its the bomb&quot; will be relevant for most who read it.<p>If you read it online from Flordia, and then buy the &quot;same&quot; Lemon Skunk from your street dealer in Orlando, of course you are going to end up with a different product...",1415737948
8591975,comment,8590692,8591963,0,0,christophilus,,,"I was wondering that, myself. The magic number seems to be 210. (1260 is 210 * 6)",1415737947
8591974,comment,8585483,8591527,0,0,jshen,,,"Il bet that the choice of language has no impact on success.",1415737924
8591973,story,,,3,0,augustiner,"Great talk on multi-device design by Luke Wróblewski",http://wordpress.tv/2014/11/05/luke-wroblewski-from-the-front-lines-of-multi-device-web-design/,,1415737916
8591972,comment,8583922,8588100,0,0,teacup50,,,"> <i>All in all, I&#x27;m curious what a solution to the privacy issue would look like that would satisfy your criteria. Any proposals?</i><p>No server other than a gateway at the house. Peer-to-peer sync.<p>If centralized servers are required, perhaps someday we&#x27;ll have the keying/trust infrastructure necessary to deploy sandboxed code that can&#x27;t be introspected externally, e.g., using Intel SGX.",1415737914
8591971,comment,8590036,8591600,0,0,rsync,,,"&quot;However, I wonder how the modern UNIX OS will work with a system like this without block devices at all.&quot;<p>I don&#x27;t think that&#x27;s how it works - I think you get a special driver that presents the fast-storage-in-dimm-slot as a block device.  So you still have a block device, it&#x27;s just faster.<p>Right ?",1415737908
8591970,comment,8591125,8591959,0,0,DanBC,,,"> I would avoid dropping the wedge into the water since you have no idea if the rind is clean.<p>Why are you eating there if you can&#x27;t trust them to provide clean food?",1415737906
8591969,story,,,1,0,dnetesn,"Transported to Paradise, but Needing More",http://www.nytimes.com/2014/11/11/science/in-a-window-on-eternity-edward-o-wilson-finds-a-paradise-but-says-more-are-needed.html?ref=science,,1415737904
8591968,comment,8590574,8591380,0,0,harryh,,,"1) It is factually incorrect to state that the rest of the world is light years ahead of us in broadband access. Connecting speeds in the US are faster than all but a handful of other countries most of which are very small & dense (like South Korea). See: <a href=""http://www.akamai.com/dl/akamai/akamai-soti-q413.pdf?WT.mc_id=soti_Q413"" rel=""nofollow"">http://www.akamai.com/dl/akamai/akamai-soti-q413.pdf?WT.mc_i...</a><p>Perhaps this misunderstanding of the current state of reality is leading you to reach incorrect conclusions.",1415737901
8591967,story,,,9,1,DanBlake,"Show HN: EverydayCarry.com",http://everydaycarry.com/,,1415737891
8591966,comment,8590422,8591889,0,0,maxerickson,,,"I looked at some numbers for Michigan. Hunters take ~400,000 deer each year, while there are ~50,000 vehicle-deer accidents (I guess the majority of the collisions kill the deer).<p>I haven&#x27;t found a convenient source for predators. There are wolves, and coyotes, bobcats and bears. I guess bobcats, coyotes and bears mostly don&#x27;t go after adults, but they can have a big impact on the number of fawns.",1415737887
8591965,comment,8591209,8591940,0,0,hackerboos,,,"Deis supports custom providers.<p><a href=""http://deis.readthedocs.org/en/rtfd-org/components/provider/"" rel=""nofollow"">http://deis.readthedocs.org/en/rtfd-org/components/provider/</a>",1415737872
8591964,comment,8590481,8591590,0,0,tedks,,,"A change set is a set of changes.<p>An object is totally unspecified.<p>I know what a repository is when I work with version control. I&#x27;ve been using version control for years and I never was confused about what the repository was.<p>What the fuck is a ``ref&#x27;&#x27;?<p>Git&#x27;s shit.",1415737869
8591963,comment,8590692,8590692,0,0,antimora,,,"Assuming the black striped continue forever for &quot;prime mod 1260&quot;, does this mean we can quickly weed out non prime numbers?",1415737854
8591962,comment,8589674,8589674,0,0,gdilla,,,"I&#x27;ve been in a store when one of the Revel iPad terminals couldn&#x27;t get online. highly annoying. Don&#x27;t traditional POS rely on the telephone lines? Usually more reliable than my ISP, that&#x27;s for sure.",1415737837
8591961,story,,,5,0,wclax04,"Openfolio and Coinbase bring something that Bitcoin needs: transparency",http://venturebeat.com/2014/11/11/openfolio-and-coinbase-bring-something-that-bitcoin-investing-needs-transparency/#,,1415737835
8591960,comment,8591486,8591681,0,0,minimax,,,"I think you are misunderstanding the way corporations are organized. All corporations must have a board of directors, and the board of directors is the ultimate top level decision making entity within the corporation. The board is always in control. Shareholders have the ability to periodically vote on directors, but that is basically the extent of their power. Shareholders have no right to influence day to day operations of the corporation. So, if you are a founder and want to assure control of the board, you must maintain a majority of voting class shares, otherwise large investors could vote in their own directors who can do whatever they want (like replacing the founder as the CEO).",1415737828
8591959,comment,8591125,8591558,0,0,brixon,,,"Same here. Also, when at a restaurant squeeze a lemon (or lime) wedge into your water to help handle odd tastes.<p>I would avoid dropping the wedge into the water since you have no idea if the rind is clean.",1415737815
8591958,story,,,15,1,dnetesn,"Weapons Directed by Robots, Not Humans, Raise Ethical Questions",http://www.nytimes.com/2014/11/12/science/weapons-directed-by-robots-not-humans-raise-ethical-questions.html?ref=science,,1415737810
8591957,comment,8590036,8591833,0,0,rsync,,,"Aren&#x27;t there plenty of other PCIe ram-cards ?<p>Like <a href=""http://ddrdrive.com/"" rel=""nofollow"">http://ddrdrive.com/</a>  ?<p>I didn&#x27;t think there was any shortage of these kind of devices - especially given their common use in ZFS workloads as a SLOG.",1415737796
8591956,comment,8591209,8591209,0,0,bkeroack,,,"I&#x27;m interested in hearing pros/cons of Deis vs Kubernetes.<p>The primary disadvantage I can see for Deis is that it can only deploy single Docker containers (vs Kubernetes pods). Given the Heroku-style setup it makes sense, but it is limiting for more complex applications.<p>On the other hand, the simplicity of Deis is attractive. I kind of <i>wish</i> I could use it, but I feel like it just isn&#x27;t feasible for a full suite of microservices + dependencies.<p>Regardless, congrats on 1.0!",1415737793
8591955,comment,8588542,8591269,0,0,aw3c2,,,"Are you sure the blood sample was handled correctly? Vitamin D tests are cheap to do nowadays but most doctors have no idea that they have to immediately enclose the sample in darkness or it will be tainted. Vitamin D decomposes(?) in sunlight.<p>I was tested deficient by one ignorant doctor, then another tested again and everything was fine. The second one told me about it. It is a pain to google so I cannot find proper sources in English.",1415737789
8591954,comment,8591923,8591923,0,0,joshstrange,,,"Hmmm.... This doesn&#x27;t seem to line up with what Gnome said [0]:<p>> It was almost inconceivable to us that Groupon, with over $2.5 billion in annual revenue, a full legal team and a huge engineering staff would not have heard of the GNOME project, found our trademark registration using a casual search, or even found our website, but we nevertheless got in touch with them and asked them to pick another name. Not only did Groupon refuse, but it has now filed even more trademark applications (the full list of applications they filed can be found here [1], here [2] and here). To use the GNOME name for a proprietary software product that is antithetical to the fundamental ideas of the GNOME community, the free software community and the GNU project is outrageous.<p>Yet Groupon says:<p>> We’ve been communicating with the Gnome Foundation for months to try to come to a mutually satisfactory resolution, including alternative branding options, and we’re happy to continue those conversations. And if we can’t come up with a resolution, we’ll be glad to look for another name.<p>If we take the Gnome post as fact it appears Groupon thought they could get away with this then when they saw the (potential) backlash they backed away from their position. This may not be the case but I&#x27;m much more inclined to believe Gnome over Groupon<p>[0] <a href=""https://www.gnome.org/groupon/"" rel=""nofollow"">https://www.gnome.org/groupon/</a><p>[1] <a href=""http://tsdr.uspto.gov/#caseNumber=86200190%0A86200193%0A86200194%0A86200196%0A86200657%0A86200661%0A86200759%0A86200763%0A86200765%0A86227618%0A&caseType=SERIAL_NO&searchType=multiStatus"" rel=""nofollow"">http://tsdr.uspto.gov/#caseNumber=86200190%0A86200193%0A8620...</a><p>[2] <a href=""http://tsdr.uspto.gov/#caseNumber=86287930%0A86287935%0A86287938%0A86287940%0A86287946%0A86287951%0A&caseType=SERIAL_NO&searchType=multiStatus"" rel=""nofollow"">http://tsdr.uspto.gov/#caseNumber=86287930%0A86287935%0A8628...</a><p>[3] <a href=""http://tsdr.uspto.gov/#caseNumber=86441913%0A86441922%0A86441923%0A86441925%0A86441926%0A86441930%0A86441933%0A86441934%0A86441937%0A86441941%0A86441945%0A86441951%0A&caseType=SERIAL_NO&searchType=multiStatus"" rel=""nofollow"">http://tsdr.uspto.gov/#caseNumber=86441913%0A86441922%0A8644...</a>",1415737785
8591953,comment,8583722,8587938,0,0,dasmithii,,,"Agreed. Criminalizing antagonism would provide dirt on just about everyone. Hell, half of YouTube [commenters] would be prosecutable.<p>Not all wrongful doings ought be illegal.",1415737783
8591952,comment,8589709,8591849,0,0,DenisM,,,"That&#x27;s why there are two separate methods on this class - Add (at the end) and Set (anywhere). Both outperform the corresponding ImmutableList<T>, according to the article.",1415737783
8591951,comment,8590849,8590849,0,0,skeswa,,,"Nice! I love teespring, maybe now I can finally build something using their data.",1415737782
8591950,story,,,5,0,mutor,"A Framework for Representing Knowledge (1974)",http://web.media.mit.edu/~minsky/papers/Frames/frames.html,,1415737779
8591949,comment,8590036,8591228,0,0,hadoukenio,,,"> I would be willing to wager that new models of laptops in 2020 with spinning disk will be uncommon<p>How about more like 2015. You&#x27;re already forgetting MacbookAir/Chromebook/Ultrabook crowd are slowly taking over (which have no spinning disks).",1415737755
8591948,story,,,2,0,k4jh,"Landing a spacecraft on a comet",http://www.iflscience.com/space/rosetta-s-philae-prepares-land-comet-67pchuryumov-gerasimenko,,1415737745
