ID,Type,Story,Parent,Points,Comments,Author,Title,URL,Content,Created
8592130,comment,8591193,8591985,0,0,jdoliner,,,"This is a very good question. There&#x27;s a growing sentiment in the Hadoop ecosystem that MapReduce is in someway passe and I think it&#x27;s somewhat unfair. A lot of the confusion comes from the fact that people don&#x27;t distinguish between Hadoop&#x27;s implementation of MapReduce and MapReduce the paradigm. As a paradigm MapReduce is actually very general. A good example of this is stream processing. Hadoop has completely separate implementations for stream processing in Storm. However there&#x27;s no inherent reason MapReduce can&#x27;t operate on streams. In fact, in pfs where the file system can be thought of as a stream of commits that&#x27;s the only thing that it does operate on.<p>So tl;dr we think that a better implementation of MapReduce can be a much more general tool than Hadoop&#x27;s MapReduce is.",1415739599
8592129,comment,8589835,8592093,0,0,dontreact,,,"If you wanted to you could check:<p><a href=""https://history.google.com/history"" rel=""nofollow"">https://history.google.com/history</a><p>Also, it is possible that the url once you actually enter is different and that may be sufficient to get in.<p>Thanks!",1415739595
8592128,comment,8591486,8591681,0,0,paul,,,"You retain control by coding it into your corporate bylaws. For example, you might have two board seats elected by common (the founders + employees), one board seat elected by preferred (the investors), and the ceo hired/fired by a majority vote of the board. That way two founders can always outvote investors, but investor + founder could outvote the other founder (sometimes necessary).<p>The way you lose control is to do something like one seat to the ceo, one to preferred, and one &quot;independent&quot;. The investor recommends his highly qualified friend as the independent member, then sometime down the road you run into trouble and the investors + independent fire you (the ceo), and then you&#x27;ve lost all control.",1415739592
8592127,comment,8591756,8591994,0,0,mike_hearn,,,"From the article:<p><i>Does this update contain any additional security-related changes to functionality?<p>Yes. In addition to the changes that are listed in the Vulnerability Information section of this bulletin, this update includes changes to available TLS cipher suites. This update includes new TLS cipher suites that offer more robust encryption to protect customer information. These new cipher suites all operate in Galois/counter mode (GCM), and two of them offer perfect forward secrecy (PFS) by using DHE key exchange together with RSA authentication.</i>",1415739574
8592126,comment,8590659,8591596,0,0,diverted247,,,"Our use case was web2print and mobile support was a big issue. SVG is great but it has mixed mobile support and performance varies. With <canvas> we are able to control rendering fine grained so when the app is not interacted, it is imagelike in performance.<p>Most of the features in txtjs can easily be ported to SVG as the primary renderer required is SVGPath. FontLoader/Fonts would require zero change but new controls would need to subclass SVG elements. I am very interested in seeing better text in SVG as well as on <canvas> for creative use.",1415739566
8592125,comment,8591923,8591954,0,0,revelation,,,"It&#x27;s like squatting on someones reserved parking and then trying to strike up a conversation on <i>alternative parking options</i> with them. The only reasonable answer is <i>get the fuck off</i>.",1415739566
8592124,comment,8589835,8590537,0,0,rational-future,,,"How is this going to help you? Would you be happy with a job you&#x27;re not good enough to do properly?",1415739565
8592123,comment,8591209,8592064,0,0,bacongobbler,,,"From the outside, not much. Both model the Heroku-style workflow with application deployment.<p>Asides from Deis being production-ready and tacking on a few extra features like `deis pull` and Dockerfile deployment workflows, we take a different approach to our components. We use the best-of-breed components from other OSS projects and focus entirely on the application deployment workflow. Flynn is focused on building the platform from the ground up. They provide the network equipment and messaging primitives (layer 0, as they call it) as well as the platform itself (layer 1) completely from scratch. Deis uses common OSS tools such as nginx and ceph to provide our layer 0 and part of our layer 1 for us and focus entirely on using those components to serve our needs.",1415739559
8592122,story,,,1,0,okasaki,"Quater-imaginary base",https://en.wikipedia.org/wiki/Quater-imaginary_base,,1415739549
8592121,comment,8592007,8592007,0,0,edro,,,"Speakers include:<p>Tom Chi (co-creator Google Glass)
- Grady Booch (creator the Unified Modeling Language)
- David Heinemeier Hansson (inventor of Ruby on Rails)
- Brian Fox (invented the GNU Bash shell)
- Rebecca Parsons (CTO, Thoughtworks)
- Hakon Wium Lie (inventor of CSS)
- Alex Gaynor (Director, Python Software Foundation, and core committer to Django)
- Sarah Allen (Presidential Innovation Fellow, led development for many Adobe products)
- Gilad Bracha (co-author of the Java Language Specification)
- Kent Beck (creator of Extreme Programming, created Test Driven Development, co-created Agile, author of 9 books)
- Ward Cunningham (inventor of the wiki, contributed to Extreme Programming, co-author of Design Patterns)
- Bram Cohen (inventor of Bittorrent)
- Hampton Catlin (creator of Sass, Haml, m.wikipedia.org, book author)
- Matei Zaharia (creator of Apache Spark)
- Melody Meckfessel (Google Director of Engineering)
- Jon Skeet (the top answerer on StackOverflow)
- Scott Hanselman (author of multiple books)
- Jeff Haynie (founder of Appcelerator)
- Ryan Bubinski (founder of Codecademy)
- Aaron Skonnard (founder of Pluralsight)
- Floyd Marinescu (founder of InfoQ)
- Steve Newcomb (founder of Famo.us)
- Orion Henry (founder of Heroku)
- Janet Wiener (Engineering at Facebook, big data expert)
- Scott Chacon (CIO, Github)
- Chad Fowler (CTO, Wunderlist, well-known programming educator and blogger)
- Salil Deshpande (open source investor titan)
- Hadi Partovi (founder of Code.org, was in charge of Internet Explorer, advisor to Dropbox and Facebook)
- Qi Lu (EVP, Microsoft)",1415739549
8592120,comment,8592085,8592085,0,0,blueatlas,,,"I plan to try this, but have to say up front that the name is great, messaging on the site is spot on, and the pricing seems quite reasonable.",1415739537
8592119,comment,8591923,8591923,0,0,rasengan,,,"Groupon lies. However the end result is good either way for GNOME and open source. Now the only question is why was the fastest up voted post in HN history which was Gnome vs Groupon in favor of Gnome moderated to the second page while this Groupon post is at the top of the front page with almost no votes!<p>Does someone at HN have stock in groupon or something?  Either way it&#x27;s time for a transparent Blockchain based HN/reddit.  This moderator bias crap is bs.",1415739508
8592118,story,,,2,0,option_greek,"Sugar Science – the unsweetened truth",http://sugarscience.org/,,1415739484
8592117,comment,8590347,8591842,0,0,serve_yay,,,"Give me a break, quite frankly. You see a guy with thick framed glasses and all of a sudden you know that he&#x27;s a culture vulture? I don&#x27;t buy it.",1415739473
8592116,comment,8589747,8589908,0,0,therealdrag0,,,"There&#x27;s a similar comercial holiday in Korea called Pepero Day. And it&#x27;s also based on the 1&#x27;s.<p><a href=""http://en.wikipedia.org/wiki/Pepero#Pepero_Day"" rel=""nofollow"">http://en.wikipedia.org/wiki/Pepero#Pepero_Day</a>",1415739470
8592115,comment,8583738,8584203,0,0,dasmithii,,,"&quot;Freedom from whom, and to do what?&quot;",1415739463
8592114,comment,8590190,8590190,0,0,spdustin,,,"As the parent of an autistic child, I&#x27;m rapidly growing weary of the use of &quot;autistically&quot; to describe socially awkward things. Sure, one might say we should be concerned with the intention and not the word, but clearly the author&#x27;s intention was to be insulting.<p>Well, it is.",1415739455
8592112,comment,8592102,8592102,0,0,tosh,,,"Author here. Trivia: this is actually the essay that is responsible for most of our attributable revenue at Blossom (<a href=""https://www.blossom.io"" rel=""nofollow"">https://www.blossom.io</a>).",1415739448
8592110,comment,8591923,8591923,0,0,fdej,,,"&quot;There is some recent confusion&quot; is such a wonderful euphemism.",1415739444
8592109,comment,8590085,8590720,0,0,iancarroll,,,"It is actually locked to instances above m3.large, so I have to redeploy to xlarge or the like.<p>Can&#x27;t say much about an enterprise environment. The UI is superior IMO.",1415739414
8592108,comment,8591923,8591923,0,0,kstrauser,,,"In the words of Winston Churchill, more or less:<p>Groupon will always do the right thing... but only after everything else fails.",1415739409
8592107,story,,,1,0,gk1,"Iorad: Instant interactive tutorials",https://www.iorad.com/,,1415739403
8592105,comment,8592070,8592070,0,0,jayleno,,,"What is the point of trademarking anything if this (backlash) is the outcome of it?",1415739395
8592104,comment,8591209,8591209,0,0,curious_user,,,"Why should I use this instead of Cloud Foundry?<p>Not trying to bash, just curious.",1415739391
8592102,story,,,2,1,tosh,"What Product Managers Can Learn from Jiro Ono",http://ramen.io/post/102346825774/what-product-managers-can-learn-from-jiro-ono,,1415739372
8592101,comment,8590922,8591778,0,0,notahacker,,,"@dweller     I understood the leverage aspect as requiring the borrower to deposit a margin of fiat currency in order to be entitled to borrow 2.5x that value in BTC, repayable with a >10% APR in BTC, which appears to be confirmed by sdouglas.[1] If it were the other way round and TradeMore were giving borrowers access to additional funds on top of lenders&#x27;, then presumably the owners of those funds would also expect a return...<p>@sdouglas    As I understand it most other BTC borrowing is done at a fixed rather than floating interest rate, in which case I can&#x27;t imagine why anyone would borrow from you except in those rare cases where liquidity dries up and they desperately need to borrow? Or why you&#x27;d want to lend <i>only</i> during low liquidity situations (or to incompetent borrowers) and only to borrowers whose trading position is exposed by that lack of liquidity?<p>[1]As a footnote, if I were running a business with that model I&#x27;d be happiest if the BTC ecosystem crashed, in which case my BTC liabilities and all the defaulting BTC loans might be worth less than the nice juicy chunks of fiat. It would be like holding subprime mortgages if house prices massively and unexpectedly soared!",1415739338
8592100,comment,8589835,8591152,0,0,rational-future,,,"True. Also most islands are younger then life on Earth, so the island could just appear under the first guide.",1415739336
8592099,comment,8591486,8591913,0,0,hglaser,,,"It&#x27;s pretty common to solve these problems with multiple votes per person.<p>E.g. 2 founders + 1 investor is very common for Series A stage startups right now. Those with one founder tend to have two votes for the founder and one vote for the investor.",1415739334
8592098,comment,8591372,8591438,0,0,AznHisoka,,,"lesson learned: don&#x27;t pour your heart into something you don&#x27;t have equity in.",1415739322
8592097,comment,8588572,8590803,0,0,pasbesoin,,,"I would hope they would have some level of quality control written into their contracts, if they are not doing the conversion themselves.  (And, given the multiple bit depths and whatnot, I have to wonder whether they are not doing the conversions.)<p>Worst case, they should ping the owners and request a corrected copy.  Although... such production companies probably die back, technically, after the products (DVD, BluRay, stream, etc.) ship (as a wild guess).<p>P.S.  In another case, I actually managed to communicate the problem directly to the content&#x27;s original author.  Still waiting to see whether that produces a fix (video and audio out of sync, sometimes over a second so).",1415739312
8592096,comment,8591923,8591923,0,0,pkaye,,,"New trademark under consideration... KDE :)",1415739308
8592095,story,,,1,0,Thevet,"Ideal Copies and Messy Print",http://collation.folger.edu/2014/10/ohel-or-dod-ideal-copies-and-messy-print/,,1415739306
8592094,comment,8591923,8591954,0,0,trjordan,,,"It&#x27;s not always about simple existence. I suspect they thought they could get away with doing something that&#x27;s totally different -- but the reaction they saw way that their users wouldn&#x27;t see it that way.<p>They knew it existed, but they didn&#x27;t know how much of a backlash they would be. Hindsight is 20/20.",1415739303
8592093,comment,8589835,8591922,0,0,mragh,,,"If I remember, I was blanking on the exact Python lambda syntax, so I Google&#x27;d &quot;python lambda&quot;. I bet it had something to do with other searches I&#x27;d done in that session as well though, and I don&#x27;t remember what they are.",1415739276
8592092,comment,8590659,8590659,0,0,diverted247,,,"I wrote txtjs. Free to ask away.",1415739266
8592091,comment,8591923,8592076,0,0,aDevilInMe,,,"Yet I do not see Groupon apologising for their behaviour, which was evil.",1415739254
8592090,comment,8590368,8591912,0,0,_random_,,,"Gaining a better understanding of how a bacteria works? They are kind of alive yet much simpler than brain.",1415739236
8592089,comment,8591193,8591193,0,0,ComNik,,,"Is there a distributed, ZFS-like filesystem usable
in clustered production environments today?<p>I&#x27;m intrigued by the idea of Git-like filesystems, but
am not aware of any great clustered filesystems at all.",1415739234
8592087,comment,8591125,8592067,0,0,JoeAltmaier,,,"Never mind pesticides; rinds are great places for bacteria to grow.  Peel all fruits and vegetables.",1415739189
8592086,comment,8590952,8590952,0,0,creichert,,,"Do you currently use any free or open source software you would like to improve?",1415739161
8592085,story,,,2,2,adscherer,"Alpha Collider – Geographically distributed load testing",http://www.alphacollider.com,,1415739151
8592084,comment,8589671,8589671,0,0,brute,,,"typo in Readme.md:<p><i>&quot;Instead of writing $\displaymath \int_i^\infty$, just write d\int_i^\infty$&quot;</i><p>should be d$, right?",1415739145
8592083,comment,8590922,8592057,0,0,sdouglas,,,"Great tip, thank you very much for this.",1415739137
8592082,comment,8590922,8591665,0,0,andrewla,,,"Out of curiosity, what are the cheaper ways to short Bitcoin?  The only ways that I&#x27;m familiar with involve borrowing bitcoins in some way, for example, Bitfinex offers what they call &quot;swaps&quot; to facilitate margin trading.<p>It&#x27;s pretty clear that the reason for borrowing bitcoins is to allow shorting, in which case most of the time margin calls can cover the default risk.<p>To answer your earlier question, &quot;... are there ways to invest your loan such that you could beat that rate?  Consistently? The default rate is going to be sky high&quot;.  I think the answer is that at scale, probably not; most people will lose money while doing heavy margin trading.  But most of the time you won&#x27;t lose the entire thing, you&#x27;ll cash out your position at a loss and pay off the accrued interest.  The only time you lose the entire amount is if you approach margin limits, in which case you&#x27;ll be automatically liquidated by the exchange and the fees will be removed.  The even more rare case is that the exchange is not able to liquidate your position because of an exceptionally large move in the BTC price, in which case the default coverage by the site becomes applicable.<p>This isn&#x27;t to say that TradeMore is a legitimate site that won&#x27;t steal your money, I&#x27;m just addressing the feasibility of the technique.  The fact that they are a UK based company, with officers published on the site, is some comfort, though.",1415739121
8592081,comment,8591944,8591944,0,0,kenjackson,,,"If Spotify can provide the revenue that matches traditional means then I don&#x27;t think Swift is likely to leave.  Make the model more viable than the existing model and you won&#x27;t have people leave it.<p>If people are going to pirate anyways then she&#x27;ll be back, but it seems like she made a pretty smart move to me.  Maybe it won&#x27;t work for everyone, but I don&#x27;t think she was telling everyone to leave Spotify.",1415739107
8592080,comment,8590692,8591963,0,0,pbhjpbhj,,,"This just seems to be a variation of the Sieve of Eratosthenes?",1415739102
8592076,comment,8591923,8591954,0,0,thoughtpalette,,,"Either way Groupon made the right decision here imo",1415739086
8592075,comment,8591923,8591923,0,0,cpach,,,"See <a href=""https://news.ycombinator.com/item?id=8590335"" rel=""nofollow"">https://news.ycombinator.com/item?id=8590335</a>",1415739078
8592074,comment,8590489,8591629,0,0,_random_,,,"Avengers did that :).",1415739053
8592073,comment,8590036,8591749,0,0,sitkack,,,"Assuming you are still using a von Neumann architecture. You are arguing past chongli, not with.",1415739052
8592072,comment,8583722,8584464,0,0,dasmithii,,," > Sure would be fucking nice if they (democrats and republicans) could not have to take opposing sides on fucking everything<p>There is a selection bias in the issues you speak of. Non-polarizing topics are handled swiftly, without much attention from the public spotlight. There is no point in discussing what&#x27;s already agreed upon, and that&#x27;s one of the more reasonable justifications of political polarization.<p>That said, the polarization is greater than would be optimal, so I do agree - it would be nice.",1415739030
8592071,comment,8591072,8591072,0,0,GuiA,,,"This is so critical, and I&#x27;m so happy to see it on HN.<p>When I was a PhD student, I TA&#x27;d an HCI class my advisor taught, where he gave a project a week. The very first project was to design a text interface - the subsequent weeks then ramped up to designing applications for 1024x768 mouse driven computers, then touch screens, then 80&quot; screens viewed from 50 feet away, etc. I think any good UI design class should proceed in this manner.<p>Now that I&#x27;ve left academia, when I need to assess an interactive designer&#x27;s skills, the first thing I do is ask them to design a text interface because all of the core principles exposed in the posted piece are foundations of any good interactive design - regardless of whether it&#x27;s in a terminal, in a GUI, or for a gesture driven application (conversely, UI designers who dismiss textual interfaces as irrelevant to UI design are probably mediocre designers).<p>Most of the fundamentals of interaction design are present in good textual interfaces, and there&#x27;s no fluff to hide behind if you are a mediocre interaction designer. I commonly see UIs with lush graphics, beautiful animations, the perfect quirky copy - and yet it all falls flat because one of the rules listed in the posted book aren&#x27;t respected, but when you try to tell the designers that they just point at all these things as signs of how great their interface is.<p>The truth is that all this crap doesn&#x27;t matter if your interaction model is shitty. Just like a great artist should be able to make beautiful pieces using just a piece of charcoal regardless of their Photoshop skills, a great interaction designer should know how to design effective text interfaces - and if they can&#x27;t, no amount of CSS skills or blog posts on &quot;skeuomorphic vs flat&quot; they&#x27;ve read will matter.",1415739001
8592070,story,,,7,2,emdagon,"There will be no Gnome for Groupon (updated)",https://www.groupon.com/blog/cities/gnome-update?update,,1415738987
8592069,story,,,3,0,dnetesn,"The Astonishing Weaponry of Dung Beetles",http://www.nytimes.com/2014/11/02/magazine/the-astonishing-weaponry-of-dung-beetles.html?ref=science,,1415738985
8592068,comment,8581865,8586983,0,0,Semiapies,,,"I&#x27;m really complaining more generally than about what you said.  I don&#x27;t think you&#x27;re asking anything unreasonable, really.",1415738980
8592067,comment,8591125,8591970,0,0,mschuster91,,,"Former barkeeper here: usually the limes and lemons are bought as-is-available, which usually means mass-produced stuff laced with pesticides. Organic fruits are, due to their higher price, normally only available in hipster places.<p>The rind is not considered edible in any way, and the pesticides don&#x27;t migrate through the rind. Which is, btw, a good reason to rinse any fruit or vegetable (prior to USE, not directly after you get home from shopping!!!) and also wash your hands afterwards so you don&#x27;t ingest the toxins via your skin.",1415738972
8592066,comment,8589709,8589709,0,0,_random_,,,"<i>&quot;If there’s interest in a full featured production quality version, I may implement that.&quot;</i><p>That would be great.",1415738962
8592065,comment,8590036,8591652,0,0,yuhong,,,"Minimum RAM requirements to be more precise. In fact, I think they made the latest versions of Windows take <i>less</i> RAM.",1415738936
8592064,comment,8591209,8591209,0,0,jpdlla,,,"What are the main differences between Deis and Flynn?",1415738910
8592063,comment,8591209,8591956,0,0,bacongobbler,,,"We hear this conversation quite a bit. Kubernetes is not a competitor to Deis. Kubernetes is a container cluster manager; a scheduler, if you will. You give it a container and some desired state and it will schedule it out to a cluster of nodes. Deis utilizes schedulers to deploy apps. We currently support Fleet at the moment but we have attended a few mesos hackathons to get a PoC working with Deis as well as kubernetes. If you have a use case, we&#x27;d be happy to hear it in the mailing list or in a github issue as a proposal :)",1415738908
8592062,comment,8587078,8587399,0,0,Semiapies,,,"I naturally upvoted, but just wanted to add thanks for the links.",1415738903
8592061,comment,8590183,8591858,0,0,demallien,,,"Yup, I got a good look at it on my way to work in Paris.  It was one of those days where there is enough cloud that you can look at the sun without it hurting, but the sun is still visible through the clouds.  I&#x27;ve been looking for sunspots on these occasions for about 10 years now, but thanks to a particularly quiet sun over that period, I haven&#x27;t had any luck.  So imagine my delight to look up and see the sunspot pretty much instantly.  I mean this sucker was <i>big</i>.",1415738854
8592060,comment,8589835,8591417,0,0,rational-future,,,"Only the very stupid are fine with Google recording everything they do.",1415738848
8592059,story,,,2,0,johnwards,"Testing Best Practices at Etsy",https://github.com/etsy/Testing101/blob/master/Testing_Best_Practices.md,,1415738840
8592058,comment,8589674,8591962,0,0,doublerebel,,,"In the past, yes POS card processing relied on a telephone connection to the processor, but this is less and less common.  Regardless POS intranet was always isolated from the internet, for PCI compliance and security.<p>Only these new entrants have become reliant on an internet connection -- but most seem to be marketing the novelty of mobile technology, rather than creating an offline-first db-synced app built on proven internet technologies.",1415738840
8592057,comment,8590922,8591609,0,0,dlss,,,"Makes sense. I&#x27;d expect the bitcoin owning population to have many more ABP users than the general population though.<p>Re: adding a black box.<p>It looks like just not using &quot;mc_embed_signup&quot; and &quot;mc-embedded-subscribe-form&quot; as the form&#x27;s id and class would solve the problem. Elements with those classes and ids are display:none&#x27;d by ABP.<p>(You can verify this yourself by enabling adblock plus, then inspecting the element)",1415738835
