ID,Type,Story,Parent,Points,Comments,Author,Title,URL,Content,Created
8591884,comment,8590922,8590922,0,0,ascorbic,,,"Have you consulted with a lawyer specialising in English financial services regulations? It seems pretty clear that you&#x27;re performing activities that require you to be authorised by the Financial Conduct Authority[1]. Have you spoken to them? The fact you&#x27;re lending and borrowing BTC rather than GBP makes no difference to the requirements. Bitcoin isn&#x27;t magic no-rules money. You&#x27;re risking prison and large fines.<p>[1] <a href=""http://www.fca.org.uk/firms/about-authorisation/do-i-need-to-be-authorised"" rel=""nofollow"">http://www.fca.org.uk/firms/about-authorisation/do-i-need-to...</a>",1415736774
8591883,story,,,1,0,acd,"Ask HN: Construct AI version of Beethoven?",,"Is it possible to construct an artificial intelligence composer AI Beethoven that constructs new music learnt from Beethoven previous works?<p>For example if you view Beethovens notes as tapes in a turing machine, feeds that into some kind of Hidden Markov model to get probabilities of following notes and possibly deep neural network or genetic algorithm blending good compositions? How would such an Artificial intelligence be constructed?",1415736748
8591882,story,,,141,190,p4bl0,"What women in technology really think (150 of them at least)",http://jvns.ca/blog/2014/11/11/the-best-thing-ive-ever-read-about-women-in-technology/,,1415736747
8591881,comment,8591209,8591209,0,0,gabrtv,,,"Project creator here.  It&#x27;s been a fun 16 months getting to this point.  Happy to answer questions.",1415736745
8591880,comment,8590444,8591747,0,0,bch,,,"> Like with most things, popularity is not derived from what you expect<p>I listed what I suspect...<p>> yet popularity exists for good reason.<p>Are you talking about cause or effect ? Does it matter ?<p>> Git may or may not be perfect, depending on your point of view.<p>It&#x27;s not, _nearly_ certainly regardless of ones PoV<p>> However, it&#x27;s more than sufficient to do the job, and it does the job pretty darn well.<p>It&#x27;s used a lot, and mostly works, sure.<p>> The other factor is that it&#x27;s popular because.... it&#x27;s popular.<p>What &quot;other factor&quot; is this? I was talking about what I consider weak points and poor engineering -- I&#x27;m not denying it&#x27;s popular... it&#x27;s practically a verb (people say &quot;git&quot; where &quot;source control management&quot;, or &quot;distributed source control management&quot; is what they mean...)<p>> Yes, it&#x27;s a good idea to take on git because other people use it.<p>Network effect, I get it...<p>> It&#x27;s not a personal tool like your text editor where you can lord over your little realm and customize the crap out of it.<p>Well... not everybody is managing the Linux kernel. Not everybody is even collaborating. I use fossil[0] because I&#x27;d rather enjoy my development process. It _works_ for me. I don&#x27;t <i>care</i> if Linus uses git, or if some high-profile codebase is managed by git.<p>> git is a collaboration tool.<p>And so are fossil and mercurial. And I&#x27;ve run _many_ projects under fossil, including ~20-person distributed (cross-country) projects that include development, configuration, and release management. No git necessary.<p>I not saying git isn&#x27;t popular, or can&#x27;t do its job. I&#x27;m saying: Its a bit hard to understand why git (which I suggest is unnecessarily difficult) is so popular -- I listed my two suspicions.<p>[0] <a href=""http://fossil-scm.org"" rel=""nofollow"">http://fossil-scm.org</a>",1415736742
8591879,story,,,3,0,abdullahdiaa,"Go/NoGo 1 – Rosetta is on track",http://blogs.esa.int/rosetta/2014/11/11/gonogo-1-rosetta-is-on-track/,,1415736728
8591877,comment,8585483,8587213,0,0,AnimalMuppet,,,"That sounds almost like denial to me.  &quot;If everybody doesn&#x27;t adopt what I think they should, it has to be because they&#x27;re dysfunctional!  It <i>can&#x27;t</i> be because the stuff I like is less generally applicable than I think it is!&quot;<p>If people disagree with you, your default assumption should be that they are looking at different evidence than you, not that they are incompetent or stupid.",1415736686
8591876,comment,8590085,8590085,0,0,tsax,,,"Kinda off-topic but I instantly pattern matched the site UI to Heroku. Anyone else feel the same?",1415736666
8591875,comment,8590772,8591801,0,0,bobyley,,,"so tell me about your site",1415736664
8591874,comment,8589709,8589709,0,0,Ono-Sendai,,,"I have something similar in C++, works pretty well.",1415736648
8591873,comment,8589676,8591119,0,0,deutronium,,,"Sure, that sounds cool! (I&#x27;ve got a cheap FPGA dev board that&#x27;s got an ADC/DAC on, that I wouldn&#x27;t mind putting to good use)",1415736646
8591872,comment,8589676,8589676,0,0,Animats,,,"You don&#x27;t get that much analog per chip yet.  See<p><a href=""http://www.anadigm.com/_doc/DS231000-U001.pdf"" rel=""nofollow"">http://www.anadigm.com/_doc/DS231000-U001.pdf</a><p>Basically, it&#x27;s four op amps, plus programmable circuitry for all the accessory stuff needed to build most of the things you can do with four op amps.  This is neat, but four op amps isn&#x27;t much analog computation. Here&#x27;s the block diagram of a classic, very successful analog control system: the F-16&#x27;s original stability control system: <a href=""http://thelexicans.files.wordpress.com/2013/07/yf16fcs.png"" rel=""nofollow"">http://thelexicans.files.wordpress.com/2013/07/yf16fcs.png</a><p>So this isn&#x27;t for analog computation, it&#x27;s for front-ending digital systems where you need to do some filtering at a faster speed than a DSP approach can handle.<p>The Cypress PSoC line seems to be a whole ARM processor with a little analog stuff added.",1415736639
8591871,story,,,3,0,pyeng,"Build a Reddit Bot in Python Part 1",http://pythonforengineers.com/build-a-reddit-bot-part-1/,,1415736639
8591870,comment,8576837,8589267,0,0,simonbyrne,,,"I agree. I&#x27;ve never heard of anyone else utilising this approach, and allowing programs to change the mode of other programs is a recipe for shooting yourself in the foot.<p>One of the most infuriating things about global rounding modes is that they are so slow for things when changing rounding modes would actually be useful. A nice example is Euclidean division: given x,y, find the largest integer q such that y >= q*x (in exact arithmetic). If you change the rounding mode to down, then floor(y/x) would get you q. However the mode change is typically so slow that it is quicker to do something like round((y-fmod(y,x))/x).",1415736639
8591869,comment,8590489,8591776,0,0,sologoub,,,"Striking requires targeting. S-400 is a very impressive piece of tech, but in order to strike something thats 2k miles away, you need to be able to see it. (Unless it has blind fire capabilities where you can target an area/altitude and have the missile search for a target there.)<p>Jamming and other countermeasures would make something like this that is a drone mothership very interesting over large land masses.<p>US has a huge edge anywhere there is water, but deep inland, have a fully mobile and defensible air field that can go anywhere is extremely compelling. Doubly so when you already have established air superiority.",1415736630
8591868,comment,8589747,8590604,0,0,tsax,,,"I bought a couple winter coats from them. BEWARE of the size, as obvious as it sounds, but I can often wear Medium or even Small sized clothes at H&M and Zara, so I picked &#x27;Large&#x27; on Aliexpress and I swear it would be an Extra-Extra-Small here in the US.",1415736621
8591867,story,,,4,0,pdknsk,"M+ by LG introduces WRG, BWR, GBW pixels in addition to RGB",http://lgdnewsroom.com/products-solutions/next-generation-display/4590,,1415736615
8591866,story,,,9,1,programnature,"Aeron: Open-source high-performance messaging [video]",https://www.youtube.com/watch?v=tM4YskS94b0,,1415736590
8591865,comment,8591209,8591779,0,0,lddemi,,,"Awesome experience. It&#x27;s simple to launch in any AWS environment with their CloudFormation template. We&#x27;re using it to replace the way we deploy micro services. It&#x27;s made my life as an ops guy much easier - I truly believe it&#x27;s the future.",1415736563
8591864,comment,8589676,8591766,0,0,deutronium,,,"Heh, that&#x27;s a really cool idea!",1415736558
8591863,comment,8590036,8591228,0,0,mark-r,,,"I think it will happen much sooner than that. Flash doesn&#x27;t have to match the price/GB of hard drives, it just has to match at the minimum viable system level. A lot of people could survive with 120GB, and that number goes up drastically when you hit 240GB. When the price of those SSDs reaches the hard drive floor of about $50, hard drives will become a niche product appealing only to those who actually need multiple terabytes.",1415736540
8591862,comment,8591209,8591779,0,0,cjoelrun,,,"Spent a couple days attempting to deploy using Rackspace tutorial. Wasn&#x27;t able to get it to work. I will be taking another look, hopefully deployments have been worked out.",1415736536
8591861,comment,8590347,8590347,0,0,dang,,,"<a href=""https://news.ycombinator.com/item?id=8556253"" rel=""nofollow"">https://news.ycombinator.com/item?id=8556253</a>",1415736535
8591860,story,,,1,0,treasur,"Encrypted treasure map to actual treasure",http://www.wallpaper.com/art/phillips-auctions-an-encrypted-map-to-a-treasure-trove-of-buried-artworks/8155#108573,,1415736494
8591859,comment,8589747,8591164,0,0,smtddr,,,"I use my debitcard. I trust them. Based on their wiki[1], they look like a huge company(e.g. Amazon) that doesn&#x27;t necessarily have incentive to be randomly ripping people off via CC fraud.<p>That said, word of caution though<p>- Unless you want to pay insane shipping, your order won&#x27;t arrive in the USA for like 4 to 6 weeks.<p>- Clothing sizes are tricky. I usually go one size bigger than my US/UK size. For my wife who wears S or XS, I have to get her medium - sometimes even that&#x27;s too small.<p>- Clothing quality varies especially for lady&#x27;s clothing. Nearly always it looks fantastic, but if you dare put it in the washing machine it will disintegrate. Wash by hand or dryclean.<p>- Order electronics at your own peril. That&#x27;s just rolling dice. I&#x27;ve seen Android phones & tablets from them. When I have a few extra hundred lying around, I&#x27;m gonna try getting a laptop - and I fully expect to get junk. But I&#x27;ve also seen orders fulfilled surprisingly well.<p>- Customer Support doesn&#x27;t usually have english as first language.<p>- So far, out of like 20+ orders. They&#x27;ve gotten maybe 2 completely wrong... or I misread the product-details<i>(some of those pages can be tricky)</i><p>1. <a href=""http://en.wikipedia.org/wiki/Alibaba_Group"" rel=""nofollow"">http://en.wikipedia.org/wiki/Alibaba_Group</a>",1415736479
8591858,comment,8590183,8590183,0,0,lutorm,,,"That sunspot was easily visible to the naked (but properly protected) eye. It was quite remarkable. Alternatively, you could see it by projecting an image of the sun on a paper with a lens. (Works best with long focal length lenses so you don&#x27;t set the paper on fire... ;-)",1415736459
8591857,story,,,7,0,d23,"Security Update from Sauce Labs",http://sauceio.com/index.php/2014/11/security-update-from-sauce-labs,,1415736447
8591856,comment,8591125,8591384,0,0,thesteamboat,,,"Have you considered taking a sports water bottle or nalgene or some reusable bottle?",1415736446
8591855,comment,8591486,8591829,0,0,taylorwc,,,"In the context of sama&#x27;s post, the formal board member will have made a financial investment. That means that s/he has committed either his/her own money, or that of an LP; in a good board member, this creates alignment and engagement--since the board member wants the company to succeed for financial and reputational reasons.",1415736423
8591854,comment,8583738,8590465,0,0,CWuestefeld,,,"<i>Its somewhat like offering the poor special-price moldy bread, deliberately poisoned to make them have to buy your medicine</i><p>No, that&#x27;s a completely unfair characterization. There&#x27;s nothing &quot;poisoned&quot; about the lower level of service being contemplated here, it&#x27;s just a lot less capable.<p>You seem to be putting yourself into the position of deciding for these hypothetical poor customers that if they can&#x27;t have the A+ level of service for top dollars, then they shouldn&#x27;t have anything at all. It&#x27;s all or nothing.<p>If you think that we <i>should</i> limit things in this way, then let&#x27;s be up-front about it. Admit from the beginning that the result will be that we&#x27;re preventing low-cost plans, so the industry will be forbidden from selling plans designed for disadvantaged people.",1415736411
8591853,comment,8591125,8591712,0,0,boyaka,,,"This has been the convincing argument for me when it comes to bottled water. I hesitate to argue this though because I know the scientific numbers, methods for water quality measurement, and general advice from people like the penn and teller episode completely disprove this argument, but here it is anyways:<p>I dislike the idea of drinking water that has been circulating through pipes and filters in the city for decades, including through our toilets and showers and huge amounts of chemical waste. Of course, the methods have completely purified the water, but claims that tap water still isn&#x27;t good are attributed to the sort of last mile dirty pipe system, which is solved by more filtering.<p>I like the idea of nature filtering the water that I drink. That&#x27;s why I like the idea of water springs. I would be less interested in spring water that still just comes from municipal water supplies that similarly recycles the water, and would prefer it coming directly from a spring.",1415736406
8591852,comment,8591193,8591784,0,0,jdoliner,,,"This is a very good point. In addition Docker itself tries to address this by using btrfs&#x27;s diffing. Like a lot of things in Docker it&#x27;s not perfect but it&#x27;s getting there.",1415736382
8591851,comment,8583257,8583731,0,0,craigds,,,"FWIW I&#x27;m using it as my default browser. Maybe it&#x27;s just me, but a developer browser is more than just for debugging websites. I really like the way they&#x27;ve customised certain things to be power-user-friendly (e.g. no patronising &quot;Show Advanced Settings&quot; buttons)<p>I&#x27;ve always used the bleeding edge Aurora and Chrome, have never had substantial problems with that.",1415736381
8591850,comment,8545469,8548853,0,0,kartman,,,"Again just to clarify, if you read Kahneman&#x27;s own words he says he is not an economist but a psychologist.<p>The Nobel &quot;Memorial&quot; prize by the bank of Sweden was awarded to him. Its what he calls himself that I am talking about, not what some Bank in Sweden is calling him.<p>Btw, says something about Economics as a field that it chose to name its top most award in way it will be confused with the true prizes set up by Nobel himself. Not the case, for example, with Math or others.",1415736372
8591849,comment,8589709,8589709,0,0,Bognar,,,"Comparisons with ImmutableList<T> from Microsoft aren&#x27;t necessarily valid, since ImmutableList<T> supports insertion and removal at arbitrary points. The implementation in the article is optimized for adding at the end.",1415736364
8591848,comment,8590922,8591778,0,0,deweller,,,"@notahacker - As I understand it, Trademore offers leveraged loans.  This means you can trade with 2.5 times the amount of the amount of the loan.<p>So, for example, you borrow 10 BTC at, say, 20% APR interest for 6 months.  You have control over 25 BTC to trade with during that time.  At the end of the 6 months, you pay back 11 BTC (10 BTC + 1 BTC interest).<p>With 25 BTC to work with, you have the potential to gain (or lose) substantially more than the 1 BTC you paid for the privilege of using those 25 BTC during that time.<p>This seems like a big risk to take for Trademore, but they must have some risk management algorithms worked out on their side.",1415736364
8591847,comment,8590036,8590390,0,0,sjtrny,,,"I&#x27;m really excited for shared RAM between GPU and CPU. At the moment GPU acceleration is limited by the meagre amount of VRAM on most desktop cards. I would love to be able to do GPU programming with a 32+GB RAM pool.",1415736360
8591846,story,,,1,0,chirau,"Sway, from Microsoft: preview now available",https://sway.com,,1415736346
8591845,comment,8591125,8591537,0,0,yzzxy,,,"Well, perhaps some sunlight will change your habits:<p><a href=""http://www.motherjones.com/politics/2009/09/fiji-spin-bottle"" rel=""nofollow"">http://www.motherjones.com/politics/2009/09/fiji-spin-bottle</a>",1415736329
8591844,comment,8585483,8591360,0,0,dllthomas,,,"Certainly the larger an interface is, the less likely that someone supports all of it by accident.  Of course, that&#x27;s both good and bad - if the accidental support would have been correct then we&#x27;re missing out, but I think most of the time we shouldn&#x27;t count on that.<p>One could possibly force the issue by including an unused function with a deliberately unique name (supports_interface_foo, or maybe a UUID or both) as part of the interface.  Can functions added later fill parts of interfaces?  If so, this approach would make the situation roughly that of Haskell typeclasses.  If not, then this approach makes the situation roughly that of Java interfaces.  In either case, it might be appropriate to some pickier interfaces.",1415736324
8591843,comment,8591193,8591405,0,0,teacup50,,,"One of the highest performing VMs with some of the most advanced JIT and GC technology is a poor choice for greenfield development?<p>In what universe?<p>The issue with OpenJDK arose when open source folks &quot;backported&quot; the unstable Java 7 OpenJDK source drops to create OpenJDK6, which was ostensibly compatible with (but <i>not</i> identical to) Java 6.<p>As of OpenJDK7/OpenJDK8, none of this hackery is required, and we&#x27;re seeing convergence of the implementations.",1415736311
8591842,comment,8590347,8590828,0,0,gaius,,,"No hipsters are something different - they are people who hijack the symbols of other subcultures without contributing anything to those subcultures. The guy with the sailor tattoos was never in the Navy - he works in advertising and drinks lattes. The girl with the thick-rimmed glasses has never rolled a D12 or written a line of assembly - she thinks only about cupcakes and &quot;vintage&quot; dresses. That is why they are looked down on by everyone, their sense of entitlement.",1415736288
8591841,story,,,1,0,crystalmace,"Portable Raspberry Pi retro game machine – with multiplayer",https://www.kickstarter.com/projects/2032055368/the-encade-a-portable-raspberry-pi-gaming-console,,1415736282
8591840,comment,8589747,8590640,0,0,Pxtl,,,"Hah, this prompted me to look online for an Android-based iPod knock-off and was quickly greeted with this awsome deal:<p><a href=""http://www.aliexpress.com/item/in-stock-2014-New-model-Lenovo-S7000-MTK6592-Tablet-PC-octa-Core-5-0-IPS-Android/1982303486.html"" rel=""nofollow"">http://www.aliexpress.com/item/in-stock-2014-New-model-Lenov...</a><p>Then some googling revealed that there is no such device as a &quot;Lenovo S7000 5.0 inch Tablet&quot;.<p>Still aways to go, I think.",1415736279
8591839,story,,,1,0,gvb,"“DarkHotel” uses bogus crypto certificates to snare Wi-Fi-connected execs",http://arstechnica.com/security/2014/11/darkhotel-uses-bogus-crypto-certificates-to-snare-wi-fi-connected-execs/,,1415736277
8591838,comment,8583257,8583622,0,0,drannex,,,"Thank you so much! This was so needed on this horrible internet connection I have here at work!",1415736254
8591837,comment,8590347,8590347,0,0,freyr,,,"The idea that any identifiable subculture could be composed of nonconformists seems obviously false. The subculture as a whole could represent a break from the mainstream, but it could only be identified as a subculture once its members have conformed to a set of common traits.<p>It&#x27;s interesting that the article was written in 2008, at which point hipsters were already ripe for critique, but we&#x27;re still talking about them. There may be more microbrews and less PBR, more thick-rimmed glasses and fewer keffiyehs, more discussion of Kanye West than indie rock -- but it still is distinctly &quot;hipster.&quot; Maybe a subculture based on cooption and ironic detachment is particularly well suited to evolve with changing environmental conditions.<p>Another possible reason for its staying power is that other subcultures have typically made a person look increasingly ridiculous / marginalized / unemployable as they aged (goth, punk, gangster rap, rave), whereas hipster style trends play it relatively safe.",1415736252
8591836,comment,8591125,8591414,0,0,beachstartup,,,"i live in LA, but when i&#x27;m in new york city, i drink tap water when indoors (it&#x27;s always nice and cold and delicious even when it&#x27;s hot out, i don&#x27;t know if this varies building to building) but when i&#x27;m out, i always buy cheap bottled water (poland spring or crystal geyser) because i don&#x27;t want to carry a non-disposable water bottle with me when i&#x27;m out and about.  new yorkers are out most of the time so that would explain it.<p>LA tapwater is nowhere near as good, in fact it&#x27;s downright disgusting in some parts of town, but i drink it anyway when i&#x27;m at home because buying large amounts of bottled water is a pain in the ass (heavy, bulky) and expensive.  sometimes i&#x27;ll buy some perrier or pellegrino if i want a treat.  i&#x27;ve found that if i fill several large mason jars full of water and put them in the fridge, it&#x27;s a good compromise.  a lot of the shittiness just evaporates out.  i&#x27;ll grab one and put it by my bedstand before i go to sleep, for example.<p>at the office we have the standard 5-gallon jug water delivery service which is the best.  i might start getting the service at home, honestly.",1415736251
8591833,comment,8590036,8591600,0,0,13,,,"I do wish the iRam had stuck around longer. The 4GB limit makes it practically useless today, but a modern version of the same would be incredibly useful for some workloads.",1415736238
8591832,comment,8591193,8591470,0,0,doublerebel,,,"Very neat.  Btrfs is a practical choice.  Looks like the Go http server listens for both changes and jobs?<p>Could you tell me about the advantages git semantics add to MapReduce?<p>Last, how does Pfs choose to distribute data across containers?<p>You&#x27;ve inspired me to put up an Unbounce page.  Let&#x27;s talk ZFS soon!",1415736217
8591830,comment,8576791,8576791,0,0,sedeki,,,"I&#x27;m doing the same but for C++ development",1415736206
8591829,comment,8591486,8591710,0,0,foobarqux,,,"What is the incentive of a formal board member and why can&#x27;t it be replicated with an advisor?",1415736202
8591828,comment,8590481,8591711,0,0,dguaraglia,,,"In my little experience with bzr, it was <i>slow as molasses</i>. The only competitive advantage it had against Git at the time was a simpler command line and better windows support (we are talking about the days when git commands were still spelled like git-branch, git-reflog and so on.)<p>Eventually Mercurial ate Bazaar&#x27;s pie and now Git is slowly eroding projects away from Mercurial. All hail Linus, who managed to create two open source systems that became de-facto industry standards.",1415736198
8591827,comment,8591754,8591754,0,0,Bahamut,,,"If I had to guess, it&#x27;s the result of Microsoft&#x27;s gaming presence.  They&#x27;re still the main game in town on the PC (platform-wise) and have a large console presence.",1415736176
8591826,story,,,3,0,kukla,"Our brains are radios (2012)",http://muratbuffalo.blogspot.com/2012/12/our-brains-are-radios.html,,1415736175
8591825,comment,8591125,8591125,0,0,batbomb,,,"There&#x27;s a big difference between bottled sparkling water,  filtered water, and plain old tap water.<p>Also, there&#x27;s differing qualities of tap water as well, because it does depend on your tap and sink itself.<p>If you have a good tap, and you are serving the water without carbonation, sure, there&#x27;s going to be little noticeable difference in general. But try running water directly from an average to low quality tap directly into a soda stream (without any time to even allow chlorine dissipate) and you&#x27;ll find that&#x27;s nowhere near as pleasant as a bottle of perrier.",1415736167
8591824,story,,,82,56,jacquesm,"The Leading Causes of Death from 1900-2010",http://www.businessinsider.com/leading-causes-of-death-from-1900-2010-2012-6?op=1,,1415736149
8591823,comment,8590489,8591753,0,0,trhway,,,"man, now i know what it was! - about 35 years ago, living in USSR near border we had some reception of some foreign TV and this was like nothing else available on USSR TV, these series blew our minds, it was literally &quot;out of this world&quot; :) I&#x27;m actually torn right now between curiosity to watch it now and fear that it will spoil the magic that it built in my mind those decades ago :)",1415736129
