ID,Type,Story,Parent,Points,Comments,Author,Title,URL,Content,Created
74927,comment,74918,74918,0,0,akkartik,,,"Nice. My desktop is a few years old, so subtract one from the C/C++ camp. I use python and ruby equally, though, so it doesn't help break that tie.",1193885914
74926,comment,74605,74856,0,0,dfranke,,,"Screen real estate is like a drug.  Addiction creeps up on you quickly, and the more you have the more you think you need.  I used to be perfectly content with one 17"" monitor.  Now I'm looking for a bigger desk so that I can add a fourth 22"" LCD.",1193885547
74925,story,,,3,0,nickb,"Google Is Courting Facebook Developers In More Ways Than One",http://www.techcrunch.com/2007/10/31/google-is-courting-facebook-developers-in-more-ways-than-one/,,1193885259
74924,comment,74866,74913,0,0,gscott,,,"The Swartz is with him after all.",1193885245
74923,comment,74751,74910,0,0,dfranke,,,"Up to a point, avoiding whitespace <i>does</i> gain you something.   It means you can fit more code on the screen at one time.  In  languages with C-like syntax, I've taken to putting consecutive close-braces on the same line, at the indentation level matching the outermost brace.  It's surprising how much it helps.",1193885086
74922,comment,74900,74900,0,0,utnick,,,"The article seems kind of bitter.<p>Obviously some people find value and fun in facebook applications plus they generate pageviews and ad dollars so everyones happy.<p>My main complaint is that profiles with tens of applications on them take forever to load on my connection and make certain friend's profiles unusable to me.\n",1193884925
74921,story,,,1,0,nickb,"Apple's Leopard is Cool, but Time Machine Makes it Astonishing",http://www.computerworld.com/action/article.do?command=viewArticleBasic&articleId=9044339#,,1193883653
74920,story,,,3,0,nickb,"Best of Leopard Is Yet to Come: Innovative Third-Party Apps ",http://www.wired.com/gadgets/mac/commentary/cultofmac/2007/10/cultofmac_1031,,1193883616
74919,comment,74857,74857,0,0,rokhayakebe,,,"Personally I hate offices. If you are really close to your co-founders, you can rent a house together and turn it into your headquarters.",1193883552
74918,comment,74918,74605,0,0,nostrademons,,,"As of now, the technology count is:<p><pre><code> Languages:\n 4 Ruby\n 4 Python\n 4 C/C++\n 2 Java\n 2 Lisp\n 1 HTML\n 1 Scheme\n 1 Mathematica\n 1 Javascript\n\n Editors:\n 8 Emacs\n 5 Vim\n 1 Visual Studio\n 1 Eclipse\n 1 Netbeans\n\n Browsers:\n 8 Firefox\n 2 Opera\n 1 IE\n\n OS:\n 11 *nix\n 8 MacOS\n 2 Windows\n</code></pre>\nPossibly modulo a couple of miscountings.  If people had multiple programs open (like one person with both Firefox and IE, or my own setup with Windows + Ubuntu VM), both are counted.  I omitted obvious jokes, like the Commodore 64 screenshots or Don Knuth's desktop.  And it only includes editors I could identify, so whatever you Mac folks are using to edit your Ruby isn't included.",1193883542
74917,story,,,3,0,transburgh,"The Significance Of Grey Hair (on a VC)",http://www.centernetworks.com/significance-of-grey-hair,,1193883387
74916,comment,74605,74856,0,0,nostrademons,,,"Some of us value the ability to hack in bed over the extra screen real estate.",1193883298
74915,story,,,8,2,seren6ipity,"An open letter From Mandriva to Steve Ballmer ",http://blog.mandriva.com/2007/10/31/an-open-letter-to-steve-ballmer/,,1193883018
