ID,Type,Story,Parent,Points,Comments,Author,Title,URL,Content,Created
301920,comment,301853,301907,0,0,menloparkbum,,,"It's just a side project, but thanks for the words of encouragement.",1221177562
301919,comment,301913,301913,0,0,qhoxie,,,"No.  I won't attempt to refute claims that Ruby is a temporary hype language (though I don't personally agree), but to suggest that Javascript will be the language to dethrone it is ludicrous.  What he essentially suggests is that Javascript is becoming powerful enough to eliminate the current need for server side languages.  This, simply, is not the case.",1221177333
301918,story,,,5,1,marketer,"BlueScreen - a screen saver for Windows",http://technet.microsoft.com/en-us/sysinternals/bb897558.aspx,,1221177205
301917,comment,301853,301853,0,0,rokhayakebe,,,"If you have same set of features, then beat them on the UI.",1221177195
301916,comment,300960,301248,0,0,skenney26,,,"Pretty amusing experiment. The site doesn't seem to like pg's informal writing style.<p>Very cool website though. I need to use this on my blog posts.",1221177189
301915,comment,301853,301853,0,0,furiouslol,,,"I'm probably going to be the sole wet blanket here.<p>Ask yourself this question. Will your product be substantially different from this competitor's product?<p>If yes, you might want to do something else. Like what you said, this competitor has growing traction. It'll be difficult for you to break the momentum especially if you provide nothing different.<p>If you really want to fight with this competitor well, you must offer something different to the users. Eg. tumblr or posterous is like a super-easy lite version of wordpress. That's why they're gaining traction. There are probably XXX number of blogging systems out there that are similar to blogger/wordpress and they just can't break through. Those that broke through differentiate themselves well from these existing services.<p>dropbox is not like the hundred other online storage site. Their interface is brain-dead simple compared to the competition.<p>Will your product be so? That's the question you have to ask yourself.<p>I'm not saying this to be a spoilsport but to help you prevent wasting your precious development time.",1221177110
301914,comment,298483,299165,0,0,snprbob86,,,"Now that's freshness!",1221177076
301913,story,,,28,45,nreece,"Is JavaScript becoming a Ruby killer?",http://blog.jaoo.dk/2008/09/11/is-javascript-a-ruby-killer/,,1221177062
301912,story,,,2,0,toni,"Army still using physicians in interrogation, bioethicist says",http://live.psu.edu/story/34468,,1221177057
301911,story,,,1,0,nreece,"Online Storage With a Twist",http://hardware.slashdot.org/article.pl?sid=08/09/11/1742223&from=rss,,1221177028
301910,story,,,1,0,marketer,"The all-american history of shopping carts",http://www.designboom.com/history/cart.html,,1221176922
301909,story,,,6,3,nreece,"Run Windows Apps 100% Seamlessly on Ubuntu",http://hehe2.net/thedarkside/microsoft/run-windows-apps-100-seamlessly-on-ubuntu/,,1221176808
301908,story,,,5,0,marketer,"How the star wars lightsaber sound was made",http://www.filmsound.org/starwars/burtt-interview.htm#Lightsabers,,1221176763
301907,comment,301853,301883,0,0,furiouslol,,,"Seriously? Yet another photo-sharing site?<p>Unless it's a game changer like fotonauts, you might want to change your game plan.",1221176627
301906,comment,301356,301356,0,0,nreece,,,"The actual title of the article is ""Finding cracks in Facebook"", not ""Cracks in Facebook"". Two totally different ideas, from a readers perspective.",1221176571
301905,comment,301605,301828,0,0,immad,,,"They seem to be referring to Linux :)",1221176377
301904,story,,,1,0,bootload,"Design, user experience and development at Canonical",http://www.markshuttleworth.com/archives/162,,1221176369
301903,comment,301605,301646,0,0,vlad,,,"And rejected from YC the first time, if I remember correctly.",1221176321
301902,comment,299687,299838,0,0,ibsulon,,,"I will definitely check out both. Thanks!",1221176267
301901,story,,,1,1,AlexTheFounder,"MentalFaces.com - my for-fun project",,"As a side project of my side project I've released http://mentalfaces.com. Not to offend  DropBox and others BIG boys. I was just a bit tired with my main work and used this technique of relaxing by doing a completely different thing. Enjoy. Or reject.",1221176260
301900,comment,301853,301853,0,0,wheels,,,"There will always be competition.  There are probably half a dozen other companies doing similar things that you just don't know about yet.  Most of the  really successful companies that I can think of weren't the first ones on the market.<p>Like others have said, learn from them.  Figure out some need that they're not addressing and sure up that niche and try to grow from there.  That may actually lead you to a point where you're not going head-on against them, and even if it doesn't it'll give you some runway before you're really going one-on-one.",1221176217
301899,story,,,12,10,bootload,"F# to join VB & C# in Microsoft language stable",http://www.eweek.com/c/a/Application-Development/F-to-Join-VB-and-C-in-Microsoft-Language-Stable/,,1221175991
301898,story,,,3,1,bootload,"Debunking Google's log anonymisation propaganda",http://news.cnet.com/8301-13739_3-10038963-46.html,,1221175924
301897,comment,301853,301879,0,0,nside,,,"Couldn't say better.\nAnd as soon as they will feel your competition they might buy you. That's probably the quickest way to exit?",1221175914
301896,story,,,2,0,bootload,"Nontechies, This One’s for You",http://www.nytimes.com/2008/09/11/technology/personaltech/11pogue.html?_r=1&partner=rssnyt&emc=rss&oref=slogin,,1221175865
301895,comment,301605,301884,0,0,aston,,,"We definitely do use encryption for both data transfer and storage. I didn't mean to imply that those things happen in the clear.<p>And yeah, hopefully we can find a way to help users along the path of managing their own keys.",1221175813
301894,story,,,4,1,snydeq,"VMware Workstation vs. Sun xVM VirtualBox",http://www.infoworld.com/article/08/09/11/37TC-virtual-workstations_1.html,,1221175798
301893,comment,300920,301753,0,0,cstejerean,,,"The words are throwing me off. Not because I can't type them fast enough, but because I can't read them as fast as I type so I need to slow down and pay attention to the letters.",1221175791
301892,comment,297593,298598,0,0,aswanson,,,"Wrong.  Just asking if he was sure.",1221175738
301891,comment,300920,300920,0,0,michaelneale,,,"I actually don't know anyone that doesn't touch type that is under the age of 35 (but perhaps I need to pay more attention). Anyone that went and did an engineering level degree surely would be able to (due to thesis writing at least).<p>Even when I was in high school (back pre 1992) we learned by having a tea-towel over our hands and having to type without looking.",1221175686
301890,comment,301605,301831,0,0,tdavis,,,"Don't blame this on poor, sweet Livingston you knave!",1221175680
301889,comment,301853,301877,0,0,auston,,,"Would you mind highlighting what features you liked from harvest that were unavailable in different apps?",1221175660
301888,comment,300920,301366,0,0,cstejerean,,,"If all you're doing all day is writing wrapper functions you need a better language or a better job.",1221175591
301887,comment,301605,301778,0,0,tlrobinson,,,"Every time you make any change to the image it needs to sync the whole thing, right? Seems wasteful to me, there must be a better solution.",1221175489
301886,comment,301838,301838,0,0,brk,,,"Wait, this guy is actually advocating replacing the googlebot with an army of humans, just to make sure some people don't over-react to an old news story?",1221175467
301885,comment,301495,301722,0,0,mattmaroon,,,"I'm not sure. I think it just means that the recording industries (like all major corporations) will always be behind the times on new ways of doing business by some years.<p>It took Apple to pull them into digital music sales, long after they should have been doing it. It took YouTube to pull them into making Hulu.<p>At some point it will be obvious that new ways of making money have completely eclipsed the old, or that the old just can't be kept alive by lawsuits anymore. But they'll fight the changeover for as long as they can, rather than making large investments in it and waiting a few years for those bets to pay off.",1221175417
301884,comment,301605,301723,0,0,tlrobinson,,,"I see a couple ways you could introduce encryption securely.<p>1. At the very least, encrypt data being transfered using SSL, to prevent sniffing on WiFi and other public networks. Public key cryptography (like SSL) certainly can be secure, and does or doesn't require ""cooperation"" depending on your definition.<p>2. Your client could somehow integrate with something like TrueCrypt, but leave it up to the user to manage their keys.",1221175408
301883,comment,301853,301853,0,0,menloparkbum,,,"Go for it. One of the projects I am working on is Yet Another Photo-sharing Site. Here in SF the first thing people ask is ""Why? Why not just use Flickr?""<p>But when I leave SF, I tell people ""I am making a photo sharing site, kind of like Flickr, but how I want it."" The response I get is ""Sounds Cool - what is Flickr?""<p>Sites like Fotolog and Photo.net and Photobucket eventually sold for way more than Flickr.<p>The point I'm trying to make is that if the market is big enough, there will be people who want to use your product, even if there is an entrenched competitor. In fact, your competitor may not be as entrenched as you think.",1221175220
301882,comment,301812,301812,0,0,fallentimes,,,"Actually reading this on Yahoo made it so much more enjoyable.",1221175192
301881,comment,300485,301758,0,0,silentbicycle,,,"For leeks, you mean. :)<p>The biggest thing I learned from Forth is that if I'm about to add a comment inside a function because something needs clarification, I should probably try breaking it out and thinking up a descriptive name instead.",1221175161
301879,comment,301853,301853,0,0,fallentimes,,,"Two things:<p>1. Respond to all user emails within 24 hours or less - even if it's just to say ""thanks"" or ""this should be released next month"". Not only will you know exactly what your users want; they'll tell your friends how quickly you responded. And of course, don't ever ever use form responses/letters.<p>2. Keep your burn rate super low. If you do that you're a cockroach - no one can kill you.",1221175116
301878,comment,300802,301362,0,0,fallentimes,,,1.2,1221174945
301877,comment,301853,301862,0,0,mechanical_fish,,,"I had the very same experience recently. I tried a couple of different web and desktop apps for time tracking before settling on Harvest, which I like. Harvest isn't <i>obviously</i> better than the others, but there are subtle ways in which it works that fit <i>me</i> well.<p>Web apps are easy for users to try out for a while. So build a couple of differentiating features and see if a subset of the (apparently lucrative!) market tries your site and sticks with it.",1221174909
301876,comment,301801,301801,0,0,amjith,,,"Please try to avoid these ""interesting factoids"" genre in HN.",1221174889
301875,comment,301858,301858,0,0,mingyeow,,,"My own personal experience. ;)",1221174832
301874,comment,301797,301797,0,0,langer,,,"Was this really worth writing a blog post about?",1221174791
301873,comment,301605,301605,0,0,ryanspahn,,,"Congrats and dugg!<p>Is a domain name change in the future?  Drop the word get?",1221174578
301872,story,,,3,0,arjunb,"The Browser as an OS",http://www.ccheever.com/blog/?p=3,,1221174543
301871,comment,301595,301766,0,0,run4yourlives,,,"I give you the alternative: Linux package dependency nightmare.",1221174540
301870,story,,,27,30,robg,"Do you remember this photograph?: The Falling Man",http://www.esquire.com/features/ESQ0903-SEP_FALLINGMAN,,1221174537
301869,comment,301842,301842,0,0,mechanical_fish,,,"I created a complex paper-based system once. Then I got bored with the tedium of retyping big strings of characters off a sheet of paper and started just using 1Password for everything.<p>You can use 1Password to create passwords that aren't associated with websites and stuff them into the equivalent of encrypted notes. When I need one I just pull up 1Password using Quicksilver and do a cut-n-paste. It's a little bit tedious, but not as tedious as paper -- and, as you say, I don't do it that often. I use ssh-keychain for most of my logins.<p>If you're freaked out about the probability that 1Password will somehow leak your bank password... don't put your bank \npassword into it. Use paper for that. I avoid allowing my laptop's copy of 1Password to know any password that could be used to harm my finances.<p>If you have a need to log in to registration-required sites on other machines... carry a piece of paper with the passwords you need. 1Password will print things out for you (also good for emergency backup -- stuff a paper log of your passwords in a safe deposit box).<p>1Password also has an iPhone app. I avoid using it because my need for portable, secure passwords is low compared to my fear of losing the phone and having to change all my passwords.<p>Really, you shouldn't type secure passwords into random other machines, anyway, since any of them could be compromised. Keysniffers. Rootkits. If you often log into security-sensitive accounts from strangers' machines... perhaps you should consider getting a laptop, an iPhone, a Nokia, or an EEE?<p>95% of my passwords are of scant interest to anybody, such that the (tiny) risk of allowing a piece of software to remember them for me is nil. I advise getting the software, and letting it go to work on the 95%. If you don't want to trust it with the remaining 5%, don't trust it.",1221174521
301868,comment,301853,301863,0,0,iamdave,,,"Right.  The good thing about markets is that there are always options.  There isn't one brand of dish detergent, one brand of cookware or one brand of bacon.  ""Go big or Go Home"" is a bad mentality to get into because you're going to find yourself worried more about what other people are doing, worried about failure, instead of worrying about what you should be doing.",1221174511
301867,story,,,1,0,parenthesis,"Shanghai surprise",http://www.telegraph.co.uk/money/main.jhtml?xml=/money/2008/09/12/ccjeff112.xml,,1221174502
301866,story,,,1,0,ComputerGuru,"Windows Isn't For Gamers Anymore?",http://neosmart.net/blog/2008/windows-isnt-for-gamers-anymore/,,1221174484
301865,comment,301853,301853,0,0,oldgregg,,,"Large markets almost always have room for a #2. However, unless you can make substantive improvements over their product or target a different niche that they are missing, you could be in for a hard slog.",1221174417
301864,comment,301595,301762,0,0,run4yourlives,,,"Heh, didn't another company get sued for that kind of crap?",1221174395
301863,comment,301853,301853,0,0,olefoo,,,"If the market supports a number of competitors that are doing  OK, and you are fine with working in that market, then go for it.<p>If you were wanting to be a category-killer then it doesn't sound like your market is suitable for that. So if you're playing ""Go Big or Go Home.""; you should find another market.",1221174299
301862,comment,301853,301853,0,0,matthewking,,,"I've been reviewing web apps recently for accounting within my startup, there's a lot of offerings and most of them cover all the same functionality.<p>But even though they all do the same thing, its the <i>way</i> that they've implemented the functions that makes each app different, and has ultimately influenced my decision.<p>At this point, I have no idea what one came along first, that doesn't matter to my decision, and I didn't just pick the first one I found, I reviewed 5-6 before making a choice.<p>Another point is, that after your initial release hopefully you'll get a user base who will provide you with feedback and ideas, its up to you how you act on that feedback. You may react to your users differently than your competitors, and ultimately that too will distinguish you from them further.<p>Good luck!",1221174284
301861,comment,301853,301853,0,0,run4yourlives,,,"Of course it's normal. Ask everyone from Pepsi to Burger King. :-)<p>That being said, from the sounds of it, the competitor seems to be very visible in the market. Given that, can you see that there is something that they're not doing? Is there are group of users that are under-served? Do you figure one might surface? It looks like they've got you beat feature wise, but can you go the other way even further? (Super simple?) These are areas that you can explore.<p>At any rate, keep going. You idea has been validated. It's a big world out there, odds are in the next two months you'll understand that there will be room for you, them, and probably a few others.<p>Good luck.",1221174280
301860,comment,301853,301853,0,0,zacharye,,,"Definitely don't ignore them. Learn from them. Do all you can to see what works for them and what doesn't. Pay close attention to what users (and blogs) are saying about the product. What do they like? What do they dislike? What features are they asking for? This competitor will give you they best market research money can buy - for free.",1221174230
301859,comment,301657,301772,0,0,staunch,,,"There are sites that do auto-refreshing with other ad networks. AdSense may forbid it, but they're not the only network. I'm certainly not suggesting it as a sneaky thing to do. Some webapps are opened for hours at a time (as the OP stated). Acting as if that multi-hour page view is equivalent to a regular page view and showing only a single ad is ridiculous.",1221174097
301858,story,,,1,1,mingyeow,"5 reasons why focus is the toughest thing to do for any startup",http://v3.mingyeow.com/?p=94,,1221174071
301857,comment,301340,301340,0,0,michaelneale,,,"I don't pity Dilbert - he whines constantly yet makes no effort improve things. He is very cynical, and has no interest in improving his lot of those around him, so he gets what he deserves.<p>I wonder if that is part of Scott Adams intent - people pity him, yet he is not really worthy of pity (which most people wouldn't realise).",1221174054
301856,comment,301340,301536,0,0,alexfarran,,,"That's pretty much what happened <a href=""http://www.dilbert.com/strips/comic/2008-07-12/"" rel=""nofollow"">http://www.dilbert.com/strips/comic/2008-07-12/</a><p>He's not ruthless and uncaring enough to be a leader.  A well aimed rock from Dogbert knocked out his moral compass allowing him to ascend effortlessly to high level management.",1221174046
