ID,Type,Story,Parent,Points,Comments,Author,Title,URL,Content,Created
1230729,comment,1230456,1230456,0,0,sidsavara,,,"I like using Toodledo:<p><a href=""http://toodledo.com"" rel=""nofollow"">http://toodledo.com</a><p>I like it because it's free, and I can even sync it with my iphone free - just have to pay $1.99 for the app<p>Nice clean interface, has a nice Google Chrome extensions, and for me it is intuitively how I order things - by date and importance.  I just use ""Project -> Task"" to signify next actions within projects",1270001216
1230728,story,,,2,0,abennett,"Tech Secrets: 21 Things 'They' Don't Want You to Know",http://www.itworld.com/internet/102796/tech-secrets-21-things-they-don-t-want-you-know,,1270001177
1230727,comment,1230315,1230712,0,0,phintjens,,,"You're looking at OpenAMQ, not SFL.<p>This is the metaprogramming we used to build OpenAMQ.  It was very successful in technology terms (1M lines of real code generated from 20k lines of metacode) but a failure in social tems (too high a barrier to community participation).",1270001077
1230726,story,,,17,16,cwan,"New Amazon patent: sending video of orders being boxed",http://www.techflash.com/seattle/2010/03/amazon_patents_new_customer_service_video_of_orders_being_boxed.html,,1270000957
1230725,comment,1230451,1230679,0,0,photomatt,,,"We're showing 10-30 to different visitors and seeing how that affects pricing, like a behavioral economics experiment.",1270000953
1230724,comment,1229068,1229068,0,0,lunchbox,,,"I would add Scrapy (<a href=""http://scrapy.org/"" rel=""nofollow"">http://scrapy.org/</a>) for web crawling.",1270000919
1230723,comment,1230315,1230398,0,0,phintjens,,,"No misunderstandings...  When the AMQP working group was founded, RHAT took a very assertive role over AMQP and created versions that no-one else implemented, and which were pushed through the working group by sheer political force.  Read the abomination that is the AMQP/0.9 spec, if you have the courage.  The determination of RHAT to create incompatible forks of the spec is a large part of what killed AMQP in our eyes.  We spent several years trying to save AMQP from that.  We failed.  We're a small team, RHAT had 20 people working on this.",1270000903
1230722,comment,1230451,1230626,0,0,photomatt,,,Fixed!,1270000845
1230721,comment,1230525,1230680,0,0,stanleydrew,,,"Yes, I would doubt that this was his idea, but I'm wondering whether this is what he's working on mainly.",1270000843
1230720,comment,1229309,1230141,0,0,dalke,,,"""according to the python diagram, there is absolutely no difference except for the parameter definition between what is allowed in a normal function definition and a lambda expression""<p>They both point to the parameter definition, but lambda sits under ""test"" and refers back to ""test"" while the normal function definition sits under ""compound_stmt"" and also points to ""suite.""<p>Those are rather big differences, and reflect rather well that while perhaps semantically they are similar, syntactically speaking they are very different.",1270000838
