ID,Type,Story,Parent,Points,Comments,Author,Title,URL,Content,Created
1230801,story,,,1,1,Flemlord,"Extortion-Like Mass BitTorrent Lawsuits For The US: 50,000 To Be Filed",http://www.techdirt.com/articles/20100330/1132478790.shtml,,1270004398
1230800,comment,1230666,1230666,0,0,codeslinger,,,"Just as I mentioned in today's thread on FathomDB, I'd be interested in what kind of workload scales linearly to 50 cores. I'm guessing its not very join heavy. H-Store's main advance, IIRC, was that it pushed many points of RDBMS engine operation into RAM. While this would indeed make the engine much faster and eliminate some historical cruft, I don't remember any fundamental breakthrough that would make distributed joins scale out very well. Anyone have any insights on how they are handling joins?",1270004386
1230799,comment,1230709,1230786,0,0,jswinghammer,,,"I guess if you cook the books you can make them say anything. It's hard to take anything Bernanke says seriously. He didn't see this crisis coming and he was never right about anything before. Why would we think he's suddenly right about something?",1270004281
1230798,comment,1230709,1230775,0,0,schwit1,,,"End of the recession? Tell that to the 16% still unable to find work.",1270004255
1230796,comment,1230648,1230732,0,0,teej,,,"(HAProxy + Mongrel) and (Apache/Nginx + Passenger) work great.  Don't get me wrong, I've seen lots of different Rails server architectures and I've spoken at RailsConf on this very topic.  I would recommend either setup to a Rails startup in an instant.<p>But in the edge case of immense load, they simply don't keep up to Unicorn.<p>The thing that sets Unicorn apart is that it does it's load balancing on the Kernel level.  All Unicorn worker processes are listening on the same socket.  The OS takes care of getting each request to a single, available worker.  So unlike Mongrel, you don't end up with per-worker queues. Though HAProxy is smart about distributing load well, Unicorn makes it seamless.  The workers simply ask for a new request and the Kernel gives it one.<p>There are some other niceties too.  Unicorn processes are forked from a master process.  If you are using REE, they can keep Rails in a shared memory.  When we deployed it, we dropped memory usage by 30%.<p>On top of all that, Unicorn's flawless rolling restarts are a pretty big plus.<p>In conclusion, if you're in the top 10% of Rails apps by traffic, give Unicorn a look.  It is likely that switching over is worth the dev risk and cost.  Otherwise, keep it on your radar, but don't consider it a must-have.<p>[reference]<p><a href=""http://unicorn.bogomips.org/DESIGN.html"" rel=""nofollow"">http://unicorn.bogomips.org/DESIGN.html</a><p><a href=""http://news.ycombinator.com/item?id=872283"" rel=""nofollow"">http://news.ycombinator.com/item?id=872283</a>",1270004184
1230795,comment,1230251,1230426,0,0,jbooth,,,"Whatever, it was obvious what you meant -- if someone has the choice of either figuring what you mean and addressing your question, or changing the subject with defensive pedantry, and chooses the latter, it may say something about their argument.",1270004147
1230794,comment,1228778,1228778,0,0,gbc,,,"Canberra. Rails. Hi.",1270004129
1230793,comment,1230648,1230648,0,0,xal,,,"Seriously? Apache? There is another low hanging fruit guys :-). Tremendous speedups can be had by moving to nginx from apache (something we did at shopify about 2 years ago )",1270004055
1230792,comment,1230251,1230528,0,0,codeslinger,,,"I'm quite interested in how you're handling joins in a manner that is scalable. What tradeoffs did you have to make? Do you support full join semantics, or are some types of joins not supported? Its not that much of a stretch to scale out an RDBMS not using any joins, but I can't bring myself to really take your claims seriously until you elaborate on how you handle joins (if at all).",1270004010
1230791,comment,1230726,1230726,0,0,maxtilford,,,"I bought a nice hat from <a href=""http://www.kleinbottle.com/"" rel=""nofollow"">http://www.kleinbottle.com/</a> and he sent me pictures of it being packaged up, so this sort of thing has been done before. I've no idea about patentability though.",1270003989
1230790,story,,,1,0,cwan,"A College Education: ""The most overpriced product you could possibly buy""?",http://www.boston.com/news/education/higher/articles/2010/03/28/fifty_thousand_dollars/,,1270003928
1230789,comment,1229390,1229827,0,0,NateLawson,,,"Simple -- with OtherOS running, the only code executing on the platform other than Linux itself is the hypervisor. So if removing OtherOS addresses a security concern, the only thing that could have been threatened is the hypervisor. There is only one known hypervisor exploit, and it is implemented from OtherOS.<p>QED",1270003909
1230788,comment,1230648,1230648,0,0,generalk,,,"Is there some technical reason I'm missing for why they wouldn't go the Passenger route? Seems to be by-far the easiest way to deploy a Rack-capable web app, and it (correct me if I'm wrong) allows for ""hot deploy"": update the code on the server and it'll sit there unused until you touch ""tmp/restart.txt"" under your app root.",1270003835
1230787,comment,1230709,1230709,0,0,niravs,,,"It's amazing how much CNN is obsessed with Twitter!",1270003783
1230786,comment,1230709,1230779,0,0,rooshdi,,,"Yes, technically it has been over for quite some time:<p><a href=""http://www.marketwatch.com/story/bernanke-declares-the-recession-over-2009-09-15"" rel=""nofollow"">http://www.marketwatch.com/story/bernanke-declares-the-reces...</a>",1270003696
1230785,story,,,8,0,MikeCapone,"Cycling in Copenhagen",http://en.wikipedia.org/wiki/Cycling_in_Copenhagen,,1270003616
1230784,comment,1230709,1230709,0,0,jswinghammer,,,"If you watch ""The Daily Show"" it gives you all the reason in the world to not watch CNN. There is pretty much stupidity on there at all hours. We turned on something on CNN this morning and my wife groaned at some stupid pun and my two year old daughter walked up to her and tried to comfort saying ""OK? OK?""<p>It was one for a minute accidentally and we encountered serious stupidity. That's somewhat impressive.",1270003592
1230783,comment,1230648,1230648,0,0,ssp,,,"Shopping is even more efficient if you distribute all your items across all the cashiers. That way, the time from you are first in line until you are done, is <i>n</i> / <i>num_cashiers</i> instead of <i>n</i>.<p>Someone, please try this the next time you go shopping, and then blog about what happened.",1270003571
1230782,comment,1230709,1230770,0,0,btipling,,,"Yeah Keith Olbermann and Rachel Maddow are right wing. O_o",1270003546
1230781,comment,1230648,1230648,0,0,albahk,,,"Amusing quote taken out of context:\n""..called Stormcloud, to kill Unicorns when they ran out of control.""<p>Tomorrow's headlines: ""Twitter is killing Unicorns""",1270003512
1230780,comment,1230144,1230515,0,0,varikin,,,"There are a bunch of other active user groups in the Cities too. Python, Cocoa, mobile dev, groovy and many others.",1270003449
1230779,comment,1230709,1230775,0,0,jaekwon,,,"the end?",1270003395
1230778,story,,,3,0,raffi,"Confidence and Entrepreneurship",http://blog.feedbackarmy.com/business-musings/confidence-and-entrepreneurship/,,1270003363
1230777,comment,1228778,1228778,0,0,dreamtime,,,melbourne,1270003362
1230776,story,,,1,0,t3rcio,"Cooking with processors",http://www.instructables.com/id/Hot-Plate/,,1270003337
1230775,comment,1230709,1230709,0,0,rooshdi,,,"Something tells me the end of the recession had an effect on this ratings decline.",1270003297
1230774,comment,1229309,1229309,0,0,xtho,,,"With respect to the language: having strings as the only data structure (everything is a string) and the developers stance on OOP (we don't need that) didn't help either and made way for python & ruby. With respect to the WWW, there was ACS/OpenACS, which even the author doesn't mention.",1270003280
1230772,story,,,1,0,cwan,"The Problem with Amazon's ""Convenient Packaging""",http://www.crunchgear.com/2010/03/30/amazons-convenient-packaging-hates-hard-drives/,,1270003247
1230771,story,,,16,3,Titanous,"Heroku (YC W08) launches SSL Hostname Add-on Public Beta",http://blog.heroku.com/archives/2010/3/31/ssl_hostname_add_on_public_beta/,,1270003210
1230770,comment,1230709,1230753,0,0,gnosis,,,"<i>""Leftwing wants MSNBC""</i><p>Are you kidding?  MSNBC is even more right wing than CNN.  PBS is about it, as far as mainstream TV news goes.  And even they are pretty much in the center, rather than on the left.<p>For some good left-wing media try Democracy Now!, Free Speech Radio News, and FAIR's Counterspin.  Some college radio stations, WBAI in NYC, and Pacifica Radio afilliates are also good.<p>My problem with CNN and MSNBC is that both of them tried to follow Fox to the right once Fox became popular.  A losing strategy if they were after Fox's right-wing audience, since they were clearly not as committed as Fox was to being further to the right than any other station on TV.  They should have moved left instead, and provided a real alternative.",1270003175
1230769,comment,1229646,1230466,0,0,JMiao,,,"You hit it. Best comment I've read in a while.",1270003119
1230768,story,,,54,20,Titanous,"URLs Are The Uniform Way to Locate Resources",http://adam.blog.heroku.com/past/2010/3/30/urls_are_the_uniform_way_to_locate_resources/,,1270003056
1230767,comment,1230315,1230395,0,0,franksalim,,,"I think that is due to OpenAMQ and not AMQP the protocol. sudo apt-get install rabbitmq-server will get you a working AMQP server on Debian or Ubuntu in one step. Building from source is fairly easy, as well: <a href=""http://www.rabbitmq.com/build-server.html"" rel=""nofollow"">http://www.rabbitmq.com/build-server.html</a>",1270003021
1230766,comment,1229401,1229667,0,0,Jasber,,,"Wordoid is great. Another favorite of mine is: <a href=""http://www.nxdom.com/"" rel=""nofollow"">http://www.nxdom.com/</a><p>Shameless plug: I threw up <a href=""http://domaingroovy.com/"" rel=""nofollow"">http://domaingroovy.com/</a> to keep track of sites like these. Maybe someone else will find it useful.",1270003009
1230765,comment,1227698,1229406,0,0,seertaak,,,"> Non-sequitur.<p>Eh? I'm positing why you might think a system which has worked for centuries should suddenly be obsolete. <i>You're</i> the one who made the claim, so why don't you enlighten me?<p>> Prove it instead of saying it is.<p>Stop being so lazy and google 'dynamic system equilibrium'.<p>> Is copying stealing?<p>No. Did I say it was? No.<p>> Is depriving someone of potential  profits stealing?<p>No, but that doesn't make it ok.<p>> Unethical on what ground?<p>Unethical because:<p>a) the artist hasn't consented to it;\nb) you are enjoying the fruits of the artist's labour without compensating him/her;\nc) you contribute to his/her economic deprivation.<p>Of course, since you 'don't even care if artists starve to death on the street' as a direct result of your illegal activities, a discussion of ethics is pointless: you clearly have none.<p>The fact that you have not physically removed the original is irrelevant. If I plagiarize someone's work, the original is still there. Does that mean plagiarism is an ethical activity?<p>> I am not depriving anyone of anything, except their potential profits.<p>Except that 'potential profits' are, in many cases, the only means to livelihood for content creators (in anticipation of the 'go tour' defense: consider Steely Dan, a studio-only band). So the 'anything', is, in fact, <i>everything</i>.<p>> Yes, we must imagine that copyright are really property rights<p>As I mentioned before, 'real' property rights are just as artificial as intellectual property rights. All 'rights' are inventions of man. Do you deny this? Or do you and your 'die-hard anarcho-capitalist' nutter pals at mises.org believe <i>your</i> particular selection of fundamental rights were handed down on a tablet by Moses?<p>> We must also imagine that copyright laws and patents laws are not really a form of economic intervention with abritary rules.<p>Any law of any sort is an 'intervention', insofar as it alters the natural, hobbesian state of affairs. But to claim that copyright law is arbitrary is just silly. Copyright law has developed slowly over centuries, adapting to new technologies in a coherent fashion. It is, moreover, absolutely predictable in its application, and serves a very real economic purpose, namely to bring artistic and scientific output under the umbrella of capitalism -- allowing said activity to be monetized and exchanged for other goods and services. One would have thought that a 'die-hard .. capitalist' would have found this rather useful and elegant.<p>> Do you want my friends over at the mises.org forum and the #mises channel at freenode to come over to show you how many hard-core libertarians despise these kind of laws?<p>If it leads to an improvement in your spelling, grammar, and logic, then why not? And yes, I'd certainly be interested in reading anti-IP articles by libertarians. Seriously.<p>> You know, maybe I really do think copyright and patent are not property right.<p>Now it's <i>my</i> turn not to 'even care' -- I really don't care what you, or any of your nutter pals, think are the 'true' property rights. Your philosophical deliberations on IRC are of no importance to me.  What matters is that if you are filesharing, you are breaking the law. And we, the community of musicians and other content creators, are going to ensure you're punished for that. If you think we're wrong about that, then you're free to lobby your politicians. But I rather suspect you're going to have to do better than your lame-ass 'copying is not stealing' and 'copyright law is arbitrary intervention' arguments.",1270002996
1230764,comment,1229084,1229084,0,0,bradleyjoyce,,,"I had this idea a while back and wanted to create just that... so I bought <a href=""http://ifundedthat.com"" rel=""nofollow"">http://ifundedthat.com</a><p>I'll sell it to whomever feels like taking a stab at it :-)",1270002953
1230763,comment,1230709,1230709,0,0,carbocation,,,"My problem with CNN is that it provides nothing of substance. I don't need the off-the-cuff opinions of their ""journalists"" during news events. That's armchair stuff.<p>As a consumer of news, I want/need someone to break a story that took days, weeks, or months to construct. I can voice my own post-debate opinions - I don't need theirs. I can find feel-good/feel-bad stories in my own neighborhood - I don't need theirs. I don't need Anderson Cooper to give lip service to ""keeping them honest."" I need journalism from which I learn something.",1270002917
1230762,comment,1230726,1230735,0,0,kjbekkelund,,,"It is a business method patent. From Wikipedia: A business method may be defined as ""a method of operating any aspect of an economic enterprise"". It is mainly in the US, Australia, Japan and Singapore that business methods are usual. In Europe this is not regarded as being inventions, and are therefore not patentable.<p>More info on <a href=""http://en.wikipedia.org/wiki/Business_method_patent"" rel=""nofollow"">http://en.wikipedia.org/wiki/Business_method_patent</a><p>Oh, and _of course_, there is a lot of discussion going on about these kind of patents.",1270002883
1230761,comment,1229089,1229477,0,0,jbooth,,,"Oh, wah, wah.<p>Are you seriously arguing the side of a bunch of middle-men who provided no value, saying it's too bad that their industry is going to disappear?<p>Wow.  And I bet you spend the other 364 days of the year talking about how the private sector is so superior through survival of the strongest and all that.",1270002716
1230760,comment,1230161,1230161,0,0,pjonesdotca,,,"Who's this speaker?",1270002700
1230759,comment,1228316,1230238,0,0,fara,,,"Yes. Actually I was expecting an answer to what do YOU hackers would like to have and dont want to pay for it. For the moment this is the most voted idea but I'm still open for more input if you have other ideas.",1270002675
1230758,comment,1230709,1230753,0,0,David,,,"Not that I disagree with your point, but ""[...] CNN ranks 21st, while MSNBC lags even further behind at 25th.""<p>Doesn't sound like specialization is working well for MSNBC, to me.",1270002644
1230757,comment,1230156,1230156,0,0,rokhayakebe,,,"This is funny. I now just wanted to find something interesting on HN. I decided to check Patrick's comment feed. Here I am finding something interesting about him. Congratulations, man.<p>Cheers<p>Edit: I actually have it on my list to read every single post he has written.",1270002643
1230756,comment,1229089,1230205,0,0,jbooth,,,"The thing is, they're not just dealing with startups -- they're also dealing with fraudulent ventures calling themselves startups.",1270002523
1230755,comment,1230525,1230525,0,0,fjabre,,,"Congrats to Eric Sachs and the rest of the team for getting this out sooner than expected.",1270002440
1230754,comment,1230251,1230251,0,0,clintavo,,,"A tad off topic but...Does anyone actually know <i>how</i> to get a FathomDB account?  I thought, as a long time Rackspace customer and the promo code ""RACK"" they promote on their site, it would be relatively simple, I've tried to register three times over the past few months, but I never hear from a peep from FathomDB........",1270002436
1230753,comment,1230709,1230709,0,0,jpcx01,,,"Nobody likes watching stuff in the mushy middle. Rightwing wants Fox news, Leftwing wants MSNBC. Always better to specialize.",1270002428
1230752,story,,,3,0,jakerocheleau,"Twitter Releases Sleek, Clean Homepage Redesign",http://www.insidethewebb.com/2010/03/twitter-releases-sleek-clean-homepage-redesign/,,1270002329
1230750,story,,,2,0,asnyder,"AT&T Prepares Network For Battle",http://online.wsj.com/article/SB10001424052702304739104575154072784198614.html,,1270002306
1230749,comment,1229662,1229662,0,0,teeja,,,"""Chinese consumers aren’t really reaping the full fruits of their labor.""<p>If having <i>savings</i> is not a fruit of labor here in the US, we'd do well to emulate that behavior more. The Depression generation learned that lesson the hard way, and we clearly forgot it.<p>Part of the reason is that hard-sell marketers here manage to continually create 'needs' where none existed, and 'value' that's abstract in the extreme. I can't fault the Chinese for erring on the side of caution. I can only wonder when we'll remember why the 'fruit' of financial security is one worth treasuring.",1270002152
1230748,comment,1230251,1230673,0,0,moe,,,"<i>You're misreading his argument or are being deliberately obtuse.</i><p>Well, it seems you're misreading mine now.<p><i>does not mean it is impossible.</i><p>I never said that.<p>If you re-read my post you will see that I was merely wondering about their claim of not just meeting the goalposts set by Oracle et al but of exceeding them by a large margin. As I understood it their new system is supposedly not only maintenance-free, but also efficient regardless of the workload or schema that I, as a user, might throw at it. And all that supposedly hosted on commodity VMs in a cloud (probably EC2).<p>That's about as bold a claim as it gets in database-land, so if I was reading too much into it then feel free to correct me on <i>that</i>, but please don't suggest I said something that I never said.<p>To put it into perspective (again): I would think both Google and Amazon have probably also thought long and hard about this problem. A full fledged SQL Store would be a much more sexy offering than their crippled SimpleDB/Datastore solutions after all. There's also a good amount of academic research in the area, with Cassandra (Dynamo/BigTable) seemingly being what many people consider the best we can currently do in terms of linear scalability on commodity hardware - at the cost of not having SQL and no ACID.<p>So here comes this startup out of the blue, claiming to have solved all these things.<p>Yes, leaps like that happen sometimes. Google happened, too, after all. But I think my skepticism is not completely unjustified either?<p>Hence my question <i>which</i> tradeoff FathomDB chose to make, to get at least a basic idea about what to expect.",1270002124
1230747,comment,1230315,1230708,0,0,mahmud,,,"My honor :-)<p>Several times in my life I thought of sending an unsolicited resume to you guys, but always doubted I had what it takes.",1270002116
1230746,comment,1230443,1230443,0,0,pjonesdotca,,,"The 'app' frenzy has long since reached 'bubble' proportion. You've been warned.",1270002035
1230744,comment,1230038,1230584,0,0,matt1,,,"Thanks -- good article.",1270001924
1230743,comment,1229684,1230629,0,0,rokhayakebe,,,"I think Adult Friend Finder fixed that issue already :) .",1270001899
1230742,comment,1230567,1230567,0,0,zephjc,,,"These slides are pretty skimpy - I'm guessing the actual talk had a lot more meat to it.",1270001890
1230741,story,,,5,0,cwan,"Is ""commuting the daily activity most injurious to happiness""?",http://scienceblogs.com/cortex/2010/03/commuting.php,,1270001879
1230740,story,,,16,3,ccg,"Hacker News Chicago meetup Wednesday 3/31 at 8pm",,"Chicago hackers: Please join us for the next Hacker News Chicago meetup on Wednesday, 3/31/2010, at 8:00pm at the Hophaus (646 N. Franklin, 312-280-8832, http://www.thehophaus.com/). Please join our mailing list (http://groups.google.com/group/hn-chicago) for announcements and hacker discussions, and follow us on twitter or identi.ca (@hnchicago).",1270001858
1230739,story,,,11,13,whalesalad,"Ask HN: Hackers in LA?",,"I grew up in Los Angeles (Pasadena/Glendale), transplanted to Honolulu almost 3 years ago, and now I'm ready to come back. I'm wondering where the startup/tech scene is right now in Southern California? I'm out of touch with my homeland, and would love to have the hackers here give me the heads up before I return.<p>Also... are there any HN meetups or groups in LA?",1270001802
1230738,comment,1230456,1230456,0,0,epi0Bauqu,,,"Recently switched from white board/notepad to <a href=""http://speckleapp.com"" rel=""nofollow"">http://speckleapp.com</a>, which is made by HN member elliottkember.",1270001750
1230737,story,,,1,0,newsit,"10 mobile technologies to watch in 2010 and 2011",http://www.echannelline.com/usa/story.cfm?item=25583,,1270001736
1230736,comment,1224071,1224791,0,0,elblanco,,,"All I can say is <i>fascinating</i>.<p>I don't think it can be drilled into developer's heads enough, that someday, somebody else will have to deal with this code. And that person might even be them 4 years from now.",1270001729
1230735,comment,1230726,1230726,0,0,alexkay,,,"Certainly a cool idea and a nice feature, but how on Earth is this patentable?",1270001674
1230734,story,,,4,1,zackattack,"Ask HN: Do you have experience running an open source web app?",,"As many of you may know, HipHopGoblin is now an open source project. And due to popular demand, it is going to be back up and running soon.<p>What's the best way to make sure that changes pushed to the Github repository don't break the app? A suite of tests? A staging server? What kind of process should we use?<p>Thanks!",1270001662
1230733,comment,1229309,1229934,0,0,sreque,,,"I tried learning Scheme, and it is like a foreign language. Everything is so different: the idiomatic style, constructs of choice, manner of solving problems. It's not just the parenthesis that throw me off. Plus, I don't like how the core language and library are organized at all. I think clojure got it much better in that regard. In the end, I don't feel it's necessarily worth it.<p>Scheme's primary advantages are that it has the most powerful compiler plugin framework which includes the most powerful macro system of any language, and it has the best language support for continuations. However, those two things alone have not been able to convince me to bite the bullet and force myself to code in Scheme for a year or more to really learn it, which is at least how long I think it would take to be comfortable in it.",1270001612
1230732,comment,1230648,1230661,0,0,anotherjesse,,,"I thought the coverage was pretty weak.  Not due to unicorn but because there are many options (including passenger (aka mod_rails) for apache) that allow queueing to occur at the proxy instead of at the individual workers.<p>I wish they had discussed why unicorn instead of mongrel and why didn't solutions like haproxy or passenger or ... didn't work?<p>This discussion was: our apache configuration didn't work so we switched the load proxy mechanics and our app server at the same time.<p>I've had great success with mongrels with HAProxy (with maxconns=1 so only 1 request per mongrel at a time) for years.  I've also had great success at Passenger with apache.<p>I think it is a great step forward for twitter's servers, I just wish the article had some meat.  Isn't this the twitter engineer blog, not blog for the general audience about how twitter works?",1270001595
1230731,comment,1230251,1230553,0,0,jbellis,,,"> you can pick up the phone and an Oracle salesperson will sell you the physical device that you're implying can't exist<p>Bullshit, and I will elaborate.<p>Oracle has two ""scalable offerings:""<p>RAC relies on a single large san to ""scale.""<p>Exadata relies on super-fast interconnects to get multiple machines to look more like a single huge one, which has the obvious speed-of-light limitations as well as the price one.<p>Neither approach is the kind of scale out with commodity hardware that something like Cassandra gives you.<p>Invoking the mythical ""pay Oracle enough money and they will make it scale"" mantra is frequently done by people who either don't know better or are deliberately muddying the water, but that doesn't make it right.",1270001563
1230730,story,,,1,0,fogus,"The Mechanics of Judgment",http://web.mit.edu/newsoffice/2008/saxe-tt0514.html,,1270001549
