ID,Type,Story,Parent,Points,Comments,Author,Title,URL,Content,Created
3761956,comment,3761013,3761831,3,0,villagefool,,,"This is the second time today that I hear about Askolo, seems more then a quincidence (heavy PR going on?).\nHow are they different from Quora?",1332861675
3761955,comment,3761814,3761921,1,0,onemoreact,,,"(d) Conservatives are more centralized.<p>Quick, what's the most influential Libral TV station?",1332861674
3761954,story,,,175,32,m0th87,ZeroRPC,https://github.com/dotcloud/zerorpc-python,,1332861666
3761953,comment,3761595,3761595,1,0,foresterh,,,"They should not give away anything this year, so those that didn't get a ticket will get a similar streaming experience and those that got one just for swag will get nothing for their ""investment""<p>and I got a ticket, so I'm not saying this out of spite...",1332861636
3761952,story,,,1,0,adamfeber,"Announcing Advanced Merge Requests for Git",http://blog.assembla.com/assemblablog/tabid/12618/bid/80158/Announcing-Advanced-Merge-Requests-for-Git.aspx,,1332861633
3761951,comment,3759589,3759982,1,0,Zikes,,,"Some of the positive cost/benefit factors will arise as a result of the data necessary to create such a system.<p>By knowing where every single item is in a store, you can create efficient routes through that store to make your shopping trip only as long as is necessary.<p>Also, in some big-box stores an employee may not be familiar with items outside of their assigned area.  They may only be able to direct you to the general vicinity, or have to call in some additional help.",1332861600
3761950,comment,3761263,3761263,1,0,glenntzke,,,"I'd like to see see gain some traction and give Runescape a run for it's popularity.",1332861583
3761949,comment,3760583,3761867,11,0,dollar,,,"You mean like demanding employees return their stock options? Yeah, nothing totally despicable about the management of your company, they are all GREAT GUYS!",1332861582
3761948,comment,3759717,3759717,1,0,Thunderdome,,,"Yep.  Two programmers enter, one programmer leaves.",1332861549
3761947,comment,3761263,3761263,2,0,digisth,,,"Clever, and very well done.",1332861535
3761946,comment,3761263,3761869,10,0,masklinn,,,"Realm of the Mad God is even better on that front: it auto-generate a name for you, you just hit ""Play"" and you're in the game ready to rock (you can edit the game once you're hooked of course, and create a formal account, and start paying your dealer, but the initial experience is ""hit play and you're playing"")",1332861532
3761945,comment,3761927,3761927,1,0,varunsaini,,,"Waiting for ideas...",1332861519
3761944,comment,3761333,3761333,2,0,rarrrrrr,,,"How many options are there for an open source cloud storage product you can run at your own site now?<p>I'm sure I've overlooked a few, but the ones I'm aware of (roughly in chronological order of when they first became usable) are:<p>Eucalyptus's Walrus  <a href=""http://open.eucalyptus.com/wiki/EucalyptusStorage_v1.4"" rel=""nofollow"">http://open.eucalyptus.com/wiki/EucalyptusStorage_v1.4</a><p>OpenStack's Swift  <a href=""http://swift.openstack.org/"" rel=""nofollow"">http://swift.openstack.org/</a><p>SpiderOak's Nimbus.io  <a href=""https://nimbus.io/"" rel=""nofollow"">https://nimbus.io/</a><p>Basho's Riak CS   <a href=""http://basho.com/products/riakcs/"" rel=""nofollow"">http://basho.com/products/riakcs/</a><p>Glad to see so much interest in this space.<p>I think Basho made a good strategic choice with what they call ""Per-Tenant Visibility"", which will facilitate other cloud hosting providers that compete with Amazon reselling Riak CS as a storage service.",1332861509
3761943,comment,3760382,3760691,3,0,schiffern,,,"The current Series E £5 and £10 note are due for replacement anyway. The £20 and £50 notes are already Series F.<p>Traditionally the famous person depicted on the banknote is changed with each series: <a href=""http://en.wikipedia.org/wiki/Banknotes_of_the_pound_sterling#Current_issue"" rel=""nofollow"">http://en.wikipedia.org/wiki/Banknotes_of_the_pound_sterling...</a>",1332861508
3761942,story,,,1,0,christofd,"TouchOSC - cool MIDI control surface (iOS/ Android)",http://hexler.net/software/touchosc,,1332861507
3761941,story,,,1,0,friendlytuna,"A NLP Module for node.js",http://css.dzone.com/articles/using-natural-nlp-module,,1332861479
3761940,comment,3761512,3761827,8,0,mmastrac,,,"If you rooted your EVO on day 0, then you probably used some of my Unrevoked work. :)<p>I can say with absolute certainty that we've held previously back active, root-level exploits in the OS or supporting Android libraries that we've found to a later date, solely to ensure that users continue to have access to root.",1332861469
3761939,comment,3761876,3761876,1,0,varunsaini,,,"Sublime Text 2 for me. Very powerful and easy to use.",1332861458
3761938,comment,3761013,3761013,3,0,j45,,,"Awesome thread.<p>I had two massively influential mentors like this in middle and high school.<p>Both were teachers who cleared the path for me. Instead of the curriculum other students did I was given one that challenged me. 95% if I got the new computer lab setup over the weekend.  I was pushed to help integrate technology into all the schools clubs, which in turn required me to join a whack of clubs I never would have, nor made diversely interested friends.<p>While I was in school, much of this did happen outside the classroom. By saving my school 50 to 80,000/year in network administration costs.  By creating (or saving) this much value I was supported with my own office, phone number, expense account to buy books or things for learning, attend conferences, and generally have my run of the school, including a pre-signed pad of late slips to use when I ran late from my commitments.<p>There was so much that got built as a byproduct of my time because I was going so fast.  The difference 10 or 15 years later? I had far fewer responsibilities to other areas of my life (and others) back then.<p>Age inevitably eats up more time and it's a reality, if you want a balanced life with more than just work in it.  This might be a kiss of death to some startup types, but it presented a new challenge to me and I ended up pursuing a consulting business to forever float me while chasing startup ideas.",1332861441
3761937,comment,3761333,3761333,2,0,siculars,,,"Interesting. Grats on the announcement. Will Riak CS support range requests on binary objects? Aka. give me bytes 100-200.",1332861440
3761936,comment,3760709,3761768,2,0,wpietri,,,"> If that code is in there without at least a comment mentioning that, then you have bigger problems than handling people's egos. This kind of thing is precisely what comments are for.<p>Comments are a poor substitute for collaboration.<p>> Tell that to people who came up with 15% ""innovation time"" at 3M and 20% at Google.<p>As far as I'm told, 20% projects always had to be approved by your manager. So I suspect that they are not quite as open as you are thinking.",1332861426
3761935,comment,3761495,3761596,2,0,toadkick,,,"That's very strange. My girlfriend's iPhone 4 handles it just fine.",1332861423
3761934,comment,3761013,3761013,2,0,daspanters,,,"Hi Derek,\nLoved your book, two quick questions, (1) Up to today, how far did you get in using RoR for your new projects and (2) what is your ""Kimo's advise"" on speed learning it ? (coming from the Microsoft world).",1332861419
3761933,story,,,3,0,hendler,"Amazing DARPA projects (Regina Dugan, now at Google)",http://www.ted.com/talks/regina_dugan_from_mach_20_glider_to_humming_bird_drone.html,"""What would you attempt to do if you knew you could not fail?""",1332861417
3761932,comment,3761040,3761810,1,0,wangarific,,,"And when you get a professional, they're often better at it than you are. It's a little like comparative advantage.",1332861409
3761931,comment,3761773,3761773,1,0,rohitnair,,,"Also, not all apps have an explicit ""delete account"" option. I've experienced scenarios where I've received push notifications when I'm actually signed out of the app (I've seen this behavior on the Google+ and Airbnb apps, for instance) I guess it really is up to the application developer to send push notifications only for active sessions.",1332861404
3761930,comment,3760274,3761411,2,0,mseebach,,,"Cars are responsible for some 15% of carbon emissions globally. Even if we could replace all cars globally (a <i>very</i> long shot already), we haven't accounted for the fact that most electricity generated is by burning fossils. China is by far the biggest builder of new nuclear power, but they can't even keep up with their growth, much less overtake it.<p>Let's say we can get all cars replaced (meaning we fix range, cost, the sophistication required to service, grid capacity etc.), you've maybe shaved 5% off emissions - and that's a one-off, not a continuous improvement, the growth in carbon emissions keeps soldiering on.",1332861385
3761929,comment,3759589,3759638,1,0,Zikes,,,"This is a particularly difficult problem, one that I actually happen to be involved with at the moment.<p>The short answer is that crowdsourcing is thus far ineffective, as there is as yet no suitable reward for tracking down where every single obscure product is in each store (and it will vary from store to store, even within the same chains).  This means it's up to each individual chain to create their own item locator system.<p>Walmart is currently working on this.",1332861378
3761928,comment,3761495,3761806,2,0,toadkick,,,"Heh, which I find myself doing frequently. Every time I get to the point where there are no ""easy"" choices for words to draw, I find myself force-quitting the app, relaunching, and playing a round with someone different, and then coming back to the round I skipped (incidentally, you get offered new word choices in this case). Hard to say whether having a ""back"" button would end up discouraging people from continuing the game or not without some A/B testing, and I have a hunch that not having a back button probably keeps people in the game a little longer, but I still wish there was a back button. I'd like to be able to return to the same point in the round instead of having to completely restart the round again.<p>EDIT: something else occurs to me too. When you are presented with a list of words to draw, you have the option to ""bomb"" the list and get new words. As I mentioned, if you force quit the app at this point, and come back to that round, you will be offered different words, for free (definitely an exploit if you are patient enough to go through the process of force-quitting and restarting). I guess putting a back button on this screen would pretty much obviate the need for the ""bomb"" button, and would directly impact their bottom line since people wouldn't have as many opportunities to use their bombs. I have a suspicion that <i>that's</i> the reason there is no back button...the fact that it doesn't give players a chance to back out and keeps them a little more engaged it probably just a happy side effect.",1332861377
3761927,story,,,2,6,varunsaini,"Ask HN: From Software Testing to Software Development",,"I want to move to software development from my current testing job. I have 5 years of experience in testing. I want to ask my fellow hackers -\n1. What are the chances to make this move?",1332861377
3761926,story,,,4,1,zerop,"What Happened When I Got Retweeted By BarackObama",http://paidcontent.org/article/419-what-happened-when-i-got-retweeted-by-barackobama/,,1332861376
3761925,comment,3756317,3757562,2,0,eli_gottlieb,,,"Last I heard, Israel has a 2% limit.",1332861363
3761924,comment,3759746,3761572,4,0,lambda,,,"You are not going to eliminate organized crime, but you can reduce it substantially. Drugs are in incredibly high demand, and are quite easy to hide and trade illicitly. Many people get into organized crime because they see that it's an easy way to make lots of money. Take away one of their biggest moneymakers, and you're not going to eliminate it entirely, but you will cut off quite a lot of their money, making it harder for them to recruit and less powerful.<p>You can also reduce their profits in other areas. The whole reason they are able to make money is that there is demand for services that cannot be provided legally. Now, some of these services really should be illegal, as they are scams or have very harmful externalities, but for many of the more lucrative ones, you need to ask yourself ""is banning this really worth the cost of enforcing it and the costs of the black market generated?""<p>For instance, human trafficking happens due to demand for labor that isn't being met by local markets, and the illegality of prostitution. Could that demand be better met by making our immigration easier, and making prostitution legal, spending the money saved on programs to help people who may be trapped in bad situations rather than perpetuating the situation by putting them into a permanent criminal class?<p>I don't pretend to know all of the answers. But I think it's a question that we need to consider seriously, and without resorting to knee-jerk ""soft on crime"" rhetoric against anyone who suggests that maybe this system is incredibly expensive, damaging to liberty, and producing more harm than good.",1332861352
3761923,comment,3761872,3761872,1,0,malarkeyking,,,"I would also consider paying and for the reasons you mention. However, how much would you pay? i would want the service to be as good as the free alternatives. In order to drive genuine innovation and great features, the site/business would need the resources to attract the top talent. Therefore, would you be prepared to pay <i>enough</i> considering the competition is bankrolled by big advertisers?",1332861316
3761922,comment,3761743,3761904,5,0,dhh,,,"Dude, that's deep. You're bike shedding the bike shed. So meta. Turtles all the way down. Touché!",1332861311
3761921,comment,3761814,3761814,2,0,amilanez,,,"Top enemies: Rick Santorum, Westboro Baptist Church and Fox News. Which of the following explains this? (a) Liberals are heavier Facebook users; (b) Liberals have more enemies; (c) Liberals are earlier adopters of new apps. :)",1332861303
3761920,comment,3761773,3761773,3,0,rdg,,,"That article is completely wrong from a technical perspective...",1332861294
3761919,comment,3760709,3761135,2,0,wpietri,,,"Not at all. It's totally possible to dare to do great stuff as a team.<p>In Silicon Valley, VCs very rarely fund single founders. They fund teams. That's because it takes a team to create the world-changing companies that they seek.<p>This list isn't saying you can't be passionate about your work. But it is saying you can't be an asshole to your teammates, and that the point of the work is never the code itself, but the effect you are collectively trying to have in the world.",1332861289
3761918,story,,,6,1,friism,"AppHarbor (YC W11) adds New Relic performance monitoring",http://blog.appharbor.com/2012/03/27/new-relic-is-now-an-appharbor-add-on,,1332861273
3761917,story,,,1,0,marbu,"Overview of ARM machines",http://nullr0ute.com/2012/03/arm-hardware-now-and-the-not-so-distant-future/,,1332861272
3761916,comment,3761040,3761696,1,0,onemoreact,,,"Sure, but as someone on salary I tend to find disposable income and then calculate that spread evenly over time.  AKA I have 1,000$ this month to spend however I like that's 1000/31 = 32$ a day or 1.30$ an hour.<p>I do this because I can't work more hours to make up for extra spending I can only wait till more money shows up.",1332861268
3761915,comment,3761512,3761775,3,0,mmastrac,,,"Why is that? You don't need root to pirate games. The only thing it does is <i>marginally</i> improve security for apps like Netflix.<p>It wouldn't have to be rooted by default. The ideal solution would be a USB tether + dev tool connection required to turn this on, so unsuspecting users aren't compromised by malicious apps.",1332861258
3761914,comment,3760460,3761815,2,0,brazzy,,,"More like: the more processors we add, the more performance can be gained by switching to nondeterministic algorithms for problems where getting a solution that is within 99% of the perfectly correct one and arrives in 1 second is better than getting a perfect solution in 2 hours.",1332861258
3761913,story,,,1,3,chris_dcosta,"Ask HN: Is anyone seriously working on a space drive?",,"There are plenty of serious companies looking at ""rockets"", and alternative launch and propulsion methods to get us somewhere more or less in the ""local"" space of our solar system, but are there any serious attempts at creating and testing anything that might lead us to travel to the stars?<p>I've seen a load of crackpot stuff but very few genuine efforts. Is there even anyone looking at challenging the science in a significant way that might lead to something?",1332861252
3761912,comment,3754664,3757361,1,0,maxcan,,,"Just to clarify, I dont think that its impossible for a lean-startup to be successful in mobile payments, but I doubt that they can do that just by emulating m-pesa.",1332861224
3761911,comment,3756317,3757116,2,0,eli_gottlieb,,,"It sounds nice, but in places like Israel you end up with governments headed by a party that took just about a 15% mandate, coalescing with two partners that took a 13% mandate and a shit-ton of small single-issue parties that got something like 3% each.  <i>One</i> Member of the Knesset deciding to swing can topple the government or force a coalition realignment.",1332861209
3761910,comment,3760709,3761637,3,0,bdunbar,,,"I think it's more about culture, not respect for rank.<p>A guy is supposed to learn at least the basics of the next higher-up job, sometimes two.  Team leaders are supposed to reach down two levels, ensure juniors are properly schooled to step up.<p>Obviously this is so if one's leader is zapped, juniors can step up and carry out the mission.<p>But this works out well in nominal peace-time and non-combat jobs, too.  And the better trained and schooled one's juniors are, the better the unit can carry out the mission.<p>Example: one week into a three-week field exercise I was given 20 minutes to pack and report to a new, temporary, job, far away from my parent unit.<p>We could do this because everyone under me (all of three guys, but still) knew what I did and could do the job.  The only problem it caused was that they suddenly had one fewer person to stand watch in the server CONEX.",1332861191
3761909,comment,3759899,3760165,1,0,wmf,,,"Red Hat proved that <i>one</i> company can make money using the support business model, but it doesn't look very replicable.",1332861182
3761908,comment,3761743,3761841,1,0,lucisferre,,,"Find a ""small"" project is probably best. I've contributed to probably over a dozen opensource projects on Github in the past year or so. I highly encourage you to find a few that you use and like. They don't even have to be really small, but I'd probably avoid projects like Ruby, Rails or the Linux kernel for now.",1332861174
3761907,comment,3761595,3761595,3,0,danellis,,,"I got a ticket, but every time I try to pay for it I get ""We couldn't complete your purchase because of a technical issue."" Anyone else having similar issues?<p>(It did tell me ""declined"" once, but I called my bank's fraud department and had them remove the block.)",1332861166
3761906,comment,3761743,3761841,1,0,viscanti,,,"Find a small project you use for something you're building.  Do you run into any issues with using it, that could be improved?  Improve those and send a pull request.  Make your first commit small and obvious.",1332861137
3761905,story,,,2,0,mgrouchy,"Exploring Python Code Objects",http://late.am/post/2012/03/26/exploring-python-code-objects?1=1,,1332861112
3761904,comment,3761743,3761821,15,0,lucisferre,,,"Bah, I can't be bothered to read the whole thing. Before the request was closed, if I understood correctly, the argument was about whether or not `xhr?` needed to return a boolean rather than what it's doing which is aliasing a regex match.<p>Hmm, call it bike-shedding if you want, but I have to be honest part of the beauty and value of Ruby is how semantic it can be made when you follow some conventions. How hard or awful is it to just actually return a boolean here? I mean is anyone expecting or relying on the clearly undocumented feature that it also returns the offset of where `/XMLHttpRequest/i` is found in the request?<p>The problem with throwing out the 'bikeshedding' defence is that it goes both ways. It's their choice to fight a small, trivial pull request that appears to make logical sense, and arguably reduces the potential for cognitive friction.<p>It's debatable who's actually bikeshedding here.",1332861110
3761903,comment,3761773,3761773,4,0,scootklein,,,"I believe the author just has a technical misunderstanding of the way APNS works. In no ways is APNS aware of accounts logged in or logged out of a service - all of this happens on the app developer's server backend. The author's case is properly laid out, but the fault is of the app developer rather than APNS. Developers should take note - this is indeed a valid race condition.<p>APNS is simply an exchange between a remote service (ex. Twitter) and an application that has registered for remote notifications (ex. Twitter app). APNS knows nothing more than the key that it provided to Twitter to identify this device in a remote push context.",1332861104
3761902,comment,,3761876,15,0,duaneb,,,XCode,1332861085
3761901,comment,,3761876,12,0,duaneb,,,"Visual Studio [Express]",1332861085
3761900,comment,,3761876,283,0,duaneb,,,"Vi (or derivative)",1332861085
3761899,comment,,3761876,7,0,duaneb,,,TextWrangler,1332861085
3761898,comment,,3761876,57,0,duaneb,,,TextMate,1332861085
3761897,comment,,3761876,156,0,duaneb,,,"Sublime Text",1332861085
3761896,comment,,3761876,1,0,duaneb,,,SubEthaEdit,1332861085
3761895,comment,,3761876,1,0,duaneb,,,ScITE,1332861085
3761894,comment,,3761876,1,0,duaneb,,,"sam (or derivative)",1332861085
3761893,comment,,3761876,8,0,duaneb,,,PyCharm,1332861085
3761892,comment,,3761876,70,0,duaneb,,,Notepad++,1332861085
3761891,comment,,3761876,3,0,duaneb,,,Nodepad2,1332861085
3761890,comment,,3761876,9,0,duaneb,,,NetBeans,1332861085
3761889,comment,,3761876,10,0,duaneb,,,nano,1332861085
3761888,comment,,3761876,1,0,duaneb,,,MonoDevelop,1332861085
3761887,comment,,3761876,7,0,duaneb,,,"Komodo Edit",1332861085
3761886,comment,,3761876,2,0,duaneb,,,KDevelop,1332861085
3761885,comment,,3761876,1,0,duaneb,,,jedit,1332861085
3761884,comment,,3761876,12,0,duaneb,,,IntelliJ,1332861085
3761883,comment,,3761876,1,0,duaneb,,,IDLE,1332861085
3761882,comment,,3761876,18,0,duaneb,,,gedit,1332861085
3761881,comment,,3761876,106,0,duaneb,,,"Emacs (or derivative)",1332861085
3761880,comment,,3761876,39,0,duaneb,,,Eclipse,1332861085
3761879,comment,,3761876,2,0,duaneb,,,"E Text Editor",1332861085
3761878,comment,,3761876,1,0,duaneb,,,Code::Blocks,1332861085
3761877,comment,,3761876,10,0,duaneb,,,Coda,1332861085
3761876,story,,,65,36,duaneb,"Poll: What text editors do you prefer?",,"Inspired by the recent polls on which programming languages people like and dislike, I decided to put together a poll with the most popular editors and IDEs to figure out what text editors people prefer.<p>I think I got most of the popular editors, but if your favorite one isn't here, ask in the comments and I will add it.",1332861085
3761875,comment,3761263,3761772,2,0,brudgers,,,"The other day, I was thinking about an SMS based MUD for cheap feature phones - text based of course. An online game for places without much 3G adoption but where there are lots of Nokias, so to speak.",1332861068
3761874,story,,,1,0,concertina226,"Carberp Trojan still alive and well, security company finds",http://news.techworld.com/security/3347264/carberp-trojan-still-alive-well-security-company-finds/,,1332861060
3761873,comment,3761289,3761289,3,0,glenntzke,,,"I look forward to trying this out with a few friends from college who were mildly addicted to simple games like Dwarf Fortress and Zelda.  Any excuse for old school multiplayer gaming is a good one.",1332861028
3761872,story,,,2,2,youssefs,"I want to pay for a social network",http://sefsar.com/post/19716868388/the-last-word,,1332860998
3761871,comment,3761595,3761779,4,0,fourspace,,,"You're assuming he has a ticket.",1332860946
3761870,comment,3758465,3758668,1,0,flogic,,,"The UI is the language with which people communicate with the computer. UI patents makes as much sense as a patent on ""WTF"". Having such a patent is the same antisocial behavior as trying to own the ""ceiling cat"" meme.",1332860945
3761869,comment,3761263,3761263,15,0,kenrikm,,,"I like how they made it really easy to get in. No signup just name your guy and go. I generally don't have time to play games however I appreciate the amount of work that goes into them. Good Job.",1332860924
3761868,comment,3760447,3761716,4,0,scott_s,,,"Newton is a famous mathematician in the same way that Jesus is a famous Jew.",1332860919
