ID,Type,Story,Parent,Points,Comments,Author,Title,URL,Content,Created
3762116,story,,,1,0,greatnews,"Parse offers its mobile backend-as-a-service on a freemium model",http://gigaom.com/2012/03/26/parse-freemium-service/,,1332863053
3762114,comment,3761013,3762000,2,0,sivers,,,"My optimism is a little bit innate, but mostly learned.<p>It was something I got from Tony Robbins : that you can choose how you want to feel about anything.  (We usually act like we can't help the way we feel. But we can consciously choose and change how we feel.)<p>No matter what happens, you can choose to ask, ""What's great about this?""  Even if you're not in the mood. Even if cranky or pissed-off, you can still force yourself to ask that, out of habit. Then the pessimism slowly dissolves, and you start to get optimistic again.<p>Then it feeds off itself. Somehow when you're optimistic, things go your way more often. Then that encourages you further, etc.<p>Actually these days I'm SO optimistic that it can work against me!  I optimistically over-estimate my ability to do things.  I optimistically think I'll just get fit and healthy through good intentions.  Etc.<p>Sometimes a dose of painful pessimism can achieve more.  (Though I guess if you realize that's the attitude that would be more helpful for you, you can choose to be pessimistic, too.  As long as you know it's an intentional choice.)",1332863046
3762113,story,,,1,0,ukdm,"Eye tracking machine is better lie detector than expert interrogators",http://www.geek.com/articles/geek-cetera/eye-tracking-machine-is-better-lie-detector-than-expert-interrogators-20120327/,,1332863041
3762112,comment,3761263,3761263,2,0,charlesju,,,"What is the license on this?",1332863007
3762111,comment,3761876,3761939,1,0,duaneb,,,"Yea, that's what I use. I'm very pleased with it.",1332862996
3762110,comment,3760311,3760852,2,0,nitrogen,,,"It's a good thing he created (and you posted) that followup, because otherwise I would've spent the rest of my morning implementing the same idea.",1332862996
3762109,comment,3761333,3761568,1,0,tlack,,,"He is right in that you don't hear much about Riak success stories, even though from the word on the street it's a good product. Perhaps this is something you guys could focus on putting together?",1332862994
3762108,story,,,1,0,Siah,"Dear Coursera and Udacity Dont congratulate yourself too much",http://openresearch.wordpress.com/2012/03/27/dear-coursera-and-udacity-dont-congratulate-yourself-too-much/,,1332862994
3762107,comment,3761876,3762043,1,0,duaneb,,,Added.,1332862980
3762106,comment,3758183,3758183,1,0,helen842000,,,"Perhaps speak more about the ideas that you want to work on, industries, types of customers etc. People can contact you because they then know they have something in common with you.<p>For example, I'm interested in designing, building and selling creative products. I'd rather build several small things that create regular income and then move onto a larger project full time.<p>Here are examples of things I'd like to create work on or have already started working on :-<p>A review site<p>A browser app/add-on<p>A clothing site<p>A range of notebooks<p>A site selling a product subscription<p>An iOS game for charity<p>A software application specific to personal trainers.<p>A Wedding Directory<p>From these things I can see that my best type of co-founder would be a graphic or web designer.",1332862980
3762104,comment,3761876,3761876,2,0,TeeWEE,,,"It depends on the language. JavaScript in Sublime. PHP in Netbeans. Java in Eclipse. ObjectiveC in XCode.",1332862970
3762103,comment,3761876,3762056,0,0,duaneb,,,Added,1332862964
3762102,comment,3761876,3762047,0,0,duaneb,,,Done.,1332862955
3762101,story,,,2,0,jrlevine,"37% of Shared Articles are ""Awesome"" (Why do we share what we share?)",http://blog.news.me/post/20010502183/why-are-37-of-all-articles-awesome,,1332862949
3762100,comment,,3761876,7,0,duaneb,,,BBEdit,1332862948
3762099,comment,3760447,3761808,7,0,ArbitraryLimits,,,"> Also, in my personal experience, she is quite well known.<p>True in my experience, also.  My very first college math professor took 15 minutes out of lecture, in Calculus I, to tell us about her.  He culminated by naming his dog after her, which I guess was his highest form of praise.<p>Don't get me wrong. Deriving conservation of energy from time invariance, conservation of momentum from linear translation invariance, etc. is totally cool.  But it's not really accurate to say that she's not well-known.",1332862943
3762098,comment,3760860,3761063,3,0,taylorbuley,,,"> I'm curious to see what will they do to differentiate themselves from Facebook's version<p>Not to mention Disqus and Echo offerings",1332862943
3762097,comment,3761876,3761876,2,0,MattLaroche,,,"Where's Pico?",1332862943
3762096,comment,3760583,3761867,4,0,eaten_by_a_grue,,,"Hahaha. The stock options were already mentioned, so, here's mine:<p>""Hey, let's make a carbon copy of this popular tower game.""<p>""Sure! That sits pretty good with me morally.""",1332862939
3762095,comment,,3761876,1,0,duaneb,,,Scribes,1332862938
3762094,comment,3759813,3759873,1,0,squarecat,,,"I understand your sentiment if these images were meant as ""portraits"", but it seems their intent was to be informative of the details and content in the same way that most bodies of water aren't a solid, bright, pasty blue but it helps to identify them on a map or globe that way.<p>Viewing celestial bodies/events with the naked eye (or as they would be if we could) can certainly be compelling but I thinks it's only pragmatic to acknowledge that even the outer planets only hold a passing interest to the public at large in an unaltered view.<p>It must be appreciated that we can capture these views at all, and with such detail!",1332862930
3762093,comment,3761495,3761495,3,0,msluyter,,,"I've enjoyed the game, but it seems to have a short shelf life. I started playing with about half a dozen co-workers last week, and now almost all of them have quit playing. This may in part be due to a.) not enough words (I'm seeing a lot of repeats), b.) time required to play -- drawing an elaborate picture (or watching it be drawn) takes considerable time (on an iPhone), and I often find myself shying away from the game for that reason.<p>Finally, I'd add that the game has a few annoyances. For example, the popup requesting you to rate the game in the app store can't be ignored. You must either rate the game, or postpone doing so.  I also lost all of my purchased colors after an update. Clearly they're having growing pains, but my enthusiasm is waning.",1332862921
3762092,comment,3761013,3761381,4,0,EvilTerran,,,"That book looks... reasonably promising, I guess; however...<p><i>""How do you handle stress and burnout?"" ""Power through it.""</i><p>I'm sorry, but that's terrible advice. You might as well tell someone with depression to ""just get over it already"".",1332862919
3762091,comment,,3761876,7,0,duaneb,,,Geany,1332862907
3762090,comment,3758465,3759107,1,0,roc,,,"> <i>""has been to eliminate the monopoly of trade guilds""</i><p>Exactly. By making their knowledge <i>public</i>.<p>> <i>""But has software ever had this problem?""</i><p>While the <i>history</i> of software looks nothing like Renaissance Italy, the <i>future</i> may -- particularly in a hypothetical world without software patents.<p>Historically, the root of even arguably-patentable software is expressly unpatentable math that has largely been developed by publicly-funded institutions.  So that even when, say, the Fraunhofer Institute was granted patents over parts of the mp3 codec, even absent the patent disclosure, it drew attention to the root math and gave rise to alternatives.<p>But looking <i>forward</i> the situation is more worrisome.  As public funding has failed to keep pace, only the potential to patent research has brought in the private funds that have continued to drive innovation.  Without that patent potential, there'd be little reason for anything beyond the hint of promising research to be shared publicly.  It would be pursued privately, without published articles, without any public disclosure on the other end.<p>And given the trend for modern software research to manifest as internet-accessible services, it doesn't seem like there would even be an <i>opportunity</i> to reverse-engineer or decompile the ultimate products that such research generated.  To say nothing of the rapidly increasing complexity of modern software and the increasing rate at which it's tied to custom silicon.<p>Consider an example: How in the world would someone be able to reverse engineer <i>Siri</i> in a world without software patents or the potential to patent publicly-funded core research?<p>The public has no access to the server-side source.  We have very limited access to the client-side source.  We have even less access to the client-side custom silicon [1]. Even if it were plausible for a not-for-profit effort to untangle a project of that magnitude, they simply do not have the access necessary.<p>[1] Though client side silicon is less integral in the current implementation, it's no stretch to imagine that Apple will continue to refine and accelerate its algorithms through heavier use of custom DSPs.  Nor is it news to say that it approaches the implausible for not-for-profit efforts to reverse engineer modern silicon.  And the relentless pace of fabrication promises to only make things more difficult going forward.",1332862907
3762089,comment,3761595,3761595,1,0,djenryte,,,"I think there was a heavy geographical element involved. All my programming friends from OC got in, some hitting the site as late as 7:04. Those in SF and LA were all locked out even after constant refreshes.",1332862881
3762088,comment,3759879,3760294,1,0,fusiongyro,,,"Let's make some distinctions. I'm not saying this is the ideal way to hire. I also dislike recruiters, and Java for that matter. But I don't find this practice indefensible, because:<p>1. Whenever you open a position, you get a ton of applicants that simply aren't qualified, and the faster you get rid of them the better.<p>2. A majority of programming jobs use Java, C# or C++, which all have 4 or 5 of these keywords with similar meaning.<p>This is a quick and easy filter. Of course, any quick and easy filter is going to have a false negative rate, and it's fair to protest that. Fundamentally, hiring programmers by their programming language competencies is also a very poor idea. But there are a lot of places that simply need a bunch of competent cogs and I don't think it's worth getting too worked up over the unintended negative consequences of their poor decisions. They want a ton of cogs, this is a great way to get a ton of cogs. You're not a cog and neither am I. I don't think either of us would want one of these ""supercoder"" jobs anyway.",1332862876
3762087,comment,3761927,3761927,1,0,girishmony,,,"learning a programming language!",1332862846
3762086,comment,3761595,3761818,2,0,throwaway1979,,,"You would think this is an obvious fix ... but you wouldn't get the hype, now would you?<p>I didn't get a ticket this year on purpose. 900 is a bit too much for my blood (I pay for it out of pocket and don't want to resell the swag). I went last year and it was both fun and sad. The concert, robots and devices made me go to geek heaven. The sad part was that it felt a lot of folks were there just for the swag. I also went to pycon last year and had an amazing time. The production values were far less but I felt that almost every single person in the room was a craftsman (craftsperson?). In terms of contacts, both events were a bust ... I don't think I socialized properly .. didn't make any lasting contacts in either places. This year, I'm saving my cash ... have already watched a lot of pycon talks on video. Will do the same for I/O",1332862835
3762085,comment,3760583,3761867,13,0,psykotic,,,"> how we really think about our players instead of taking on what is essentially an uninformed and cliched conventional wisdom opinion about the company.<p>Judging a company by what they do publicly rather than what they might say or think privately seems like a smart move on his part.<p>If you want your peers to think better of Zynga, the onus is on you, not them.",1332862823
3762084,comment,3760583,3761423,1,0,roguecoder,,,"The third option is to start a disruptive new competitor doing what they do only better and more ethically, supporting long-term relationships and sustainable development.<p>As long as anyone but you holds the gold, it's much harder to engender change.  Putting them out of business, on the other hand, has the awesome side effect of getting one rich while doing the right thing.",1332862812
3762082,comment,3761263,3762037,5,0,user2459,,,"Awesome! And again great work. The game was really enjoyable and the code inspiring.",1332862792
3762081,comment,3761595,3761871,2,0,justinchen,,,"In the description he says the ticket is in his name.",1332862781
3762080,comment,3757178,3759080,1,0,runjake,,,"Very few nations are as big as the US.",1332862781
3762079,story,,,3,1,dropshopsa,"Free Beginners Guitar Course Online",http://justinguitar.com/en/BC-000-BeginnersCourse.php,,1332862767
3762078,comment,3755890,3756075,1,0,ergo14,,,"Well then, maybe your hackers circle is usless and you should reorganize your circles or something. Thats the only conclusion i can make from your statement :(",1332862765
3762077,comment,3761814,3761968,1,0,pron,,,"Watch this: Jonathan Haidt on the moral roots of liberals and conservatives\n<a href=""http://www.ted.com/talks/jonathan_haidt_on_the_moral_mind.html"" rel=""nofollow"">http://www.ted.com/talks/jonathan_haidt_on_the_moral_mind.ht...</a>",1332862762
3762076,comment,3761263,3762003,5,0,paulrouget,,,"All the info are here: <a href=""http://hacks.mozilla.org/2012/03/browserquest/"" rel=""nofollow"">http://hacks.mozilla.org/2012/03/browserquest/</a>",1332862746
3762075,comment,3761876,3761876,21,0,jakubw,,,"<a href=""http://news.ycombinator.com/item?id=3717754"" rel=""nofollow"">http://news.ycombinator.com/item?id=3717754</a>\nI don't think you'll get different results 9 days later.",1332862728
3762074,comment,3760274,3761930,3,0,alexchamberlain,,,"It's irrelevant. We have to find ways of generating electricity cleanly anyway. So, we can kill 2 birds with one stone by making cars use that electricity. Better than driving hydrogen bombs around.<p>IMHO running out of fossil fuels and their escalating price is a much more compelling reason to use electric cars than the emissions argument.",1332862727
3762073,comment,3761013,3761635,1,0,dropshopsa,,,"Here is a good site for guitar try do a lesson a day.. justinguitar.com",1332862725
3762072,comment,3757796,3759141,1,0,gaius,,,"1983 was also the year the bottom dropped out of the console market, loads of firms went bankrupt, it was not a good career move to get into the industry in the mid-80s.<p><a href=""http://en.wikipedia.org/wiki/Video_game_crash_of_1983"" rel=""nofollow"">http://en.wikipedia.org/wiki/Video_game_crash_of_1983</a>",1332862724
3762071,story,,,1,0,huihijnil,Http://www.ln33.com/,http://www.ln33.com,,1332862720
3762070,comment,3761876,3761876,5,0,DanHulton,,,"Bah.  Real men program with a personally-magnetised needle and a steady hand.",1332862710
3762069,comment,3761876,3761876,2,0,udp,,,"GVim and MacVim. I'd probably use Sublime Text 2 if it supported vim modelines.",1332862705
3762068,comment,3761814,3761814,1,0,pron,,,Cute.,1332862700
3762067,comment,3760274,3761738,1,0,pradocchia,,,"Right, energy is awfully political.<p>Between the technical challenges and the political challenges, I recon the political ones are the harder of the two. Get the politics right, and the technology will sort it self out. Don't get the politics right, and the technology doesn't have a chance.<p>I'm also glad Gates has turned his attention to energy. 'Tis good to have someone of his resources and temperament focused on the problem.",1332862663
3762066,comment,3761876,3761876,1,0,Achshar,,,"Not that i use it but it really helped me in the beginning of my learning of html and php. Dreamweaver.",1332862663
3762065,story,,,2,0,Suan,"Vim plugin for real-time, github-styled markdown previews",https://github.com/suan/vim-instant-markdown,,1332862658
3762064,comment,3761046,3761757,1,0,tocomment,,,"So maybe it would work?  You just need a way to handle the radioactive waste, and a way to engineer on a very large scale.",1332862656
3762063,comment,3758963,3759055,1,0,jedberg,,,"You just put it back into the system if it doesn't fit.",1332862640
3762062,story,,,1,2,doodleskull,"How to create a successful webcomic?",,"My ""how-to-make-awesome-comic-site-like-no-other"" ideas so far:<p>- Make animationed shorts. People are vlogging with a video camera, but no one is doing that with animation.<p>- Make comics with HTML5 animations.<p>- Provide a new comic and a new video every single day.<p>- Mix and match infographic-style layout with personal comics and doodles.<p>Any thoughts? I'd be really thankful for any ideas or thoughts. Any thoughts.",1332862637
3762061,comment,3758047,3761962,1,0,analyst74,,,"I think you just answered that, right before asking it.",1332862630
3762060,story,,,4,2,charbonnelb,"Chocolate makes you loose weight",http://www.utsandiego.com/news/2012/mar/26/weight-loss-secret-chocolate/?page=1#article,,1332862625
3762059,story,,,1,0,georgecmu,"Why are there so few dunks in women’s basketball?",http://www.slate.com/articles/sports/explainer/2012/03/brittney_griner_dunk_why_are_there_so_few_jams_in_women_s_basketball_.html,,1332862625
3762058,comment,3761977,3761977,1,0,longzheng,,,"If anyone has any questions or feedback, would love to hear it.",1332862601
3762057,comment,3760709,3761936,1,0,CodeMage,,,"<i>Comments are a poor substitute for collaboration.</i><p>Of course they are, seeing as how they're only one form of collaboration. I wouldn't think that writing a comment to draw people's attention to some non-obvious aspect of code would count as anything but a form of collaboration.<p><i>As far as I'm told, 20% projects always had to be approved by your manager. So I suspect that they are not quite as open as you are thinking.</i><p>Which is why I did say, in continuation, that the 20% has been subverted at Google. From what I've heard, it hasn't <i>always</i> been that way.",1332862598
3762056,comment,3761876,3761876,1,0,forkrulassail,,,"Scribes (linux Textmate clone)",1332862596
3762055,comment,3761743,3761984,2,0,nirvdrum,,,"Agreed.  It all depends on perspective.  That's why I've always found the term to be needlessly dismissive.",1332862588
3762054,comment,3761743,3761821,2,0,protomyth,,,"I found this comment <a href=""https://github.com/rails/rails/pull/5329#issuecomment-4669686"" rel=""nofollow"">https://github.com/rails/rails/pull/5329#issuecomment-466968...</a> interesting for the implications of keeping an instance variable around as opposed to true / false.",1332862557
3762053,story,,,4,0,JayInt,"Input/Output Challenge for Google I/O",https://developers.google.com/events/io/input-output/,,1332862556
3762052,comment,3761743,3761821,8,0,zumda,,,"To summarize it: Someone upgraded from Rails 2.3 and had an issue, since xhr? stopped returning a boolean but 0 instead (the regex index of the first match). But he used the return value of that predicate in javascript. In Ruby 0 is truthy, but in Javascript it is false. So he made a pull request to change the behavior back to a boolean instead of 0.<p>@fxn then said that's not needed, and the predicate did return a truthy value and the contract never specified that it would actually return a boolean, so no contract was broken, so there is nothing to fix. (The Rails documentation uses monospaced ""true"" and ""false"" for the singletons and normal ""true"" and ""false"" for truthy and falsey values.)<p>Then Tim Pope suggested an alternative solution that would actually return a boolean. It got merged by @tenderlove but quickly reverted by @fxn again.<p>And so the bike shedding continued...",1332862551
3762051,comment,3761595,3761595,1,0,joejohnson,,,"According to Vic Gundrota, it took ""just over 20 minutes"" for the conference to sell out.  <a href=""https://plus.google.com/u/0/107117483540235115863/posts/iyc4arLjidR"" rel=""nofollow"">https://plus.google.com/u/0/107117483540235115863/posts/iyc4...</a>",1332862549
3762050,comment,3760583,3760583,3,0,ajays,,,"There's an interesting angle in there that I think people are missing.<p>To recap: Shay seemed intent on preserving control over Connectrode, even though it wasn't making any money and going nowhere. But after getting turned down by Zynga, he had an epiphany: he had never applied to Zynga even though they are right there in Austin.<p>I've seen this happen a few times. When we don't want to do something, our conscious mind will come up with some excuse (""their cafeteria is not good, and I'm a strict vegan"", or ""they use python, and I'm a Perl guy"", or something inane like that). But deep down we already know we don't want to do that; we're just coming up with some overt justification for our decision.<p>I'd be willing to bet that even if Zynga agreed to his terms, he wouldn't have joined. His gut told him it was not a good fit for a variety of reasons, many of which probably he himself doesn't know.<p>Moral of the story is: we should listen to our gut more often. It speaks very softly, but it's usually right.",1332862541
3762049,story,,,2,3,gregory80,"Ask HN: Ever been asked to sign an NDA, before an interview?",,"I've been asked to sign an NDA at almost every job I have taken in my professional life -- once I have accepted the job -- I have only once encountered a company that wanted me to sign an NDA before the first interview, it caught me off-guard, is this common practice?",1332862495
3762048,story,,,1,0,conveiekguard,"Hosting en mexico",http://www.digitalserver.com.mx,,1332862492
3762047,comment,3761876,3761876,1,0,rodion_89,,,"Geany (<a href=""http://www.geany.org/"" rel=""nofollow"">http://www.geany.org/</a>)",1332862484
3762046,comment,3759968,3760038,2,0,_delirium,,,"The MIT license doesn't require that derivative works also be released under the same license; you need a copyleft license for that kind of requirement.",1332862472
3762045,comment,3760709,3761256,0,0,edwinnathaniel,,,"Up until today, I never understand the term ""good developers"".<p>Good Developers seem like a mythical creature that exist in Atlantis.",1332862471
3762044,comment,3761595,3761788,1,0,abraham,,,"I think this is one of the reasons the price doubled this year.",1332862452
3762043,comment,3761876,3761876,1,0,wbrendel,,,"No BBEdit option?",1332862431
3762042,comment,3761263,3762003,1,0,justinhj,,,"It's not a Comet style poll because the only requests I see it making are to a server that seem to be tracking metrics that have no response.",1332862418
3762041,comment,3761743,3761841,1,0,code_pockets,,,"Start your own project.<p>Open source is not strictly about contributing to existing projects. You can start as many new projects as you'd like.<p>My experience is that many big projects started out as personal (read small) projects that grew out of adoption.<p>What kind of projects should you start?<p>Pick something that you reason you can solve with your current knowledge, and get working.",1332862390
3762040,comment,3760460,3761774,1,0,alexchamberlain,,,"Does that include I/O over a network?",1332862387
3762039,comment,3761040,3761040,1,0,Lagged2Death,,,"I applaud the notion of examining the way you spend your money and thinking about whether the stuff you spend money on is really adding value to your life or whether it's just a habit that you've fallen into.<p>But:<p><i>You can save more in one call to a cable company than skipping your morning coffee, even though skipping morning coffee takes more work.</i><p>What could possibly be less work than <i>not</i> buying something? Not buying something usually saves both money <i>and</i> time.<p>And I don't know about his cable company, but getting a human being from any of my utilities on the phone is something I'd count as <i>work</i>.",1332862386
3762037,comment,3761263,3762020,17,0,franck,,,"Thanks. We are going to update the repository soon with licensing info.",1332862382
3762036,comment,3759938,3760736,1,0,anonymoushn,,,"<i>That would make HFT much less attractive at the ridiculous frequencies it happens currently, as you'd need to hold on to stock for longer for it to shift enough for the gross gain to exceed the sales tax.</i><p>This is true if for some reason the HFT wants to take liquidity on both sides of the trade.  In reality, the HFT will probably add liquidity on both sides of the trade, making a profit equal to the true spread plus any change in price.  Moves of one tenth of a cent will continue to be massively profitable for the HFT, but the HFT's counterparty will have to pay a much larger spread.<p>One group of people who commonly take liquidity on both sides of the transaction are retail investors, so they would end up taking a great deal of the losses created by this tax.",1332862363
3762035,comment,3761714,3761714,1,0,jcurbo,,,"My wife and I went to Chincoteague on vacation once and I had no idea they had a NASA facility out there.  They have a nice little visitors center and info on the rockets they launch, including schedules.  I wasn't able to see one but I will definitely be heading out there for a launch at some point.",1332862353
3762034,comment,3761814,3761814,4,0,AznHisoka,,,"I always wanted a dislike button.. I would use it on 99% of the status updates I read, especially egotistical updates that make me feel jealous.",1332862339
