ID,Type,Story,Parent,Points,Comments,Author,Title,URL,Content,Created
3762217,comment,3760583,3762173,1,0,joezydeco,,,"I think he's pretty clever for using the very tiny window of opportunity to gather some publicity for himself.  Remember, the guy just lost his job.",1332863992
3762216,comment,3761714,3761714,-1,0,tcarnell,,,"I'm sure NASA just invent important sounding work so they can play with rockets.<p>...do the Jet Streams 'really' need monitoring? they have probably been doing fine for years!",1332863987
3762215,comment,3761876,3762205,4,0,koenigdavidmj,,,"It's back to Reddit for you two.",1332863972
3762214,comment,3762168,3762168,1,0,incirus,,,Sudoku,1332863971
3762212,comment,3759899,3760156,1,0,doktrin,,,"Maintaining a civil discussion is one thing.  Literally silencing and erasing opinions we do not agree with is <i>completely</i> different.<p>Does anyone actually believes this is the approach we should be taking?",1332863960
3762211,comment,3760583,3761867,4,0,chernevik,,,"You != Zynga.<p>With less than 24 hours to decide -- a timeframe set by Zynga -- what exactly is he supposed to decide on beyond his impressions at the negotiations' start?<p>And he went out of his way to _not_ slander Zynga.  He didn't claim to be poorly treated, makes no complaint about Zynga pursuing its own interests.  He mentions his respect for a number of your colleagues.  He calls the company ""evil"" but so carefully defines the term that it's clear he means ""unsustainable"" and ""short term cash flow maximizing"".    You don't agree and that's what makes a market.<p>You want a chance to bridge the gap between your understanding and his?  Get on the horn to Corporate, get a carve-out for Connectrode, then call him up and make him an offer, same terms as Monday but without the crazy deadline.",1332863958
3762210,story,,,3,0,pbj,"Why videos go viral",http://www.youtube.com/watch?v=PPN2BHydH3Y,,1332863957
3762209,comment,3761876,3761876,1,0,aantix,,,"No Rubymine?  Hands down the best Ruby/Rails IDE out there.",1332863930
3762207,story,,,6,2,lilytaylor89,"New Tools for Designers and Developers",http://www.dzone.com/links/new_tools_for_designers_and_developers.html,,1332863898
3762206,comment,3761773,3761957,1,0,idunno246,,,"But the original owner still wants to receive push, so you shouldn't unregister.  This isn't apple's problem, this is that the twitter app's server doesn't know they logged out and continues to send messages to the phone.",1332863870
3762205,comment,3761876,3762070,1,0,warfangle,,,"Excuse me. But _real_ programmers use butterflies.",1332863867
3762204,comment,3761876,3762122,1,0,robin_reala,,,"Textpad wasnt bad 8 or so years ago, but its unfit for purpose these days due to its inability to handle Unicode. Youve actually got to be quite careful with it, as itll mangle text you load and save.",1332863866
3762203,comment,3759614,3759614,1,0,unfocused,,,"Power Supply
   150W
Dimensions
    11.1"" x 11.02"" x 3.74""
Weight
    10 lbs.<p>This isn't even in the same category in my opinion. Power, Dimensions and Weight are huge compared to the Pi. So to answer your question, it's a 'No' for me.",1332863842
3762202,comment,3761805,3761805,1,0,cd34,,,"While this is an interesting post, it was written and based on conclusions from 2007 - many of which are addressed in better kernel defaults, included in smarter tunables, and better mount options.",1332863824
3762201,comment,3761102,3761723,1,0,tcarnell,,,"It could be...<p>The application basically allows you to enter contracts you have - for example software licenses or contracts with suppliers and as those contracts change over time (ammendments and addendums), and contract terms come and go, the application will send alerts for when things need to get done. It also handles terms that automatically roll over etc and has quite a comprehensive import tool to allow you to import existing contract data into the system.<p>It was primarily design for companies that have many contracts with suppliers, re-sellers and licenses etc.<p>Let me know if you want more information. I really dont have any plans for the application, so I am just seeing if anybody else might find it useful, or is looking for something similar.",1332863801
3762200,comment,3761263,3761681,7,0,tibbon,,,"I dunno, this is better (and more fun) than any Flash based browser MMO I've played. Also didn't bug me about buying coins in their store or some Zynga-like upsell.",1332863800
3762199,comment,,3761876,0,0,duaneb,,,"Programmer's Notepad",1332863797
3762197,comment,3761954,3761954,9,0,KenCochrane,,,"Here is a video about it from this years Pycon.<p><a href=""http://youtu.be/9G6-GksU7Ko"" rel=""nofollow"">http://youtu.be/9G6-GksU7Ko</a>",1332863789
3762196,story,,,80,61,taylorbuley,"Google Drive: Finally coming this April",http://gigaom.com/cloud/google-drive-finally-coming-this-april/,,1332863784
3762195,comment,3761773,3761773,1,0,webjunkie,,,"Ugh, this guy got APNS wrong. An app never needs to register a device with Apple. It's not Apple who sends something, it's still the developer via APNS.",1332863784
3762194,story,,,2,0,blazer7486,"What Fashion Sites Can Learn from Video Games",http://www.fashinvest.com/experience-doom-first-person-fashion/,,1332863777
3762193,comment,3761013,3761533,2,0,invalidOrTaken,,,"I think this will become a more and more common problem, especially in our field.  Things move so fast that if you're just <i>trying</i> to keep up, you'll soon find yourself the most knowledgeable on the subject in your local area.  This is great if you want to sound impressive, but not so great if you're trying to learn.<p>The best option is of course to find a Kimo.  Failing that, getting really good at interacting with people online might be the best option; if you're learning something independently,  you're probably learning it online, and if you're learning it online, then other learners(however few) are only a click away.",1332863776
3762192,comment,3761263,3761601,1,0,vertex-four,,,"Mozilla are trying to push their BrowserID on the world though. A fairly popular (among devs) technological demo seems like the right place to start that; it'd show us how easy it is for users to use, and how simple it is to integrate. Not using it is a wasted opportunity.",1332863763
3762191,comment,3761725,3761725,2,0,rjurney,,,"Awwwwwww yeah!",1332863762
3762190,comment,3761289,3761289,2,0,yesimahuman,,,"Cool. One of my last big projects was to build an MMO on the web. No flash, and we used Cometd: <a href=""http://play.parallelkingdom.com/"" rel=""nofollow"">http://play.parallelkingdom.com/</a>, <a href=""https://chrome.google.com/webstore/detail/lindbaaodgocnekppljikhgdgedliclg"" rel=""nofollow"">https://chrome.google.com/webstore/detail/lindbaaodgocnekppl...</a>",1332863751
3762189,comment,3758465,3759417,2,0,robertskmiles,,,"It's not that government-enforced monopolies on copying or using certain pieces of information are never justified, just that they aren't property.<p>Your right to drive as indicated by a driving licence is not 'property', your planning permission for a building is not 'property', your FCC permission to use a particular part of the EM spectrum is not 'property'. And your right to make copies of a particular piece of information isn't 'property' either. These are all abstract legal rights/privileges.<p>If you drive without a licence, broadcast in a band reserved for someone else, or copy a copyrighted work, then you are 'driving without a licence', 'breaking FCC regulations', and 'infringing copyright', respectively. Calling any of those things stealing is inaccurate, which is the kind of mistake you end up making if you think of them as property.",1332863741
3762188,comment,3760709,3761603,12,0,felipemnoa,,,">>At this point, I get the nasty feeling that many people who preach ""don't ever rewrite"" mantra are the people who have produced large volumes of code in the past, but consider themselves too ""senior"" to maintain it now. The common rhetoric regarding ""young/junior programmers"" only confirms that notion.<<<p>I imagine the real reason is because the senior people have been burned to no end by trying to rewrite code they themselves did not understand.",1332863699
3762185,comment,3761263,3761263,3,0,pepijndevos,,,"Did anyone figure out how to get to the mario pipe, and what the ??? quest is?",1332863690
3762184,comment,3762164,3762164,1,0,bdr,,,"The video worked for me in FF but not Chrome on Mac.",1332863684
3762183,comment,3762168,3762168,1,0,holycrab,,,"Watching TV",1332863681
3762182,comment,3760460,3761864,1,0,swah,,,"Thanks guys, this kind of discussion is why I open HN every day for the past few years.",1332863638
3762181,comment,3761876,3761876,1,0,binarymax,,,"My two: Bluefish(on Ubuntu) and Textpad(on Windows) never seem to show up on these lists.",1332863634
3762180,comment,3762168,3762168,1,0,holycrab,,,"Reading magazines",1332863634
3762179,comment,3761876,3761876,2,0,martinp,,,"Somewhat language dependent. IntelliJ IDEA for Java stuff. Vim for everything else.",1332863634
3762178,comment,3762168,3762168,1,0,holycrab,,,"Checking emails",1332863620
3762177,comment,3758963,3760803,1,0,samstave,,,"I thought users had to buy buttons for $1. That is what it said in the article...<p>But the article was poorly written, so I am not sure if I was missing something.",1332863596
3762176,comment,3761495,3762134,2,0,hamey,,,"Thanks for posting, back up now ;-)",1332863589
3762175,story,,,64,25,akg,"Memepool is back, after 4yr hiatus",http://memepool.com/,,1332863573
3762174,comment,3761495,3761495,2,0,hamey,,,"Site back up after a hefty Linode upgrade, thanks for your patience y'all.",1332863569
3762173,comment,3760583,3761860,2,0,roc,,,"It read to me as a bit of both. He had reservations (who wouldn't) but he'd also already had the taste for working for himself.<p>So he's simultaneously got a reminder that his own work is important to him, a bit of breathing room from his chunk of the buyout and an opportunity to start off with a bit of a ""bang"" PR-wise.<p>What entrepreneur would pass up on that?",1332863568
3762172,comment,3761495,3761928,2,0,freehunter,,,"I was frustrated by the new word choices popping up after quitting, actually. I had a pretty awesome drawing, the app crashed, and the new choices were pretty lame.<p>Minor quibble, I know, but it does seem odd that you get new choices just by quitting when they really want you to pay for them.",1332863549
3762171,comment,3761876,3761876,1,0,simonsarris,,,"I am taken by surprise that I am the only one so far it seems, in this topic and the one from nine days ago, that uses Programmer's Notepad.<p><a href=""http://www.pnotepad.org/"" rel=""nofollow"">http://www.pnotepad.org/</a><p>I always figured it was fairly popular. Many compare it to Notepad++, which has many points here but I have never used.<p>Therefore I will check out Notepad++, though I urge Notepad++ users to check out Programmer's Notepad!",1332863546
3762170,comment,3762168,3762168,1,0,holycrab,,,iPad,1332863526
3762169,comment,3762079,3762079,1,0,carlos,,,"I've been using this online training for long time already. I would say it's not only for beginners but also for intermediate levels too. It covers many different guitar styles.
During this long time I've seen how the page positively evolved and I'm happy to see how one person (justin) which is doing a superb job in giving those lessons for free is getting more and more attention. This is in my opinion a good example of how perseverance, free content and love for what you do can at then end pay back with a very good reputation from users and I guess good money with the selling of same free online content but as DVDs,books, etc",1332863511
3762168,story,,,1,6,holycrab,"Poll: How do you spend your time in the bathroom?",,,1332863511
3762167,comment,3762049,3762049,2,0,bdr,,,"I haven't applied to a stealth-mode startup in a while, but yes, last time I did I was asked to sign an NDA.",1332863501
3762166,comment,3760274,3760983,2,0,rdl,,,"Care to describe this in more detail?",1332863500
3762165,comment,3758047,3758692,1,0,analyst74,,,"Also mentioned in the article:<p>""were seeing them with light that left them shortly after the Universe itself formed.""<p>That means, there could be a lot more, but their light has not travelled to earth yet.",1332863486
3762164,story,,,13,2,iamwil,"James Cameron's first footage from the deep",http://www.telegraph.co.uk/earth/earthvideo/9168817/James-Camerons-first-footage-from-the-deep.html,,1332863474
3762163,comment,3760274,3762008,2,0,mgkimsal,,,"you'd think so, but it probably doesn't make much of a difference.  The london driving tax was supposed to make a difference, and I don't think it did much - there's not enough good alternatives.",1332863458
3762162,story,,,2,0,janedidi,"Brain Scans are Revealing the Neuro-Anatomy of Intelligence",http://ieet.org/index.php/IEET/more/pellissier20120327,,1332863453
3762161,comment,3760382,3761521,2,0,freehunter,,,"Ah, that was not immediately obvious to me that both Darwin and Turing would be on the note. I could see them both being there as progressive scientists. Here in the US, we only have one person (usually a former president) on our notes, and a reminder of our religion on the back.<p>So, leg up with Darwin already.",1332863444
3762160,story,,,1,0,venturefizz,"Check out Brightcove's new offices in Boston [slideshow]",http://venturefizz.com/slideshow/brightcove-office-tour-slideshow,,1332863443
3762158,comment,3760633,3760633,1,0,Techcited,,,"It's nice to have an inside perspective on what makes an accelerator tick.",1332863434
3762157,comment,3761495,3761633,1,0,prostoalex,,,"Yeah, but is it a deal breaker? The comparison is between Draw Something and Words with Friends, which does have a back button, but also a gazillion of users <a href=""http://www.insidesocialgames.com/2012/01/23/hidden-chronicles-words-with-friends-top-this-weeks-list-of-fastest-growing-facebook-games-by-mau/"" rel=""nofollow"">http://www.insidesocialgames.com/2012/01/23/hidden-chronicle...</a> It seems to be a minor detail.",1332863433
3762156,comment,3761512,3761512,2,0,zyb09,,,"well it's kind of an official feature on Nexus phones, there's a script to unlock it on the phone, you just gotta execute it. So what more exactly do you want? Besides that I don't even know why a normal user would want root access, even I only use it on a dev phone to quickly flash another ROM to test my App in different Android OS versions. For people wanting to get rid of branding etc., they should just stop buying carrier customized crap. You can get vanilla devices at Amazon, or just get an iPhone or Nexus, it's not that hard. If they aren't capable of doing some basic research before purchasing a product, I don't think giving them root access to their phone would end well.",1332863432
3762155,story,,,22,3,bdr,"The Google We Lost",http://andrewbadr.com/log/16/the-google-we-lost/,,1332863408
3762154,comment,3761595,3761595,15,0,raghus,,,"30 seconds? Vic Gundotra's post on the page says <i>Google I/O has officially sold out! It took just a bit over 20 minutes!</i>",1332863405
3762153,comment,3761876,3762127,2,0,phatbyte,,,"<a href=""http://www.sublimetext.com/docs/2/vintage.html"" rel=""nofollow"">http://www.sublimetext.com/docs/2/vintage.html</a>",1332863404
3762152,comment,3762062,3762123,1,0,doodleskull,,,agree,1332863394
3762150,comment,3761595,3761595,2,0,00joe,,,"I hope you all get chromebooks, hahaha.",1332863374
3762149,story,,,8,4,jsaunders,"Show HN: A site for code reviews",,"Create a review as you would on pastebin, then any line in a review can be clicked to leave a comment. Comments appear under the line they reference and can be hidden by clicking the red tabs on the left or right. You can optionally toggle all comments by clicking the speech bubble at the top of the review. You don't have to have an account to create a review or leave a comment.<p>I plan on adding multi-file reviews as well as version control access in the next few releases. After that I plan on making some IDE plugins to allow users to send code directly to the site via their IDE.<p>Let me know what you think. (I haven't done a lot of IE testing yet so there could be some issues there)<p>https://codetique.com",1332863374
3762148,comment,3761512,3761559,3,0,ajross,,,"This argument is a tautology.  ""Power users"" are just a synonym for people who want stuff not in the default.  To the extent that the default installation lacks desired features (wifi hotspots are a good example) we are all ""power users"".<p>But yes: gaming, browsing and texting don't require it.  And a big portion of the user base never leaves that box.",1332863373
3762147,comment,3760275,3760496,1,0,snth,,,"You trust?  Unfortunately, unless something is put in place that makes it clear this is intended (in the site guidelines, or by changing the down arrow to something else), this won't change.",1332863370
3762146,comment,3761872,3761923,1,0,youssefs,,,"For instance, at present Facebook makes just shy of $5 per user per year.<p>I think $1 per month could be reasonable, Spotify charges 5 - 10 times that. The idea is that you're changing the priority from building an amazing ad network to building an amazing social network.<p>The things that are good for users are nearly always bad for advertisers. Such as total privacy.",1332863363
3762145,comment,3761876,3761876,1,0,evo_9,,,"If you haven't tried Sublime Text 2 yet, give it a go. Once you get the hang of installing packages and customizing it, you'll be hooked. It's a pretty incredible package.",1332863351
3762144,comment,3761013,3762005,6,0,sivers,,,"I was wondering that myself!<p>So I wrote my first Android app, to track every minute of every day.  See <a href=""https://github.com/50pop/NowNowNow"" rel=""nofollow"">https://github.com/50pop/NowNowNow</a> if interested.<p>Most of my time these days is spent studying some new programming languages and techniques (Ruby, Rails, Sinatra, Sequel, JavaScript, jQuery, Backbone).  Less time spent turning that learning into real creation. Soon... soon....",1332863349
3762142,story,,,31,24,bergie,"Show HN: WYSIWYG-editing Markdown with Hallo Editor",http://bergie.github.com/hallo/markdown.html,,1332863341
3762141,comment,3761743,3762052,5,0,fxn,,,"Indeed, it took me some 24 hours to revert. I reflected about it for some time.<p>After thinking about it for a day, I was convinced the commit was sending the wrong message, and felt it had to be reverted. The commit message explains the rationale.",1332863333
3762139,comment,3761512,3761963,3,0,unkoman,,,"That's a very america-centric view of things. Europeans who buy phones for a couple of 100 euros instead of investing in a life long relationship with a provider sees things differently.",1332863319
3762138,comment,3761013,3761956,2,0,jedc,,,"I can only imagine they're a YC startup, based on the people I see active there after I registered.  (PG, JL, other YC partners)  With Demo Day today, things are picking up PR-wise. :)",1332863302
3762137,comment,3761495,3762093,2,0,afterburner,,,"""or watching it be drawn""<p>I believe there's a skip button? Never tried pushing it, though.",1332863297
3762136,comment,3761725,3761725,1,0,JAVagueArgument,,,"I built something similar (in Ada O_o) when I worked at Blockbuster video 12 years ago... until today I have been amazed that IMDB haven't done this.<p>Gratz, I will start using it when I get home :)",1332863286
3762135,comment,3761876,3761876,1,0,pandemicsyn,,,"Vim mostly. Chocolat Sometimes.",1332863284
3762134,comment,3761495,3761495,1,0,carlsednaoui,,,"For those having a hard time getting to the article.<p><copy><p>1. Watching friends screw up is fun<p>This is genius. Draw Something combines the benefits of asynchronous gameplay (easier to play with friends instead of strangers because they dont have to be online) with the benefits of synchronous gameplay: watching the action in quasi-realtime. Watching your friends painfully draw a crude Tom Hanks stroke-by-stroke is just good ol fashioned fun. Even better, this acts as an indirect communication channel for users to write messages and clear the screen before starting the actual drawing.<p>2. There isnt a freaking back button<p>When you tap on a game to have a turn, there is literally no way back. You are forced to complete the turn before you can view your other games. Given most players have a lot of games on the go, they are keen to get back to the home screen and see who is ready to play. If you play Words With Friends, how many times have you tapped on a game, not thought of a move then tapped back to try another game? Draw Something forces you through the turn which keeps the whole machine ticking over faster.<p>3. Play for seconds or hours<p>The amount of time you want to dedicate to playing is completely variable. If you are waiting in a queue you can spend 10 seconds drawing a quick move on a single game. If you really want to knuckle down, you can slave over every pixel for 20 games and spend hours playing it. This is vital for a mobile casual game to fit into all sorts of time-killing / entertainment situations.<p>4. Natural encouragement to start new games<p>You just finish 5 moves and are waiting on everyone to have their turnwhat do you do? Start another game of course! Why wouldnt you when you can see all those other fun Facebook friends are ready to play?<p>5. Cooperative playing where scoring actually doesnt matter<p>Most game developers spend a huge amount of time trying to tune scoring systems and get the balance right. In Draw Something its all kinda a bit vagueand thats a good thing. If you are really into scores, you can dive into it. Most regular players just have fun guessing drawings from their friends (and maybe getting a decent streak). You are essentially working together, which can be a lot less intimidating for people who are worried about not being good at games.<p>6. Virtual ice breaker with Facebook crushes<p>Seriously, dont tell me you didnt start a sneaky game with that guy/gal you dont really know but thought why not. Given the tight Facebook integration, it makes it socially acceptable to start a game with someone on the outer edge of your social circle. Because there isnt a chat option, it forces you to communicate purely through drawing which can be far less awkward.<p>7. Words are taken from pop culture<p>Rather than just ripping a bunch of words straight from the dictionaryyou end up drawing things like Lady Gaga or Dubstep. Far more stimulating!<p></copy>",1332863279
3762133,story,,,3,0,evo_9,"""Siri, does anyone still use you?"" Yes, says survey",http://arstechnica.com/apple/news/2012/03/siri-does-anyone-still-use-you-yes-says-survey.ars,,1332863274
3762132,comment,3761512,3761963,1,0,ajross,,,"Not a great example.  Samsung phones all (AFAIK, though I'm sure exceptions must exist) have a bootloader that allows unauthenticated booting and reflashing to arbitrary code.  ""Rooting"" a phone with Odin/Heimdall is generally straightforward.  They're easily the <i>most</i> open of the Android hardware vendors.",1332863232
3762131,comment,3761876,3761876,1,0,swah,,,"I use Sublime Text, but I miss Emacs every day (you can't really extend ST2...)",1332863194
3762130,story,,,1,0,dohertyjf,"The Difference Between Winners and Losers",http://www.johnfdoherty.com/difference-winners-losers/,,1332863180
3762129,comment,3761013,3761956,2,0,mds101,,,"I believe the difference is you ask a question to a specific person. And all these questions and answers are laid out on a single page in a nice interview style. And considering that most of the guys being asked and those doing the asking are all pretty smart guys, it makes for super interesting reading. Not that you would get any of that from their landing page though. Read the page for Patio11 to get an idea of how great it is.",1332863173
3762128,story,,,20,14,aritraghosh007,"Google Pushes Play Front And Center",http://techcrunch.com/2012/03/27/google-play-hits-navbar/,,1332863172
3762127,comment,3761876,3761876,3,0,phatbyte,,,"Sublime 2 + Vim package. You get best of both worlds",1332863171
3762126,comment,3761876,3761876,1,0,DodgyEggplant,,,"Please add Wing IDE",1332863169
3762125,story,,,1,0,amrik,"Choosing A Right Blog Hosts - Part-1",http://www.monetizeblogging.com/choosing-a-right-blog-hosts.html,,1332863161
3762124,comment,3761289,3761873,10,0,masklinn,,,"> simple games like Dwarf Fortress<p>Simple like <i>DF</i>?",1332863121
3762123,comment,3762062,3762062,1,0,lhorie,,,ship,1332863098
3762122,comment,3761876,3761876,2,0,functionform,,,"Interesting, no Textpad?",1332863095
3762121,comment,3761512,3761963,3,0,runjake,,,"And for those not in the know, this is literally how the conversation takes place. Which is why there isn't a default option to root.<p>Change will require a (major) disruption.",1332863089
3762120,comment,3761040,3761040,1,0,ThomBot,,,"I think two important metrics are being left out of the author's perspective:<p>1. What value do I assign to my personal free time?<p>2. Does my purchase have the ability to save me time?<p>For instance, a cup of coffee will cost me 15 minutes of my salaried time PLUS 15 minutes of my personal time (to drive, order, pay, etc). However, perhaps I am a writer and the coffee and coffeeshop environment will help me accomplish 2 hours of writing in 90 minutes. Then the whole thing is a wash.",1332863076
3762119,comment,,3761876,0,0,duaneb,,,pico,1332863074
3762118,comment,3761289,3761289,1,0,pkmiec,,,"what's the ??? quest?",1332863061
3762117,comment,3757336,3759571,1,0,jagbolanos,,,"I'm currently using Parse for data and S3 for file storage. I will give it a try to PFFile in another project to see how it works.",1332863055
