ID,Type,Story,Parent,Points,Comments,Author,Title,URL,Content,Created
3762033,story,,,2,0,joeyespo,"Publicly available large data sets for database research",http://lemire.me/blog/archives/2012/03/27/publicly-available-large-data-sets-for-database-research/,,1332862330
3762032,comment,3761876,3761876,1,0,jiggy2011,,,"What, no option for the original nodepad or what about DOS edit?",1332862327
3762031,comment,3761112,3761112,5,0,nanijoe,,,"Thanks for sharing..I went through all 110 slides, even though I started out meaning to see only the first few.",1332862319
3762030,comment,3757881,3761732,1,0,fehguy,,,"We tried out enunciate as well.  It's good but didn't quite fit our needs...<p>You can run swagger with the built-in support via swagger-core/swagger-jaxrs.  Play 1.4/2.0 support is there as well and a number of folks are creating support for other server frameworks.  See the samples for integration:<p><a href=""https://github.com/wordnik/swagger-core/tree/master/samples"" rel=""nofollow"">https://github.com/wordnik/swagger-core/tree/master/samples</a><p>But to be honest, you can run the whole system with static files and zero server integration.<p>The downside of using javadocs is that you need to expose sourcecode/docs.",1332862313
3762029,comment,3761263,3762003,2,0,abraham,,,"There are active websocket connections.",1332862299
3762028,story,,,1,0,packing321,"Package services,packing company",http://www.packingserviceinc.com/professional_packing_services_company.php,"Professional Package Services Company, Save Money Moving!  Let Our Packers Pack and Load Your PODS Container or Rental Truck. Flat Rate Quotes 888-722-5774.",1332862290
3762027,story,,,133,9,kohlmeier,"Bayes nets by example with Python and Khan Academy data",http://derandomized.com/post/20009997725/bayes-net-example-with-python-and-khanacademy,,1332862290
3762026,comment,3761750,3761750,4,0,unignorant,,,"Another suggestion (from my blog):<p><a href=""http://ethanfast.com/2011/10/deconstructing-a-successful-yc-application/"" rel=""nofollow"">http://ethanfast.com/2011/10/deconstructing-a-successful-yc-...</a><p>Hadn't heard of Kippt before, but it looks useful.",1332862289
3762024,story,,,1,0,bproper,"Apple faces legal challenge in Australia of 4g label",http://www.washingtonpost.com/business/technology/apple-faces-australian-legal-challenge-over-4g-label/2012/03/27/gIQAiLB3dS_story.html,,1332862288
3762023,comment,3761013,3761934,1,0,sivers,,,"(1) I'm torn on Rails. It's so so so SO much ecosystem to learn just to make a basic web app. I find that I'm much more attracted to Sinatra. Also I prefer Sequel to ActiveRecord. Also, I really want to try playing with the architecture of a JSON REST API back-end and a JavaScript front-end (like Backbone.js).  So for that, it seems Sinatra + Sequel suits me better.  I'm trying this way for now, and if it doesn't work out, I'll commit a few hundred hours to learning Rails whole ecosystem.  (Then I guess keeping up with it constantly.)<p>(2) Oooh. Good question. It wasn't advice that made the difference. It was a style of teaching. Standing above me, pushing me further than I knew, but somehow still on the edge of my abilities. Making me figure things out for myself instead of giving me the answer.<p>The closest I've seen someone come to systemizing it is Code School : <a href=""http://www.codeschool.com/"" rel=""nofollow"">http://www.codeschool.com/</a><p>I love that style of ""here's a little info, now figure out this problem.""",1332862281
3762022,story,,,2,0,taylorbuley,"Mozilla calls for tighter controls on sub-CAs",http://www.h-online.com/security/news/item/Mozilla-calls-for-tighter-controls-on-sub-CAs-1484643.html,,1332862277
3762021,comment,3761263,3762003,4,0,jiggy2011,,,"Ah, It's websocket with load balanced nodejs servers.",1332862268
3762020,comment,3761263,3761263,18,0,user2459,,,"Really organized, easy reading source too: <a href=""https://github.com/mozilla/BrowserQuest"" rel=""nofollow"">https://github.com/mozilla/BrowserQuest</a><p>Outstanding work that I'm sure is going to inspire a lot of people. Though I don't see a license file anywhere.",1332862265
3762019,comment,3761761,3761761,2,0,lucian1900,,,"Very interesting. I've pondered building something similar when I needed client-server replication for a project, but for that it ended up being easier to just use Backbone.js and a server-side API written in Python.",1332862260
3762018,comment,3761013,3761526,3,0,leilasworld,,,"Derek in a strange twist I find myself here for the first time.  I don't even know what ""hacker news is"" but in my ""go with the flow"" state of mind I thought I'd click through a link. I've read the comments below and in reference to your not wanting to ""top cdbaby"" I would say that you exude such carefree joy, such an ""anything is possible"" vibe that I'm sure any business venture you embark on will succeed! I remember meeting you years ago at a music conference in New York. You had such a likeable, warm magnetism, it was YOU that I bought into and not CDBABY per se, because I instantly felt that you were an honest, trustworthy ""positive energy"". So I thank you deeply! I have a challenge I would love your perspective on.  In the area of financial flow, I've come to believe I somehow have a block that is impeding it.  I have read insane amount of books on the subject and through alot of intropection, believe this may be the case. HOWEVER...when I see someone who has been successful in this area such as yourself, I wonder, did you always feel finanically abundant, or worthy of it or somehow knew that it would all fall into place? Can you offer any thoughts on getting oneself to a place where you believe it is possible for yourself as you ARE creating something worthy and beautiful? Continued blessings, Leila",1332862258
3762017,comment,3746557,3747256,1,0,jlvarner,,,"While not at an industry level, which I agree would be interesting analysis. There is some research indicating at the group level, in general, women do have a beneficial influence: <a href=""http://www.sciencedaily.com/releases/2010/09/100930143339.htm"" rel=""nofollow"">http://www.sciencedaily.com/releases/2010/09/100930143339.ht...</a><p>But I think there are two aspects of including more women, or any other underrepresented group, in tech. One is what you mentioned in regard to pushing the state of the art, but the other is providing service to different sectors of the population.<p>If the primary thing you need as an entrepreneur is to understand the needs and wants of your audience, there's only so far I can go before it's at best a purely intellectual understanding. Same thing with small startups, if they are growing out of scratching my own itch, the lack of women means needs specific to them are much less likely to be addressed.",1332862250
3762016,story,,,1,0,evo_9,"The Xfund, Harvard, And The Student-Entrepreneur",http://www.fastcompany.com/1826202/experiment-fund-xfund-harvard-university-education,,1332862250
3762015,comment,3761773,3761903,1,0,jobert,,,"You're right -- this is not only a problem on Apple's side, both Apple and app developers can take measurements to prevent this from happening. On Apple's side this requires fundamental changes in their (un)subscribe mechanism, but that's not likely to happen soon. Therefor, an app developer can implement best practices to ensure this doesn't happen. For example, blocking the UI with an activity indicator until the app receives OK from the APNS when firing the unregister request.",1332862249
3762014,comment,3761040,3761471,1,0,randomdata,,,"I have always thought about my purchases this way, but consider it an additive labour cost. i.e. Do I really want to work an <i>additional</i> four weeks worth of work on top of what I am already doing for this TV? The answer is almost always no. Even for small items, where I could realistically work it off in minutes, the answer is still often no.<p>Also, whenever possible, I try to employ the two year rule: If I still want something after two years, it is probably worth purchasing. If I have forgotten about it, I would have forgotten about it in my possession as well.",1332862207
3762013,comment,3761013,3761487,3,0,karterk,,,"Have you tried hanging out in the node.js IRC channel? Help is just a step away! The node mailing lists are also pretty helpful.<p>You can also feel free to email me (email in profile) - I have been working on node for more than a year now on a decent sized project.",1332862201
3762012,comment,3760709,3761419,2,0,memset,,,"No offense taken! Good discussion overall :)",1332862190
3762011,story,,,1,2,eureka,"Gen Y vs Gen X",,"I'm seeking a programmer and am curious about your opinion regarding gen y vs gen x. Is there more potential in a gen Y programmer who is inherently a muli-tasker, open to unconventional ideas and creativity or is an experienced gen x more reliable having the knowledge of trial and error. Does a baby boomer even have the running in this game?",1332862189
3762010,story,,,2,0,udp,"GTK+ 3.4.0 released",http://article.gmane.org/gmane.comp.gnome.announce/10292,,1332862172
3762009,comment,3760317,3760632,1,0,wpietri,,,"Yes. One can only understand the design space by exploring it.",1332862165
3762008,comment,3760274,3761964,2,0,kamjam,,,"<i>Yes, we can slow down the rate at which the rate of growth grows</i><p>Yes, in the UK it's called taxing the hell out of everything. Petrol is now £1.42 a litre. That's right, A LITRE. That's about $8.50 a gallon. That'll make people use their cars less and move to more efficient vehicles very quickly.",1332862159
3762007,comment,3761814,3761814,5,0,kijin,,,"John: People don't have archememies.<p>Sherlock: What?<p>John: In real life. People don't have archenemies.<p>Sherlock: That sounds a bit dull. See, in Facebook, I can have as many archenemies as I want!",1332862123
3762006,story,,,1,0,thejteam,"How the Smithsonian Screwed Up Its Video Game Exhibition",http://www.npr.org/blogs/monkeysee/2012/03/26/149394361/how-the-smithsonian-screwed-up-its-video-game-exhibition,,1332862121
3762005,comment,3761013,3761155,3,0,kamaal,,,"How do you manage your time and track your productivity. If its not too personal can you give us a framework of your daily time table.",1332862117
3762004,comment,3758654,3759350,1,0,jeromegn,,,"By the way, this is being actively developed: <a href=""https://github.com/jeromegn/Backbone.localStorage"" rel=""nofollow"">https://github.com/jeromegn/Backbone.localStorage</a>",1332862097
3762003,comment,3761263,3761263,3,0,jiggy2011,,,"Anyone know how they do the networking?<p>Websock , Comet or ajax?",1332862081
3762002,comment,3761013,3761622,4,0,whyleyc,,,"Practice ""Zen Navigation"" - <a href=""http://c2.com/cgi/wiki?DirkGentlyNavigationMethod"" rel=""nofollow"">http://c2.com/cgi/wiki?DirkGentlyNavigationMethod</a>",1332862081
3762001,story,,,1,0,dminor,"Remind HN: Free Caltech Machine Learning Class Open for Registration",,http://work.caltech.edu/telecourse.html,1332862081
3762000,comment,3761013,3761013,2,0,S_A_P,,,"Derek,<p>One thing I have noticed about many of your blogs/talks is that you have an innate sense of optimism.  Is this a learned trait of yours or was this something you picked up as you made your way through life and found success?  While I dont feel that I am a pessimist, I do wish I could improve my sense of optimism/anything is possible with work/focus.  Any tips?<p>Thanks and I always enjoy your posts.",1332862080
3761999,story,,,1,0,wicknicks,"WalmartLabs is building big data tools — and will then open source them",http://gigaom.com/cloud/walmart-labs-is-building-big-data-tools-and-will-then-open-source-them/,,1332862065
3761998,story,,,2,0,LindseyRenee,"Lazy Grief",http://lindseyreneegrace.wordpress.com/2012/03/27/lazy-grief/,,1332862065
3761997,comment,3761743,3761841,4,0,rohitarondekar,,,"Try to get into a bugmash of some kind. I started this way with Rails and I wrote about it <a href=""http://www.rohitarondekar.com/articles/my-first-rails-bugmash"" rel=""nofollow"">http://www.rohitarondekar.com/articles/my-first-rails-bugmas...</a><p>Many companies and tech groups have these around the world during meetups and conferences.<p>But most importantly dont let this pull request fool you. Rails is nice to contribute to even if you are starting out and the rails core team especially jose valim and santiago pastorino are super helpful.",1332862063
3761996,comment,3761743,3761922,6,0,lucisferre,,,"Fair enough, I wont argue with your elastic defence ;).",1332862057
3761995,story,,,1,0,acak,"Angry Birds 'Space' app tops 10 million downloads",http://www.telegraph.co.uk/technology/news/9169117/Angry-Birds-Space-app-tops-10-million-downloads.html,,1332862028
3761994,story,,,1,0,evo_9,"Analysis: iPad battery allegations unwarranted",https://www.macworld.com/article/1166074/analysis_ipad_battery_allegations_unwarranted.html,,1332862017
3761993,comment,3761046,3761126,2,0,bradleyland,,,"There's a greater lesson in all this discussion. Great ideas can be stifled by the limitations of knowledge. That is to say, if you ""know"" that an idea cannot work, you may not explore it. However, if you know nothing about the principles that limit a field, you can't even begin to postulate solutions, because you can't see that an idea is as absurd as putting the cart in front of the horse.",1332862001
3761992,comment,3761263,3761748,5,0,masklinn,,,"No issue on iOS 5.1 here (on a 4S)",1332861993
3761991,comment,3760382,3760874,1,0,rmc,,,"The UK is considerable less religious than the USA. The UK Conservative Party (i.e. the right wing party), are in favour of open, equal marraige. The current Conversative Prime Minister has stated he supports gay marriage because he's a conservative. The established church of the UK (sort of the Church of England (also Church of Ireland, Church in Wales, Scottish one who's name I've forgotten)), has gay bishops.",1332861988
3761990,comment,3761013,3761608,2,0,whyleyc,,,"Thanks for answering, looks like you have some interesting projects on the go.<p>My favourite was <a href=""http://50pop.com/karmalist"" rel=""nofollow"">http://50pop.com/karmalist</a> if only because someone needs to kill Yelp !<p>An open source, non company-controlled business review service is a killer proposition. The challenges will be how to incentivise users to submit reviews to the service (what's their motivation ?) and how to successfully moderate extreme or unhelpful reviews in a scalable manner.",1332861987
3761989,comment,3760447,3761808,2,0,rbehrends,,,"> In the second paragraph of the first page the author subtly suggests that she is the greatest mathematician as well as the greatest physcicist (at least a bunch of her contemporaries, who are smarter than you, the reader, thought so).<p>This isn't quite what it says. That paragraphs talks about her being the most significant and creative <i>female</i> mathematician of all time, and attributes it to Einstein. That's a significant weaker statement, given how few women mathematicians there were before modern times.<p>Conversely, if the article had described her as the greatest mathematician and greatest physicist of all time, that would be a massive overstatement, of course.<p>What I was trying to get at here (and what Einstein probably was trying to convey to a lay audience, too) was that she was very (probably critically) important for the development of early 20th century mathematics, when many of the foundations of how we do mathematics today were laid, and that this was the case regardless of her gender.",1332861973
3761987,comment,3760274,3761833,3,0,kamjam,,,"Stupid and superficial is very relative and means very different things to different people.<p>Facebook, Amazon, iTunes, iPads etc etc... all very stupid and superficial when you don't know where your next meal is coming from. But the West will happily preach on to the less developed nations to use inefficient methods of power generation which are still very expensive tech when they themselves have not been able to solve the problems associated with cheaply mass producing power using that same technology.<p>It's going to be interesting to see how all these technology develops, no doubt at least some of it will filter done to mass produced consumer goods. Hopefully some of the profits will go towards helping the poorer nations develop their tech.",1332861950
3761986,comment,3761595,3761657,4,0,BHSPitMonkey,,,"For what it's worth, the Google Android team (as well as many other Google dev teams) host weekly ""Hangouts"" on Google+  where you can ask questions.  They call them ""Office Hours"", and you can find the list here:<p><a href=""https://developers.google.com/events/"" rel=""nofollow"">https://developers.google.com/events/</a><p>Oh, and of course all the I/O talks will be livestreamed and then posted to YouTube.",1332861946
3761985,comment,3761289,3761776,1,0,manuscreationis,,,"Awesome, thanks!",1332861935
3761984,comment,3761743,3761904,7,0,bradleyland,,,"This happens all the time, and I'd argue, is the source of what many consider bike shed issues, even when they're not.<p>An essential element of a bike shed disagreement is that the matter being discussed must be trivial. That is, the color of a bike shed doesn't matter. It has no impact on the utility of the bike shed. This is a function before form viewpoint.<p>Ah, but if real life were only so black & white.<p>In practice, triviality is a sliding scale. The presence of the offset is only trivial if you're not using it. So, to some people, it's a bike shed issue. To others, it's a matter of breaking lots of code. Clearly not a bike shed.",1332861918
3761983,story,,,1,0,awnstudio,"Free Event, Meeting and Collaboration Service",http://www.surveybuilder.com/s/LKbJsWGcgAA,,1332861915
3761982,comment,3761013,3761703,9,0,EvilTerran,,,"Yeah, that ""I have no innate abilities"" line didn't quite sit right with me -- there's <i>one</i>, at least. My first thought there was ""attribution error"".",1332861914
3761981,comment,3761913,3761913,1,0,Sword_Monkey,,,"Any attempt at interstellar travel in the near-future is likely to be pointless only because humanity will likely invent a faster way of travelling between stars before the first mission is completed.<p>Why send a craft toward the nearest star if it'll take the thing a hundred years when in a decade we might be able to halve that time? Only once we've gotten to grips with local space travel, and really pushed the limits of speed will we be able to appraise an attempt at interstellar travel.<p>And hey we might figure out faster-than-light one day, we've surprised ourselves before, no reason we can't do it again.",1332861911
3761980,story,,,1,0,Shan786,"Fund a TextOnly Browser for iPhone",http://www.indiegogo.com/TextOnly-Browser?a=447051,,1332861910
3761979,comment,3760382,3760382,2,0,geekam,,,"Let's start similar petition for Donald Knuth in the US.",1332861906
3761978,comment,3761595,3761595,2,0,eslaught,,,"The real number was 20 minutes: <a href=""https://plus.google.com/107117483540235115863/posts/iyc4arLjidR"" rel=""nofollow"">https://plus.google.com/107117483540235115863/posts/iyc4arLj...</a>",1332861904
3761977,story,,,1,1,longzheng,"Been working on a Twitter client for Windows that doesn't suck",http://www.metrotwit.com/,,1332861892
3761976,story,,,2,0,JayInt,"Ask HN: Is anyone using OS OpenData",,"http://www.ordnancesurvey.co.uk/oswebsite/products/os-opendata.html<p>Free Geo data for the UK.. but is it any good<p>Google maps has strict rules on using their geolocator (has to be ONLY for use with displaying points of google maps)",1332861890
3761975,comment,3761263,3761681,5,0,groovecoder,,,"That's an interesting argument against HTML5 apps. If I really want to copy your Flash app, I'll just start at <a href=""https://www.google.com/search?q=flash+decompilers"" rel=""nofollow"">https://www.google.com/search?q=flash+decompilers</a>",1332861869
3761974,comment,3761595,3761595,3,0,runjake,,,"The article the submitter links to says it sold out in 20 minutes, not 30 seconds.",1332861840
3761973,story,,,1,0,nicleflee2,"Nike Free 7.0 V2 Men's Shoes In Black / Gray / Orange - $52.68 : Nike Free Run",http://www.nikefreerun2shoesuk.com/nike-free-70-v2-mens-shoes-in-black-gray-orange-p-40.html,"Cheap Nike Free 7.0 V2 Men's Shoes In Black / Gray / Orange on sale, save up to 64%, buy cheap Nike Free 7.0 V2 Men's Shoes In Black / Gray / Orange at nikefreerun2shoesuk.com, enjoy it!",1332861837
3761972,comment,3761750,3761750,2,0,WadeF,,,"<a href=""http://www.guidetoyc.com/"" rel=""nofollow"">http://www.guidetoyc.com/</a> is pretty good. Nice collection of articles found there as well.",1332861829
3761971,comment,3761595,3761595,4,0,jellomaster,,,"devsite.registration.checkWaitListStatus = function (a) {\n    var b = ""/events/register/waitlist/status/"" + devsite.registration.waitListKey + ""/"";\n    $.get(b, function (b) {\n        var d = b.status;\n        ""waiting"" == d ? a.setTimeout(devsite.registration.checkWaitListStatus, 25E3 + 1E4 * Math.random(), a) : devsite.location.href = ""fulfilled"" == d ? b.details_page : ""/events/io/register/noticket""\n    }).error(function () {\n        devsite.location.href = ""/events/io/register/noticket""\n    })\n};",1332861828
3761970,comment,3761528,3761730,1,0,helen842000,,,"That post is very useful. Talking to customers is VERY scary so we put it off until the very last thing only to find out they don't want what we made!<p>I'd be interested in reading the follow-up to the article on ways of finding customers!",1332861817
3761969,comment,3761760,3761760,3,0,jdludlow,,,"<i>I asked if it is a network if it is built on top of another network. I think in that case, the answer is no.</i><p>Ironic that the network he's talking about is built on top of the TCP/IP stack.<p>I guess the point of the article is to argue about the definition of ""social network"", which isn't that exciting.",1332861814
3761968,comment,3761814,3761921,2,0,fredley,,,"I expect that most of the people using this app now - early adopters, readers of tech news - are (to use a broad term) geeks. Geeks are, in my experience, more likely to be liberal. It would be interesting to know A) If this is actually true (someone's done a study) and B) If so, why this is.",1332861809
3761966,comment,3759938,3761690,1,0,brisance,,,"The paper presents the case that HFT as it is practiced <i>right now</i> is bad due to regulations.<p>But we do not know if tweaking the regulations is the ""right"" move. Could be a case of ""out of the frying pan and into the fire"".",1332861785
3761965,comment,3761595,3761595,1,0,nabilt,,,"Academic tickets sold out fast, but genreal tickets were available for about 20-30 minutes. Last year google had another round of tickets so be on the lookout.",1332861783
3761964,comment,3760274,3761858,2,0,mseebach,,,"I'm not sure what you're getting at. Yes, we can slow down the rate at which the rate of growth grows. We may even feel awfully good about that. But if any meaningful projection of climate data is to be believed, we don't need slower growth, we need a total collapse in emissions: we need to get to net negative emissions. Soon.<p>I think going green etc. is nice, and often just common sense with a new label on it. But very often it's just distracting from realising just what kind of breakthrough that is necessary.",1332861772
3761963,comment,3761512,3761512,6,0,thought_alarm,,,"Samsung: Here's our new line of cell phones we would love for you to carry.<p>AT&T: Looks nice.  We'd like this one to look more iPhone-like.<p>Samsung: No problem. Our designers are very talented.  One new feature of these devices is root access for any advanced users who want to customize their phones.<p>AT&T: We don't think that's a good idea.<p>Samsung: You got it.  Root access is gone.",1332861769
3761962,comment,3758047,3758047,1,0,ajays,,,"I don't understand one thing: how can they keep the telescope stable and focused so accurately on one spot in the sky, without any jitter? The Earth is rotating at 360 degrees/24 hours, which is about 0.25 degrees per minute. This 17000 pixel image covers 1.2 degrees, which means the light is sweeping across this sensor at 60 pixels/second as the earth spins.<p>How can they move the telescope so accurately that a sensor pixel picks up light from the exact same spot in the sky for an extended duration of time?",1332861768
3761961,comment,3760275,3760302,2,0,SamReidHughes,,,"I would have downvoted it.  He posted a big honking main function and other irrelevant parts of code.",1332861766
3761960,story,,,1,0,spjwebster,"AWS and Eucalyptus bring AWS to on-premises IT environments",http://www.eucalyptus.com/news/amazon-web-services-and-eucalyptus-partner,,1332861764
3761959,comment,3761040,3761569,1,0,tomjen3,,,"Where do you get a five percent return on investment?",1332861729
3761958,comment,3761918,3761918,2,0,benologist,,,"Good move.  New Relic is <i>awesome</i> with .NET.",1332861701
3761957,comment,3761773,3761903,3,0,there,,,"And when an account is logged out, the app should be calling<p><pre><code>   [[UIApplication sharedApplication] unregisterForRemoteNotifications];\n</code></pre>\nwhich should unregister it from iOS, even if the network connection isn't available, right?  If the call makes it back to Apple's servers, future push notifications shouldn't even get to the device, but even if they do, shouldn't iOS see that it's no longer valid for the application and not display it, bouncing it back to Apple's servers so the token will show up on their Feedback server?  Unless I'm mistaken, unregistering for notifications will remove the application from the device's Notification Center settings.",1332861679
