ID,Type,Story,Parent,Points,Comments,Author,Title,URL,Content,Created
574741,comment,573963,573963,0,0,pmjordan,,,"Very cool. Does anyone know what level of global illumination they are able to reach? I noticed they did have an ambient occlusion setting which produced some noisy-looking shadows (though that could've been a video artifact). Obviously difficult (i.e. highly indirect) lighting situations will seriously impact the framerate, but it would still kick ass if they could hardware accelerate it. Given that they use GLSL to define their surface properties, I'd be interested in how they figure out where to cast their random rays.<p>Baking this into an ASIC instead of an FPGA would be awesome. But I'm sure they're already onto that.",1240441890
574740,comment,573192,574031,0,0,Tichy,,,"I just don't see the use for it - presumably one could create a random number generator to generate all sorts of codes, and have all hackers be occupied indefinitely? There are so many open problems whose solution would actually increase the body of human knowledge.<p>Still, if you want to play, play. It probably is a good problem to practice cryptography with.",1240441879
574739,comment,574653,574653,0,0,JacobAldridge,,,"I once heard that as much as 93.6% of all statistics are just made up on the spot.<p>I hope that never happens here.",1240441853
574738,comment,574589,574729,0,0,axod,,,"I'd place mine firmly with the web ads ;)<p>I agree @ keep costs low, but I still think the definition of a lifestyle business is one that isn't growing in terms of the <i>business</i>.<p>If you liken it to a house rental. You could have the best house in the world, and be able to rent it out for $5m a year. That'd give you a great lifestyle, but even if you can manage to rent it out for $6m the next year, that's not <i>business</i> growth. <i>business</i> growth would be renting out 2 properties, 3, etc etc. Reinvesting the profit into the business in order to provide sustainable long term growth.<p>>> ""I would think that's the nirvana description of any business, though.""<p>So I'd disagree with this. Not every business wants profits over future growth.",1240441797
574737,comment,574468,574672,0,0,hwijaya,,,"I second that. I also pick and implement depends on what is need at the time. Example of when i need list: <a href=""http://css.maxdesign.com.au/listutorial/"" rel=""nofollow"">http://css.maxdesign.com.au/listutorial/</a>",1240441790
574736,comment,574064,574678,0,0,andyking,,,"I have one of these in a drawer--it's a bog-standard GSM phone that takes SIM cards.",1240441748
574735,comment,574545,574724,0,0,arohner,,,"Author here. I was thinking in terms of an entire query being a function that returns data.<p>Also notice that your set notation demonstrates composability, but the equivalent SQL does not.",1240441650
574734,comment,572639,574367,0,0,Avshalom,,,"Okay see I remember seeing the article that made the berry link. Like actual honest to god degree holding scientists (of some discipline) were willing to be quoted on that hypothesis. A hypothesis that I, completely out of my field, just poked a half a dozen major holes in.<p>I didn't ""It's unlikely that women have higher red-resolution because that claim is made by misogynists,"" I said the berry explanation may have been made by misogynists. I suspect at the very least it was made by morons.<p>But despite your seeming distaste for Women's Studies, academia has a well documented history of misogyny that needs to be remembered anytime an argument is made that is so close to ""women are physically adapted to housework."" Particularly when, like I said above, a lack of evidence for some claim is blatantly obvious.",1240441570
574733,story,,,1,0,mollylynn,"Message Manipulation - How To Get Thought Leaders To Sing Your Praises",http://www.johngreathouse.com/thrill-the-messenger-pt-1/,,1240441569
574732,comment,574471,574647,0,0,sketerpot,,,"No matter what happens, people will continue making music because a whole lot of people <i>like</i> making music. What value do the record companies add to that, which we can't get by other, less harmful means?",1240441535
574731,comment,574566,574710,0,0,scott_s,,,"It's not a ""bug"" if the behavior is intended.<p>I just tested the example with Version 2.5, and it returns 4. Version 2.2.2 is over six years old: <a href=""http://www.python.org/download/releases/2.2.2/"" rel=""nofollow"">http://www.python.org/download/releases/2.2.2/</a>",1240441517
574730,comment,574498,574571,0,0,gcheong,,,"Maybe it's good news as long as it doesn't get techcrunched?",1240441505
574729,comment,574589,574682,0,0,dhh,,,"I'm on board with the term ""lifestyle business"" if we make it imply ""very profitable business that continues to grow revenues without adding additional cost"". I would think that's the nirvana description of any business, though.<p>""Which is more risky? 1 person earning $10m a year, or 10 people earning $1m each a year within the same company?"", that simply doesn't compute. If all those 10 guys are making their $1 million each from selling web ads where as the 1 guy is making his $10 million selling subscription software, I know who I'd want to place my money with right now.",1240441320
574728,comment,574368,574439,0,0,hwijaya,,,"Agreed. And, a lot of passions.<p>Beside, i think most people that Matt points out is still quite exceptional. For one thing, John Gruber and Jason Kottke know what they are talking about more than majority of people. In fact, the act of starting itself (let alone know more than most people) is already a difficult thing to achieve. As i can testify, my friend who told me he want to be pro-blogger months ago, hasn't even started now.<p>So, i would probably say Matt's post is more exception rather than rule.",1240441254
