ID,Type,Story,Parent,Points,Comments,Author,Title,URL,Content,Created
574818,comment,574471,574471,0,0,brc,,,"'mustache twirling villains' = Gold",1240444761
574817,comment,574459,574789,0,0,zemaj,,,"Pipelining does not work in most browsers (& is disabled in FF by default). When it does work it can be flaky. A JS solution works on current technologies.",1240444724
574816,story,,,1,0,technologizer,"What Windows 7 Starter Edition is is good old-fashioned trialware.",http://technologizer.com/2009/04/22/windows-7-starter-edition-its-trialware/,,1240444705
574815,comment,574545,574756,0,0,tvon,,,"Please quote with '>', not by indenting.",1240444678
574814,comment,574631,574631,0,0,timf,,,"Interesting, signing up for a key.<p>I don't understand how your per-month & after-the-fact billing model is feasible if you factor in per-transaction costs?",1240444649
574813,comment,574631,574631,0,0,rbreve,,,"I guess  this is USA only?",1240444538
574812,comment,574459,574658,0,0,smhinsey,,,"that's called a sprite, that giant jquery ui file with multiple images, in case you want to find more info.",1240444502
574811,comment,574631,574748,0,0,rbreve,,,"https ?",1240444502
574810,comment,574540,574744,0,0,listic,,,"Can't disagree with economy. But AMD did manage to really rock in 2005-2006, didn't it?<p>EDIT: According to the article, AMD bagan to rock with server processors in 2003",1240444499
574809,comment,574697,574697,0,0,hs,,,"i don't use those languages and i use vim<p>i still believe touch typing (10 fingers + cartoon characters) is often taken for granted<p>how many of your bugs stem from typo?",1240444467
574808,comment,573919,574246,0,0,michaelneale,,,"In some ways it has happened a little with smalltalk: Gemstones MagLev for ruby work demonstrates that it is possible.<p>Whilst for many things I like the VM ""platform"" idea, I still think of lower level compile-to-the-metal languages are more <i>real</i> to me, and always necessary for some things, but perhaps thats my age and experience, and in time VMs will be the norm and native compilation will be like asm code... who knows..",1240444428
574807,comment,573883,574045,0,0,swillden,,,"<i>My only regret is their focus on ""fair-weather"" states, if they ever come to Wisconsin, I'll be the first in line.</i><p>That and I'm waiting for the plug-in hybrid model.  Actually, what I'd really like is a direct-drive diesel version, like their very first prototype.  It got 230 mpg.  Still, the hybrid gas-electric prototype supposedly gets 120 mpg starting with an empty battery.  The battery in the hybrid will be smaller, holding a 40-mile charge.",1240444412
574806,comment,574631,574747,0,0,lurkinggrue,,,"They are going to make up for it in volume?",1240444412
574805,story,,,53,12,juliang,"Wilson Sonsini Term Sheet Generator",http://www.wsgr.com/WSGR/Display.aspx?SectionName=practice/termsheet.htm,"This is a pretty amazing new development on the road towards open source law.",1240444405
574804,comment,574540,574744,0,0,systems,,,"Using your logic, the one with the biggest wallet will always win.  Which is not true! (Of course the one with the biggest wallet already won the big wallet award!)<p>We have seen many giants fall or fail, Microsoft never came up with an answer to the iPod, you may argue that MS didnt really try that hard, but still I think its a good example.<p>And finally, there is always a place for No. 2, AMD can be a player, it doesn't have to be No. 1 to remain a player.",1240444365
574803,comment,571908,573626,0,0,lisper,,,"BTW, the math in this case is really easy.  Kinetic energy is 1/2<i>m</i>v^2.  1000 MPH is 444m/s.  So to accelerate a one metric ton vehicle to 1000 MPH requires 1/2<i>1000 </i>444^2 = ~100MJ, which is less than the energy in one gallon of gasoline.",1240444321
574802,comment,574697,574697,0,0,kqr2,,,"Also, curious about people who do Flex development.",1240444266
574800,comment,574566,574731,0,0,pauldino,,,"FWIW, both Scheme and JavaScript have the same behavior as Python 2.5",1240444207
574799,story,,,1,0,kqr2,"OLC Memos Define Official Waterboarding Procedure",http://waterboarding.org/official_procedure,,1240444206
574798,comment,574321,574788,0,0,calambrac,,,"And then they would be sued.  That's what contracts are for.",1240444152
574797,comment,573919,574509,0,0,JulianMorrison,,,"The superficial similarity is deceptive.<p>C++, the elegance of a subset is replaced with a grab-bag of features when you zoom out.<p>Scala, the grab bag of features are replaced with an elegant unified language when you zoom out.<p>Scala gives average programmers an upgrade path and rewards them for following it. C++ gives average programmers a headache. In Java the average programmer thinks he knows the language, but that won't do him any good if all the important patterns are above the language at library level or higher.",1240444058
574796,comment,574589,574713,0,0,pwim,,,"Addressed in <a href=""http://news.ycombinator.com/item?id=509808"" rel=""nofollow"">http://news.ycombinator.com/item?id=509808</a>",1240444035
574795,comment,574321,574657,0,0,GrandMasterBirt,,,"This is exactly right... MS is marketing it as windows 7 srtarter.. Should be windows notebook 1.0, hey 2.0 will come out at same time as windows 8. Cool. Even nicer if they changed the interface so the ""netbook"" feels like a netbook with a different ui and so on. This way nobody feels like they got the crummy windows and ms is milking em, they just got something different... And ms gets to sell dumbed down oses. Windows 7 just aint compatable with your pos notebook. Ok get windows notebook 1.0.<p>I still feel that selling a crippled os like xp vs xp pro is just plain ol evil... Vista is worse and no lessob learned",1240443861
574794,comment,562588,563209,0,0,listic,,,"I meant to ask, how much network traffic (bytes) do you see?\nI guess your hosting provider counts it, if you don't.<p>And, while we're at it, what hosting provider do you use?",1240443819
574793,comment,574545,574545,0,0,neilc,,,"<i>Current databases don't give the developer a way to bypass the optimizer.</i><p>Sure they do. Oracle and other commercial DBs provide ""planner hints"", which essentially force the optimizer to use a particular access method / join method for a given part of the plan.<p><i>why does SQL decide that declarative style is the One True Way to get access to your data</i><p>Well, part of the reason for a query optimizer is that if the physical representation of the data changes, the queries don't need to change. So that if you add or remove an index, you don't need to adjust all the queries on the table, for example. Obviously the query planner is imperfect, but planner hints are fairly common in practice. The further you stray from declarative queries, the more application changes are needed when physical database properties change.<p><i>Datatypes don't match your PL</i><p>If you want a strongly-typed database system that can be accessed from any language, you need the DB's type system to be distinct from any of the client language's type systems. This isn't always the right tradeoff, of course.",1240443778
574792,comment,574631,574751,0,0,hs,,,"you can have 160 chars of 7 bit instead which costs you $0.0000625 / char instead of $0.00007143<p>12.5% saving",1240443733
574791,comment,574534,574765,0,0,jballanc,,,"Apple has been smart and conservative in its investments, financial dealings, and product development. They won't put out a netbook just because analysts want them too and they won't cut prices just to increase market share.<p>The recession was caused by all those doing, pretty much, the exact opposite.",1240443713
574790,story,,,1,0,mkull,"Philly Startups - Entrepreneurs Unplugged streaming now",http://www.ustream.tv/channel/entrepreneurs-unplugged,,1240443648
574789,comment,574459,574646,0,0,timdorr,,,"Even better: HTTP pipelining - <a href=""http://en.wikipedia.org/wiki/HTTP_pipelining"" rel=""nofollow"">http://en.wikipedia.org/wiki/HTTP_pipelining</a><p>Of course, that's controlled client-side and often doesn't request all that many resources at once. This is a server-side pipelining that lets them determine their own capacity (which makes sense).<p>Of course, I'm not really sure how they're going to do this in IE, since it doesn't support decoding base64 content to image data on the page. Something tells me this is going to hit a bit of a brick wall.",1240443643
574788,comment,574321,574716,0,0,Mazy,,,"The problem is that if there is this cheaper version for netbooks that's good enough, OEMs will just buy that and put it on all their boxes.",1240443542
574787,comment,569338,570074,0,0,lsc,,,"I've offered jails in the past (2004-2005) and currently offer Xen VPSs.  Yes, Jails make more efficient use of ram and other hardware; however, Xen makes more efficient use of SysAdmin time.  Now, the FreeBSD jail functionality is getting better all the time, and it's much better now than it was, but it just doesn't provide the same level of resource isolation that Xen provides.<p>On xen, I don't have to worry about runaway user processes.  Xen deals with the problem for me.  this was not the case with Jails.<p>So yeah.  I like Jails for cooperative environments, but there is a reason why I'm selling Xen VPSs now, not FreeBSD jails, and it's not 'cause I like linux more than FreeBSD.",1240443513
574786,comment,574545,574545,0,0,jrockway,,,"It sounds like his ideal database already exists; AllegroCache.  It's an object database, but you can easily restrict yourself to certain data types to make it ""relational"", if that's what you're after.<p>Some of the open source databases are almost as featureful; Elephant for CL and KiokuDB for Perl come to mind.",1240443495
574785,comment,574631,574751,0,0,silentOpen,,,"It is but the telcos don't operate in a free market. Additionally, the GSM standard puts SMS messages in a low-bandwidth channel, increasing scarcity. Of course, there are technical solutions to this problem but fixing the problem is tantamount to slaughtering a cash cow and it's not done.",1240443487
574784,comment,574459,574646,0,0,zemaj,,,"Keep alive maintains a persistent connection, you are still limited by the number of concurrent connections to the server and the latency that each one experiences.<p>MHXR bundles all your requests into one. This leads to savings the latency overhead on each request (& probably some server resources not having to deal with multiple connections too).<p>I tell you what; piping binary data into objects? Genius! I had no idea that was possible.",1240443470
574783,story,,,1,0,amichail,"YouCube:  Play six YouTube videos on a cube.",http://www.universaloscillation.com/youcube/,,1240443415
574782,comment,574545,574735,0,0,neilc,,,"How is your example SQL ""not composable""?<p><i>Notice that this solution is composed of the first two queries, however composing in SQL kills your performance, and this is generally not the right way to structure the query.</i><p>It doesn't actually ""kill"" performance at all, as a typical SQL optimizer will rewrite the query to remove the subquery, or else to push the outer predicate down into the subquery (which for this query accomplishes basically the same thing).<p><i>I was thinking in terms of an entire query being a function that returns data.</i><p>A query returns a relation, and that relation can be used as the input relation to another query, either via a subquery or via views. That seems like pretty powerful composability to me.",1240443387
574781,comment,574079,574771,0,0,frig,,,"Not as helpful as I'd want, but yeah, I recall one that was getting some traction as a signals-processing aide for tasks like, eg, radar or video analysis and possibly DPI.<p>Totally blanking on the name, it had a pretty similar kit: it seemed like you wrote the raw code in C or a C-like lang, then there was some software assist for laying out dataflow between cores.<p>Edit: I was thinking of Tilera.",1240443365
574780,comment,574545,574735,0,0,DougBTX,,,"The SQL does have much the same syntax, IMHO:<p><pre><code>    SELECT * from X where P(x)\n    intersect\n    SELECT * from X where Q(x)\n    ==\n    SELECT * from X where P(x) and Q(x)\n</code></pre>\nI did enjoy the rant though. It seems like ORMs like Hibernate are moving to have as much complexity as the database they map...",1240443360
574779,comment,573850,574712,0,0,alexandros,,,"Your position is dangerously close to solipsism. You allude to Occam's razor but it also answers your question. If the simplest algorithm does not imply limiting the amount of 'stuff' (universes), why would it limit the amount of observers?",1240443270
574777,comment,574575,574775,0,0,tptacek,,,"The CNet article claims the vulnerability involves ""social engineering"" attacks that will coerce users into giving up personal information. ""Social engineering"" in web apps is usually code for ""landmine links"", and the OAuth protocol itself doesn't communicate any user information of any sort (just an opaque token).",1240443182
574776,comment,573850,574258,0,0,tophat02,,,"I've never understood this argument.  If an INTELLIGENT being produced the conscious entity, who or what was responsible for creating this intelligent being?<p>And no, you can't side step this question.  You can't say ""well, it's god"" because that's special pleading.  I just don't understand how people can assume that evidence of complexity requires a designer, but never seem to have a problem inventing said designer out of thin-air as a magically preexisting entity.<p>What's more likely: that a natural process of change followed by selection essentially navigated through an infinite search space of possible configurations, some of which would create things like intelligent life, or that there was, magically, a pre-existent eternal intelligent being that decided to create other intelligent beings?",1240443099
574775,comment,574575,574575,0,0,timdorr,,,"Any blackhats have any clues as to what this is about? I'm too impatient to wait 7.5 hours :P",1240443090
574774,comment,574496,574496,0,0,duskwuff,,,"This isn't actually a VPN - you can't send non-TCP traffic over it, and it doesn't even work for all TCP traffic unless you use the SOCKS proxy (ssh -D).<p>What CAN be used to construct a true VPN is ssh -w. But I don't think that works in putty.",1240443084
574773,comment,569338,569517,0,0,lsc,,,"if I may defend myself, I find price is often a poor indicator of quality.   (not to say prgmr.com is high-end;  our interface does, well, kindof suck. )",1240443063
574772,comment,574459,574553,0,0,ojbyrne,,,"They do plenty to cache images (including the digg dude). This is about the first load. Yahoo has some report showing that data is uncached quite a bit of the time, even when sending the appropriate headers.",1240443054
574771,comment,574079,574079,0,0,listic,,,"I wonder if this could fly.<p>Because the other approach very-many-cores processor design that I know of, was by Intellasys (<a href=""http://www.intellasys.net/"" rel=""nofollow"">http://www.intellasys.net/</a>), the latest company of Forth's inventor Chuck Moore. And it seemed to have gone nowhere: <a href=""http://www.colorforth.com/S40.htm"" rel=""nofollow"">http://www.colorforth.com/S40.htm</a><p>The problem with this design, as I could see it, is that tiny cores can be too small to do anything practically useful on their own; inter-processor communication and I/O eats cycles. In Intellasys' case I guess the problems were multiplied by the fact that it would be harder to get traction for the chip was designed to be programmed in Forth , and Chuck Moore would settle for nothing less.<p>Maybe University of California will have better chance of success, i.e. if it has more runway to tweak their design.<p>Does anyone know of other very-many-cores processor chips?",1240443053
574770,story,,,3,0,jpwagner,"What venture capital can learn from private equity",http://www.businessweek.com/technology/content/apr2009/tc20090413_125937.htm?chan=top+news_top+news+index+-+temp_technology,,1240443003
574769,comment,573836,574058,0,0,tjpick,,,"1. CS != SE\n2. Graduates with engineering degrees are sought-after and very employable in many areas, because engineering is hard and the people who do it are smart.",1240442968
574768,comment,574697,574697,0,0,doubleyooexwhy,,,"No. All I need for C is my emacs, compiler, and terminal, and I'm good to go.",1240442862
574767,comment,574631,574631,0,0,hs,,,"sometimes carrier in my country have good deal for sending sms, like 0.1c per message for gsm. $1 unlimited for cdma, etc (caveat: only within-carrier, far more expensive across-carrier)<p>the thing is i can't have 4 or 5 digits short sms number; however, that didn't stop me either :d<p>for gsm, i use gnokii, iterating on a list of number with corresponding message is all needed<p>for cdma, it's a bit harder since no open source program is ready-to-use-out-of-box ... basically it boils down to sending `proprietary` at commands to /dev/bla (whatever dmesg spits) or port comm (if the cdma modem only has windows driver, forcing you to)<p>my only gripe with sms is it's 'serial' in the sense i can't 'broadcast' -- that's it, i can only send 1 sms per say 6-10 seconds (depends on how busy the network is)<p>there's no handshake? so there's no way for me to know if the recipient gets it ... and sometimes they get 'empty' sms ... maybe the carriers' mechanism to block spam <i>shrug</i><p>that's all i know about sms, i don't know about sms-center, maybe if one has access to it, s/he can broadcasts sms just like email<p>if someone knows more / better, please enlighten me thx",1240442827
574766,story,,,1,0,doubleyooexwhy,"Getting Your Feet Wet in SDL, Part 2: The Pong Clone",http://blog.16software.com/getting-your-feet-wet-in-sdl-part-2-the-pong-clone,,1240442777
574765,comment,574534,574534,0,0,inconvenient,,,"I'd love to hear the recession doom-and-gloomers explain this one.",1240442610
574764,story,,,1,0,dtap,"Time Warner and Embarq can't compete with city-owned ISP, trying to outlaw it",http://www.engadget.com/2009/04/22/time-warner-and-embarq-cant-compete-with-city-owned-isp-trying/,,1240442608
574762,comment,574631,574757,0,0,stirman,,,"You can view replies to the outgoing messages, see the 'from' field description here: <a href=""http://www.pennysms.com/docs"" rel=""nofollow"">http://www.pennysms.com/docs</a><p>As for routing them back through SMS, we could do that, but thought being able to field replies via email would be more convenient.",1240442559
574761,comment,573226,573226,0,0,johnation33,,,"anyone else can help me with this?",1240442558
574760,comment,574212,574212,0,0,jpcx01,,,"StumbleUpon should fix this quick and easy by changing the user agent string (overridable in the registry). The last thing the world needs is inflated IE6 stats.<p>The whole ""companies need their internal applications"" is bullshit. Firefox and Chrome do not break an installed IE6 on a computer. People can continue to use IE6 for internal sites, and a real browser for other sites.<p>Any IT department that forbids installation of Firefox needs to be brought outside and proverbially shot.",1240442504
574759,comment,574631,574747,0,0,stirman,,,"Penny SMS is the API from a site I built a few years ago, www.ohdontforget.com.<p>TC mentioned it here:\n<a href=""http://www.techcrunch.com/2008/05/27/mobaganda-a-dead-simple-invite-site-built-on-googles-app-engine/"" rel=""nofollow"">http://www.techcrunch.com/2008/05/27/mobaganda-a-dead-simple...</a><p>CrunchBase Profile for ODF:\n<a href=""http://www.crunchbase.com/company/ohdontforget"" rel=""nofollow"">http://www.crunchbase.com/company/ohdontforget</a><p>My CrunchBase Profile:\n<a href=""http://www.crunchbase.com/person/jason-stirman"" rel=""nofollow"">http://www.crunchbase.com/person/jason-stirman</a><p>I wanted to use the press mentions for ODF, since it's the exact same technology, which is why I mentioned ""The PENNY SMS technology has been featured on""<p>Does it come off as bad form?",1240442491
574758,comment,573850,574557,0,0,ericb,,,"There are many people on HN capable of making pattern-recognizing neural nets. Neural nets are loosely (very) modeled on human neurons.<p>To create a neural net, a framework is created that sets up layers of neurons and sets their weightings (often randomly). The framework runs the net against batches of data, measures the level of success, and changes the weightings.  Eventually this process produces a ""brain"" that can, for example, recognize letters.<p>The framework's creator can't explain how the generated neural net functions because <i>no one designed it</i>. To someone not familiar with the process, the neural net would trigger their <i>intuition for recognizing intelligent design</i>.",1240442488
574757,comment,574631,574631,0,0,thehickmans,,,"Any plans for receiving SMS messages?",1240442481
574756,comment,574545,574545,0,0,andr,,,"<p><pre><code>    SQL was invented in the 70s for business analysts to write reports without having to go bug the programmers.\n</code></pre>\nSo what? Unix was invented in the 70s because Ken Thompson wanted to play Space Travel. [1]<p><pre><code>    Queries are not composable.\n</code></pre>\nPer your example, you want to throw out SQL because using AND and OR doesn't feel right. I'd love to see you compose a 10-line SQL query. Also, views ARE query composition.<p><pre><code>    PL/SQL is primitive by today's standards, yet it's the only game in town for certain classes of features, like stored procedures and triggers. \n</code></pre>\nUntrue. Oracle, the creators of PL/SQL, now let you write stored procedures in any JVM or .NET language (so Jython, Clojure, etc.). MS SQL supports .NET stored procedures. PostgreSQL supports Tcl, Perl and Python. Also, your alternative suggestion of a simple and stupid data store DOES involve fetching all the data from the database into RAM and operating on it in your application. You can already do that with SQL.<p><pre><code>    It's not obvious which queries are slow.\n</code></pre>\nUntrue. MySQL can log slow queries and help you analyze them in real time using tools like mytop. I assume similar tools are available for all databases. When you write code it's not always obvious if it will be slow, either.<p><pre><code>    No back door for map, filter, reduce\n</code></pre>\nIsn't the WHERE clause filter? Isn't GROUP BY very similar to reduce? SELECT UPPER(firstname) is map? With the ability to define custom functions in different languages that's a fairly powerful tool. Also, comparisons between MapReduce and SQL are misguided, because MapReduce does not operate on tabular data.<p>Finally, your solution is based entirely on the idea that people will prefer Lisp to SQL.<p>SQL is not perfect for everything, but if you want to suggest a better alternative, start with a solid argument.<p>[1] <a href=""http://en.wikipedia.org/wiki/Unix#History"" rel=""nofollow"">http://en.wikipedia.org/wiki/Unix#History</a>",1240442481
574755,comment,574261,574261,0,0,lurkinggrue,,,"A rose by any other name still smells like a rose.",1240442440
574754,comment,574283,574283,0,0,j_baker,,,"Heh, this was an assigned reading in my Computing Languages class.  Coincidentally, my professor is also one of the interviewers.",1240442426
574753,comment,573836,574090,0,0,jackchristopher,,,"It works as a essayist generalization. It's like saying most people get average results. It acknowledges the Gaussian inevitable.",1240442419
574752,story,,,10,11,lukas,"'Bacontrepreneurs' Building Bacon Empire",http://abcnews.go.com/WN/story?id=7391205&pa,,1240442411
574751,comment,574631,574631,0,0,catch23,,,"1 penny still sounds expensive for 140 bytes of data.",1240442396
574750,comment,574697,574697,0,0,asimjalis,,,"I'm also curious about Python, Objective C and C#.",1240442320
574749,comment,573674,573776,0,0,discojesus,,,"<i>Twat offends the constitution of the weak.</i><p>Yeah, they do look a little bit like shotgun wounds, don't they?",1240442292
574748,comment,574631,574631,0,0,elai,,,"How will you prevent API key spoofing?  Capture that XML-RPC request, and voila, security breached until customer complaint.",1240442256
574747,comment,574631,574661,0,0,nixme,,,"How do you manage to provide such a low rate?<p>I also can't seem to find the TechCrunch mention that's claimed at the bottom of the front page. Can you provide a link?",1240442125
574746,story,,,13,5,audidude,"Iris, concurrency library for C (NSOperation, Twisted deffereds, and CCR in one)",http://github.com/chergert/iris,,1240442088
574744,comment,574540,574540,0,0,dtap,,,"AMD will never seriously threaten Intel. Intel can throw a billion dollars at anything AMD does and come out with a better solution. Some facts...<p>Intel's research budget last year: $5.7 billion<p>AMD's Revenue last year: $5.81 billion<p>Intel needs AMD to exist so that they can avoid anti-trust lawsuits. If AMD fails then Intel will face a lot of legal problems.<p>Disclosure: My dad works for Intel.",1240442052
574743,story,,,1,0,AaronChua,"5 ideas for the new ebook landscape",http://ac-idealog.blogspot.com/2009/04/5-ideas-for-new-ebook-landscape.html,,1240442014
574742,comment,574589,574641,0,0,mixmax,,,"I honestly don't think 37Signals is changing the world in a big way. You're not inventing the transistor, you're making one of many online to-do lists and chats. I'm not saying the products aren't nice, they are. But they aren't gamechanging in any way.<p>You're great at marketing though.",1240441903
