ID,Type,Story,Parent,Points,Comments,Author,Title,URL,Content,Created
1119714,comment,1119051,1119051,0,0,houseabsolute,,,"No major reason to do it on gold or platinum, so basically they used these precious materials just for the hell of it? Odd.",1265947184
1119713,comment,1119566,1119566,0,0,varaon,,,"If you're still a student, check it out from the library and see if it suits you.",1265947122
1119712,comment,1118044,1119149,0,0,anamax,,,"> Have you heard of the Pension Benefit Guarantee Corporation?<p>Yes, I have.  It's largely funded by companies that offer pensions - it's a huge problem that it isn't completely funded that way.  That's not an argument for increasing its taxpayer funding.<p>Also, the first thing that it does is cut pension benefits.<p>I'm the only one who is going to pay for my retirement, so I've little sympathy for folks who think that I should pay for theirs.<p>If you're in a giving mood, feel free to kick in some money for me.  If you're not willing to do that, what's the argument that I should pay for someone else's?",1265947110
1119711,comment,1117184,1117184,0,0,brfox,,,"Notice how the labels never overlap?  This includes the highway labels.  I bet they just randomly start placing labels and once you have a few of them on the map, then there is no way to have the same labels all the time... especially if the edges of the view are slightly different than when it was accessed before.",1265947098
1119710,comment,1119539,1119673,0,0,cmelbye,,,"Google is doing a poor job of supporting Google Gears, and they've made it clear that they're focussing on HTML5 from now on.",1265947043
1119709,comment,1119323,1119323,0,0,chasingsparks,,,"This article actually convinced me to start trolling sites to learn how to argue better and recognize bad arguments. (I will not do so here.)",1265947028
1119708,comment,1119590,1119590,0,0,csomar,,,"Don't forget that you are building this for programmers, so they already know the open source alternative and may also prefer to code it from scratch.<p>Try to build something that bring value to the user. Check out codecanyon.com, they have lot of scripts. Some are successful and brings $1,000++ and some get a sale or two. But those are small scripts, and even when they are small, they are 600 or 700 line of PHP or JavaScript code.",1265947009
1119707,comment,1119051,1119601,0,0,pyre,,,"I was under the impression that when using hydrogen for fuel, the by-product was water (at least in automobiles). The article just triggered the question, I wasn't necessarily commenting on the technology.<p>> <i>At a global scale, the ""rains out of the atmosphere"" bit mostly covers it. Condensation and evaporation processes tend to make water vapor largely self-regulating, shifting around quantities of water that dwarf human factors.</i><p>I was thinking more on a local level. I realize that water vapor will dump out of the atmosphere (unlike CO2) so it for the most part will not be a greenhouse gas. My question was on whether or not large amounts of water vapor being released from cars will cause local ecosystem changes. (i.e. If every vehicle in NYC or Los Angeles ran on hydrogen, would it cause average rainfall in the immediate or surrounding areas to increase? What about yearly average ratio of cloudy vs sunny days?) Obviously people in middle-America (for example) probably won't cause much of a local impact, but what about major urban centers?",1265947004
1119706,story,,,41,6,Technophilis,"Tell your Startup Visa story",http://www.startuplessonslearned.com/2010/02/tell-your-startupvisa-story.html?utm_source=feedburner&utm_medium=feed&utm_campaign=Feed%3A+startup%2Flessons%2Flearned+%28Lessons+Learned%29,,1265946976
1119705,comment,1118984,1119674,0,0,steveklabnik,,,"Just look what happens to /x/ every time /b/ goes down.",1265946963
1119704,story,,,2,1,s3graham,"Flash Player 10 for 64-bit Linux Released",http://labs.adobe.com/downloads/flashplayer10_64bit.html,,1265946963
1119703,story,,,3,0,georgecmu,"Nanofiber Lamps Are More Efficient Than Incandescent, Greener than Flourescent",http://www.popsci.com/technology/article/2010-02/nano-fiber-lamps-are-more-efficient-incandescent-bulbs-more-eco-friendly-fluorescent-bulbs?page=,,1265946929
1119702,comment,1118044,1119215,0,0,anamax,,,"> Isn't that actually worse?<p>For whom?  Not for me.<p>> Not only can IBM screw its pensioners, but the pensioners have no recourse<p>They made a bet.  Since they were willing to take the winnings, they should take the loss.",1265946919
1119701,comment,1119590,1119649,0,0,csomar,,,"+1 for the jQuery UI suite.<p>More than jQuery, there's Ext Js, which is quite extensive (and FREE)",1265946827
1119700,comment,1119184,1119289,0,0,GHFigs,,,"<i>My God! RWW isn't even BLUE for heaven's sakes.</i><p>Facebook users who have made this mistake are <i>also</i> confused by this. Clearly something is amiss--they <i>know</i> they aren't at the Facebook they desire--but they don't know where the mistake was made, or by whom.<p>Even the basic error is not egregiously stupid. Generally speaking, wouldn't you expect, from years of Google usage, that the first result for ""facebook login"" to be the Facebook login page? In fact, <i>it is</i>, if you ignore the news results. <i>If</i>.<p>Consider that: RWW is a top result for ""facebook login"" (not a ""random link""), it does have multiple Facebook logos and the text ""Sign in with Facebook"" directly above the comment form. These things conspire to aid the user's confusion along with the most damning setter of expectations: the fact that it <i>used to work</i>.<p><i>You</i> may understand that Google's results are not always perfect, that the Facebook logo appears on sites unrelated to Facebook, and that ""Sign in with Facebook"" does not have anything to do with <i>using</i> Facebook. But does Gladys? Evidently not. And why should she? Until yesterday, she didn't need to.",1265946807
1119699,comment,1119051,1119529,0,0,peregrine,,,"How come nobody thinks about using hydrogen for powerplants? And keep it a closed system? Make hydrogen and oxygen from water+sun+new Tech. Burn hydrogen and oxygen and turn it into water vapor. Spin turbines. Collect water vapor and repeat?",1265946801
1119698,comment,1119184,1119554,0,0,cookiecaper,,,"These people are primarily native English speakers. Of course errors are excusable when mastering a second language, but I don't think anyone seriously believes that any significant number of those people are non-native English speakers.",1265946715
1119697,story,,,3,0,jonathanmarcus,"John Wehr Joins HiiDef as CTO",http://blog.hiidef.com/post/384795411/johnwehr,,1265946673
1119696,comment,1119317,1119553,0,0,wanderr,,,"When I have to work with them for any length of time, I certainly do hate some screwdrivers more than others.",1265946669
1119695,comment,1119184,1119363,0,0,nfnaaron,,,"May I assume for sake of argument that by ""deserve any comments"" and ""lack of intelligence"" that you're including comments similar to those made by the leets against the facebook confused?<p>Why is this OK? Why is it OK to laugh at and discriminate against less intelligent people?<p>What have less intelligent people failed to do, that would have made them more intelligent, that makes them deserve to be looked down on? Is it their fault that they're less intelligent?<p>How is this different from laughing at people because their skin is a different color, or they speak a different language?<p>Disclosure: I'm guilty of this. But I've been wondering about this question for a few years now.",1265946605
1119694,comment,1119544,1119544,0,0,marshallp,,,"That's not exactly new, that's mostly conventional wisdom in economics/business theory.<p>Larry Ellison also believes software is a mature industry.<p>However, I think you and he are both wrong in that respect. Yes consumer websites that allow you to communicate is mature, there's not much innovation that can happen there.<p>However, information filtering, which is what google (search,adsense) and amazon (recommendations) do is certainly not complete. They use data and machine learning to do their work, but it's possible for a whole lot of people to come along and get big niches in their space by human-designed mathematical models.<p>An industry where this has already happened is in stock trading. \n1- At first there human stock pickers (yahoo directory), \n2- then came along automated machine learning, which they call statistical arbitrage (google),\n3- and now only human created mathematical models give a consistent edge.<p>If you look at coming industries like robotics and bioengineering, they're just coming into the google-like machine learning stage (and there are opportunities for software startups), and haven't even started the math model stage.<p>So yes, if your only skill is building web applications, you're chances of stardom are less than a decade ago, but incorporate more math into your software and there are a lot of opportunities.",1265946589
1119693,comment,1118042,1118449,0,0,elblanco,,,"Don't forget that the ""religiosity"" in the countries that are the historic home of the church is also very poor. You go into a Cathedral or Basilica during mass in most places in Europe and all you find are old ladies. Basically, the home base of the Church has abandoned the Church.<p>Coincidentally those places are also technologically and philosophically sophisticated, places that <i>do</i> care about the future by definition. Yet they also tend to have low birthrates. The Church is simply taking advantage of these two situations in a campaign to explain a short term (though sizable) economic blip which is already reasonably explainable in ways that don't conform to the obvious ideological footprint the Church is trying to fit all this into and for all appearances looks to already be on the upswing anyways.",1265946567
1119692,comment,1118984,1119369,0,0,camccann,,,"I've sometimes wondered what Mencken would have thought of the internet.<p>Especially given that large parts of his life could be plausibly summarized by ""he did it for the lulz"".",1265946557
1119691,story,,,2,0,alexl,"A fresh look at traditional medical diagnostics",http://www.ted.com/talks/george_whitesides_a_lab_the_size_of_a_postage_stamp.html,"This has sparked quite a long thread of comments, too.",1265946532
1119690,story,,,64,17,csomar,"Unobtrusive CSS Framework",http://unobtrusivecss.com/,,1265946531
1119689,comment,1119574,1119574,0,0,dpritchett,,,"So far (11 mins in) this feels like a 50 minute podcast recapping the book.  I'm definitely enjoying Jessica's presentation and I imagine this will be very useful for anyone who's on the fence about buying the book itself. [1]<p>I'm actually reading it right now and it's kinda neat reading the ca. 2006 viewpoints of serial entrepreneurs who have been hugely successful (again) since these interviews were recorded.<p>Imagine what Evan Williams (Blogger/Twitter) and Paul Buchheit (GMail/Friendfeed) would have wanted to talk about three or four years ago.  You can see the seeds of their soon to be successful new businesses in every line of these two interviews.  Really a great bit of history.<p>EDIT: 21 minutes in the topic shifts to ""What can big companies learn from startups?""<p>[1] <a href=""http://www.foundersatwork.com/"" rel=""nofollow"">http://www.foundersatwork.com/</a>",1265946517
1119687,comment,1118599,1119477,0,0,allenbrunson,,,"... but not on the iphone, sadly.",1265946430
1119686,comment,1117668,1119542,0,0,MrFoof,,,"Actually, childhood was a blast.  The first 8 to 10 years of schoolwork being completely trivialized meant I could be over at some friend's house every day, futzing around in the backyard, or playing with action figures and legos.  All the time.<p>I have few memories of before I was 4 years old.<p>* Rolling around some cookie monster thing.\n * Being sick of flash cards.\n * Spraying my grandfather with the hose, and thinking it was hilarious.\n * The dog knocking me over to take the entire bag of snausages.\n * Playing random games we made up in the backyard with the kids next door.<p>How much do you vividly remember from when before you were 5 years old?  I'm guessing not a whole lot.",1265946405
1119685,comment,1117489,1118371,0,0,voidmain,,,"I'm sure the cost of entry for medical insurance (and pretty much every highly regulated industry) is dominated by costs imposed by regulation.",1265946401
1119683,comment,1119461,1119622,0,0,brehaut,,,"In overview:<p>1. Write javascript prototypes to mimic the primatives of BASIC where there is no JS equivalent - Arrays spring to mind, JS Arrays are dynamical growing sparse arrays. To support BASIC arrays you will need support redim and redim preserve to resize the array. You may also want to consider a string wrapper type as some implementations of BASIC have mutable strings, JS does not.<p>2.Write a parser for BASIC that generates an AST (abstract syntax tree).<p>3. Walk the AST recursively emitting Javascript equivalents (ie fragments of code) of the BASIC constructs.<p>4. Pass that javascript to eval or load it as an external JS file.<p>The two languages are fairly similar in broad details. subs and functions both become functions, depending on the dialect of BASIC you are implementing you wont need to implement classes, maybe only types. Probably the most finickity detail will be mapping ON ERROR nonsense across to something more sensible, and perhaps handlign by val and by ref arguments.",1265946325
1119682,comment,1119433,1119583,0,0,wanderr,,,"For me I normally don't care at all how big, bulky or heavy a laptop is until I am traveling/vacationing.<p>I like to travel light, so it's nice if my laptop is so light and small that rather than needing a whole bag of its own, it can slip comfortably into a bag I was going to bring with me anyway. Being a cheapskate with high tech standards, my solution was the Asus AS1410 (dual core model). For about $100 more than a netbook, you get a laptop with decent specs that's almost netbook sized, but has a keyboard that doesn't hurt to type on, and a much higher resolution display.",1265946321
1119681,comment,1118995,1118995,0,0,mrtron,,,"The perils of recursion (upenn.edu)",1265946279
1119680,story,,,58,9,wglb,"Headcount ",http://www.joelonsoftware.com/items/2010/02/11.html,,1265946279
1119679,comment,1119590,1119676,0,0,patio11,,,"<a href=""http://www.bingocardcreator.com"" rel=""nofollow"">http://www.bingocardcreator.com</a><p>Click the big freaking image on the front page to see iBox in action.  Sign up for the free trial (the purple button is the web app version, which is what you want) or log in as a guest, then create a bingo card and mouse over the preview image to see a tooltip.  Alternatively, get to the customize bingo cards page to see tooltips applied to each of the customization options.<p>Incidentally, if you do the above, you will be participating in an A/B test of those tooltips, so I'm not positive what exactly you see.  All the alternatives currently live show tooltips, but the way they do it is different.  I relentlessly optimize for task success.",1265946224
1119678,comment,1118991,1119550,0,0,compay,,,"You're right, I chose a lousy example. Much of my experience with Ruby revolves around Rails, so perhaps that colors my perspective a bit more than I sometimes realize.",1265945944
1119677,comment,1119539,1119658,0,0,Sam_Odio,,,"You can go even shorter: <a href=""http://divvyshot.com/p/LRHa/"" rel=""nofollow"">http://divvyshot.com/p/LRHa/</a> or <a href=""http://dvsht.com/p/LRHa/"" rel=""nofollow"">http://dvsht.com/p/LRHa/</a>.<p>The same works for events; just substitute an e.",1265945867
1119676,comment,1119590,1119633,0,0,Vindexus,,,"Well it wouldn't just be a UI box plugin for sale. It would include the backend for editing and managing all your help text and FAQs. I'd also really like to put in search, and possibly an ""ask a question"" form.<p>I'm sure a lot of people would say ""I can just do this myself in X time"". But if the product is good enough, and easy enough to implement, it would just make more sense to use this product. Sort of like how setting up a form is pretty trivial, but it might make more sense to use Wufoo or FormSpring to get a better form in less time.<p>The tooltips idea is a good point. Maybe that could be incorporated as well (if I do this)? I think that tooltips and FAQs serve different purposes though. Tooltips are more for ""what is this thing right here?"" and FAQs are more for stuff like ""Okay, how do I do X?"". Both are useful for confused visitors I think.<p>Edit: Do you have a site using iBox I could check out? None of the demos on their site appear to be working.",1265945850
1119675,comment,1119539,1119539,0,0,cmelbye,,,"Wow, congratulations guys! It's been fun watching the site evolve over the past few months. The new site design is absolutely beautiful, I don't think I've ever seen anything better in a web application to be honest.",1265945850
1119674,comment,1118984,1119167,0,0,Perceval,,,"/b/ also functions as a honeypot.  The other boards are more strictly moderated to stay on topic, free from trolling and racism, and worksafe.  The ability of those boards to stay sane is in part a function of having a board like /b/ where misbehavior is permitted (with only the bare minimum of limits).  Were it not for the ability to let off steam at /b/, the other boards might not function as well and might be disrupted more often.",1265945772
1119673,comment,1119539,1119661,0,0,est,,,"Why they failback on Java not G Gears?",1265945767
1119672,comment,1119539,1119580,0,0,mhartl,,,"I dig the reddit shirt in the photos. :-)",1265945733
1119671,comment,1119029,1119422,0,0,patio11,,,"I don't think it is the ads causing the bouncing.  I think it is simple Internet-induced ADHD, the same thing which contributes to bounces everywhere else.  I see similar curves in time-on-page for anything I do -- even at my best articles segmented by users referred from a trusted recommendation (e.g. a blog they respect).  That is without any advertising whatsoever on my pages.",1265945732
1119669,comment,1116487,1116724,0,0,brianobush,,,"they also own shares that have more voting power. I can't recall the details, but one of their votes has more weight than the publicly traded shares do.",1265945639
1119668,comment,1117668,1117723,0,0,mkramlich,,,"And gaining contacts and cash. Which in turn help him later to build a startup. So I agree, it's not all bad.",1265945620
1119667,comment,1117668,1119280,0,0,anonjon,,,"""if there's something interesting, just go hack it up and ask for forgiveness later.""<p>This is probably the best advice given on hacker news today.",1265945594
1119666,comment,1119539,1119653,0,0,Sam_Odio,,,"The java applet is a backup for older browsers.  If you have firefox 3.6 just drag photos directly onto an event page.<p>We'll expand support as soon as we can but we're at the mercy of the browsers here.",1265945545
1119664,comment,1119051,1119614,0,0,lucifer,,,"There are other considersions:<p><a href=""http://en.wikipedia.org/wiki/Indium"" rel=""nofollow"">http://en.wikipedia.org/wiki/Indium</a> says that Indium is ""rare"".  (Let us all pray that is not found only in the Middle East .. ;)",1265945533
1119663,comment,1118984,1119369,0,0,Perceval,,,"Excellent Mencken quote.  Another relevant one: ""Man is least himself when he talks in his own person. Give him a mask, and he will tell you the truth."" --Oscar Wilde",1265945522
1119662,comment,1118042,1118312,0,0,elblanco,,,"Yet poor, famine starved peoples the world over (the exact kind of people with no hope for the future) tend to have large families.",1265945460
1119661,comment,1119539,1119653,0,0,pcardune,,,"Only Firefox 3.6 supports dragging files onto a web page. Not available in chrome yet...",1265945429
1119660,comment,1118984,1119342,0,0,Perceval,,,"Some credit may be due to Shii, who was the admin on 4chan who implemented FORCED_ANON on /b/.  See: <a href=""http://shii.org/knows/Shii"" rel=""nofollow"">http://shii.org/knows/Shii</a><p>Some of his thoughts and findings on anonymity can be found here:<p><a href=""http://shii.org/knows/Anonymous"" rel=""nofollow"">http://shii.org/knows/Anonymous</a><p><a href=""http://blog.topix.com/archives/000106.html"" rel=""nofollow"">http://blog.topix.com/archives/000106.html</a><p><a href=""http://wakaba.c3.cx/shii/"" rel=""nofollow"">http://wakaba.c3.cx/shii/</a>",1265945425
1119659,comment,1118599,1118599,0,0,duncanj,,,"I always felt that Java's design resembled Modula-3.",1265945321
1119658,comment,1119539,1119539,0,0,CamT,,,"On top of the nice design, the URL for the images is quite short and legible; e.g. <a href=""http://divvyshot.com/photo/LRHa/"" rel=""nofollow"">http://divvyshot.com/photo/LRHa/</a>.  That's a nice touch.",1265945310
1119657,comment,1119544,1119592,0,0,apsec112,,,"I do, but it was just launched a few days ago and it's not on Google yet: <a href=""http://www.rationalfuturist.com/"" rel=""nofollow"">http://www.rationalfuturist.com/</a>",1265945288
1119656,comment,1119566,1119566,0,0,chipsy,,,"Only if you are in the market for comprehensive reference. Reading through TAOCP is a good project for the eager-to-learn beginner, but you probably already know the essentials of the material from your coursework. It's a compendium of the ""proven useful"" stuff, which tends to be older material. Research papers will have more/newer information. TAOCP will have more examples.",1265945224
1119655,story,,,1,0,alanthonyc,"Pinboard Adds Plaintext Saving Service",http://pinboard.in/blog,,1265945088
1119654,comment,1119579,1119579,0,0,pedalpete,,,"'Seemingly coming out of nowhere, rumors have started circulating this week'.\nThis rumour has been circulating for years, and I believe Ballmer has even commented on it. \nRIM does need a new OS, and Microsoft could definately benefit. But this isn't a new concept.",1265944980
1119653,comment,1119539,1119539,0,0,est,,,"You must have Java installed on your computer to use the drag-and-drop uploader.<p><a href=""http://imgur.com/mXc6q"" rel=""nofollow"">http://imgur.com/mXc6q</a>",1265944951
1119652,comment,1119184,1119526,0,0,noonespecial,,,"I used driving as a way to illustrate the scale of the background knowledge required for the activities. There is a fair amount of background information required to drive safely that has nothing to do with physics. The rules and conventions of the road are not based on physics. Sometimes they seem to be completely devoid of logic as well. <i>Teenagers</i> regularly master these well enough to function. There is little fear that they will have trouble with this. Everybody does it right? (But when that fear is present, it is equally debilitating in the auto world, its just much more rare.)<p>Neurosurgery on the other hand, is hedged by an impenetrable wall of background knowledge that must be mastered in order to achieve even basic competency. It takes a dedicated expert a lifetime of study and practice. It really should be left exclusively to experts.<p>My point was that most people think operating to computers is closer to neurosurgery than driving so there's no point in even trying to understand. Just call the expert. Once they realize this is not the case, they often learn the basics fairly quickly.",1265944865
1119651,comment,1119539,1119539,0,0,kul,,,"iPhoto online but better, sweet, congrats!",1265944851
1119650,comment,1117130,1117468,0,0,hacknews,,,"Could you clarify this statement?<p>rs",1265944825
1119649,comment,1119590,1119590,0,0,pedalpete,,,"I think you need to still sort out what you are offering/selling. \nRarely does 'I want to make a...' turn into a business.\nCome at it from the other direction. \n'People need ..., I can serve this need with...'.<p>If websites need help sections, is the best product a 'help dialog box plugin'? \nHow would you answer the help questions?\nAre you just providing a UI element? If so, what is that truly worth, when full suites like jQuery UI exist?",1265944789
1119648,story,,,4,0,msacks,"Pinax, Rapidly Developing Web Sites in Python ",http://www.thebitsource.com/software-engineering/python/pycon-pinax-rapidly-developing-web-sites-python/,,1265944779
1119647,comment,1119184,1119330,0,0,necubi,,,"Cars are, as usual, a really poor analogy. It's true I have absolutely no idea how to fix a car if it breaks down; however, fixing cars is a highly specialized skill (especially these days) and requires expensive equipment. Companies like Facebook, meanwhile, spend millions of dollars on usability testing so that their websites and applications are easy to use, and there is the expectation that anybody _can_ use them. Now if we were talking about programming, or even system administration, it would be a more apt analogy.",1265944747
1119646,comment,1119539,1119599,0,0,Sam_Odio,,,"Nope - it was designed in house by Michael Yuan.<p>Very talented guy.  There are a couple CSS hacks in there that don't exist anywhere else on the 'net.  Try to find them!",1265944717
1119645,comment,1119184,1119621,0,0,ehsanul,,,"Hard to believe. Then again, these are probably the bottom 1%, as there are probably thousands that went to that page, out of which some were clueless enough not to be able to find the actual facebook home page, and were yet able to comment.<p>Some of the worse comments:<p><i>I don;t understand, new facebook sucks! WHere are all of my friends and why are there all these ads for khabrein? How to I get to my LOGIN?!?!?!?!?</i><p><i>I don't like Facebook's new logo. Why did they change their name to Khabrein!!!???</i><p><i>this is awful. more useless crap i don't want. if i wanted news info i would go somewhere else, but i don't want it, any of it. thanks for spoiling my one outlet in life.</i>",1265944714
