ID,Type,Story,Parent,Points,Comments,Author,Title,URL,Content,Created
1119644,comment,1118132,1118830,0,0,andreyf,,,"I agree that it would be nice, and that's the world most parents try create for their kids. Outside of meticulously engineered/supervised social structures, however, I see little reason for a pure meritocricy to arise, if only for the reason that the concept of ""merit"" doesn't exist outside of our moral models.<p>And you can certainly get a promotion many ways aside from sleeping with the boss.",1265944711
1119643,comment,1118599,1119361,0,0,lucifer,,,"When you define a class, say ""Foo"", instances of Foo are Foo objects.  ""Foo"", itself, is an instance of a class named ""Class"" which is a direct descendent of the class ""Object"".<p>In Java's type system, classes are 'first class objects':<p><a href=""http://en.wikipedia.org/wiki/First-class_object"" rel=""nofollow"">http://en.wikipedia.org/wiki/First-class_object</a>",1265944669
1119642,comment,1119184,1119430,0,0,GHFigs,,,"I contend that branding people as intentionally ignorant is an excuse for your own laziness. You're always going to be able to dismiss part of the problem as ""too hard"" to bother addressing, that way. I used to feel that way myself. It's convenient, but it's also not true.<p>The truth is that people are learning constantly whether they want to or not. It's what humans <i>do</i>. We take input from the world and turn it into cognitive models of the world. The only question is what input and how accurate the model is--things which the designer of a thing can always influence.<p>What you're seeing when you see laziness is people who have developed a cognitive model of computers (or whatever) that involves a lot of pain and confusion relative to the reward. Some of this is just absorbed from the surrounding culture, but much of it is gleaned from their actual experience in using them. They have <i>learned</i> that learning about the computer = pain, and that's what they avoid. A common element of that pain is feeling stupid and lazy for not yet understanding. (After all, that's what people who <i>do</i> understand computers keep telling you.) But who can blame a person for avoiding painful experiences?<p>Learning always involves at least a trace of confusion, but it doesn't have to be painful in a way that people want to avoid in spite of the rewards. Eliminate the unnecessary pain from these experiences and you'll find that ""laziness"" seems to disappear along with it.",1265944636
1119641,comment,1117668,1118305,0,0,b3b0p,,,"I save very close or more than 2/3 of my current salary.<p>I own my car, I bought it in cash. Where I live I need it (I already tried the whole Vespa thing, I lasted one winter and was exhausted).<p>I don't have a mortgage. I sold my house.<p>I rent. I don't want the baggage a house brings (time, maintenance, stuck in one place). My rent is ~ half of my old mortgage which was not that much and in a much more enjoyable community (behind campus and about 2 min walk from the video store, coffee shops, and grocery store).<p>I only buy what I truly believe I will hang on to and be happy or content with.<p>Why do I do this? I don't know, maybe to retire early. Maybe do the whole start up thing someday.<p>However, I think it's mostly because it's comfortable for me. I don't feel comfortable in one place and like the ability to just throw everything in my car and go. I don't like things that hold me back or slow me down.<p>Edit: this is after taxes and whatever else they take off. I'm going by what my paycheck says.",1265944616
1119640,comment,1119184,1119277,0,0,eitally,,,"More accurately, everyone here has at least one subject about which they care so little that they won't attempt to ""get"" it, no matter how simple it becomes.  If I start talking computing to my wife, her brain immediately turns off.  If i start listening to her reading recipes, mine does the same.  It's not that she doesn't enjoy using computers or that I don't enjoy eating the food she cooks, but we all have limited bandwidth and most of us have conscious filters by which we restrict our CPU cycles to subjects that actively interest us.<p>I think when dealing with the general public, specialists too often confuse ""don't care"" with ""is stupid"".",1265944601
1119639,comment,1118781,1118781,0,0,kingkilr,,,"Stuff like this is why I'm convinced the PyPy guys have the right approach.  Write it once in a high level language and then compile it into different targets.",1265944567
1119638,comment,1119596,1119596,0,0,mixmax,,,"The thing is that most people don't know what they want. A lot of people <i>think</i> they know what they want, but very few do. Just the other day I had a snowball fight, and it was great fun and a wonderful experience. When I woke up that morning it certainly wasn't in my calendar - I had totally forgotten how much fun fighting with snow is.<p>Also, it's much more about the process than the goal. Notice that people who reach their goals simply set new ones, painters paint whether they're paid or not, hackers hack in their freetime, etc.",1265944544
1119637,comment,1117832,1119396,0,0,turkishrevenge,,,"According to the Bureau of Labor Statistics employment data on IT sector employment (<a href=""http://www.bls.gov/iag/tgs/iag51.htm#workforce"" rel=""nofollow"">http://www.bls.gov/iag/tgs/iag51.htm#workforce</a>) the number of IT workers is relatively small compared to the rest of the population.<p>What about those untold millions not in IT or the sub-110 IQ ""morons""? You know, the people that generally make society function? What about them? Do you think they are just going to sit idle? Or will they all be making pottery? Why should I even buy a pot made by human hands? Please.",1265944523
1119636,comment,1115561,1116432,0,0,gcb,,,"Denial. First stage of self discovery.<p>:D",1265944519
1119635,comment,1118995,1118995,0,0,Hexstream,,,"Wow. That sounds like an instant, live-remix trance music. I love it.",1265944506
1119634,comment,1119184,1119184,0,0,Judson,,,"Honestly, the worst part is how many 40-80 year old women are using the word ""sucks"".",1265944500
1119633,comment,1119590,1119590,0,0,patio11,,,"You're pitching a product to technical users which can be duplicated with your OSS lightbox script of choice (I like iBox) and about 45 seconds of effort.  I would think long and hard about what benefits you provide over including the OSS lightbox script in return for asking for money and/or breaking my site when you go down.<p>Incidentally, in terms of UI design, I think using a modal iBox here is probably a step backwards in many circumstances.  Make it a tooltip instead.  (You appear to be using this on another site.  Instrument it, so that you know how many people click on the help, then actually succeed in asking a question.  I predict that number will be vanishingly small.)",1265944487
1119632,comment,1118132,1119340,0,0,andreyf,,,"Driven people go to SV because it's easier to find other driven people to work with there. PG says this explicitly quite often.",1265944451
1119631,comment,1119539,1119539,0,0,niallsmart,,,"About time someone brought some serious design chops to the table.  Pretty much every major photo sharing site (bar MobileMe) rocks the web like it was 1999.",1265944418
1119630,comment,1117145,1118863,0,0,camccann,,,"It is the eternal bane of the hasty cook that, alas, hot metal looks <i>exactly</i> like room-temperature metal.",1265944354
1119628,comment,1119566,1119566,0,0,marshallp,,,"No, it's more like a decoration piece then anything. Read research papers online of the areas you're interested in.",1265944292
1119627,comment,1118597,1118968,0,0,anonjon,,,"Yes? I do care about this stuff.<p>The first reason is that I'm kind of a wonk for this stuff.\nI like reading about the different languages and learning them. \nI have fun doing it; (I also program because I think it is fun, I could probably make plenty of money doing something else had i the desire...).<p>The second reason is that I believe you should use the right tool for the right job.<p>Firstly, by learning more paradigms I get more flexible with my programming in any language. I can pick the way to implement that will fit my solution best, rather than worrying about shoehorning the solution in my head into the wrong pattern.<p>Secondly, I can make better choices at the start of a project.<p>If I have a basic plan at the beginning of a project, I can decide based on the plan what will most likely make implementing it the most pain free. When your implementing language fits your problem domain perfectly, you can be incredibly productive.",1265944277
1119626,comment,1117524,1118113,0,0,nandemo,,,"Er, no, admitting that you put a lot of effort into a speech is exactly what sprezzatura is not.<p>Sprezzatura would be more like ""oh, was the speech that good? I hadn't noticed myself. Well, now that you mention it, I guess it just comes naturally to me..."".",1265944272
1119625,comment,1119551,1119598,0,0,jlong,,,"The core product hasn't really changed in years. Most of the time when I get an upgrade it's only so I can feel more current. I could be content with Fireworks 4 if necessary.",1265944239
1119624,comment,1119184,1119387,0,0,marilyn,,,"I highly doubt that the majority of these users are using Firefox. More likely they are using the default browser available on their operating system.",1265944231
1119623,story,,,2,0,georgecmu,"Palm orders sudden halt on Pre, Pre Plus, and Pixi production",http://venturebeat.com/2010/02/11/report-palm-orders-sudden-halt-on-pre-pre-plus-and-pixi-production/,,1265944207
1119622,comment,1119461,1119461,0,0,jstevens85,,,"Could someone explain to a non-CS major (Maths) what would be the simplest, quickest way to implement a BASIC to JavaScript compiler?",1265944071
1119621,comment,1119184,1119412,0,0,mncaudill,,,"I think it is worse than that. I typed in ""facebook login"" clicked the first link (which wasn't RWW at the time) and here's what I got: <a href=""http://tinyurl.com/ylapbnu"" rel=""nofollow"">http://tinyurl.com/ylapbnu</a><p>17 comments and not a Facebook logo in sight.",1265944026
1119620,comment,1119184,1119341,0,0,Perceval,,,"Some folks have put together a comment filter that flags any comments that are 'formally' stupid in the same way that #14 is: <a href=""http://stupidfilter.org/main/"" rel=""nofollow"">http://stupidfilter.org/main/</a>",1265944020
1119619,comment,1119508,1119508,0,0,grellas,,,"In California, Labor Code 2870 allows you to keep inventions conceived or reduced to practice entirely on your own time and without use of an employer's resources unless such inventions ""relate at the time of conception or reduction to practice . . . to the employer's business"" or to ""actual or demonstrably anticipated research or development of the employer.""<p>""Relate,"" in this sense, can be read pretty broadly and so there is always theoretical concern over this issue if you as an employee developed something on the side.<p>In practice, though, there is quite a broad scope for employees to do side projects without having them swept in by such clauses. The exception is where you use expertise that is directly related to your job duties to come up with a better way of doing things in the very area in which your employer competes. Common sense suggests why that should be an exception: if the rule were otherwise, any employee could basically claim job-related inventions as his own.<p>If you have already left employment, and have not yet developed anything, then you should normally have little risk of having your ideas being deemed to belong to your employer. It is normally virtually impossible for an employer, for example, to prove that you were still employed ""at the time of conception or reduction to practice"" of your idea, as opposed to afterward.  Two important exceptions to watch out for on this point: (1) if you file a patent application shortly after leaving employment relating to your employer's field, this is like waving a red flag in your employer's face that you had conceived the invention while employed; and (2) some assignment-of-invention agreements set forth a rebuttable presumption that any invention you develop within x period of leaving employment is presumed to have been conceived while still employed, and the legal effect of this sort of clause is to treat such an invention as belonging to your employer unless you can affirmatively prove otherwise (an often impossible task).",1265944014
1119618,comment,1118386,1119263,0,0,chrischen,,,"If the company goes away then the servers that invalidate your Windows will not do so anymore.<p>This system would be a problem, but only if having a working OS depended on Microsoft keeping its servers up.",1265943976
1119617,comment,1118991,1119506,0,0,punster,,,"Oh, and the lack of an integer type seemed to make it really difficult to do proper bit shifting--i'd expect this to be the bread and butter of an embedded scripting language.",1265943962
1119616,comment,1118946,1118946,0,0,csmeder,,,"Honest feed back? How about this version:<p><pre><code>  def fact(max=ARGV[0].to_i, i1=1, i2=1, i=1)\n    i < max ? fact(max, i2, i1+i2, i+1) : (puts i1)\n  end \n  fact()\n</code></pre>\nThis was the 2nd program I wrote in Ruby (I know it's recursive and therefore inefficient but my goal was to see how short I could make it not how efficient)",1265943950
1119615,story,,,3,0,skorks,"Actionscript 3 Ascii Art Class",http://blog.sugarpillfactory.com/?p=332&preview=true,,1265943948
1119614,comment,1119051,1119529,0,0,camccann,,,"Right. It's just a variety of solar power, converting the energy in sunlight into another form--in this case, chemical potential energy.<p>The potential value lies in weighing practical considerations between different ways of storing solar energy--standard solar technologies tend to produce either heat or electricity, neither of which stores well.",1265943867
1119613,comment,1119184,1119387,0,0,imd,,,"Did you actually try this?  ""facebook login"" in the address bar takes me to the Google results.  It only takes you to the first search result if it calculates you had a high probability of wanting to go there, like typing ""yahoo"".  Occasionally, it does the wrong thing, but not in this case.",1265943854
1119612,comment,1118919,1119075,0,0,corruption,,,"For example, come up with a quantitative market hypothesis (e.g. X% of Y businesses contacted by method Z in will be interested in buying the ""software"". Also problem statements etc etc etc - anything quantitative. We setup a simple data collection form (a-la kissmetrics) for the minions at elance and set them at finding out the answer. They generate target lists (web scraping etc), contact them, collate the results and the rest is pretty simple. I've done it in stages so it's not all the same people doing the work.<p>Now we are starting to outsource the development of a repeatable sales process, which will be an interesting thing. It'll be the first project I've done almost no work on, but could be the most lucrative!<p>So we are still doing <i>some</i> of the CD, but the hard part (getting out there and finding early adopters, interviewing them, collating feedback etc) is automated.",1265943849
1119611,story,,,10,0,skorks,"App Engine SDK 1.3.1, Including Major Improvements to Datastore",http://googleappengine.blogspot.com/2010/02/app-engine-sdk-131-including-major.html,,1265943834
1119610,comment,1118132,1119402,0,0,andreyf,,,"I'm tempted to thow out the over-quoted ""luck favors the prepapred mind"". Yes, Microsoft lucked out when Bill Gates' mom was a boardmember of IBM, but they certainly took full advantage of it, and their many other opportunities - most of which came with having a more accurate understanding of their market than others. What might seem like luck to the inexperienced mind is usually a well executed strategy in line with a superior model.<p>All in all, though, I think it wise to hold yourself responsible for your accomplishments - both geographic location and your circle of acquaintances is something you have significant control over.",1265943813
1119608,comment,1118991,1119391,0,0,kingkongreveng_,,,"If the app you need to script is C++ there are much more appealing options than Lua, which is very C.  You get ugly C style code in your C++.<p>QScript, ChaiScript, and projects like boost.python and libperl++, play much better with your C++.",1265943786
1119607,story,,,2,0,skorks,"Oracle calls for JavaOne papers",http://www.pcworld.idg.com.au/article/336035,,1265943779
1119605,comment,1118599,1119384,0,0,lucifer,,,"> In this case isn't someClassObject just a literal that's resolved at compile-time and erased into a simple identifier symbol?<p>No.  Its a variable assigned in runtime.<p><pre><code>   public void yesYouCan (Object foo, Class<?> someClassObject) {\n      // compile time?\n      if(foo.getClass() instanceof someClassObject) { ... }\n   }\n</code></pre>\nRegardless, class and symbolic resolution occur at both compilation (to create the binary clsss files) and in runtime in the JVM (to load and execute the binary generated by the compiler):<p><a href=""http://java.sun.com/docs/books/jls/second_edition/html/execution.doc.html#44487"" rel=""nofollow"">http://java.sun.com/docs/books/jls/second_edition/html/execu...</a><p>> You can't pass someClassObject as an argument to anything but an operator like new or instanceof, and you can't assign to or from it, it doesn't itself belong to a class. It isn't an object.<p>No, its quite possible/common to write methods that take class objects as parameters.",1265943736
1119604,comment,1119539,1119539,0,0,tripngroove,,,"Thank you for showing photos on a gray background - so much better for making them the focus!",1265943720
1119603,comment,1119596,1119596,0,0,rantfoil,,,"Loved people in time, money and spirit. And created beautiful software that brought people together.<p>Not sure if order matters, though doing the latter makes the former easier. =)",1265943705
1119602,story,,,1,0,skorks,"The Life And Times Of IE6",http://media.smashingmagazine.com/cdn_smash/wp-content/uploads/2010/02/IE6_final.jpg,,1265943658
1119601,comment,1119051,1119567,0,0,camccann,,,"At a global scale, the ""rains out of the atmosphere"" bit mostly covers it. Condensation and evaporation processes tend to make water vapor largely self-regulating, shifting around quantities of water that dwarf human factors.<p>However, where does the article mention water vapor? They're doing <i>electrolysis</i>, i.e., cracking water molecules apart. The desired result is the liberated hydrogen; the waste is oxygen--hopefully O2, or if you're unlucky O3, which is a pollutant in the lower atmosphere.",1265943606
