ID,Type,Story,Parent,Points,Comments,Author,Title,URL,Content,Created
5121743,comment,5119644,5120371,1,0,cabalamat,,,"Yes. Sorry, I should have made that more explicit.",1359233948
5121742,comment,5121433,5121671,3,0,jostmey,,,"It is unfortunate that so many people still believe in fairy tale creation stories of the world, enough so that crazy public officials are elected into office. But I suppose the Human mind by default is irrational.",1359233945
5121741,comment,5121432,5121685,4,0,ArchD,,,"Yes, and very type-unsafe. You could do all this using C++ templates in a type-safe way.",1359233940
5121740,comment,5120409,5120803,2,0,jtheory,,,"The trade-off is supposed to be that you can't <i>always</i> get a last-minute room at the Four Seasons when you book it for ""tonight"" -- sometimes they'll be sufficiently full that they won't have sold that block to HotelTonight, and instead of having a plush room right across the street from where you'll be working early the next morning, you'll need to settle for a ""motel"" right on the highway, 10 miles away.<p>I'm not sure how these things end up playing out (and if HotelTonight shows data that maps how often selected hotels actually have rooms available, that might undercut the hotels' stance a bit), but I know I wouldn't want to rely on it; even planning in advance, in my experience it's not terribly rare that hotels are booked up if you don't call early enough (and it's an in-demand area).<p>Edit: ah, yup -- that's HT's pitch to the hotels.  From the section for ""hotel partners"": The key to targeting these unique and valuable guests is the IMPULSE DEAL, a rate so you good you only use it when you absolutely need to move rooms at the last second. Since you dont have that need everyday, our display changes everyday, meaning guests can never predict when your hotel will be offered.",1359233937
5121739,comment,5120991,5120991,6,0,prawn,,,"For anyone else that had no idea:<p>Wikipedia: ""Fast Approximate Anti-Aliasing (FXAA) is an anti-aliasing algorithm created by Timothy Lottes under NVIDIA. It was first used on several games such as The Elder Scrolls V: Skyrim.""",1359233912
5121738,comment,5121242,5121644,4,0,wooster,,,"I'd be surprised and disappointed if those companies were using GCC to compile avionics code written in C++.",1359233894
5121737,story,,,1,0,bcn,"RovAir Aims to Be the Airbnb of Mobile Broadband Plans",http://allthingsd.com/20130126/rovair-aims-to-be-the-airbnb-for-mobile-broadband-plans/?mod=atdtweet,,1359233826
5121736,comment,5121072,5121377,1,0,arash_milani,,,"Can you please show what you mean in a demo. the link you posted is using the same ""float:left and pseduo-selectors with the margin rules"" or am I missing anything?",1359233813
5121735,comment,5121242,5121242,10,0,helmut_hed,,,"LWN has great coverage on the modularity issue, from the time period when Clang was just getting started: <a href=""http://lwn.net/Articles/301135/"" rel=""nofollow"">http://lwn.net/Articles/301135/</a>",1359233813
5121734,comment,5121242,5121496,8,0,bcoates,,,"Until around 2001, GCC supported U/WIN as a host and target platform. The FSF/RMS demanded they remove any code allowing that platform to work, so they did. The GCC project allowing technical decisions to be made for them for political reasons is not new.",1359233811
5121733,comment,5121287,5121618,11,0,hkmurakami,,,"So I guess a more productive donor gift would be to endow a chair or professorship.<p>edit: Donors can actually set up scholarships in their name too (and you can even restrict the students who can apply if you so choose -- say, only engineering majors, etc.). Many of my friends in college were given generous need based scholarships from alumni who had set up scholarship funds for future students.",1359233789
5121732,comment,5121492,5121631,7,0,jmillikin,,,"It's called ""roaming"", and most modern phones support it. The ""cheapest tower wins"" roaming described in the article would be difficult to achieve because of the massive web of contracts required. Not to mention the terrible user experience -- most users DON'T want the cheapest possible connection, they want the one that won't drop their calls.",1359233775
5121731,comment,5121287,5121581,4,0,rogem002,,,"> This economic downturn is breeding a whole generation of just-try-to-stop-me kids.<p>I disagree that the economic downturn is the cause of these young peoples motivations. I would argue that due to a large amount of people achieving a high level of education, degrees are not a foot in the door. As a result personal investments such as attending networking events, doing work experience and building an online presence (Such as a quality GitHub account) will make it a lot easier to stand out from the herd.",1359233762
5121730,story,,,4,2,jeffjia,"A New Side Project - Send2Cloud",http://jeffjia.github.com/Send2Cloud/,,1359233735
5121729,comment,5121242,5121662,6,0,helmut_hed,,,"This appears to be at least one of the source emails:<p><a href=""http://gcc.gnu.org/ml/gcc/2000-01/msg00572.html"" rel=""nofollow"">http://gcc.gnu.org/ml/gcc/2000-01/msg00572.html</a>",1359233697
5121728,comment,5110528,5121291,1,0,sogen,,,"What if someone needs less money (20-30k)?<p>BTW thanks for the info Sam.",1359233693
5121727,comment,5121061,5121222,3,0,SquareWheel,,,"Sticking an advertisement in there is enough to turn me off the service.",1359233679
5121726,comment,5115144,5119497,1,0,ChuckMcM,,,"Being ethical is something you do for you, not society.",1359233663
5121725,comment,5120400,5121677,1,0,specialist,,,"<p><pre><code>  Personally, I think our best option would be to do away with the notion of age-based grades.\n</code></pre>\nAgreed.<p>I've been chewing on two ideas.<p>Assess student achievement with actual achievements. Just like achievement badges in the Boy Scouts. My son is an Eagle Scout. After meeting the minimum requirements, and completing his project, he was able to assemble whatever achievements tickled his fancy. Promotes self direction and working at one's own rate.<p>Have students teach each other, work more collaboratively, grade each other. Versus lectures, rote memorization, and testing. I've experienced this first hand (as the student). Peer pressure and expectations work wonders. Hardest, most rewarding 'A' grade I ever earned. (I was otherwise a terrible student.)<p>Alas, to date, there's very little research on these two reforms. Some places have tried the achievement system, results inconclusive. I haven't looked to see if the peer support system has been tried else where.",1359233653
5121724,comment,5121404,5121404,8,0,doe88,,,"I really think for once Anonymous guys should shut up and find another <i>cause</i> to <i>defend</i>, because If they wanted to harm the currently insightful ongoing debate on the handling of the Aaron Swartz's case they wouldn't do otherwise. And btw the actions of Aaron Swartz were not even remotely comparable with the reckless behavior of Anonymous. All this can do is make Aaron Swartz guilty by association in the mind of the average person when she hear about the actions of Anonymous. It doesn't serve any meaningful purpose.",1359233629
5121723,comment,5120301,5120301,2,0,10098,,,"Watching these made me feel disgusting. Like I'm some creep going trough other people's laundry. Closed the tab and still can't shake off this feeling.",1359233560
5121722,comment,5110921,5119704,1,0,fnbr,,,"I actually did that, several times.<p>My mistake was that I didn't realize I was supposed to have Drake.jar in the same folder as the workflow that I was trying to execute (I'd keep getting the error 'Unable to access jarfile drake.jar'). Naive error, I suppose.<p>However, I'm still having trouble executing the 'A nicer way to run Drake' instructions. I created a file named 'drake' on my path, and inserted the given text. However, I keep getting the error<p>'Exception in thread ""main"" java.lang.NoClassDefFoundError: drake/core'<p>Was I supposed to alter the script in any way? I just naively copy/pasted.",1359233541
5121721,comment,5120578,5121033,1,0,Turing_Machine,,,"I'd be interested in seeing the study. For me, at least (and I think for many others) the thought of creating yet another login is enough to make me back out.",1359233470
5121720,comment,5118706,5119542,1,0,biesnecker,,,"Maybe I misinterpreted your question. My answer was to a question more along the lines of ""why do parents talk about parenting all the time?"" If the person offering advice is being a dick about it (be it about parenting or anything else), then sure, it's inappropriate. But at the same time I remember when my first was born, I was pretty darn receptive to advice because _I had no idea what I was doing_. I'm less receptive now because half a decade in I think I have a decent handle on things, but I'm still not hostile about it -- I generally smile and nod and ignore (which, come to think of it, is what I do whenever anyone offers me advice I don't need).",1359233450
5121719,comment,5106767,5108698,1,0,Evbn,,,"You have better things to do than tell people to invent time machines to go back and not do things that are already done.",1359233425
5121718,story,,,3,0,pragmatictester,"Clarifying Our Platform Policies for Facebook Developers",https://developers.facebook.com/blog/post/2013/01/25/clarifying-our-platform-policies/,,1359233422
5121717,comment,5120664,5121682,7,0,graue,,,"My opinion of Sweden's government has worsened considerably thanks to those <i>extremely</i> blatant examples of politically-motivated injustice. A high ranking shouldn't be an excuse to sweep real problems away.<p>For more on the Pirate Bay trial, see Falkvinge's post here:<p><a href=""http://falkvinge.net/2013/01/06/banana-republic-justice-behind-the-scenes-of-the-pirate-bay-trial/"" rel=""nofollow"">http://falkvinge.net/2013/01/06/banana-republic-justice-behi...</a><p>HN discussion: <a href=""https://news.ycombinator.com/item?id=5016277"" rel=""nofollow"">https://news.ycombinator.com/item?id=5016277</a>",1359233414
5121716,comment,5121061,5121061,1,0,dreeves,,,"Ooh, one of our competitors generalizes the idea of Facebook humiliation as a commitment device: <a href=""http://aherk.com"" rel=""nofollow"">http://aherk.com</a><p>Other startups offering commitment devices as a service: <a href=""http://blog.beeminder.com/competitors"" rel=""nofollow"">http://blog.beeminder.com/competitors</a>",1359233393
5121715,comment,5120664,5121275,3,0,lucian1900,,,"I'm pretty sure the parent was being sarcastic. Even vague knowledge of Europe makes that statement obviously silly.",1359233385
5121714,story,,,0,0,Giannicj,"Who Is...Meaku",http://www.bellanaija.com/2010/07/26/who-is-meaku/,,1359233323
5121713,comment,5121053,5121664,1,0,jiggy2011,,,"I don't necessarily disagree in this case. Though I can't think of many times in my career where I had explicitly calculate probabilities, though may be an outlier.<p>I think it's more a concern about a general attitude sometimes displayed on HN like ""You don't know how X86 handles memory alignment, dude you even code?""",1359233322
5121712,comment,5120496,5121516,1,0,mehulkar,,,"The only problem is the Facebook already has a billion users.",1359233316
5121711,comment,5120578,5120639,1,0,dpick,,,"There actually is a really basic diff tool right now (Click on revisions on the recipe page). I'm working on creating a more advanced one now. Any ideas on what a good interface might be?",1359233309
5121710,comment,5121242,5121496,4,0,Someone,,,"<a href=""http://gcc.gnu.org/wiki/GCC_Plugins"" rel=""nofollow"">http://gcc.gnu.org/wiki/GCC_Plugins</a> is a good starting point. I have no reason to believe that page deviates significantly from what GNU's. stance was at some point in time.",1359233300
5121709,comment,5120578,5121422,2,0,themckman,,,"To the GP, that was probably me. Unfortunately, we never got anything off the ground.<p>dpick, I'd be happy to share the ideas we were kicking around when thinking about this if you want to shoot me an email: john [at] nineteeneightd.com.",1359233297
5121708,comment,5121242,5121546,9,0,X-Istence,,,"FreeBSD is making the change, most of the code for the company I work for is only compiled with clang ... we do government work.",1359233267
5121707,comment,5119336,5121249,1,0,jawns,,,"But what I'm proposing is to gain the rights to create a derivative work based on TWO original works.  So, the copyright of the derived work would be assigned JOINTLY to the copyright holder of the original arrangement (the artist himself) and the copyright holder of the original lyrics.",1359233252
5121706,comment,5120578,5121273,2,0,dpick,,,"Thanks for the idea, I'll give it a try.",1359233205
5121705,comment,5119876,5119897,1,0,plusfour,,,"<a href=""http://dropandload.com"" rel=""nofollow"">http://dropandload.com</a><p>It works on most browsers",1359233196
5121704,comment,5119876,5119876,1,0,plusfour,,,"This is a lot better, and works on most browsers: <a href=""http://dropandload.com"" rel=""nofollow"">http://dropandload.com</a>",1359233148
5121703,comment,5106767,5109497,2,0,Evbn,,,"Please don't bully him like that. Have you learned nothing from this incident?",1359233142
5121702,comment,5121287,5121287,2,0,jrs235,,,"In order to stay afloat how many larger universities will no longer allow transfer credits to prevent people going to cheaper schools for gen Eds?",1359233138
5121701,comment,5121287,5121287,2,0,tstactplsignore,,,"As much as online degree may be the future, this is really out of touch. An online degree is still considered absolutely useless in academia, law, and medicine. Literally none of the students currently graduating in the top 5% of their classes will pursue an online degree as opposed to a traditional school.",1359233137
5121700,comment,5121287,5121287,1,0,vincefutr23,,,"does anyone know where to look to find out how much debt a college has or what their financials are?",1359233120
5121699,story,,,1,0,elkalioby,"     ",http://hawaa.society-ladies.com/2878.html,,1359233112
5121698,comment,5121432,5121432,-4,0,wildranter,,,"1) imperative programming\n2) functional programming\n3) OOP\n4) etc programming<p>They're jus programming paradigms. Take what you need and get the job done. Anything else is just a buzzword.",1359233111
5121697,comment,5121432,5121432,2,0,ExpiredLink,,,"Of course, this skips negligible parts of C programming like memory management.",1359233076
5121696,comment,5121242,5121426,15,0,agwa,,,"> It's worth noting that GCC already supports significantly more C++11 than either MSVC11 or ICC, although this article makes no such comparison<p>Really great point.  I don't understand why this article focused on C++11 of all things.  Until recently, gcc had much more complete C++11 support than Clang.  Now, it seems they're about on par (if feature tables are any guide[1]).  In fact, a couple years ago I was about to switch to Clang but when I started using C++0x I had to stick with gcc because Clang's support just wasn't there yet.<p>Also, LLVM's C++ Standard Library (libc++) is still pretty immature on Linux, so even if you use Clang for C++11 you're probably going to end up using gcc's standard C++ library anyways!<p>So yeah, this article is pretty sensationalist.<p>[1] <a href=""http://gcc.gnu.org/projects/cxx0x.html"" rel=""nofollow"">http://gcc.gnu.org/projects/cxx0x.html</a> and <a href=""http://clang.llvm.org/cxx_status.html"" rel=""nofollow"">http://clang.llvm.org/cxx_status.html</a>",1359233067
5121695,comment,5121433,5121671,10,0,Jtsummers,,,"Because huge swaths of the population either agrees with them or agrees with their other political/economic/religious views.<p>Personally, what shocks me more than individuals getting elected, are the educated individuals who believe it. I work in an office filled with engineers. Amazingly, my first cubicle neighbor, and I've found he isn't an outlier, was a diehard young earth creationist. Electrical engineer, 4 year degree at a good school. Still somehow believes in a vast conspiracy by scientists in league with the devil to hide The Truth. At a previous company, another engineer, this one with a PhD, was not ashamed of the time he berated guides/curators at the Museum of Natural History for a display on dinosaurs.",1359233053
5121694,comment,5120978,5121452,2,0,jjhooper,,,"Have you ever wondered where the money comes from to pay you the cash back? It's from charging higher merchant fees for rewards cards - so it's just a shell game really.<p>If merchants can charge a higher excess for rewards cards, that will help level the playing field.<p>It's a shame AmEx isn't included in the deal.",1359233036
5121693,comment,5120991,5120991,1,0,jiggy2011,,,"If they did decide to ditch real time and low level control on the next Xbox is there any reason it couldn't just be type of Windows RT device?<p>Basically turning the xbox into an alternative to a desktop PC?",1359233022
5121692,comment,5106767,5109236,2,0,Evbn,,,"And yet you expressed your idea in under 140 characters.",1359232978
5121691,comment,5120444,5120444,1,0,pablisco,,,"Why not create a P2P server that runs on something simple like a raspbery pi to provide supporting backbone for the network. They are cheap and small. This could make an awesome kickstarter project. Maybe make it like a keychain that wakes up every 5-15 minutes to update/broadcast messages",1359232974
5121690,story,,,2,0,quakkels,"Learn Bubble Sort with Playing Cards",http://codecr.am/blog/post/4/,,1359232890
5121689,comment,5121287,5121618,3,0,akadien,,,"This is quite true.  For state schools, new buildings may be a ""gift"" from the political class to show the public their support for higher education.  The stupid irony is those buildings typically don't come with operations and maintenance funds.  At the same time, state appropriations are decreasing, putting the pinch on O&M and department support.  The university (or publicly supported research institute) has a shiny new building in which they can put neither equipment nor people.",1359232890
5121688,story,,,6,0,jamesjyu,"Why Times Square Needs a McWorld",http://www.theawl.com/2013/01/giant-mcdonalds-times-square,,1359232846
5121687,comment,5120496,5120672,5,0,wildranter,,,"Really simple. They need to pay their bills.<p>I'm sure your frinds rather be working for some project that would make the world better (hey Linux, I'm at you!:) But, still, they have to pay bills.<p>That's life. Don't like it? Change it.",1359232839
5121686,comment,5121287,5121287,5,0,mitchty,,,"It's already starting.<p><a href=""http://www.cva.edu/"" rel=""nofollow"">http://www.cva.edu/</a> This college in St Paul last year just got some art accreditation that purportedly takes into account future financial viability. They just announced they can't remain financially solvent. So much for accreditation.<p>At this point I think education will have a rather interesting next few years.",1359232837
5121685,comment,5121432,5121432,6,0,dkhenry,,,"When reading this title my default reaction was ""Oh God Why"" I am happy to see the author agrees with me. As an intelectual excersize I think this is great showing that yes C is  very very flexable ( You can do the same stuff with C++ and it will look nicer BTW[0]) but please don't do this, Its messy and hard to trace.<p>[0: <a href=""http://www.boost.org/doc/libs/1_49_0/libs/range/doc/html/range/reference/adaptors/introduction.html"" rel=""nofollow"">http://www.boost.org/doc/libs/1_49_0/libs/range/doc/html/ran...</a>",1359232830
5121684,comment,5119521,5120143,1,0,graue,,,"People <i>liked</i> Gmail, though. It was a product everyone loved, a major upgrade for webmail. Google+, on the other hand, has some cool features but is also a cudgel that Google is beating us over the head with if we want to post YouTube comments, Google Local reviews or Play Store app reviews, none of which ought to require using a real name. As Gmail users we're constantly nagged to ""upgrade"" to Plus. These are legitimate reasons to dislike G+; it's not just jealousy.",1359232800
5121683,comment,5120400,5121453,4,0,MichaelGG,,,"Even if there were no advancements, which is certainly not the case, no, it would still probably not be a good use of the money. If all forms of cancer are simply unsolvable (not the case), then research would be better spent on researching other diseases, working to change healthcare so the costs are not extremely expensive, and so on.<p>And why spend $100K+ to save one child? Why not that money, to, say, feed many starving children? Or build housing?<p>If ""trying to help him"" would be a form of ""great research"", then chances are someone would be interested in it. You might need to realise that he is simply unlucky. But not necessarily any more unlucky than a child that gets polio, or has their skin burned off, or is left brain damaged from a car accident.<p>It's complicated and sad, but denouncing long-term investment because of immediate sad situations will only create more sad situations.",1359232797
5121682,comment,5120664,5121585,6,0,nisse72,,,"> pretty corrupt<p>Based on those two examples?<p>According to this: <a href=""http://cpi.transparency.org/cpi2012/results/"" rel=""nofollow"">http://cpi.transparency.org/cpi2012/results/</a><p>...4 nordic countries place in the top 7. Sweden is nr 4. The US is nr 19.",1359232763
5121681,comment,5120400,5121221,0,0,illuminate,,,"Complicity is only with those willfully ignorant, I imagine. Colonialism ~is~ a malevolent mass. ""Rich white persons"" tend to be the force behind colonialism, but theoretically it could be anyone.",1359232751
5121680,comment,5120496,5121589,2,0,CamperBob2,,,"Considering that the movement of money is all that ever changes anything in today's world, I don't think that's a bad idea.  I'd listen to their pitch, put it that way.",1359232709
5121679,story,,,1,0,mylion,"Conquer the Search Engines in 15 Steps",http://graphicality.com/conquer-the-search-engines-in-15-steps/,,1359232697
5121678,comment,5118174,5120979,1,0,csomar,,,"I smelled sarcasm, thanks for clarifying. Otherwise, why would you consider getting back to college? Nostalgia for college days or just because you didn't had that experience? What value do you think it could bring? (I dropped for 2 years, and still not sure what to do next)",1359232695
5121677,comment,5120400,5121135,4,0,SoftwareMaven,,,"The application process is one of those interesting ones. I completely agree that having a different ruleset but same grading process is completely wrong, but I think that says more about having involvement from too high of a governmental level.<p>Personally, I think our best option would be to do away with the notion of age-based grades. Make progression based on competency (at least for the core curricula), so if you are highly competent in math, you may be with students several years older than you but if your writing stinks, you may be with younger kids.  Instead of trying to force kids into a mold that very few fit comfortably in, let them grow in their own ways.<p>I would love to have my kids attend a school like that. My daughter, who is a gifted writer and artist but struggles non-stop with math (and there are physiological reasons for that) would be able to be comfortable in school and, as a result, better able to focus on her strengths instead of trying to shore up weaknesses that only matter for testing programs.<p>If the charter system allows more experimentation, then that alone justifies its existence; but the transition of more than 100 years of ""prepare them for the factory"" type of education to ""prepare them for knowledge work"" will not painful, especially since we still need some of the ""prepare them for the factory"" and many more ""prepare them for a trade"".",1359232671
5121676,comment,5121274,5121274,2,0,emkemp,,,"""With his penchant for harems, I imagine McAfee will need all the anti-virus protection he can get.""<p>Heh.",1359232632
5121675,comment,5120991,5120991,1,0,duskwuff,,,"I don't know about the PlayStation, but there's reason to suspect that the XBox leak was fake:<p><a href=""http://x-surface.tumblr.com/post/41282771026/x-surface-dont-believe-everything-you-read"" rel=""nofollow"">http://x-surface.tumblr.com/post/41282771026/x-surface-dont-...</a>",1359232620
5121674,story,,,1,0,rrhoover,"Vine: The Next Big Marketing Channel?",http://insidetheproduct.quora.com/Vine-The-Next-Big-Marketing-Channel,,1359232578
5121673,comment,5121061,5121061,2,0,wahnfrieden,,,"Do alternative alarm apps still require you to leave the phone on all night?",1359232550
5121672,comment,5120400,5121563,-1,0,illuminate,,,"""Sounds like ""Rich White Guy"" is the best person to solve the problems, then""<p>This is not a binary ""problems"" or ""no problems"". The manner by which colonialists ""improve"" the rest of the world is at the expense of the rest of the world.<p>Not commenting on Gates' particular methods, but injecting money generally comes with a cost, and at various freedoms of the countries involved. At best of intention, throwing money at a problem is not usually solving the conditions behind a problem.",1359232545
5121671,comment,5121433,5121433,14,0,efnx,,,"Can someone explain to me how young earth creationists can even exist at high levels in our government? It just seems so embarrassing. I feel like I'm taking crazy pills here.",1359232543
5121670,comment,5119600,5121217,1,0,rdtsc,,,"That could be interpreted as sarcasm or not. Wish you'd used a /s or whatever the marker for sarcasm is these days.",1359232542
