ID,Type,Story,Parent,Points,Comments,Author,Title,URL,Content,Created
5121669,comment,5120998,5121574,1,0,vidarh,,,"I got the impression that when mentioning HIV and toenail infections etc., he's talking about the overall technique of a ""nanomedicine"" delivery via a hydrogel that ""self assembles"" when it comes into contact with water.<p>The <i>specific</i> instance of that which they are currently focusing on appears to be targeting only bacteria, but since the method is focused on mechanical destruction of the cells, presumably they might be hoping that they can adapt the technique to detect and destroy other things as well.",1359232519
5121668,comment,5118439,5120667,1,0,jcoder,,,"That's really interesting---I assumed it was just really bad JPEG compression!",1359232446
5121667,comment,5120664,5121141,7,0,illuminate,,,"This ""we're the best because we're the best!"" attitude is harmful and resting on laurels ""as an American"" is why we're not the best, leading to a continued erosion of freedom, ill-action, and our deserved opinion in the eyes of the rest of the world.",1359232372
5121666,comment,5120407,5121648,3,0,tsm,,,"Maybe 3 needs to become 42. Maybe x needs to become price. Maybe miapelling needs to become misspelling. I pretty frequently have a one-character thing that needs to be replaced.",1359232366
5121665,comment,5120400,5121075,4,0,erikpukinskis,,,"Education and income both seem to effect fertility independently. There is evidence that income correlates with higher fertility, even controlling for education: <a href=""http://hal.archives-ouvertes.fr/docs/00/52/09/48/PDF/publi_pdf1_dt_167.pdf"" rel=""nofollow"">http://hal.archives-ouvertes.fr/docs/00/52/09/48/PDF/publi_p...</a> and vice versa: <a href=""http://csde.washington.edu/~scurran/files/readings/May12/Why%20Does%20Education%20Lead%20to%20Lower%20Fertility.pdf"" rel=""nofollow"">http://csde.washington.edu/~scurran/files/readings/May12/Why...</a><p>That said, all of the science on the subject is measuring very specific things and should be interpreted narrowly.  You can say income is broadly correlated with fertility, and rule out some specific measures of education as an explanation for that particular (small) piece of the variance pie, but you can't then just make up an explanation and pretend it's supported by science. Just-so stories like the one you're telling are at best food for thought, or fodder for future experimental hypotheses. There's no scientific basis that I know of for the kind of mechanism you're proposing. Though I'd be happy to see more studies on the subject.",1359232362
5121664,comment,5121053,5121656,2,0,cperciva,,,"Right, which is why I was making the point that there are a great many situations where an understanding of probability will help.",1359232361
5121663,story,,,1,0,paulbjensen,"Using APML to make money from data",http://blog.new-bamboo.co.uk/2008/8/29/apml,,1359232353
5121662,comment,5121242,5121496,1,0,categoryjid,,,"Do you have a link to that email? Interested to see what he said.",1359232352
5121661,comment,5117385,5117385,1,0,benrmatthews,,,"Amaingly transparent organisation too. You can see every patient they've ever funded and the outcome of their treatment in a Google spreadsheet, here:<p><a href=""https://docs.google.com/spreadsheet/pub?key=0Ah3wJ9CRQzyHdDZSaEF1X1JsRm1yZ251d0RQZ0VmRGc&gid=0"" rel=""nofollow"">https://docs.google.com/spreadsheet/pub?key=0Ah3wJ9CRQzyHdDZ...</a>",1359232348
5121660,comment,5119336,5119565,1,0,chc,,,"I can't find where that <i>is</i> explained thoroughly. This was <i>claimed</i> but not explained very well in the comments on the article. If I write some music and then later put out a cover version of another song set to that tune, how do I lose my copyright on the music I wrote?",1359232313
5121659,comment,5121061,5121591,1,0,ap0rnnstar,,,"Thanks for the feedback damon_c. A friend of mine had similar ideas. I'd love to add features like this. I can use all the help I can get. Can you shoot me an email abrahamagopian@gmail.com, or I can contact you.",1359232293
5121658,story,,,2,0,jpadilla_,"Watch the best Pep Talk ever given by a Kid",http://mashable.com/2013/01/26/kid-president-pep-talk/,,1359232257
5121656,comment,5121053,5121613,2,0,jiggy2011,,,"This is true, though arguably lack of any knowledge about anything is a deficit.<p>Since it's impossible to know everything about everything, it's really a question of ""what is the probability that this will be useful?""",1359232236
5121655,comment,5121242,5121546,19,0,Scaevolus,,,"Google and Apple already have.<p>Switching compilers isn't that difficult, especially when they're as reliable as GCC and Clang.",1359232225
5121654,comment,5119600,5121266,3,0,rosser,,,"Seriously? This again?<p>Anonymous is <i>not</i> Rosa Parks.",1359232217
5121653,comment,5120444,5120444,1,0,jcoder,,,"Will this promiscuously share with any other reachable running instance? Does that, combined with anonymity, create a risk that an adversary could distribute misinformation directly to protesters via this app?<p>(EDIT: rephrased as question)",1359232199
5121652,comment,5119876,5120209,2,0,piranna,,,"Chrome v26 has native DataChannels, but I didn't have time to update my polyfill and also it gave me problem the last time I tried it, so I'm waiting until it gets out of Canary.<p>Yes: I developed DataChannel-polyfill, the first working implementation of the DataChannels specification, too... :-)",1359232154
5121651,comment,5120496,5120705,9,0,CamperBob2,,,"It seems like a legitimate way to reconcile one's conscience with the <i>realpolitik</i> of modern IT employment, engaged as we are in building the surveillance state/police state/nanny state we were all warned about by 20th century novelists and historians.<p>I try to do this when I buy an RIAA-published album or watch a Hollywood film.  I make sure I donate an equivalent amount to civil-liberties orgs (EFF, ALA, and others) during that year.<p>""Carbon credits,"" basically.",1359232151
5121650,comment,5110528,5112490,1,0,CanadaKaz,,,"Amount depends on VC, Angel, or Incubator stream. (There are three streams.) The reason we did it this way is because we think gov't is bad at picking good start-ups and that VCs, Angels, and Incubators are better. The funding is minimal. (As low as $25K for angels for example.) We just want people saying ""this person is good, let them in"" have skin in the game.",1359232141
5121649,comment,5120409,5121625,7,0,kodablah,,,"In many occupancy-based price optimization algorithms (at least in the multi-family sector where I previously worked), it is not optimal to maintain 100% occupancy. It doesn't allow much flexibility. I've seen recommendations for apartments around 95% to cope with fee changing, turn over maintenance etc. I'm sure hotels are in a similar situation (but have even lower percentage due to guest volatility).",1359232135
5121648,comment,5120407,5120504,1,0,wahnfrieden,,,"Could you explain your use cases of `s`? I've basically never found a use for it given `c` and `r` or `R` but maybe I'm missing something.",1359232131
5121647,comment,5120655,5120655,1,0,jkaykin,,,Me!,1359232099
5121646,comment,5109560,5110196,1,0,jacalata,,,"Are you suggesting that the genetic grouping of white males is scientifically accepted as being a better ruby conference speaker than non-white or non-male people?",1359232099
5121645,comment,5121061,5121335,1,0,novalis,,,"Sorry for the OC. I may have missed something here.\nI don't see how two checkboxes equal 4 bits of information by default. In this case you can have two checkboxes depending on 1 bit that can represent and/or count 2 values regardless the two checkboxes being complementary or contrary. Four bits can represent up to 16... Are you referencing ""bit"" for ""piece"" and also for ""binary digit"" ? Other ?",1359232059
5121644,comment,5121242,5121619,11,0,hosay123,,,"Apple manufacture consumer entertainment devices that are neither safety critical in nature nor difficult to field test. Think more along the lines of Boeing, Northrop Grumman or Raytheon.",1359232055
5121643,story,,,1,0,hambone1,"MARIJUANA PRICES AROUND THE WORLD, MUST SEE THIS",http://www.cannaberg.com,,1359232047
5121642,story,,,4,0,shuaib,"The End Of The Mac Is Coming, And Apple Is Thrilled",http://www.businessinsider.com/the-end-of-the-mac-is-coming-and-apple-is-thrilled-2013-1,,1359232039
5121641,comment,5121021,5121021,1,0,trickaduu,,,"Sounds like a good idea, seems too big for Flippa if you ask me. Have you asked any of the sites mentioned above if they're interested? Or a largely offline company?",1359232019
5121640,comment,5120020,5121464,1,0,calpaterson,,,"> Mongo makes dev easy, but I worry about the long term cost when things get complex. I did a job recently and found that my brain struggled to keep the internal Mongo doc structure intact.<p>I don't worry too much about that.  You can use the repository patten to manage the serialisation and storage of your objects.  Given this is something you'd typically do in most backends, I don't think it's a big ask.  I do worry about the Mongo scare stories.<p>> You can use Celery (uses RabbitMQ/Redis/Mongo/whatever underneath for the broker) for offloading the jobs in Python. Just add a decorator to your work function, makes it really easy (you can also use PiCloud if you need something with more crunching power)<p>I can't remember evaluating Celery, so possibly I overlooked it.  Perhaps it didn't work with Python 3 at the time?<p>I'll have to look into Angular.",1359232015
5121639,comment,5120882,5120882,2,0,juriga,,,"Great news! I've been using Recon.io for a couple of months now and found the alerting functionality really useful. It's basically Google Alerts for Twitter: just enter your product/company name and have one less feed to worry about.<p>Their database of journalists is also quite valuable already. I've entered ""analytics"" as the industry keyword and I get a couple of alerts every week for similar product launches covered by well known journalists.<p>In the future I'd love to see more history and aggregates on the dashboard (now only shows tweets from the last 7 days).",1359232014
5121638,comment,5120444,5120444,4,0,pasbesoin,,,"I ask this from a fairly clueless, out-of-date perspective, but are the current Bluetooth stacks and implementations robust enough at this point to trust?  (Aside from all the higher level stuff.)<p>P.S.  I agree with what I think is the principle behind this -- I have for some time, with respect to freedom on the Internet and its like.  That being that the only true security and reliability will come from owning and controlling the physical layer.<p>I also like that, unlike with autonomous wifi access points, the signal might be able to hide -- and move about -- within a larger sea of Bluetooth connectivity and at lower powers and therefore exploitable ranges.  If I'm thinking about this at all correctly (I'm unsure).",1359232012
5121637,comment,5120400,5120400,-1,0,wildranter,,,"Hey Bill Gates! Fix what Aron Swartz was fighting for.",1359231995
5121636,comment,5119876,5121583,1,0,piranna,,,"Currently I'm using PubNub as a ""pool of peers"", where a new peer connect and send a ""presence"" message that's listened by the previous peers, that then send a SDP offer to that new guy. Later, it keeps waiting some time sending offers to the new guys, and when it has several connections (from older and newer peers) it disconnect and start to search for new peers only over the WebP2P network.<p>Ideally, I would like to use something more ""agnostic"" like SIP or XMPP, but didn't be able yet to do it in an anonimous way, since both protocols require to create accounts somewhere that later when you register on a SIP or XMPP server it ask to confirm that you exists, so goodbye anonimity :-(",1359231974
5121635,comment,5116093,5117403,1,0,Pinatubo,,,"How long ago was this written?  They make reference to ordering typewriter ribbons ...",1359231941
5121634,comment,5121242,5121496,5,0,masklinn,,,"> If they were truly opposed to people using GCC as a module in a larger system, why would they go out of their way to encourage modularization?<p>Because Clang happened.",1359231938
5121633,story,,,2,0,bolshchikov,"ECMAScript 6 - The new parts of JavaScript",http://blog.bolshchikov.net/post/41526603450/ecmascript-6-the-new-parts-of-javascript,,1359231909
5121632,comment,5121061,5121061,1,0,astine,,,"This is clever, but the problem that I at least usually deal with is not waking on time, but getting to bed at a reasonable hour, especially if I'm using social media before bed. A Facebook plugin which told the user to go to sleep and maybe told his friends that he/she should be in bed so they should stop talking with him would actually be pretty cool.",1359231881
5121631,comment,5121492,5121492,6,0,wtracy,,,"I really like the ""cell phone that connects to multiple networks"" idea. Not just for the ability to make the cheapest call, but for the ability to make a call from anywhere that has reception from <i>any</i> provider.<p>I wonder if that could pave the way for boutique carriers that provide connectivity in hard-to-reach spots (say, the bottom story of a parking garage). The building owner could potentially take a cut on the phone fees the same way that building owners extract a fee from ATMs on their property.",1359231859
5121630,comment,5120978,5121420,2,0,dangrossman,,,"It isn't. I had a FICO score of 795 with no credit card utilization at all. I get the best loan terms and was approved for a mortgage of up to a million dollars recently. No credit card utilization ratio is required to have an excellent credit score. Simply having a card and stuffing it in a drawer for a few years, while never missing a utility or loan payment, will hit all the marks that matter.",1359231856
5121629,comment,5121492,5121492,3,0,cbryan,,,"Does anyone know what bands they're talking about? What's the theoretical max bandwidth on these new frequencies?",1359231837
5121628,comment,5121242,5121426,10,0,categoryjid,,,"PhDs don't do 'final year projects'. They don't really do 'projects' at all. They produce a thesis based on original research over a period of three or more years. If a PhD student is starting some kind of project in their final year, they're seriously fucked.",1359231823
5121627,comment,5121287,5121604,4,0,HarryHirsch,,,"You especially see this phenomenon at state universities.  The university gets a new building, and the politician gets a photoshoot.  Renovating an existing building, on the other hand, would save the taxpayer money but doesn't offer opportunities for photo-ops.",1359231804
5121626,story,,,1,0,wallflower,"A single 3D-printed burger currently costs over $300,000 to make",http://www.geek.com/articles/geek-pick/a-single-3d-printed-burger-currently-costs-over-300000-to-make-20130122/,,1359231790
5121625,comment,5120409,5121528,3,0,CamperBob2,,,"I must be missing something here.  How does an empty room make any money?",1359231779
5121624,comment,5119373,5121427,1,0,OafTobark,,,"Tell that to the numerous kickstarters, some of which are two guys in a garage figuratively speaking. I might be assuming but it sure comes off that way in quite a number of cases. Not discounting the need of having background knowledge but still",1359231773
5121623,comment,5119600,5120690,3,0,EthanHeilman,,,">There is no right or wrong way to fight for freedom.<p>There are two wrong ways to fight for freedom (or any noble cause): (1). to fight unjustly and (2). to fight ineffectively. Starting a fight is not without a cost to a side that loses the fight, that cost may be in lives, money or emotional energy. To fight ineffectively for a noble cause is to fight unjustly since you hurt your chances of winning, to fight unjustly but effectively for a noble cause turns a noble cause into an unjust cause.<p>>IT is a fight a fight is a war.<p>Not all fights are wars, nor are all wars fights (for examples wars have been fought to pump up nationalism or to test a doctrine with neither side actually engaging in real fighting. If you read 'The Prince' much of the wars between the cities of Italy are not fights).<p>>There are very few rules in war.<p>The appeal to a war mentality you are making is an appeal to as you say ""few rules"". This is both untrue in that most wars are fought within a large number of rules and limited in scope, most wars are not absolute wars, and absolute wars tend to consume the original causes for the war. Absolute wars are wars for the sake of war rather than wars for the sake of principal. To advocate a war mentality for the purpose of arguing that few rules apply is completely self-defeating since such a war destroys the original purpose you are attempting to achieve.<p>>make no mistake if there is a fight - there will only be one winner.<p>This is certainly not true, you can have all losers, all winners or any combination thereof. Who wins in a absolute nuclear war? Maybe invertebrates, maybe not.<p>Do not take this post as defense of the earlier poster.",1359231763
5121622,comment,5121498,5121498,1,0,evoxed,,,"MacConnection has them for $300 off since December if you go through the link on AppleInsider. That being said, I think it'd be better if flash sales and the like weren't posted to HN.",1359231749
5121621,comment,5120578,5120578,1,0,dguaraglia,,,"This is pretty amazing. I had thought how cool it'd be to have something like this a bunch of times (specially when I want to find simplified curry recipes.)<p>I seem to recall someone put something similar on HN a few months ago. Any ideas who it was?",1359231737
5121620,comment,5120998,5121562,4,0,icegreentea,,,"From my quick skip of relevant literature (there's a butt load of research in antibacterial hydrogels), we really aren't in any position to answer that question yet. The mechanism described in the press release is actually speculative.<p>Many of the papers raise that mechanism as a possibility, but they'll also note that there are many human cells that have a cell membrane at least as electronegative as bacteria, and that they witness antibacterial effects against relatively neutrally charged bacteria membranes as well. One example can be found here [1]. Try flipping through the mechanism and cytotoxicity (how dangerous it is to human cells) sections.<p>Basically, this is all exciting new research, but there really are no hard answers yet.<p>[1] <a href=""http://www.ncbi.nlm.nih.gov/pmc/articles/PMC2650250/"" rel=""nofollow"">http://www.ncbi.nlm.nih.gov/pmc/articles/PMC2650250/</a>",1359231705
5121619,comment,5121242,5121546,10,0,taligent,,,"I'm confused but didn't Apple just do this for two operating systems.<p>And then moved their entire OSX and iOS development community as well ?",1359231704
5121618,comment,5121287,5121287,20,0,danielford,,,"One reason for new buildings on college campuses is that donors and the government are much more willing to give funds for that purpose than they are for salaries and benefits, which make up the bulk of most college budgets.  So, I understand your frustration if you're angry about tuition rising while your college is erecting a new building every three years, but those are usually two separate piles of money, and there's not much your college can do to change that.<p>That said, I still flinch every time I hear about a new building on our campus.  I'm increasingly uncomfortable with the perception that colleges are living large while tuition rates climb, and I feel we should be more conspicuously frugal to combat it.",1359231704
5121617,comment,5121287,5121519,4,0,guptaneil,,,"I edited the post, it was poorly worded. My intention was to say that colleges are at least somewhat protected from just ""going out of business"" since that would potentially destroy the lives of thousands of recent graduates.<p>As far as why they would do that, my guess is that is probably a requirement to get accredited.",1359231703
5121616,comment,5120444,5121544,2,0,matt2000,,,"Yeah if I remember correctly the built in Bluetooth file transfer actually won't send an apk, which was definitely surprising to us too. We could send it over our custom app, but that's the problem - what we're trying to send is the custom app itself.",1359231697
5121615,story,,,0,0,areaattawia,"Extra long headphone cord? Try this",http://www.shapeways.com/model/847938/cordli-iphone-4-4s-case-bottom-half.html?li=productBox-search,"Simple practical solution for a problem I have. iPhone case for headphone cords.",1359231654
5121614,comment,5120020,5121341,3,0,calpaterson,,,"I think you're misunderstanding what a single page app is.  If a single page app is degrading gracefully when Javascript is turned off then it is probably not a single page app.",1359231645
5121613,comment,5121053,5121578,4,0,cperciva,,,"We're very good at working around our deficits.  The fact that someone can be a successful developer without knowing basic probability doesn't mean that a lack of knowledge of probability isn't a deficit; they might be a much better and <i>more</i> successful developer if they filled that gap.",1359231610
5121612,comment,5121242,5121454,6,0,ajross,,,"Not really.  EGCS was producing real, usable releases while it was forked.  It wasn't a rewrite in any meaningful sense.",1359231564
5121611,comment,5121242,5121242,11,0,asveikau,,,"Last few times I've seen Phoronix articles my impression is honestly ""this is a troll website, right?""<p>But I was pretty surprised by the attitude that surfaced very early in the linked thread on the GCC list, too.  Outwardly hostile, as if to say, ""well damn, you losers sure better catch up with LLVM right this instant, otherwise you're making lame excuses"".  I don't have any involvement in either project (other than the fact that I've used and appreciated both compilers), but this strikes me to fundamentally misunderstand open source.  Does LLVM have to fail for GCC to succeed?",1359231528
5121610,comment,5120444,5120716,1,0,jchrisa,,,"Great thought on signing before secrecy. Have you looked at the ietf JOSE project for signing json?",1359231510
5121609,comment,5120496,5121487,4,0,meaty,,,"I think it's more that most of the users are ignorant of the privacy implications.",1359231503
5121608,comment,5119644,5120420,1,0,onlyup,,,"I got ""Amazon for Ugly People"" hahaha",1359231488
5121607,comment,5120496,5120839,3,0,larrykubin,,,"I think this is a reference to a story on The Onion:<p><a href=""http://www.theonion.com/video/cias-facebook-program-dramatically-cut-agencys-cos,19753/"" rel=""nofollow"">http://www.theonion.com/video/cias-facebook-program-dramatic...</a>",1359231477
5121606,comment,5120409,5121541,10,0,tedunangst,,,"Human nature is incompatible with a rational sense of fairness. Everybody could start off happy with the price they paid, but upon discovering other people are also happy, will become unhappy.",1359231456
5121605,comment,5121287,5121287,1,0,eksith,,,"The college I went to, nearly went out of business several times. I think now, attendance is rising as people who're out of work are going back to school. I have two jobs for now, but I'm thinking of quitting one and going back to school myself.<p>Although it's awkward majoring in something that has nothing to do with your current line of work.<p>What's really annyoing is that no one asks for your GPA (well at least, they didn't ask me) no matter where I applied; just the school and what courses I took. The more I see people who don't have a college degree getting things done, the more I feel college, while you do learn, is still a scam as far as jobs are concerned. And I'd rather learn for the sake of learning than learn just to get a job.",1359231455
5121604,comment,5121287,5121395,6,0,_delirium,,,"Another revenue-related reason is that many large donors want their money put towards construction. A lot of donations >$10m are specifically earmarked towards construction of a building named after the donor.",1359231455
5121603,comment,5119352,5119560,16,0,georgemcbay,,,"IMO the lessons aren't really patronizing.<p>I'd TL;DR them down to ""Whatever your bright idea is probably isn't as original as you think.  If you think nobody else has thought of it you probably haven't looked very hard, or if you're very lucky the numerous other people who thought of it at the same time as you or before you never pursued it"".<p>We all live in the same world (now more than ever), we're all influenced by the same things and IMO ideas are more tied to a time and the zeitgeist than they are to any person, every personal and historical ""bright idea"" I've ever encountered backs this up in my experience.<p>This is why ideas are a ""dime a dozen"" and execution is everything.",1359231449
5121602,comment,5119939,5119939,1,0,Benferhat,,,"I like them, but the animations make no sense. The words shouldn't move.",1359231440
5121601,comment,5121092,5121361,-4,0,wildranter,,,"Who cares about your silly integer decrements anyway? (a.k.a. downvotes) I just broke glass of wine, the only thing that could get me into a known state. Or not?<p>If you can't (silly miopict people) can't deal with the truth of life... Who cares anyway? (just a tip: in the end you're gonna get fuckecked anyway, so start fucking or get vanished). Anyway, open your eyes.<p>PS, ASK PG: Why do you make so easy for pussies to get away with their cumbersome opinions by simply down voting instead of incentivizing them to manning up?",1359231430
5121600,comment,5101813,5121577,1,0,speromeliora23,,,"And I've been through this myself, billions other experience this eventually, everyone learns in their own way... As Chuck Palahniuk says in Fight Club, ""it's only after we lose everything, that we are free to do anything""",1359231411
5121599,comment,5087065,5088054,1,0,archgoon,,,"That's not a sidechannel. That's adding noise to the main channel.",1359231400
