ID,Type,Story,Parent,Points,Comments,Author,Title,URL,Content,Created
5121598,comment,5121242,5121550,7,0,jmillikin,,,"That implies that the previous lack of modularization was a practical decision, not a political or philosophical one. Implementation of the GCC plugins system started in 2008. Can you imagine the GCC team completely changing their philosophical stance almost overnight (Clang's first release was in mid 2007), just to get more users? It would be as if they'd relicensed to proprietary software to better compete with VC++.<p>Previously GCC's primary competitor was ICC, and they were compared based on the quality of their output. Now GCC's primary competitor is Clang, and they compete on how user-friendly their interface is. Modularization is a user interface improvement, just like better error messages or more comprehensive warnings.",1359231380
5121597,comment,5120978,5121452,1,0,dangrossman,,,"Your credit card didn't protect you from fraud, it exposed you to it. It's only because you paid for something by giving away a number that gives anyone arbitrary access to your bank that you had money stolen, had to watch your statements to notice it, and had to file a chargeback to get the money back. Hackers on the web can never reach into your wallet and take $250 -- this is a drawback of your credit card, not ""protection"" offered to you.",1359231374
5121596,comment,5120301,5120651,1,0,CamperBob2,,,"Not acceptable.",1359231353
5121595,story,,,2,0,acremades,"The Silicon Valley Housing Market Is Only Going To Get Crazier ",http://m.techcrunch.com/2013/01/26/the-silicon-valley-housing-market-is-only-going-to-get-crazier/?icid=tc_home_art&,,1359231345
5121594,comment,5121404,5121513,7,0,quomopete,,,"It's not really coverage of his suicide that this site and the tech community is concerned with, to be clear. It's his life and the significance of him not being around anymore that is the focus. Aaron meant <i>a lot</i> to this community as he stood in and stood for the ethos and practices of the community of Internet users and workers.<p>He was a prolific writer and practitioner on issues that concern this community very much. He was also a sheer phenomenon in himself in that he grew with the growth of the world wide web and espoused and embodied many of it's inherent virtues and values to society. There is also a pretty strong narrative going that his untimely passing is a close consequence of his beliefs, which influenced many in this sphere (and also those outside of it, who might not even have known him at all).<p>I don't think you're being disrespectful or callous. Perhaps you're curious, though. The outpouring of information, discussion and attention is in and of itself an indication that this is a very big deal to many here and that it is important to keep this discussion alive and it might be useful to dig into it and see what is being said of all this.",1359231311
5121593,comment,5120301,5120301,1,0,CamperBob2,,,"Transcode it out of Flash on the fly and you'll really have something!",1359231308
5121591,comment,5121061,5121061,2,0,damon_c,,,"Maybe it would be a good idea to appeal on facebook to the user's friends to text/call/Dm them to wake them up.<p>The people i know who need something like this would sleep through public, humiliation, fire... But if the phone was ringing repeatedly... and it was their actual friends that they might not have heard from in awhile, they would wake up for that.  Maybe you could even make it easy (click here) to call them with one of those phone call APIs or something.<p>Probably best to encourage them to only use this when they really need to wake up.  Or maybe it happens after the 3rd of so snooze...<p>I actually like this idea.  Let me know if you want help.",1359231294
5121590,comment,5121242,5121542,6,0,Someone,,,"One of the concerns mentioned is <i>""GCC needing to bring in newcomers by young students and experiments from academia, while most new developments these days are using LLVM""</i>, i.e. that there _eventually_ will not be sufficient community to make those adjustments. I think that concern is justified and may not even be limited to gcc. Any open source project without significant commercial backing will have problems staying attractive to developers for decades. Why would anybody volunteer to work on a decades old and, because of it, somewhat crusty, codebase for free?<p>Yes, gcc has commercial backers, too, but I think at the moment most of them are more willing to pay for the support of additional architectures or architecture variants than for new language features (at the moment; that can change if C++11 gets more commonly used)",1359231283
5121589,comment,5120496,5121321,1,0,meaty,,,"Ugh. Very insightful.<p>It wouldn't surprise me if some startup starts trading conscience futures!",1359231282
5121588,story,,,2,0,bennycreative,"What's your purpose?",http://bennyschmidt.com/blog.html,,1359231236
5121587,comment,5119876,5120073,1,0,piranna,,,"WHAT?!?!?!?!! It's the first news I have about that, I don't know to be happy about it or angry about nobody told me... :-P",1359231211
5121586,comment,5120158,5121148,3,0,sachingulaya,,,"Agreed. They're not needed here. We don't need a legitimate grass roots movement dragged through the mud by having Anonymous involved.<p>The conspiracy theorist in me thinks that the Anonymous brand is so tainted and awful that subversive forces might be using it to undermine legitimate protest by associating it with a hostile, criminal group.",1359231201
5121585,comment,5120664,5121275,3,0,graue,,,"> <i>Scandinavia</i><p>Maybe better in some respects, but Sweden seems pretty corrupt in light of the Pirate Bay trial and Assange prosecution.",1359231148
5121584,comment,5119336,5120498,1,0,jaredsohn,,,"Doubtful, since they also happened to change the lyrics to say ""Johnny C's in trouble""",1359231131
5121583,comment,5119876,5121571,1,0,StavrosK,,,"Hmm, who runs the handshake servers, and how can you remove them? Unfortunately I haven't managed to get the app to run, but it sounds fantastic in theory...",1359231123
5121582,story,,,2,0,onosendai,"Sergey Brin on the NY subway wearing Google Glass",http://venturebeat.com/2013/01/21/augmented-reality-geek-catches-sergey-brin-on-the-ny-subway-wearing-google-glass/,,1359231119
5121581,comment,5121287,5121287,14,0,fawce,,,"I love this quote: ""Going to a 4 year school is supposed to be the foundation from which you create a future, not the transaction that crushes everything you had hoped to do because you have more debt than you could possibly pay off in 10 years.""<p>I hosted a coursera meetup recently (<a href=""http://www.meetup.com/Coursera/Boston-MA/829362/"" rel=""nofollow"">http://www.meetup.com/Coursera/Boston-MA/829362/</a>) and I met two students who were enrolled as part time off-campus students, taking the required minimum of classes at the university, and only ""spending"" those classes on requirements for their majors. All of their enrichment beyond the major was through MOOCs like Coursera. They told me it would take 6 years instead of four, but cost way less, and the preferred the MOOCs for the advanced material anyway. The last piece of the puzzle for them was finding internships, so they could lay the groundwork for a job upon graduating.<p>Compared to my ""find yourself"" traipse through college, I was blown away by the steel-trap optimization these guys were applying to school. This economic downturn is breeding a whole generation of just-try-to-stop-me kids. It will be awesome 25 years from now when they are in charge.",1359231116
5121580,comment,5121242,5121546,13,0,Hello71,,,"You mean like FreeBSD?",1359231069
5121578,comment,5121053,5121366,6,0,tmoertel,,,"Colin, if we start with the hypothesis that ""any developer really ought to be able to solve [that problem]"", we get a testable prediction: If a person cannot solve that problem, that person is not ""really"" capable of being a developer. This prediction, however, doesn't seem to survive long when exposed to reality: There are lots of people who cannot solve that problem but are succeeding, right now, in jobs that most people would accept as software development.<p>Software development is a <i>big</i> space with lots of room for specialization. Maybe it would be better, then, to model what is essential to ""development"" not as a distribution over knowledge but as a joint distribution over knowledge and specialization.",1359230991
5121577,comment,5101813,5101813,1,0,speromeliora23,,,"Look at it this way: now you can go on living a life based on truth, embrace your pain, and use it as a way get to know the true you, and love that person as you are, then, you will find the perfect person for you and laugh about all of this... Its funny, fundamentally, it's not really her rejecting you... It's you rejecting you... Because no one can make you feel inferior but you, you create your experience, make the best of it and turn your pain into something beautiful",1359230983
5121576,comment,5119876,5120152,2,0,piranna,,,"You are true. DataChannels are encripted by spec, and WebSockets are also being cyphered. I've taken security and anonimity as far as I could (I'm not a security nor frontend guy... :-P )",1359230974
5121575,comment,5121404,5121513,5,0,archgoon,,,"I think the real issue is that everyone (both Hacker News types and the public at large) has, up until now, been far too complacent about computer law and the justice system in general.<p>We should be making this much noise more often.",1359230908
5121574,comment,5120998,5120998,4,0,wcoenen,,,"Why is parkinson even mentioned? It is not a disease that is caused by infection.<p>Same question for HIV. It's a virus so it doesn't have a membrane which this gel is supposed to attack.<p>Same question for toenail infections. This is caused by  fungi, not bacteria.<p>Lots of marketing hype here. I don't believe a word of it.",1359230843
5121573,comment,5120409,5121528,5,0,tesseract,,,"There's an implicit ""for the best price each room could possibly bring"" attached to that goal. The reasoning is basically that the cost of a hotel room (construction, upkeep, etc) is not affected too much by whether it is occupied or not. (In that way it's very similar to a seat on an airliner.) So considering your costs as a hotel operator are nearly fixed, you're quite obviously better off selling 50 rooms at $200 and then 50 more rooms at $100, than if you had kept the price at $200 and only been able to sell the first 50 rooms. Of course in the real world the pricing strategies are a lot more complicated than that and depend on having good models for how many people are willing to pay what price, and when.",1359230841
5121572,comment,5118554,5121479,1,0,pygy_,,,"Thanks a lot!",1359230840
5121571,comment,5119876,5120894,1,0,piranna,,,"I worked REALLY HARD to make it all statil HTML and Javascript, and I'm still working hard to remove the handshake servers... Any help here will be greatly welcome :-)",1359230837
5121570,comment,5120400,5120791,7,0,sliverstorm,,,"The $1.7B was not necessarily wasted, if it provided the BMGF learnings that improve future efforts.",1359230824
5121569,comment,5091830,5096580,1,0,bch,,,"Indeed.<p>First 3 lines of <i>all</i> perl code for me are:<p><pre><code>  #!/usr/bin/env perl\n  use strict;\n  use warnings;</code></pre>",1359230811
5121568,story,,,12,0,jamesjyu,"The Silicon Valley Housing Market Is Only Going To Get Crazier",http://techcrunch.com/2013/01/26/the-silicon-valley-housing-market-is-only-going-to-get-crazier/,,1359230797
5121567,comment,5120020,5121119,1,0,calpaterson,,,"This video:<p><a href=""http://www.youtube.com/watch?v=vXjVFPosQHw"" rel=""nofollow"">http://www.youtube.com/watch?v=vXjVFPosQHw</a><p>(which was also posted by politician) was very useful in explaining the theory.  I also made some changes to it, but offhand I can't remember what they were.  I think it was to do with the separation of starting vs initialising modules (parts of a page).",1359230794
5121566,comment,5121287,5121457,1,0,HarryHirsch,,,"For starters, the gratuitous building and renovation does nothing to improve the quality of the degree, and certainly increases cost of tuition.  The university isn't better off, and the students undoubtedly are worse off.  If that isn't a market failure I wouldn't know what is.",1359230762
5121564,comment,5120922,5120922,2,0,kyllo,,,"pg addresses this in <a href=""http://www.paulgraham.com/start.html"" rel=""nofollow"">http://www.paulgraham.com/start.html</a><p><i>Start by writing software for smaller companies, because it's easier to sell to them. It's worth so much to sell stuff to big companies that the people selling them the crap they currently use spend a lot of time and money to do it. And while you can outhack Oracle with one frontal lobe tied behind your back, you can't outsell an Oracle salesman. So if you want to win through better technology, aim at smaller customers. [...] Corollary: Avoid starting a startup to sell things to the biggest company of all, the government. Yes, there are lots of opportunities to sell them technology. But let someone else start those startups.</i><p>On the other hand I see a lot of potential in selling cheap, lightweight, cloud-hosted, but effective ""small business IT"" applications on a subscription basis to help enable the little guys to compete with big business on a more level playing field. You're running a small business and you can't afford to shell out millions on an Oracle or SAP system? Maybe you can't afford to hire a full-time developer or even a consultant to build you an application? Who cares, when there's a just-as-good application that you can access online for less than $100/month?<p>The key to this would be understanding the use cases particular to whatever industry you are selling to. You might have to have industry-specific modules within a larger application framework.<p>Then there's always the potential challenge of ETL-ing the data from whatever legacy system the small business might be currently using in order to make it available inside your application, but that's much more of a consulting job than a product marketing job. That's got to be one of the the most expensive aspects of selling enterprise software in the first place.<p>And of course, assuring the customer about security, privacy, and IP protection of their data would also be of paramount importance, if it's going to be cloud-based.",1359230720
5121563,comment,5120400,5120924,10,0,sliverstorm,,,"<i>especially when other rich white guys are causing or exacerbating many of the problems.</i><p>Sounds like ""Rich White Guy"" <i>is</i> the best person to solve the problems, then. Which is a fairer fight- bushmen vs. rich white guys, or rich white guy vs other rich white guys?",1359230638
5121562,comment,5120998,5121536,5,0,roc,,,"Would switching from a chemical/biological to a mechanical form of attack against bacteria be expected to produce an evolution of <i>mechanically</i> resistant bacteria?<p>Be they variants that don't have the same properties that cause the nanogel to be attracted, or have cell walls that are too strong to be disrupted by the nano-stuctures, etc?<p>I guess my question is: are we talking about a 'final weapon' sort of thing, where any potential 'defense' would require ditching some attribute that makes bacteria feasible in the first place? Or are we just talking about a <i>new</i> weapon, one that we fully expect to eventually wane in effectiveness and thus will have to continue iterating upon?",1359230597
5121561,comment,5120400,5120791,11,0,adaml_623,,,"Guy spent $1.7 Billion testing a hypothesis.  Admitted he was wrong.<p>Probably would have been better to fail faster, etc. But it was his money.  Kudos to him.",1359230592
5121560,comment,5120496,5121165,5,0,pasbesoin,,,"How do you connect?  If you aren't actively and intelligently taking precautions, they may well have enough network address history to be fairly definitive.<p>Also, do you block their widgets on other sites/pages?<p>Not that I disagree with the ""Big Brother"" concerns that this ""Ihre Papiere, bitte."" activity raises.<p>P.S.  Aside from government(s), of what value is a proven identity to commercial interests?  Being able to prove that you/they are targeting exactly who they want.<p>Hmm... Amongst other things, I understand that process servers are already attemtping to use FB as a accepted means of delivery.  And I've read that debt collectors are using accounts having profile pictures of bikini clad young women, in order to successfully ""friend"" those they wish to hound.<p><i>All</i> sorts of value to ""proven"" identities...",1359230580
5121559,comment,5120400,5120858,1,0,cbs,,,"You just stated that it was difficult to solve and didn't say anything more, which I think is one of the problems most people have when talking with Malthusians.<p>For people who even vaguely know what they're talking about chances are pretty good they're aware of that the problems and hard and are still trying to make progress.  Showing up and espousing that idea doesn't add anything to the conversation other than maybe suggesting your priorities are different than theirs (but that too can be articulated better).<p>I can compare it to talking to a libertarian, or alternatively someone who doesn't think anything matters but profit.  All of their ideas are very sound within the realms of the overarching theory they subscribe to.  That's all well and good, and sometimes makes for good conversation but they don't bother to extend their ideas to the current state of reality which exists outside of the already ideal conditions those philosophies provides.<p>Don't want to be reduced to ""a simple Malthusian""?  Make a post that says more than simply reiterating a watered down version of his thesis.",1359230577
5121558,story,,,1,0,nerdfiles,"Cry HN: Coupling Services with Analytics is Surveillance",http://webjournal.nerdfiles.net/2013/01/26/black-hat-ux/,,1359230567
5121557,story,,,2,0,grinich,"Product manufacturing for the newbie, from prototype to production",http://www.quora.com/Michael-Grinich/Posts/Product-manufacturing-for-the-newbie-from-prototype-to-production?__snids__=90770844&__nsrc__=1,,1359230548
5121556,comment,5120407,5120535,3,0,fishtoaster,,,"As a little thought exercise, I'm trying to see how many commands I can think of that are equivalent to s.  So far:<p>1s<p>cl<p>c<space><p>vc<p>xi<p>There's obviously more if you want to add '1' to a couple of these, and more still if you want to go to 3 characters.",1359230542
5121555,comment,5120400,5120981,5,0,rdwallis,,,"I don't find the argument that famine relief does more harm than good compelling.<p>Can you list some examples of this type of harm? Are they outliers or is it normal for this kind of aid to hurt its recipients?",1359230492
5121554,story,,,1,0,digitalmud,"Back to the squares, without the Brothers",http://www.egyptindependent.com/opinion/back-squares-without-brothers,,1359230491
5121553,story,,,3,2,ttar,"Facebook exec: Employers SHOULD be allowed to ask women their plan to have child",http://www.dailymail.co.uk/news/article-2268697/Sheryl-Sandberg-Firms-SHOULD-allowed-ask-female-staff-plans-family-says-Facebook-head.html,,1359230465
5121552,comment,5120978,5120978,2,0,paulsutter,,,"The legal minimum of 1.5% is fascinating, i wonder if it was put in by the credit card lobby.<p>Overall, this change should accelerate evolution in the payments space. Customers choose the payment type, so when merchants have to eat the fee and hide it from consumers there's little downward pressure on fees.<p>The minimum looks like an attempt to put a floor of 1.5% on the fees. Does anyone know what happens to any payment technology that wants to charge 0.5%? Does a merchant who passes along such fees have to eat it if its less than 1.5%? Or is it disallowed?",1359230445
5121551,comment,5120978,5121462,2,0,rahim_nathwani,,,"Yes.  In the UK, sticker prices or advertisements aimed at consumers must include VAT where applicable.  This is not so if the sticker/ad/whatever is aimed _solely_ at businesses (many of whom can claim back the VAT).\nFurther info: <a href=""http://www.hmrc.gov.uk/vat/sectors/consumers/basics.htm"" rel=""nofollow"">http://www.hmrc.gov.uk/vat/sectors/consumers/basics.htm</a><p>Service charges are a different matter.  Some restaurants advertise a mandatory service charge (e.g. 15%) on all bills, or for parties of x (e.g. 6) or more people.  Although it may seem like increasing prices by the amount of the mandatory service charge would make life easier for everyone, services charges (even mandatory ones) are treated differently for tax purposes: if they are distributed to employees, they are not subject to VAT (revenue tax) or Corporation Tax (profits tax).  They are, however, subject to payroll taxes (PAYE Income Tax and NIC): <a href=""http://www.hmrc.gov.uk/paye/payroll/special-pay/tips.htm#1"" rel=""nofollow"">http://www.hmrc.gov.uk/paye/payroll/special-pay/tips.htm#1</a>",1359230443
5121550,comment,5121242,5121496,14,0,shardling,,,">If they were truly opposed to people using GCC as a module in a larger system, why would they go out of their way to encourage modularization?<p>The claim I've seen repeatedly is that this is precisely because they must now compete with Clang/etc.",1359230436
5121549,comment,5120409,5120803,1,0,Evbn,,,"Four Seasons selling blocks of rooms for pennies on the dollar to HT doesn't hurt their brand? Do you think HT is paying $500 for each of those rooms?",1359230418
5121548,comment,5121061,5121330,1,0,bennyg,,,"The kerning on the bold typefaces throughout that site is annoying at best.",1359230416
