ID,Type,Story,Parent,Points,Comments,Author,Title,URL,Content,Created
467567,comment,467546,467546,0,0,robg,,,"I worry about this division between users but kudos to pg for trying an worthwhile test. It's an example where I wish there was some content analysis with karma to illustrate spheres of influence. But I just don't think we can ever get there with such small samples of text, as is typical of the vast majority of comments.<p>If you don't like the current ""division"" between users, then please offer some alternatives. I'm stumped. I recognize the need but I'm not sure it fits. Rather than be outed as an Orange, I might prefer some increased weight on comment upvotes but behind the scenes. At least then there could still be some behavior modification, but it would be mostly without division between the haves and have-nots.<p>EDIT: Maybe it's just my latent fear of getting beat up as soon as we walk out of the room?",1233832124
467566,comment,467363,467363,0,0,lallysingh,,,"I've tried a lot of systems (omni* and a few others), but here are what stick with me:<p>Emacs Org-Mode for the day-to-day stuff that I want to keep in front of me when I'm writing code.  It's essentially perfect for it.  Using the tables with pasted-in code is utterly fantastic (hint: replace-regex '^' with '|> ' and it'll keep your indentation before you hit tab and tablify the code).<p>Org mode does tables, outlines, todo lists, agendas, mostly everything a programmer's going to want day to day.<p>For higher-level planning, I leave the workstation.  Get a cup of coffee/soda/juice/who-are-we-kidding-its-coffee and a table away from computers.  A moleskine (the squared one, with the grid layout) and a good pen (I like these $4 pilot extra-fine vballs) is what I use.  Relaxing music in noise-canceling headphones FTW.<p>Do yourself a favor and begin with the habit of writing the date on a page when you start writing on it.  It's useful for you to see your progress over time, and it can be helpful later in patent disputes.<p>As for the thinking process itself, here's my heuristic:<p>- Small apps are mostly driven by a framework you just use (probably some MFC/DI garbage).  Keep your code clean & organized, and work a little to keep the expected chaos from working with always-mysterious frameworks contained.  E.g. don't ever trust the framework to handle your model code for you.  Use proxy classes, multiple inheritance, whatever to firewall yourself from that chaos.<p>- Medium apps have enough internal structure to get past the cognitive mass of the framework.  There, you end up with a top-level abstraction that structures the app.  Be it a pipeline, a set of command objects, or a data structure you maintain, there's one big one and the app is structured by it.<p>- Large apps have a few of these.  They're independent subsystems and you firewall their interactions the best you can.  Unless you've got the time/labor for large-scale refactoring, you generally just try to keep the abstractional dams from breaking.  In those cases, I usually try to get some middleware in there, so I can easily handle stubs, testing, and interactive use with each.  If you've got a REPL, you can avoid it, but in C++/Java, it can really help.",1233832095
467565,comment,467553,467553,0,0,jacquesm,,,"how is that for double speak ? ""AOL remains an extremely valued partner, and we’ll continue to work closely together to provide their users with the best search experience possible. After careful consideration, we made the decision that we needed to exercise our rights now so we could be in a position to sell our interest when the timing made sense for us.”<p>The language twists that publicly traded companies go through in order to express themselves are really tiring.<p>The plain text translation of that to me reads: ""We don't want to kill you outright in public but we're tired of you and because the market is contracting we'd like to get out while the getting out is good. Also we'd like you very much to not switch to a competitor once we've ditched you.""",1233832058
467564,comment,467376,467376,0,0,revorad,,,"Awesome stuff. Thanks for doing this.<p>What age are these kids? What's the local language?",1233832041
467563,comment,467542,467542,0,0,pclark,,,"is this in New York or Banglore ... ?",1233832023
467562,story,,,14,21,RiderOfGiraffes,"Ask HN - I don't understand the up/down arrows behavior ...",,"I'm finding that on some threads there are comments I can up or down mod, but other comments I can only up mod.  I thought it might be because I couldn't downmod people with more karma than I have, but then I found a two comments by the same user, and I could downmod one but not the other.<p>I'm very confused by this - not that it really matters - but I'd like to understand.  Can anyone here provide an explanation?<p>Thanks.",1233831991
467561,comment,466845,467203,0,0,tome,,,"Well here's a starter for you.  Using enhanced regex syntax you can match a language containing strings of prime length.  On the other hand (using the pumping lemma[1]) you can prove that that set is not regular, hence not detectable by a standard regex.<p>[1] <a href=""http://books.google.com/books?id=MDQ_K7-z2AMC&pg=PA47&lpg=PA47&dq=finite+automaton+prime&source=bl&ots=0wWTv5AeBd&sig=6sOwOf6PNdQmcvI6QhWVMKLvKKA&hl=en&sa=X&oi=book_result&resnum=3&ct=result"" rel=""nofollow"">http://books.google.com/books?id=MDQ_K7-z2AMC&pg=PA47&#3...</a>",1233831922
467560,comment,467509,467509,0,0,pclark,,,"way old! But a great article.",1233831870
467558,comment,466110,466940,0,0,ajb,,,"Yes, but they don't differ on how you deal with practical problems, at least not ones on the level of how to design a car or a computer. Maybe they would affect cutting edge semiconductor research or fusion reactor design, (I don't think the interpretations of quantum physics do, but other conjectures might).",1233831804
467557,comment,467427,467544,0,0,jacquesm,,,"Some form of meta moderation would be a good fix for that, modding down when you disagree with someone is simply cheap. If you disagree then say so (and why!), don't mod down.<p>You can have your name in pink, purple or green for all I care it will not matter one little bit, the only thing that matters is what you have to say.",1233831710
467556,comment,466485,467435,0,0,jodrellblank,,,"Oh come on, now you're changing the terms. I've never heard anybody wanting a war on the <i>measurement</i> of aging.<p>It's the human bodily degeneration and weakness, physical and mental, that results from the biological processes of life running for tens of years that's the undesirable part. Commonly known as ""old age"" and ""aging"".",1233831695
