ID,Type,Story,Parent,Points,Comments,Author,Title,URL,Content,Created
467633,comment,467588,467588,0,0,allyt,,,"OMG! YouTube for games! That was <i>my</i> idea, and you <i>all</i> stole it!<p>But seriously, this is an idea that's 100% execution, with tons of little things to get right.",1233835130
467632,story,,,6,0,terpua,"Solving a different problem",http://sethgodin.typepad.com/seths_blog/2009/02/solving-a-different-problem.html,,1233835114
467631,comment,466571,467399,0,0,mjnaus,,,"I guess many people around here would agree that ideas are a dime-a-dozen and often times change during execution. However, I completely understand that you're feeling bummed, I would be too...<p>And even though others are working on it, that doesn't mean you shouldn't! What is keeping you from going ahead as planned, even if it's without YC?",1233835058
467630,story,,,1,0,mrspin,"Google Latitude shows what’s wrong with Nokia’s social location (SoLo) strategy",http://www.last100.com/2009/02/05/google-latitude-shows-whats-wrong-with-nokias-social-location-strategy/,,1233835027
467629,comment,466571,467399,0,0,allyt,,,"OMG! I totally had this idea, too!",1233834969
467628,comment,467181,467265,0,0,3pt14159,,,"Here I was, just days away from being able to down-mod people and they double the karma requirements.<p>Don't be silly pistoriusp, after being here for two years I'm not surprised your last 50 average comments karma is not 3.5 less than your last 25 average comments karma. Your definitely leveling off, which should be fine. Although there have been many more users lately, so perhaps there is karma inflation that should boost your average karma over time.",1233834950
467627,comment,467546,467613,0,0,robg,,,"If they're all trollbait, the least offensive wins?",1233834885
467626,comment,467181,467609,0,0,ErrantX,,,"This is a fair point.<p>Some people are here for startup stuff. Some people for codign/programming stuff. Yet others (though probably a smaller demographic) are here for social stuff. And more.<p>Plus others are here for a mix.<p>Some way to tailor what you see would be awesome! not too much that each ""genre"" is different but enough that the posts or articles <i>you</i> want to see are at the top :D",1233834881
467625,story,,,1,1,bdfh42,"One day with Palm Pre (a fantasy)",http://palmwebosblog.com/palm-pre/one-day-with-palm-pre-a-story-of-technology-fiction-soon-to-be-a-reality/,,1233834857
467623,comment,467562,467583,0,0,ErrantX,,,"how do you mean by <i>already</i> ?<p>I can still down mod the comments in this thread that I have replied to.<p>EDIT: wait NOW I see :) I cant down the above comment. Ignore me :)",1233834701
467622,comment,467588,467588,0,0,swombat,,,"I'm not entirely sure why this is worth posting up on the front page...<p>Ideas are everywhere. Even groundbreaking, ""hard"" ideas (e.g. Calculus) can occur in several places at once. Certainly, a flash game widget is not a new idea and is being implemented by dozens of start-ups at this point in time. The fact that two of them were connected with YCombinator is neither surprising nor inappropriate.<p>This is a good example of why VCs never sign NDAs, basically. The chances of this stuff happening by chance (rather than malice) is way too high.<p>It sounds trite, perhaps, but it's worth repeating that ideas are just one ingredient in a successful start-up. Execution, timing, people, choice of technology, marketing... all those are just as important, if not more.",1233834682
467621,comment,467376,467376,0,0,paraschopra,,,"Which area of India does this school belong to? Your initiative looks interesting",1233834625
467620,comment,467041,467137,0,0,jgrahamc,,,"I strongly disagree that desktop clients have a bright future.<p>1. If you've ever tried to do cross-platform desktop client GUI work you'd know that getting it to look good on every platform is a nightmare.  It's really no different from where we are with RIA.<p>2. Right now there's a large amount of work going into js frameworks that means that we'll see these techniques become standardized over time.<p>3. If you look at desktop clients there's actually a lot of innovation in terms of small UI components (see most things that Apple is doing) and so desktop clients are by no means static.<p>4. As js and the frameworks improve we'll see more and more applications move into the browser.  At my current startup we are working on a very rich application and there was no question of doing a native desktop client, there was just no point tying ourselves to a specific OS.",1233834610
467619,comment,467562,467562,0,0,CalmQuiet,,,"What confuses me is that there is not a man page that explains the workings of news.yc  
Parts of it can be pieced together in SEARCHING - or in articles like the Feb 4 newsnews on new comment/color-highlighting feature.  
Nor have I seen an <i>explanation</i> of why no man page (e.g., ""if you dont' understand how it works you're too noob a hacker for these pages"" or ""we don't explain it all because we don't want it to be too easy to hack the site"" (i.e., beat the system) ).
As an admitted noob, I remain... puzzled.",1233834554
467618,comment,467562,467569,0,0,markup,,,"Well, it looks like I was looking at comments older than 24hrs (can downmod comments I have replied to, in the last few minutes): so I am wrong on this :-)",1233834495
467617,comment,467562,467601,0,0,davidw,,,"Because you posted the 'original story', you can't downvote direct replies to it.",1233834417
467616,comment,467427,467434,0,0,murrayh,,,"Initially this struck me as a counter-productive and elitist measure, but it didn't take me long to swing to a positive reaction.<p>Really, I want less crappy comments and more good ones. I've been skimming comments for months now, for a variety of reasons, but mostly because I am simply not that interested anymore.<p>Hopefully people do hesitate and refrain from submitting a comment, because that is probably a comment I don't want to see. In the end, if someone really cares, they will post a comment anyway, and that should give the 1 point comments more perceived worth (maybe I will no longer treat them so harshly during my skimming?).",1233834398
467615,comment,467181,467609,0,0,tome,,,"I know very little about statistics so I wouldn't have much of a clue about the right algorithm to use, but I do have a good idea of the behaviour I would like.<p>I think the behaviour I want is exactly that required by the Netflix Prize:<p><a href=""http://en.wikipedia.org/wiki/Netflix_prize"" rel=""nofollow"">http://en.wikipedia.org/wiki/Netflix_prize</a><p>although rather than rating comments 1 to 5 I think I'd probably just have three levels (don't appreciate, neutral, appreciate).",1233834289
467614,comment,467427,467427,0,0,casta,,,"Orange names? I'm almost color blind and my LCD screen doesn't display the color in the right way, I never noticed the colors. :°(",1233834193
467613,comment,467546,467598,0,0,allyt,,,"I don't think his idea is to remove points completely - they would still determine where the comment gets placed on a page, they just wouldn't be displayed as prominently.<p>This would really change the UX of the site, actually - I find myself scanning over just points/names after having read the first few posts in a long thread.",1233834067
467612,comment,467181,467580,0,0,robg,,,"Indeed. Train on the Oranges, test on the Greys.",1233834052
467611,comment,467562,467601,0,0,tome,,,"Of this feature, yes.  See under 4 August at the bottom of the page:<p><a href=""http://ycombinator.com/newsnews.html"" rel=""nofollow"">http://ycombinator.com/newsnews.html</a><p>I don't know about in general though.  There are a ""mythical"" things about this site that sort of just happen, and you get used to.  I don't know if there's a full explanation somewhere!",1233834050
467610,comment,466835,467408,0,0,rbanffy,,,"I dunno... Those 4-8 GB of RAM would be better used on the motherboard as disk cache.",1233834013
467609,comment,467181,467587,0,0,jacquesm,,,"I think you're subconsciously reinventing k-means clustering with random starting points.<p>Subclasses might not be such a bad idea at all actually, after all there are different coffee shops for different tastes as well. If a site could be made to automatically appear as a place that caters to your 'taste' that would be a pretty awesome development. Everybody would feel right at home.",1233833897
467608,comment,467181,467273,0,0,davidw,,,"People in the top 10, for that matter.  I guess some of us just post a lot with only the occasional valuable comment;-)",1233833884
467606,story,,,2,0,bdfh42,"Speed up your JavaScript, Part 3",http://www.nczonline.net/blog/2009/01/27/speed-up-your-javascript-part-3/,,1233833764
467605,comment,466497,466497,0,0,jparicka,,,"We can help to design a website.  Contact me at jparicka(@)gmail.com.",1233833732
467604,comment,467181,467423,0,0,jacquesm,,,"I've yet to see it being used in any other way.",1233833629
467603,comment,467181,467181,0,0,jacquesm,,,"Visible distinction between users creates an upperclass and an underclass, if there is no very good reason for doing so I am very much against it.<p>Use the 'karma' counters as an internal mechanism to reward users with extra features or to remove those features if their karma drops below the thresholds again because of misbehviour. Use it to sort the submissions and the comments possibly using some kind of weighting system so that the 'good' content (content by long established users) bubbles to the top, it gives newcomers something to strive for.<p>But don't make it visible, remove the points from the header of the site, keep it under water. Why?<p>This is why:<p>- good 'karma' need not be shown, it comes across in every posting you make, because you are supposedly showing good judgement in your writing, not in the 'colour of your name'<p>- there will be no timidity for rookies to speak out against 'old timers', similar bs happens on ./ where your UID number seems to be the arbitrator of the discussion<p>- karma has some meaning outside of HN, and if I take that meaning correctly then you're not going to get any for showing it<p>- karma tends to self-reinforce enough when used as an underwater feature, it will self-reinforce out of control as soon as you make it into a distinct mark<p>- this feature to create a distinction between the 'top group', the 'incrowd' of those who are 'better' and 'the rest' (the unwashed masses or whatever you wish to call them) will be an incentive to game the system, if it is underwater such an incentive is not present.",1233833591
467602,comment,467427,467427,0,0,lionhearted,,,"Some really great points. Couple very quick thoughts, and then ideas about your points. First, you only need to average 3.5 to be oranage if that's a concern, meaning posts around 2 or 3 don't set you back much, and just a few +10 or +20 comments here and there means you can comment totally freely and stay orange.<p>2. Don’t post on a front page post that already has more than a full page of text.... You’re just yelling into the void. --> I actually think this is GREAT. People won't post into an already largely full thread unless they have real insight that's bursting to get out, instead of rehashing some obvious observation.<p>3. When possible, reply to a highly rated comment that doesn’t already have replies. Particularly focus on getting your comment to appear ""above the fold"" when it is posted. This will ensure that your comment is read and enjoyed. --> If it gets abused for gamesmanship, that's ugly. However, an insightful follow-on or dissent from the top comment IS more read, and thus does create more value, and thus, more karma. But we should be vigilant as a community to these karma-jackers.<p>4. Don't post against the prevailing mood of a post. If the mood of that article is pro-libertarian, beware critiquing that philosophy! On the other hand, when the population is more balanced in that individual thread, feel free. In general someone who agrees is more likely to upvote than someone who disagrees, so you should get be ahead on balance. --> At first, this really upset me. I've seen a lot of warm'n'happy comments get upvoted more than an insightful point I made that I assume took heat from people with a different opinion based on the voting patterns around it. Then I realized - if you're on something controversial, it's got to either be balanced, or really good to get community respect. If people reflect for a minute before spouting talking points, that could be a good thing.<p>5. As soon as you make a comment, upvote the article and all of the parents to your comment. This will put your article closer to the public eye. If you want to truly join the dark side, vote down the other comments on the thread or other replies. I’ve never done this, but it’s an option. --> Yeah, could be a big problem - will be interesting to see how it plays out.<p>6. Say something interesting. Without this, you’ve got nothing! --> This is awesome.<p>7. If you’re trying to be funny or sarcastic, make it incredibly obvious. If it’s not incredibly obvious what you’re trying to say, don’t bother posting. --> I'm not everyone, but I HATE online sarcasm. It's cheap and easy to get that ANYWHERE. The internet is overflowing with sarcasm. I like that Hacker News is really an intelligent discussion place, and humor is used less frequently and more judiciously than elsewhere.<p>8. Don't get involved in a long discussion! This will only end with a bunch of 1 point posts that drag your average down. --> Finally, I just realized something. I try to check my comments later and see if anyone replied to me. I'm going to make more of an effort to upvote 1-karma posts that were late to the party if they offer even a bit of insight, as a way of saying thanks for keeping the discussion going.<p>Cheers Gavin!",1233833585
467601,comment,467562,467595,0,0,RiderOfGiraffes,,,"That's an interesting point that I shall explore.  However, it's not the whole story.  Although I wouldn't want to, I cannot downmod <i>your</i> comment.  That might be explained by the fact that it's a response to mine.<p>I'm still not completely clear on the logic, but some of the factors involved are surfacing.<p>Is there a complete explanation somewhere, rather than just some reverse engineering?",1233833563
467600,comment,467181,467197,0,0,davidw,,,"Shouldn't you be off changing diapers?:-)",1233833562
467599,comment,467546,467567,0,0,tome,,,"OK, here's my alternative:<p><a href=""http://news.ycombinator.com/item?id=467574"" rel=""nofollow"">http://news.ycombinator.com/item?id=467574</a>",1233833552
467598,comment,467546,467573,0,0,robg,,,"Right, I agree. Content matters. But without some really powerful content analysis, points may be the best that can be done.<p>Isn't there something useful in having some feedback measure of things you've contributed? If anything, without points, I'd worry that the devaluation of comments would get much worse. At least now there is some valuation.",1233833520
467597,comment,467542,467563,0,0,markup,,,"""Location of work is Bangalore"" (last line)",1233833516
467596,comment,466835,466835,0,0,rbanffy,,,"So, how much does it cost to work there?<p>Is there a cheaper package that covers just hanging around?<p>;-)",1233833462
467595,comment,467562,467562,0,0,tome,,,"You cannot downmod comments that are older than 24 hours.",1233833439
467594,comment,467411,467414,0,0,ggrot,,,"#3 almost sounds like the definition of a startup:<p>The number of people having any connection with the project must be restricted in an almost vicious manner. Use a small number of good people (10% to 25% compared to the so-called normal systems).",1233833326
467592,comment,467041,467137,0,0,halo,,,"Why? Creating cross-platform non-native custom widgets on the desktop isn't much easier.",1233833255
467591,comment,467546,467546,0,0,Eliezer,,,"Boy, that didn't take long even by my standards.",1233833181
467590,comment,467077,467420,0,0,hhm,,,"I guess the entire group could be hired by a company trying to build a competing product.",1233833153
467589,comment,466485,467435,0,0,gravitycop,,,"> The age of something is simply the measurement of elapsed time since something came into its present configuration. A 'war on aging' makes as much sense as<p>You are committing the fallacy of equivocation. <a href=""http://en.wikipedia.org/wiki/Equivocation_fallacy"" rel=""nofollow"">http://en.wikipedia.org/wiki/Equivocation_fallacy</a><p>The war under discussion is a war on aging, definable as <i>biologically senescencing</i>, rather than a war on simply <i>existing-over-time</i>. <a href=""http://en.wikipedia.org/wiki/Senescence"" rel=""nofollow"">http://en.wikipedia.org/wiki/Senescence</a><p>Please also see: <a href=""http://news.ycombinator.com/item?id=466749"" rel=""nofollow"">http://news.ycombinator.com/item?id=466749</a>",1233833140
467588,story,,,42,20,segnor,"It feels kind of weird when.. you get rejected and than 5 months later read about.. your idea",http://news.ycombinator.com/item?id=467399,,1233833087
467587,comment,467181,467580,0,0,tome,,,"Thanks!  I think you're right, that in order to avoid fragmenting the site into a lot of different subclasses with different tastes that there could be a pool of ""good"" users who determine what the default ""good"" story and ""good"" post are.",1233833075
467586,comment,467041,467487,0,0,Daniel_Newby,,,"The article says why: to make it more easily skinnable by simply referencing a different style file. Skinning tables takes more work.",1233833041
467585,comment,467181,467265,0,0,Eliezer,,,"Okay - this is exactly the problem that occurred to me within 2 seconds of learning how this feature works.  If it's going to work <i>any</i> way, it should at least be a GRADIENT from grey to orange.  <i>This</i> way of doing suddenly splits your whole user community into two groups, the Greys and the Oranges.<p>Anyone remember what happened to the Blues and Greens in Rome?  To the Eagles and the Rattlers in the Robbers' Cave Experiment?  If not, see here:  <a href=""http://www.overcomingbias.com/2008/01/the-two-party-s.html"" rel=""nofollow"">http://www.overcomingbias.com/2008/01/the-two-party-s.html</a><p>There's a huge difference in human psychology between a gradient and a divider.  Not that this is necessarily a good idea anyway - it encourages people not to post on old threads, or even not to post too far off the top of the page, etc.  But in any case - if you're going to do it at all, make it a gradient!",1233833003
467584,comment,465567,467185,0,0,jay_kyburz,,,"A few minutes of research turned up this. Not very nice.
<a href=""http://www.howtocreate.co.uk/tutorials/javascript/domstylesheets"" rel=""nofollow"">http://www.howtocreate.co.uk/tutorials/javascript/domstylesh...</a>",1233832822
467583,comment,467562,467576,0,0,markup,,,"Well I cannot downmod comments I have <i>already</i> replied to. Up/downmodding does NOT mean you agree or disagree with that comment, it means you find it useful/interesting or that it has added something/contributed to the discussion",1233832819
467582,comment,467325,467325,0,0,RiderOfGiraffes,,,"This has radically altered my thinking about my launch.  I'm going for the web ""old-school"", not for the the early adopters, but why should I deliberately lock them out.  I can provide a couple of shiny things for the EA to find, use, hack and adapt.<p>The ground swell propagation of usage is probably best accomplished by getting an EA excited, so help them to help you, even if they're not your intended actual market.",1233832739
467581,story,,,26,8,hhm,"Brains, Brains, Brains, Brains: different flavors of genius",http://scienceblogs.com/pontiff/2009/01/brains_brains_brains_brains.php,,1233832696
467580,comment,467181,467574,0,0,ErrantX,,,"That is interesting... (you get my upvote :D)<p>You could take that farther and create a ""pool"" of good users who vote and comment in keeping with the HN style (a pool that could, of course, grow over time) and if your voting habits correlated to them your vote began to be worth more.",1233832684
467579,comment,467546,467567,0,0,allyt,,,"Anything that doesn't segregate the users? Has nobody read The Sneetches?
<a href=""http://en.wikipedia.org/wiki/The_Sneetches_and_Other_Stories"" rel=""nofollow"">http://en.wikipedia.org/wiki/The_Sneetches_and_Other_Stories</a><p>I liked neilk's idea a lot better:
<a href=""http://news.ycombinator.com/item?id=466155"" rel=""nofollow"">http://news.ycombinator.com/item?id=466155</a><p>And jacquesm's idea best:
<a href=""http://news.ycombinator.com/item?id=467573"" rel=""nofollow"">http://news.ycombinator.com/item?id=467573</a><p>Why <i>do</i> we need to show points?",1233832623
467578,comment,467427,467434,0,0,jacobscott,,,"Putting my graduate student hat on, it seems like what HN is faced with is a problem of mechanism design. If we can agree that the goal of HN is good news and discussion (and defer to pg on the details of exactly how those resolve), then the question is how to design comment/karma features so that the best interest of the community aligns with the best interest of the individual poster.<p>pg doesn't mention the implications of gaming (in this context, flaws in the mechanism) in the newsnews announcement. I haven't had time to read the entire primary thread, but if anyone has pointers, send them my way.<p>Also, if any game theory type people are around know more about mechanism, would be interested in what you think of the new commenting features.",1233832609
467577,comment,467473,467473,0,0,lallysingh,,,"Testability as a design metric didn't seem to be mentioned in all this.<p>When I started looking into Unit testing & TDD, I was surprised I didn't see any sort of style guide for it.  Lots of stuff like that available for OO, C++ templates, etc.  But I wasn't satisfied with what I saw in this area.<p>It's only now that I really appreciate a REPL for this purpose.  Some sort of way for a developer to interact with live running code, without having to trace it in a debugger, is very, very useful.<p>But, REPLs aren't available for many languages.  Instead, you end up designing code that's easy to test.  I'll test every class with logic in it, but only the methods with real code in them (+ a little extra, b/c I don't trust my ego on this).<p>The code tends to feel dumber, but the development process becomes more linear, as I get it more right at the time of that initial test development than I would otherwise.  E.g. I don't have to go back to it to fix bugs later, which is more painful as I've already forgotten my thinking on some of that stuff.",1233832583
467576,comment,467562,467569,0,0,ErrantX,,,"As Dasil says you cant down mod replies to your comments (for obvious reasons :D).<p>I find I can vote on comments I reply to... (it doesnt, to me, appear to be logical that if your replying you agree with the post).",1233832581
467574,comment,467181,467529,0,0,tome,,,"I've wondered for a long time whether the following system would work:<p>Everyone can vote posts up or down if they like.  There is a feature which statistically analyses how your votes correlate with other votes, and you can choose to see votes that the analysis predicts you will find interesting and worthwhile based on what you have liked seeing in the past.",1233832564
467573,comment,467546,467567,0,0,jacquesm,,,"Hey, you've got it easy, you're orange :)<p>Ok, that's an attempt at humor, which I understand is risky in and of itself. But seriously, orange or not is really not relevant, what you have to say is. The more visible distinctions there are between users the more people will be given an incentive to try to game the system.<p>My 'alternative' would be the exact opposite, remove all distinctions between users in the layout, including the visibility of the 'points', use the points system out of sight to give/remove functionality and to influence the order in which comments and submissions are sorted.",1233832442
467572,comment,467562,467569,0,0,dasil003,,,"You can't downmod a response to your own comment.  That's the only anomaly I've seen.",1233832336
467571,story,,,5,0,daleharvey,"Erlang Conference in SF",http://www.erlang-factory.com/conference/SFBayAreaErlangFactory2009,,1233832290
467570,comment,466485,467556,0,0,gravitycop,,,">> The age of something is simply the measurement of elapsed time<p>>now you're changing the terms.<p>Ambiguous use of terminology (e.g. <i>age</i> defined one way vs. <i>age</i> defined another way) is <i>equivocation</i>. <a href=""http://en.wikipedia.org/wiki/Equivocation_fallacy"" rel=""nofollow"">http://en.wikipedia.org/wiki/Equivocation_fallacy</a><p>May I suggest the term <i>senescence</i>, or <i>biological senescence</i>, be used instead of the term <i>age</i>? <a href=""http://en.wikipedia.org/wiki/Senescence"" rel=""nofollow"">http://en.wikipedia.org/wiki/Senescence</a>",1233832258
467569,comment,467562,467562,0,0,markup,,,"When it happens to me it is because I have replied to that comment. I assume that it is because if you replied to a comment you DO think it is worth reading it, and it surely contributed to the discussion, therefore no sense in downmodding it",1233832221
467568,comment,467181,467494,0,0,pbrown,,,"That's awesome. Problem is I use Chrome, or I'd jump on it in a heartbeat. Thanks though.",1233832188
