ID,Type,Story,Parent,Points,Comments,Author,Title,URL,Content,Created
7279831,comment,7277797,7279449,3,0,pjungwir,,,"It is funny to me that Erlang combines unique tools for application stability with the ability to edit stuff online in production. I&#x27;m not saying I never launch a production Rails console, but seeing that in Erlang is a weird juxtaposition. I&#x27;d love to understand better how those fit together comfortably in an Erlanger&#x27;s world view.",1393021061
7279830,comment,7277947,7278224,1,0,aiiane,,,"A lot of people use &#x27;majority&#x27; when they mean &#x27;plurality&#x27;.",1393021001
7279829,comment,7275911,7277426,1,0,jzawodn,,,"I&#x27;d love to see that script.  I&#x27;m a long time screen user and would love to find a few examples that&#x27;ll show off what tmux makes easy.",1393020996
7279828,comment,7277326,7279711,1,0,timae,,,"Look, you created Immunity Project. That&#x27;s pretty cool and coming from that perspective, I can see why you think Selfie Ticket doesn&#x27;t need emotion its positioning. However, we think we&#x27;re onto something with this and it&#x27;s not meant to be a gimmick.<p>If you&#x27;re simply trying to sell tickets online (i.e. process a credit card and hand out a barcode) there are plenty of solutions for that, as you suggest. Ticketing platforms are built around the transaction and they do a good job of it (we were in this group too). However, there is a much larger population of people out there (whether they are creating events yet or not) that are trying to build and grow a community around something they&#x27;re doing. The best way to build connections with someone? In person.<p>That&#x27;s the type of event we&#x27;re building for. One that&#x27;s used to grow a community. And for that purpose, scanning barcodes sucks. It&#x27;s un-human at the worst time, when you&#x27;re trying to build human connections.<p>Hope that gives some background for our thought process behind telling the story the way we have.",1393020970
7279827,comment,7278164,7279560,0,0,mkaziz,,,"megaupload did much of the same, no? And this is very flagrantly assisting copyright violation.<p>Of course, if they were smart, they&#x27;d just use this to find the content to issue DMCA to.",1393020965
7279825,comment,7277947,7278658,5,0,eitally,,,"No, actually not.  You can&#x27;t call yourself a nurse unless you&#x27;ve actually been licensed as a nurse (Registered Nurse).  The sub-RNs are CNAs (Certified Nurse Assistants) and LPNs (Licensed Practical Nurses).  The step above RN is NP (Nurse Practitioner, which is <i>roughly</i> the equivalent of a general practitioner MD and a small step above PA (Physician&#x27;s Assistant, which can do all the stuff a GP/MD can do except write prescriptions).  Even within RNs there are two categories: &quot;normal&quot; RNs and RN/BSNs, which are registered nurses who also have a bachelor of science degree.<p>Source: wife is a nurse (RN).",1393020946
7279824,comment,7278784,7279597,3,0,pavel_lishin,,,"Imagine a world of digital sustenance miners.",1393020939
7279823,comment,7279137,7279742,6,0,stonemetal,,,"Netflix&#x27;s website is hosted from AWS they don&#x27;t stream moves from it.  All the video data comes from a CDN.  In the past they have used pretty much all of the major CDNs before creating their own.",1393020933
7279822,comment,7277127,7278580,1,0,matwood,,,"It is textbook, but the poster asked for seemingly random numbers in code.  Based on all the places the invsqrt method has popped up, it also was a textbook method for doing it quickly.",1393020910
7279821,comment,7276976,7278492,1,0,alxndr,,,"IIRC Hangul has some weird pronunciation quirks depending on where some letters are in a syllable.",1393020907
7279820,comment,7279062,7279446,1,0,whyme,,,"There&#x27;s no such thing as mass surveillance being used solely for either good or evil. At least as long as people are not perfect, which I expect will be forever.",1393020896
7279819,comment,7279087,7279470,12,0,privong,,,"> Though it seems a bit odd to host his work on his own personal site, rather than one hosted by his institution.<p>Anecdotal experience of mine is that there&#x27;s a trend for some academics (at least in astronomy) to put everything on their personal site. It makes for more consistent &quot;personal branding&quot;, as your web presence isn&#x27;t moved every 2-3 years as you move from postdoc to postdoc to faculty position.",1393020893
7279818,comment,7276133,7278271,1,0,ssorallen,,,"Nicolas Gallagher addresses and deflects this point specifically with real numbers: <a href=""http://nicolasgallagher.com/about-html-semantics-front-end-architecture/#a-note-on-raw-file-size-and-http-compression"" rel=""nofollow"">http://nicolasgallagher.com/about-html-semantics-front-end-a...</a> The link came from an earlier poster. Once you compress the HTML, the savings are insignificant compared to the likely 10s or 100s of kilobytes of images and JavaScript on a modern web page. Given how tiny the savings are, there are other places more worth your time to save bytes.",1393020883
7279817,comment,7279778,7279778,1,0,byoung2,,,"You don&#x27;t support https, and you send my message in plain text.  All the encryption in the world server side won&#x27;t make a difference if you can read the message in transit.",1393020873
7279816,comment,7279137,7279513,1,0,aaronblohowiak,,,"Are you on X1?",1393020860
7279815,comment,7279087,7279717,6,0,scott_karana,,,"Crowdsourcing? Researchers already collaborate on works like this, so all we would get are unexperienced looky-loos and trolls.<p>(Or were you being silly :P)",1393020818
7279814,comment,7279407,7279758,1,0,NotOscarWilde,,,"> they just haven&#x27;t cut a new release in a while<p>Which seems to mean that you can&#x27;t run the stable version of pentadactyl on Firefox 27 (the current release) [1]. I do understand that it is not equal to being inactive, but at least for me  it was one of the reasons why I returned back to vimperator (which has a stable version that works for Firefox 27).<p>[1]: <a href=""https://addons.mozilla.org/en-US/firefox/addon/pentadactyl/"" rel=""nofollow"">https://addons.mozilla.org/en-US/firefox/addon/pentadactyl/</a>",1393020816
7279813,comment,7279412,7279755,1,0,hoddez,,,"Whoa cool thanks for sharing that. This could have been very helpful, and still might be. I&#x27;ll have to check it out and see what they did differently and how the performance compares.",1393020786
7279812,comment,7278198,7278841,1,0,sqrt2,,,"A MAC of a message m can only be computed with the knowledge of a key K. Specifically, with a cryptographic hash function h,<p><pre><code>  HMAC(K, m) = h(K + a || h(K + b || m)),\n</code></pre>\nwhere + is addition mod 2 (xor), || is concatenation and a and b are constants. (This construction takes into account possible length extension attacks on h.)<p>Given that h is secure, knowledge of any reasonable number of pairs (m, HMAC(K, m)) does not allow you to recover K, and without K, you cannot compute HMAC(K, m) for known m, i.e. enumerate all the possible MACs for serial numbers.",1393020779
7279811,comment,7276028,7278987,1,0,maxerickson,,,"I think it is lots of fun to pick at things, but I think it is more fun to pick at what someone is trying to say, rather than picking at how it was said.<p>(I&#x27;m being cranky here, I didn&#x27;t get worked up over any of this or anything)",1393020776
7279810,comment,7277947,7279336,1,0,marquis,,,"I think those are precisely the 2 reasons we have so few male teachers entering the workforce these days. It&#x27;s an awful awful thing. Being a teacher used to be a prestigious career.",1393020766
7279809,comment,7279803,7279803,1,0,_ak,,,"Here&#x27;s the announcement that describes how it works: <a href=""http://blog.joinmytalk.com/?p=6"" rel=""nofollow"">http://blog.joinmytalk.com/?p=6</a><p>I also put the code on GitHub: <a href=""https://github.com/joinmytalk"" rel=""nofollow"">https://github.com/joinmytalk</a><p>Any feedback is appreciated.",1393020756
7279808,comment,7279262,7279761,3,0,jrs235,,,"I just remembered a book I came across in college. I highly recommend that everyone read it, but not until after they graduate high school (otherwise fewer people would care about graduating high school). It&#x27;s called The Underachiever&#x27;s Manifesto is very small 4 by 6 inches and only 96 pages. It&#x27;s a very fast and enjoyable read.<p><a href=""http://www.chroniclebooks.com/titles/the-underachiever-s-manifesto.html"" rel=""nofollow"">http://www.chroniclebooks.com/titles/the-underachiever-s-man...</a><p>EDIT: Your comment reminded me of this book because I want my children to read it someday (but I don&#x27;t want them to get the attitude too early)...",1393020740
7279807,comment,7277797,7278213,3,0,jamii,,,"I think that&#x27;s the real strength of clojure - not the language itself but that the community around it is focused on radically reducing complexity.<p>Every project I have ever worked on that struggled or failed did so because the complexity outgrew the developers ability to manage it. It kind of scares me that scala is growing so quickly - from my experience working on a large scala project it seems to breed complexity like nothing else I&#x27;ve ever worked with (haskell, python, ocaml, erlang, clojure).",1393020732
7279806,comment,7279595,7279595,1,0,e1ven,,,"I apologize – I&#x27;m on mobile, so I can&#x27;t really look carefully right now, but if you don&#x27;t have time to run the site, perhaps you could convert it to something with lower maintenance, like YouTube channel?",1393020711
7279805,comment,7277947,7279721,2,0,marquis,,,"Could I take your comment to mean that men are not teachers because of the low pay-scale? It&#x27;s a valid point and certainly one we would all like addressed.",1393020699
7279804,comment,7279407,7279407,3,0,mixedbit,,,"Does Mozilla explore similar architecture with their experimental Servo project?",1393020691
7279803,story,,,1,1,_ak,"Show HN: a website to hold presentations and share them remotely in realtime",https://joinmytalk.com/,,1393020681
7279802,comment,7279407,7279407,7,0,mvip,,,"We&#x27;ve been using Uzbl in Screenly (<a href=""http://www.screenlyapp.com/"" rel=""nofollow"">http://www.screenlyapp.com/</a>) for some time now and it works really well.",1393020675
7279801,comment,7279137,7279766,5,0,bifrost,,,"Endemic congestion.",1393020670
7279799,comment,7279412,7279412,1,0,ellisonleao,,,"very nice! congratulations!",1393020654
7279798,comment,7278778,7278778,1,0,cr3ative,,,"Correct me if I&#x27;m wrong, but isn&#x27;t this solely Cogent&#x27;s fault?<p>Settlement-free peering agreements tend to be fine as long as symmetrical traffic is sustained, and that&#x27;s not the case at the moment, meaning Cogent are in breach of the agreement.<p>So... Cogent need to re-negotiate the peering agreement with Verizon, which is what Verizon is demanding, quite fairly?",1393020646
7279797,story,,,5,0,ferno,"Lessons learned from running a NodeJS app in production",http://www.spectrumcoding.com/rants/2014/02/21/lessons-from-production.html,,1393020644
7279796,comment,7279062,7279731,2,0,MrZongle2,,,"<i>We will need new founding fathers to re-write the book on what the most perfect union looks like.</i><p>Let me be the first to request that of our 21st Century founding fathers (gender-neutral), <i>none</i> of them are from our existing political or entertainment classes.",1393020641
7279795,comment,7279062,7279446,19,0,motters,,,"Mass surveillance isn&#x27;t inevitable, it&#x27;s a political decision and a decision which is reversible.  PRISM and Xkeyscore didn&#x27;t invent themselves - they took money and manpower and above all political will to come to fruition.  We have nuclear weapons, but nuclear proliferation isn&#x27;t inevitable.<p>Dismissing people who are opposed to the abuse of technology for purposes which are fundamentally anti-democratic as &quot;illogical&quot; is just a cheap piece of rhetoric.  You should think more carefully about what you&#x27;re supporting.",1393020630
7279794,comment,7279137,7279599,5,0,nathancahill,,,"traceroute is a good starting point. Sometimes I have to try a couple different datacenters until I hit <4ms ping time. Sometimes I just ask the datacenter is website x is hosted there.",1393020614
7279793,comment,7279573,7279573,2,0,tinco,,,"Wow.. so in the video they plugin a CPU module. Doesn&#x27;t the CPU need equal length parallel lines to the memory? Or is there a serial interface to memory nowadays?<p>Crazy idea, I hope it works. Would definitely freshen things up.",1393020604
7279792,comment,7274238,7274238,1,0,h3ro,,,"I do this kind of stuff with wget, sed, awk so far, but it&#x27;s nice to see some more thought-out alternatives.<p>What I like most about your competition though is the JS interface that gets used for one good last thing (before being properly scraped and de-AD- and de-java-fied): clicking on the content you want, and deselecting content you don&#x27;t want: subtly, with your mouse you lead a pattern-matching algorithm doing the annoying work.<p>Honestly the simplicity of this interface is even more breathtaking to me than gargl :P\nBut it&#x27;s even more limited, as after clicking twice it thinks that it has understood the pattern already, although that might not be the case.<p>I&#x27;d suggest to integrate the idea, but to make the learning process more clever, make it possible to select more things, even though the engine thinks there can&#x27;t be any more similar things. Give that AI more things to learn from. We want more identifiers than just counts and HTML elements: &quot;2nd subelement of <h1>&quot;.<p>There&#x27;s good stuff you can do with statistics, too. Some data exists only once, some exists only 3 times, some always exists over 10 times. That&#x27;s valuable info. Some data has many words of whitespace seperated text - oh a paragraph!<p>tldr We need something that generates good semantics out of normal web sites automatically, so that users can use a simple Web UI mangled into the target web site to choose the right pattern.",1393020601
7279791,comment,7277888,7279461,4,0,dfc,,,"People&#x27;s obsession with &quot;specific times&quot; is kind of nice when you want to get on a plane, execute a contract before the offer expires,  allocate scarce resources like tables at a restaurant or telescope time,  calculate hours of ec2 usage, ensure adequate physician coverage in an ER, etc.<p>I think &quot;specific times&quot; are one of the hallmarks of modern society.",1393020595
7279790,comment,7277797,7279669,10,0,davidw,,,"For those following along at home, rvirding is one of the inventors of Erlang.<p>Robert - one of the things that occasionally bothers me about Erlang is that if something like string handling is  so trivial, then it should be made available as a more extensive library, rather than an exercise that leaves the reader wishing they were using another language that handles boring stuff like that.  It may well <i>not</i> be trivial for the person just get started with it, and you&#x27;ve lost a user if they give up in frustration.<p>Here&#x27;s one of the other inventors of the language asking for help about splitting a string, for instance:<p><a href=""http://erlang.org/pipermail/erlang-questions/2014-February/077417.html"" rel=""nofollow"">http://erlang.org/pipermail/erlang-questions/2014-February/0...</a>",1393020585
7279789,comment,7279624,7279624,1,0,ColinWright,,,"A popular topic:<p><a href=""https://hn.algolia.com/?q=busy+email#!/story/forever/0/busy%20email"" rel=""nofollow"">https://hn.algolia.com/?q=busy+email#!/story/forever/0/busy%...</a>",1393020579
7279788,comment,7279137,7279745,2,0,philp,,,"> No; no ISP would ever run externally managed equipment inside their network.<p>You haven&#x27;t been paying attention to that Edward Snowden fella, have you?",1393020578
7279787,story,,,4,0,cezarfloroiu,"Don't talk about ideas – execute them",http://cezarfloroiu.com/post/77414941859/dont-talk-about-ideas-execute-them,,1393020569
7279786,comment,7279137,7279742,1,0,bifrost,,,"Yeah, you were wrong :)",1393020564
7279785,comment,7277587,7278601,1,0,mikeleeorg,,,"Great idea, especially the running commentary part! Sounds like a great way to include more people, plus make these lunches potentially hilarious.",1393020564
7279784,comment,7276032,7279017,2,0,wyclif,,,"Google+ has loads of users who aren&#x27;t doing that, though. I mean users who are there <i>to use Google+</i>, and not to use YouTube, Google Drive, Gmail, &c.",1393020563
7279783,comment,7278214,7279746,5,0,rjzzleep,,,"not too mention that vim became <i>hip</i> only in the last couple of years.<p>saying it&#x27;s converting vim users left and right is a little far fetched. most of those users never had any real vim muscle memory to begin with. a lot of &quot;vim&quot; users i saw work just fine without motion commands. the only reason they used it was because they could use it anywhere. whether it&#x27;s modal or not is totally irrelevant to them.",1393020540
7279782,comment,7273081,7273853,2,0,bertil,,,"Detailed food preference means religious opinion.<p>I&#x27;m not talking out of my ass: someone who has one of the most innovative companies around shared a real problem they had because of that. If NSA was not completely overwhelmed by bullshit data, they would absolutely use supermarket data to target Salafists.",1393020514
7279781,comment,7279087,7279488,17,0,Typhon,,,"I read the paper and found it to be intelligible and interesting, making reasonable attempts to justify sound, plausible hypothesis. \nObviously he may not be right, but his explanations are well worth reading.",1393020503
7279780,story,,,1,0,jicea,"ITunes, App Store, iBooks and Mac App Store Affiliation",http://blog.manbolo.com/2014/02/21/itunes-app-store-ibooks-and-mac-app-store-affiliation,,1393020487
7279779,comment,7277865,7279668,4,0,gnaritas,,,"Exchanges don&#x27;t trade on the blockchain, only deposits and withdrawls are on chain.  Off chain transactions make up the bulk of transactions as the blockchain can currenly only handle around 7 transactions a second which is about twice as much as it&#x27;s actually being pushed so there&#x27;s still room to breath.<p>The same applies to overstock, coinbase is doing their transaction processing and it&#x27;s likely most of those are off chain as well as coinbase is a broker and has plenty of coin and dollars in house and is likely where purchasers in the US got their coin anyway as well is also likely being the users online wallet; they settle up daily with an exchange to keep their supply at necessary levels.<p>Bitcoin isn&#x27;t ready for mass adoption yet; the infrastructure is still being put into place and the 7 transaction limit has to be removed and exceeded by quite a bit to grow the point of being able to handle large volume kind of stuff.  In the meantime, and probably even after, off chain transactions will likely be how most scale is achieved.",1393020481
7279777,story,,,1,0,applecore,"Go West, Young Bank Bro",http://www.modernluxury.com/san-francisco/story/go-west-young-bank-bro?page=2,,1393020464
7279776,comment,7279262,7279607,3,0,maxerickson,,,"Our systems are full of stupid self reenforcing opinions. It&#x27;s somewhat amazing.",1393020442
7279775,comment,7277587,7279756,2,0,mikeleeorg,,,"I did this all on company time, though there were occasional evening and weekend outings (all optional). I should note that I did this at a large corporation that gave me the ability to do all of this on company time too - not all companies are that flexible.",1393020438
7279774,story,,,1,0,sailE,"Sellvana ($5M seed) versus Magento",http://magenticians.com/sellvana-versus-magento,,1393020436
7279773,comment,7277947,7278595,5,0,Fomite,,,"Oddly enough, I know some people in the welding industry, and it&#x27;s discussed.",1393020406
7279772,comment,7278214,7279363,5,0,TylerE,,,"You are technically correct, but not usefully so. The XML is pretty hairy. A VCS that handles XML semantically (e.g. tag-pair oriented, rather than line-oriented) might have some shot....but, basically, merges are more or less not going to work so it&#x27;s not really version control, just backups.",1393020395
7279771,comment,7276032,7278804,3,0,wyclif,,,"<i>I think you&#x27;re using &quot;weak sauce&quot; incorrectly</i><p>Not at all: <a href=""http://www.urbandictionary.com/define.php?term=weaksauce"" rel=""nofollow"">http://www.urbandictionary.com/define.php?term=weaksauce</a>",1393020393
7279770,comment,7279137,7279558,7,0,nathancahill,,,"Largest was over 300TB. I talked with the owner beforehand and got access to the internal IP address so traffic wouldn&#x27;t leave the datacenter (free of cost).<p>I offered to help them set up an API instead of scraping, but they decided scraping was easier in the short term.",1393020389
7279768,comment,7278784,7279166,2,0,dustcoin,,,"Most of the numbers floating around the internet and nearly every mainstream news piece about bitcoin&#x27;s energy consumption are wrong. They cite an outdated statistic maintained by blockchain.info that assumed everyone was using a GPU even when nearly all of the network was ASICs.<p>I would estimate the current network (25Ph/s) averages around 2-5W per Gh/s, leading to 50-125MW total power use. bbosh in this thread is off by an order of magnitude.",1393020381
7279767,comment,7279062,7279062,7,0,afutd,,,"&quot;&#x27;We think the governance has opted for ubiquitous law enforcement.&#x27; Pham whistled softly. Now every embedded computing system, down to a child&#x27;s rattle, was a governance utility. It was the most extreme form of social control ever invented. &#x27;So now they have to run everything.&#x27; The notion was terribly seductive to the authoritarian mind ... The only trouble was, no despot had the resources to plan every detail in his society&#x27;s behavior. Not even planet-wrecker bombs had as dire a reputation for eliminating civilizations.&quot;<p>--Vernor Vinge, A Deepness in the Sky",1393020377
7279766,comment,7279137,7279653,2,0,jonny_eh,,,"and what&#x27;s the problem exactly?",1393020375
7279765,story,,,1,0,denzil_correa,"Your Fate? Thank Your Ancestors",http://opinionator.blogs.nytimes.com/2014/02/21/your-fate-thank-your-ancestors/,,1393020358
7279764,comment,7277797,7278249,3,0,mml,,,"I once challenged Scott Fritchie to give an Erlang talk at our local ruby group (rum.mn) without implementing Eratosthenes&#x27; sieve, and sure enough he did, using elevators of all things.<p>I was so impressed with Erlang that i&#x27;m still banging my head on it nearly 10 (half-hearted) years later.",1393020342
7279763,story,,,13,1,pkrein,"Dashboard Metrics that Actually Work",https://segment.io/academy/dashboard-metrics-that-actually-work/,,1393020339
7279762,comment,7277723,7278886,1,0,crpatino,,,"On the other hand, you can take a 20% to your base salary, but your standard of living will only decrease by what? 10%?<p>(I am aware that the math does not pan out that way, but the fact remains that if you have confiscatory levels of taxes at the higher brackets, the cost of marginal (negative) increase in your base salary ends up working in your favor)",1393020335
7279761,comment,7279262,7279723,4,0,nsxwolf,,,"I bounced around from a (non-elite) state school, to community college, and finally ended up with a CS degree from a fairly mediocre accredited private university.<p>I had a pretty bad attitude about education after my high school experiences, so I just fancied myself as some sort of autodidact that does things his own way without concern for the &quot;system, man&quot;.<p>I&#x27;ve done well for myself as an engineer, so I feel that I cam out of it all ok. But now that I have kids, I don&#x27;t really want to pass on my bad attitudes onto them, so I guess I&#x27;m facing some of the issues this article discusses.",1393020335
7279760,comment,7258233,7262141,1,0,lexcorvus,,,"I looked into it, and you&#x27;re right; I was sloppy in my terminology, and will be more careful in the future. I appreciate the correction.<p>In this light, let&#x27;s consider four activities: <i>spending</i>, <i>investing</i>, <i>saving</i>, and <i>hoarding</i>. Currency dilution encourages the first two and discourages the second two. It also systematically transfers purchasing power from savers/hoarders to spenders/investors. Can you build a case that the benefit from dilution outweighs the costs? Dilution certainly encourages &quot;economic activity&quot; (for certain values of &quot;activity&quot;), which you seem to regard as axiomatically good. What is your justification for this?",1393020331
7279759,comment,7275911,7279172,1,0,mbillie1,,,"Hmm, I remember having this issue with RHEL also, but I thought it was fixed in maybe tmux 1.8... although I could certainly be wrong.",1393020330
7279758,comment,7279407,7279699,2,0,yepguy,,,"Pentadactyl is still extremely active, they just haven&#x27;t cut a new release in a while.",1393020304
7279757,comment,7279412,7279412,6,0,hawkharris,,,"I don&#x27;t own a guitar, so I tested this web app by making guitar-like noises. It turns out my voice produces &quot;C&quot; chords...and my neighbors probably think I&#x27;m insane.<p>(Jokes aside, this has a great design and it&#x27;s an interesting application of the microphone API. Hope to see more apps using this feature in the future, especially in conjunction with the cool voice-to-JSON APIs that have recently come out.)",1393020304
7279756,comment,7277587,7278188,1,0,greggman,,,"I&#x27;m curious, do your movies, outings, and activities happen on company time or do people have to use their personal free time to attend? Many employees have significant others, family, etc which means they want to spend their free time as theirs.",1393020302
