ID,Type,Story,Parent,Points,Comments,Author,Title,URL,Content,Created
7280034,comment,7277797,7279652,2,0,digitalzombie,,,"Whatapp old video talk and presentation on it. You can search it on HN.<p>Um... it&#x27;s not easy to get 2-3million they did it but they also profile the crap out of it.<p>I think they easily got 1 million out of the box though.",1393023597
7280033,comment,7279087,7279959,5,0,Typhon,,,"I am puzzled by your comment.<p>Do you mean to imply that the Voynich manuscript is &quot;obviously&quot; a joke ?<p>Do you mean to imply that, in your view, the invention of a new alphabet to write an hitherto unwritten language, which would then have failed to gain widespread acceptance, is a less realistic explanation than your own theory ?<p>Would you please care to explain it in greater details, then ?",1393023586
7280032,comment,7277797,7279652,2,0,mst,,,"The first three results on google for me for &#x27;whatsapp freebsd erlang concurrent connection&#x27; are -<p><a href=""https://blog.whatsapp.com/index.php/2012/01/1-million-is-so-2011/"" rel=""nofollow"">https://blog.whatsapp.com/index.php/2012/01/1-million-is-so-...</a><p><a href=""http://blog.whatsapp.com/index.php/2011/09/one-million/\u200E"" rel=""nofollow"">http://blog.whatsapp.com/index.php/2011/09/one-million/\u200E</a><p><a href=""http://www.erlang-factory.com/upload/presentations/558/efsf2012-whatsapp-scaling.pdf"" rel=""nofollow"">http://www.erlang-factory.com/upload/presentations/558/efsf2...</a><p>Perhaps those would make a good starting point?",1393023577
7280031,comment,7279573,7279977,5,0,zwieback,,,"You&#x27;re right but ignoring cost I&#x27;d rather have something that looks like this than a Mac but there&#x27;s no accounting for taste.<p>Regarding the PCIe comment: people are already using PCIe over cable as an expansion technology. We use lots of these, for example: <a href=""http://www.onestopsystems.com/pcie_over_cable_3810.php"" rel=""nofollow"">http://www.onestopsystems.com/pcie_over_cable_3810.php</a><p>Works in a pinch although it&#x27;s of course not going to have the same performance as a connectorless solution.",1393023556
7280030,comment,7277947,7278286,1,0,spike021,,,"Yeah I think that seems to be a pretty common scenario. It&#x27;s pretty unfortunate that there are people who only think of programming in relation to game development rather than the rest of the spectrum.",1393023532
7280028,comment,7278214,7279672,3,0,ggreer,,,"If anything, the NeoVim will be much more responsive. Vim&#x27;s current plugin architecture is simple: when plugin code is running, the UI is blocked. If your plugin has an infinite loop, Vim hangs forever. If your plugin does network I/O, Vim hangs until the socket read/write is finished. The only work-around is to use non-blocking sockets and abuse CursorHold/CursorHoldI autocommands and updatetime. That trick breaks the leaderkey, which is a show-stopper for many users. There are similar problems with syntax highlighting. Vim has its own (extremely inefficient) regex engine that blocks the UI when matching.",1393023526
7280027,comment,7278645,7278694,2,0,selmnoo,,,"So, what about you jl? You&#x27;ll still have your hands on deck?<p>Not to be so intrusive, but I recall pg talking about the son -- was that a factor in pg making this decision? To dedicate more time to parenting or something like that?",1393023524
7280026,comment,7279262,7279607,2,0,walshemj,,,"That is the case in a lot of country&#x27;s  the old 11 plus in the UK and the similar streaming into &quot;technical&quot; schools that Germany uses.",1393023515
7280024,comment,7279062,7279839,1,0,anigbrowl,,,"The city where I live has PR and I grew up in a country where it is the norm. I like it too, but it&#x27;s not a panacea, you still get abuse, corruption, and political horse trading of all kinds.",1393023486
7280023,comment,7278214,7279783,3,0,jude-,,,"> not too mention that vim became hip only in the last couple of years.<p>Wait, what?  Vim has been in use for a lot longer than that (it was released in 1991), and vi even longer (1976).",1393023458
7280022,comment,7277913,7277913,4,0,themoonbus,,,"It&#x27;s posts like this that remind me I&#x27;m out of step with the hacker news majority. My first thought when seeing this was &quot;why would anyone want that&quot;.<p>It just makes eating seem so... mechanical? In my house, so much family time was structured around food – grocery shopping, cooking, eating, choosing a restaurant to go out to, driving to grab take out, etc.<p>I guess it just depends on the food culture you&#x27;re used to. I do appreciate that this is helpful for a certain subset of the population who don&#x27;t have any interest in food (if you have interest but are too busy, maybe you should make yourself less busy), but I guess I was just surprised to see unanimous support in the comments.",1393023446
7280021,comment,7277797,7278121,2,0,digitalzombie,,,"Erlang scheduler time share each processes. So if you have an infinite forloop, it while stop for several ms for other processes to run.<p>Preemptive scheduler, I doubt Go have this, then again Go doesn&#x27;t have a VM/OS system.",1393023441
7280020,comment,7278214,7279881,3,0,Jach,,,"I have a habit of typing &#x27;jkjk...&#x27; in command mode when I&#x27;m thinking, and eventually I got sick of stretching my fingers to escape into command mode so I just used &#x27;jk&#x27; as my escape sequence.<p><pre><code>    imap jk <Esc>\n</code></pre>\nOf course now in non-vim editors I sometimes have to undo the occasional jk sequence... But my point is that the escape key can be whatever people want it to be.",1393023440
7280019,comment,7277723,7278886,1,0,smartician,,,"I think you&#x27;re confusing marginal tax rate with effective rate. As a single person in California making $150k p.a., your take-home pay is about $95k per year, or $7,900 per month.",1393023437
7280018,comment,7279262,7279262,4,0,shas3,,,"The key problem with schools is that they teach you to not just respect authority, but also to defer to it. In the real world, conforming and deferring to authority only makes you mediocre. In order to succeed, one needs to develop the mental framework to question authority and challenge the status quo. The current schooling system, for the most part, does not encourage the development of such a mentality.<p>As someone who grew up in India, I am all the more sensitive to the role of authority. Thanks to massive density of population, weak economy, and cultural norms, Indian institutions promote the worst forms of deference to authority.  However, rather than culture, in countries like the US, the schooling system is the primary source for teaching people to conform to their peers&#x27; expectations and to defer to authority. The American society, in general, is quite different from the hierarchical structure that exists in American schools. In the real world, you have more freedom to question authority. Life is also different for adults because they are often more mature than kids, and are in positions where they have more choice than in the school. Schools should thus change to mirror the society, while still understanding the fact that school students are mostly immature.<p>Often, such suggestions for reform are mistaken for &#x27;give them the choice to study what they want&#x27;. On the contrary, throughout secondary school, students should necessarily be taught all subjects and forced to sit through all classes. But, be careful to note that this does not necessarily imply that they should be <i>judged</i> on all these courses. The key problem in modern schools is that the &#x27;judgement&#x27; system is broken. Just like performance review systems in most companies. Schools should take a leaf out of the HR policies of companies like Netflix [1] and do away with formal judgement/performance review processes.<p>[1] <a href=""http://hbr.org/2014/01/how-netflix-reinvented-hr"" rel=""nofollow"">http://hbr.org/2014/01/how-netflix-reinvented-hr</a>",1393023420
7280017,story,,,7,4,technologizer,"The smartphone app wars are over, and Apple won.",http://techland.time.com/2014/02/21/ios-vs-android-2/,,1393023414
7280016,comment,7271602,7272476,1,0,sparagi,,,"I agree.  We left Network Solutions b/c they were hit 3 times in less than a year.  Maybe the website targets moved to Namecheap, so they were targeted also?",1393023406
7280015,comment,7279573,7279977,3,0,kyberias,,,"Thank you for the insight on PC signaling.",1393023406
7280014,comment,7280008,7280008,3,0,ChuckMcM,,,"Apropos of this story to HN: <a href=""https://news.ycombinator.com/item?id=7274277"" rel=""nofollow"">https://news.ycombinator.com/item?id=7274277</a> I reiterate how challenging it is to provide accurate and up to date coverage in a country with a functioning government, that doesn&#x27;t want you there. For decades it was impossible to get any stories out of the Soviet Union with any reliability.",1393023356
7280012,comment,7279062,7279767,4,0,exratione,,,"And Trygve Ytre and Gunnar Larson? Larson was millennia dead, of course. The civilization at Ytre had barely outlived the man. There had been an era of ubiquitous law enforcement, and some kind of distributed terror. Most likely, Larson&#x27;s own localizers had precipitated the end. All the wisdom, all the inscrutability, hadn&#x27;t helped his world much.<p>--Vernor Vinge, A Deepness in the Sky",1393023301
7280011,comment,7277865,7278140,3,0,petertodd,,,"I&#x27;m pretty sure I remember either Gregory Maxwell or Andrew Miller suggesting it to me first, and I think it might be the latter&#x27;s idea originally. (at least in the Bitcoin space) Andrew has done a lot of work on &quot;merkelizing&quot; data structures: <a href=""http://www.cs.umd.edu/~amiller/gpads/"" rel=""nofollow"">http://www.cs.umd.edu/~amiller/gpads/</a>",1393023271
7280010,comment,7279062,7279795,7,0,anigbrowl,,,"Technology is like water, it finds its own level. When you make sensors and storage as cheap as dirt then you&#x27;re going to end up with widespread deployment. In many polities, people seem to think that the costs are outweighed by the benefits (of improved security and so on). I&#x27;m not sure that they are and you are clearly sure that they aren&#x27;t, but ultimately the criteria for arriving at a given position are arbitrary.<p>I mean, lots of people think technology leads to economic inequality by devaluing human labor, resulting in unemployment and pay stagnation, but you probably agree with me that it would be futile to pass a law for the express purpose of limiting industrial productivity per worker.",1393023246
7280009,comment,7277128,7279987,1,0,happyscrappy,,,">I game<p>Oh, you game.  You so game.",1393023222
7280008,story,,,11,2,ChuckMcM,"Venezuela tells CNN journalists to 'get out'",http://www.cnn.com/2014/02/21/world/americas/venezuela-cnn-journalists/,,1393023204
7280007,comment,7279412,7279412,1,0,paperwork,,,"Interesting, just last night I was searching google to see if it is possible to write a guitar tuner in html 5 :)\nI just started learning the guitar. When I do basic finger exercises, I have no idea if I&#x27;m plucking the right string. Something like this could be easily extended to help provide feedback for such exercises.",1393023203
7280006,story,,,1,0,rookhack,"TOMS for Houses",http://www.newyorker.com/online/blogs/currency/2014/02/pete-dupuis-buy-one-give-one-houses.html?mobify=0,,1393023197
7280004,comment,7276491,7278932,1,0,antirez,,,"np ;-) after all as an heavy HN reader I understand very well the impossibility to read whole posts...",1393023194
7280003,story,,,2,1,stevewilhelm,"How Mikaela Shiffrin Won the Slalom – NYT Visualization ",http://www.nytimes.com/interactive/2014/02/21/sports/olympics/womens-slalom-results.html,,1393023155
7280002,comment,7276032,7276937,1,0,milesokeefe,,,"> It&#x27;s your story. We help you tell it.<p>They really need to write something that tells you what the service does.",1393023150
7280001,comment,7279573,7279873,6,0,egypturnash,,,"Keeping the design interns busy?",1393023146
7280000,story,,,1,0,daleco,"IHMC Robotics at the DRC. Small documentary, behind the scene",https://www.youtube.com/watch?v=DjQx1BT_xts#t=259,,1393023142
7279999,story,,,1,0,vsakos,"WhatsApp lost 500,000 of its users to Telegram",http://thenextweb.com/facebook/2014/02/21/whatsapp-lost-500000-users-to-telegram-but-most-others-seem-happy-to-stay/,,1393023139
7279998,comment,7277128,7279173,1,0,belorn,,,"Im commenting to &quot;win an argument&quot;. If you want to believe that information that direct drones where to send missiles are equal harmless to food, then have a nice day.",1393023134
7279997,story,,,2,0,driscollis,"Python 101: Book Outline",http://www.blog.pythonlibrary.org/2014/02/21/python-101-book-outline/,,1393023127
7279996,comment,7279262,7279880,26,0,psbp,,,"The smartest kids I knew were those with very intellectual, but hands off, parents.<p>I always thought it was misguided to advice parents to demand homework be done at a certain time or enforce certain metrics (test scores, volunteer hours, etc), rather than just having intelligent conversations about, well, anything!",1393023123
7279995,story,,,1,0,elias12,"Rethinking Time Management",http://www.fork.do/posts/rethinking-time-management,,1393023116
7279994,comment,7279262,7279929,5,0,nsxwolf,,,"There&#x27;s probably a lot of kids today that could benefit from hearing a story like yours.",1393023115
7279992,comment,7279137,7279468,2,0,majormajor,,,"Comcast agreed to not throttle competing video services, at least until 2018, back when it acquired NBC (and so part of Hulu, which it had to step back from management from) a couple of years back.<p>So if you can make a case that they&#x27;re &quot;almost unquestionably&quot; throttling Netflix, you could probably find some people very interested in that... but it sounds more like they were just saturated and are now taking steps to alleviate it.",1393023055
7279990,comment,7277865,7279779,2,0,nwh,,,"I don&#x27;t think we are anywhere near the blocks being half full, lots are less than 100kB except for Eligius. Is there anywhere displaying this metric?",1393023030
7279989,story,,,2,0,jtchang,"Just found this documentation really well done",http://docs.dhtmlx.com/scheduler/month_view_templates.html#comment-1223836107,,1393022999
7279988,comment,7274034,7275012,1,0,je42,,,"Cool, that can save a lot of headaches.",1393022972
7279987,comment,7277128,7278163,1,0,belorn,,,"I game, lets test this then.<p>Lets hypothetically provide the full mobile phone records of US army personal located in Yemen, and lets count the bodies. Do you think a conventional bomb will result in few&#x27;er dead people? How many innocent friends and family would die?",1393022963
7279986,comment,7279087,7279959,11,0,Noxchi,,,"I belong to a culture (North Caucasian) that doesn&#x27;t / didn&#x27;t have it&#x27;s own writing script in that time frame. That also faced havoc due to mongol conquest (so this might have created refugees).<p>This discovery excites me because the person also mentions that it has Caucasian characters in the manuscript. So maybe it was written by my ancestors.",1393022958
7279985,comment,7278214,7278214,18,0,rjzzleep,,,"Thiago if you read this, please do your fundraiser a favor and mention all the work and review that went into your thread safe message queue already.<p>There is a lot of skepticism about your capability of delivering, but i think it&#x27;s clear that you already have the experience needed.",1393022956
7279984,comment,7266796,7270647,2,0,ulfw,,,"Yea and all Ford has to do is put rotisserie grills on their F150s and they could beat McDonalds. Odd argument.",1393022948
7279983,comment,7277947,7278836,1,0,SilasX,,,"Not the best metaphor, dude ...",1393022929
7279982,comment,7277326,7279905,2,0,_garrett,,,"You could add a visual icon as a sort of two-factor authentication. Set the icon to change every few minutes and do a push notification with the current icon to the people at the door.",1393022923
7279981,comment,7279087,7279815,1,0,TrainedMonkey,,,"Quantity is a quality of it&#x27;s own. I think getting large number of people to try something is a good way to move forward. Sure it is not efficient, but fairly reliable.",1393022918
7279980,comment,7279261,7279261,2,0,Greenisus,,,"Does anyone know if this is an issue at the Foundation API level (affecting any apps using NSURLConnection, for example) or if it&#x27;s a Safari issue?",1393022911
7279978,story,,,48,16,T-A,"NSA Official Warned About Threat 17 Years Before Snowden",http://www.bloomberg.com/news/2014-02-21/nsa-official-warned-about-threat-17-years-before-snowden.html,,1393022881
7279977,comment,7279573,7279573,43,0,ChuckMcM,,,"And this is what you get when you have a designer &quot;imagine&quot; what a PC would look like.<p>One of the nice things about the Mac Pro was that it was <i>engineered</i> to look good, as opposed to being &quot;designed&quot; to look good. (or not depending on your design tastes).<p>The modern PC has three things you have to manage when engineering a &#x27;new&#x27; one, heat management from both the CPUs and the GPUs, signals management which can carry exceptionally high frequency signals across &quot;busses&quot; that act as transmission lines, and modularity.<p>This vision has the latter covered but introduces challenges that make keeping the other two in check probably impossible.<p>First (and perhaps foremost) a modern PC generates a lot of heat, and managing that heat is central to any design, like having a place to eat and a place to sleep are essential to any home design. The components will generate up to 1200W of heat (equivalent to a space heater or hair blow-dryer set on &#x27;high&#x27;) Which needs to be removed from the components fast enough to prevent them from reaching their critical temperature.<p>Next up, modern PCs use PCIe channels that clock at 5Ghz with low voltage differential signaling. These signals absolutely do <i>not</i> like going through connectors, so systems design need to minimize connector transitions to 1 or zero. The renders for this design seems to show components plugging into a back plane (minimum two connectors). Also at 5Ghz, the wavelength of these signals is 6 cm. That means that bits going through a wire that is longer than 6cm long start taking a &quot;long time&quot; (relative to the signal) to arrive. Now PCI has some mechanisms in the protocol to support this but it starts resulting in additional bus transactions and signals. That increases latency in a way that can turn your awesome GPU into something decidedly unawesome in terms of its performance. It isn&#x27;t the GPUs fault, its getting the data too and from the CPU which is the problem. There is a reason the &#x27;video&#x27; slot on PCs is the one right next to the processor :-). This problem is made even more manifest in memory systems. If you get a chance to look at the circuit board traces for memory DIMMs some time notice how some are really squiggly and some are straight. The trick is that they are all <i>exactly</i> the same length so that data that starts coming out of the chip arrives at the same time at the CPU and vice versa. Fully Buffered DIMMs (FBDIMMs) were a shot at &#x27;fixing&#x27; this and few people bought them. The chips ran hotter and performance was worse, lose lose to most consumers.<p>All that said, I love the <i>concept</i> of modularity in a PC but at the moment I can&#x27;t see how to get that without sacrificing a lot of performance. That is one of the reasons I was so impressed with Apple&#x27;s effort. It gets a lot of things right.",1393022872
7279976,comment,7279062,7279277,1,0,Zigurd,,,"You are mostly correct, but pervasive surveillance of police behavior, even when it is entirely controlled by the police department results in deep cuts in the use of force, and of complaints against the police.<p>Still, that doesn&#x27;t make me an optimist about &quot;sousveillance.&quot;",1393022859
7279975,comment,7279261,7279261,2,0,helper,,,"Wow, this sounds bad. It sure would be nice if Apple gave us a little bit more information, like when the bug was introduced and what exactly was not being verified. Until we get more information, you should assume the worst that all your IOS TLS traffic might be compromised.",1393022841
7279974,story,,,1,0,veritas9,"Square's Coding Challenge – Levenshtein distance",https://www.codeeval.com/public_sc/58/,,1393022835
7279973,comment,7279062,7279062,2,0,fleitz,,,"Sure it&#x27;s easy to avoid surveillance state dystopia... learn from Winston...<p>O cruel, needless misunderstanding! O stubborn, self-willed exile from the loving breast! Two gin-scented tears trickled down the sides of his nose. But it was all right, everything was all right, the struggle was finished.<p>He had won the victory over himself. He loved Big Brother.",1393022765
7279971,comment,7279137,7279661,5,0,ef4,,,"That&#x27;s pretty hard to generalize. I worked at the biggest CDN for many years. They definitely get free traffic in many places. They had a whole team who&#x27;s job was talking to network owners and saying &quot;look, you paid for X terrabytes of traffic to us last month. We can cut that cost by 100 if you let us install servers inside your network that will cache the popular content locally.&quot;<p>It all depends on relative size. Bigger networks can demand money from smaller networks and/or CDNs. Networks of comparable size can profitably peer with each other without exchanging cash. Comcast may not do it for free, but the national ISP in a smallish developing country sure might.<p>It&#x27;s a big dance, and the relationships are constantly changing. Managing it all in software to actually optimize cost and performance is a big part of the secret sauce for a CDN.",1393022758
7279970,comment,7279262,7279880,6,0,tokenadult,,,"Good on you for attributing the saying to Plutarch.<p><a href=""http://quoteinvestigator.com/2013/03/28/mind-fire/"" rel=""nofollow"">http://quoteinvestigator.com/2013/03/28/mind-fire/</a><p>Yes, to your substantive point, learning is easy (comparatively) when the motivation is intrinsic. Trying to preserve intrinsic motivation in my four children is why I keep slogging along in homeschooling.<p>I had no competitive sports involvement in my youth, nor did my wife, but we&#x27;ve encouraged our children all to be involved in our local soccer club, and I LOVE that they have had early experience in shrugging off defeats and continuing to improve their skills on the field. One loss (or even a bunch of losses) does not end a playing career.",1393022750
7279969,comment,7278400,7278400,1,0,programminggeek,,,"No, it can&#x27;t. Haskell is not a prototyping language.<p>Ruby (and more generally dynamic languages like PHP/Python) are and Rails like frameworks are amazing tools for prototyping when you don&#x27;t know what you are building, need to iterate quickly, and need to prove out an idea. Dynamic languages are great for building things that are very dynamic, things that are in fact a kind of prototype.<p>Haskell and other languages with things like type checking and compilers and so on are designed to be safer, smarter, and are better long term for projects where the cost of complexity and maintenance are more significant and the development investment will get a payback.<p>If you don&#x27;t know if a project is going to work, you shouldn&#x27;t spend a huge investment to find out if it will work. So, use a tool like Wordpress, Drupal, Rails, Django, etc. to build out the minimum viable thing that you can build to prove out the idea and see if there is a real business there. Once you prove out the prototype and you know it is going to be a long term project that can pay for itself in terms of ongoing development investment, you need to throw the prototype away and build it with a tool like C#, Go, Java, Haskell, etc.<p>Most projects never realize they are no longer a prototype and should no longer be written in a prototyping language. Thus, you get all of the problems that come with a prototype without a lot of the solutions that we already have for solving them like compilers and such.<p>Interestingly, if you use a tool like Rails, there is enough there that you can get far past the point of a prototype before realizing it is no longer the right tool for the job. This is evidenced by the fact that there are now a ton of people talking about large project OOP and structure in Ruby and Rails, without them realizing that it&#x27;s always going to be an uphill battle in Ruby because of the language itself.<p>So, if the question is if Haskell can be the next great prototyping language, then I don&#x27;t think it is. If the question is if Haskell can be the language that you could migrate a project to after you realize it&#x27;s no longer a prototype, then yeah it might be.<p>Building a large production product with long term maintenance and scaling needs in a prototyping language is very likely a bad idea and is probably why there are so many projects that start to be really difficult in dynamic languages after they reach a certain size.",1393022735
7279968,comment,7276032,7276942,2,0,thetrb,,,"There&#x27;s Xing, but it&#x27;s mostly focused on Europe.",1393022733
7279967,comment,7276682,7277532,3,0,hashberry,,,"The presentation and video was amazing. I immediately fell in love with her. She smiles non-stop. She jumps around with giddy excitement in a cute little dress. She&#x27;s the perfect manic pixie dream girl trope. I want her to have all my babies.",1393022725
