ID,Type,Story,Parent,Points,Comments,Author,Title,URL,Content,Created
7279895,comment,7278086,7278200,2,0,lutusp,,,"Unfortunately, a 520 isn&#x27;t a official HTTP error:<p><a href=""http://en.wikipedia.org/wiki/List_of_HTTP_status_codes"" rel=""nofollow"">http://en.wikipedia.org/wiki/List_of_HTTP_status_codes</a><p>Quote: &quot;520 Origin Error (Cloudflare) ... This status code is not specified in any RFCs, but is used by Cloudflare&#x27;s reverse proxies to signal an &quot;unknown connection issue between CloudFlare and the origin web server&quot; to a client in front of the proxy.&quot;<p>Basically, the error (if it&#x27;s a real error indication and not bogus) suggests an inability by the server to establish a connection with your system. Remember that HTTPS (HN&#x27;s operating mode) signifies extra requirements for a legitimate connection (and a different port: 443 instead of 80), so there might be firewall issues at your workplace that aren&#x27;t an issue at home.",1393021756
7279894,comment,7279860,7279879,1,0,thauburger,,,"Quite possible...",1393021751
7279893,comment,7277915,7279695,2,0,Legion,,,"The relative terseness and readability of Ruby code makes it so that turning to reading the source code is often favored over a lot of documentation.<p>It would be a bit more difficult to operate in the same way in a Java environment.<p>That said, the fact that it&#x27;s kind of viable in Ruby doesn&#x27;t mean that it&#x27;s the best thing. Ultimately, I agree with you: better documentation would be very welcome.",1393021745
7279892,comment,7279261,7279441,4,0,nwh,,,"You can do that but you&#x27;ll be throwing certificate errors everywhere if they&#x27;re self signed. By the sounds of it this is a bypass or method of getting around the CA altogether.",1393021733
7279891,comment,7279582,7279754,1,0,emocakes,,,"I&#x27;m with you on this one ^",1393021731
7279890,comment,7277326,7279828,3,0,naveenspark,,,"Apologies if my post felt unnecessarily snarky.  Yes I am cofounder @ Immunity Project, but I previously helped create Redbox Tickets so I have that hat on for this thread.  My opinion on the video aside, when you have a line of people in front of you trying to get into an event, how does this help build community?  You have such little time with each person because your #1 focus is getting them in the building.  Even if its a small event you want people spending more time in the event not chatting with the ticket taker.  What is the roadmap like for this feature?  Perhaps that will help me better understand the value prop.",1393021719
7279888,comment,7277888,7278856,4,0,T-hawk,,,"Greenland&#x27;s span of longitude in degrees is greater than that of the continental US.  That is what this map projection is displaying.  Even though Greenland&#x27;s distance is smaller, it&#x27;s more longitude and time zones because the meridians are very closely packed near the pole.",1393021688
7279887,comment,7278679,7278679,1,0,mathattack,,,"Congrats!  Big step up for him.  Big step for PG too.  I think the new division of labor should allow each to specialize at what they&#x27;re good at.",1393021685
7279886,story,,,1,1,helloanant007,"A tool for conference attendees",http://confer.csail.mit.edu/,,1393021675
7279885,comment,7279573,7279573,5,0,greenyoda,,,"Prior discussion:<p><a href=""https://news.ycombinator.com/item?id=7020090"" rel=""nofollow"">https://news.ycombinator.com/item?id=7020090</a>",1393021674
7279884,comment,7279262,7279753,7,0,Phlarp,,,"You&#x27;re beating the right path. Don&#x27;t let anybody take wind out of your sails for any reason.",1393021661
7279883,comment,7279062,7279062,1,0,nawitus,,,"Avoiding surveillance is easy, but it costs money. It turns out most people don&#x27;t want to pay for it, and the market decides in favour of surveillance. (I&#x27;m talking about voluntary surveillance here. Even if there&#x27;s no voluntary surveillance, governments could obviously still spy on you).",1393021653
7279882,comment,7279261,7279261,3,0,nwh,,,"Does this contain patches for the jailbreak?",1393021634
7279881,comment,7278214,7279073,2,0,dagi3d,,,">I don&#x27;t use Vim much now because I work a lot in Windows, and Vim got me into the habit of hitting escape when I was through entering text, but escape cancels the input in a lot of programs. However, I still use it in the shell or when I need to make certain global edits.<p>some people discourage the use of the Esc key and prefer to use Ctrl-c instead. I&#x27;d recommend to disable it and force to use the Ctrl-c combo. I did it and completely forgot about the Esc key(actually I find it more comfortable)",1393021624
7279880,comment,7279262,7279262,47,0,ef4,,,"One of the ironies here is that it&#x27;s actually much easier for the smartest kids to excel in school if they have a healthy level of disrespect for it.<p>Intrinsic motivation is the dominant factor. A student that&#x27;s actually driven by curiosity and a desire to master everything he or she can is tens or hundreds of times more effective than someone acting out of extrinsic motivation -- the carrots and sticks of grades and punishments.<p>It is <i>so much</i> easier to learn this way that the other kids who are just slogging it out seem to be moving in slow motion. Staying far enough ahead of them to get good grades takes very little effort when you&#x27;ve actually internalized that learning is something you do for fun.<p>The real trick of course is igniting the desire in the first place. Which has been obvious for at least two millennia:<p><pre><code>    &quot;The mind is not a vessel to be filled, but a fire to be ignited.&quot; - Plutarch</code></pre>",1393021623
7279879,comment,7279860,7279860,1,0,vlaurenlee,,,"Nice Tom, awesome offer. Maybe turns into an annual tradition?",1393021603
7279878,comment,7279407,7279407,1,0,javanix,,,"I&#x27;d love to figure out how to get tmux/screen keybindings for this.<p>Opening a browser and using it within an existing terminal (without needing the mouse) would be incredibly close to the ideal workflow for me.",1393021582
7279877,comment,7278198,7278198,1,0,germanTankPanzy,,,"I think the most important information is the table:\nMonth \tStatistical estimate \tIntelligence estimate \tGerman records\nJune 1940 \t169 \t1,000 \t122\nJune 1941 \t244 \t1,550 \t271\nAugust 1942 \t327 \t1,550 \t342<p>Intelligence estimates... so off the mark.",1393021568
7279876,comment,7279573,7279573,5,0,programminggeek,,,"Gosh that&#x27;s pretty.<p>This is the kind of ambition that I feel like is missing from PC&#x27;s. So much of the PC business revolves around just cutting cost and not making something cutting edge. Somehow Razer has managed to build interesting hardware that pushes the limits in a world where everyone is stuffing off the shelf components into mostly generic cases.",1393021561
7279874,comment,7241176,7244492,1,0,vbuterin,,,"That sounds like one of those &quot;serious in theory, trivial in practice&quot; problems. Like it or not, there ARE only 3 types of standard transactions, and even the network-level protocol recognizes this. Each of them has a specific address convention.",1393021554
7279873,comment,7279573,7279573,4,0,nawitus,,,"What problem is this solving?",1393021537
7279872,comment,7279262,7279262,20,0,mathattack,,,"There&#x27;s a saying at Harvard Business School...  (I didn&#x27;t attend, so I&#x27;m not namedropping!)<p>The A students become professors.  The B students work for the C students.<p>The academic society forces this focus on high grades across all subjects that is unhealthy.<p>But what&#x27;s a student to do?  If you can&#x27;t get into a top school with a couple of Bs, life gets tougher.  If you want to major in Computer Science, any school is fine.  If you want to major in Philosophy, you had better get into a top 10 school.  And once there, you&#x27;d had better get top grades because you&#x27;ll need to go to graduate school.<p>The problem is even larger than the author suggests.  If you&#x27;re in a large city, to get into the nice high school with the fancy IB program, you might need straight As in junior high.  And that junior high school may have competitive admissions.<p>It&#x27;s a wonder that any creativity survives!",1393021517
7279871,comment,7279573,7279843,1,0,vonmoltke,,,"> Yes, but you could do that within the tower. Maintaining signal integrity through the connectors and/or propagation delay due to trace length would be the limiters.<p>They can, and probably will, also use signal path equalizers.",1393021515
7279870,comment,7278214,7279305,3,0,rjzzleep,,,"i so wish any of the terminal emulators in osx had the scriptability that urxvt has. i miss it all the time :/",1393021501
7279869,comment,7278645,7278663,1,0,caublestone,,,"Congrats Sama!",1393021484
7279868,comment,7279062,7279605,1,0,rayiner,,,"I think technology is neutral. At the end of the day, it&#x27;s always people that are the problem and the solution. The same technology that allows a despot to oppress people more easily simultaneously makes it easier for a faction to overthrow him.<p>Consider Hitler&#x27;s Germany. There were factions within the military that tried to overthrow him, but failed. My assertion is that widely distributed technology makes it easier for factions like that to succeed.",1393021483
7279867,story,,,1,1,parkeragee,"Hire Remotely just launched – FREE 30 day job listings",http://hireremotely.co,"Hire Remotely has just launched and for a limited time, we are allowing all 30 day remote job listings for FREE. Check it out! www.hireremotely.co",1393021453
7279866,comment,7278198,7278198,12,0,T-hawk,,,"This actually hit my previous company in a software context.<p>We would number our hotfixes sequentially.  Many would be items demanded by a single client, so would get deployed as hotfixes only to that customer&#x27;s site, and just rolled into the main trunk for the next quarterly release for everyone else.  Clients would always be notified about hotfixes going onto their live sites.<p>One savvy client noticed the hotfix numbering sequence.  Naturally, that ensued quite a number of extremely awkward discussions as they would regularly ask why our software needed so many hotfixes (tens per week) and why they weren&#x27;t entitled to all of them right away.<p>Solution: a new policy to randomly generate hotfix numbers.  Which of course led to the next problem, that now the sequence was not obvious from the names, so dependent hotfixes would sometimes get deployed in the wrong order.  Why can&#x27;t anything be easy...",1393021452
7279865,comment,7277865,7279719,2,0,vbuterin,,,"Ah okay, that makes sense. You&#x27;re completely right that that&#x27;s not really solvable in general.<p>Unless, of course, we finally switch over to a public/private key based login system and each user&#x27;s balance sheet is composed of a set of authorized/signed deposits, trades and withdrawals (ie. a full blockchain, but centralized and &quot;mined&quot; only by the exchange&#x27;s server). I wonder what possibilities that kind of setup would open.",1393021449
7279864,comment,7277797,7279292,1,0,davidw,,,"> And one reason it works is because it has built-in those features for building fault-tolerant systems which, for example, Go lacks.<p>Very few people really need that though, so from a marketing point of view, to sell that as the primary feature is to consign Erlang to a fairly small niche.",1393021447
7279863,comment,7279087,7279837,4,0,privong,,,"> They didn&#x27;t really have a good answer for whether that e-mail would stick around after I graduated. Or whether access to that account would be available forever, or whether it would be free.<p>Yeah, that can be an issue. It seems to be pretty common now for universities to let folks keep their email addresses (since they often outsource the addresses to google).<p>> I didn&#x27;t even bother asking why anyone would want an ugly e-mail address like pxl014000@utdallas.edu to be their official formal means of communication.<p>Very true. Though, often one can set up an email alias (assuming you don&#x27;t have a name that&#x27;s too common!).",1393021435
7279862,comment,7279407,7279708,2,0,javanix,,,"Its pretty kludgy, but X forwarding to a local VM that runs it is actually usable.<p>It&#x27;s also available through MacPorts apparently, though I haven&#x27;t had a chance to try it.",1393021430
7279861,comment,7279573,7279724,1,0,yid,,,"It might be a better strategy to keep the module prices as low as possible and depend on frequent upgrades. I wouldn&#x27;t mind committing to buying a new CPU/RAM module every year for a few years if the price was right.",1393021425
7279860,story,,,6,2,thauburger,"Show HN: I'm giving away 26 hours to 26 startups I've never met",http://thauburger.com,"Today&#x27;s my 26th birthday. One of my goals this year is to work with lots of new, interesting startups. So, in YC fashion, I&#x27;m opening up 26, one-hour &quot;office hour&quot; sessions to any startup who is interested.",1393021414
7279859,comment,7278214,7279429,2,0,jamesgeck0,,,"Path 2 is actually something you could do with neovim. The editor&#x27;s core and it&#x27;s UI would be decoupled, so you could put whatever UI you wanted to build on top of it relatively easily.",1393021377
7279858,story,,,1,0,giantrobothead,"Map of Conflict Lines in Kiev",http://bigthink.com/strange-maps/645-kiev-burning-a-map-of-the-front-line?utm_source=feedburner&utm_medium=feed&utm_campaign=Feed%3A+bigthink%2Fblogs%2Fstrange-maps+%28Strange+Maps%29&utm_content=Netvibes,,1393021363
7279857,comment,7279573,7279724,1,0,vonmoltke,,,"The greatest advantage would be partially insulating the owner from platform changes, though that depends on how Razer implements the generic backplane in the tower.<p>For example, lately Intel has been changing CPU sockets and interface chipsets like I change my underwear.  Upgrading the processor requires upgrading the motherboard, which may trigger a cascade upgrade of other parts.  With this system, it may be possible to upgrade the CPU module (with all bridge chipsets included) without having to touch any other parts.<p>Also, you are no longer limited by what a motherboard vendor chooses to put on their board.  No worrying about number of RAM slots, number of USB headers, how many of each type of PCIe slot they decide to include.<p>How well it works, and whether it justifies the price, remains to be seen.",1393021351
7279856,story,,,2,0,wagerlabs,"Erlang vs Haskell [2006]",http://wagerlabs.com/blog/2006/01/01/haskell-vs-erlang-reloaded/,,1393021349
7279855,comment,7278645,7278991,3,0,notatoad,,,"The mobile apps all kind of suck though.  i keep installing new ones, and always end up back in the browser, exercising my pinch-to-zoom muscles.",1393021349
7279854,comment,7279407,7279407,3,0,javanix,,,"Thanks for the rename, whoever did that. Couldn&#x27;t figure out how to properly phrase it without being super link-baity.",1393021334
7279853,comment,7277797,7277797,1,0,6d0debc071,,,"<i>> Never used Erlang nor considered it</i><p>---------------<p>Well, I guess only the first part of that is true now. :p<p>But yeah: Why not Erlang?<p>I haven&#x27;t seen a good pitch for it that addresses anything we&#x27;re interested in.<p>Erlang&#x27;s big thing seems to be that it scales. We don&#x27;t have that as a major problem for our programming. If we did, I imagine I&#x27;d be interested in quantitative comparisons with other programming languages for similarly advanced code, (i.e. I wouldn&#x27;t want to read some ungodly shitfest alongside decent code as the argument that Erlang was better.)<p>To be convinced from that perspective, I&#x27;d have to:<p>A) Know ahead of time that we were going to be in a position where we&#x27;d need that sort of optimisation<p>B) Know, or strongly suspect, that we wouldn&#x27;t have to expend more effort learning Erlang than we would optimising it to &#x27;good enough&#x27; performance in another language.<p>C) Be assured that I&#x27;d be able to hire sufficiently intelligent programmers who knew, or were willing to learn, Erlang to maintain things if I set up in it.<p>That seems a rather niche position to be in requiring both a very strong pitch for that advantage on the part of Erlang, and a significant degree of foresight on my part. If it takes six months to a year to gear up for starting a decent Erlang solution, we&#x27;d best be expecting to do massive systems engineering fairly frequently as compared to writing the solution in something that we know right now for that to pay off.<p>People may say that it&#x27;s trivial to implement what&#x27;s missing in Erlang, as compared to the systems side of things that&#x27;s missing in some already known language. That may be true, I don&#x27;t pretend to know enough about it to comment on it. However, even if it&#x27;s so, is it sufficiently harder to implement something that scales out to the required efficiency in Known-Language-X than it is to learn Erlang to that level? Especially given that there&#x27;s probably already community support for scaling in Known-Language-X.<p>#<p>It does seem to have some other nice features. But from that perspective - and this was my first response on dipping into Learn You... I look at it and think <i>&#x27;This looks kinda like Haskell. Why not use Haskell?&#x27;</i> or, as the case may be, <i>&#x27;Why not Lisp?&#x27;</i> Both of which I&#x27;ve some experience with and would be easier to find good programmers for.<p>In that regard Erlang is competing with some damn powerful languages.",1393021320
7279852,comment,7278784,7279166,5,0,anigbrowl,,,"The problem with a lot of cryptocurrencies is that the mining is difficult and wasteful; you&#x27;re doing a lot of computation that only makes economic sense if a lot of other people are also doing it, and it&#x27;s plain that many of those people are trying to do it using someone else&#x27;s equipment, which is a form of theft (specifically, conversion).<p>I like DogeCoin (much shibe) but this is still a Bad Thing. It would be much better if the problem being solved to create a blockchain were also useful in some other context, eg protein folding. Of course, some such problems are handled better than others by computers; protein folding is something that humans seem to do well but for which we haven&#x27;t managed to develop great algorithms yet.<p>But if part of the work can be done in the human brain rather than in a CPU/GPU/ASIC, is that bad? The current computation model basically means that mining rewards go to whoever invests the most capital, ie has money to throw at the problem. This is inherently inequitable, because it means people with more money or a willingness to appropriate the equipment of others will mine/dig/discover more coin. Of course, the argument is that since mining is rather random, in theory you can start mining on your small CPU tomorrow and hit some coin, or get a random amount of coin for a fixed amount of mining. But random rewards devalue expertise and experience in favor of an unnaturally even probability distribution. I really think the computational abstraction is a barrier to cyptocurrency adoption, because ultimately your economic incentive is only as good as people&#x27;s adoption of a sunk cost fallacy.",1393021312
7279851,comment,7278645,7279688,1,0,adamzerner,,,"Cool, I look forward to reading them!<p>Just a thought (I know you&#x27;ve got a huge &quot;to-do list&quot; in your head), I&#x27;d like to hear your opinions on effective altruism, and what you think the best ways to change the world are.",1393021307
7279850,comment,7279262,7279714,6,0,CanSpice,,,"I don&#x27;t see why it&#x27;s sad to do something one enjoys doing.",1393021303
7279849,comment,7277797,7277797,1,0,9999,,,"I&#x27;ve actually always wanted to use Erlang and I&#x27;ve worked on quite a few projects where it probably would have been the best solution possible (massively concurrent websocket backends for example). The two things that made Erlang a non-starter on those projects were:<p>1) It&#x27;s hard to find people that have production experience with Erlang\n2) The perception is that batteries are not included (even in comparison with Go... if you have some information to refute that notion I would be more than happy to learn more)",1393021293
7279848,comment,7277587,7278911,2,0,pjungwir,,,"They&#x27;ve moved around a bit, and it&#x27;s fairly new. I attended at Sisters and Floyd&#x27;s so far; I think there were others. There was discussion on the pdxruby list you can probably find archived, and future sessions are on Calagator. (Looks like Caffe Vita was today.) I&#x27;d love to see you there!",1393021279
7279847,comment,7278645,7278663,4,0,mathattack,,,"Every startup has a moment where the founder has to ask, &quot;Do I become a professional administrator, or do I hand the professional management to someone else so that we can scale while I keep spending my time on what I want to.&quot;<p>It&#x27;s good to see that YC has done this prior to a crisis, rather than in reaction to one.  It doesn&#x27;t seem like there&#x27;s a better use of PG&#x27;s time than office hours and writing.  If this allows him to do more of both, everyone benefits.",1393021261
7279846,comment,7277797,7277923,2,0,wagerlabs,,,"This is very old but...<p><a href=""http://wagerlabs.com/blog/2006/01/01/haskell-vs-erlang-reloaded/"" rel=""nofollow"">http://wagerlabs.com/blog/2006/01/01/haskell-vs-erlang-reloa...</a>",1393021253
7279845,comment,7278645,7278663,1,0,randall,,,"Yay! Very excited for you and YC. Congrats!",1393021240
7279844,story,,,1,0,jenniewhite,"How to Boost Performance with In-Memory, Multi-Dimensional Analytics",http://nani.gs/1dYO0ai,,1393021232
7279843,comment,7279573,7279793,4,0,mbell,,,"> Doesn&#x27;t the CPU need equal length parallel lines to the memory?<p>Yes, but you could do that within the tower. Maintaining signal integrity through the connectors and/or propagation delay due to trace length would be the limiters.<p>> Or is there a serial interface to memory nowadays?<p>Not for PC level memory speeds.<p>> Wow.. so in the video they plugin a CPU module.<p>All the pictures show &quot;CPU / RAM&quot; in the same module, which makes a lot more sense to me as an EE.",1393021228
7279842,comment,7279412,7279412,1,0,OhHeyItsE,,,"do we need any more evidence that the web will win?",1393021204
7279841,comment,7276976,7278203,1,0,anon4,,,"Cyrillic-using languages generally do.",1393021199
7279840,comment,7276263,7277851,1,0,RA_Fisher,,,Thanks!,1393021191
7279839,comment,7279062,7279062,4,0,stretchwithme,,,"We can avoid it only if we wake up to the real problem.<p>We don&#x27;t get to pick who represents our interests.  We can only vote for preselected choices.  This concentrates power in the hands of a few.<p>And these are more immune to voter desires and more subject to other forms of manipulation.<p>Either you exercise your power.  Or its up for grabs.<p>We need proportional representation, at least in the House of Representatives.",1393021189
7279838,comment,7279062,7279446,2,0,milsorgen,,,">Fretting over whether or how it&#x27;s coming is simply illogical, focusing efforts on making sure it&#x27;s used properly is the only forward thinking, reality accepting solution.<p>I couldn&#x27;t disagree more strongly. If we have an issue I think it would be prudent to examine the entire issue especially the degree and kind of it&#x27;s coming.<p>Your willing to make vast assumptions on something that affects the very fabric of our society and I find that quite disturbing.",1393021186
7279837,comment,7279087,7279819,9,0,pavel_lishin,,,"It reminds me of attending freshman orientation. It was suggested to us that we use our university e-mail address for all professional communication.<p>They didn&#x27;t really have a good answer for whether that e-mail would stick around after I graduated. Or whether access to that account would be available forever, or whether it would be free.<p>I didn&#x27;t even bother asking why anyone would want an ugly e-mail address like pxl014000@utdallas.edu to be their official formal means of communication.",1393021166
7279836,comment,7279262,7279262,10,0,dethstar,,,"The thing the girl said reminded me of my little nieces and nephews. They are in either Highschool or jr high, whenever I&#x27;ve asked them what they want to study, or do in life they just say &quot;something easy&quot;. \nBy easy it doesn&#x27;t mean not challenging or that requires no effort, it means that they are certain they&#x27;re going to pass, that&#x27;s all they care about. And since they haven&#x27;t experimented/looked in other fields, for fear of failing, they are also not sure what they want to do at all. When I talk to their mother, she just wants them to be teachers like her, because she could probably get them a job.<p>So yeah, it is pretty harmful. Let them fail.",1393021146
7279835,comment,7279595,7279806,1,0,jason_slack,,,"Yeah that is an option, but I enjoyed doing all of this myself.",1393021120
7279834,comment,7279262,7279262,4,0,joelgrus,,,"I grew up as one of these &quot;terrified to fail&quot; kids. Now I have a kid of my own, and one of my primary parenting goals is that she not end up like that.",1393021093
7279832,comment,7275911,7278420,3,0,netc,,,"Not sure if you tried following for input/output multiplexing -\n* Create 5 panes, one for each server\n* Ctrl-b  :setw synchronize-panes<p>This should synchronize the input to all panes i.e. type in any \none and it will be sent to all 5. to turn it off, just run the same\ncommand again.\nI don&#x27;t know if tmux has equivalent synchronize-windows.",1393021079
