ID,Type,Story,Parent,Points,Comments,Author,Title,URL,Content,Created
7279966,comment,7277888,7278423,4,0,dade_,,,"This is one thing I miss about Saskatchewan, the big red mark in the middle of Canada.  They are always on DST, which means you can watch the sunrise every clear winter morning and don&#x27;t go home in pitch black world.  It works just fine and no one misses the time change.  It would save a lot of confusion and work much better IMHO.",1393022706
7279965,story,,,222,142,ski,"America Online to Buy Internet Chat Service for $287 Million (1998)",http://www.nytimes.com/1998/06/09/business/america-online-to-buy-internet-chat-service-for-287-million.html,,1393022693
7279963,comment,7278304,7278304,1,0,elwell,,,"Ok fine. Just don&#x27;t buy PhoneGap.",1393022682
7279962,comment,7276560,7276871,1,0,ulfw,,,"How does your average Silicon Valley 60+ hour worker get extra compensation for those additional hours that are expected of him (beyond the contractually agreed 40 hours)?",1393022675
7279961,comment,7277888,7279791,1,0,MichaelGG,,,"How do relative times help in your scenarios? How on earth would timezones fit into EC2 billing?",1393022662
7279960,comment,7277326,7279645,2,0,corydominguez,,,"I don&#x27;t know exactly how it works, but the page shows animations over the ticket information, these could be customizable or rotated during the event by the event organizer making them very difficult to fake.",1393022632
7279959,comment,7279087,7279087,1,0,aaron695,,,"Why can&#x27;t people just realise humour is not unique to one&#x27;s own time period and culture.<p>Jumped the shark here -<p>&quot;He also speculates that the reason this work is written in a language never seen before was that it was made by a small group of people who belonged to a culture that didn’t have a written form.&quot;",1393022604
7279958,comment,7279407,7279407,16,0,Smudge,,,"> Any program can only be really useful if it complies with the Unix philosophy.<p>False! Software can be really useful without being modular and readily composable.<p>But I enjoy the premise of what Uzbl is aiming to solve. It would certainly make for a richer array of web-related software components, with plenty of uses beyond just web browsers.",1393022600
7279957,comment,7276976,7278492,1,0,snogglethorpe,,,"At the least, Korean has voiced-versus-non-voiced-depending-on-word-position changes, and IIRC there are other similar rules (about changing pronunciation in certain contexts) as well.",1393022591
7279956,comment,7279062,7279626,5,0,Zigurd,,,"> <i>a cypherpunk-style completely open Internet is fundamentally incompatible with both network defense needs</i><p>There isn&#x27;t a middle ground. Either the people have access to strong encryption, DHTs, cryptocurrency, etc., or we live in a panopticon, a soft cage, a managed illusion of freedom. The toothpaste is not going back in the tube.<p>The real question is whether we need more than 10% of the military industrial complex we currently have, or whether this is a deadweight, dragging down our economy and destroying freedom.",1393022563
7279955,comment,7279595,7279922,1,0,jason_slack,,,"Folks from Apple IP&#x27;s visit the site everyday (and have for years!) I even get some e-mails saying Thank You for making this available.<p>Right now I host this on a simple desktop computer running CentOS (an AMD Athlon X2 with 32gb of RAM, Mirrored 1TB hd)<p>I tried hosting it on a VPS and well, performance was so bad.",1393022548
7279954,comment,7279573,7279573,6,0,TrainedMonkey,,,"This could be future of personal computing, however I am afraid that prohibitive cost would kill this. I would expect markup of $100-$150 per module, unless it is a very simple module that needs no cooling.<p>I am also not sure about cooling system. Little isolated compartment with nearly no holes for cooling beefy GPU or CPU with overclocking sounds a bit farfetched. They mention that each individual module would have it&#x27;s own water cooling system. I think it is madness, much more practical and economical to transfer heat to the central tower and have large radiator with quiet fans there.<p>I built few custom rigs with water cooling, and whole point of water cooling is to transfer heat to the large radiator.",1393022546
7279953,comment,7278645,7278645,1,0,ulfw,,,"Sam is a very intelligent, likeable and knowledgeable guy. Best man for the job. Congrats!",1393022542
7279952,comment,7279763,7279763,2,0,physcab,,,"In my experience, dashboard metrics shown on TV screens for everyone to see are as useful as wall painted murals -- cool to look at but not much help driving the business forward. Everyone  wants to look at different things. Marketing might want to look at ROI and LTV, PM&#x27;s want to see retention rates, and execs want to see top line goals as a percentage of monthly targets. Its better to have a tool that can be customized for each owner / stakeholder.",1393022541
7279951,comment,7279573,7279900,4,0,mburns,,,"Computers are extremely modular already. Plus, you don&#x27;t need to buy a proprietary interconnect and case that only one vendor provides.",1393022536
7279950,comment,7278645,7278663,1,0,RoboTeddy,,,Congratulations!,1393022518
7279949,comment,7279262,7279262,3,0,kator,,,"I have six kids, my goal in life is to teach them to make good decisions.  I always tell him to embrace originality in mistakes.  Make them big, creative, interesting mistakes.  Learn.  Move on.",1393022487
7279948,comment,7279886,7279886,1,0,helloanant007,,,"Confer helps you build a personalized schedule for conference you are attending. It helps you decide where to spend your time by providing social recommendations based on your interests.",1393022476
7279947,comment,7277797,7278370,1,0,arh68,,,"You are right: it is a valid metric.<p>It&#x27;s the quality of the language that counts, but it&#x27;s the popularity that matters.",1393022448
7279946,comment,7277888,7278326,1,0,sweedy,,,"they are still up late, because many people also have long working hours, as they are forced through the siesta lunch break",1393022444
7279945,story,,,5,0,wr1472,"Richard Branson insists he will be aboard first Virgin Galactic space flight",http://www.theguardian.com/science/2014/feb/21/richard-branson-first-virgin-galactic-space-flight,,1393022428
7279944,comment,7277797,7277797,3,0,501,,,"I&#x27;ve posted these before[1]:<p>* No public bug tracker<p>* epmd&#x27;s security (or lack thereof)<p>* Can&#x27;t insist that epmd be started separately (`erl -no_epmd` won&#x27;t start epmd but it also won&#x27;t start epmd&#x27;s gen_server)<p>* Can&#x27;t swap out epmd because while `erl -epmd_module foo` is there, `net_kernel:epmd_module()` is barely used. (Although I don&#x27;t think its interface is documented anyway)<p>* No built-in way to hook UNIX signals<p>* While the documentation itself is pretty good, it&#x27;s presentation is lacking and it&#x27;s difficult to quickly correct mistakes as you run into them<p>* It can be difficult to reason about when a shared binary will be garbage collected<p>* OS packaging (I&#x27;m thinking of Debian/Ubuntu) of Erlang and Erlang apps tends to be more harmful than helpful (old packages, namespace conflicts, etc)<p>To them I&#x27;d add:<p>* No agreed upon build tool (rebar while prevalent isn&#x27;t universally accepted)<p>* Community libraries often have no support for upgrades or aren&#x27;t packaged properly for releases<p>* Can&#x27;t upgrade SSL if you&#x27;re using it as a carrier<p>* No standard code format tool like gofmt (yes I know about erl_tidy, no it doesn&#x27;t provide the same functionality as gofmt or it&#x27;d see similar use)<p>* Not enough infrastructure around built around edoc; where&#x27;s the godoc or godoc.org work-a-likes? (yes I know about erldocs.com, it&#x27;s no godoc.org)<p>[1]    <a href=""https://news.ycombinator.com/item?id=5801706"" rel=""nofollow"">https://news.ycombinator.com/item?id=5801706</a>",1393022418
7279943,comment,7271719,7276535,1,0,nathanhammond,,,"Over-simplification: As a &quot;not-bank&quot; they can&#x27;t engage in fractional reserve banking. This leveraging of money is what allows banks to truly generate profits. Acquire deposit assets at 1%, lend that same money out at 3-5%, profit on the spread. If a bank is offering a low rate that means that either their lending arm is not able to effectively use deposited capital or their overhead as percentage of that spread is too large. Higher rates signal that the bank is attempting to gain capital in order to supply their lending side.<p>Simple&#x27;s funding likely only increased their runway while they were building a product that I&#x27;m guessing was net-negative. I don&#x27;t feel like they could generate enough revenue to cover their burn rate using their holding bank strategy. If they could I suspect they would have continued down this path as a fearsome (future) competitor.<p>Once some bank builds the underlying technology in-house correctly they&#x27;re going to be nigh untouchable.",1393022417
7279942,comment,7276902,7278571,1,0,unclebucknasty,,,"I challenge whomever downvoted me to refute at least the tl;dr in my comment.",1393022411
7279941,comment,7279573,7279857,1,0,Avitas,,,">> Oculus: &quot;[...] whether or not the target market can afford the machine.&quot;<p>> vonmoltke: &quot;[...] though that depends on how Razer implements the generic backplane in the tower.&quot; [...] &quot;Upgrading the processor requires upgrading the motherboard, which may trigger a cascade upgrade of other parts.&quot;<p>-----<p>The above are the two big items in my mind. Another potentially minor (or major) issue is how the seals for liquid cooling are made, their durability and reliability. I am assuming that the pump is located in the backplane and a quick connect/disconnect type connection is used for liquid connections.<p>It sure looks cool. It looks like Razer&#x27;s designers and/or engineers really liked the look of Thermaltake&#x27;s Level 10 and wanted to take it in a different direction. It could also be that these are OEM&#x27;ed from the same manufacturer.",1393022387
7279939,comment,7277540,7279437,2,0,Pacabel,,,"But &quot;open&quot; does imply having more than just one realistic choice, or at least the ability to realistically create more choice if it isn&#x27;t already present.<p>Right now, JavaScript is basically the only option in practice, and getting additional languages supported by the major browsers does not seem possible. I don&#x27;t consider that &quot;open&quot; at all.",1393022383
7279938,story,,,8,0,steveklabnik,"More Details About Our Bitcoin Integration",http://blog.balancedpayments.com/more-details-about-bitcoin/,,1393022377
7279937,story,,,1,0,spking,"Flu hitting young and middle-age adults unusually hard",http://www.myfoxdc.com/story/24786340/flu-hitting-young-and-middle-age-adults-unusually-hard,,1393022356
7279936,comment,7279087,7279640,3,0,taliesinb,,,"The video is great, I stayed up early into the morning watching it!<p>Indeed, I wish that more academics made the effort to create such accessible summaries of their work.",1393022355
7279935,comment,7279407,7279814,1,0,mercurial,,,"Run a nightly? But yeah, it seems to always take a little while for the Pentadactyl folks to release a stable version.",1393022352
7279934,comment,7277326,7279645,1,0,elwell,,,"Yeah. Just dreaming, but it would be cool if the event organizer could use their phone&#x27;s camera aimed at the guest to face recognize them and match them to the db of guest snapped pics. Would be too difficult to get required accuracy right now, but maybe in future.",1393022351
7279933,story,,,1,0,mvclark,"Integrate MathJax into SVG diagrams",http://puzlet.com/m/b00b3,,1393022330
7279932,story,,,1,0,manikrathee,"Nuclear Gene Sequencing In The Sunflower Family",http://www.science20.com/news_articles/nuclear_gene_sequencing_sunflower_family_now_github-130182,,1393022314
7279931,comment,7277947,7279810,2,0,jack-r-abbit,,,"There has been several teacher-student sexual assault cases in the area in the last few years... I think all but one was &quot;female teacher and male student(s)&quot;. I believe that a far greater number of people view that as &quot;more acceptable&quot; than &quot;male teacher and female student&quot;. It is a very sad double standard.<p>And we pay our teachers like crap. Which confuses me even more about the teachers that clearly don&#x27;t care for teaching by the way they half-ass the job. Clearly they are not in it for the money.",1393022296
7279930,comment,7279573,7279897,1,0,vonmoltke,,,"Maxim claims to have the technology for gigabit signal path equalizers: <a href=""http://pdfserv.maximintegrated.com/en/an/AN996.pdf"" rel=""nofollow"">http://pdfserv.maximintegrated.com/en/an/AN996.pdf</a>",1393022273
7279929,comment,7279262,7279723,16,0,nostrademons,,,"FWIW, I got several Fs in middle school, went to an alternative high school with no grades, got into Amherst - where I failed two courses in my major, and eventually ended up at Google (there were 3 startups in the meantime).<p>I think that if you want to do this successfully, you need to get <i>really</i> good at hacking expectations and doing end-routes around roadblocks.  For me, I had the advantage of perfect scores on a bunch of my standardized tests, so I had this other credential that would make people sit up and take notice.  My parents also advocated heavily for me, and I was not shy about befriending adults who I thought were more competent than my teachers and getting work/academic experience with them.  I&#x27;d taken college courses at 3 different schools before applying to college (acing all of them, and in one case doubling the class average), and I&#x27;d worked for a tech startup and done good work for them, so I had plenty of people willing to write recommendations for me.<p>The most important thing to realize if you&#x27;re faced with a roadblock (and probably in life in general) is that different people are impressed by different things.  You will never please everyone, but if there are <i>some</i> people who are impressed with you and willing to advocate for you, you can usually do an end-run around the people who think you will never amount to much.  It&#x27;s somewhat unfortunate that the public school system is packed with the sort of people who look at surface impressions only - think about what sort of people might be attracted to work at an institution where their own freedom to decide what to teach is itself set by bureaucrats sitting in the State House who have never gone near a classroom.  It&#x27;s doubly unfortunate that these are people in authority who have significant power over how our kids turn out.  But the real world itself is much broader and more malleable than the classroom, and you can hack your way around a bad classroom experience.",1393022221
7279928,comment,7278304,7278304,1,0,mvelie,,,"It could also be that apple wanted the other part of Burstly which did advertising, to help support their iAd platform.",1393022196
7279926,comment,7279412,7279710,1,0,nanidin,,,"He&#x27;s using (or at least loading) the DPS.js library: <a href=""https://github.com/corbanbrook/dsp.js/"" rel=""nofollow"">https://github.com/corbanbrook/dsp.js/</a>",1393022189
7279925,comment,7277915,7277915,4,0,randall,,,"Tim. You&#x27;re a pessimistic bastard but I love you. And I love Omniref. (When I remember to use it.) Maybe consider a sublime text plugin and complete sublime&#x27;s inevitable march toward IDE-dom?",1393022185
7279924,comment,7277888,7279167,3,0,billforsternz,,,"I think the point is that although it&#x27;s only 1000km, the difference when expressed as a proportion of one day is the same. So noon in LA corresponds to late afternoon in NY, noon on Greenland&#x27;s west coast corresponds to late afternoon on Greenland&#x27;s east coast.",1393022180
7279923,comment,7279573,7279573,1,0,ChikkaChiChi,,,"Assuming that the &#x27;tower&#x27; is the motherboard, it better cost the same as a module, or else this is a non-starter.",1393022171
7279922,comment,7279595,7279835,1,0,fuzzywalrus,,,"On that same note:\nVimeo does allow download links to the source files (assuming its a distribution format like MPEG4 and not intermediate codecs designed to be used by Final Cut, Avid etc). In the interest of preservation, it&#x27;d allow users to download the sources as well, would be more easily viewed (and embeddable).<p>I do see value in hosting outside of Vimeo/Youtube as the likelihood of having content DMCA&#x27;ed is a looming threat.",1393022167
7279921,comment,7279087,7279488,3,0,zzleeper,,,"What is the relation with Luton?\nCan&#x27;t see any mention here: <a href=""http://stephenbax.net/"" rel=""nofollow"">http://stephenbax.net/</a>",1393022167
7279920,comment,7278214,7279047,11,0,chongli,,,"<i>First, every vim plugin would break. But if you look at how many Vim plugins are actually used, I would be surprised if the top 100 Vim plugins covered less than 99.99% of all Vim users. That means we only have to upgrade 100 Vim plugins, and probably just a couple of lines if they&#x27;re written well.</i><p>Please don&#x27;t invent fake statistics in order to support your argument. Vim&#x27;s plugin ecosystem has a long tail distribution[0]. After just a cursory glance at vim.org&#x27;s script repository you&#x27;ll notice that even the 141st ranked plugin[1] has over 10,000 downloads. To find the first plugin with less than 1,000 downloads, you&#x27;ll have to drop all the way down to sql.vim[2] which happens to be ranked 1501!<p>Personally, I happen to use (daily) multiple plugins which are ranked outside the top 1000.<p>[0] <a href=""http://en.wikipedia.org/wiki/Long_tail"" rel=""nofollow"">http://en.wikipedia.org/wiki/Long_tail</a><p>[1] <a href=""http://www.vim.org/scripts/script.php?script_id=483"" rel=""nofollow"">http://www.vim.org/scripts/script.php?script_id=483</a><p>[2] <a href=""http://www.vim.org/scripts/script.php?script_id=905"" rel=""nofollow"">http://www.vim.org/scripts/script.php?script_id=905</a>",1393022158
7279919,comment,7277947,7278022,1,0,mathattack,,,"So it&#x27;s probably a good sign in general, but not a sign that the major is changing yet.<p>At my university I would guess that it was about a quarter women.  They were evenly distributed amongst the caliber of grads.  Of the top 8 or so in my class (smaller program) 2 were women.",1393022131
7279918,comment,7279262,7279537,1,0,spacehome,,,"That&#x27;s really insightful.",1393022121
7279917,comment,7279062,7279062,3,0,drdeadringer,,,"Avoid?<p>We&#x27;re here.",1393022119
7279916,comment,7279262,7279564,3,0,ronaldx,,,"It may be as much a product of the school system.<p>In my local area, schools are formally ranked by their average grades. This means they spend 13 years encouraging kids to believe that taking easier subjects <i>(with better pass rates for the school)</i> is in their own best interest.",1393022106
7279915,comment,7279647,7279647,1,0,mindcrime,,,"Good conversation so far.  Hoping this catches on.  #startups is nice, but it&#x27;s more of a social / chit-chat channel these days with not much actual focus on tactics, strategy, or serious startup issues.  A channel like this could be very handy.",1393022106
7279914,story,,,1,0,bcn,"About the security content of iOS 7.0.6",https://support.apple.com/kb/HT6147,,1393022094
7279912,comment,7279412,7279813,1,0,nanidin,,,"Underneath, it uses DSP.js also, so I&#x27;d imagine it&#x27;s pretty similar. I am able to get autocorrelation & FFT frequency results out & graph them at about 50hz without any optimization on my rather old laptop in Chrome.",1393022065
7279911,comment,7276032,7277321,1,0,abitsios,,,"> Why did you create a profile?<p>1) The intent was to separate my personal and professional social presence: Facebook is no place for doing or talking business.<p>2) I was looking for work at the time.<p>3) I tend to try things out<p>> If you don&#x27;t want to connect with your professional network,\nI never said that.<p>> if you don&#x27;t care who looked at your profile\nWhether I care or not, I don&#x27;t think the network should be reporting views to profile owners. I don&#x27;t think I am alone in this either: Can you think of any other social network that does this? Would you go back to Facebook if it reported your every view to your contacts? Of course I&#x27;m spooked by this.<p>> What do you think is the purpose of having a LinkedIn account?<p>Not sure. I can eliminate a few things:<p>- Not finding employees. I&#x27;m supposed to pay for premium to be able to search properly and message people, and then (given my personal experience as a user) my message will be lost in the noise of irrelevant offers (who the hell thinks a PHP developer would be remotely interested/suitable for UI/UX, C++, Technical Writer, ... ? Mass mailers do). SO careers and behance has served me very well instead.<p>- Not finding work. Can I even separate my contacts into people-that-can-see-that-im-looking and people-that-shouldnt nowadays? If so, I&#x27;ll call it progress. (My boss shouldn&#x27;t know if I&#x27;m looking ffs)<p>- Not organizing contacts. One flat list of people?<p>- Not content. The majority of content I got to see was PR/HR kind of fluff that was almost exclusively cross-posted from elsewhere. None of my professional contacts actually generate content - that seems to happen on Twitter and G+.<p>I guess I use it as another online CV.",1393022049
7279908,comment,7277895,7277895,2,0,mathattack,,,"When I saw the title of this, I thought, &quot;This is very P&G&quot;.  Then I saw that the founder came from P&G.  That&#x27;s the right background to make this work.  It&#x27;s more about solving business challenges (&quot;How might the scanner data tell me about an out of stock that my ERP system is missing&quot;) rather than technical problems.",1393021979
7279907,story,,,2,0,MrboolUS,"Basic Concepts of Java Programming",http://mrbool.com/basic-concepts-of-java-programming/30152,,1393021949
7279906,comment,7274363,7275079,1,0,staunch,,,"This fraud is &quot;enormous&quot; only compared with a bartender stealing cash out of a till. It is infinitesimally small in terms of what occurs on a very regular basis.",1393021947
7279905,comment,7277326,7279645,1,0,jordan_clark,,,"You bring up a valid point. Presenting a picture as the only means for authentication removes the benefit of digitized confirmation. Pics on the app store link appear to show a clock of some sort over the picture, but even that could be easily recreated.",1393021913
7279904,comment,7278914,7279736,1,0,ttruett,,,"Just checked out InsightSquared, we&#x27;re definitely similar.<p>While relatively subtle, the main difference seems to be that we&#x27;re more of a motivational tool whereas they are more of an analytical tool.<p>We&#x27;re trying to position Ambition to where it&#x27;s primary purpose is to drive numbers, not just look at them. Yes transparency through reporting is part of that, it&#x27;s just more passive and it&#x27;s easy for people to become paralyzed by data.",1393021891
7279902,comment,7279595,7279595,1,0,jason_slack,,,"For some reason I cannot edit this anymore. It is HTML5.",1393021877
7279901,comment,7279262,7279262,6,0,knappador,,,"Make it twice as hard and require half as many points.  Getting 100% at anything  signals the end of learning, not the beginning of mastery.",1393021867
7279900,comment,7279573,7279873,1,0,lttlrck,,,"Lack of modularization?",1393021855
7279899,comment,7277128,7279439,1,0,rayiner,,,"Norms that aren&#x27;t enforceable aren&#x27;t &quot;rights&quot; they are aspirations or opinions. The UDHR has lots of aspirations, stating that people <i>should</i> be provided the basic necessities of life, but without real buy-in, those are just someone&#x27;s opinions.<p>Moreover, talking about &quot;rights&quot; which are mere aspirations makes the argument of &quot;we shouldn&#x27;t do X because it violates peoples&#x27; rights&quot; utterly impotent. &quot;We shouldn&#x27;t spy on other people because I believe that people are entitled to privacy.&quot; Okay, and your beliefs are special because? If you can&#x27;t cite some concrete basis, either in law or broad and deep social consensus, you&#x27;re just expressing your opinion, but trying to make it seem more authoritative than an opinion.",1393021828
7279898,comment,7278914,7279106,3,0,mathattack,,,"Sales is much more publicly metric driven than development.<p>Many top sales organizations have public quotas, with quarterly contests, and public records showing how everyone is doing against it.<p>The nature of sales (public wins and failures, lots of banging your head into the wall on a daily basis to support an unknown long term outcome) is why there are a lot of athletes that get into it.<p>The app seems to be very much in line with this type of thinking.<p>But yes - it would never work for developers.",1393021818
7279897,comment,7279573,7279871,2,0,mbell,,,"That would be problematic at best given the clock speed and timing requirements of DDR3.",1393021774
7279896,comment,7279407,7279699,1,0,nextos,,,"Me too, I&#x27;ve been switching back and forth between both. I&#x27;d be interested in knowing if Pentadactyl is still running fine on Firefox 27.",1393021763
