ID,Type,Story,Parent,Points,Comments,Author,Title,URL,Content,Created
7069008,comment,7063167,7064555,1,0,sheraz,,,"I think IBM has a problem in that, as a company, they do not know how to sell to smaller fish. Chances are that you already have a relationship with IBM or a vendor, and that is how you get information on new products or upgrades.<p>My guess is that $5k / year for a product does not &quot;move the needle&quot; to reach sales quotas. Therefore, there is no incentive to talk to small shops.",1389875797
7069007,comment,7068455,7068688,3,0,jackgavigan,,,"Besides, stock price isn&#x27;t a good measure of de Castro&#x27;s performance. Advertising revenue is better. Over the past year, Yahoo!&#x27;s advertising revenue has declined while its competitors&#x27; have grown. Facebook took the #2 spot in US digital advertising revenues (Google is #1) from Yahoo! last year.<p>If Yahoo!&#x27;s advertising revenue had grown increased at the same rate as, say Google&#x27;s (up 15% over the past year), revenue would have been ~$600m higher.<p>It&#x27;s interesting that de Castro started out at McKinsey. The book &#x27;Dangerous Company&#x27; portrays McKinsey consultants as Powerpoint jockeys who are great at formulating high-level strategy but not so good at actually running businesses.<p>Perhaps de Castro benefited from a rising tide at Google but lacked the turnaround skills required at Yahoo!",1389875797
7069006,comment,7066238,7066942,3,0,casca,,,"While the Hawthorne Effect is widely cited, even after many years the results have not been reliably reproduced so it should be invoked cautiously.",1389875693
7069005,comment,7067171,7068886,1,0,rjzzleep,,,"i&#x27;d be surprised if there wasn&#x27;t a decent amount of bugs still in the standard library",1389875653
7069004,story,,,82,94,thomasfromcdnjs,"Obama Is Announcing His NSA Reforms Tomorrow - Use This Scorecard To Judge Them",https://thedaywefightback.org/obama-scorecard/,,1389875615
7069003,comment,7068579,7068697,1,0,Jacqued,,,"Because you&#x27;d buy a lot less things. There are 2 reasons to that :\n- they are more costly, so you can&#x27;t afford as many\n- their quality means they last anywhere from 2 to 50 times as long as their crappy equivalents ; so again you have to buy them less often.<p>Take shoes : a man could buy only 8-10 pairs of really good shoes throughout his entire adult life and be set. Of course, those would be $500 high-quality shoes (not random &#x27;designer&#x27; shoes).\nOr he could buy 60-80 pairs of cheap crappy shoes that quickly wear out and become painful to wear, and are not worth maintaining since they&#x27;re so dirt cheap.<p>Then the high quality shoes are probably made by a craftsman in the U.S. instead of an exploited worker in a third world country, so that&#x27;s a more fulfilling job. And you don&#x27;t have to transport the shoes across the globe on gigantic boats, so that&#x27;s another eco-benefit.",1389875578
7069002,comment,7068981,7068981,2,0,redknight666,,,"Hinton to Google, Yann Lecun to Facebook, the game is on :)",1389875514
7069001,comment,7067803,7067803,5,0,protomyth,,,"submitted the same article 1 day ago <a href""https://news.ycombinator.com/item?id=705844"" rel""nofollo"">https://news.ycombinator.com/item?id=7058448</a><p>[I wonder about the filters - this submission has some discussion to it]",1389875500
7069000,story,,,1,0,nailer,"What's the difference between Angular and Ractive?",http://blog.ractivejs.org/posts/whats-the-difference-between-angular-and-ractive,,1389875491
7068999,comment,7068680,7068978,1,0,pc86,,,"I have LTE in my area so I may be an exception, but I was listening to Spotify in my car for over an hour yesterday without any WiFi connectivity.<p>The app itself is sometimes a pain (particularly via the controls on my car steering wheel...), like the inability to change whether I&#x27;ve liked or disliked a song.",1389875487
7068998,comment,7068656,7068656,1,0,stkni,,,"Ah! I still remember the day I discovered that some of the project I had inherited was Tcl that was generated at runtime by Tcl.<p>There&#x27;s somethings you can do when everything&#x27;s a string that you can&#x27;t easily do in many other languages, unless that language is Lisp-based of course.",1389875425
7068997,comment,7068455,7068716,6,0,mtrimpe,,,"Marissa was appointed to  achieve the near impossible task of turning around a massive behemoth which seemed dead-set on a course towards oblivion.<p>The only key asset that still gave Yahoo significant leverage was its war chest and rather than let it dwindle she decided to invest it in a number of bold steps to achieve a dramatic shift in corporate culture.<p>While some of these steps are indeed turning out to have been mistakes I find I hard to argue, keeping Occam&#x27;s razor in mind, that her actions did not keep the best interest of the shareholders in mind, especially given Yahoo&#x27;s performance on the market.",1389875409
7068996,comment,7068028,7068987,1,0,redknight666,,,"HALs will always introduce security issues. I believe Microsoft Research has been working on that particular problem with Singularity, it would pay to take a look at what they did there.",1389875376
7068995,comment,7068455,7068827,1,0,grey-area,,,"I&#x27;m not saying it applies to every salesman, but say a company with an existing product makes a new sale - the money from that is mostly down to the salesperson who closes the deal. I&#x27;m sure it depends on the situation. Anyway, the point was more that it is <i>possible</i> for one person to be worth say 10 million USD to a company at a particular time, even if it is quite uncommon.<p>This is just an expression in the difference in scale between a single person&#x27;s resources and those of a corporation - if any individual has access to the leverage and resources of a large corporation, they could easily make/lose a lot of money for that company very quickly, sometimes down to dumb luck, sometimes down to skill at their particular niche.<p>Of course the society which allows the limited liability company to exist might want to redistribute some of that wealth more evenly, because capitalism is pretty unfair and brutal in its raw form, but an individual can certainly be <i>worth</i> lots to a company in monetary terms, because they can make a lot.",1389875329
7068993,comment,7068680,7068940,5,0,josu,,,"And offline playlists. Apart from the US there aren&#x27;t many countries that offer unlimited mobile data plans for a reasonable price. So for me, offline playing is a very big deal, since that&#x27;s how I listen to most of my music when I&#x27;m away from home.",1389875257
7068992,comment,7068028,7068934,6,0,tfgg,,,"That doesn&#x27;t mean it doesn&#x27;t set up a good incentive, similar to the use of disused land going back to the Peasants Revolt and Diggers and concepts like adverse possession. While Parliament might not have explicitly legalised it, it also hasn&#x27;t closed the loophole, perhaps in recognition of its social use and history.<p>I&#x27;m not sure what you mean about &quot;hot air about homelessness&quot;? Do you think squatters have nice warm homes that they could actually go back to if they weren&#x27;t being such frightful brutes?",1389875240
7068991,comment,7066479,7066479,2,0,lips,,,"I&#x27;m experiencing login errors (PEBKAC caveat: password manager, 2x checked, reset), but the support confirmation page is a nice surprise.<p><a href""http://i.imgur.com/w01CoUy.jp"" rel""nofollo"">http://i.imgur.com/w01CoUy.jpg</a>",1389875224
7068990,comment,7068680,7068796,1,0,mzl,,,"From the article: &quot;We have removed these caps completely across all platforms&quot;",1389875224
7068989,story,,,1,0,amitagarwal,"Show HN: Instant Movie Search for YouTube",http://zerodollarmovies.com/search,,1389875218
7068988,comment,7067206,7068573,1,0,72deluxe,,,"I don&#x27;t think that there will be a sudden mass conversion. Look at the mess of Vista and the unpopularity of Windows 8. There wasn&#x27;t a mass migration to Linux.<p>Home users will just buy an iPad because they realised that they didn&#x27;t actually use Excel at home and so didn&#x27;t need a PC. Businesses will just upgrade to Windows 7/8/9 and IT departments will moan/groan.",1389875213
7068987,comment,7068028,7068977,1,0,bobsgame,,,"Yes, I think the VM overhead wouldn&#x27;t be as big a deal as the programs themselves though. People would have to realize that applications are &quot;heavyweight.&quot; Not sure if HAL would introduce security issues, the VM is to keep things as secure as possible.",1389875203
7068986,comment,7068680,7068833,1,0,timje1,,,"I&#x27;m a bit annoyed at the fact that the free user&#x27;s plays dictate where my subscription cash goes.<p>But I don&#x27;t see how the free users actually detract from my experience of the service...",1389875185
7068985,comment,7063910,7063910,1,0,stephanvd,,,"Nice, thanks!<p>I needed this for my Synology NAS, so I added bindings for it: <a href""https://github.com/beardedspice/beardedspice/pull/"" rel""nofollo"">https://github.com/beardedspice/beardedspice/pull/4</a>",1389875148
7068984,comment,7062489,7062727,1,0,noselasd,,,"They could still track you though. You&#x27;ll need a sim card, and you&#x27;ll need to attach to the network - which means the carrier can track your location.",1389875123
7068982,comment,7036661,7041195,1,0,jaseemabid,,,"Well said! Its probably the tinkering that eventually teach people that something that is in coreutils is worth looking into.",1389875107
7068981,story,,,11,2,kercker,"Meet the Man Google Hired to Make AI a Reality",http://www.wired.com/wiredenterprise/2014/01/geoffrey-hinton-deep-learning/,,1389875098
7068980,comment,7068964,7068964,1,0,redknight666,,,"I noticed my submit also disappeared.",1389875098
7068979,story,,,27,4,doctorshady,"F.C.C. Chairman Adds More Ambiguity to His Position on Network Neutrality",http://bits.blogs.nytimes.com/2014/01/15/f-c-c-chairman-adds-more-ambiguity-to-his-position-on-network-neutrality/,,1389875090
7068978,comment,7068680,7068950,1,0,Dewie,,,"> The ability to store music offline is also becoming a less important feature as mobile networks improve.<p>I only need it when I don&#x27;t have wifi, but I think I&#x27;m going to start using mp3 players again because managing the whole download/undownload thing in Android Spotify is tedious and the overall useability of the app is crap.",1389875078
7068977,comment,7068028,7068938,1,0,redknight666,,,"The problem I see there is the resources necessary when you have multiple tabs open. If you are forking the web browser, it would make sense to provide a HAL as part of the sandbox and run in a different process.",1389875064
7068976,comment,7067206,7067581,1,0,72deluxe,,,"Windows 8 is alright on a Surface but on a computer with a big screen, it is sadly very mixed up and a frustrating experience. Like iOS 7, you have no idea if anything is a button or is text until you wave your cursor/hand over it, and then some things are hidden until you do that, so for new users it is HORRENDOUS (even if they&#x27;re competent Windows users), and for experienced users it is still pretty HORRENDOUS.\nBut on a Surface, it is quite good!",1389875060
7068975,comment,7068680,7068967,2,0,odonnellryan,,,"I feel good: I don&#x27;t think they&#x27;d be able to make certain actions without some bargaining power.",1389875059
7068973,comment,7067556,7068680,3,0,RossM,,,"This is starting to feel a bit like a race to the bottom. There&#x27;s not a lot left to charge for - offline storage, higher quality and ad-free playback. Offline storage is becoming redundant with an increasing WiFi presence, and audio quality isn&#x27;t a huge draw (I hear enough people playing music through their phone speakers).<p>Rdio already offers ad-free playback on the web (6 months) - it&#x27;s going to put these services in a tricky situation if one of them starts offering ad-free everywhere.",1389875038
7068972,comment,7068680,7067280,2,0,rayiner,,,"Unions have special carve outs in the antitrust laws. Besides that, colluding to limit labor supply isn&#x27;t necessarily legal either. E.g. The DOJ has threatened the ABA with antitrust enforcement if they use the law school accreditation process to artificially limit the supply of lawyers. This is labor side collusion, but is still considered illegal because it doesn&#x27;t fall within union carve outs.",1389875027
7068971,comment,7066204,7068964,3,0,nmc,,,"Check <a href""https://twitter.com/hnstatu"" rel""nofollo"">https://twitter.com/hnstatus</a>",1389875013
7068970,comment,7066125,7068796,2,0,mrcarrot,,,"Doesn&#x27;t using Spotify on Sonos require a premium account?<p>If not, I&#x27;m not sure why I&#x27;m paying any more.",1389874992
7068969,comment,,7062208,1,0,nycticorax,,,"It&#x27;s funny that, in an article describing issues with a high-DPI display, the author never explicitly says the size of the screen (e.g. in inches), or the DPI.  He just tells us it&#x27;s 3200x1800.  In case you were wondering, the display on the Lenovo Yoga 2 Pro is a 13.3&quot;, 16:9, 276 DPI display.  Personally, I find this description more immediately useful than saying that it&#x27;s a 13.3&quot;, 3200x1800 display.",1389874986
7068968,comment,,7063126,1,0,noselasd,,,"I&#x27;d imagine the POCSAG network would be quite overloaded, quite quickly. It doesn&#x27;t have a lot of bandwidth, and unless the network knows where you are, messages destined to you would have to be broadcast everywhere.",1389874985
7068967,comment,7065826,7068680,7,0,krelian,,,"As someone who wants Spotify to succeed I don&#x27;t know if the recent changes are a good sign or not as to how the company is doing.",1389874972
7068966,comment,,7068756,2,0,72deluxe,,,"You&#x27;re right about Windows CLI - PowerShell is dreadful!",1389874950
7068965,comment,7068680,7066937,1,0,beaumartinez,,,"> <i>This IS still a site about startups, right?</i><p>Yes, but this thread is still about a language.<p>> <i>I like to make money.</i><p>Of course. And the main concern with npm, Inc is whether making money will at some point conflict with wanting to make npm better, no-strings-attached.",1389874946
7068964,story,,,8,4,jackgavigan,"Another HN outage?",,"More problems this morning? I&#x27;ve been getting errors and timeouts this morning, and noticed one of my comments has disappeared.",1389874914
7068963,comment,7064435,7068132,2,0,72deluxe,,,"I would second this. Many office staff (who tend to be women) just use the computer because it is part of their job and don&#x27;t learn their way around a system or learn the concepts of files etc. (I am not attempting to be sexist btw - just many people my wife work with in the office don&#x27;t attempt to learn anything new and can&#x27;t cope with basic changes to the system; they complain that Word isn&#x27;t working because they have set the font to white and are typing onto a white background, for example. A web browser is &quot;the Internet&quot; and they don&#x27;t know the difference between &quot;Windows Explorer&quot; and &quot;Internet Explorer&quot;, and have no idea where their files are etc. etc. etc.)\nI can see why the iPad took off with its lack of usable file system from a user perspective, because you don&#x27;t need to learn any of the stuff you would with a PC.<p>Icons that have moved is the end of the world for some people. Putting Linux onto a desktop would be like the end of the universe, despite how easy we find it to use.",1389874901
7068962,story,7067981,,1,0,glassapps,"Lean Startup im Selbstversuch (german)",http://vothigor.wordpress.com/2014/01/16/falsches-management-als-innovationskiller/,,1389874887
7068961,comment,7068028,7068840,2,0,k-mcgrady,,,"I think the mid-tier features are mostly free now (mobile use was the big one I think).",1389874877
7068960,story,7068028,,1,0,jonyami,"Here are 10 Steam Machine games you can play right now",http://www.redbull.com/us/en/games/stories/1331628195846/10-steam-machine-games-you-can-play-right-now,,1389874855
7068959,comment,7068028,7059919,1,0,budgetyzer,,,"Check: App.budgetyzer.com\nSimilar tool more advanced.",1389874853
7068958,comment,7067400,7068947,1,0,adambutler,,,"New blog post here -> <a href""http://simpleweb.co.uk/2014/setting-up-your-team-for-ios-app-development"" rel""nofollo"">http://simpleweb.co.uk/2014/setting-up-your-team-for-ios-app...</a>",1389874844
7068957,story,7067213,,2,0,pini42,"Software Development, Configuration and Management",http://continuousdelivery.uglyduckling.nl/continuous-delivery/software-development-configuration-and-management/,,1389874833
7068956,comment,,7068656,3,0,pjmlp,,,"Happy birthday Tcl!<p>The first web application server I used, between 1999 and 2001, was an in-house framework built on top of Apache + C + Tcl.<p>Quite similar in principles to AOL Server, actually.",1389874831
7068955,comment,7068680,7068946,1,0,bobsgame,,,"Java applets are either greatly limited in capability or have full access to the underlying system.\nThis is circumventing the applet/plugin paradigm and allowing full Java programs without security being an issue, as they only have access to the virtual system.",1389874814
7068953,comment,7066238,7068864,2,0,_pmf_,,,"It&#x27;s also still common as language for hardware debuggers.",1389874743
7068952,comment,7068680,7068888,6,0,mschuster91,,,"Still, it&#x27;s better than public radio stations.",1389874738
7068951,story,7068579,,30,0,cubictwo,"Malware installed by Cron job",http://blog.sucuri.net/2014/01/the-hidden-backdoors-to-the-city-of-cron.html,,1389874729
7068950,comment,,7068863,1,0,k-mcgrady,,,">> &quot;As said in another comment, you get a better audio quality and the avaibility to store music offline (I found it quite useful on my mobile phone). Of course, the quality will only matter to some people.&quot;<p>As you say the quality thing will only matter to some people. The ability to store music offline is also becoming a less important feature as mobile networks improve. I have to admit I still use it quite often but looking ahead a few years Spotify really needs to differentiate their premium product more.",1389874723
7068949,story,,,1,0,yusufaytas,"Imcache : Open source Java Ninjas are wanted",https://github.com/Cetsoft/imcache,"Imcache is a Java Caching Library. It supports various kinds of caching models that have been applied so far.",1389874723
7068948,story,7068028,,1,0,vldx,"Hannibal Lecter isn’t a psychopath, but you might be","http://qz.com/167267/hannibal-lecter-isnt-a-psychopath-but-you-might-be/#/h/40983,1,2,40984,1/",,1389874711
7068947,story,,,1,0,adambutler,"IOS Development For Teams (+ new blog post)",https://github.com/simpleweb/iOS-Development-For-Teams/#,,1389874706
7068946,comment,7068028,7068938,1,0,soboleiv,,,"Isn&#x27;t usual Java(not sure about C# model) sandbox enough?",1389874667
7068945,story,7068668,,1,0,lsinger,"Why and how to use Twitter as a software developer",http://blog.leif.me/2013/11/how-software-developers-use-twitter/,,1389874651
7068944,comment,7068680,7067678,1,0,72deluxe,,,"I think you really hit the nail on the head with the keyboard shortcuts thing. On Vista and beyond, they made the listview headers accessible by Tab in Explorer. This was STUPID.<p>So XP really is dead easy to use with keyboard shortcuts, particularly in Classic mode. OSX by default only lets you tab to text boxes, which you need to change in System Preferences, but can&#x27;t get to without a mouse because you can&#x27;t tab to the control to change it...... the irony......",1389874646
7068943,story,,,1,0,abcv085,"Which was the worst VR headset of the 1990s?",http://www.redbull.com/us/en/games/stories/1331628307841/rip-the-fallen-heroes-of-virtual-reality,,1389874644
7068942,comment,,7068796,1,0,vincentkriek,,,"As far as I know you can&#x27;t listen to spotify using 3rd party clients (like the Sonos).",1389874640
7068941,story,7068455,,2,0,pmcpinto,"Google is building a robot army",http://www.kernelmag.com/features/report/8180/google-is-building-a-robot-army/#,,1389874632
7068940,comment,,7068828,7,0,joeblau,,,"I stopped paying for Spotify back in August even though there was a clear benefit.  The only clear added benefit you&#x27;re going to receive is no ads. I think Google Music is putting pressure on them and they need something to compete.",1389874621
7068939,story,7068680,,1,0,reqres,"Will buying porn turn out to be bitcoin's killer app?",http://www.theguardian.com/technology/2014/jan/16/will-porn-com-bitcoin-app,,1389874590
7068938,story,7068028,,1,0,bobsgame,"Concept for Browser running Java/C# programs in VM sandbox - Feedback wanted",http://i.imgur.com/tJsKeU9.png,,1389874501
7068937,comment,7068331,7068894,1,0,blueskin_,,,"That still only applies to homes; it needs to be extended to commercial premises first.",1389874478
7068936,comment,7068028,7068039,1,0,72deluxe,,,"I am impressed by the fact that you&#x27;re running such an old machine and have managed to avoid the rabid upgrade habits that apparently infect Mac users! (I myself have to sedate myself to overcome this). \nI suppose the &quot;if it isn&#x27;t broke, don&#x27;t fix it&quot; adage comes in here, and I am mighty impressed that you are continuing to live with such an old old machine. Is OSX usable on that? I recall 10.5 (and older) being horribly &quot;crashy&quot;; 10.6 was far better for me, but it was probably the desktop software I was using that was causing system instability.\nWhat&#x27;s the battery life like?",1389874472
7068935,story,,,7,0,jgrahamc,"Show HN: The""Hacker News Statu"" Twitter account",http://twitter.com/hnstatus,,1389874381
7068934,comment,,7068900,10,0,jackgavigan,,,">..squatting laws are to make sure property is being used and not hoarded.<p>That is simply not true but thank you for providing an example of the hot air about homelessness that I referred to.<p>Squatters rely on section 6 of the Criminal Law Act 1977, which creates an offence of using or threatening unauthorised violence for the purpose of securing entry into any premises, while there is known to be a person inside opposing entry. As I said, this was originally implemented to prevent slum landlords from using violence to drive out tenants who benefited from statutory rent controls.<p>No UK government has ever passed any law that legalises or permits squatting.",1389874353
