ID,Type,Story,Parent,Points,Comments,Author,Title,URL,Content,Created
7069084,story,,,46,85,ColinWright,"How Do You Teach Kids the Value of Money? (2006)",http://www.getrichslowly.org/blog/2006/11/08/how-do-you-teach-kids-the-value-of-money/,,1389877153
7069083,comment,7067206,7067700,2,0,smackfu,,,"Millions of people who will continue to not care what OS they are running.",1389877150
7069082,comment,7067206,7067536,2,0,xmodem,,,"> A single core 1.5GHz Pentium 4, with 512MB of RAM, running XP delivers all of the same features that Windows 7 delivers with a quad-core 3GHz iCore7 and 8GB or RAM.\nA Pentium 2 running at 300MHZ, with 64MB of RAM, running Windows NT 4, delivers all of the same features that Windows XP delivers with a beefy 1.5Ghz Pentium 4 with 512MB of RAM.<p>At some point old technology will be refreshed.  How far do you want to go with this?",1389877082
7069081,story,,,93,49,andyjohnson0,"Eero Saarinen's Bell Labs, Now Devoid of Life",http://www.metropolismag.com/Point-of-View/January-2014/In-Photos-Eero-Saarinens-Bell-Labs/,,1389877081
7069080,story,,,8,5,hndl,"Israel’s Efforts to Limit Use of Holocaust Terms Raise Free-Speech Questions",http://www.nytimes.com/2014/01/16/world/middleeast/israels-efforts-to-limit-use-of-holocaust-terms-raise-free-speech-questions.html?hp&_r=0,,1389877056
7069079,story,,,1,0,javinpaul,"JSF to become action based framework?",https://weblogs.java.net/blog/mriem/archive/2014/01/13/jsf-tip-56-using-action-based-prototype-mojarra,,1389877029
7069078,comment,7069015,7069015,0,0,rschmitty,,,"I don&#x27;t get the presidential part.  Lots of statements about response time being better, then the guy with nearly double the load time won the election?  Not that I&#x27;m arguing against page speed, just found that odd in the info graphic..<p>Also, it wouldn&#x27;t hurt to perfect your load times! <a href=""http://developers.google.com/speed/pagespeed/insights/?url=http%3A%2F%2Fsmartbear.com%2Fhomed%2F"" rel=""nofollow"">http://developers.google.com/speed/pagespeed/insights/?url=h...</a>  54/100 mobile & 77/100 desktop when I tested it",1389877029
7069077,story,,,1,0,ruggerotonelli,"MySQL on Amazon's RDS: Why you should use both Multi-AZ and Read Replicas",http://blog.celingest.com/en/2014/01/16/rds-mysql-multi-az-and-read-replica/?mdm=rgrHN16Jan,,1389877024
7069076,comment,7068331,7068787,14,0,PaulRobinson,,,"&quot;Email is a wonderful thing for people whose role in life is to be on top of things. But not for me; my role is to be on the bottom of things.&quot;<p>So I think we all read that and think we want to be a bit more like Don Knuth, eh?<p>I&#x27;ve met Dr Knuth a couple of times. He&#x27;s a lovely man, rather modest and just a little nervous. There are some in the industry I&#x27;ve met who know of their infamy and carry it less well.<p>Last time I spoke to Don, he was stood on a low/wide window ledge of Manchester (UK) Town Hall watching the Olympic flame make it&#x27;s arrival there in the Spring of 2012.<p>We were both attending a conference held there in honour of Alan Turing&#x27;s 100th birthday. Also in the room were Fred Brooks, Vint Cerf, Tony Hoare, Samuel Klein and various other amazing names from computer science and a few other names of note who aren&#x27;t quite so &quot;classic&quot; yet (David Ferrucci of IBM Watson project, Gary Kasparov, etc.).<p>This is the first and last time I will ever name drop, and I swear I have no idea how I ended up in that room with that company. But it was pretty cool.<p>And Don did not fall out of the window, and I was relieved I did not witness same. That would have scarred me for life.<p>Anyway, he&#x27;s got the right idea. We should all be more like Don.",1389877020
7069075,story,,,2,0,chethiya,"Leap motion controller for interactive analytics [video]",http://www.youtube.com/watch?v=YGSTwVnpkN0,,1389877016
7069074,comment,7068579,7068822,1,0,oleganza,,,"As far as I know, Fed prints around $80 billion since 2012 and does it today. All this money does not just sit somewhere, but is being &quot;invested&quot; to &quot;stimulate the economy&quot;. Sources are listed here: <a href""http://en.wikipedia.org/wiki/Quantitative_easin"" rel""nofollo"">http://en.wikipedia.org/wiki/Quantitative_easing</a><p>Then, you ignored the fact that existing Fed policy made possible murder of 1 million people over several years at a cost of $6 million per person. There were no taxpayers or private investors who&#x27;d save that much money to invest in a large scale murder operation. It was all possible because of Fed, legal tender laws and tons of regulations that make sure people have to accept USD as money. I think it is important to understand that to see the power that the Fed has and how much lives are affected by that power. It just gives the proper context.",1389876990
7069073,comment,7067556,7069037,1,0,tammet,,,"The marked locations in high-res areas like cities are based on both most popular wikipedia articles and most popular foursquare locations in the intense area. Quite likely Alex&#x27;s place is one of these highly popular foursquare locations.",1389876989
7069072,story,,,2,0,javinpaul,"Shenandoah: Red Hat's JEP for a pauseless collector",http://openjdk.java.net/jeps/189,,1389876986
7069071,story,,,1,0,m_class,"What a Transportation Revolution in China Looks Like?",http://www.scientificamerican.com/article.cfm?id=transportation-revolution-in-china,,1389876979
7069069,comment,7067803,7068077,7,0,mietek,,,"> ...apparently SGI destroyed Cray’s old software archives before spinning them off again in the late 90′s.<p>Why would anyone do this?",1389876871
7069068,comment,7069015,7069015,15,0,cliveowen,,,"Unreacheable, talk about irony.",1389876869
7069067,comment,7062923,7068869,1,0,delinka,,,"I don&#x27;t follow. The VPN provider will still have to insist on limits, because the telco will insist on limits. It&#x27;s not like Facebook is automatically unlimited, it&#x27;s just limited to what Facebook is willing to pay for its users. It becomes Facebook&#x27;s problem to understand data usage by its users and its apps and to pay accordingly (or not pay, and let the data start counting once the user is past the &#x27;Facebook limit.&#x27;)<p>Therefore, a VPN provider will be in the same position. So instead of paying AT&T for your data plan, you&#x27;re basically paying the VPN people for your data plan plus privacy from AT&T.",1389876840
7069066,comment,7068579,7068951,3,0,Yver,,,"The attacker obfuscated &quot;base64_decode&quot; part but not &quot;eval&quot;. It&#x27;s not the first time I see base64_decode() being more the focus of attention than eval, I don&#x27;t know where it originates from.<p>Also, if cron infected the PHP files I wonder what infected the crontab. :\\",1389876823
7069065,comment,7068680,7068999,2,0,Dewie,,,"> I have LTE in my area so I may be an exception, but I was listening to Spotify in my car for over an hour yesterday without any WiFi connectivity.<p>I have a 50MB limit. And the stupid app doesn&#x27;t let me differentiate between playing offline and playing only when I have wifi, so if wifi is turned on on my mobile and also the 3G (which I might have on because I want to browse some websites when I&#x27;m outside my home or going somewhere), and the wifi doesn&#x27;t work for some reason, Spotify will happily leech off my data plan with me being none the wiser.",1389876793
7069064,comment,7066674,7068575,5,0,nextw33k,,,"That is a very dangerous way to think.<p>Cultural exchange is the key way to breaking down barriers, the more they learn about us and vis-versa the quicker things will change.",1389876765
7069063,story,,,1,0,daanpape,"Belgian tech startup releases cheap Linux module",http://slashdot.org/submission/3269757/belgian-tech-startup-releases-cheap-linux-module,,1389876765
7069062,story,,,1,0,ColinWright,"How Do You Teach Kids the Value of Money?",http://www.getrichslowly.org/blog/2006/11/08/how-do-you-teach-kids-the-value-of-money/,,1389876745
7069061,comment,7068028,7068028,1,0,alexkus,,,"Seems odd, even with the interesting conditions (no hot water or no electricity in some rooms), that with demand allegedly so high the &quot;rents&quot; are still so low.",1389876740
7069060,comment,7069015,7069015,1,0,brasetvik,,,"Ironically, just ~12 minutes after submission, the site is down.. :)",1389876732
7069059,comment,7064435,7066176,1,0,bluecalm,,,">Simply because it&#x27;s &#x27;insulting&#x27;?<p>Because he makes a lot of bold/insulting claims and then fails to give one argument most of the time. When he does provide an argument it&#x27;s very often nonsense (like with his analogy of someone being asked to calculate MAD).<p>>Should you not be far more concerned if it&#x27;s true?<p>I am. I am also concerned about discrediting scientists without providing reasons. Creationism, anti-vaccination and climate change denial are all based on people not trusting scientists and following guys who just tell them scienc is nonsense. Taleb is very close to that line.<p>> What does it say about you that you are posting angry vitriolic comments online because someone called out scientists misusing statistical tools but that you are not as alarmed that such a thing could be happening?<p>He didn&#x27;t call out anybody. He just threw plain insults without reasons. When you call out someone you say what is wrong with what they are doing, like this:  \n&quot;Hey, bankers, it&#x27;s unfair that you make huge bets and don&#x27;t pay out when you lose!&quot;,  \n&quot;Hey, investing firms, it&#x27;s stupid that you treat a lucky few as celebrities while you can&#x27;t have any confidence in their performance&quot;.  \nHere is didn&#x27;t called out people. He just asserted they are using one of the most used mathematical tools incorrectly, that it&#x27;s because confusion in naming and that it should be disposed of. He didn&#x27;t give one example of mistakes happening because of it.  \nNow, people who follow him and believe that he is some kind of authority may start distrusting science or academia (as he is actively hostile vs both) exactly the same way anti-vaccination people do: just because some celebrity told them so.  \nThere is value in calling people like him out on their nonsense.",1389876701
7069058,comment,7067206,7068339,3,0,rbanffy,,,"These machines seem like excellent candidates for running Linux with a light desktop environment. If the owners will not spend money on software that&#x27;s Windows-specific (chances are they&#x27;ll need modern browsers and Microsoft doesn&#x27;t offer one for XP), why install Windows on them?",1389876692
7069057,comment,7066204,7066204,1,0,Grue3,,,"A rare instance where compiled code is actually slower than before &quot;compilation&quot;.",1389876690
7069056,story,,,1,0,DiabloD3,"2014 Federal Spending Bill Contains Demands For NSA Transparency",http://www.bloomberg.com/news/2014-01-14/congress-spending-bill-demands-details-about-nsa-spying.html,,1389876656
7069055,comment,7067556,7068973,3,0,rikkus,,,"I&#x27;m guessing they make most of their money from the ads - and appreciate the extra they get from paying subscribers enough that it&#x27;s worth giving them a few extra benefits over the ad removal.",1389876652
7069054,comment,7068028,7069012,4,0,SideburnsOfDoom,,,"FWIW, I think this is the law being referred to as &quot;closing in 2012 the loophole that allows squatting&quot;<p>&quot;Offence of Squatting in a Residential Building&quot; <a href""https://www.gov.uk/government/uploads/system/uploads/attachment_data/file/220062/squatting-circular.pd"" rel""nofollo"">https://www.gov.uk/government/uploads/system/uploads/attachm...</a>",1389876642
7069053,story,,,1,0,BenLinders,"Getting Feedback with the Perfection Game",http://www.benlinders.com/2014/getting-feedback-with-the-perfection-game/,,1389876637
7069052,comment,7066125,7068970,1,0,iriche,,,"That&#x27;s really the only thing I wonder too now, else I will cancel directly too",1389876548
7069051,comment,7068680,7068680,6,0,Grue3,,,"How about no country limits? Eh?",1389876538
7069050,story,,,2,0,danso,"AOL Gives Up Control of Money-Losing Local News Division Patch",http://www.businessweek.com/news/2014-01-15/aol-relinquishes-control-of-money-losing-local-news-unit-patch,,1389876531
7069049,comment,7068964,7068964,6,0,ColinWright,,,"<a href""https://news.ycombinator.com/item?id=706901"" rel""nofollo"">https://news.ycombinator.com/item?id=7069013</a>",1389876530
7069048,comment,7067556,7068896,3,0,arethuza,,,"Isn&#x27;t a lot of France fairly rural and with a low population density - the distribution of pictures in Europe seems to match population density fairly closely:<p><a href""http://kids.britannica.com/comptons/art-143547/Population-density-of-Europ"" rel""nofollo"">http://kids.britannica.com/comptons/art-143547/Population-de...</a>",1389876525
7069047,comment,7066674,7067071,2,0,Toenex,,,"Surely even the North Korean Government won&#x27;t object to a USB drive full of kitten pictures.  Or are they sending an unrepresentative sample of the internet? :)",1389876508
7069046,comment,7067206,7068520,2,0,electrichead,,,"I believe IE6 is the definition of broken.",1389876481
7069045,comment,7068656,7068656,3,0,protomyth,,,"I would put Tcl on the list of languages to learn just because it is one very different and it can be used to build some cool projects (the web server).",1389876475
7069044,comment,7068680,7068833,1,0,ozh,,,"Blame the service, not the users.",1389876471
7069043,story,,,1,0,ColinWright,"John Dobson, amateur astronomer & designer of the Dobsonian telescope, has died",http://en.wikipedia.org/wiki/John_Dobson_(amateur_astronomer),,1389876458
7069042,story,,,1,0,edent,"Show HN: Handshake.js a Haptic Effects Library for HTML5",https://github.com/o2Labs/handshake-html5-vibrate-haptic-library/,,1389876450
7069041,comment,7062671,7067972,1,0,Mikeb85,,,">  In which case, it matters little if you use metric or not...<p>Well, you still will measure things, most cooks will do a stint in the pastry kitchen, plus in the higher end restaurants a lot of pastry techniques transfer over to the savoury side (ie. a lot of what we think of as &quot;molecular gastronomy&quot;).<p>While metric vs imperial doesn&#x27;t matter for accuracy (whereas weight is more accurate than volume if you&#x27;re measuring anything that&#x27;s not liquid, and even with liquids it&#x27;s easier to measure volume incorrectly), metric is just easier.",1389876413
7069040,comment,7067556,7067922,4,0,riffraff,,,"most of the pictures reflect tourism density, US has less than one fifth of the yearly tourists of europe.",1389876390
7069037,comment,7067556,7067556,1,0,Chestofdraw,,,"Zooming in on London, Piccadilly Circus (the no. 1 photo location in London according to this site) and found that the no.7 location here is &#x27;Alex&#x27;s Amazing Test Location of Greatness&#x27;<p>I wonder what this is and if anyone else has found similar spots anywhere else?",1389876313
7069036,comment,7068028,7068753,7,0,mietek,,,"Squatting is not the problem.  Vandalism, or criminal damage, is the problem.",1389876291
7069035,story,,,1,0,0cool,"Tokyo just became more real on Google Maps with new 3D imagery",http://googleasiapacific.blogspot.sg/2014/01/fly-through-tokyo-and-more-with-new-3d.html,,1389876291
7069034,comment,7063495,7066201,2,0,informatimago,,,"You mean cypher text.  Plain text is clear text is unencrypted.",1389876289
7069033,story,,,3,0,AndreyKarpov,"Checking the Source SDK Project",http://www.viva64.com/en/b/0229/,,1389876283
7069032,comment,7066479,7068193,8,0,tinco,,,"No. This site isn&#x27;t about UX or innovation, it&#x27;s about tech start ups. It&#x27;s a constant reminder that something can be successful even if it was written in a LISP dialect and has a bunch of UX misses as long as the core idea is valid and the product usable enough.<p>I&#x27;ve used a bunch of HN skins that were supposedly better designed, but none of them stuck. Apparently it&#x27;s just plain unnecessary for HN to be better.",1389876283
7069031,comment,7068656,7068816,1,0,reuven,,,"I met with a company in 2011 that was using Vignette, and was considering creating their own CMS.  I said something like, &quot;I know that the really old version used to work on Tcl, but I assume that you&#x27;re long past that.&quot;<p>I was met with blank, embarrassed stares, until the manager finally said, &quot;Um, we&#x27;re actually still using that ancient version built on Tcl.&quot;<p>So far as I know, they&#x27;re still using it -- they never upgraded, switched, or developed an alternative.  I&#x27;m not sure if that speaks to the company&#x27;s ability to absorb pain, or to the excellent, long-term software engineering that went into that version of Vignette.",1389876275
7069029,comment,7068656,7068864,4,0,dded,,,"> One of my fondest memories working with Tcl was in the EDA industry. Thanks to its legacy, Tcl/Tk enjoys widespread usage in the entire workflow - from logic design to sign-off<p>Those of us actually using EDA tools are not necessarily so fond of Tcl.  Not me anyhow.  Tcl is awkward to debug, and its everything-is-string semantics make programming an exercise in quoting.  Just when I think I understand the scoping, I screw it up.<p>> Despite its odd syntax<p>Tcl&#x27;s syntax is one thing that I actually <i>do</i> like about the language.  It&#x27;s odd, yes, but it&#x27;s simple and clean.<p>> Tcl is one of the rare examples of a functional programming language actively used in the industry (I&#x27;m looking at you Lisp).<p>Cadence actually uses a real Lisp in some of their tools; they call it Skill.  Skill is, in fact, a joy to code in; and I greatly prefer it to Tcl.  They also have a lexically scoped version called Skill+, which I&#x27;ve never got to use.<p>> wishing that something like Python would replace [Tcl]<p>Python, yes!  Or Scheme.  Or even Perl.  I don&#x27;t know Lua, but have always imagined it to be better than Tcl and it seems to occupy a similar niche.  But no one even talks about Tcl getting replaced.",1389876236
7069028,story,,,2,0,DiabloD3,"NSA Spying Fallout Hits French Satellite Deal",http://www.techdirt.com/articles/20140114/04272125862/nsa-spying-fallout-hits-french-satellite-deal.shtml,,1389876234
7069027,comment,7068028,7069011,5,0,ry0ohki,,,"It&#x27;s peculiar compared to the United States, where there are pretty much no squatters rights in most cities.",1389876223
7069026,comment,7068331,7068771,5,0,cevn,,,"Yeah, not exactly sure this is newsworthy. He&#x27;s not even reporting a bug, just responding to one.<p>Keep being alive Dr. Knuth.",1389876174
7069025,comment,7066479,7067106,1,0,easy_rider,,,"I&#x27;m wondering how you will be able to with the numerous ways of CSRF protection implementations.",1389876152
7069024,story,,,3,0,mcls,"Why Humility Pays Off",https://medium.com/busy-building-things/89fd1897770b,,1389876149
7069023,comment,7069013,7069013,5,0,nmc,,,"Thanks for the info!<p>Out of curiosity, do you have an idea about the source of the corruption problems?",1389876123
7069022,comment,7068028,7069011,3,0,disputin,,,"The answer to that is Land Value Tax, which can also replace all other taxes.",1389876117
7069021,story,,,2,6,junto,"Ask HN: Cannot find a website where you could hire sysadmins short term",,"I recently saw a cool website on HN where you could hire sysadmins for small bits of work. HN Search is failing me. I can&#x27;t seem to find it anymore. Can anyone remember what it was?",1389876076
7069020,story,,,11,2,yawboakye,"The story of prisoner F95488",http://sports.espn.go.com/espn/news/story?id=4300383&src=mobile,,1389876051
7069019,comment,7064188,7064582,1,0,alexkus,,,"Not always (as long as you&#x27;re talking about something they are in possession of, you&#x27;re right if you mean you can&#x27;t prove that you don&#x27;t have some flash drive hidden somewhere but, then again, it need not be encrypted if they don&#x27;t have access to it).<p>To start simply, it&#x27;s certainly possible to prove that a disk installed with a base install of an OS (and then never touched) contains no encrypted volumes if all of the remaining blocks are empty. Every file can be compared to a known good copy and if there&#x27;s no other data anywhere on the disk then there can&#x27;t be anything hidden on it.<p>From there it&#x27;s a case of proving that each bit of extra data on this disk relates to a file available under the OS or a fragment of such a file (now deleted). This gets progressively harder the more the disk has been used.<p>It impossible to deny this when you have a GB+ sized area of unpartitioned data (or unmounted partition) containing seemingly random noise. Or a similar GB+ sized file that you cannot demonstrate to be something benign by unpacking/decrypting/etc. &quot;It&#x27;s a file of random noise I generated&quot; is going to set off the alarm bells.",1389876018
7069018,comment,7066038,7067424,1,0,Xdes,,,">But, given nobody else thinks this way, then no, unions are not a conspiracy.<p>Historically unions were conspiracies until the late 1800s.",1389875952
7069017,comment,7066479,7067651,1,0,easy_rider,,,"I&#x27;d love to argue that PG probably thinks this is a good thing. (no scraping). And for good reasons.\nWho is paying the bandwidth bills in the end, and for whom, you might ask. And then if those users will end up contributing to HN in any intellectual way in the end, or are just scraping content to spin in their auto-blogs filled with ads.",1389875947
7069016,comment,7065826,7068749,1,0,BenoitP,,,"Thank you a lot :) I&#x27;m further bombarding you with questions:<p>I&#x27;m trying to list the usages of Bayesian inferences in industry. So, there is spam filtering, I bet there would be recommandation engines (ex: amazon&#x27;s product recommandation, ad targeting). Would you know of other uses?<p>Do you know of some kind of tutorial of how one particular bayesian engine is applied to a particular dataset in a commercial venture?<p>Also, I have been looking at weka (<a href""http://www.cs.waikato.ac.nz/ml/weka"" rel""nofollo"">http://www.cs.waikato.ac.nz/ml/weka/</a>), and j48 in particular. j48 is an implementation of the C4.5 algorithm, (which is close to ID3 and C5). Here is how I learned about C4.5: <a href""http://www.cs.umd.edu/~samir/498/10Algorithms-08.pd"" rel""nofollo"">http://www.cs.umd.edu/~samir/498/10Algorithms-08.pdf</a>.\nWould you happen to know if one of these algorithms have commercial applications?<p>In a different subject, Judea Pearl has been awarded the Turing award for using Bayesian networks to calculate probability of causality. Which is different than traditional Bayesian analysis, where we calculate probabilities of a property being true. In his theory, he claims one can calculate the probability of a property being a necessary condition, the probability of a sufficient condition to another property (and the probability of both combined). I&#x27;m really having trouble understanding the ins and outs of this too. Have you heard about an usage of this theory? Do you think it has a viable shot at having commercial applications?",1389875936
7069015,story,,,32,26,Baustin,"The Cost of Poor Web Performance",http://blog.smartbear.com/web-performance/the-cost-of-poor-web-performance-infographic/,,1389875912
7069014,story,,,1,0,ozh,"China’s Internet population: 618 million with 81% connecting via mobile",http://thenextweb.com/asia/2014/01/16/chinas-internet-population-numbered-618m-end-2013-81-connecting-via-mobile/,,1389875876
7069013,story,,,263,122,kogir,"Tell HN: Server Status",,"HN went down for nearly all of Monday the 6th. I suspected failing hardware.<p>I configured a new machine that is nearly identical to the old one, but using ZFS instead of UFS. This machine can tolerate the loss of up to two disks. I switched over to it early morning on the 16th, around 1AM PST.<p>Performance wasn&#x27;t great. Timeouts were pretty frequent. I looked into it quickly, couldn&#x27;t see anything obvious, and decided to sleep on it. I switched back to the old server, expecting to call it a night.<p>Then the old server went down. Again. The filesystem was corrupted. Again. So I switched back to the new server. During this switch some data was lost, but hopefully no more than an hour.<p>And here we are. I&#x27;m sorry that performance is poor, but we&#x27;re up. I&#x27;ll work to speed things up as soon as I can, and I&#x27;ll provide a better write-up once things are over. I&#x27;m also really sorry for the data loss, both on the 6th and today.",1389875871
7069012,comment,7068028,7068992,5,0,blueskin_,,,">While Parliament might not have explicitly legalised it, it also hasn&#x27;t closed the loophole<p>Actually, it did in 2012.",1389875862
7069011,comment,7068028,7068028,6,0,mcv,,,"&quot;Peculiar law&quot;? Dutch laws aren&#x27;t that different. A property has to have been empty for at least a year before it becomes legal to squat (and I believe these rules have been tightened further a couple of years ago, but I&#x27;m not entirely up to date).<p>The reason to have squatting legal (with restrictions) is to make it unattractive to keep buildings unused in the face of housing shortage. Find some use for it or turn it into housing. If you don&#x27;t, eventually, someone else can.",1389875814
7069010,comment,7068028,7068930,6,0,misnome,,,"And relied on not to trash the place.",1389875811
7069009,comment,7068455,7068723,1,0,grey-area,,,"Stock is generally viewed as part of compensation, no-one&#x27;s talking purely about salary here and the higher you go on the corporate ladder, the less important salary becomes.",1389875810
