ID,Type,Story,Parent,Points,Comments,Author,Title,URL,Content,Created
1149982,comment,1148425,1149739,0,0,berntb,,,"Well, [organic] chemists are ""famous"" for low average life span.<p>I heard claims that the life expectancy was much better these days, but the person making the claim had an obvious interest in selling people on doing more courses in the subject. (And the subject is fun; if it had been possible for me, I would have done more org chem.)",1267070903
1149981,story,,,1,0,weaksauce,"Apple exec Tim Cook talks Apple TV, iPad A4 processor, more",http://www.appleinsider.com/articles/10/02/23/apple_exec_tim_cook_talks_apple_tv_a4_processor_more.html,,1267070846
1149980,comment,1149865,1149865,0,0,pvg,,,"If only there were some sort of tokens employers could give employees as an incentive. The tokens could then be exchanged for goods and services. Perhaps the production and circulation of tokens could be managed by the government to prevent abuse.",1267070664
1149979,comment,1149881,1149881,0,0,phaedrus,,,"He seems to be arguing that the existence of multiple javascript frameworks is caused by it lacking a standard library, but I don't think you can conclude one based on the other; as a counter example the Java language has an extensive standard library, yet it has many, many 3rd party frameworks as well.<p>The other thing most of these frameworks provide is cross browser compatibility.  If there were a large standard library built into javascript, I fear it would just be more things for different browser makers (especially Microsoft) to implement with different quirks, and you'd still need a 3rd party compatibility framework layered on top of it to be cross browser compatible, only now it would have to cover a large framework instead of just 16 objects.",1267070583
1149978,comment,1149555,1149555,0,0,nfnaaron,,,"Wow, what extreme reactions on the negative side. It sounds a lot like smokers being angry at no smoking laws for bars.<p>There are two issues: 1) Whether a business has the right to limit what goes on in that business (and a worthy debate that is); and 2) How serious your addiction might be if it provokes that much anger.<p>Step away from the keyboard.",1267070576
1149977,comment,1149865,1149865,0,0,csallen,,,"There was a time when I played WoW religiously, and actually had my own guild. This was back in the day, when guilds spent 30+ hours a week clearing dungeons that required 40 people to memorize and execute intricate strategies. Even though my guild was relatively successful, motivating people to show up to these raids was <i>always</i> a chore. Many players consistently left dungeons early, or avoided them altogether. Interestingly enough, these same players didn't mind spending hours grinding or fishing or hanging out in the city, doing nothing in particular. They did this despite the fact that raiding dungeons was more productive, stimulating, exciting, challenging, and potentially rewarding.<p>I suspect one of the appeals of doing repetitive, mindless things like fishing or grinding in games is because... they're repetitive and mindless. There are real-life equivalents: clicking around on Hacker News, slumping on a couch for hours watching television, etc. These activities are much less mentally exhausting, much less stressful than doing actual work.<p>Anyway, I think your idea is a great one, but there are some hurdles. If you reward people for menial activities, then they'll waste tons of time on it because it's mindless and easy. Chances are this type of work is not what any company would want its employees doing. If you only reward people for actual demanding work, then chances are you won't really be adding anything.",1267070558
1149976,comment,1149865,1149865,0,0,brown9-2,,,"There is probably a pretty large body of work on employee motivation and reward systems in the academic literature. I'd suggest familiarizing yourself pretty closely with all of the research before going anywhere with this idea.",1267070547
1149975,comment,1149555,1149555,0,0,kaib,,,"Wow. After reading the article and some of the comments I'm realizing how different the cafe culture in Europe is. We have been living in the Bay Area for a number of years, so it's not like I haven't seen the droves of people sitting silently in coffee shops and tinkering away on their laptops. But the fact that this even generates a discussion.. :-)<p>A lot of European establishments I know have decided to never join the wifi movement. And even if many cafes now offer wifi it's very hard to spot people actually sitting with their laptops. Why would you want to, there are so many other things you can do in a cafe. Read, think, draw or just plain talk to the people in your party.",1267070543
1149974,comment,1149851,1149851,0,0,jff,,,"That is pure art.",1267070523
1149973,comment,1149865,1149865,0,0,metamemetics,,,"Also, obligatory-TED-video-exposing-counterintuitive-point: <a href=""http://www.ted.com/talks/dan_pink_on_motivation.html"" rel=""nofollow"">http://www.ted.com/talks/dan_pink_on_motivation.html</a><p>Providing higher rewards decreases performance.",1267070505
1149972,comment,1147767,1149947,0,0,nollidge,,,"> does it also take the blame for deaths caused by nuclear weapons?<p>In my view, yes, it does, and science needs to learn from that (and countless other mistakes).  It's certainly not universally praise-worthy.  But it does provide a way for ethical people to reliably improve the human condition.",1267070497
1149971,comment,1149865,1149865,0,0,ryanelkins,,,"A company spanning system is a pretty lofty goal. Perhaps you should look into something smaller, say something at the application level. A good example would be Ribbon Hero for MS Office.",1267070423
