ID,Type,Story,Parent,Points,Comments,Author,Title,URL,Content,Created
1150043,comment,1148157,1148292,0,0,patio11,,,"I have this funny feeling that Joel Spolsky probably does not need to read my blog for advice on effective software marketing.  But yes, I approve.  Do stuff like this.  It works, it is inexpensive, it lasts forever, and your customers will love you for it.<p>(Though if you're doing it for narrow SEO reasons, I might consider not breaking it into its own domain.  Links pointing at it won't help the product rank if the product is on a domain different than the linkbait.)",1267073996
1150042,story,,,3,1,twampss,"4chan founder defends online pranks",http://www.cnn.com/2010/TECH/02/22/chris.poole.4chan/index.html,,1267073952
1150041,story,,,2,0,DavidSJ,"John Gruber at Macworld 2010",http://www.youtube.com/watch?v=YbrfsXYoyCI,,1267073931
1150040,comment,1148707,1149641,0,0,davemc500hats,,,"again, i don't believe you're correct. i'm not aware that existing surplus unused EB-5 visas are used to ""help"" fill the backlog of EB-2 and EB-3 visas.  there appears to be some surplus calculations going on between EB-1, 2, & 3 visas based on EB-1 priorities.  i could be wrong; again i'm not an immigration lawyer.<p>that said, it could be argued there <i>is</i> some priority for immigrants who are helping to create jobs over those who are not.  i'm not suggesting that position be used to set priorities in allocating visas, but it's not necessarily unfair that the backlog of some group visas has higher or lower priority than others.<p>it seems that you have a particular issue with your friend's visa being in backlog and not being approved, and that this is coloring your perspective on all other types of visas.<p>while i have sympathy for your situation, this is not a rational perspective from which to make an argument for prioritization of visas, imho.",1267073879
1150038,comment,1148668,1149831,0,0,spencerfry,,,"Read the article.<p>I'm talking about passive income. Every virtual good Zynga creates needs to be made one time and then can be sold many times. It's passive in that sense.<p>I used subscription models as one example, because I'm most familiar with that, but selling virtual goods and selling themes are also ways of making passive income.",1267073831
1150037,comment,1149716,1149728,0,0,1010011010,,,"Network ""Solutions"".<p>What a shitty company.",1267073824
1150036,comment,1148707,1149293,0,0,kvs,,,"It's true current H1-B is broken or favors the employer. I think a fairly easy fix to that is to not bind H1-B to an employer and let the employee move around within the scope of the visa. This can alleviate some employers who take advantage of H1-B holders.",1267073804
1150035,story,,,24,15,jasonlbaptiste,"Facebook Checks-In On Loopt",http://techcrunch.com/2010/02/24/facebook-loopt-talks/?utm_source=feedburner&utm_medium=feed&utm_campaign=Feed%3A+Techcrunch+%28TechCrunch%29&utm_content=Google+Reader,,1267073764
1150034,story,,,3,0,peter123,"Senator Al Franken is Requesting User Caps on Internet Bandwidth?",http://blogmaverick.com/2010/02/24/senator-al-franken-is-requesting-user-caps-on-internet-bandwidth/,,1267073758
1150033,comment,1148707,1149592,0,0,davemc500hats,,,"sorry, no free rides... if you fail, you have to start over again.<p>(that is: you can always start another business, pitch new investors for funding, and re-qualify for the new business. there is no restriction on multiple attempts, however you will have to convince investors you're worth a 2nd chance... or 3rd... or 4th... etc)",1267073619
1150032,comment,1149881,1150005,0,0,tolmasky,,,"Cross-domain is not really an issue here, its quite silly that I can't in JavaScript require one file on my domain from another file in my domain. Instead, people have spent countless hours trying to figure out ""the right way"" to have interdependent code that doesn't block through a synchronous XHR. Sometimes this has resulted in requiring build tools which turn imports into script tags, etc (which is frustrating for a language that shouldn't require building).<p>This is why Objective-J has @import:<p><pre><code>    @import <Foundation/CPSet.j>\n    @import <AppKit/CPView.j>\n\n    alert(CPView);\n</code></pre>\nWhat's really upsetting is that we're getting the first update to JavaScript in like 10 years, and these fundamental concerns are still not being addressed. Instead of saying ""what can give us the next generation of web apps"", we've dropped the with keyword. Objective-J was really designed as ""man, these features should have been in here ages ago"". @import allows you to require code without a build step, without downloading or running twice, and still having it all take place asynchronously so that we don't block on some slow file.",1267073569
1150031,comment,1147767,1147767,0,0,jonny_noog,,,"<i>The Sophisticate:  ""The world isn't black and white.  No one does pure good or pure bad. It's all gray.  Therefore, no one is better than anyone else.""</i><p>I have often stated and thought that the world to me is not black and white and that indeed no one does pure good or pure bad. But I can't say this view has ever lead me to the conclusion that therefore, no one is better than anyone else.<p>Turning this issue over in my head, I guess I always just assumed that things being on a grey scale - the operative word being ""scale"" - that this would surely mean that things existing at different points on that scale could not be considered as all being the same. Interesting to read that apparently this is not the view held by some.<p>In my personal experience, I find that those whose view is that the world is black and white tend to also be those who wish to impose this view on others. While those who see the world as grey (whether they fall into this trap of the ""Fallacy of Gray"" or not) tend to be less concerned with converting others to their viewpoint and if anything are more concerned with defending their viewpoint from attacks by the black/white people. I'm not entirely sure what conclusion to reach from this observation... Authoritarians tend to see black and white, while libertarians tend to see grey and sometimes the ""Fallacy of Gray"" possibly as a defensive overreaction?",1267073562
1150030,comment,1149881,1149934,0,0,josh33,,,"Standard library = socialism<p>Many open libraries = capitalism<p>Since capitalism elucidates turrets  in some people, I'll add that what I'm driving at is competition breeds innovation and quality. If one library adds functionality another doesn't have, then it will add it, and in the process, improve on it. Awesome!",1267073492
1150029,comment,1149555,1149997,0,0,carbon8,,,"Social with each other. Neighborhood social centers, enough so that people care enough to even consider banning laptops.",1267073446
1150028,comment,1149555,1149928,0,0,drewsing,,,"Interesting point. I agree with you in that newspapers take away from interaction.<p>Laptops, though, can consume people in so many different ways, which makes it harder to approach a conversation with someone. You never know if someone is checking email, doing work, or just social masturbating on Facebook. There is a thicker ""invisible social wall"" when trying to approach someone with a laptop because you don't want to bother something important, so very few people even try to start a conversation.<p>When someone's reading a paper, you know they are interested in the day's current news, which makes an easy conversation opener. You know they aren't busy doing their taxes or writing a paper.",1267073411
1150027,comment,1148707,1149940,0,0,davemc500hats,,,"i'm pretty sure that's incorrect, as the existing EB-5 visa allocations have a specific target of 10,000 visas (which are currently not even close to being used up, only ~1,000 are used every year).<p>if anything, prioritization is likely to work the other way: \nEB-1s first, then EB-2s, EB-3s, etc. see language below for EB-1 priority visa workers (with ""extraordinary abilities""):\n  <a href=""http://en.wikipedia.org/wiki/EB-1_visa"" rel=""nofollow"">http://en.wikipedia.org/wiki/EB-1_visa</a><p>note: i am not an immigration lawyer (IANA[I]L).<p>you may also wish to review language for the Immigration Act of 1990:\n  <a href=""http://en.wikipedia.org/wiki/Immigration_Act_of_1990"" rel=""nofollow"">http://en.wikipedia.org/wiki/Immigration_Act_of_1990</a>",1267073395
1150026,comment,1148707,1149937,0,0,kvs,,,"Why couldn't your friend apply in EB-1 or EB-2?",1267073357
1150025,comment,1149865,1150011,0,0,pvg,,,"<i>token allocation tweaks take years to take effect</i><p>This is mostly a function of a particular method of token allocation, rather than a property of the tokens. There are entire lines of work where the allocation is quite elastic - people who work on commission, people who make a significant part of their income based on performance bonuses, etc. Even at start-ups, in my experience, bonuses for important milestones are not all that uncommon, even if they often are, well, token.",1267073321
1150024,comment,1149501,1149501,0,0,va_coder,,,"I assume the the signature at the end ""-Jeff"" was Jeff Bezos.  If so, that's pretty impressive that the CEO knows so much about technology.",1267073154
1150023,comment,1148707,1149937,0,0,davemc500hats,,,"i'm saying that solving INS processing times by not introducing new visa legislation is a rather ass-backwards perspective.<p>furthermore, the job creation / economic output benefits don't need to wait for green card processing to be solved.<p>there's being practical, and then there's simply being defeatist.<p>i'd rather be part of trying to provide solutions to INS processing times than to wait on innovative solutions to job creation & immigration reform.",1267072935
1150022,comment,1149555,1150001,0,0,carbon8,,,"I often spend all afternoon at various cafes, buying a $2-4 drink every 1-2 hours.<p>Most people with laptops spend 1-2 hours. You'll get people working longer in the mid morning and mid afternoon. People who show up with laptops at 2 (1:30-2 is a common transition period), for instance, seldom stay past 5/5:30 (another common transition period). 5 or 6 hours tends to be the upper limit; most people can only sit in the same spot for so long. Obviously, it's very rude to this without buying drinks at regular intervals.<p>At many cafes, people that are ruder about it are almost never regulars. Any cafe that's popular enough to be filled up will have a network of regulars. Regulars chat, share books, go out for drinks and, among the programmer regulars, chat about startups, collaborate on projects or hire one another for contract work. You'd probably not be able to recognize it if you go in and people are all reading and on laptops at the time, but if you start frequenting it you'd start to pick up on it",1267072927
1150021,story,,,1,0,mhb,"ESPN Sets Sights on Different Way to Show Olympics",http://www.nytimes.com/2010/02/25/sports/olympics/25television.html?hpw,,1267072762
1150019,comment,1135610,1136077,0,0,jessriedel,,,"Huh?  The idea would be that, for a percentage-of-your-income loan, poorer people would pay back <i>less</i> and richer people would pay back more (compared to a standard loan).",1267072623
1150017,comment,1148062,1148611,0,0,patio11,,,"Or under three months to fill up my VPS' 20 GB allocation for disk storage and cause further attempts by customers to create bingo cards to throw write errors, bringing my business to a crunching halt.<p>Like I said, yay for logrotate.",1267072473
1150016,comment,1148707,1149939,0,0,eagleal,,,"My fault, I don't know why I confused the <i>permit to stay</i> (expires every 2 years) with <i>permanent residence</i>. Well, in Italy you just need a home and revenue to obtain a permit to stay (work related). The permanent residence or permit to stay doesn't lock you to the first job it was issued for, though.<p>However you can still (with the permit to stay) move between UE countries, just get back to Italy and declare revenue (as entrepreneur).",1267072452
1150015,comment,1149682,1149682,0,0,jessriedel,,,"Why is this on HN?",1267072392
1150014,comment,1149555,1149868,0,0,Tiktaalik,,,"Vancouver's most popular local chain, JJ Bean, has never adopted wireless and they continue to be massively successful based on the quality of their product. They're rapidly expanding.<p>Many other notable cafe's such as 49th parallel also don't have any wireless.<p>I guess it's all up to local culture.",1267072344
1150013,story,,,1,0,mblakele,"The Database Tea Party: The NoSQL Movement",http://www.kellblog.com/2010/02/24/the-database-tea-party-the-nosql-movement/?utm_source=feedburner&utm_medium=feed&utm_campaign=Feed%3A+marklogic+%28Kellblog%29,,1267072250
1150012,comment,1147670,1147878,0,0,dasil003,,,"Fortunately for us geeks, setting up a proxy is no big deal.",1267072249
1150011,comment,1149865,1149980,0,0,patio11,,,"However, empirically we've seen that touching token allocations causes huge amount of resentment and is very, very difficult to do in an elastic manner.  Demands of the business can arise in hours or days, token allocation tweaks take years to take effect.  We've seen that people will react -- within seconds -- to non-token incentives to do things that certainly resemble work.  Blizzard can make a database entry with a few purple pixels attached and <i>wham</i> several million people start doing very repetitive tasks to achieve it.  Think of the business value that could be harnessed if a little alert on my dashboard said ""Hey Patrick, that funky Mersenne Twister re-implementation that has been in purgatory for the last 12 weeks and is now blocking delivery now is offering purple pixels for unit testing!""<p>I know you can game any system for rewards -- it has been a near obsession of mine since a kid, when I found that 89.5% is still an A- and that meant I could still miss 3 homework assignments and not suffer any consequences as long as I did really well on the tests.  Like was mentioned in the video posted yesterday, everyone knows that grades are a game... its just an unsophisticated game that sucks, but nonetheless seems to converge on education for many people.  Grades as a game have always been Pong in a world where Pacman exists... now they're Pong in a world where WoW exists.  (Or even where Farmville exists.)  Holy cow, we can abuse that better.  (""Little Timmy learned 7 * 8 = 56.  Ding, Mathematician Level 14!  <i>Gratz Timmy</i>!"")",1267072207
1150010,comment,1149508,1149678,0,0,joeyo,,,"<i>It doesn't matter whether that guy gets ordered around by a short bald guy and would have been in the Paleolithic, too.</i><p>I don't disagree with the gist of your point, but I just wanted to observe that male pattern baldness is generally correlated with increased testosterone levels. So in a way it's masculine by definition.",1267072161
1150009,comment,1148425,1149702,0,0,pwdfilelocked,,,"- First the fuel source would need to be kept at -160C or so, which is difficult, and would be decidedly impressive upon failure.\n- Second, one of the reaction products is HF gas. If this doesn't mean anything to you, note that HF gas was the -first- substance covered in the ""Things I won't work with"" category. ""And that soaks into tissue very readily, with the acid part doing its damage along the way, and the fluoride merrily poisoning enzymes and wreaking havoc.""",1267072136
1150008,comment,1148707,1149424,0,0,holygoat,,,"And in sales taxes.",1267072112
1150007,comment,1149508,1149508,0,0,matwood,,,"First read ""How To Win Friends and Influence People."" If you apply the rules in the book and are at least an average looking guy you should not have any problems finding dates.<p>Add in some gym time and some pop culture into your daily RSS feeds and you're all set.<p>When you find a girl you like, slowly introduce your geek side.  She'll think it's cute.  Plus, nowadays everyone uses computers in one way or another so any geek tendencies are not going to be that big of a stretch to understand.<p>Really, it's not that hard.",1267072008
1150006,story,,,15,7,alexjmann,"Fleeting Youth, Fading Creativity in Science",http://online.wsj.com/article/SB10001424052748703444804575071573334216604.html?mod=wsj_share_twitter,,1267071959
1150005,comment,1149881,1149934,0,0,cgranade,,,"To my mind, part of the point was that there's no standard way of importing additional libraries. Many modern languages have some sort of symbolic import statement that instructs the interpreter or compiler to add additional libraries to the execution context, but there's no single way of doing that from within JavaScript. Of course, that somewhat makes sense, as you don't want every random site making cross-domain imports and bypassing same-domain policies. At the same time, as the author demonstrates, you can have an agreed-upon API that provides much of the same functionality using XHR, which would make working with multiple libraries from different vendors a lot nicer.",1267071949
1150003,comment,1149865,1149980,0,0,petercooper,,,"The problem with that idea is that eventually people feel entitled to win tokens whether or not they made any achievements. They get so angry at not automatically being given tokens that the government mandates a minimum amount of tokens every employee must win per hour.",1267071826
1150002,comment,1149865,1149973,0,0,ryanelkins,,,"Actually providing rewards decreases performance in creative problem solving. He actually said that it worked really well (""kicked butt"") in getting people to perform simple mechanical skills based tasks.<p>Besides, the point isn't about increasing performance in situations where people are highly engaged regardless, it's about increasing engagement where motivation can wane, especially in more menial type of tasks/jobs.",1267071815
1150001,comment,1149555,1149852,0,0,joezydeco,,,"Maybe I'm not in cafes enough to understand this, but how long are laptop users camping out on tables?<p>I can see if they're checking a quick email while having a coffee, but experiences I've had and maukdaddy above show that people are camping out a lot longer than that first cup.  So are they staying all day?  Are they purchasing more beverages?",1267071778
1150000,story,,,13,0,dwwoelfel,"School superintendant fires entire high school teaching staff",http://www.businessinsider.com/henry-blodget-unionized-rhode-island-teachers-refuse-to-work-25-minutes-more-per-day-so-town-fires-all-of-them-2010-2,,1267071758
1149998,comment,1149800,1149800,0,0,lsb,,,"This is really cool, but something doesn't smell right.<p>1) They give numbers from a single-core CPU implementation, and from a many-core GPU implementation, and they discuss numbers from a many-core CPU implementation as well, like some of the new four- or eight-core chips; without many-core CPU numbers, it's comparing apples to oranges.<p>2) What indices are on the table?  Does the GPU have any indices?  A read-only database is certainly going to have indices, and (hopefully) covering indices for all the big queries.<p>3) SQLite has strongly-typed <i>values</i> not <i>columns</i> (you can stick a string in an integer column and that's just fine) and it seems like they disregarded much of the SQLite type system, only focusing on integer values.  I'd like to know how much time is spent on type checking values.",1267071605
1149997,comment,1149555,1149886,0,0,joezydeco,,,"<i>wireless has made coffee shops so popular that people once again value them as social centers</i><p>You mean social with each other, or social with their online friends?",1267071597
1149996,comment,1148157,1149551,0,0,gecko,,,"We were looking for a good mascot for Kiln, but unfortunately, all of the animals that we consulted were already in exclusive contracts with other products except for <i>Strigiphilus garylarsoni</i> and the inverted flame-weasel, neither of which we felt represented our product well.<p>Late one night in the Kiln alpha period, though, I was hacking around the Mercurial integration, messed up, and suddenly realized that issuing ""hg up"" held the repository at its current version, but moved time itself to match the requested revision.  In other words, I had unintentionally made a time machine out of Mercurial.  After riding a dinosaur for awhile, it hit me that I suddenly had a chance to get Kiln a legitimate mascot.<p>I thought for awhile about where and when to go, then promptly ""hg up""d to the mid 1600s.  I went to the island of Mauritius, and approached the dodo bird.  I explained that, through no fault of the poor bird, it was about to go extinct.  But I had an option: I could ""hg revert"" the thing back into the present, restoring it from extinction, if only it'd be willing to sign an exclusive marketing contract for Kiln.  We negotiated a little bit back and forth, but at the end of the day, as you can see, the dodo happily agreed.  It now lives a life of luxury, and has even taken up recently to hanging around kiwi birds an awful lot.<p>Unfortunately, the current version of Kiln can only restore deleted files, not deleted species, but we still think the dodo--a peaceful bird with no natural enemies, restored to the present--makes a nice mascot.",1267071354
1149995,comment,1149865,1149865,0,0,coffeeaddicted,,,"Your mind always knows if it's working or having fun. Every way to trick the mind in confusing the two fools it at most for a short time, then it catches up. I guess that's because your mind is about as clever as you are yourself (and it knows what you're trying to do!).<p>Also there are already reward systems which are real. I like to be proud of what I do. I like to be rewarded with fair payment. I think stuff like that works better for me than an artificially added point-system.",1267071352
1149994,comment,1149865,1149865,0,0,emilam,,,"There is a HBS Press book that goes into this in detail.\n<a href=""http://www.amazon.com/gp/product/142214657X?ie=UTF8&tag=emilam0e-20&linkCode=as2&camp=1789&creative=390957&creativeASIN=142214657X"" rel=""nofollow"">http://www.amazon.com/gp/product/142214657X?ie=UTF8&tag=...</a>",1267071275
1149993,story,,,9,0,Alex3917,"A good video explanation of Chat Roulette",http://vimeo.com/9669721,,1267071254
1149992,comment,1149865,1149970,0,0,vyrotek,,,"Probably true, but that doesn't mean there isn't a market for such a idea. What do you think the ratio of McJobs to Startups/Google jobs is?",1267071235
1149991,comment,1149865,1149980,0,0,vyrotek,,,"Except those tokens are currently handed out by a person instead of a unbiased machine who could dispense them based on measured progress for some task. Still made me laugh, you get my vote :)",1267071126
1149990,comment,1148338,1148338,0,0,loupgarou21,,,"I'm not a programmer by trade, so I can't relate to that specific interviewing process.  I do have to say though, not all interviews suck.  I've been through a fair number of interviews.  Some have been good, some have been bad, most are somewhere in between.<p>I've been offered jobs for most companies that I've interviewed with.  I have two pieces of advice.  First, be honest.  If you don't know something, tell them you don't know it, but stress that you are willing to learn.  Second, paint with broad strokes, and fill in with details as they ask for them.  And third (I know, I said two,) be prepared, but not rehearsed.  This will help to keep you calmer.  If you are prepared, answers will come easily, but if you're rehearsed, when you start to forget exactly what you were going to say (and you probably will start to forget) you'll have a harder time improvising.",1267071105
1149989,comment,1149861,1149861,0,0,muuy,,,"Wasn't this already submitted a couple hours ago?",1267071103
1149988,comment,1148425,1149222,0,0,berntb,,,"You got all that from the Wiki page? :-)",1267071101
1149987,comment,1149555,1149555,0,0,greenlblue,,,"I applaud the effort. I've always thought of cafes in a romantic way as conversation/idea factories but this illusion is completely shattered when I walk in and people are clanking away at their keyboards. So it's nice to see somebody is trying to bring back the romantic image even if it is just for the weekends.",1267071056
1149986,comment,1148157,1149356,0,0,nollidge,,,"Joel hits on this on the first page (Subversion Re-education).  My understanding, as a DVCS virgin, is that you commit far more often (to your local repository) than with Subversion, and so Hg can more intelligently merge things.<p>My guess is that there is some intelligence that can tell that ""foo missing there, and foo added here"" is actually just ""foo moved from there to here"", unlike SVN, which attempts no such heuristics.  I hope someone can correct me if I'm wrong here :)",1267071030
1149985,story,,,1,0,TheTarquin,"Sieve of Eratosthenes Implemented in CSS",http://azureabstraction.com/upload/files/smurf/random/sieve.html,,1267071011
1149984,comment,1149865,1149980,0,0,Psyonic,,,"There are few times I care about voting, but for this I'd vote 5 times ;)",1267070963
1149983,comment,1148707,1149221,0,0,anamax,,,"> This is true, but you are forfeiting any active management position, authority and likely control, which is basically the same as being fired as CEO.<p>Again - no, being deported doesn't cause any of those things.  The owners of the biz are the ones who make that decison.<p>Since we're assuming that you're being deported because you're not satisfying the conditions of the startup visa, what are the odds that said owners would have kept you on anyway?<p>Advocates of the startup visa said that they wanted to bring folks into the company to create biz.  Fair enough, but what should we conclude when they complain about deporting folks who don't do what they wanted?<p>And, what should we conclude when they make up stories about the consequences of deportation?",1267070906
