ID,Type,Story,Parent,Points,Comments,Author,Title,URL,Content,Created
7395812,comment,7393437,7393929,2,0,datawander,,,"There already are a pair of data-driven journalists at the WSJ whose day-to-day sounds more like a data scientist than a typical journalist.  They are Tom McGinty and Rob Barry.<p>They gave a great talk recently, which I wrote about (shameless plug below), summarizing how they investigated the Asiana airline crash in SF recently and what their day looks like.  They&#x27;re brilliant:<p><a href=""http://datawonder.co/blog/2014/01/15/data-skeptics-wsj-meetup/"" rel=""nofollow"">http://datawonder.co/blog/2014/01/15/data-skeptics-wsj-meetu...</a>",1394752518
7395811,comment,7390638,7394397,1,0,gnaritas,,,"Oh, my bad then, never mind.",1394752514
7395810,comment,7395207,7395735,2,0,Zancarius,,,"> well-stocked spice rack (which costs an initial hundred bucks or so upfront, but depreciation maybe adds at most a couple quarters to each meal).<p>Then there&#x27;s the bulk options for spices you use regularly and in sufficient quantity to keep the quality of your stock reasonably high! Being from the Southwest, that tends to include copious amounts of chili powder, paprika, and a few others for me since I go through them so quickly.<p>I really like your post though. It doesn&#x27;t cost <i>that</i> much to eat well, if you&#x27;re willing to sacrifice some time in exchange. And it&#x27;s probably healthier, too (lower sodium, plus you know more or less what you&#x27;re putting into it).",1394752506
7395809,comment,7384818,7389818,2,0,jmalicki,,,">Curing cancer? There&#x27;s no Federal Department of Stopping >Cancer, either you work for a big pharmaceutical company or >you get a PhD and scramble for grant money.<p>Actually, there is a Federal Department of Stopping Cancer - the National Cancer Institute.<p><a href=""http://www.cancer.gov/"" rel=""nofollow"">http://www.cancer.gov/</a>",1394752462
7395808,comment,7393437,7395678,4,0,danso,,,"The data processing concepts that will be purportedly taught are not tied to any platform or language. I&#x27;ve used Fusion Tables to teach concepts of data and it&#x27;s mostly useful for the built-in mapping capability and the ability to merge tables via foreign key, and the pivot/summary transformations. It&#x27;s not <i>just</i> that beginners lack the tools to do these in SQL/Access/R/etc., it&#x27;s that they don&#x27;t even know what these concepts are, or what the value in them are.<p>If you don&#x27;t know <i>many</i> data concepts, then this course is probably worth taking. Then apply them to your datasets wherever they may be stored",1394752447
7395807,comment,7392759,7394498,2,0,gnaritas,,,Agreed.,1394752445
7395806,comment,7394767,7394767,1,0,jonalmeida,,,"Neat, but maybe another font or less image compression (or lack of anti-aliasing?). The images look blurry to me.",1394752442
7395805,comment,7395207,7395756,2,0,jonnybgood,,,"Don&#x27;t confuse demand for hype. There&#x27;s a demand to have a trial phase with the product, but not for the actual product itself. We&#x27;ll see if there is actual demand once that phase is over.",1394752440
7395804,comment,7395207,7395780,2,0,pbreit,,,"&quot;They are going about picking nutrients the way I...&quot; pick groceries at the market?",1394752433
7395803,comment,7394131,7394587,2,0,sehr,,,"I&#x27;m not saying he deserves the benefit of the doubt, but if we were all judged by our actions at age 19 everyone&#x27;s credibility would be hurt.",1394752423
7395802,comment,7394465,7395240,0,0,devcpp,,,"Well, it <i>is</i> a publicly-traded company now. When a shareholder sees the opportunity to make a dime, he&#x27;ll seize it.",1394752420
7395801,comment,7395207,7395735,3,0,desigooner,,,"I&#x27;d suggest people to go shopping at your local ethnic store for spices vs. buying pre-packed spice racks or those tiny spice bottles from whole foods or your local markets.<p>You&#x27;ll get X times quantity for 1/Yth the cost.  The same goes for Lentils, Beans and Rice",1394752417
7395800,comment,7393416,7395517,4,0,karangoeluw,,,"I am moving about 5 gigs worth of data from Box to GD. No glitches, no hogging. GD is taking about 62 Mb of memory and is pretty consistent around there.",1394752412
7395799,comment,7392665,7394091,1,0,notastartup,,,"whoa that is seriously awesome tool! how do you build such excel plugins? have you also thought about listing it on the microsoft office store?",1394752364
7395798,comment,7394986,7394986,2,0,rthomas6,,,"Is &quot;torture&quot; here waterboarding only or something even worse? I&#x27;m not condoning waterboarding, but it&#x27;s already unofficially common knowledge. What other &quot;enhanced interrogation techniques&quot; were used under approval?",1394752345
7395797,comment,7395045,7395559,8,0,AYBABTME,,,"I&#x27;ve cleanly used that in a lil&#x27; game I&#x27;m working on.<p>Players send their move to the game on a channel they expose through Move(). They\nreceive regular updates of the game state on a channel they expose through Update().<p><pre><code>    type Player interface {\n        Name() string\n        Move() <-chan Move\n        Update() chan<- State\n    }</code></pre>\n> <a href=""https://github.com/aybabtme/bomberman/blob/master/player/player.go#L30-L34"" rel=""nofollow"">https://github.com/aybabtme/bomberman/blob/master/player/pla...</a><p>The game reads the player moves, if moves are available[1]:<p><pre><code>    for pState, player := range g.Players {\n        if pState.Alive {\n            select {\n            case m := <-player.Move():\n                movePlayer(g, board, pState, m)\n            default:\n            }\n        }\n    }\n</code></pre>\n> <a href=""https://github.com/aybabtme/bomberman/blob/master/bomberman.go#L250-L251"" rel=""nofollow"">https://github.com/aybabtme/bomberman/blob/master/bomberman....</a><p>The game sends each turn&#x27;s update to players that are ready to listen for it:<p><pre><code>    for pState, player := range game.Players {\n        pState.Board = board.Clone()\n        pState.Turn = game.Turn()\n        select {\n        case player.Update() <- *pState:\n        default:\n        }\n    }\n</code></pre>\n> <a href=""https://github.com/aybabtme/bomberman/blob/master/bomberman.go#L262-L269"" rel=""nofollow"">https://github.com/aybabtme/bomberman/blob/master/bomberman....</a><p>This leans to surprisingly clean implementations:<p><pre><code>  * A websocket player [2]\n  * A keyboard player [3]\n  * A random AI player [4]\n</code></pre>\nNote that the rest of the game (`bomberman.go`) is a hairy ball that needs refactoring.<p>[1]: this, to prevent an unresponsive player from hanging the game, or an AI player\nfrom unfairly computing longer than it&#x27;s opponent<p>[2]: <a href=""https://github.com/aybabtme/bomberweb/blob/master/player/player.go"" rel=""nofollow"">https://github.com/aybabtme/bomberweb/blob/master/player/pla...</a><p>[3]: <a href=""https://github.com/aybabtme/bomberman/blob/master/player/input/input.go"" rel=""nofollow"">https://github.com/aybabtme/bomberman/blob/master/player/inp...</a><p>[4]: <a href=""https://github.com/aybabtme/bomberman/blob/master/player/ai/random.go"" rel=""nofollow"">https://github.com/aybabtme/bomberman/blob/master/player/ai/...</a>",1394752342
7395796,story,,,2,0,unsupak,"Crowdsource Help in finding the missing Malaysian Airliner",https://www.digitalglobe.com/,,1394752325
7395795,comment,7395288,7395288,1,0,Battochon,,,"Damn! I thought I would have some up votes with this one! Too bad... next time! But Green Programming is a pretty important topic I think!",1394752297
7395794,comment,7395207,7395702,4,0,teebrz,,,"It&#x27;s not hard too eat so that it only costs ~5$ a day depending on your situation. Most simple meals like a sandwich or some pasta can be made for ~1$ and a little more effort. Where I live in Philly a little ad hoc produce stand sets up right down the street regularly with very cheap produce. 5$ would buy lettuce, some apples, carrots, potatoes, etc - enough for a couple days. I can go to the Italian market and get cheap rolls and meat. The Amish and Mennonites have markets around. There are grocery stores where I can get bags of beans, rice, and other staples very cheap.<p>The problem is if you&#x27;re in a situation where it&#x27;s like you get 5$ at the beginning of each day, you can&#x27;t buy in bulk and save. Likewise if you live in a &quot;food desert&quot; it&#x27;s harder to shop.",1394752282
7395793,story,,,1,0,iffycan,Filefile,https://github.com/cobyism/Filefile,,1394752274
7395792,comment,7395207,7395558,1,0,amckenna,,,"With a steady supply line and a better understanding of demand after initial launch the supply line can be smoothed out and cheaper methods of transportation can be employed. Right now they are paying to speed up the process and make up for lost time.<p>I&#x27;m not going to speculate on its future success but even if it lands amongst the diet shakes it would be in a multi billion dollar market.",1394752261
7395791,comment,7393416,7395366,4,0,robzyb,,,"I entirely agree with this. I am surprised that no one brought it up earlier.",1394752213
7395790,comment,7395629,7395723,1,0,jonalmeida,,,"I had no idea this was a thing..",1394752176
7395789,comment,7395207,7395772,1,0,nsxwolf,,,"You can look at my comment history and see that I never post comments like this.<p>This is an exception because I find this so utterly repulsive and repugnant.<p>Somewhere deep down in my soul I find this just anti-human, like a bunch of transhumanist lemmings that can&#x27;t wait to jump off the whole humanity train so they&#x27;re going to start by eliminating food. Next comes truth, followed by beauty.",1394752174
7395788,story,,,1,0,acdha,"The US National Archives is looking for crowdsourcing innovators",http://blogs.archives.gov/aotus/?p=5396,,1394752133
7395787,comment,7394022,7394938,1,0,jsankey,,,"I actually prefer Android as a user.  But if I&#x27;m building native (instead of HTML5), it&#x27;s because I want a polished UI, and that is easier to deliver on iOS where there are only a handful of devices to test against (in particular screen resolutions).  Assuming the app goes well on iOS then I&#x27;d happily take on the extra effort of an Android version.",1394752120
7395786,comment,7395563,7395563,1,0,b0b0b0b,,,"The article doesn&#x27;t offer much on <i>how</i> it became a hit.<p>I learned about Papers Please from nerdcubed on youtube:  <a href=""https://www.youtube.com/watch?v=sV-6YSye2Vo"" rel=""nofollow"">https://www.youtube.com/watch?v=sV-6YSye2Vo</a><p>I bet he hasn&#x27;t spent anything on, say, a google ad campaign.",1394752114
7395785,comment,7394131,7395263,3,0,rayiner,,,"You&#x27;re mixing together two different hypotheticals.<p>In your first one, you have someone provacatively dressed. In this hypothetical, the government isn&#x27;t a rapist escalating their level of access, but someone on the street who can see the same thing everyone else does. I.e. the government isn&#x27;t using your Facebook posts as justification for hacking into your computer. If it has access to something, so do hundreds of people at ATT, Google, or FB. There&#x27;s no escalation beyond what you&#x27;re broadcasting into the world.<p>In your second one, you have a serial monogomist. But showing anything special to a boyfriend or girlfriend is a 1:1 interaction, even if you do it thousands of times. But the government isn&#x27;t claiming access to your emails on the theory you regularly email hundreds of people. Web mail or a Facebook post isn&#x27;t 1:1, but rather something in which you invite hundreds of unknown people into any single interaction.<p>You can&#x27;t mix and match bits of each analogy to avoid the distinctions that keep each one from fitting the situation you&#x27;re trying to compare it to.",1394752106
7395784,comment,7395207,7395701,1,0,nsxwolf,,,"I&#x27;m just hoping it isn&#x27;t successful. I&#x27;m not looking forward to a future where a co-worker at lunch time says &quot;No thanks, brown-bagging it today!&quot; and guzzles it down.",1394752064
7395783,comment,7394465,7395118,2,0,camus2,,,"Except they have the money the buy any latest hyped app.",1394752048
7395782,comment,7394959,7394959,3,0,singingfish,,,"We&#x27;ve been doing well encapsulated, tricky back end stuff for a while.  Started with angular over the last month.  Angular basically achieves the same proper separation of concerns that our perl-based back end tools do.<p>Angular is not really interesting because it&#x27;s the new big thing.  It&#x27;s really interesting because it&#x27;s right.  (bitch of a learning curve though).",1394752045
7395781,story,,,2,4,ztratar,"Ask HN: What are the best prototyping tools?",,"I want to go from idea to clickable prototypes <i>very</i> quickly. Fidelity doesn&#x27;t need to be extreme, but having the option to overlay images or styles (or better yet, simply paste in images) would be awesome.<p>What tools do you use? Why are they great?",1394752029
7395780,comment,7395207,7395498,4,0,dxbydt,,,"Wow, what a crazy thread! They are going about picking nutrients the way I would go about picking some web framework. Hey lets pick Rails what dynamic languages no way ok how about Servlets no way dude no semicolons for me ok then how about Play dude its like so boilerplatey ok fine how about scalatra fine scalatra it is. There&#x27;s no thought that some human is actually going to put this thing in his mouth, what effects its going to have on his health and well-being. Nutrition as a Service.",1394752021
7395779,story,,,13,2,qzervaas,"Is My Shift Key On Or Not (iOS 7.1)",http://ismyshiftkeyonornot.com/,,1394752019
7395778,comment,7391369,7392013,1,0,dllthomas,,,"Wouldn&#x27;t this strictly only apply to IP <i>destination</i> headers?",1394752009
7395777,comment,7394879,7394879,23,0,ACow_Adonis,,,"I am what you might call a speed-reading skeptic.<p>Like most of us, by which i mean intellectual types who define our selves and worth in part by the relative level of our perceived knowledge, speed reading seems like a holy grail.  There&#x27;s so much out there to read, and not enough time in my life to do it.  But it is to us as fad diets/exercise regimes to people who care primarily about their looks/weight.<p>I say this because its apparent I&#x27;m a relatively fast reader, i have to read a lot for work, and i have professional colleagues to compare myself to.  In all these speed-reading fads in professional environments, I&#x27;ve never actually met a single person, NOT ONE, who can actually read these materials faster than an intelligent, well read person.  (barring perhaps abnormalities like Kim Peek, but newsflash, you know if you&#x27;re Kim Peek and if you are/aren&#x27;t, there&#x27;s not much you can do about it).  Get someone into an actual environment where they have to read lots of stuff, have to comprehend it, and its professionally demonstrable, and suddenly all the &quot;speed readers&quot; vanish.<p>Do you know why I&#x27;m a relatively fast reader?  I&#x27;d say probably: a) genetics b) reading a lot.<p>b) is about the only thing I&#x27;ve seen that has a big effect and is demonstrable, and is in our control.  The fastest readers read a lot.  The slowest readers don&#x27;t.  Those who didn&#x27;t read a lot, and then started reading, got faster.<p>And barring genetic abnormalities and usual statistical variance, no one I&#x27;ve met, EVER, has been able to read more than 3/4/5/6 hundred words per minute with accurate comprehension.<p>Which brings us of course, to the comprehension debate.  Lets avoid the ridiculousness of the comprehension stats that are usually poorly designed and created by people trying to sell you things, they are worth about as much as fad diet testimonials and figures.  And this is where a lot of speed reading salesmen try to get you.  &quot;I can read this at 1000 wpm with just slightly less comprehension!&quot;.  &quot;I can skim and pull out the important parts really fast!&quot;.<p>To which my feelings can be summed up: Anyone can purport to increase their reading speed by including words they didn&#x27;t read or comprehend in their wpm.  Frankly, if you are not reading something with %100 comprehension, you are not reading it.  Taking a sample and taking a census are two different things.  That you can take a 10% sample in 10% of the time does not make you a &quot;speed-census-taker&quot;.  Ditto skimming, summarizing, or any other weasel-word used to gloss over the fact that someone is trying to speed up their &quot;reading&quot; by reading or comprehending less.<p>I&#x27;m not saying skimming doesn&#x27;t exist.  I am saying its not the same as reading/comprehending, and that &quot;speed-readers&quot; show heavy drops in comprehension.",1394751995
7395776,comment,7393416,7393565,1,0,pete_aykroyd,,,"Even if google were to shutter this in 5 years, there&#x27;s not _that_ high of a cost to switching. In the end, it&#x27;s just your files. You can move them.<p>I&#x27;m more concerned with whether their software is any good. I tried it a while ago and it didn&#x27;t even come to close to dropbox even in terms of syncing, let alone the other things that dropbox has done.",1394751961
7395775,comment,7394465,7394465,1,0,ilolu,,,"So how is facebook going to show value to advertisers from this ad format ?. I could scroll beyond the ad and it might even play to completion.",1394751915
7395774,comment,7390736,7391513,1,0,sosborn,,,"To be fair, the earned income tax exemption is sufficiently large enough that you will be making six figures before you have to pay a penny in U.S. tax. You still have to file though.",1394751906
7395773,comment,7394022,7395364,1,0,emeraldd,,,"For small stuff, their entry level 5$ a month droplet is perfect and pretty much beats anything else I&#x27;ve come across.  Having SSD backed storage is nice too.",1394751905
7395772,comment,7395207,7395634,4,0,diminoten,,,"How is this the kind of comment you&#x27;d expect to leave on HN?<p>&quot;I hope it goes away, its name sucks, and using it would literally make me vomit.&quot;<p>Astounding commentary, nsxwolf. I look forward to hearing from you soon.",1394751899
7395771,comment,7394465,7394465,4,0,matthuggins,,,"Yeah, I called it as soon as they started auto-playing friends&#x27; videos in our news feeds.  They were clearly just getting us accustomed to the idea of stopping scrolling so they know we&#x27;ll see these ads.",1394751880
7395770,comment,7393416,7395628,3,0,AceJohnny2,,,"1. might be for automatically creating a .pdf from a .doc file at a URL you can then share with others. The doc->pdf conversion falls under the &quot;reproduce, modify, create derivative works&quot; legalese, and the URL creation that others can access through the autogenerated &quot;secret&quot; (which isn&#x27;t, legally, it&#x27;s public) falls under the &quot;communicate, publish...&quot; legalese. I&#x27;m taking this explanation from a similar one that Dropbox themselves (IIRC) published about their own terms of service that had users outraged!<p>However, I fully agree with you about the suspicious point 2.",1394751868
7395769,comment,7394959,7395113,1,0,camus2,,,">  Performance is a big one for many.<p>Given how poor Angularjs performs that&#x27;s not really the point of Angular.<p>>  such as use of global DOM selectors like $(&#x27;.foo&#x27;).<p>Which is perfectly valid especially when doing event delegation.<p>The point of Angular is not to replace jQuery,the point of Angular is to have a clean way to integrate DOM manipulation into pages that have a complex application logic. Something devs should do with or without AngularJS,just that Angular forces (some) S.O.C.*<p>But one still does DOM manipulation in directives. with jQLite BUNDLED with Angular. AngularJS is no magics ,AngularJS has its own limited jQuery. Makes sense because the unique point of jQuery is DOM manipulation,not building applications with complex logic.<p>So people saying &quot;I replaced this fairly large jQuery app with AngularJS&quot; are lying, You cant write a &quot;fairly large app&quot; just with jQuery,You need to roll your own framework on top of it, at least.<p>* : My advice to anyone jumping in the next framework bandwagon is never couple your application logic to any framework. But that&#x27;s what we see with AngularJS, everything in controllers or services tied to AngularJS apis... so much for separation of concerns...",1394751850
7395767,comment,7395198,7395557,9,0,bri3d,,,"&quot;IT&quot; is too vaguely defined to mean much anymore, but based on this interview I suspect it&#x27;s internal infrastructure at Netflix. Stuff like staff PCs, internal data warehouses, sales, finance, and marketing software support, WiFi APs, routers, keeping the backoffice servers and network up, ensuring reliable WAN and LAN connectivity so engineers can reach production securely, intrusion detection and analysis, and so on.<p>Generally in smaller software companies I hear R+D and consumer-facing applications referred to as &quot;engineering&quot; with external-facing infrastructure (like the production datacenter) referred to as &quot;operations,&quot; with &quot;IT&quot; being reserved for this internal backoffice kind of stuff.<p>In other places, especially larger corporations, I&#x27;ve often heard everything having to do with a computer lumped in as &quot;IT.&quot;",1394751829
7395766,comment,7393329,7393329,1,0,bluecalm,,,"Maybe I am just older and grumpier every day but every UI change Google does be it Hangouts, Youtube, Gmail, Maps and now Search make their services less attractive and less comfortable to use.\nI like underlined links. It was easier to distinguish between actual links, descriptions and ads. Now it take more focus from me to just skim the results looking for the right one. Sucks!",1394751816
7395765,comment,7392237,7392237,1,0,jgalt212,,,"I&#x27;m not a lawyer, but I think this guy&#x27;s analysis is off the mark.<p>Consider this simple example:  If what he says is true, there would be no market for used equipment because no one would buy such equipment for fears of blanket liens pulling the equipment back in cases where the seller becomes insolvent at some point down the road.  And if history is any guide, given a long enough time horizon, a sizable percentage of businesses become insolvent.<p>I think what he may be thinking about are fire sales.  i.e. when an insolvent business sells assets, the bank has first claim to the proceeds, or can block such sales from occurring at distressed prices.",1394751812
7395764,comment,7394879,7395504,2,0,cowsandmilk,,,"> my quick search on google scholar i&#x27;d say there are way more than a handful of papers on reading comprehension at high speeds.<p>The Rayner paper is what is called a review. It has 19 pages of references to hundreds of papers on the topic that Rayner has read so the nonexpert does not have to.<p>Generally, reviews are much better sources than individual papers for the non-expert to read because the author has gone through the literature to understand the feuds and arguments and how they have played out. In my field, I regularly have people try to send me papers that were thoroughly thrashed as wrong over a decade ago. That is generally what happens when a non-expert tries to dive into the primary literature blindly without understanding the general framework and consensus that a good review provides.<p>All that said, it is very hard for a non-expert to tell whether a review is good or not. It is a conundrum.",1394751793
7395763,comment,7394828,7394828,2,0,itafroma,,,"When I look at the page now, I see a number of leading, loaded talking points that—to me—are anything but balanced:<p>- The Winter Olympics is inherently elitist<p>- seatbelt fines are a joke - people should be responsible for their own safety<p>- Is it fair that a family should be given $200000 because their situation made for a good news story?<p>- Its ok for parents to drug their children on long flights<p>It&#x27;s understandable that a site full of user-generated content is going to have some content that&#x27;s detrimental or counter to the site&#x27;s goals (in this case, fostering opinions that are &quot;aware and respectful of the other side&quot;[1]), but I would consider curating the front page so that stuff doesn&#x27;t appear front and center to color a first impression.<p>[1]: <a href=""https://www.saysaw.org/about"" rel=""nofollow"">https://www.saysaw.org/about</a>",1394751786
7395762,comment,7394022,7395527,2,0,thaumaturgy,,,"Oh, bravo. That is nice. It took me a moment to figure out.<p>For others: PHP allows you to increment strings, and if you try to do that, it follows Perl&#x27;s habits (<a href=""http://perldoc.perl.org/perlop.html#Auto-increment-and-Auto-decrement"" rel=""nofollow"">http://perldoc.perl.org/perlop.html#Auto-increment-and-Auto-...</a>):<p>&quot;If, however, the variable has been used in only string contexts since it was set, and has a value that is not the empty string and matches the pattern /^[a-zA-Z]<i>[0-9]</i>\\z/ , the increment is done as a string, preserving each character within its range, with carry...&quot;<p>So &quot;0wz&quot;++ becomes &quot;0xa&quot;, &quot;0xa&quot;++ becomes &quot;the hexadecimal representation of 10, plus one&quot;.<p>I learned something new today.",1394751785
7395761,comment,7392404,7394291,1,0,noblethrasher,,,">which isn&#x27;t really possible if you&#x27;re rendering html in the server.<p>It&#x27;s not only possible, it&#x27;s pretty trivial in most cases. Just endow each user facing object with a .ToHTML() and .ToJSON().<p>This is actually one of the core benefits of REST, you send me a request for a resource along with some desired media type(s), and I send you back a representation in the media type of your choice (or as close as possible).",1394751777
