ID,Type,Story,Parent,Points,Comments,Author,Title,URL,Content,Created
7395988,comment,7394879,7395777,6,0,jacobolus,,,"> <i>Frankly, if you are not reading something with %100 comprehension, you are not reading it.</i><p>This is too dogmatic to be (IMO) a useful definition for the unadorned word “reading”.<p>After all, what does it even mean to comprehend something 100%? Without being inside the author’s head (and perhaps not even then) it’s impossible to know all of the ideas associated with every word and phrase by the author at that particular moment, or the precise rhythm and intonation the author would use in saying the words aloud, or the precise feelings the author was trying to evoke.<p>Or for that matter, is it possible to comprehend something 100% without deeply thinking about what it means to the reader, all the ideas and feelings the words (in context with the rest of the world at the moment of reading) dredge up. For instance, I personally can’t read something in a truly deep way, and really know what I think about it, without writing (often lengthy) comments of my own. But I wouldn’t say that shallower types of reading aren’t still “reading”.<p>Language inherently distorts thoughts, which are impossible to perfectly package and unpackage in a serial format.",1394754377
7395986,comment,7393697,7394355,2,0,mattchew,,,"> And yes, there are some parents who do a great job homeschooling; I&#x27;m sure of it. I&#x27;ve just never met them, and I was extensively involved in local homeschooling programs back in my home town, so I interacted with dozens of homeschooling families, hundreds of homeschooled kids, and visited some of the organized conventions and programs that involved thousands more.<p>If you have interacted with this many homeschoolers and never met any you thought were doing a great job, this might indicate something about homeschooling. Or, it might indicate something about you.",1394754339
7395985,comment,7395207,7395760,1,0,DonGateley,,,"Have they published a bulk cost breakdown?  From what I&#x27;ve read the price seems too high but I&#x27;d like to see the data.<p>It&#x27;s impact on poverty world wide could be like the potato was to Europe and the Islands.  On second thought...",1394754325
7395984,comment,7394828,7395225,1,0,dictum,,,"So delightfully Web 2.0.<p>To see how the average aesthetic of the web has changed, compare jyte, <a href=""http://web.archive.org/web/20070622000055/http://janrain.com/"" rel=""nofollow"">http://web.archive.org/web/20070622000055/http://janrain.com...</a> and <a href=""http://web.archive.org/web/20070620031338/https://pibb.com/"" rel=""nofollow"">http://web.archive.org/web/20070620031338/https://pibb.com/</a> to <a href=""http://janrain.com"" rel=""nofollow"">http://janrain.com</a>",1394754322
7395983,story,,,2,0,brazzy,"A Walk in the Sun (1991)",http://www.baenebooks.com/chapters/0671878522/0671878522___1.htm,,1394754314
7395982,comment,7395198,7395962,5,0,dataisfun,,,"Thanks for tip. These are now expanded in interview text :)",1394754313
7395980,comment,7395968,7395968,1,0,suyash,,,"Here is various photos from Google Search? Which one do you guys prefer?: <a href=""https://www.google.com/search?q=ergonomic+chair+and+computer&qscrl=1&source=lnms&tbm=isch&sa=X&ei=2EIiU4nZDsqU2QWMzoDgBg&ved=0CAkQ_AUoAQ&biw=1560&bih=979"" rel=""nofollow"">https://www.google.com/search?q=ergonomic+chair+and+computer...</a>",1394754305
7395979,story,,,6,3,thecombjelly,"Show HN: a web app to track when your food will go bad",,"http://wasteless.io<p>A web app to keep track of when your food expires. Grew out of a CLI program I made for myself.<p>It was also an experiment with writing a webapp purely in Common Lisp. It comes with the full source code [0] as well as source code from some CL libraries that I spun off on the way.<p>libs:<p>cl-config: library for managing configuration settings loosely based on the BSD model. [1]<p>cl-init: library for integrating your common lisp program into an OS&#x27;s init system. Manages starting and stopping the services as well as setting up a swank/slime interface. [2]<p>pg-sessions: a library that sits on top of hunchentoot and the postgres library postmodern to store and manage sessions in a postgres database. [3]<p>[0] https://bitbucket.org/thomashintz/wasteless/src<p>[1] https://bitbucket.org/thomashintz/cl-config/src<p>[2] https://bitbucket.org/thomashintz/cl-init/src<p>[3] https://bitbucket.org/thomashintz/pg-sessions/src",1394754299
7395976,comment,7395207,7395668,1,0,Noxchi,,,">1) outside of a really small group of people (unless I&#x27;m mistaken?)<p>You are mistaken. Haven&#x27;t you seen commercials for those &quot;breakfast drinks&quot;? That&#x27;s what this is pretty much.",1394754264
7395975,comment,7390736,7390736,2,0,runewell,,,"Yeah, our tax/employment/visa system sucks, although European rumors of our impending demise are greatly exaggerated. If you&#x27;re not from the USA it is understandable that you may not be aware of the nightmare that is our state legislation. Our states are like grumpy siblings in the big dysfunctional family we call our nation. They each have their own method of handling taxation and employment and each have their own irrational set of processes. As a nation we could certainly improve the way we handle such matters.",1394754256
7395974,comment,7395644,7395948,1,0,AnimalMuppet,,,Agreed.,1394754247
7395973,comment,7390736,7393390,2,0,philiphodgen,,,"The intersection of bitcoin and business and tax is an interesting place to be. Governments will, I think, want to reach out and smother Bitcoin with a pillow. How you prepare for that is an interesting question. He said. :-)<p>In choosing where to form a corporation you have to think about the protection that the country offers you.<p>My prediction is that after the USA has beaten Swiss banks into a pulp they will start marching through the Carribean. What is a tiny country going to do when Uncle Sam&#x27;s minions land with a thud?",1394754233
7395972,comment,7395644,7395920,6,0,saraid216,,,"> Can we climb down from the overheated rhetoric? It smells like propaganda.<p>And your comment smells like shilling. If we&#x27;re making baseless accusations.",1394754230
7395971,comment,7395563,7395563,8,0,danso,,,"I love this game, though I haven&#x27;t completed it for all of the endings. I love the idea and the design, that is...first of all, Lucas Pope is the developer I aspire to be...able to singlehandedly dream up a concept and execute it, <i>and</i> be totally personable on Twitter to the mass of fans he deservedly generated.<p>I fell in love with the game ever since I saw the YouTube trailer and read some of his game dev diaries...It&#x27;s hard to think of a modern game that has such limitations -- the color palette, the clunkiness of the interface, the unforgivingness of the scoring system -- for such artistic intent.<p>But what I think is particularly noteworthy and inspiring was how Pope didn&#x27;t make the game as a political statement. He (from what I remember in his early podcasts) thought about the idea while waiting in customs, and wondered if a game could be made of the drudgery of this work. His commitment to making a game that excelled <i>as a game</i> resulted in a game that was actually <i>fun</i>, while being an artistic achievement and politically engaging, for sympathizers of both the state and the refugee.<p>(As counter-examples, I think &quot;Cart Life&quot; is also an amazing achievement in art, but not a very good game because of  unintentional bugs. Also, most artistic games in which you mostly just walk around until the game ends).<p>David Simon, who created &quot;The Wire&quot;, complains quite bitterly that his intent was to make a show that raged against institution and bureaucracies, and yet people only talked about Omar and all of his other characters...Simon did such a great job of plot and characterization that it overshadowed his political aims. I kind of see &quot;Papers, Please&quot; as the opposite of that...Pope just wanted to make a great game, and he did such a great job of it that it turned out to have a compelling political message.<p>Anyway, it has my vote for being included in the MoMA&#x27;s video game collection. And it&#x27;s inspired me to go back into games programming, at least as a hobby.",1394754229
7395970,comment,7380754,7382911,1,0,robflynn,,,"That makes me happy.  Sounds like you came into it just as I was stepping away. I pretty much stayed through the name change and then split. :)",1394754227
7395968,story,,,2,1,suyash,"Ask HN: Most ergonomic setup (chair and computer)?",,"What is your preferred chair at home/office? PLease share photo if possible or details that others can find helpful. The purpose of this ASK HN is to get a nice chair to avoid back pain and wrist problems.",1394754204
7395967,comment,7380754,7384119,1,0,robflynn,,,"Sorry, you&#x27;ve got the wrong number.  Hello, Tmobile??",1394754192
7395966,comment,7390736,7392906,1,0,tormeh,,,"Probably easier in Europe, is my guess. Few first-world countries are worse than the US. Note that the EU is not a uniform place, so you need to do a bit of research on which country you want. As noted previously, the Scandinavian countries are good places to start. They all speak English as well, knowledge of the relevant Scandinavian language is not required for basically anything.<p>I would assume the same is true for Switzerland and The Netherlands. Think twice before going for Germany (a popular choice for many good reasons not including bureaucracy) and don&#x27;t even consider the southern countries.",1394754191
7395965,comment,7390857,7394977,1,0,apu,,,"Yes, capacity is intimately tied to VC dimension; in particular, VC dimension is one way to measure capacity. See the Wikipedia article for more information: <a href=""http://en.wikipedia.org/wiki/Vc_dimension"" rel=""nofollow"">http://en.wikipedia.org/wiki/Vc_dimension</a><p>I&#x27;m not an expert on deep learning (although I generally understand how they work on vision problems), so I&#x27;m not sure if you can precisely measure the capacity of deep networks. Informally, the primary number that seems to matter is the number of parameters in the network that have to be learned. This paper quotes that at &quot;more than 120 million&quot;.<p>SVMs, in contrast, typically work with feature dimensionalities (i.e., # of parameters) that are on the order of 1,000 - 100,000. You can&#x27;t directly compare these numbers because there are various non-linearities involved, but this deep learning network is definitely much higher capacity than an SVM would be with normal feature dimensionalities.",1394754189
7395964,comment,7395726,7395726,2,0,AnimalMuppet,,,"Absolutely.<p>And for this reason, an app has to be <i>significantly</i> better for it to be worth the bother to switch.",1394754185
7395963,comment,7380754,7383570,1,0,robflynn,,,"Thanks! :)",1394754177
7395962,comment,7395198,7395198,6,0,numlocked,,,"The jargon and acronyms in this interview are intense. It&#x27;s pretty clearly an industry interview so it&#x27;s my fault that I don&#x27;t know the phrases, but I&#x27;m a little surprised by how impenetrable it is to me (a software engineer who has worked in large corp environments).<p>Anyway care to expand on some of the less Googleable acronyms?<p>- MDM/MAM<p>- NAC<p>- EDW (synonymous with ETL?)",1394754171
7395961,comment,7394828,7395750,1,0,ilyanep,,,"This is an awesome idea! I like thinking of arguments/debates as almost like a logical/mathematical argument (thanks to a lot of people, but most recently Day9 of Starcraft community fame) and this would make that explicit and therefore quite cool, in my opinion.",1394754155
7395960,comment,7395207,7395918,1,0,zacinbusiness,,,"I&#x27;m not making comments, I&#x27;m asking a legitimate question. If you have the means, the time, and the ability to make a meal for yourself then what provides the motivation to say &quot;Nah, I&#x27;d rather eat this.&quot; For example, most folks on HN have the means, the time, and the ability to build their own custom computer rig. Some choose it, and some choose not to and for various reasons such as they simply don&#x27;t need a custom rig, or they aren&#x27;t sure that their craftsmanship will yield a better result than a store bought product and so forth and so on. So, when it comes to food (which is infinitely more important than what computer system you&#x27;re using) what is the motivation for drinking a paste of dubious origin vs. eating solid food that you build yourself?",1394754148
7395959,comment,7395644,7395920,6,0,ryandrake,,,"Also, cars are not killing people. Drivers are. Unless we&#x27;re talking about self-driving cars that spontaneously turn themselves on, back down the driveway, and mow down pedestrians on their own.",1394754137
7395958,comment,7395644,7395947,0,0,kiba,,,"If there&#x27;s a way to increase safety, I am sure that they had thought of it.",1394754135
7395957,comment,7395644,7395920,3,0,downplay,,,"In 1885 Karl Benz construct the first automobile.\nIt had three wheels, like an invalid car,\nAnd ran on alcohol, like many drivers.\nSince then about seventeen million people have been killed by them\nIn an undeclared war;\nAnd the whole of the rest of the world is in danger of being run over\nDue to squabbles about their oil.\n-Heathcote Williams (Autogeddon extract).",1394754127
7395956,comment,7376063,7376063,1,0,robflynn,,,"I have two invites to give away as well.<p><i>edit</i> 0 remaining.",1394754125
7395955,comment,7395644,7395920,18,0,lutorm,,,"Until the same attention is placed on traffic deaths as on deaths by other causes, it&#x27;s hardly &quot;overheated&quot;.",1394754117
7395954,comment,7394879,7394879,2,0,amtab,,,"Having tried out various of the recent speed reading sites and apps, I honestly don&#x27;t think they are useful for any dense or difficult material requiring thought to comprehend. I almost always find that challenging text requires nonlinear reading to really get, something not possible with these tools. Perhaps they are useful for fluffy news articles, but not much more.<p>Does anyone know of any good techniques for improving time to comprehension when reading technical work? I feel like I am very inefficient at getting through math or computer science papers, which obviously resist any kind of normal speed reading.",1394754112
7395953,comment,7395207,7395895,1,0,jack-r-abbit,,,"Soylent threads also get a lot of snarky and rude comments directed <i>at</i> the people who love the concept. The others you listed (with the exception of Apple) don&#x27;t get that so much. I don&#x27;t think I&#x27;ve ever read an Uber or Airbnb thread where the people against it were so rude to the people for it.",1394754084
7395952,comment,7392320,7395566,3,0,keithwarren,,,"GeekDesk and Embody and I have never felt better. Going on a year now.",1394754072
7395951,comment,7393416,7394793,1,0,Paul12345534,,,"Google Drive has an API but it&#x27;s certainly not meant for S3 use-cases serving content on websites :)<p><a href=""https://developers.google.com/drive/v2/reference/"" rel=""nofollow"">https://developers.google.com/drive/v2/reference/</a><p>When you talk about Glacier, you must remember there&#x27;s no instant access to files and there&#x27;s <i>bandwidth</i> costs associated with downloading your files. The price for storage may be the same but the overall costs of Glacier are much higher.",1394754066
7395950,comment,7395781,7395781,1,0,lalos,,,"For mobile a good app is <a href=""https://popapp.in/"" rel=""nofollow"">https://popapp.in/</a>",1394754066
7395949,story,,,3,0,WestCoastJustin,"The Ivanpah Solar Electric Generating System",http://www.theatlantic.com/infocus/2014/03/the-ivanpah-solar-electric-generating-system/100692/,,1394754030
7395948,comment,7395644,7395920,18,0,bunderbunder,,,"Murder?  No.<p>Negligent homicide?  Yes.",1394754005
7395947,comment,7395644,7395892,0,0,abstractbill,,,"I&#x27;ve often wondered about this.  Instead of just having a single thin metal skin that deforms, wouldn&#x27;t it be even better to have multiple skins sandwiching a kind of honeycomb structure?  That way you have even more stuff to deform and absorb the impact.",1394754005
7395946,comment,7395207,7395780,2,0,Noxchi,,,"> There&#x27;s no thought that some human is actually going to put this thing in his mouth, what effects its going to have on his health and well-being.<p>What do you mean? That is the whole point of the discussion.\nThey are citing studies and talking about what effect the various ingredients in the formula will have on the body.",1394754003
7395945,comment,7395207,7395784,4,0,colechristensen,,,"This is a stupid amount of petty intolerance.  What other people eat is their own damn business, and if you don&#x27;t like it keep quiet and don&#x27;t try to push your personal preferences on other people.",1394753996
7395944,comment,7394828,7394828,1,0,ericbieller,,,"wow, I really like this idea. Going to dig a bit deeper into it.",1394753977
7395943,comment,7395045,7395045,3,0,noname123,,,"Cool. Can the concurrency guru&#x27;s out there tell me what is the difference between the &quot;Go Concurrency Pattern&quot; and the Java SingleThreadExecutor? (<a href=""http://docs.oracle.com/javase/6/docs/api/java/util/concurrent/Executors.html#newSingleThreadExecutor%28%29"" rel=""nofollow"">http://docs.oracle.com/javase/6/docs/api/java/util/concurren...</a>)<p><pre><code>  ExecutorService pipeline = ExecutorService.newSingleThreadExecutor();\n\n  FutureTask<String> step1 =\n       new FutureTask<String>(new Callable<String>() {\n         public String call() {\n           return &quot;step1&quot;;\n  }});\n\n  executor.execute(step1); // execute single-step pipeline\n  \n  step1.cancel(true); // interrupt the task</code></pre>",1394753973
7395942,comment,7392320,7394187,1,0,suyash,,,"This chair looks comfortable but is it really for long time sitting and programming? Does it have a good lower back support?",1394753958
7395941,comment,7394828,7395763,1,0,ebyc1234,,,"Definitely a good point itafroma. The idea is that people can post their own opinions that can be agreed or disagreed with,  but you&#x27;re right the homepage should be curated. I certainly don&#x27;t agree with a lot of what&#x27;s on there, but a good topic is one which gains interest and provokes a useful discussion.",1394753953
7395939,comment,7394986,7395357,2,0,throwawayaway,,,"Well I don&#x27;t know, I doubt they care how close to home it is, provided they still get paid. The purest cynicism I ever did see was in response to the drone attacks on funerals. People cried &quot;you&#x27;re creating more terrorists&quot;. The cynics replied, &quot;That&#x27;s actually the point&quot;. A self perpetuating war machine. There are people out there that have this as their goal.",1394753931
7395938,comment,7395644,7395644,12,0,kiba,,,"It&#x27;s such a shame. The automobile is built as a requirement to live in society rather than something that complement and argumented our lifestyle.",1394753930
7395937,comment,7392320,7394822,1,0,idlewan,,,"I&#x27;ve tried that.\nOn my bed, with my laptop face down on this (<a href=""http://www.aliexpress.com/item/Metal-Folding-Laptop-Table-Foldable-Table-Notebook-Table-Foldable-Laptop-Desk-Foldable-NotebookTable-Black-Color/424799962.html"" rel=""nofollow"">http://www.aliexpress.com/item/Metal-Folding-Laptop-Table-Fo...</a>) and an external 60% keyboard.<p>It felt great at first, but there was two major problems for me:<p>- with the laptop desk I had to slide under it each time I wanted to use the computer and grab the external keyboard, which isn&#x27;t instantaneous like getting up/sitting down.<p>- I was waaaayyyy too sleepy lying on my bed. Had 2 minutes micro-naps all the time.<p>Right now I still often program in my bed, but with the screen vertical and at eyes height on the laptop desk, and my back resting against a bean-bag chair. It&#x27;s much more comfortable than a standard desk-chair combination, I recommend people try it.\nI avoid the use of a mouse, however, and my laptop is configured to be very keyboard-friendly, so there&#x27;s also that to be taken into account. Using a mouse isn&#x27;t impossible, but I&#x27;m much more performant without one.",1394753912
7395936,comment,7392320,7395085,1,0,suyash,,,"interesting way to manage the space in a optimal way but coding on bed, that&#x27;s not for me.",1394753912
7395935,comment,7393416,7395195,3,0,Paul12345534,,,"Flickr is also limited to jpeg photos only ;) and I&#x27;d trust Google for <i>safety</i> of my data (not necessarily privacy) for more than a crummy hosting provider.",1394753906
7395934,comment,7393329,7395900,1,0,agumonkey,,,"Good point, I forgot was logged in, and judge google.com as a public page (unlike facebook primary essence). Logged off, the `share` option is gone. But that remark was in the context of mangled URLs. I can&#x27;t right-click, double click nor select to get the URL and pass it along. Very broken IMO even though I understand they want me to visit said page.",1394753864
7395933,comment,7395207,7395759,1,0,svenkatesh,,,"Yeah, it&#x27;s Big Food paying all of these nasty commenters to bash Soylent because it&#x27;s so disruptive. /s",1394753852
7395932,comment,7385390,7385890,1,0,endeavor,,,"It sounds like they are going after a vulnerability in the browser. My guess would be that do a man-in-the-middle attack where they have a device that acts as a proxy so you get YOUR Facebook page, but with an exploit injected into the code.",1394753836
7395931,comment,7395045,7395045,10,0,songgao,,,"> In Go, we can do this by closing a channel, because a receive operation on a closed channel can always proceed immediately, yielding the element type&#x27;s zero value.<p><pre><code>    for n := range c {\n        select {\n        case out <- n:\n        case <-done:\n        }\n    }\n</code></pre>\nThis, is brilliant.",1394753824
7395929,comment,7393133,7395506,1,0,reqres,,,"> IMO you are underestimating that AWS expands all the time in _every_ direction.<p>I think I can see where you&#x27;re coming from but I strongly disagree that AWS will protect its market share by adding more products.<p>Each new product doesn&#x27;t just bring utility in terms of what customers can do - it also brings disutility in other areas. New products dilute marketing (what are you selling?). It dilutes the allocation of internal resources (maintenance, R&D, marketing). It increases cognitive overhead for customers (E.g. the product range is a mess -EC2/S3/SWF/SQS/SES/SNS/FPS How is a customer to keep track of what&#x27;s going on?).<p>My assertion is that for the average customer - new AWS products only bring headache and zero benefit. Because most people just won&#x27;t find the need for it. Also AWS don&#x27;t need to care. They will not meaningfully improve the core offering to the average user because it&#x27;s the high end customers that will move the needle at the end of the day.",1394753795
7395928,comment,7395781,7395781,1,0,joenied,,,"You talking about getting a general idea laid out? Like Axure?",1394753779
7395927,comment,7395563,7395563,6,0,hibikir,,,"The indie market is quite open to games that really come out of left field, instead of following the same 5 genres indies always go back to, if just because they are easy and well understood.<p>Lucas had made a couple of nice mini-games before that showing how relatively unconventional gameplay can be quite fun if attached to a good premise. The Republia Times is pretty much the same emotional concept but with different gameplay.<p>A big part of the game being a hit IMO was the beta was just out there for download, and it was a very polished first third of the game. A few large blogs picked it up, \nand at that point, if the game is any good, it&#x27;ll just sell a whole lot. The demand was so big that Steam approved it for Greenlight out of schedule: It was greenlit after just a week or two on the process.<p>Either way, It&#x27;s a game that is very easy to recommend.",1394753694
7395926,comment,7394959,7395079,1,0,jonrimmer,,,"Because writing controllers, services, directives, etc. with various dependencies is something you do all the time, and the DI reflection lets you do so in a quicker, friendlier, and non-duplicated way, whereas setting up the ng-min step is something you only have to do once, then you can forget about it.<p>You already need to set up a build pipeline to get your minification, concatenation, etc. in the first place. It&#x27;s hardly a terrible burden to have to stick an ng-min step in there as well. It seems like you&#x27;re trying to justify an instinctive distaste for this feature by exaggerating how problematic it is, when in reality it isn&#x27;t problematic at all.",1394753681
7395925,comment,7392804,7395129,1,0,workhere-io,,,"SQLAlchemy&#x27;s documentation makes the ORM seem a bit unapproachable, but Flask-SQLAlchemy does a good job of simplifying things: <a href=""http://pythonhosted.org/Flask-SQLAlchemy/"" rel=""nofollow"">http://pythonhosted.org/Flask-SQLAlchemy/</a>. With that documentation I don&#x27;t think SQLAlchemy is much harder to use than Django&#x27;s ORM.",1394753672
7395924,comment,7390638,7393321,3,0,jiggbenice,,,"Well, from our perspective that&#x27;s all that was done -- his body was cremated and given to us in ash-form. But I&#x27;m sure from the funeral home&#x27;s perspective they did whatever preparations they had to do, processing, helped us put his obituary together and submitted it to publications, administration costs, etc.",1394753662
