ID,Type,Story,Parent,Points,Comments,Author,Title,URL,Content,Created
7396043,comment,7395644,7395908,3,0,a8da6b0c91d,,,"Equivalent car classes are much heavier now than they were 20+ years ago. It&#x27;s because of the weight of airbags and safety features.",1394755198
7396042,comment,7392759,7395244,1,0,nazgulnarsil,,,"Yes, and I use them extensively. But they do not publish a guide to the studies they think are most worth paying attention to due to their quality and size.",1394755189
7396041,comment,7395672,7395672,10,0,dijit,,,"So, they don&#x27;t use IP Telephony then?<p>You&#x27;re aware you can add whatever you want into DNS, it doesn&#x27;t have to mean anything that computers understand right? you /could/ make your A records the intro to Star Wars- but nobody will be able to use your site.<p>TXT is a much better option imho, or.. y&#x27;know, not doing this.",1394755179
7396040,comment,7393218,7393517,0,0,spoiler,,,"Gah! That sounds so ridiculous\nLaw is so opaque, obscure, confounding, and downright obtuse that I sometimes wonder how it can still be <i>a thing</i>.<p>Soon we&#x27;ll need lawyers to tell us what we can or can&#x27;t do when we&#x27;re writing a simple bash script.<p>I&#x27;m of the opinion that, if everything involved law, there&#x27;d be virtually no progress.",1394755172
7396039,comment,7395644,7395892,3,0,InclinedPlane,,,"Indeed. You can drive some older cars right into a brick wall at 50mph and only need to replace the bumper. But that&#x27;s less good for the occupants who would be killed during a crash like that. Modern car design sacrifices the vehicle for the sake of protecting the occupants.",1394755170
7396038,story,,,1,0,mxfh,"'Creativity, like evolution, is merely a series of thefts'",http://www.wired.co.uk/magazine/archive/2014/03/ideas-bank/mark-pagel,,1394755159
7396037,comment,7392804,7392804,1,0,Pitarou,,,"What are the engineering trade-offs here?  Metric were migrating from CouchDB, so using a JSON field is the obvious solution, but what about for new projects?<p>Compare it to say, Django-CMS, which achieves pretty much the same thing by storing the tree data-structure directly in SQL. The `django-mptt` library handles the details of efficiently implementing a tree structure in SQL, and `south` simplifies database scheme migration. As a programmer, which system would you rather work with?",1394755140
7396036,comment,7395644,7395920,3,0,briantakita,,,"It&#x27;s clever marketing. It seems Americans really listen to re-branding of terms.<p>We have been playing this game where Americans live in burbs and spend time commuting. That has a huge psychological, familial, physical, environmental, financial, economic, & diplomatic toll.<p>Our landscape is dominated by asphalt & concrete to support the norm.<p>I think we can do better. If it takes some stigma to turn the discussion and to show more attention on the alternatives, then bring on the stigma.<p>In reality, not enough attention is paid. America seems to be more afraid of flying in an airplane or terrorists than the ubiquity of automobiles.",1394755113
7396034,comment,7394879,7395988,3,0,ACow_Adonis,,,"And I think that&#x27;s a fair criticism.  We get down into the details and not much can be said with such certainty.  Even measuring comprehension as a metric is fraught with dangers, biases, and questions of how to do it.<p>As many people are pointing out, anything over and above green eggs and ham often requires several re-reads and some digestion at normal speed.<p>But if we must talk in generalities (and i think that&#x27;s appropriate for the medium and context of hacker news), if we want to talk about measurable comprehension as its used in speed-reading discussions, what level of it actually constitutes reading, and place it on a scale of 0-100%, then I think its reasonable to consider actual &quot;reading&quot; as arbitrarily close/adjacent to 100%.",1394755088
7396033,comment,7395672,7395672,3,0,zmanian,,,"Would love a how to....",1394755088
7396031,comment,7394879,7394879,1,0,benjamincburns,,,"To... read between the lines... on this summary, I think The Zen of Python is applicable here. Readability counts.<p>One technique that might work would be to &quot;translate&quot; content into a simpler language which is optimized for fast serial consumption with high comprehension. Sure, that&#x27;s probably impossible to achieve with today&#x27;s technology, and there&#x27;s the issue of internationalization (is it a version of an exisiting language with strict rules, or a whole new language altogether?), but those are &quot;just&quot; engineering problems, right?<p>Or maybe the inverse is really the problem - maybe it&#x27;s not the language, but the metric we&#x27;re focusing on. WPM is as poor of a metric for &quot;rate of information intake&quot; as LOC is for programmer productivity.",1394755022
7396030,comment,7395644,7395644,34,0,tokenadult,,,"The death rate per miles driven in the United States has fallen dramatically in my lifetime, and I can remember when the annual number of deaths was much higher.[1] That said, the article makes a very interesting claim about attitudes that we should all follow to the end of the article for further discussion here: &quot;There’s an open secret in America: If you want to kill someone, do it with a car. As long as you’re sober, chances are you’ll never be charged with any crime, much less manslaughter.&quot; My wife bike-commutes year-round (yes, even in Minnesota), and as I mention this among Facebook friends, other friends who are also bike commuters point out that car drivers can basically kill bicyclists in the United States with no legal penalty at all. That&#x27;s not a good social environment for getting more people out for exercise and energy conservation by substituting bicycling for driving cars.<p>The history reported in this article is very interesting. There are a lot of contemporary photographs of changing American cities. The quotations from experts provide perspective on the visuals: &quot;&#x27;If a kid is hit in a street in 2014, I think our first reaction would be to ask, &quot;What parent is so neglectful that they let their child play in the street?,&quot;&#x27; says Norton.<p>&quot;&#x27;In 1914, it was pretty much the opposite. It was more like, &quot;What evil bastard would drive their speeding car where a kid might be playing?&quot; That tells us how much our outlook on the public street has changed.&quot;<p>Indeed. Are we really thinking carefully about how to spread the risk around, when so much of our living space is dominated by cars?<p>AFTER EDIT: The video link shared by pugz[2] in a reply comment elsewhere in this thread is not to be missed. Car safety standards have improved enormously in my lifetime, but those protect the occupants of cars better than they protect pedestrians and bicyclists who are hit by cars.<p>[1] <a href=""https://en.wikipedia.org/wiki/List_of_motor_vehicle_deaths_in_U.S._by_year#Motor_vehicle_deaths_in_U.S._by_year"" rel=""nofollow"">https://en.wikipedia.org/wiki/List_of_motor_vehicle_deaths_i...</a><p>[2] <a href=""https://www.youtube.com/watch?v=fPF4fBGNK0U"" rel=""nofollow"">https://www.youtube.com/watch?v=fPF4fBGNK0U</a>",1394755021
7396029,comment,7395644,7395947,4,0,Retric,,,"The only stuff that actually matters is keeping people from being squashed and the occupant&#x27;s deceleration profile which you can already customize by changing how the car deforms. To really make a difference vs a high end car we could mandate 3 point seat-belts and helmets like you have in racing world.<p>Still a 70MPH a head on collision is already fairly safe assuming people are belted the real killers are unbelted passengers, collision debris, and rolling. Edit: Head on collisions still kill a lot of people but they tend to be higher speeds accidents and often involve unbelted individuals.  Also we are slightly below 1 death per 2 million hours in a car we just spend a lot of time in our cars.<p>PS: <i>Worldwide it was estimated that 1.2 million people were killed and 50 million more were injured in motor vehicle collisions in 2004.</i> <a href=""http://en.wikipedia.org/wiki/Epidemiology_of_motor_vehicle_collisions"" rel=""nofollow"">http://en.wikipedia.org/wiki/Epidemiology_of_motor_vehicle_c...</a>",1394754960
7396028,comment,7395563,7395919,3,0,scotty79,,,"If you detain people in Papers Please the guard who does the actual detaining gives you a cut. It feels like sort of a bribe.",1394754928
7396027,comment,7394876,7395838,1,0,kolev,,,"Well, I think the strategy is: Invest in insurance, not in solid security.",1394754922
7396026,comment,7387512,7395305,1,0,tptacek,,,"What&#x27;s a form letter?",1394754916
7396025,comment,7395644,7395920,14,0,ChuckMcM,,,"I came here looking for this comment, I was not disappointed :-)<p>The headline is hyperbole, but it is <i>common</i> hyperbole. Factories pumping out pollutants are &quot;murdering&quot; our people, Cigarette manufacturers are &quot;murdering&quot; their customers, Etc.<p>The interesting point in the story is how we went from &#x27;cars need to look out for people&#x27; to &#x27;people need to look out for cars&#x27; in a relatively short time frame. The discussion of the various articles and points of view and how they gained favor over time is similar to things like Nuclear power which went from &#x27;power to cheap to measure&#x27; to &#x27;tool of the devil&#x27;, or gun ownership, or Television ownership, or any number of things that have impacted the community at large.<p>The thing to remember for this community is that these are <i>emotional</i> arguments presented as <i>rational</i> arguments. Hence the term &#x27;murder&#x27; which evokes the desired emotion (outrage) rather than &#x27;dangerous&#x27; which evokes a statistical mindset of potential harm.",1394754859
7396024,comment,7393072,7393072,2,0,Houshalter,,,"Lesswrong.com is good. Subreddits will vary depending on your interests.",1394754829
7396021,comment,7392404,7394885,5,0,tptacek,,,"You figured it out. They secretly don&#x27;t have any bugs. Shhh.",1394754738
7396020,comment,7391369,7394930,2,0,rhizome,,,"<i>It seems to depend entirely on the program in question</i><p>Accessibility does, but it has nothing to do with the agency. &quot;Does the government store the content of US calls?&quot; can be answered in the aggregate without reference to specific programs. If the content is there, an agency only has to acquire the authorities required to access <i>what is already there</i>.<p>So, the question remains: is the content there to access, given proper authorities?",1394754738
7396019,comment,7395644,7395957,7,0,anigbrowl,,,"I don&#x27;t care for cars and have never owned one, but horse-powered transport wasn&#x27;t free of social cost either.",1394754722
7396018,comment,7394465,7394465,1,0,beedogs,,,"In related news, I&#x27;ve introduced FB Purity, NoScript, ABP, and Ghostery to Facebook.",1394754722
7396017,comment,7395644,7395947,2,0,AnimalMuppet,,,"You know how the original Volkswagen Bugs had that empty front hood, because the engine was in the rear?  My dad advocated filling the front hood with bags full of empty aluminum cans.",1394754718
7396016,comment,7394959,7395460,4,0,bmm6o,,,"Angular is an MVC framework, which means that your code should be updating the model and letting Angular push that to the view.  A lot of the stuff you would do with jQuery is directly updating the view.  So instead of writing something like:<p>$(&#x27;#whatever&#x27;).addClass(&#x27;selected&#x27;); // say this is in an event handler<p>you should write:<p>$scope.isSelected = true; // this is your ng event handler<p>and the html is like this<p><div ng-class=&quot;{selected: isSelected}&quot;><p>That is, you think a lot more about the model and how it&#x27;s represented in the view (declarative) and less about what to do to the view to make it look the way you want (imperative).<p>That&#x27;s not to say that there&#x27;s no place for jQuery in an angular app, but it does replace a lot of the typical uses.  And fighting it just leads to frustration.",1394754713
7396015,comment,7395538,7395538,1,0,prawn,,,"I&#x27;d like to see adapted shipping containers (with similar grow spaces) become more affordable for home use.<p>I live in a house on a 750sqm or so block. A decent portion of my back yard is devoted to growing - I have seven raised beds* (2.4m x 1.2m) plus trellis up against fences nearby. There are also citrus trees and herbs elsewhere. But having this dedicated space means I had to sacrifice playing space for my child and any future children; there is 55-60sqm of lawn but I&#x27;d have preferred more and there is no paved area for a basketball ring.<p>I wonder if future homes could explore underground growing spaces as well as water storage. Underground rainwater &quot;bladders&quot; are becoming a bit more popular in Australia already.<p>We could, at the time a house is being built, dig down as though for a swimming pool and embed 2-3 shipping containers. There are companies selling quite expensive set-ups with automated watering and lighting, remote monitoring and so on. If a cellar was dug at the same time, access to underground grow space could be through an interior cellar to avoid dealing with hatches and ladders outdoors?<p>One issue would be that this might preclude anything requiring pollination from insects, but there are ways around many cases (manual pollination, air circulation, self-pollinating plants, etc).<p>* Some of the raised beds: <a href=""http://instagram.com/p/UuNB2JD1vk/"" rel=""nofollow"">http://instagram.com/p/UuNB2JD1vk/</a><p>Produce: <a href=""http://instagram.com/p/cTSjSuj1hy/"" rel=""nofollow"">http://instagram.com/p/cTSjSuj1hy/</a><p>Cleaning out a bed to sow seeds last weekend: <a href=""http://instagram.com/p/lTOGElD1ug/"" rel=""nofollow"">http://instagram.com/p/lTOGElD1ug/</a><p>Another shot from last Winter: <a href=""http://instagram.com/p/cTQKhYj1vC/"" rel=""nofollow"">http://instagram.com/p/cTQKhYj1vC/</a>",1394754704
7396014,comment,7393416,7394984,1,0,c_c_c,,,"Didn&#x27;t exactly shut it down like they did with reader or others though. It was replaced by another product, Google Wallet. Reader received no replacement from Google.",1394754696
7396013,comment,7387413,7394229,1,0,glenra,,,"Setting aside your pompous overall tone - which is probably not helping you to win any arguments - the best I&#x27;ve been able to parse from what you&#x27;ve said so far is this: <i>if</i> somebody <i>already accepts</i> a slew of Marxist assertions, <i>then</i> this new Marxist assertion seems ordinary and reasonable.<p>And I agree, it probably does.<p>But since I&#x27;m <i>not</i> already a Marxist, I don&#x27;t have any existing framework wherein it makes sense to say things like &quot;concentrated capital exploits labor&quot; much less to discuss <i>how</i> this allegedly happens and how that goes on to create what &quot;Marxist analysts&quot; mean by &quot;anxiety&quot;. (I&#x27;m not convinced the word &quot;exploit&quot; is even a useful term in this context.)<p>I would prefer instead frame employment in terms of ordinary economics and say that when any two parties agree on any sort of contract there is likely to be both a <i>producer surplus</i> and a <i>consumer surplus</i>; both sides profit by the exchange. If it made sense to call one of those surpluses &quot;exploitation&quot;, you&#x27;d have to call the other one that too. It&#x27;s not one-sided.<p>Sadly, pseudo-marxists have been spouting this sort of stuff for so long that by now they&#x27;ve polluted the terms &quot;capitalism&quot; and &quot;capitalist&quot;; it might be easier for free-market advocates to give up and start over with a new term (like, say, &quot;free-market advocates&quot;) for what economists used to mean by &quot;capitalism&quot; than to keep fighting over it. I&#x27;m probably never going to convince you that &quot;capitalism&quot; doesn&#x27;t &quot;exploit workers&quot; because to you, &quot;exploiting workers&quot; is part of the <i>definition</i> of &quot;capitalism&quot;.<p>When I say something is an extraordinary claim, I merely mean it&#x27;s a claim that seems intuitively false to me. Since the claim was phrased in a way that didn&#x27;t seem to exclude my own subjective sense of the world as a source of evidence, I consulted that sense, and found the claim wanting.<p>In the end, it seems like the title claim of the article - &quot;you are a Marxist&quot; - probably just doesn&#x27;t apply to me. Maybe it applies to you. Which is fine.",1394754686
7396012,comment,7368573,7369813,1,0,shagie,,,"Its based on the idea of an artist in residence (Wikipedia: <a href=""http://en.wikipedia.org/wiki/Artist-in-residence"" rel=""nofollow"">http://en.wikipedia.org/wiki/Artist-in-residence</a> ).  Another odd travel related residency is Heathrow&#x27;s writer-in-residence: <a href=""http://www.bbc.co.uk/news/uk-england-london-14371775"" rel=""nofollow"">http://www.bbc.co.uk/news/uk-england-london-14371775</a> .<p>The idea of the artist in residence is to get away from one&#x27;s daily routines and environment into a new and enriching environment for the artist.  Its not a &quot;get from point A to point B&quot; that they&#x27;re giving away its a &quot;experience riding around the US on the railway and talk with the people who are on the train or see the scenery so that you can become a better writer.&quot;  The start and end of the trip are purely coincidental.<p>As to if its less expensive than tickets: section 10 of the official terms shows what will be given: a travel voucher for 1 person on a sleeper train for between 2 to 5 days that would be worth about $900.  The key here is <i>given</i> - free is much less than the cost of tickets.",1394754665
7396011,comment,7395207,7395960,3,0,jack-r-abbit,,,"Sorry. Usually legitimate questions don&#x27;t involve reducing people interested in Soylent to various negative buckets like: Lazy, no foresight, poor time management skills. I mistook your comments for condescending snark. Still not sure I am wrong but since I&#x27;m not a mind reader I&#x27;m not going to argue about what you were thinking. I can just go off of what I read.",1394754663
7396010,comment,7395563,7395817,8,0,froo,,,"I read the original article and was quite intrigued at the premise (a game about document inspecting, how novel), so I shelled out the $10 and bought the game.<p>Gotta say, after only playing the game for about 20 minutes your review was entirely accurate and I can&#x27;t wait to make my girlfriend play the game...",1394754652
7396009,comment,7395045,7395943,8,0,enneff,,,"There is no &quot;Go Concurrency Pattern&quot; (singular). The article demonstrates some ways to use Go&#x27;s concurrency primitives.<p>Obviously there is a massive syntactic difference between your Java example and the equivalent Go code, but the other major difference that jumps out at me is that cancellation is baked into the Java library, whereas in Go the programmer determines how each of their pipeline stages should be shut down.",1394754626
7396008,comment,7393416,7393932,9,0,thefreeman,,,"It&#x27;s not like Google is just going to cancel Drive and delete all of your files. If Drive goes away all you need to do is signup for Drop Box...",1394754608
7396007,comment,7391649,7391649,2,0,spoiler,,,"I got some invites too. Email me if you want them:<p>nino at miletich dot me",1394754596
7396006,comment,7395644,7395955,4,0,AnimalMuppet,,,"I agree that we should pay the attention to traffic deaths that the death toll warrants.<p>But don&#x27;t call accidental deaths murder.  <i>That&#x27;s</i> the &quot;overheated&quot; part.  Murder has a definition, and traffic deaths aren&#x27;t it.<p>Even if you are a fervent advocate of traffic safety, this kind of manipulative rhetoric does you no favors.  It makes people tune you out as a demagogue.<p>(Why do I call this &quot;manipulative&quot;?  Because it tries to play on peoples&#x27; view of the horror of murder to make people realize the horror of traffic deaths.  Traffic deaths <i>are</i> horrible, but the technique is still manipulative.)",1394754590
7396005,comment,7394879,7394879,2,0,benjamincburns,,,"This is a complete aside, but am I the only one who finds it impossible to read this piece and not be completely distracted by a sudden acute awareness of <i>how</i> I&#x27;m reading it?",1394754568
7396003,comment,7395644,7395959,12,0,panic,,,"People don&#x27;t intentionally mow down pedestrians.  Our current system, which includes both cars and drivers acting with the best of intentions, kills huge numbers of people each year.  Instead of trying to assign blame to a particular actor in the system, we should be thinking about ways to change the system as a whole so it kills fewer people.",1394754557
7396002,comment,7392804,7394635,1,0,ddorian43,,,"i think flask-sqlalchemy does something similar",1394754556
7396001,comment,7395644,7395958,3,0,bdamm,,,"High performance aircraft and cars already do this.  They thought of it - and it&#x27;s expensive.",1394754555
7396000,comment,7394828,7394828,1,0,PaulHoule,,,"I have friends who disagree (they come out of Palestine/Isreal) but I think most people are really about the Yankees vs. the Red Sox and putting things head to head leads to real user engagement.",1394754553
7395999,comment,7394959,7394959,1,0,scotty79,,,"Angular seems not to have much of actual models (not view models), it&#x27;s all about the view components and syncing them with their view models. Backbone doesn&#x27;t have much support for the views, it&#x27;s all about models and collections and syncing them to the server.<p>Yet people don&#x27;t seem to be too eager to use both together. Why do you think that is?",1394754551
7395998,comment,7393133,7394081,1,0,devicenull,,,"It&#x27;s because it&#x27;s hard to do right, and securely.  With IPv4, it&#x27;s been around so long that all the secure issues are well understood, and software just expects it to be there.<p>IPv6 has a bunch of possible security issues, and breaks in all sorts of unknown ways.<p>It&#x27;s not impossible to do, but it&#x27;s a lot harder then just installing some software.  As an example, libvirt comes with all sorts of network filters that will prevent IPv4 guests from doing all sorts of bad things (IP spoofing, ARP poisoning, etc).  In contrast, it comes with exactly zero similar filters for IPv6.<p>You need to explicitly ask for this from providers.  While you might not get it right away, having the demand there is the only thing that&#x27;s going to encourage companies to spend time on it.",1394754528
7395997,comment,7394465,7395651,1,0,ACow_Adonis,,,"And this is one of the reasons why i&#x27;m shocked they aren&#x27;t used.  Its seems like a clear win.  Cut down on bandwidth use by your employees for relatively little/practically no effort + employees would be happier.<p>And when have we known a big corporation/government to care about a moral grey area that is legal and in their interests? Hell, that describes half of their operations and even some companies!",1394754482
7395996,story,,,1,0,sofia_,"Tearing down language barriers through technology – a startup story",http://blog.startupletters.com/post/79448241305/tearing-down-language-barriers-the-story-of-unbabel,,1394754469
7395995,comment,7395644,7395958,3,0,jstanley,,,"So you&#x27;re saying we&#x27;re at the theoretical optimum of car safety and that there are no possible improvements?",1394754467
7395993,comment,7395644,7395947,2,0,bagels,,,"Right now, you have multiple skins sandwiching air.",1394754422
7395992,comment,7395096,7395839,1,0,nabla9,,,"We are not special. Money has been very unpredictable entity in history. In the past, economic thinking was not that developed. There were no alternatives.<p>Historical fluctuations in inflation: <a href=""https://en.wikipedia.org/wiki/File:US_Historical_Inflation_Ancient.svg"" rel=""nofollow"">https://en.wikipedia.org/wiki/File:US_Historical_Inflation_A...</a><p>Historical interest rates: <a href=""http://i.imgur.com/i0xit0K.png"" rel=""nofollow"">http://i.imgur.com/i0xit0K.png</a><p>More important than store, is predictability. If you know it&#x27;s going to be 1-5% inflation next 20 years with high probability, life is much easier to plan than if there is high change of huge deflations or inflations.",1394754411
7395991,comment,7395563,7395563,11,0,dangero,,,"It seems likely that a lot of people bought it, like I did, for a novel experience regardless of whether or not the experience is actually fun.<p>We&#x27;re living in quite the renaissance of game exploration. I wonder if the indie game genre will continue to flourish or if this is a temporary moment of history. Regardless it is probably as strong as it has ever been right now.<p>Gone Home is another recent and interesting &quot;game&quot; to check out:\n<a href=""http://store.steampowered.com/app/232430/"" rel=""nofollow"">http://store.steampowered.com/app/232430/</a>",1394754400
7395990,comment,7395207,7395904,1,0,zacinbusiness,,,"It doesn&#x27;t take hours to eat an apple on your way to work in the morning. And it doesn&#x27;t take careful planning nor constant vigilance to grill a salmon steak and prepare a small salad. It takes about 40 minutes to do that and costs maybe $10, for two meals for two people and with about 5 ingredients (salmon, lettuce, olives, red pepper, olive oil).",1394754383
7395989,comment,7395198,7395962,8,0,martinald,,,"MDM/MAM = mobile device management/mobile application management (managing and provisioning mobile devices and their applications, generally automatically)<p>NAC = network access control<p>EDW = enterprise data warehouse (archiving old information while preserving access)",1394754380
