ID,Type,Story,Parent,Points,Comments,Author,Title,URL,Content,Created
7395922,comment,7381557,7394428,1,0,kolev,,,"This isn&#x27;t /r/Bitcoin - if you only want positive comments in hopes that this will somehow magically increase the fiat-equivalent of your stash or at least will stop the price from falling, well, as I said, this is not /r/Bitcoin.",1394753637
7395921,comment,7395538,7395538,6,0,sdfjkl,,,"I&#x27;ve been experimenting with home hydro/aeroponics the last few months and learnt a lot. It is amazing when you bite into your first self-grown tomato[0].<p>I am however surprised that grow lamps, even if LED based, are economical for these guys. The retail price for one of those Valoya B100 [1] LED bar is around £700. Plus around 100 Watt running for 16 hours a day. This might make sense if you&#x27;re growing weed in your basement[2], but probably not for veggies. Perhaps London&#x27;s crazy prices and lack of space to put a greenhouse in make it economical though.<p>[0] Picture: <a href=""https://lh5.googleusercontent.com/-YD-C9M32TbI/UvFqtQg6TYI/AAAAAAAAB80/6OXJDo4nbZE/w932-h1242-no/IMG_0279.jpg"" rel=""nofollow"">https://lh5.googleusercontent.com/-YD-C9M32TbI/UvFqtQg6TYI/A...</a><p>[1] <a href=""http://valoya.com/products/33-b-series"" rel=""nofollow"">http://valoya.com/products/33-b-series</a><p>[2] Apparently the most popular use of home hydroponics, and if you research anything about it, you will inevitably come across a huge gray market around this. Also a lot of gardening advice ranging from useful to mythological.",1394753637
7395920,comment,7395644,7395644,19,0,AnimalMuppet,,,"&quot;Murder Machines&quot;?  Come on.  Not all deaths are murder.<p>We Americans have this idea that nothing bad should ever happen, that we should find a way to prevent it.  It&#x27;s a goal to shoot for, certainly.  But calling it murder if you don&#x27;t reach that goal?  No.<p>Can we climb down from the overheated rhetoric?  It smells like propaganda.",1394753621
7395919,comment,7395563,7395817,3,0,notahacker,,,"If it&#x27;s all in the setting I hope he releases a sequel set in a developing country where you&#x27;re trying to rack up as much as many informal &quot;administration fees&quot; as possible without getting caught...",1394753619
7395918,comment,7395207,7395886,5,0,jack-r-abbit,,,"I have plenty of time in the morning to make a lunch to take to work. I don&#x27;t want to. Your &quot;holier than thou&quot; comments are not helping anyone. So you&#x27;re not interested in Soylent... why be a jerk about it to people who are? I hate tofu... should I trash talk all the people that put that disgusting, vile creation into their mouth?",1394753618
7395917,comment,7395207,7395843,2,0,dxbydt,,,">Were you expecting a magical revelation from the gods of nutrition?<p>Unlike subjective ad-hoc-cy garbage like web/js frameworks, nutrition is a sound science well studied for hundreds of years. We know which people in which climes eat which food groups in what proportion, how they fare relative to each other, impact of food groups on your bile/blood/bowels , ...\nThere are, as you choose to call them, &quot;gods of nutrition&quot;, with PhDs and years of experience studying the damn thing in their labs. To randomly pick brown rice over whey because &quot;hey I don&#x27;t want to support industrialized cattle farmers&quot;...that would be like my toddler picking candy over broccoli because it just tastes better! This is supposed to be an MRP that real people eat, and hopefully has no adverse effects on them. Its not some random 8080 server that serves json whether you code it up with or without semicolons.",1394753609
7395916,comment,7394828,7395750,1,0,prawn,,,"I have thought about this before and came to the same conclusion. If you want a serious debate site, then you have to dig deeper to resolve the finer points that make up a broader issue.",1394753584
7395915,comment,7393329,7394463,2,0,cjensen,,,"I use xScope [1] to simulate seven types of colorblindness. The blue titles are distinctive in every simulation. Does xScope miss something? Or are you assuming that blue is not distinctive because most colors are not distinctive?<p>[1] <a href=""https://iconfactory.com/software/xscope"" rel=""nofollow"">https://iconfactory.com/software/xscope</a>",1394753574
7395914,comment,7391885,7395389,1,0,hershel,,,"I skimmed the pdf , and didn&#x27;t see variance.",1394753573
7395913,story,,,1,0,G5ANDY,"Zuckerberg Phones Obama for Answers About NSA Spying",http://www.wired.com/wiredenterprise/2014/03/zuck-gets-nsa-love-bff-obama/,,1394753569
7395912,comment,7392320,7392320,1,0,zacinbusiness,,,"I know the guy says he tried a standing desk...but I wonder if he calibrated it correctly? It&#x27;s more than just standing in front of a desk, you have to get all the measurements correct as well.",1394753567
7395911,comment,7395644,7395877,13,0,pugz,,,"Modern car design saves lives. Cars in the 1950&#x27;s had stiff, thick plates and it didn&#x27;t do them much good. Have a look at the excellent 2009 vs 1959 car crash test video: <a href=""https://www.youtube.com/watch?v=fPF4fBGNK0U"" rel=""nofollow"">https://www.youtube.com/watch?v=fPF4fBGNK0U</a>",1394753533
7395910,comment,7393329,7393893,2,0,hnriot,,,"seriously??? My 12 year old daughter could spot a hyperlink from a hundred yards without the ugly underlining. She told me &quot;it&#x27;s obvious&quot;. Links are inferred by their placement, you click on google search results more than a couple of times and you learn. Humans figured out fire, the wheel, perspective and now space travel so I really don&#x27;t think the lack of underline is really going to dent anyone&#x27;s web experience. People keep saying the same old nonsense that underlining helps them discover etc, but come on... seriously, if you really believe that you&#x27;re in the wrong place.<p>&quot;Nobody cares about this argument anymore&quot; - finally I agree with you.",1394753530
7395909,comment,7394876,7395642,2,0,kolev,,,"Yeah, and 2-factor auth is not mandatory...",1394753529
7395908,comment,7395644,7395877,6,0,wyager,,,"Modern lightweight cars are <i>significantly</i> safer than old, heavy cars. Thick steel is good for protecting you from explosions, not collisions.",1394753523
7395907,comment,7392320,7392320,1,0,kaonashi,,,"On a lot of La-Z-Boy chairs, there are two wingnuts that can adjust the back tension; I would think tightening those down would make operating the chair more stable while wheels were engaged.",1394753504
7395906,comment,7394879,7394879,3,0,Jugurtha,,,"Oh God, speed reading ...<p>I like it when people mention how it&#x27;s awesome and how it &quot;totally works&quot;..<p>I can read fast through light content, but some parts of a text need comprehension, not just to be read. They need a mental effort that you don&#x27;t exert reading an article about a movie star.<p>Like many of you, I spend a lot of time reading technical doc. It&#x27;s not necessarily &quot;complicated&quot;, but it certainly is complex. Speed readers don&#x27;t seem to get the subtlety of this, and when anyone says it works, I&#x27;d love to hand them the IEEE articles and the bunch of journals I eat all day long and dare them to just summarize the state of the art part.<p>As I said, there are parts you can read fast because the content concentration isn&#x27;t that high, and, thanks to plagiarism in the scientific community, a <i>lot</i> of articles are worded in an uncomfortably &quot;similar&quot; -cough verbatim- way. There are parts though you need to stop. Read, re-read.<p>You can&#x27;t speed read parts where a comma matters. Where there are a lot of interconnections between several works, etc..<p>The reason, I think, some people think speed reading works is that they don&#x27;t read much and don&#x27;t read much stuff that matters to be able to tell it doesn&#x27;t work.<p>Most people have a short attention span. Heck most wouldn&#x27;t even be able to read a &quot;paragraph&quot;, so I wonder where they had all that &quot;experience&quot; speed reading. That&#x27;s like claiming to have test driven a Ferrari in a 20 feet track. I&#x27;ll simply say &quot;Good for you&quot;.<p>Try to post that link to your friends who claim to speed read, most of them won&#x27;t even read it entirely. Ask them how they liked X part (that doesn&#x27;t exist). They would probably answer you assuming it&#x27;s really there. There you go, you proved my point.",1394753493
7395905,comment,7379821,7383496,1,0,taternuts,,,"even this particular game plays surprisingly well on mobile.",1394753491
7395904,comment,7395207,7395814,3,0,Anderkent,,,"It&#x27;s for people who don&#x27;t care about eating enough to spend hours every week just preparing healthy meals, but care enough about eating healthily that they don&#x27;t want to just eat fastfood/takeaway all the time.<p>I also contest your statement that eating healthy is easy, unless by easy you mean &#x27;requires careful planning and constant vigilance&#x27;",1394753468
7395902,story,,,1,0,philwhln,"A Brief History Of Cloud Foundry",http://www.activestate.com/blog/2014/03/brief-history-cloud-foundry-and-stackato,,1394753426
7395901,comment,7393133,7394655,1,0,FireBeyond,,,"It does seem to be. We are relatively small, and admittedly have a whole bunch of data in S3, but aside from that, our $10K/mo at Rackspace (primarily VMs, some load balancing) is looking to go down to about $6K/month at AWS when we port across 40 or so VMs (then we also don&#x27;t have to deal with $4K/mo of S3 data transfer, too).",1394753426
7395900,comment,7393329,7394979,1,0,reubenmorais,,,">  - no, sharing doesn&#x27;t only mean &#x27;publish on g+&#x27;<p>I sympathize with the feeling, but do you really expect them to drive people to their competitors? Do you think Facebook&#x27;s Share button should allow you to Publish on G+ as well?",1394753419
7395899,comment,7393416,7393416,0,0,Paul12345534,,,"Quite happy paying for Crashplan at the moment but Google Drive has the allure of instant access to files with a nice API... no heavy desktop client.... complete control how you access them.... I have 4-5TB total between my photography and other work.<p>This IS an Amazon Glacier killer if nothing else :)<p>Really hoping within the next 5 years someone finally comes up with the large capacity optical discs they keep promising. Bluray discs will fit in bank safety deposit but it&#x27;s still a lot of hassle.",1394753419
7395898,comment,7394959,7394959,1,0,bdg,,,"I find the architecture of ng fits a vast number of projects I work on very elegantly, however, I feel like I am learning to walk all over again.Things I could do in a day take me a week to learn, but I feel like my learning is progressing fast enough that I will be skilled at its use in a week.",1394753411
7395897,comment,7393329,7394009,1,0,huskyr,,,"When we&#x27;re complaining about UX changes in Google Search anyway: i really miss the old left-hand side menu with search filters, especially with image search. They&#x27;ve hidden it under &#x27;search tools&#x27;  where it takes more clicks and it&#x27;s a lot less  visible than the old way.",1394753402
7395896,comment,7393416,7395594,1,0,barrkel,,,"That&#x27;s exactly what I think - I even said so earlier - <a href=""https://news.ycombinator.com/item?id=7394140"" rel=""nofollow"">https://news.ycombinator.com/item?id=7394140</a>",1394753340
7395895,comment,7395207,7395207,4,0,cwilson,,,"Every time we have a thread about Soylent on HN, without a doubt, it turns into a debate between people who love the product/concept and people who absolutely loathe it.<p>I&#x27;ve always found it interesting that a lot of the most disruptive companies have this effect at some point, in various degrees. Apple, Uber, Airbnb, and recently Secret all come to mind.<p>I&#x27;m not saying this is any kind of a predictor for the success of Soylent, but it&#x27;s still interesting.",1394753302
7395894,comment,7394828,7395750,1,0,waldir,,,"I actually came here to say this. This breaking-down process to turn complex arguments into a tree of simple statements that can be debated more objectively and with less controversy was the core of a similar platform that existed a few years ago, but which has since been discontinued, called Ideagraph.<p>I collected all the remains of the website I could find some weeks ago here: <a href=""http://imgur.com/a/bAmcV"" rel=""nofollow"">http://imgur.com/a/bAmcV</a>. Unfortunately, there doesn&#x27;t seem to be a web archive version.<p>I&#x27;ve been hoping the concept would surface again, and this Saysaw is quite close, but doesn&#x27;t take the concept of distributed debate quite as far.<p>EDIT: To be perfectly clear, since the blurbs in the link above make no mention of the working mechanism of the site: Ideagraph worked by allowing each statement to be voted up or down, or subdivided into its component ideas. This could happen multiple times, creating a deep tree structure, where only leaf nodes could be voted on; the score of the parent nodes would be automatically calculated from its children, all the way to the top (the high-level arguments). Also, any node could be linked to another part of the tree, which they describe as &quot;Facts concluded in one debate by one group of people are reused in other debates.&quot; The whole thing was built on top of MediaWiki, to provide the wiki features of distributed editing, edit history, etc. (and also because the idea came from an attempt to improve Wikipedia discussions). But mediawiki obviously that wasn&#x27;t the ideal platform to build such a system, and I believe it&#x27;s one of the reasons the project was eventually discontinued.",1394753296
7395893,comment,7394828,7395750,2,0,ebyc1234,,,"Thanks md224, yes thats a great idea, something like you described is being planned right now. Definitely a challenge to implement well while keeping it an easy/fun/accessible interface. Typical users would get totally lost in something like stackoverflow.",1394753295
7395892,comment,7395644,7395877,16,0,TylerE,,,"Because you WANT it to deform. A stiff structure would increase deceleration on the occupants - in addition to being more likely to get in accident in the first place - additional weight will cause the vehicle to brake less rapidly, be more likely to roll over, etc, in addition to reducing efficiency.",1394753294
7395891,comment,7393416,7395546,1,0,joedevon,,,"Wow. Not sure how voting works on HN, but looks like I got downvoted for this comment. LOL. It&#x27;s just an opinion. Not trolling or anything.",1394753292
7395890,comment,7377250,7380863,1,0,barrkel,,,"<i>Third, metaprogramming, meta-object protocols, macros and so on are indeed easily abused and you should avoid using them if a simpler abstraction will suffice.</i><p>This shows you&#x27;re agreeing with me, BTW.",1394753281
7395889,comment,7393310,7393310,1,0,avmich,,,"This is indeed going to be the heaviest rocket in existence. SpaceX is truly pushing the envelope for the available launchers. I&#x27;d really appreciate if they&#x27;s bring to market the F-9H.<p>However saying that it&#x27;s second only to Saturn V is incorrect - unless followed by words &quot;in the USA&quot;. That&#x27;s because ill-fated N-1 was bigger - and Energia with both successfull orbital launches was bigger as well, by the payload on LEO.<p>Even Space Shuttle would be bigger, if you&#x27;d count by liftoff weight. That&#x27;s kinda interesting - the picture in the article mentions existing launchers and Space Shuttle, which doesn&#x27;t fly anymore, and that&#x27;s understandable - people can compare to familiar things. But to conclude that it&#x27;s second only after Saturn V... I guess SpaceX marketing department isn&#x27;t very concerned with how misleading their statements are :) .<p>Come on, SpaceX - you don&#x27;t need those exagerrations, you&#x27;re good as you are - don&#x27;t spoil your image trying to artificially look better.",1394753255
7395888,comment,7394959,7395769,1,0,singingfish,,,"> But that&#x27;s what we see with AngularJS, everything in controllers or services tied to AngularJS apis... so much for separation of concerns...<p>The web is a complex beast.  Front ends doubly so.  The idea here is to keep your web based interactions as thin as possible and keep all of the logic in the business logic models.  Combine with dumb templates and you have stuff that will scale out or up fine, given the availability of appropriate processing power on the client end.",1394753249
7395887,comment,7394879,7394879,2,0,drakaal,,,"I can &quot;read&quot; a technical book at faster than 1600 WPM.<p>I don&#x27;t read all of it, and that makes all the difference.<p>Most people don&#x27;t learn Skimming, Scanning, and Skipping.<p>Skimming is when you go over the page quickly jumping sentence start to start judging the sentence to see if you want/need to read it. If a sentence starts with info you don&#x27;t need, or already know you jump to the next bit.<p>Scanning is where you go looking for certain words on the page. I&#x27;m reading on Data Storage stuff, and I only care about Raid 5+1 so I scan for those words on the page.<p>Skipping is like hitting the next chapter button on your Shiny Disc player. If the chapter isn&#x27;t relevant you skip it. And go on to the next.  This is useful for books where 80% is beginner stuff.<p>This isn&#x27;t how you &quot;read&quot; Harry Potter. You wouldn&#x27;t have any fun. So a novel in 90 minutes would have to be for people who don&#x27;t enjoy reading. I can&#x27;t imagine that fast. (Like my minds eye, and ear can&#x27;t do all of the Lord of the Rings movies at 8x)",1394753242
7395886,comment,7395207,7395858,0,0,zacinbusiness,,,"So it&#x27;s for people with poor time management skills or who have almost no foresight? I&#x27;m glad I am able to take the minute to throw together a tofu sandwich in the morning but maybe I&#x27;m blessed with a less hectic morning routine than most Soylent users.",1394753236
7395885,comment,7393329,7393893,1,0,mbesto,,,"From an article in 2004 that is still very much relevant today:<p><i>Underlined blue text is still the most obvious visual indicator of a link</i><p>...and more...<p><a href=""http://www.nngroup.com/articles/guidelines-for-visualizing-links/"" rel=""nofollow"">http://www.nngroup.com/articles/guidelines-for-visualizing-l...</a>",1394753236
7395884,comment,7394986,7395522,2,0,maybehybrid,,,"> folks here would be even more unhappy<p>Maybe. But we could have a constitutional direct democracy (to provent the policies which would make us unhappy), in addition to having smaller countries. In the UK, for example, making the counties into states like in the USA, but with direct democracy and rather than having a centeralised government for the whole country have a EU-like meeting as though they were seperate countries. It&#x27;s a merky idea, but that&#x27;s what I&#x27;m currently in favor for. We should be able to call a referendum to get rid of certain laws but maybe the government should continue to create the laws as means of reducing idiocracy (like in Switzerland, but even that has dumb laws being passed sometimes, but it by far has more personal freedom than in UK/USA in my opinion).<p>I hope that makes sense, I&#x27;m not good with english.",1394753234
7395883,comment,7395398,7395398,2,0,illbert,,,Textual,1394753209
7395882,comment,7394465,7395114,1,0,MichaelGG,,,"Android, anyways, has a way to mark a WiFi AP as mobile so apps can avoid this.",1394753204
7395881,comment,7393145,7395542,9,0,benched,,,"I&#x27;m just the opposite. Work doesn&#x27;t even cross my mind after I run out of the office shouting &quot;Freedom!&quot; My manager once asked why I didn&#x27;t see a change to a meeting time he made late the night before; I just laughed. Why on earth <i>would</i> I have seen it?",1394753191
7395880,comment,7392759,7395855,1,0,dllthomas,,,"Yes, the correlation has to be sufficiently unlikely to have arisen by chance.  Even in that case, though, our estimate of green jellybeans having some causal relationship with acne <i>should</i> increase.",1394753164
7395879,comment,7391212,7392622,2,0,krschultz,,,"Mucking around with provisioning profiles, schemes, and certificates is a part of iOS development that totally sucks.",1394753163
7395878,comment,7381875,7391727,1,0,diminoten,,,"Seen by <i>you</i> as a provocateur, which frankly I&#x27;m alright with, Internet stranger.",1394753153
7395877,comment,7395644,7395644,1,0,ansimionescu,,,"In Romanian &#x27;car crash&#x27; is called literally &#x27;accident&#x27; [0]. Something that&#x27;s always baffled me is how friggin&#x27; thin the metal plates that make up the car are. Why the fuck does a whole industry consider this normal?! [1]<p>Edit: thanks for the info (and for the downvotes <3)<p>0: <a href=""http://translate.google.com/#en/ro/car%20crash"" rel=""nofollow"">http://translate.google.com/#en/ro/car%20crash</a><p>1: <a href=""http://www.youtube.com/watch?v=qhCXFsQ6kKQ"" rel=""nofollow"">http://www.youtube.com/watch?v=qhCXFsQ6kKQ</a>",1394753149
7395876,comment,7395538,7395538,3,0,mikegreen,,,"It is a great idea - it reduces one of the hardest things in produce sales - the farm to table transportation.<p>A few points:\nAuthor shows a picture of a 25-day old bibb lettuce plant under this text (not caption):\n&quot;The seedlings stay in darkness for around five days, allowing them to propogate. Once that happens, the LEDs are switched on, and within three days, micro herbs are ready for harvest.&quot;<p>Micro herbs are useful for garnish or a fancy-pants restaurant $15 appetizer.  There isnt much solving the worlds food problem with some magical plants that grow 3&quot; tall in 5 days (the bottom picture is microgreens in a container).<p>Nothing in the article says how much room they have in London for this.  How many bomb shelters are there in London?<p>It is good for leafy greens. Don&#x27;t think you&#x27;re growing tomatoes and peppers and avacados down there - the energy required for temp and lighting for fruiting plants is much higher (lets say 4x the wattage compared to leafy greens/lettuce).",1394753136
7395875,comment,7393416,7395667,1,0,joedevon,,,"It was just a thought.<p>I mean, just speaking in terms of a business move, Google&#x27;s track record ain&#x27;t great with these types of services. There must be a better way than dumping them like that.<p>What I heard or read somewhere about Reader is that they couldn&#x27;t find internal champions, and that&#x27;s why it died. NOT because it was losing money.<p>Then again, Google+ is a better business for them than RSS.",1394753132
7395874,comment,7393133,7395670,5,0,dangrossman,,,"To take this to the extreme: you could shut down an innocent business that hosts on DigitalOcean by posting a threatening or defamatory comment on their blog, then making an abuse report. This puts them in the position of hosting such speech, and permits DO to cancel the service without recourse as a TOS violation. That&#x27;s what you&#x27;re OK with if you&#x27;re OK with that being a term of the agreement. You point out that there&#x27;s no first amendment issue here, but there&#x27;s a lesson to be taken from the bill of rights anyway -- that sometimes protecting the rights of everyone means also protecting the rights of specific individuals you disagree with.<p>There may be small risk of this scenario happening, but if you are comparing to another host that doesn&#x27;t make service contingent upon policing of content you host, then any risk is infinitely larger than necessary. In general, minimizing the ways my business could be wiped out by some service provider helps me sleep better at night. If a user uses a service I provide to host something defamatory, I want there to be a court order before the web host goes flipping power switches on my racks, as it&#x27;s likely I&#x27;ll have been contacted by someone before it gets to that point.",1394753119
7395873,story,,,1,0,tsudot,"Essential Security for Linux Servers",http://plusbryan.com/my-first-5-minutes-on-a-server-or-essential-security-for-linux-servers/,,1394753118
7395872,comment,7394879,7395777,6,0,hsitz,,,"I&#x27;m with you on the skepticism thing.  When we read, at least when we read anything important, we aren&#x27;t simply ingesting bits of information.  We&#x27;re usually reading something that was carefully crafted to have a logical flow, where what is presented early supports or leads to what is said later.  To understand the structure of a written piece is not easy.  For &quot;dense&quot; works (e.g., some philosophy) it might take reading and re-reading several times, jumping forward and backward, to fully figure out what is being said, whether it makes sense, whether it&#x27;s to be taken as reliable or not.  Even that might not be enough.  The idea of speedreading for the &quot;main points&quot; is ridiculous.  Even less dense works have a logical flow, they aren&#x27;t just a list of bits of information.  If you&#x27;re going to read critically (i.e, with good comprehension), which is generally the proper way to read, speedreading is useless.",1394753095
7395871,story,,,1,0,dcawrey,"Mintspare Will Pay Bitcoin For Your Old Electronics",http://www.coindesk.com/mintspare-will-pay-bitcoin-for-your-old-electronics/,,1394753088
7395870,comment,7393133,7395512,2,0,toomuchtodo,,,"Sounds like they need to hire someone to take care of that then.<p>Disclaimer: Sysadmin/Devops",1394753068
