ID,Type,Story,Parent,Points,Comments,Author,Title,URL,Content,Created
9838022,comment,9836651,9837913,0,0,AlexDanger,,,"What is the metallic taste? I&#x27;ve experienced this before during fasting periods. Anyway to get rid of it without sugary fruit juice?",1436178101
9838021,story,,,1,1,dutrition,Dutrition,http://www.dutrition.com/,,1436178085
9838020,comment,9837342,9837703,0,0,rurban,,,"Mostly nonsense. You are making the same mistake as Matlab, throwing away all the internal Intel precision, just because you don&#x27;t know the boundaries and limitations or you don&#x27;t care.\nIn short Matlab did as you said in v6.0 and it was wrong.<p>Read Kahan and matlab&#x27;s (non)&quot;defense&quot;:\n<a href=""http://www.cs.berkeley.edu/~wkahan/MxMulEps.pdf"" rel=""nofollow"">http://www.cs.berkeley.edu/~wkahan/MxMulEps.pdf</a>\n<a href=""http://blogs.mathworks.com/cleve/2014/07/07/floating-point-numbers/"" rel=""nofollow"">http://blogs.mathworks.com/cleve/2014/07/07/floating-point-n...</a>",1436178035
9838019,comment,9837442,9837943,0,0,toomuchtodo,,,"Or perhaps &quot;Yeap to everything the article refers to.&quot; didn&#x27;t add to the conversation.",1436178018
9838018,story,,,1,0,neilpeel,"Q2 Exit analysis for Nordic technology companies",http://www.thenordicweb.com/blog/q2-exit-analysis-for-nordic-technology-companies,,1436178010
9838017,comment,9837493,9837884,0,0,tylerpachal,,,"I think it is better known as &quot;Developer Evangelist&quot; or &quot;Developer Relations&quot;.",1436177997
9838016,comment,9835433,9835615,0,0,bodyfour,,,"Your first sentence makes some sense, but your second is way off base.<p>Over a time scale of generations the wealth gap is controlled by larger social/taxation/etc questions.  (For one example, in the US more public money is spent educating a rich student than a poor one)  However, in the shorter day-to-day or year-to-year time scales it&#x27;s mostly just a reflection of equity values.  The rich have a lot of their money in equities and the poor have none.  If at the closing bell the stock markets are up then the wealth gap just increased that day; if they&#x27;re down it has shrunk.<p>The &quot;dollar losing value&quot; argument is silly.  The opponents of loose monetary policy (and especially gold bugs and bitcoin fanboys) have been predicting sky-high inflation.  When it didn&#x27;t show up on cue their line morphed into this wishy-washy claim that inflation is somehow secretly high.  Believe me, when inflation is high its not a secret.",1436177990
9838015,comment,9837265,9837842,0,0,cxromos,,,"you can&#x27;t borrow, get 100 EU billions in haircuts few years ago, have monthly salaries in the administration and bureaucracy between 1.5-1.7 monthly, get 60 EU billions 5 years ago and not expect to default with 90 EU billions only in salaries in public sector. And those were only salaries expenses. Incompetent, malignant, and corrupt bureaucracy is Greek&#x27;s heritage. No one will pay for that. When they borrow money in the eurozone they borrow money from middle class people who put that money into the bank. Then they call elections, and now are in recession, even though months before the elections they were on the upward line. They were already in the state that could service their own budget without borrowing and on top of that pay 3.4% interest to the creditors. The issue was that they didn&#x27;t wanted to pay that 3.4%. All of this we see today is that 3.4%. And of course an insane idea that communism will rule the EU. Once more. He is an asshole, a person who calls the ordinary people who borrowed money to the Greeks for years terrorists and nazists. Good riddance.",1436177987
9838014,comment,9836066,9837043,0,0,rustynails,,,"The science behind the movie was very clever. What has disappointed me is that Disney/Pixar keep on pushing the sexism gambit in their movies.  This movie wasn&#x27;t as bad as some of their others, but they are Consistently failing to address gender in a balanced way.\nDoes anyone male in this movie do/say anything good?\nWhat about Frozen? The stupid (Wessleton) and nasty (Hans) are only male.\nBrave? Same thread. The kings/Princes are all obnoxious and/or stupid.\nWreck-it-Ralph : Kowalski strikes Ralph across the face as a show of might and it&#x27;s meant to be funny (ie. The modern assertive woman who bashes men as &quot;humour&quot;)\nSeveral of the tinkerbell movies where ratchet & clank are the typical stupid males (and in most of them, they are almost the only males).  To be fair. They do portray the southern belle as a dimwitted hick too, which is the stupid southerner prejudice emanating from the U.S. civil war.\nHowever, they did a great job with Tangled and Princess and the frog - there&#x27;s a much better gender balance in those movies.\nIt&#x27;s a shame. You take your kids to see a supposedly family friendly movie and you cringe at the sexism that is pushed by the writers and directors.  Do you just shrug it off, wondering if this prejudice won&#x27;t rub off on your kids - or do you highlight the sexism to your kids and ask how a large studio could be so consistent in their bias, despite their deep attention to the science.  I can&#x27;t help feel there is more sexism and more conscious sexism than there has ever been. It really makes me sad.",1436177977
9838013,comment,9835433,9837829,0,0,lorenzfx,,,"> nobody really knows what had happened if we&#x27;ve let the banks die.<p>I&#x27;m not even an economist, so obviously I have no idea what would have happened (even as is in &quot;they don&#x27;t really know&quot; but I know even less).<p>My reasoning is this:\nif I remember correctly Greek government bonds were already trading at ~70% of their nominal values two or even three years ago (cannot check, currently on a train along the Rhine with <i>very</i> limited internet access). To me this means, that the banks had already written off ~30 of the value of that bonds, and I bet if we look at their balance sheets we&#x27;ll see that fact reflected.",1436177972
9838012,comment,9835650,9835804,0,0,m_t,,,"From what I read on reddit some time ago when this was posted.\nWith completely false number.<p>In our example city, you need to pump water on high ground, and then let it flow down. The high ground is at 30 unit. The water will be at the right pressure between 30 and 20.<p>But when it will reach 20 and below, there is too much pressure for the pipes! What is currently used is some kind of pressure relieving system that will release a bit of the pressure. The water can now come down between 20 and 10.<p>But then again, there&#x27;s too much pressure for the water to go from 10 to 0 without damaging the pipes. Another valve is there to take care of this.<p>So, for now, energy is used to pump the water up, and then we have to waste that energy when the water goes down in order to maintain acceptable pressure. With the new system, a part of the energy that was used can be harvested again.<p>This is the same idea behind harvesting the braking energy on hybrid cars.",1436177972
9838011,comment,9837188,9837847,0,0,teddythetwig,,,"It depends what you consider a startup. Off the top of my head I can name a few start-up companies that are operating in Wageningen, but in industries that don&#x27;t receive as much attention as sexy computer start ups.",1436177967
9838010,story,,,2,0,d3v3r0,"Design patterns in JavaScript",http://blog.alexdevero.com/design-patterns-in-javascript/,,1436177927
9838009,comment,9837353,9837353,0,0,czardoz,,,"Could &quot;freemium software&quot; be considered to be the new &quot;shareware software&quot;? With both types, you get some features without paying, and you must pay for the full experience.",1436177897
9838008,story,,,2,0,davidgerard,"Bitcoin and the dangerous fantasy of ‘apolitical’ money (2013)",http://yanisvaroufakis.eu/2013/04/22/bitcoin-and-the-dangerous-fantasy-of-apolitical-money/,,1436177865
9838006,comment,9835937,9836866,0,0,jschwartzi,,,"That one is for horses, and the other is from horses.",1436177818
9838005,comment,9837188,9837846,0,0,teddythetwig,,,"I disagree with your statement of &quot;No entrepreneurial mindset&quot; Perhaps when it comes to VCs, they don&#x27;t really get it, but I find that since capital is so hard to come by, the quality of startups here is much higher than in the US.",1436177789
9838004,comment,9836508,9836832,0,0,NamTaf,,,"It&#x27;s on top of a relatively large hill in the suburbs, so it gets a lot of breeze. Scan around behind you and you&#x27;ll see the extent of it. The traffic lights are just about at the top of that hill, so that house has at least a 180 degree view of the east, which is where the bay/ocean is and thus where breezes often blow from.",1436177780
9838003,comment,9836211,9837837,0,0,r721,,,"The key paragraph is as follows:<p>&quot;The investigation into the anomaly that caused New Horizons to enter “safe mode” on July 4 has concluded that no hardware or software fault occurred on the spacecraft. The underlying cause of the incident was a hard-to-detect timing flaw in the spacecraft command sequence that occurred during an operation to prepare for the close flyby. No similar operations are planned for the remainder of the Pluto encounter.&quot;<p>Also, try this link (content is same): <a href=""http://pluto.jhuapl.edu/News-Center/News-Article.php?page=20150705"" rel=""nofollow"">http://pluto.jhuapl.edu/News-Center/News-Article.php?page=20...</a>",1436177741
9838002,comment,9837188,9837975,0,0,jacquesm,,,"Good starting points:<p><a href=""http://www.expatica.com/nl/visas-and-permits/Moving-to-the-Netherlands-Guide-to-Dutch-visas-and-permits_101934.html"" rel=""nofollow"">http://www.expatica.com/nl/visas-and-permits/Moving-to-the-N...</a><p><a href=""http://www.newtoholland.nl/"" rel=""nofollow"">http://www.newtoholland.nl/</a>",1436177715
9838001,comment,9836336,9836336,0,0,thomasrossi,,,"do you think there was some help from the inside? Or just overruled?",1436177709
9837999,comment,9837188,9837975,0,0,century19,,,"There is a Knowledge Migrant Visa which means that anybody with decent IT skills should not have a problem.  Though I think you need the job offer first.  Hiring people from outside the Netherlands and getting them a visa is very normal so it shouldn&#x27;t be a barrier for anybody who wants to move to Amsterdam.  There is also a tax incentive where foreigners don&#x27;t pay as much tax (30% ruling, the first 30% of your income doesn&#x27;t get taxed) for the first ten years.  Again, if you are sufficiently skilled you should qualify.",1436177664
9837998,comment,9835503,9837904,0,0,threeseed,,,"Thrift has been essentially deprecated for quite a while now.<p>Either use CQL or the Binary Drivers.",1436177619
9837997,story,,,11,5,talkingquickly,"The First Swimming App on the Apple Watch",http://info.activeintime.com/news/2015/6/29/the-worlds-first-swim-app-on-the-apple-watch,,1436177580
9837996,comment,9837493,9837707,0,0,tylerpachal,,,"Could you order those (talks, Stackoverflow, blog posts, etc) in order of importance?  I&#x27;m in a similar spot as OP; looking to become an evangelist.  I&#x27;ve actually taken my first job internationally, and wouldn&#x27;t mind the travel at all.",1436177570
9837995,comment,9837353,9837353,0,0,patio11,,,"The word is pretty decisively dead [+].  Lots of companies make money by selling software over the Internet on a free trial model.  As was routinely observed in the shareware community as we tired of the name, &quot;How can we differentiate &#x27;shareware&#x27; from the rest of the industry when <i>Microsoft Freaking Office</i> is sold on a free trial model these days?&quot;  After the widespread rise of the web &quot;You can give the installer executable to other people.  Please do!&quot; was no longer a really compelling advantage, and it <i>always</i> confused a lot of civilians.  (&quot;You mean I don&#x27;t have to pay for it, right?&quot; &quot;No, that is <i>not</i> what shareware means.&quot; &quot;You greedy bastard!&quot;)<p>I just sold my business which did this back in April -- it supported me above my previous day job salary for a while back in the day, before the rest of my business eclipsed it.  I was, ahem, very much not the most successful HNer with the model, but many of the others like to keep things under their hat.<p>At least one received a check written on purple paper with an exclamation point on it, as if the dollar amount wasn&#x27;t an exclamation enough.  (He&#x27;s occasionally active on HN and can tell you the story if he wants to, but it isn&#x27;t mine to tell.)<p>[+] I used to be a card-carrying member of the Association of Shareware Professionals, which is now the Association of Software Professionals, because the membership expressed its opinion that the shareware branding communicated &quot;crappy software which will give your Googles a virus but is otherwise free.&quot;",1436177566
9837994,comment,9835808,9837595,0,0,hokkos,,,"It is more the &quot;extends&quot; than &quot;class&quot; that is controversial because it eschews other pattern like mixins.",1436177558
9837993,comment,9837353,9837353,0,0,_pmf_,,,"Shareware has been renamed to &quot;Apps&quot;.",1436177545
9837992,comment,9827051,9835012,0,0,jacquesm,,,"> The funny thing is, if you&#x27;re interested in performance, you&#x27;re probably going to be writing a JIT, so this optimization is really just a stop-gap measure.<p>Exactly. And stop-gap measures are fine if and when they&#x27;re followed up by a proper solution. Unfortunately stop-gap measures tend to be a lot more permanent than originally intended in practice.",1436177544
9837991,comment,9837188,9837975,0,0,teddythetwig,,,"If you are interested, and an American citizen, send me a DM and I&#x27;d be glad to answer any questions.",1436177540
9837990,comment,9837425,9837910,0,0,louithethrid,,,"Im sure we can assign it to the survivors of a pandemic, to dig two massgraves - to be blamed and not to be blamed.<p>Guess who gets the flowers.",1436177536
9837989,comment,9834296,9837059,0,0,ionised,,,"Who&#x27;s holding the USA to high standards?",1436177519
9837988,comment,9834165,9836157,0,0,dottrap,,,"<p><pre><code>  Because if you&#x27;re scripting something out, it&#x27;s very possible that you&#x27;ll need to run it outside of a Mac in no time.\n</code></pre>\nYes, it&#x27;s still early, but with Swift becoming open source, the portability problem will probably become less of an issue.<p><pre><code>  Plus, there&#x27;s no decent dependency management yet and you can&#x27;t compare the amount of external libraries commonly used for scripting with languages like Python or Ruby.\n</code></pre>\nThinking about this, I wonder if it is actually as big of a problem as some may think. Swift has built-in automatic bridging capabilities to both C and Objective-C. Assuming this works the same in the REPL/command line (I haven&#x27;t verified this), then you can directly call every system library on your platform that is written in C or Obj-C (which is all of them). The need to download external modules like in Python or Ruby seems greatly diminished.<p>And to the portability question, on a Unix platform in general, the majority of libraries available for the platform are C libraries with all the capabilities you normally would have to get as a separate module for Python or Ruby. Since this is all directly available without separate modules, when you do need a feature not installed on your system, you would simply install a C library with that capability through your system&#x27;s normal packaging management system or build/compile it yourself.",1436177494
9837986,comment,9837265,9837615,0,0,lectrick,,,"Assumes the will of a single man would have been enough to rescue an entire economy based on what looks to outsiders like an ingrained culture of laziness",1436177482
9837985,comment,9837188,9837846,0,0,teddythetwig,,,"Haha, if it wasn&#x27;t so heavy on mentioning Rockstart, I would have assumed it was paid for by SBC. They are much more about selling themselves outside of The Netherlands. I&#x27;ve heard some people saying that Rockstart is trying to open an SF office, but I&#x27;m not sure if I believe that.",1436177463
9837984,comment,9837802,9837802,0,0,jbrooksuk,,,"I&#x27;ve been using Numi for a couple of weeks now. It&#x27;s a really nice way of playing with an algorithm and breaking down each part with variables.",1436177458
9837983,comment,9837493,9837907,0,0,onion2k,,,"He used it in a post on a major tech forum, specifically asking for advice about becoming an evangelist. It&#x27;s not like Obama merely saying the N-word, it&#x27;s like Obama saying the N-word in a speech about the proliferation of hate speech against the black community in America.",1436177455
9837982,comment,9837342,9837924,0,0,exDM69,,,"> Unless you are working with small numbers? Suppose you are dividing 1e-30 by 1e-30 than the result should still be 1 so if you return 0 when the second argument is < 1e-6 then you&#x27;re screwed.<p>A very good point which I didn&#x27;t think of! Obviously the 1e-6 figure is specific to the application.<p>How should one avoid division by zero then? You can&#x27;t figure out the relative error without a division, can you? For normal comparisons, using a relative error is the way to go but the zero case is different.<p>On the other hand, using quantities of magnitudes in 1e-30 is already using half the exponent, a change of units may be due here.",1436177452
9837981,comment,9837353,9837930,0,0,Lrigikithumer,,,"This might be true for the mobile market, however the PC market is a different beast entirely.",1436177452
9837980,comment,9837802,9837802,0,0,ghshephard,,,"Highly recommend Soulver in this category as well - I probably use Soulver 100+ times a day, it&#x27;s particularly awesome around things like throughput - you can throw things like, &quot;10 kbits/second at 30 days in megabytes&quot; - the sort of stuff people screw up all the time with excel when they forget to multiple by 8 somewhere.<p>It can also do the Currency translation, &quot;1 BTC in USD&quot;<p>And string a bunch of them, to do things like, &quot;$2/square foot in SGD/square meter&quot;",1436177451
9837978,comment,9833717,9835794,0,0,Anderkent,,,"> Were you given a benzo specifically to erase your memory of the events?<p>I don&#x27;t remember! :P",1436177413
9837977,comment,9837353,9837353,0,0,andersthue,,,"I agree that the term shareware is dead, but time limited or feature limited freeware with a paid full version is not dead.<p>I make a living from <a href=""http://www.watermark-image.com"" rel=""nofollow"">http://www.watermark-image.com</a> and other sw for windows, I have  et a lot of people at MicroConf who makes a living from sw.",1436177391
9837976,comment,9837342,9837785,0,0,panic,,,"<i>It should be noted however (as I do) that the decimal number is still not equivalent to the actual floating point number, only that when converted back it is the same.</i><p>Since 2 divides evenly into 10, every binary number has an exact decimal representation, and you can produce a decimal string which is equivalent to any floating point number.  You may need quite a few digits, though.",1436177377
9837975,comment,9837188,9837188,0,0,realrocker,,,"Interesting. Was wondering how hard it is to get a work visa?",1436177362
9837974,comment,9837188,9837719,0,0,jacquesm,,,"> This article paints a picture of incredible industrial innovation, but if you look at dutchstartupjobs.com, the majority of the startups here seem to be social media or marketing related, just like the rest of the country.<p>Yep. If there is one thing a particular circle is very good at it is slapping themselves on the back and having dinners in expensive restaurants. Fortunately not everybody is like that and most people here have their feet firmly planted in the mud.<p>I dislike hype like this, it&#x27;s like talking to companies that exist for three weeks and immediately start branding themselves as &#x27;world leader&#x27; in their domain.",1436177362
9837973,comment,9835433,9837883,0,0,Djeman,,,"Austerity isn&#x27;t about rising taxes, as much, as about lowering government costs.",1436177342
9837972,comment,9832987,9833570,0,0,dirkt,,,"TeX (and LaTex) is pretty old, and designed to run on machines much less powerful than what we have today. Back then, I&#x27;ve used LaTeX on MSDOS PCs with 640 kB of memory. And the original TeX was written in 1978 for a PDP-10.<p>Many distributions are indeed big and clunky because you get lots of packages and fonts all in one, and there&#x27;s no good way to selectively install.<p>Or do you mean verbosity when writing the markup? Actual text doesn&#x27;t require a lot of markup, and you can make things even simpler by defining your own commands.",1436177339
9837971,story,,,1,0,omribahumi,"Ask HN: How do you build your Docker containers?",,"Are you using a simple Dockerfile? Packer.io?<p>Are you using simple bash commands or a CM tool like Ansible/Chef/Puppet?",1436177333
9837970,comment,9835433,9835591,0,0,landryraccoon,,,"I don&#x27;t often hear war as described as &quot;easy&quot;. I don&#x27;t think any of Greece&#x27;s creditor nations are willing to start a shooting war over a default.",1436177323
9837969,comment,9837188,9837188,0,0,Hhefferman1989,,,"I&#x27;m getting very bored with the start-up cheerleading industry in Europe: a small but very vocal number of publications (Tech.eu, The Next Web, TechCrunch EU) and event organisers constantly championing random cities in Europe as up-and-coming technology epicentres to rival Silicon Valley. Even London, which is by any reasonable measure the largest hub of start-up activity in Europe and has seen the most significant exits, comes nowhere close to Silicon Valley in terms of deal volume, capital availability, density of senior talent, etc. Sure, tech start-ups exist in Amsterdam and in Berlin, and in Stockholm, and in Barcelona, but these cities aren&#x27;t technology hubs, creating self-sustaining economies driven by meaningful exits and the development of world-leading domain expertise: many of the start-ups in these cities are only sustainable because VCs in Europe are primarily funded by European governments. That&#x27;s what a &quot;hub&quot; is; take away the hype and the government money and it still exists.",1436177305
9837968,comment,9836991,9837523,0,0,gonvaled,,,"Are you sure about that?<p>Isn&#x27;t a country better off after debt restructuring?",1436177301
9837967,comment,9835433,9837829,0,0,robinei,,,"If the banks were going to default without taxpayer help, why didn&#x27;t we just nationalize them and let the share holders take the loss they themselves have set themselves up for? Then we could shoulder the cost of getting the banks afloat again, and then subsequently regain some of the cost at least by selling them (instead of just giving taxpayer money to the risk-taking share holders like we do now)",1436177291
9837966,comment,9836023,9836023,0,0,boothead,,,"I&#x27;m really getting a lot out of Tim Ferriss&#x27; podcast <a href=""http://fourhourworkweek.com/podcast/"" rel=""nofollow"">http://fourhourworkweek.com/podcast/</a> lately. Especially the episodes with Kelly Starrett, Josh Waitzkin, Sam Harris, Peter Attia, Pavel Tsatsouline and Whitney Cummings.<p>I think at a certain point you start to recognize that more tech isn&#x27;t helping as much as it was (diminishing returns perhaps) and that a more holistic approach to improving is necessary.",1436177278
9837965,comment,9835937,9837655,0,0,vorg,,,"> &quot;A&quot; and &quot;the&quot; are most certainly the same part of speech.<p>I disagree...<p>> There are many other words in the same category:<p>All these example words add semantic meaning to the noun phrase, and a primary sub-category for their use is whether the noun is countable (e.g. cat) or uncountable (e.g. salt):<p><pre><code>    cats                                         VS salt\n    a cat/any cat, some cats, all cats/every cat VS some salt, all salt\n    no cats, one cat, two cats, ...              VS no salt, some salt\n    few cats, many cats                          VS little salt, much salt\n    my cat/s, our cat/s, your cat/s              VS my salt, our salt, your salt\n    his cat/s, her cat/s, its cat/s, their cat/s VS his salt, her salt, its salt, their salt\n    this cat, that cat, these cats, those cats   VS this salt, that salt\n</code></pre>\nThe article &quot;a&quot; is only used with countable nouns (unless an uncountable is being used as a countable with meaning &quot;a type of&quot;) and so fits into this sub-categorization.<p>> Note that &quot;my&quot;, &quot;his&quot;, and &quot;this&quot; also mark definiteness on the noun phrase.<p>In those cases the demonstrative is adding semantic information to the noun, whether possession (&quot;my&quot;, &quot;his&quot;) or location (&quot;this&quot;).<p>If we split &quot;A cat sitting on the rug meows.&quot; into the 2 sentences &quot;A cat is sitting on the rug. The cat meows.&quot;, the only function of the &quot;the&quot; in the second sentence is to provide a cohesive link to something in the first sentence. Similarly, &quot;Some salt stored in the shaker spills.&quot; can be split into &quot;Some salt is stored in the shaker. The salt spills.&quot; This makes &quot;the&quot; solely a cohesive device, independent of the semantics and in the domain of thematics. So &quot;a&quot; and &quot;the&quot; are used orthogonally, each in different ways of analyzing an utterance.",1436177267
