ID,Type,Story,Parent,Points,Comments,Author,Title,URL,Content,Created
9838086,comment,9836677,9838062,0,0,kang,,,"Such systems are prone to political effects. For example, a pop song would get much more upvotes than a genuine discussion. Over time intellectuals leave because of the noise.",1436179312
9838085,comment,9837265,9838015,0,0,wsc981,,,"I can&#x27;t fault the Greek government for lending what the creditors (banks from Germany and France) were willing to provide. I think the creditors made a huge mistake in their greed and thinking it was a sound investment since the credit would be backed by strong countries in the Eurozone anyway. And I also think ik was a huge mistake to include Greece in the Eurozone, since at the time the problems with the Greek economy were already well known.<p>Now the Greeks have voted no, we finally have reached the moment we can right these wrongs. Greece should leave the Eurozone so they can achieve a better trade position. The Greek debts should be wroten off as losses to the creditors so the Greek economy can recover. And perhaps other weak countries in the Eurozone should follow suit, eventually.<p>It&#x27;s morally wrong to keep the Greek people in endless debts that they&#x27;ll never be able to repay anyways.",1436179309
9838084,comment,9835655,9835655,0,0,sudioStudio64,,,"Petzold is awesome. His blog has several articles he&#x27;s written about his political views. I&#x27;m glad that someone with that kind of notoriety isn&#x27;t afraid to write about politics.",1436179295
9838083,comment,9835937,9835937,0,0,Anderkent,,,">(If you have pronoun as a part of speech, that would be a very clever answer, but you&#x27;re going to have a lot of trouble convincing non-linguists of that.)<p>Can someone elaborate on that?",1436179263
9838082,comment,9836651,9838039,0,0,pennaMan,,,"I disagree. It&#x27;s worth mentioning simply because the practice has survived a long time trough many cultures. Time is a really good curator - if something survives a really long time (thousand of years scale) it is very likely to be of use.",1436179204
9838081,comment,9837265,9838045,0,0,vruiz,,,"> you have to find agreement with the other 18 elected leaders that try to represent their people as well<p>That right there might be the root of all EU problems.",1436179189
9838080,comment,9833111,9836526,0,0,NotableAlamode,,,"<p><pre><code>    you promised to take care of your wife\n</code></pre>\nIt&#x27;s not an unconditional promise. The promise assumes that the partner does the same. Yet only men are being punished (via taking their children, houses, monies), a clearcut violation of their human rights that bayesianhorse is defending.",1436179178
9838079,comment,9835963,9836914,0,0,icebraining,,,"I don&#x27;t see the EFF saying that ICANN is as a whole of that opinion; what they said is that there is such a proposal, and that ICANN is considering it (which they are, and which is why they&#x27;re asking for external input).",1436179155
9838078,comment,9836197,9836197,0,0,BetaCygni,,,"They reference Asimov. Good. His rules should provide enough inspiration and he explored them thoroughly.<p>For example: the zeroth law (preserve humanity) might help in deciding between a child and an adult. If the adult is beyond reproductive age (e.g. elderly) it may save the child. If the adult is still able to reproduce and the child would not survive on its own, save the adult. In case of doubt it should probably use quality adjusted life years, and that will probably cause it to save the child.",1436179138
9838077,comment,9836651,9837887,0,0,megablast,,,"I started to skip breakfast a few years ago. Now I skip lunch as well. Feel a lot better for it, don&#x27;t lose energy, and don&#x27;t get tired in the afternoon. I run everyday in the morning instead of breakfast, and cycle a lot.",1436179126
9838076,comment,9835172,9835604,0,0,sudioStudio64,,,"You are so right and clever! What a clever boy you are! I&#x27;m firmly put in my place. Thank you for clearly showing the truth of the moment. Oh, oh, how wrong I was.<p>Are you sure that there weren&#x27;t any petitions to get rid of her before this weekends thing?",1436179112
9838075,comment,9837915,9837915,0,0,melling,,,"&quot;Real artists ship&quot;<p>&quot;if you are not embarrassed by the first version of your product, you&#x27;ve launched too late&quot;<p><a href=""https://en.m.wikipedia.org/wiki/Release_early,_release_often"" rel=""nofollow"">https://en.m.wikipedia.org/wiki/Release_early,_release_often</a><p>I&#x27;m sure there are many others, but these ones keep me shipping.",1436179107
9838073,comment,9835433,9837967,0,0,dan00,,,"> If the banks were going to default without taxpayer help, why didn&#x27;t we just nationalize them and let the share holders take the loss they themselves have set themselves up for?<p>That sounds a bit like only risk-taking share holders would have been harmed and that wouldn&#x27;t be much harm for the society at all.<p>I really don&#x27;t think that the harm would be that focused, because banks aren&#x27;t only about risk-taking share holders and because of the interconnection of banks at the end someone might be harmed you&#x27;ve never thought about.<p>I really don&#x27;t envy any politician having to make a decision in such a case.",1436179061
9838072,comment,9837915,9837956,0,0,soft_dev_person,,,"If I ever buy a car with skateboard as a chassis, I&#x27;ll be very disappointed!<p>Sorry, just had to =)",1436179057
9838071,comment,9837188,9837702,0,0,skrebbel,,,"I agree with you entirely.<p>Nevertheless, when Dutch spokespeople say &quot;high tech&quot;, they mean machines, robots, chips, etc. Complex machinery that you can touch. More generally, hardware.<p>There&#x27;s quite a bunch of impressive stuff happening in this space in the Netherlands, even compared to Silicon Valley. Companies like ASML (builder of the chip machines that produced 80% of the chips in your smartphone) and FEI (electron microscopes that can show individual molecules) are some BigCorp examples that are tremendously successful but remarkably unknown outside the Netherlands. There&#x27;s a whole bunch of startups and SMEs doing similar stuff at similar levels: PhenomWorld, Solaytec, Mapper, Nemo Healthcare are a small number of pretty successful ones that I know of, and there&#x27;s a whole bunch more.<p>In this space, Silicon Valley has Intel and Apple. These are huge and awesome companies, but there&#x27;s a way smaller slipstream of SMEs to complement them, definitely if you compare it to the total amount of tech businesses there. To my knowledge, the vast, vast majority of Silicon Valley startups do web/mobile stuff these days.<p>On a personal note though, I find that while these Dutch companies make incredibly impressive products, the way they accomplish this is often very old-fashioned and stubborn. 30 million lines of untested, undocumented, takes-a-night-to-compile C code, anyone? Welcome to ASML.",1436179021
9838070,comment,9837905,9837934,0,0,spacemoelte,,,"I also switched to fastmail from gmail.\nI setup gmail to forward all emails to my new address, and then running the gmail importer in fastmail.\nSo i have all my emails in fastmail, and receive all emails sent to the old address.\nI&#x27;m using a custom domain for my emails.",1436179005
9838069,comment,9836991,9837274,0,0,isoos,,,"Maybe austerity is a really bad idea. It has its place in the general monetary toolbox [1], but history shows that it is really not worth to use only that (Mark Blyth: Austerity - The History of a Dangerous Idea [2]). Also, even the IMF has studies where the positive effects of austerity are questioned [3].<p><pre><code>    [1] http://www.economicprinciples.org/\n    [2] https://www.youtube.com/watch?v=JQuHSQXxsjM\n    [3] http://www.imf.org/external/pubs/ft/wp/2011/wp11158.pdf\n</code></pre>\nAlso, the EU needs much more wealth redistribution than it is currently happening, and austerity acts contrary to that:\n<a href=""https://plus.google.com/+JeanBaptisteQueru/posts/CPB9bwHqsfn"" rel=""nofollow"">https://plus.google.com/+JeanBaptisteQueru/posts/CPB9bwHqsfn</a>",1436178967
9838068,comment,9837307,9837307,0,0,dualogy,,,"Ah, Owsley &quot;The Bear&quot; Stanley. He also lived on a fatty-meat-only zero-carb diet for some 50 years in decent health until he died in a car accident aged 75 in 2011. Quite the character: <a href=""http://www.thebear.org"" rel=""nofollow"">http://www.thebear.org</a>",1436178966
9838067,comment,9837188,9837969,0,0,nraynaud,,,"I agree with most of the message, but remember that in the US everything is funded by the government too (direct investments, state contracts, research contracts, tax-breaks etc).",1436178965
9838066,comment,9837405,9837405,0,0,jakozaur,,,"Good, lengthy read, but I find it pessimistic. Identifies well some problems, but I believe there are better strategies to mitigate the issues.<p>For example:\n<a href=""http://www.theeffectiveengineer.com/blog/what-makes-a-good-engineering-culture"" rel=""nofollow"">http://www.theeffectiveengineer.com/blog/what-makes-a-good-e...</a><p>1. Optimize for iteration speed.<p>2. Push relentlessly toward automation.<p>3. Build the right software abstractions.<p>4. Develop a focus on high code quality with code reviews.<p>5. Maintain a respectful work environment.<p>6. Build shared ownership of code.<p>7. Invest in automated testing.\n...<p>Author of that blog post also wrote excellent book on that subject.",1436178955
9838065,comment,9835172,9835439,0,0,sudioStudio64,,,"I remember petitions to get rid of her before this weekends freak out. Are you saying that the red pill types are not fanning these flames?",1436178924
9838064,comment,9837493,9837983,0,0,mobinni,,,"Well if we can&#x27;t make mistakes...",1436178886
9838063,comment,9835433,9835717,0,0,coob,,,"And we&#x27;re treating those figures as trustworthy are we? Eurostar consistently failed to validate numbers provided by the Greek government in that period.",1436178859
9838062,comment,9836677,9836677,0,0,clemensley,,,"Love the idea. We are working on something similar, but without the decentralization at this point. In our system users can invest bitcoin in a post by upvoting it. If that post gets many upvotes subsequently the investor will make a profit, otherwise a loss.\n<a href=""https://github.com/rolandnsharp/node-bitcoin-reddit"" rel=""nofollow"">https://github.com/rolandnsharp/node-bitcoin-reddit</a><p>We are looking for collaborators for this project. Please feel free to get in touch if you are interested (@clemensley).",1436178835
9838060,comment,9837493,9837493,0,0,jondubois,,,"Anyone who made it big before 25 just got extremely lucky. That doesn&#x27;t mean that they&#x27;re not smart though.<p>You shouldn&#x27;t give yourself such a short timeline for achieving your career goals - The odds are severely against you.\nCapitalism isn&#x27;t optimised for fairness; it&#x27;s optimised for making as many people work for as long and as hard as possible (and this effect is only going to get worse with time).<p>Financial success is actually an oddity - A flaw in the system. It goes against what it&#x27;s optimised to do.<p>Think of capitalism like the carrot dangling in front of the horse to keep the horse moving.<p>If you&#x27;ve learned to enjoy watching the carrot dangling and wiggling around aimlessly at the end of that stick, then you&#x27;re getting the most value out of the system.",1436178818
9838059,comment,9837353,9837353,0,0,vinceyuan,,,"Shareware becomes free apps with in-app purchases.",1436178813
9838058,story,,,1,0,boothead,"It takes a network",http://foreignpolicy.com/2011/02/21/it-takes-a-network/,,1436178808
9838057,comment,9836991,9837473,0,0,alextgordon,,,"Finding efficiencies and <i>austerity</i> are not the same thing. Germany has free university tuition, Greece has a failing healthcare system that keeps running out of medicine.<p>Germany has not implemented austerity, yet it feels the need to lecture other countries on the need to do so.<p>Greece is part of the single market, that means that people can <i>leave</i>. All the smart, qualified people left Greece a long time ago.",1436178786
9838056,comment,9837479,9837479,0,0,rfergie,,,"Snowplow: <a href=""https://github.com/snowplow/snowplow"" rel=""nofollow"">https://github.com/snowplow/snowplow</a> and <a href=""http://snowplowanalytics.com/"" rel=""nofollow"">http://snowplowanalytics.com/</a>",1436178779
9838055,comment,9837915,9837915,0,0,shabbyrobe,,,"What does this mean for the future of nanomsg&#x27;s development?",1436178762
9838054,story,,,1,0,abrar2015,"The all new medical SmartWatch from Google",https://ejablog.com/the-all-new-medical-smartwatch-from-google/,,1436178752
9838053,story,,,2,0,robinwauters,"Let a thousand European scale-ups blossom",http://tech.eu/features/5225/1000-scaleups-europe/,,1436178744
9838052,story,,,1,0,nksonfire,"Some unknown features or tricks in C language",http://www.easycppcodes.com/c-programming/some-unknown-features-or-tricks-in-c-language/,,1436178704
9838051,comment,9835808,9837818,0,0,alkonaut,,,"I feel like in a new design you would pick one or the other, as a second scoping rule would not carry its own weight in terms of what problems it solves vs the complexity of implementing runtimes or learning the language. In that case I&#x27;m almost certain you would go for block only as it is the default in nearly all curly braced languages.",1436178668
9838050,comment,9837265,9837397,0,0,kenOfYugen,,,"Greece has been rolling down the slope for the past 5 years.\nHating on a man for years of a country&#x27;s peril does not offer constructive criticism.<p>Maybe you should know the data before you blame a man.\nHow about some charts and numbers from December 2014:\n<a href=""http://www.telegraph.co.uk/finance/economics/11283931/Nine-charts-showing-why-Greece-has-to-leave-the-euro.html"" rel=""nofollow"">http://www.telegraph.co.uk/finance/economics/11283931/Nine-c...</a>",1436178659
9838049,comment,9835937,9837050,0,0,cafard,,,"In Homeric Greek, the definite article is more of a demonstrative adjective, isn&#x27;t it, more &quot;that man&quot; rather than &quot;the man&quot;? And Greek hung on as the language of administration in the eastern part of the empire.",1436178632
9838048,comment,9836900,9836900,0,0,irascible,,,"PSA: Names in software matter. I know we want to believe we live in some language agnostic utopia, but the fact is, programming culture, literature, and science, is dominated by the english language... so when you name your language something like &quot;Coq&quot; (sounds like cock), or Nimrod, (a common american childrens insult), or your OS, Losethos, (which has the word Lose in it, even though it is an actual place...), You face a tremendous barrier to adoption. Case in point, the previous examples, Nimrod changed their language name to Nim, and have seen a recent surge in visibility/popularity, Losethos renamed to TempleOS, and has seen a similar wave of attention... Names matter.",1436178608
9838047,comment,9837342,9837903,0,0,rurban,,,"Technical calculations do care, e.g FMAC in matlab.\n<a href=""http://www.cs.berkeley.edu/~wkahan/MxMulEps.pdf"" rel=""nofollow"">http://www.cs.berkeley.edu/~wkahan/MxMulEps.pdf</a><p>In short Java went ahead and declared imprecise and architecture-independent float results better than more precise and architecture dependent results. \nMatlab followed suite with v6.0 and found big errors in mxmuleps compared to Matlab v5.0.<p>Such a little rounding problem in the 6th digit e.g. caused a big problem in one architectural problem of mine, where it did cost several millions. Check for the costs of rounding problem in the real world, comp.risks e.g.\n<a href=""https://www.ima.umn.edu/~arnold/disasters/"" rel=""nofollow"">https://www.ima.umn.edu/~arnold/disasters/</a>",1436178574
9838046,comment,9836991,9837195,0,0,maaku,,,"You are not a sovereign state.",1436178556
9838045,comment,9837265,9837402,0,0,allendoerfer,,,"> To me, it seems he&#x27;s a true hero of his nation, putting the needs of his people before the needs of the creditors.<p>If you are responsible for the finances of a whole state you have to find agreement with the other 18 elected leaders that try to represent their people as well, preferably before you are unable to pay for your countries loans and it collapses.<p>The Euro group was already moving in his direction but they have to justify their actions in front of their own people. I am all for some fresh wind but if you go into politics you have to be able to make compromises. You cannot just want something thinking that you are the only intelligent person in the room and step back if you do not get it, especially when the future of your country is at stake.",1436178524
9838044,comment,9837493,9837839,0,0,stan_rogers,,,"Well, Einstein did bugger-all for a quarter century, and all he could come up with at 26 was four short inconsequential papers that together wouldn&#x27;t have merited extra postage on the envelope.",1436178467
9838043,comment,9835937,9836427,0,0,cafard,,,"It has been a while since junior high, but I believe they taught us that articles were a subset of adjectives.",1436178466
9838042,comment,9837188,9838024,0,0,century19,,,"Interesting.  The same applies to the 30% ruling I see (<a href=""http://www.expatax.nl/30ruling.php"" rel=""nofollow"">http://www.expatax.nl/30ruling.php</a>).  You need a high salary to qualify for it.",1436178419
9838041,story,,,1,0,nns,"Beyond the Boring: Has the Web lost its soul?",http://www.smashingmagazine.com/blog/2015/07/06/hunt-for-the-webs-lost-soul/,,1436178367
9838040,story,,,41,25,daviducolo,"Postico: A Modern PostgreSQL Client for OS X",https://eggerapps.at/postico/,,1436178340
9838039,comment,9836651,9837637,0,0,4ydx,,,"Whether or not it is a coincidence mentioning religion adds nothing to the conversation.",1436178320
9838038,comment,9836336,9837886,0,0,rjaco31,,,"The massive PR hit they&#x27;re taking means their company will most likely die. And &quot;compromising&quot; someone merely by letting one download stuff is at best a gamble, any decent infosec professional will examine this stuff with the same precautions as when analyzing malware.",1436178314
9838037,comment,9837802,9837802,0,0,kbd,,,"Seems worth mentioning the Frink programming language here:<p><a href=""https://futureboy.us/frinkdocs/"" rel=""nofollow"">https://futureboy.us/frinkdocs/</a>",1436178309
9838036,comment,9836991,9837391,0,0,riffraff,,,"AFAIR, most of those countries defaulted on their socialist era debt too. \n(Except hungary, which was already known as the &quot;happiest barrack in the communist camp&quot;)",1436178266
9838035,comment,9836336,9837739,0,0,jacquesm,,,"That Outlook window has a header labeled &#x27;product activation failed&#x27;.<p><a href=""http://i.imgur.com/tdAKXFD.jpg"" rel=""nofollow"">http://i.imgur.com/tdAKXFD.jpg</a>",1436178256
9838034,comment,9837189,9837189,0,0,leppr,,,"For those using uMatrix/NoScript:\n<a href=""https://archive.is/wPJa9"" rel=""nofollow"">https://archive.is/wPJa9</a>",1436178252
9838033,comment,9837353,9837353,0,0,pdpi,,,"There&#x27;s at least one piece of modern software I use on a daily basis that should count as shareware: Sublime Text.",1436178250
9838032,comment,9836651,9837913,0,0,fnayr,,,"That&#x27;s a sign of ketosis!",1436178234
9838030,comment,9835904,9835904,0,0,dghf,,,"Possibly more shocking, more than 60% of men who were born in 1923 and still alive in 1941 would die during the War (assuming I&#x27;ve understood the article correctly and my maths is sound).",1436178202
9838029,comment,9837265,9837842,0,0,cxromos,,,"And you can&#x27;t win elections by promising not to pay back your debts and accuse everyone else of trying to destroy the democracy. New government does not mean you can erase your debt. And the fact that you won the elections by telling fairytales does not mean that someone else will pay for the fairytale. That is borderline insanity. Democracy is responsibility of the successive government for the deeds of the previous one. May that be debt or a warcrime.",1436178175
9838028,story,,,1,0,DrScump,"How Wolf Became Dog",http://www.scientificamerican.com/article/how-wolf-became-dog/,,1436178171
9838027,comment,9835655,9837843,0,0,kromem,,,"First off, I wasn&#x27;t in the least presenting it as an actual alternative. I was putting the spree shooting issue in context (much like the terrorism vs falling TVs statistics). Personally, as someone that&#x27;s rather data driven, I hate when statistically rare issues get WAY more attention than more prevalent and pressing issues. The gun control issues really shouldn&#x27;t revolve around mass shootings any more than the issue around national nutrition should revolve around nut allergies. It&#x27;d be insane if the country was arguing banning peanuts after someone dies from a nut allergy. But we do the same with guns now.<p>The real discussion is the everyday issue regarding guns. And you&#x27;re probably correct with your assumptions. Here in the US, we have 4x the homicide rate as, say, the UK, where gun ownership is very low.<p>And our violent crimes is probably only about 60-70% of their rate.<p>BUT, if we look at per capita rates for that, it means here we have about 3 more people killed out of 100,000 each year, but they have about 200-300 people beaten, raped, etc each year out of 100,000.<p>Again, crime rate comparisons are a very inexact and difficult thing to do well, but my numbers for this come from a rebuttal of a pro-gun sound-byte, so I&#x27;m hoping they&#x27;re a bit on the conservative side: <a href=""http://blog.skepticallibertarian.com/2013/01/12/fact-checking-ben-swann-is-the-uk-really-5-times-more-violent-than-the-us/"" rel=""nofollow"">http://blog.skepticallibertarian.com/2013/01/12/fact-checkin...</a><p>Personally, I&#x27;m lucky to not know anyone who has been shot dead by a criminal. (I do know someone who was shot dead by police while drunk though - but police gun ownership is not at all on the discussion table in the US). I do know two people who were beaten and left brain damaged, and one that was raped in front of her kids during a home invasion with a knife-welding assailant. Now, I&#x27;ve mostly lived in areas in the US that were the least gun friendly (NYC and CA), so maybe people in other areas would have different stats. But certainly even here in the US, violent crimes are around 100x more common than homicides, and a reduction of 30-40% there would improve a greater quantity of lives than a 4-fold reduction in homicides. (The net quality of a trade-off is extremely debatable. And a debate we should be having.)<p>Still, I&#x27;d love to see better and more trustworthy data at a greater scale than what&#x27;s currently available before I throw my weight behind one side or another. I can argue either side because both have valid points. But I find myself at a loss for which I ultimately agree with, as I simply don&#x27;t have enough information to make an educated decision. And as someone that actually actively looks for the data, if I can&#x27;t figure it out, I have a hard time listening to self-assured opinions on the matter (of which there are plenty on both sides).<p>This is a complex issue that needs sophisticated analysis, but that&#x27;s not at all the attention it gets as long as the only time it&#x27;s discussed is in the context of a knee jerk reaction to a 1 out of 7,000,000 occurrence.<p>P.S. I bring up the ways violent crime has reached the people around me not to try and sway with an appeal to anecdotes, but simply to add the human element to the generic &quot;violent crime&quot; term. We have the human element of gun violence constantly put before us in the media, but the crimes people survive (though often scarred and broken) simply don&#x27;t get the same attention. These are often serious matters and at 100x an already 4x inflated homicide rate, they are the issues I find myself more worried about than guns.",1436178158
9838026,comment,9837353,9837981,0,0,the8472,,,"On the PC you still get 30-day trials for professional software or apply-for-private-use-licence-leave-an-email models.<p>It&#x27;s not quite the same as the eternal winzip install on millions of PCs, but some people still make money that way.",1436178147
9838025,comment,9835904,9837598,0,0,FatalLogic,,,"Don&#x27;t you just need a general table of death rates for the 20th century? Such as this for the UK<p><a href=""http://1.bp.blogspot.com/--_yGIwe9rks/TpwbBfZB6AI/AAAAAAAAARg/1v4Z78m--po/s1600/UK1901.jpg"" rel=""nofollow"">http://1.bp.blogspot.com/--_yGIwe9rks/TpwbBfZB6AI/AAAAAAAAAR...</a><p>You can see the pattern you&#x27;d expect: a rise in the death rate, compared to the surrounding years, during the world wars. Though there are other peaks, such as the higher peak just before 1920, which is probably influenza, not WWI.<p>edit: Oh, this doesn&#x27;t show annual death rate by year of birth, which is what you were looking for",1436178118
9838024,comment,9837188,9837999,0,0,teddythetwig,,,"I think this specifically is a reason why it is so hard for Dutch startups to hire non-EU citizens. The minimum salary for the Highly Skilled Migrant Worker visa is something like 35k a year. This is waay more than a small company can afford, and it doesn&#x27;t even include the registration costs for hosting a Highly Skilled Migrant Worker.",1436178109
9838023,comment,9838021,9838021,0,0,dutrition,,,"Dutrition is a tool that lets you easily create daily meal plans. It has a big database of 8,618 foods, plus you can add you own supplements or foods that don&#x27;t already exist. Meals can be reused so you don&#x27;t have to fill them more than once. It also lets you see your daily/weekly/monthly grocery list so you can plan ahead.",1436178106
