ID,Type,Story,Parent,Points,Comments,Author,Title,URL,Content,Created
9838155,comment,9835375,9837902,0,0,marcus_holmes,,,"Well the way this is playing out for the Muslims isn&#x27;t great for them.<p>If the same follows for us, then any self-identified member of the tech community will automatically be suspected of being an asshole by everyone else.<p>I have no idea whether your plan to not identify with the tech community will work. Maybe you&#x27;re right and it&#x27;s grown too much to be seen as a single community. Be interesting to find out.",1436180399
9838154,comment,9838105,9838105,0,0,illuminek,,,"Is this the maintenance page or has it been hacked?",1436180371
9838153,comment,9837265,9838029,0,0,gonvaled,,,"> New government does not mean you can erase your debt<p>This is a sovereign government: they can do whatever they want. Defaulting on the debts will have consequences, of course, some good, some bad. Difficult to say if, in balance, this will be good or bad for Greece.<p>> Democracy is responsibility of the successive government for the deeds of the previous one. May that be debt or a warcrime<p>OK, bring the accused to the courtroom. And, now that you are at it, bring the rest of the players. The banks, the Troika, and all the rest that have profited from this whole saga.<p>The blame does not lie <i>solely</i> on the Greek.<p>The outcome of the judgement can very well be positive for Greece: maybe some banks have to repay some interest, maybe the IMF has to restructure some of the debt because they badly advised past Greek governments, maybe Germany has to repay that old loan they took from Greece and never repaid, maybe the Euro-area has to compensate some members for the prejudice of helping Germany become the world export leader at their expense by using a weak currency, maybe the UK has to pay some fines for allowing the financial markets (by opposing regulation) to bet against economies bringing them to the brink of bankruptcy ...<p>We can factor all those things and see who owes what to whom (impossible), or we can recognize that everybody shares a part of the blame and help one member of the European Union - which probably made huge mistakes, but can&#x27;t now stand on its own.",1436180333
9838152,comment,9835655,9837610,0,0,sudioStudio64,,,"I think that sounds completely reasonable.",1436180328
9838151,comment,9837265,9837402,0,0,vidarh,,,"Personally I think that he was expecting this. That he took the &quot;bad cop&quot; role on purpose, and that it&#x27;s now time for the &quot;good cop&quot; to come in and appear more reasonable while pointing to the referendum with a &quot;what can I do?&quot; shrug while asking for more (e.g. after the IMF report, debt relief is now back on the table; EDIT: where it should have been all the time).",1436180325
9838149,comment,9836677,9838086,0,0,clemensley,,,"That is true. In a sense that is the truly democratic effect: more people care about pop music than intellectual discussions (obviously our system would be a twisted form of democracy where money==votes; then again that&#x27;s too different from real world democracy).<p>I obviously have no idea how this will pan out, but it&#x27;s just far too exiting to not just try.<p>Edit: Our idea is really to &quot;give bitcoin to the people who provide value&quot;. Nothing is set in stone yet, but our current thinking is that there are two ways to provide value in a Reddit style system: submit new content or upvote valuable content. We want to find a fair way to pay rewards in both cases.",1436180309
9838148,story,,,50,21,andres,"Show HN: MUI – Lightweight CSS Framework for Material Design",https://www.muicss.com/?a=2,,1436180302
9838147,comment,9832449,9836879,0,0,voltagex_,,,"That&#x27;s really really interesting. I&#x27;ll have some spare time soon, reach out if you need some help/testing.",1436180281
9838146,comment,9835655,9837623,0,0,maxerickson,,,"I wonder how good a proxy the number of guns is for the number of people with access to guns.<p>(It&#x27;s probably reasonably good, I&#x27;m interested in what the numbers would be, not trying to put forward a conclusion)<p>I guess in the US over recent decades the number of people with access to guns has increased relative to the number of guns (because I think there are less hunters and more self defenders).",1436180273
9838145,comment,9835433,9836673,0,0,mike_hearn,,,"<i>> When the government issues bonds it auctions them off and takes money from people(out of circulation) in return, reducing the supply of money.</i><p>Where did you get that idea? Governments usually borrow money so they can spend it. That money isn&#x27;t deleted or burned, it heads right back out of the government into the economy.",1436180267
9838144,comment,9838138,9838138,0,0,parvbhullar,,,"I&#x27;m planning to use titan as graph persistence layer for current data structure.",1436180253
9838143,comment,9836651,9837887,0,0,morganvachon,,,"> I&#x27;ve never really understood the idea that breakfast is the most important meal of the day...<p>I&#x27;ve always heard that you should have the most calories and greatest diversity of food at the first meal of the day, slightly less so at the midday meal, and a very light/low calorie dinner. This is supposedly because you need that huge energy and mental boost to get your day started, and as the day goes on your caloric intake should taper off as you won&#x27;t need it as much by the time you get home from work, and a light dinner because within a few hours you&#x27;ll be sleeping and won&#x27;t need it either.<p>Now that being said, it wouldn&#x27;t work for me. I am up around 6-6:30am, I have breakfast (when I do eat it) at 7:15-7:30am, and my morning at work is decidedly not busy nor does it require critical thinking (I&#x27;m basically stuck answering the sales lines in the morning as the rest of the team doesn&#x27;t roll into work until nearly lunchtime). This is off-season, so I might get ten calls before lunch, and about half of those are non-productive. I take an early lunch, around 11:30am, so I&#x27;m available for the larger part of the afternoon. So, the time between breakfast and lunch is usually four hours. That&#x27;s not enough time to fully digest a large breakfast and be hungry again, so I usually either eat a light breakfast or none at all.<p>What I&#x27;ve found is that if I eat small meals for breakfast and lunch, with a snack available should I need it in the mid afternoon, I tend to focus better and get more done. The only downside is that by the time I get home and finish cooking dinner, I&#x27;m ravenous and I end up eating way too much for that meal. That&#x27;s the part I&#x27;m trying to focus on now and cut down to about half. This will put my overall caloric intake at less than the &quot;maintain&quot; level for my build and age, which will hopefully help me to slowly lose weight.",1436180227
9838142,comment,9836651,9837014,0,0,ak1394,,,"This. It removes so much of cognitive load compared to other diets.<p>You don&#x27;t have to care about choosing your food according to the diet or to count calories.<p>You don&#x27;t have to figure out if you are withing the limits of the diet, or feel bad if you&#x27;ve eaten something extra.<p>On the days you&#x27;re not fasting, you can eat whatever you want.",1436180197
9838141,story,,,1,0,Gazler,"[video] NDC Conf – Web Development in 2020 – Steve Sanderson",https://vimeo.com/131637102,,1436180193
9838140,comment,9835433,9835748,0,0,mike_hearn,,,"Wha?! Their new government has doubled down on the bad policies that led Greece to this state. It absolutely DOES have a strong connection to the people who caused the  problem - they were put in power because the Greeks turned their back on the previous government that was at least trying to go along with the required reforms.",1436180173
9838138,story,,,1,1,parvbhullar,"Is support for TitanDB available, alternative graph layer",,"Is support for TitanDB available, Is it usable in prod. any other alternative graph layer which supports persistence to cassandra or HBase.",1436180136
9838136,comment,9837342,9837861,0,0,jacquesm,,,"It looks plenty disturbing to me. I don&#x27;t even think it should be qualified as a &#x27;precision problem&#x27; it&#x27;s more like a &#x27;total failure&#x27;.",1436180117
9838135,comment,9835433,9837031,0,0,mike_hearn,,,"Greece stopped having a primary surplus the moment Syriza came to power, as one of the first things they did was reverse tax rises and rehire fired civil servants.",1436180087
9838134,comment,9836651,9838039,0,0,aaron695,,,"I think it does because it&#x27;s evidence it&#x27;s a brain hack of some sort.",1436180080
9838133,comment,9835808,9837595,0,0,neoeldex,,,"In es6 it&#x27;s finally possible to properly subclass internal types, it properly separates Class properties and prototypes, and it allows users to extend arbitrary classes.",1436180076
9838132,comment,9837425,9837852,0,0,melling,,,"Medical science doesn&#x27;t have a Moore&#x27;s law.  In fact, most things don&#x27;t.<p>Anyway, we&#x27;re losing ground because humans are applying medicine incorrectly. We take antibiotics for viral infections and, like the article states, we use antibiotics but don&#x27;t cure the disease so the disease builds a resistance.<p>Short answer is that we did it to ourselves. I&#x27;m sure we&#x27;ll spend billions of dollars in R&D and India will just ignore the patents.",1436180061
9838131,story,,,1,1,kkapelon,"Canvas, Sound, scrolling, webgl demo",http://www.soleilnoir.net/dreamon/,,1436180061
9838130,story,,,1,0,cashoutapp,"Cashout: Practice Forex Trading with this App",http://cashoutapp.io/,,1436180049
9838129,comment,9835655,9837214,0,0,sudioStudio64,,,"I have friends who have class 3 licences and they say that the strictures in place on automatic weapons are why you don&#x27;t see then used in crimes very often. They are heavily regulated and tracked.<p>As to your point, I don&#x27;t fault the antigun crowd for using any tactics that work. The progun crowd is certainly guilty of he same thing.",1436180034
9838128,comment,9837353,9837353,0,0,pjmlp,,,"Yes, open source killed it.",1436180004
9838127,comment,9836651,9836651,0,0,wooger,,,"FWIW, I&#x27;ve done a ~20 hour fast for the last few months.<p>Eating in a 4 hour window from 6pm to 10pm approx.<p>This diet isn&#x27;t practical if you&#x27;re doing any serious exercise, either in the morning, or late evening (during after the eating window), so I often have to cheat and eat lunch, or otherwise extend the window on days when I&#x27;m exercising.<p>Otherwise it&#x27;s surprising easy to stick to with a coffee or two for comfort, and I&#x27;ve lost a significant amount of weight:<p>* It&#x27;s hard to eat enough calories to gain / maintain my (over)weight in 4 hours, at least if I stick to whole, fresh, real food. Some days I can hit a ~1000 calory deficit according to my calculations.<p>* I find it easy to go to sleep on a full-ish stomach, which helps a great deal compared to other diets.",1436180000
9838126,comment,9837682,9837682,0,0,falsemirror,,,"As per Brian, an organizational culture is built around by upholding companies core values. What are AirBnb&#x27;s core values? Can&#x27;t find anywhere online.<p>He says &quot;Surround yourself with people that are so good they initimidate you.&quot; Hmm. Sounds like a breeding ground for competitive culture.<p>(Source: <a href=""https://blog.kissmetrics.com/brian-chesky-alfred-lin-culture/"" rel=""nofollow"">https://blog.kissmetrics.com/brian-chesky-alfred-lin-culture...</a>)",1436180000
9838125,comment,9836651,9837874,0,0,scrapcode,,,"I also got that vibe in a paragraph preceding the paper that has a Clickbank affiliate link to a book on the subject of intermittent fasting. The author goes on to state &quot;...it has helped many people get leaner and healthier with a relaxed mindset.&quot;<p>That kind of hinted to me where the bias of the paper would be. However, such bias could&#x27;ve resulted from the information he found during his studies.",1436179995
9838124,comment,9827051,9830174,0,0,pjmlp,,,"> Of course they do (tagbody in Common Lisp, for example). And when they don&#x27;t, it&#x27;s often relatively easy to add one.<p>I was wrong, however it is much more limited than the goto everywhere from C, as where the labels are located is clearly defined in the tagbody and not in every possible statement.",1436179967
9838123,comment,9837915,9837915,0,0,onion2k,,,"There&#x27;s a great list of project management advice by Jerry Madden of NASA that gets posted here occasionally[1]. One of the points is;<p>&quot;Rule #30: It is mainly the incompetent that don&#x27;t like to show off their work.&quot;<p>Madden&#x27;s remark is based on the specific environment he was involved in (NASA engineering); if you&#x27;re surrounded by people who are good at their jobs and who know how to criticise constructively then there aren&#x27;t many reasons to hide what you&#x27;re doing other than it being a bit rubbish. I don&#x27;t <i>entirely</i> agree with the idea that people who don&#x27;t show things off are necessarily incompetent, especially if showing off your work means putting it under general public scrutiny (who can be very nasty), but there&#x27;s a huge amount of value to be gained in getting feedback <i>from your peers</i> as early as possible.<p>[1] <a href=""http://www.nasa.gov/pdf/293253main_62682main_jerry_madden_forum7.pdf"" rel=""nofollow"">http://www.nasa.gov/pdf/293253main_62682main_jerry_madden_fo...</a> (Non-PDF version: <a href=""http://www.altisinc.com/resources/rules/"" rel=""nofollow"">http://www.altisinc.com/resources/rules/</a> )",1436179962
9838120,comment,9835904,9838109,0,0,dghf,,,"Oops. You&#x27;re right, I took the 1946 figure as the 1941 one (700/1100 > 60%).<p>Still, 38% is pretty bad.",1436179861
9838119,story,,,2,0,nailer,"How Apple Music onboards new users",http://www.useronboard.com/how-applemusic-onboards-new-users/,,1436179859
9838118,comment,9837188,9838090,0,0,codfrantic,,,">It&#x27;s far more likely that the major reason is the non-subbed TV/movies imo<p>For the current set of people in their twenties I agree. However, a lot more kids TV these days is dubbed instead of subtitled. I notice that English with 14 year olds these days seems less advanced then ten years ago.",1436179838
9838117,comment,9837353,9837930,0,0,benihana,,,"I don&#x27;t think I&#x27;ve seen someone type the word shareware in about 3 or 4 years. I don&#x27;t think I&#x27;ve heard someone say shareware in at least fifteen years.<p>But I think you&#x27;re absolutely right: the spirit is there, it just goes by a different name.",1436179832
9838116,comment,9837265,9838029,0,0,alextgordon,,,"Sovereign debt absolutely can be defaulted on, just like any other kind of debt. The risk of default is priced into it.<p>Greece is in a situation where there is no possible way that it can ever pay back its debts. <i>Saying that</i> does not make you &quot;borderline insane&quot;. Quite the opposite.",1436179825
9838115,comment,9837265,9838091,0,0,MaysonL,,,"Actually, a more accurate translation would be &quot;fear-mongers&quot;",1436179778
9838114,comment,9835433,9837953,0,0,ZeroGravitas,,,"That&#x27;s a good question, is it? Are any other modern countries?<p>One of the things people have been laughing at the Greeks for is that they don&#x27;t even have a Cadastre listing who owns what land. Apparently this is proof the Greeks are all lazy, tax-avoiding thieves. In Scotland they&#x27;re trying to achieve the same thing as they only know who owns about a quarter of the country.<p>Unfortunately the very rich aristocrats who own this land have been trying to prevent it since apparently knowing who owns land is some dark secret they&#x27;re worried about getting out. They&#x27;ve been writing articles, such as the one by the UK prime minister&#x27;s father-in-law Lord Astor, comparing this compiling of a list of ownership to the behaviour of Mugabe in Zimbabwe.<p>So, are we living in democracies with government responsible to citizens? I&#x27;d say to a great degree we don&#x27;t, and like many soldiers who fought in European wars last century I think it becomes clear that you have more in common with the ordinary people of other European nations than you do with the ones guiding you into wars, or continuations of the same via diplomacy or economic shock doctrines.",1436179775
9838113,comment,9836651,9837887,0,0,ak1394,,,"I normally don&#x27;t have any breakfast either, just because I prefer to spend extra time in bed in the mornings.<p>This haven&#x27;t prevented me from gaining weight though. So just skipping breakfasts in the long term wouldn&#x27;t be enough.",1436179754
9838112,story,,,4,4,vkb,"Where have all the grownups gone?",http://www.jjdisconnects.com/blog/2015/6/10/where-have-all-the-grownups-gone,,1436179739
9838111,comment,9835808,9837863,0,0,amelius,,,"But then the called functions have to be written async style.",1436179719
9838110,comment,9836336,9837914,0,0,liviu-,,,"Tixati on Windows, Transmission on Linux.",1436179719
9838109,comment,9835904,9838030,0,0,juhanima,,,"No. Surviving to 1941: 1,800, wartime mortality: 700, surviving to 1946: 1,100.<p>700/1,800 = 38%",1436179711
9838108,comment,9837915,9838072,0,0,bbcbasic,,,"Probably it should be build the tyre first. This is a functionally complete thing that can, along with many other functionally complete things be composed into the car.",1436179702
9838107,comment,9835655,9836807,0,0,sudioStudio64,,,"That&#x27;s absolutely true. The discussions on this site tend to the abstract and miss this point.",1436179692
9838106,comment,9836892,9837445,0,0,chronial,,,"> It&#x27;s interesting in that people seem to trust meta-statements like the red label&#x27;s more than they trust basic statements like the green label&#x27;s.<p>That are the rules of puzzles.",1436179674
9838105,story,,,45,45,illuminek,"Is housing.com hacked/down? India's Leading Startup",https://housing.com/,,1436179604
9838102,story,,,1,0,aman-pro,"Can Open Source Be a Golden Geese?",https://medium.com/@Aman_Gautam/can-open-source-be-a-golden-geese-a795d35a2b8f,,1436179574
9838101,comment,9837915,9837915,0,0,amelius,,,"> You bought a damned chair and you want it to remain a chair, not to find out that it&#x27;s some kind of protean piece of furniture that&#x27;s a chair today and partly a table tomorrow and, who knows, maybe you&#x27;ll be able to humidify your cigars in it next week.<p>This is exactly my problem with web-services (and software that auto-updates itself).",1436179570
9838100,comment,9835433,9837280,0,0,saiya-jin,,,"I tend to disagree. With nationalism/patriotism, you cannot avoid highlighting positivies of the past and skipping darker parts, which then gives twisted &quot;we&#x27;re the best country in the world&quot; impression. US is a fine example, but I believe all countries are in, one way or the other.<p>One should view critically the past and present of its own nation, focus on all aspects, and learn from mistakes. But nationalism/patriotism and objective critical thinking tend to go against each other in real world out there. So no, I prefer to not like patriotism, of any kind. Anyway, I feel more of a citizen of this world, rather than some area that belonged somewhere else 100 years ago, elsewhere 1000 yeats ago, and will for sure in another 1000 years in future. Once a person moves a bit around the world, perspective on this topic is changed for good (classic House quote - &quot;Patriotism is nothing but loyalty to real estate&quot;)",1436179560
9838099,comment,9835433,9836695,0,0,Shivetya,,,"Its pretty much an ignorant statement. Which younger generation is he referring too? Those born after Greece joined the EU, those who happen to be 18-21, what?<p>I am pretty sure we can segment society in any means necessary to excuse one group or another from responsibility. I can just as well blame the same younger generation for bringing in a firebrand Marxist and voting to support saying NO when its going to wreck their economy even further; likely closing the banks for electronic transfers for business may have done too much damage.<p>As for the article, I could care less what Germany did or didn&#x27;t do back then. Times were different then, we were all recovering from a incredible war and no one wanted to see conditions repeated that may lead to a third. Reparations and the restrictions on Germany after the first world war led to someone like Hitler gaining power so why repeat the situation?",1436179552
9838098,comment,9837188,9837856,0,0,goddabuzz,,,"HackerOne is located in Groningen<p><a href=""http://techcrunch.com/2015/06/24/hackerone-bags-25m-as-security-info-sharing-mainstreams/"" rel=""nofollow"">http://techcrunch.com/2015/06/24/hackerone-bags-25m-as-secur...</a>",1436179550
9838097,comment,9837265,9837402,0,0,higherpurpose,,,"> Our politicians on the other hand seem to do anything the EU tells them<p>What the US tells them too, probably:<p><a href=""https://blog.cyberwar.nl/2015/07/dutch-intelligence-bill-proposes-non-specific-bulk-interception-powers-for-any-form-of-telecom-or-data-transfer-incl-domestic/"" rel=""nofollow"">https://blog.cyberwar.nl/2015/07/dutch-intelligence-bill-pro...</a>",1436179507
9838096,comment,9837915,9837915,0,0,Kenji,,,"Slightly OT, but<p><i>Except for some basic UNIX tools, like grep or make</i><p>Is make a basic tool? I&#x27;m often surprised when I find out new features of make that I was unaware of. I feel like it&#x27;s bigger than it appears to be.",1436179501
9838095,comment,9837915,9837956,0,0,pdpi,,,"> First the skateboard, then the scooter, then the bike, the motorcycle, and finally the car.<p>I&#x27;ve always found this metaphor incredibly amusing, because, to me, it actually highlights the _problems_, rather than advantages, of the iterative approach. At every step of the process, you&#x27;re not only increasing complexity, you&#x27;re also pivoting your product to the point where:<p>1. your previous clients are unlikely to still be well served by the new product, and are likely to churn as a result<p>2. the engineering challenges are different enough that most of the components aren&#x27;t really reusable, and trying to shoehorn one stage into becoming the next will give you a sub-par product.",1436179496
9838094,comment,9835655,9837933,0,0,nraynaud,,,"careful, these are OECD countries, so there are no third world countries.<p>But your remark on Mexico rings true to me, maybe they are excluded because the victims are mostly not chosen at random.",1436179494
9838092,comment,9836430,9836430,0,0,melling,,,"How about processing simple Markdown?<p># main<p>## topic one<p>### subtopic one<p>## topic two",1436179462
9838091,comment,9837265,9837402,0,0,Bootvis,,,"He called the creditors &#x27;terrorists&#x27; though. He didn&#x27;t have to do that and I really can&#x27;t blame the creditors for wanting someone else at the table.",1436179451
9838090,comment,9837188,9837188,0,0,kriro,,,"Interesting article but I fundamentally disagree with the notion that the excellent school system is the cause of the good English skills of the Dutch (which undoubtedly exist). It&#x27;s far more likely that the major reason is the non-subbed TV/movies imo (well a combination of both)<p>I&#x27;ve always associated the Netherlands with being a tech saavy nation. They always had a vivid hacking scene for example. Additionally the Dutch tend to be citizens of the world and pretty open minded which is a good mix.\nI completely agree with the assessment of Amsterdam. Nice city, not overly expensive, pretty great for youngish people -> good competitive edge (Berlin is similar but Amsterdam has more of a startupy general vibe imo).",1436179400
9838089,comment,9837188,9837975,0,0,nothrabannosir,,,"If you are from the US or Japan you should absolutely check out DAFT: the Dutch-American Friendship Treaty:<p><a href=""https://en.wikipedia.org/wiki/DAFT_%28treaty%29"" rel=""nofollow"">https://en.wikipedia.org/wiki/DAFT_%28treaty%29</a><p><a href=""https://ind.nl/EN/individuals/residence-wizard/work/working-on-a-self-employed-basis"" rel=""nofollow"">https://ind.nl/EN/individuals/residence-wizard/work/working-...</a><p>It allows you to be a freelancer in Holland. No citizenship, but you do get a residency permit that is up for renewal every 2 years, as long as you satisfy the requirements (no social benefits, only freelancing, &c).",1436179388
9838088,comment,9835375,9836659,0,0,forgottenpass,,,"<i>Since the power that the attackers have in these messages is the reaction of the recipient, it might be possible to turn this around.</i><p>Yes, but not by using the mechanism you go on to describe.  You simply have to show the harasser that their harassment doesn&#x27;t bother you.  The points system won&#x27;t convey that to a troll.  Worrying about trolls enough to join into such a system validates, not defuses, their efforts.",1436179366
9838087,comment,9837353,9837353,0,0,huhtenberg,,,"There&#x27;s no &quot;shareware&quot; per se, but there&#x27;s plenty of &quot;indie trialware&quot; if you will and it&#x27;s doing really well.<p>I have long-time friends who live very comfortably from a small herd of shareware products. I also know others who decided to grow at some point and now operate moderately-sized software shops that too are doing well. All of these are on Windows, and nearly all of them are desktop software. One thing to keep in mind that smaller companies tend to put up a larger corporate facades, so the chances are that you&#x27;ve seen plenty of single-man shareware shops without realizing it.",1436179329
