ID,Type,Story,Parent,Points,Comments,Author,Title,URL,Content,Created
9837964,comment,9836651,9837782,0,0,0624213997,,,"Day 1 was always the easiest for me, but I had an eating disorder, I was not going about this in a healthy way.<p>After 3 days, I could easily do a week, and I managed to do a 30 day fast one year.<p>I don&#x27;t recall feeling high, I just remember a lot of laying down, dreaming and thinking about food, baking, and not doing much of anything else.<p>I really rather prefer being able to eat everything I want, and spend 2-3 hours a week at the gym. But my weight has gone up by 10-15 lbs (and I have also aged from 17 years old to 29).<p>I can&#x27;t say I&#x27;m the same size as when I was fasting, but I have a defined shape, whereas before I was bone and skinny fat.",1436177252
9837963,comment,9836023,9836448,0,0,Yenrabbit,,,"Bad Voltage is fun. Linux Voice probably deserves mention as another great Linux podcast (linuxvoice.com)",1436177246
9837962,comment,9835433,9835711,0,0,allendoerfer,,,"How can a group of the ECB, the IMF and the EU be &quot;mostly German&quot;? Seems pretty international to me. In fact Germany is under-represented in the ECB and the commission, because it has only one seat, as do countries that have a tenth of the German population.",1436177227
9837961,comment,9836991,9837219,0,0,youngtaff,,,"The problem is the German and French public have never been told or refuse to understand that the original bailout of Greece was a bail out of German, French and other banks.<p>Greece was sacrificed to save the wider euro, and the German and French public should be grateful.",1436177218
9837960,comment,9834296,9835831,0,0,ionised,,,"“Nationalism does nothing but teach you to hate people you never met, and to take pride in accomplishments you had no part in.”  - Doug Stanhope",1436177202
9837959,comment,9836991,9837309,0,0,gonvaled,,,"With your risk profile, the interest rate will be 99%, payable as soon as the credit is given, before you leave the room. You will come alone, unarmed, and barefooted.",1436177201
9837958,comment,9834721,9837192,0,0,peterfirefly,,,"Not quite what they said/wrote, actually.  It was more like &quot;given the lack of implemented reforms and privatizations, the current debt has become close to unsustainable and definitely will be unsustainable if they continue to not implement long promised reforms and privatizations&quot;.",1436177195
9837957,comment,9836677,9837194,0,0,Nursie,,,"In many countries, UK included, you have already broken the law and could go to prison over that.",1436177187
9837956,comment,9837915,9837915,0,0,sova,,,"Some very practical, down-to-earth, solid advice.<p>Lines I found insightful:\n&quot;... make it functionally complete in the first place.<p>... If it can&#x27;t be made functionally complete it&#x27;s too big. You&#x27;ve tried to bite off a piece that&#x27;s bigger than you can swallow. Just get back to the drawing board and split off a piece that can be made functionally complete.&quot;<p>^_^<p>I really like the idea of splitting a project into phases.  You might have Three phases, each one building on the last, but the very first complete phase should be a complete and usable thing in itself.<p>First the skateboard, then the scooter, then the bike, the motorcycle, and finally the car.",1436177157
9837955,comment,9836336,9837886,0,0,blfr,,,"It&#x27;s very easy to spin up rTorrent on some machine not attached to you so this doesn&#x27;t seem like a very good plan, especially considering the PR damage. Maybe if they managed to embed malware in some commonly trusted file format but that again doesn&#x27;t seem likely since there are too many viewers, and security researchers will generally be careful.",1436177148
9837954,comment,9834721,9834907,0,0,imaginenore,,,"It&#x27;s semantics, at the end of the day Greece owes money, and you simply cherry-picked a term that doesn&#x27;t contain that debt.<p>> <i>The key insight from the &quot;primary surplus&quot; is that a haircut would work, because Greece could be self-sufficient once the debt burden is gone.</i><p>And so would my hypothetical business that can&#x27;t even cover the monthly payments on the loan. If we magically erase the debt, just like that, I got a profitable business I can brag about.<p>> <i>Greece does not get the loans now - that money is already gone</i><p>Wow, just wow.",1436177138
9837953,comment,9835433,9837524,0,0,Djeman,,,"Wait a minute. Isn&#x27;t Greece a democracy with government responsible to citizens?\nGreece gov has been spending for decades on military and no one argued with that while credit cards worked.",1436177113
9837952,comment,9837342,9837342,0,0,lectrick,,,"See also &quot;why I use integers whenever possible&quot;",1436177104
9837951,comment,9837442,9837442,0,0,marcfowler,,,"I don&#x27;t know whether it&#x27;s because of the type of questions I&#x27;ve ever asked on there, but I&#x27;ve found it to be excellent, and I always get my questions answered perfectly.<p>The attitude on there seems to be slightly terse, but, it is designed and really focussed on Q&A, not discussion. So I don&#x27;t know that I really agree with the criticism of it.",1436177079
9837949,comment,9835433,9837731,0,0,peterfirefly,,,"Yes it is.  Laws require debate and public voting in Parliament which exposes many/all members of the governing coalition to lots of bad press, which is /so/ unfair since all they really wanted was to get reelected and, honest, they didn&#x27;t want to be a bother to anyone.",1436177049
9837948,comment,9836677,9836677,0,0,davidgerard,,,"Ryan&#x27;s work at Reddit was reimplementing bitcoind in JavaScript on node.js: <a href=""https://github.com/ryanxcharles/fullnode/graphs/commit-activity"" rel=""nofollow"">https://github.com/ryanxcharles/fullnode/graphs/commit-activ...</a><p>Here&#x27;s where he sets out what he was trying to do: <a href=""https://np.reddit.com/r/Bitcoin/comments/2uadvd/the_real_reason_ryan_charles_was_fired_from/co6r4q9"" rel=""nofollow"">https://np.reddit.com/r/Bitcoin/comments/2uadvd/the_real_rea...</a><p>The takeaway is: if you start with &quot;... but with Bitcoin!&quot;, then iteratively putting different words before &quot;but&quot; is unlikely ever to result in something that is actually useful, not just interesting.",1436177042
9837946,comment,9836991,9837095,0,0,gonvaled,,,"Debt comes with <i>risk</i> and <i>reward</i>: you give some money, get some interest, and <i>maybe</i> the principal back. The amount of interest depends on the risk. Usually nothing happens, and you get everything back, but sometimes you don&#x27;t. That&#x27;s business.<p>If you want some &quot;strict, enforceable and unavoidable means to collect it&quot;, you are not talking about debt as we know it.<p>There is no business with a profit margin and 0 risk. Well, there is actually: the ones the private lenders made with Greece, before unloading their financial instruments onto the European governments",1436176891
9837945,comment,9837353,9837353,0,0,r3m6,,,"The shareware concept is doing well, just the name has changed to &quot;30-day trial&quot; or &quot;Lite&quot; or &quot;Free/Pro&quot; or....<p>As an example, Andy Brice blogs about his shareware business at <a href=""http://successfulsoftware.net/"" rel=""nofollow"">http://successfulsoftware.net/</a>",1436176890
9837944,comment,9836336,9837739,0,0,haakon,,,"He tweeted<p>> The torrent contains a virus, it&#x27;s best to let the authorities examine the evidence and stop seeding and spreading false info.<p>Yes, the hackers fabricated 400GB of lies and please don&#x27;t look at them.",1436176857
9837943,comment,9837442,9837790,0,0,pm24601,,,"I see the righteous trolls down voted my opinion :-)",1436176854
9837942,comment,9837802,9837802,0,0,bshimmin,,,"This looks really, really nice.  But I think a problem for adoption is that on a Mac Spotlight can already do most of the calculations this does that I&#x27;d actually want to do on a regular basis (for me, that&#x27;s currency conversion and some basic arithmetic).  I can imagine downloading this, being impressed by its slickness, and then routinely forgetting to use it in favour of Spotlight.",1436176854
9837941,comment,9834165,9837505,0,0,andreamazz,,,"Oh, I just reached the point where Ayaka talks about Carthage. That&#x27;s a pretty straightforward solution, nice.",1436176837
9837940,comment,9836651,9837238,0,0,mattlutze,,,"It was his MD thesis, apparently. I think there is some validity in the fact that his university awarded him his medical doctorate based on the quality and content in the work.",1436176831
9837938,comment,9837493,9837931,0,0,59nadir,,,"Text is a very dangerous format.",1436176822
