ID,Type,Story,Parent,Points,Comments,Author,Title,URL,Content,Created
7824852,comment,7823559,7824658,2,0,mikeash,,,"Excellent. I was careful to phrase my comment to only be about my ability to <i>find</i> them, since I was sure they must exist somewhere. $1,600 for a meter-long gold cable is actually not bad, aside from the fact that it&#x27;s pointless.",1401497988
7824851,comment,7824570,7824846,5,0,sitkack,,,"VHDL was modeled after Ada.<p>And yes, the languages look almost identical.",1401497967
7824849,comment,7823400,7824163,1,0,obituary_latte,,,"People are lazy. Anything that works to circumvent that fact should be applauded.",1401497909
7824848,story,,,2,1,biznerd,"Ask HN: Why did the other portals (Excite, Lycos, etc.) totally fail?",,"There were a bunch of other portals. Most notably Excite and Lycos. They were worth billions of dollars. Now they&#x27;re gone. Yahoo reigns supreme. Why?",1401497859
7824847,comment,7824684,7824794,1,0,tokenizerrr,,,"Here you go: <a href=""https://github.com/davidmerfield/RandomColor/blob/master/randomColor.js#L29"" rel=""nofollow"">https://github.com/davidmerfield/RandomColor/blob/master/ran...</a>",1401497849
7824846,comment,7824570,7824570,2,0,AceJohnny2,,,"I know this is tangent, but as someone who hasn&#x27;t programmed Ada, I&#x27;m struck by how the superficial syntax of VHDL is similar to Ada.<p>See:\n<a href=""http://en.wikipedia.org/wiki/VHDL#Design_examples"" rel=""nofollow"">http://en.wikipedia.org/wiki/VHDL#Design_examples</a>\nvs:\n<a href=""http://en.wikipedia.org/wiki/Ada_programming_language#Language_constructs"" rel=""nofollow"">http://en.wikipedia.org/wiki/Ada_programming_language#Langua...</a><p>Same &quot;use packagename&quot;. Same &quot;entity foo is&quot;, same block definition by &quot;begin [...] end entity&quot;<p>Coincidence, or is there a historical reason for this?<p>Edit: The answer was in the VHDL article itself: &quot;Due to the Department of Defense requiring as much of the syntax as possible to be based on Ada, in order to avoid re-inventing concepts that had already been thoroughly tested in the development of Ada,[citation needed] VHDL borrows heavily from the Ada programming language in both concepts and syntax.&quot;",1401497756
7824845,comment,7824695,7824695,12,0,minimaxir,,,"Working up a few quick statistics:<p>- Of the people that finished a course, male students had an average grade of 83.8%, female students had an average grade of 82.7%.<p>- The correlation between the grade of students who finished a course and the usage of supplemental materials is positive, but weak (0.16 for each variable, except for forum posts, which are complete uncorrelated with grade).<p>- The easiest course was HarvardX/CS50x/2012, with a perfect 100% average grade from all students who finished the course [EDIT: this course has pass/fail assignments]. The hardest was HarvardX/CB22x/2013_Spring, with an average score of 73.3% (the class, unsurprisingly, is about Ancient Greek Heroes)<p>- The course with the highest completion rate (# completed / # registered) is MITx/14.73x/2013_Spring at 7.48% (The Challenges of Global Poverty). The worst completion rate is HarvardX/CS50x/2012 at 0.07% (Introduction to Computer Science I, note that this is also the most registered course by a large margin)<p>- All classes have more male students than female students. The class with the highest Male/Female ratio is MITx/2.01x/2013_Spring at 17:1 (Elements of Structures). The class with the lowest ratio is HarvardX/PH278x/2013_Spring at 1.03:1 (Human Health and Global Environmental Change)<p>Let me know if you have any statistical ideas.",1401497700
7824844,comment,7824570,7824744,5,0,vince_refiti,,,"Inviting others to critique your work. Great to see. I will have to have a serious look at Rust sometime then.",1401497692
7824843,comment,7823946,7824281,1,0,tokenizerrr,,,"It is annoying, but know that you can remove entries from the autocomplete list (in Chrome at least) by selecting it using the arrow keys and using shift+delete.",1401497690
7824842,comment,7823385,7824624,1,0,l33tbro,,,"Not saying the music choice is inappropriate - I think it fits the piece perfectly.  But - IMO - art spectatorship should be sober and limited only to elments the artist intended.  So any use of extra music to enhance my experience feels redundant.  But hey, that&#x27;s why we have the mute button :D",1401497659
7824841,comment,7823167,7823167,3,0,elwell,,,"> You&#x27;ll receive one (1) Bitcoin each time a friend you invite gets a job through Mighty Spring!<p>$600?",1401497655
7824840,comment,7823385,7823976,2,0,wrongc0ntinent,,,"All &quot;offensive&quot; details in The Last Judgement were covered soon after Michelangelo&#x27;s death (1564). The fresco was restored 1980-1994, without the added loincloths, but a couple of the figures were actually heavily modified and impossible to restore. [0]<p>[0] <a href=""http://en.wikipedia.org/wiki/The_Last_Judgment_(Michelangelo)"" rel=""nofollow"">http://en.wikipedia.org/wiki/The_Last_Judgment_(Michelangelo...</a>",1401497588
7824839,comment,7824687,7824687,17,0,jabelk,,,"I have dabbled in a little bit of video production, and on the (rare) occasion that I catch a few minutes of televised football, that yellow line always blows me away. Mentioning how difficult it must be to whoever is actually watching the game results in weird stares as if it&#x27;s the most natural thing in the world, but I&#x27;m glad to read that I&#x27;m not going crazy. And I had no idea how extensive the setup actually was.",1401497550
7824838,comment,7824570,7824744,2,0,obituary_latte,,,"Thanks for doing what you do.",1401497514
7824837,comment,7822912,7823460,3,0,8ig8,,,"> I think this is an excellent illustration of a situation where your users get a better experience by being asked to pay money than they get by being given services for free.<p>I don&#x27;t follow. As a prospective user, trying ngrok for the first time, how is my experience better if I&#x27;m required to pay to try it out versus jumping right in and creating my tunnel without creating an account or taking my credit card out of my wallet?",1401497511
7824836,comment,7824830,7824830,1,0,littimus,,,"Albeit not very interesting, the code is on Github:<p><a href=""https://github.com/ncpierson/Sound-of-Text"" rel=""nofollow"">https://github.com/ncpierson/Sound-of-Text</a><p>I opted not to use JQuery or any Javascript library. Maybe that is interesting to some.",1401497509
7824834,comment,7765758,7765758,1,0,specto,,,"I like it, though every once in a while something will be blocked in the middle of the screen and I can&#x27;t dismiss the red blocked area to get to the actual content.",1401497411
7824833,comment,7824570,7824726,5,0,TheCondor,,,"The standard library is robust...  The language itself isnt terribly big, it does support threads though.<p>NYU made a free Ada compiler in the 90s, it&#x27;s part of gcc now. Ada&#x27;s problem wasn&#x27;t only compilers, it was the culture.  Hackers hate COBOL, it&#x27;s still routinely used to cutdown a language (&quot;Java is the new COBOL&quot;)  yet very few have ever used it but it has that rap.  Ada is a DoD specified language that was designed with real software engineering problems and science in mind, it has a bad rap because of that.<p>It&#x27;s a different world now, the tooling alone changes the equation (at the time both Ada and pascal were seen as too verbose, begin and end were a lot more letters than braces, now our editors do that stuff for us..)  being a DoD specified cousin of pascal is what hurt Ada, then there was the compiler selection... It always seems like Ada is ready to be attractive, there is a community around rust and go though.",1401497349
7824832,story,,,1,0,xbeta,"An App That Fights Back Against Smartphone Thieves",http://mashable.com/2014/05/28/lookout-theft-protection/,,1401497327
7824831,comment,7815237,7821648,1,0,xxs,,,"you can use ftp or just prepend a space before http",1401497293
7824830,story,,,6,2,littimus,"Show HN: Sound of Text – Download audio from Google Translate",http://soundoftext.com,,1401497280
7824829,comment,7823385,7823385,2,0,chrismcb,,,"From an American copyright point of view... Is this copyrightable? It is a reproduction of a work of art that is no longer under copyright. The image itself offers no creativity, other than as a reproduction.",1401497227
7824828,comment,7824570,7824814,3,0,lobster_johnson,,,"Pascal also had subtypes, or at least Borland&#x27;s did.",1401497208
7824827,comment,7823400,7823400,2,0,ljd,,,"We use the GovTrak API&#x27;s and some from Sunlight Foundation for <a href=""http://PlaceAVote.com"" rel=""nofollow"">http://PlaceAVote.com</a>.   They are pretty awesome and well written.",1401497199
7824826,comment,7823385,7824044,2,0,WoodenChair,,,"&quot;It&#x27;s funny to think that they would have to censor this on American television because of the religious right.&quot;<p>Re: What would fit on American television today.<p>Pretty specious argument.  Just because something was appropriate in the 1400s, doesn&#x27;t mean we have to find it appropriate today.  We also don&#x27;t find hanging people in public squares appropriate anymore, or a million other things...<p>There are arguments to be made in favor of allowing more nudity on television.  &quot;They used to do it back in the day&quot; is not one of the good ones.",1401497175
7824825,comment,7823946,7824129,1,0,userbinator,,,"See this post, where the VP of Level 3 says they&#x27;re providing open DNS: <a href=""http://blog.level3.com/level-3-network/a-flawed-study-of-cdns-and-dns/"" rel=""nofollow"">http://blog.level3.com/level-3-network/a-flawed-study-of-cdn...</a><p>The request hijacking briefly appeared earlier this year, but they seem to have stopped doing it.",1401497123
7824824,story,,,3,0,harrychenca,"5 Secrets that Your Mutual Fund Manager Doesn’t Want You to Know",https://medium.com/@Nvest/5-secrets-that-your-mutual-fund-manager-doesnt-want-you-to-know-b18318bbd26e,,1401497120
7824823,comment,7824570,7824720,6,0,lobster_johnson,,,"What about GNAT? I remember sniffing at Ada back in the mid-90s, and at that time GNAT had implemented most of Ada 95 (which had a lot of new OO features that seemed on par with Borland Pascal). I did not choose Ada because Borland was so much better -- IDE, big community, many libraries -- and then Delphi came along; Ada looked more advanced, but not fun.",1401497116
7824822,comment,7824684,7824817,2,0,leeoniya,,,"also check out <a href=""http://alienryderflex.com/hsp.html"" rel=""nofollow"">http://alienryderflex.com/hsp.html</a>",1401497090
7824820,comment,7824684,7824684,2,0,leeoniya,,,"&quot;BRIGHT COLORS&quot; and &quot;DARK COLORS&quot; overlap with several dark colors. pretty much every color model gets brightness values that dont jive with perceptual reality.",1401496977
7824819,story,,,3,0,amazedsaint,"Elon Musk Just Unveiled SpaceX 2.0",http://mashable.com/2014/05/29/elon-musk-just-unveiled-spacex-2-0/,,1401496965
7824818,comment,7824684,7824684,2,0,hcarvalhoalves,,,"Supporting complementary / tertiary colors would make it even more useful.",1401496963
7824817,comment,7824684,7824684,12,0,mxfh,,,"Good library to begin with, but could do better on the perceived brightness.<p>Since HSV is NOT perceived as evenly distributed to the human eye along the value(lightness) axis[1],<p>would recommend employing <i>chroma.js</i>[2] which uses the HCL and CIE color spaces, which in general yield more pleasing results for use in color scales.<p>[1] <a href=""http://vis4.net/blog/posts/avoid-equidistant-hsv-colors/"" rel=""nofollow"">http://vis4.net/blog/posts/avoid-equidistant-hsv-colors/</a><p>[2] <a href=""https://github.com/gka/chroma.js"" rel=""nofollow"">https://github.com/gka/chroma.js</a><p><i>i want hue</i> might be a bit of overkill though: <a href=""http://tools.medialab.sciences-po.fr/iwanthue/index.php"" rel=""nofollow"">http://tools.medialab.sciences-po.fr/iwanthue/index.php</a>",1401496928
7824816,comment,7824411,7824612,5,0,reitzensteinm,,,"These comparisons (from the quote) often come up with ARM vs x86, but they&#x27;re always comparing apples and oranges. Yes, you can fit an ARM core with 1/4 the performance in, say, 1/16 the power envelope, but you can do that with x86 cores as well.<p>The cores we&#x27;ve got are still heavily optimized for single thread performance, because that&#x27;s what the market demands. Even embarrassingly parallel domains like web serving have increased latency, and Amdahl&#x27;s law is a problem for most real world programs. The penalty paid for this is high, due to diminishing returns due to caches, complex architectures, and (roughly quadratic) power increases due to higher clock speed.<p>Ignoring the obvious ARM versus Atom low end comparison, Intel is readying Knight&#x27;s Landing, their 2015 Xeon Phi product. It&#x27;s going to include 72 Atom cores, with 288 threads, and be able to be socketed in standard Xeon motherboards.<p>That&#x27;s 1152 Atom threads on one commodity(ish) server (and the first time I&#x27;ve ever used a calculator to determine the thread count of a server), and it looks a hell of a lot like the picture being painted by many ARM vendors. Many lightweight cores, great power efficiency and peak performance, and most likely not necessarily suited to latency sensitive tasks.<p>I don&#x27;t think it&#x27;s about ARM versus x86 at all, it&#x27;s more about a new strategy for computation. Intel can&#x27;t transition its traditional x86 processors over to the new model, so they&#x27;re starting to make Atom a first class Xeon product (both with low power standard Atom chips already released, and the Xeon Phi).<p>The market will shift the other way too - we&#x27;re going to see ARM processors from multiple vendors that rival at least AMD&#x27;s x86 offerings in terms of performance per core. And power consumption, too.<p>After that, there&#x27;ll be products on both ends of the spectrum from both architectures, and then maybe we can start to move past the false dichotomy of ARM having efficiency and x86 having performance.",1401496908
7824814,comment,7824570,7824726,11,0,RogerL,,,"Ada has packages, generics, exceptions, concurrency, default values, operator overloading, user defined types, fixed point, subtypes (so you can, for example, limit an integer to the range 0..100, and then the compiler has to check to see that it is used correctly everywhere), pooled memory, built in run type checking, pragmas, etc., etc.",1401496809
7824813,comment,7816604,7819437,1,0,TheMagicHorsey,,,"We do post things on LinkedIn and Facebook, however we get only a tiny fraction of the traffic that we get from Google.  In addition, the traffic from Google seems to convert to paying customers at a higher rate--not sure why yet.",1401496792
7824812,story,,,45,3,mxfh,"How To Avoid Equidistant HSV Colors (2011)",http://vis4.net/blog/posts/avoid-equidistant-hsv-colors/,,1401496786
7824811,comment,7824684,7824702,2,0,tstrimple,,,"It&#x27;s using Math.random, so no it&#x27;s not currently possible. You&#x27;d have to replace the Math.random calls with something like this: <a href=""https://github.com/davidbau/seedrandom"" rel=""nofollow"">https://github.com/davidbau/seedrandom</a>",1401496775
7824810,comment,7824321,7824749,1,0,soneca,,,"I used the sentence Taleb himself used to describe it. I just editorialized the number of aphorisms because it changed.",1401496740
7824808,comment,7824378,7824796,1,0,andyshinn,,,"It is their own nginx HTTP / TCP router, which is backed by etcd and confd. You can check it out at <a href=""https://github.com/deis/deis/tree/master/router"" rel=""nofollow"">https://github.com/deis/deis/tree/master/router</a>. Essentially, you can fire up multiple of these instances, and Deis uses them to route application, controller, and git traffic to the proper container.",1401496609
7824807,comment,7816184,7821433,1,0,hashbanged,,,"> &quot;it&#x27;s unusual for women to be clever enough to program so we&#x27;re making a song-and-dance about these ones&quot;<p>The more examples you see of people like you programming, the less of a song-and-dance you think it is. And you might perceive it as putting them up on a pedestal, but others don&#x27;t.<p>In an ideal world, we don&#x27;t have to increase the visibility of other genders in programming.<p>Did you have role models and examples that you looked up to who also looked like you? I think it&#x27;s a hard thing to empathize with if you&#x27;ve always had those examples.<p>> &quot;well unless you can find examples of people of your sex doing that job well then forget it&quot;<p>Which is a stronger message to a child: other genders or ethnicities being held up as examples or never seeing anyone who looks like you doing what you want to do?",1401496587
7824806,comment,7824687,7824687,7,0,ksenzee,,,"I love this. I&#x27;ve spent a lot of time between plays imagining just what kind of engineering is behind that magic first down line. Of course, I should have known it came down to this: &quot;Our engineering team... worked around the clock through the summer...&quot; Sometimes I wonder if there is any such thing as a correctly scoped project that can be completed during daylight hours on weekdays.",1401496585
7824805,comment,7821236,7823844,1,0,wslh,,,"Yes, you are right about the storage (now I can recall the feeling). But the main point remains valid: Google was a gamechanger.",1401496580
7824804,comment,7824757,7824757,1,0,slosh,,,"I live in san fracisco.  i walk everywhere.  miles a day.  It&#x27;s great for my health, I like the internet but i don&#x27;t have a cell phone.<p>I only miss the car when i want to go out of town.  i&#x27;ve never missed my cell phone, one time ever..ever... ever.",1401496573
7824803,story,,,2,0,mmvvaa,"Buenos Aires colorful pro-biking campaign",http://lacriaturacreativa.com/2014/05/una-colorida-campana-grafica-para-mostrar-los-beneficios-de-usar-la-bicicleta/,,1401496555
7824802,comment,7824757,7824757,1,0,massappeal,,,"Cars, no contest, and I live in an area with TERRIBLE mass transit. I live in a small town just west of San Jose in Silicon Valley, and in order for me to get anywhere, I have to take a 45 min bus ride (the only bus that comes into my town) into Sunnyvale and from there either catch another bus or Caltrain to get where I&#x27;m going, and often times another bus, Muni or Bart after that.<p>That said, I would still rather keep my Internet than gain a car. Safeway delivers for free, I no longer need to go to Blockbuster to get new content, and I can (if I chose) work completely remotely.<p>Living without a car sucks, especially in California where public transportation is a joke, but its still better than living without internet.",1401496534
7824800,story,,,1,0,rmason,"Google's prototype self-driving cars to be built in metro Detroit",http://www.freep.com/article/20140528/BUSINESS01/305280197,,1401496466
7824799,comment,7822057,7824629,5,0,mbutterick,,,"I didn&#x27;t start from scratch. I built the project on top of Racket & Scribble (which itself has similarities to TeX).<p>Bear in mind that creating Pollen was a side mission of the main project: making the website <a href=""http://practicaltypography.com"" rel=""nofollow"">http://practicaltypography.com</a>. The existing tools weren&#x27;t good enough, so I ended up making my own. I looked at using TeX. No one had anything nice to say about its HTML capabilities. So I moved on.<p>Pollen does less than TeX. But it also demands less (in terms of setup & learning curve). Authors who need everything TeX can do aren&#x27;t going to be interested in Pollen. But that&#x27;s OK — they already have TeX.",1401496460
7824797,comment,7817586,7821546,1,0,barrkel,,,"You sound like you&#x27;re drawing a normative conclusion from positive facts (i.e. the is/ought problem).<p>The fact that juries judge things from a certain perspective says nothing about whether they ought to do so or not.",1401496437
7824796,comment,7824378,7824378,1,0,benmccann,,,"What is Deis using for this new HA routing? HAProxy, ELB, homegrown?",1401496429
7824795,comment,7824570,7824720,16,0,RogerL,,,"It really wasn&#x27;t ridiculous. I know, from the point of view of your budget, it really was, but...<p>The compiler writers were serving a tiny sliver of a market. At the time it took a lot of resources to build such a compiler, and then you had to support a bunch of not-off-the-shelf, militarized and embedded chips. You had to past a huge suite of tests, and if a customer submitted a bug, well, you just had to fix it in a timely manner. I&#x27;m sure we paid a ton for our compiler, but they also ended up flying people to us regularly from NYC to DC. The compiler writers were all but on speed dial. I&#x27;m sure we got our money&#x27;s worth out of it.<p>Now, what we could have gotten from the same amount of money applied to a C compiler plus extensive tooling, testing, and so on is an interesting question...",1401496415
7824794,comment,7824684,7824684,2,0,betadreamer,,,"Neat! I would love to see the math behind it.",1401496381
7824793,story,,,103,14,luu,"Software Foundations",http://www.cis.upenn.edu/~bcpierce/sf/,,1401496320
7824792,comment,7824322,7824450,1,0,huntermeyer,,,"Ya, we&#x27;re focused on Portland right now. We&#x27;re looking to expand soon.",1401496246
7824791,comment,7823559,7823807,1,0,zafka,,,"I don&#x27;t think that is true. Consider that IC manufacturers use gold plating on pins and connectors. If Zinc was just as effective, I think they would use it instead. I know zinc protects steel as a sacrificial anode, I am not sure if it does as much for copper.",1401496245
7824790,comment,7824695,7824695,11,0,danso,,,"FYI, just in case you don&#x27;t want to go through the (short) signup process to see what&#x27;s in the data.<p>This is what the first 10 lines of the CSV file look like:<p><a href=""https://gist.github.com/dannguyen/4d372986b74ff087927a"" rel=""nofollow"">https://gist.github.com/dannguyen/4d372986b74ff087927a</a><p>Here&#x27;s the output of `wc -l`<p><pre><code>     641139 1092627 70165566 HMXPC13_DI_v2_5-14-14.csv\n</code></pre>\nHere&#x27;s a mirror of the file [9.6MB]: <a href=""http://danwin-files.s3.amazonaws.com/data/nf/HMXPC13_DI_v2_5-14-14.zip"" rel=""nofollow"">http://danwin-files.s3.amazonaws.com/data/nf/HMXPC13_DI_v2_5...</a>",1401496242
7824789,story,,,37,5,elwell,"Overtone – Collaborative Programmable Music with Clojure",https://github.com/overtone/overtone,,1401496212
7824788,comment,7824321,7824697,6,0,anigbrowl,,,"I much prefer context in the title, and find this antipathy to editorial headline construction ridiculous. I&#x27;m not likely to open a thread just because there&#x27;s one comment on it, and the original title is so generic as to be uninteresting.",1401496184
7824787,comment,7822894,7822894,2,0,duffdevice,,,"This is really cool. Somebody already asked for a reverse button, how about a way to playback the evolutionary history of your biomorph (animated)?",1401496147
7824784,comment,7823400,7823400,2,0,mattste,,,"Awesome list of resources! I&#x27;m currently working on a text-based Twilio app that simplifies updates on how their Senator/Representative votes on major legislation. Further down the line I&#x27;d like to tie in direct communication with Senators/Reps where they give a statement on why they voted the way they did, updates on when they&#x27;re in their local offices, etc.",1401496138
7824783,comment,7821305,7824409,0,0,frak_your_couch,,,"So does Hortonworks as of 2.1<p><a href=""http://hortonworks.com/blog/announcing-hdp-2-1-tech-preview-component-apache-spark/"" rel=""nofollow"">http://hortonworks.com/blog/announcing-hdp-2-1-tech-preview-...</a>",1401496136
7824782,comment,7822657,7823090,2,0,egypturnash,,,"Shit, I got a ton of fun out of Skyrim and paid absolutely $0 for it - it was a pack-in when I bought my 360 late in the console&#x27;s lifecycle.<p>Oh wait I paid $7 for it when I decided to port my save files from the 360 to my computer and futz around with mods. Either way. Lots of fun for not very much because I didn&#x27;t care about playing it when it was the hot new thing.",1401496121
7824781,comment,7812133,7813917,1,0,dannyvanhooy,,,"Opentruecrypt.net also registered in Germany. I saw also the project at Github.",1401496086
7824780,comment,7823400,7824657,4,0,mikecb,,,"The main source of their power is every single court case, and more importantly, tracking which ones interact with each other and how, such as being overturned.<p>This not only needs access to pacer, but a good algorithm and a huge staff to catch up to westlaw/lexis.",1401496072
7824779,comment,7823385,7823385,1,0,pshin45,,,"Hah, got me thinking maybe PG&#x27;s pre-Viaweb startup idea to put art galleries on the Web was just too far ahead of its time[1].<p>[1] <a href=""http://paulgraham.com/bronze.html"" rel=""nofollow"">http://paulgraham.com/bronze.html</a>",1401496062
7824778,comment,7822657,7823090,1,0,georgeecollins,,,"That&#x27;s part of the problem.  The game publisher gets like $30 of that first sale, which for some game represents 10 users when you include the people who buy it used.  So the people that fund the game get ~$30 for the game and Gamestop makes $100+.  At some point gamestop needs to fund games to keep their business model afloat.<p>It&#x27;s better for the publisher to make an online game that can&#x27;t be resold.",1401496016
7824777,comment,7823478,7824558,5,0,tptacek,,,"Thanks. Join us and help out.",1401495988
7824775,comment,7823478,7824491,6,0,tptacek,,,"We will not be looking at dm-crypt or any other piece of cryptographic software. Our charter is to assess Truecrypt, and Truecrypt we shall assess.",1401495965
