ID,Type,Story,Parent,Points,Comments,Author,Title,URL,Content,Created
7824774,comment,7823478,7824766,8,0,tptacek,,,"We already know. The developer(s) got tired of supporting the project. The world seen through HN/Reddit&#x27;s prism believes Linux Truecrypt is an incredibly important project. The Truecrypt developers beg to differ: Windows was what was important to them (and, for that matter, for most non-tech users). Microsoft now provides FDE as part of the OS. They&#x27;re done.<p>It&#x27;s not a signal.",1401495921
7824773,comment,7812133,7813058,1,0,dannyvanhooy,,,"Libretruecrypt.net is registered in Germany.",1401495869
7824772,comment,7823341,7823341,1,0,volatile,,,"Inspired by John Conner with this Atari Portfolio and a ribbon cable in Terminator 2? <a href=""http://imgur.com/5AVTMHV"" rel=""nofollow"">http://imgur.com/5AVTMHV</a>",1401495869
7824771,story,,,1,0,JoshTriplett,"Predicting the livetime of a Hackage package",http://www.joachim-breitner.de/blog/archives/650-Predicting-the-livetime-of-a-Hackage-package.html,,1401495865
7824770,story,,,1,0,inkel,"New gpm plugins added to the homebrew tap: gpm-git and gpm-local",https://github.com/pote/homebrew-gpm_plugins,,1401495855
7824769,comment,7823594,7824202,1,0,crazy1van,,,"In general, I support your libertarian way of thinking. But on the other hand, drug resistance does have elements of a tragedy of the commons. Its often in our individual best interests to over medicate, but the group as a whole suffers with resistant germs. Just like it is in every individuals best interest to have the best value vehicle despite of the extra pollution that skimping on some components would cause.<p>Then again, this type of thinking can quickly extend too far. Vast numbers of drugs require prescriptions that have nothing to do with antibiotics. Heck, I can&#x27;t even get contact lenses without a prescription. That kind of thinking strikes of nannyism.",1401495835
7824768,comment,7823167,7823360,1,0,pcg,,,"I used it as one component of a job-search.<p>My impression is that it&#x27;s fairly keyword-driven.  You&#x27;re told things like how you&#x27;re 86% compatible for some job, and maybe you could bump that up to 88% by remembering that you have expertise in another couple technologies, etc.<p>I didn&#x27;t end up closing a job through MightySpring, but I like their approach and wish them well.",1401495817
7824767,story,,,1,0,JoshTriplett,"X.Org synaptics support for modern clickpads",http://who-t.blogspot.com.au/2014/03/xorg-synaptics-support-for-lenovo-t440.html,,1401495786
7824766,comment,7823478,7823496,2,0,logicallee,,,"What did you make of the bizarre sourceforge page?  Did it pass the basic smell-test for you?  struck me as very different from how other projects have communicated what the sf page ostensibly communicates, but maybe it&#x27;s not a signal.",1401495779
7824765,comment,7823928,7824197,1,0,fallinghawks,,,"Yes, and nobody ever records video with a mobile phone.",1401495744
7824764,comment,7824570,7824752,9,0,jacquesm,,,"Thanks (both for the answer, and for ZC++, my first real C++ compiler on windows after &#x27;cfront&#x27; (on xenix iirc, but it&#x27;s ages ago...), MWC before that).",1401495734
7824763,comment,7821954,7821954,0,0,rikacomet,,,"Isn&#x27;t the word &quot;dyes&quot; the right one to use here? Instead of &quot;dies&quot;?",1401495721
7824762,comment,7824757,7824757,1,0,JoshTriplett,,,"Cars, no contest.  I live in an area with excellent mass transit, and between that, walking, and the occasional plane ticket to somewhere that has airport shuttles, Uber, or taxis, I rarely <i>need</i> a car.  It&#x27;s a convenience, not a requirement.",1401495695
7824761,comment,7824570,7824708,6,0,achille,,,"Until leaving Oracle about a year ago, I&#x27;d been doing a lot of development in PL/SQL, which is extremely similar and compiles to the same ADA bytecode (called DIANA).<p>Most of Oracle&#x27;s E-Business Suite is written in PL/SQL, although some components are being re-written in Java (ADF) in the new Fusion Middleware stack.<p>If your company is using Oracle for payroll or financials (this includes lots of companies, including Apple, Google etc), it&#x27;s likely some of the customizations have been developed recently, and they&#x27;ve been developed in PL/SQL. Many of the components in EBS have not changed in decades<p>So to answer your question, developers at Google right now are writing in Ada (well almost):<p>> <a href=""https://www.google.com/about/careers/search/?#!t=jo&jid=1144001&"" rel=""nofollow"">https://www.google.com/about/careers/search/?#!t=jo&jid=1144...</a><p>It&#x27;s not easy to rewrite either. Writing ERP software is extremely hard, because it can&#x27;t be cleanly modeled in a few abstractions. There are a lot of edge cases. I would suggest reading Ward Cunningham&#x27;s <a href=""http://c2.com/cgi/wiki?WhyIsPayrollHard"" rel=""nofollow"">http://c2.com/cgi/wiki?WhyIsPayrollHard</a>",1401495628
7824760,comment,7823385,7824741,5,0,hrabago,,,"This is what I remember as well.  (1) It was very very crowded, and (2) the crowds didn&#x27;t make a big impression in my memories of being there because I was looking up.",1401495628
7824759,story,,,1,0,JoshTriplett,"Dropbox Recursive Downloader",http://www.donarmstrong.com/posts/dropbox_downloader/,,1401495619
7824758,comment,7799323,7799665,1,0,jimmaswell,,,"In an indie game&#x27;s development that I&#x27;m familiar with they use to use an orm or something similar but switched to manual SQL after the orm was generating way too many redundant statements. realtime mmorpg",1401495612
7824757,story,,,1,7,Meltdown,"Ask HN: The Internet or Cars – Which could you live without?",,"For me... it&#x27;s easy... the Internet!<p>Honestly, as I&#x27;m in my 40&#x27;s and remember what things were like before the Internet, I don&#x27;t think I&#x27;d miss the Internet that much.. probably be better for my health as well.",1401495604
7824756,comment,7821917,7823264,1,0,curun1r,,,"The US has selective enforcement of laws...minorities are far more likely to be arrested for things like drug use than those in the majority. The US has a social safety net for the poor that&#x27;s pathetic compared to most EU countries. And the US has employment practices that make it difficult for most people with a criminal record to ever get decent employment again.<p>Poor, desperate people who feel like their future options are limited are far more likely to commit crimes than those who are financially comfortable and/or believe they have promising futures. Diversity doesn&#x27;t necessitate higher crime rates, but our diversity combined with our policies does.",1401495604
7824755,story,,,1,0,JoshTriplett,"Sometimes reading code makes you scream.",http://blog.steve.org.uk/sometimes_reading_code_makes_you_scream_.html,,1401495588
7824754,comment,7796794,7819986,1,0,fallinghawks,,,"And I&#x27;m saying she&#x27;s a member of a primitive tribe who thinks being 13 and having sex is fine. To her, she&#x27;s not being raped.<p>If you read my comment above in full, I did say what he was doing was reprehensible. Relative to our culture, he&#x27;s molesting a child, and if it were happening in the US it would be considered rape because we consider people under 18 to be incapable of informed consent. And therein lies the uncertainty of definition, since she was informed and consented.",1401495549
7824753,comment,7821954,7821954,2,0,Eliezer,,,"If this is the manufacturing process and its price, why are LED light bulbs still expensive?  (Serious question.)",1401495538
7824752,comment,7824570,7824710,34,0,WalterBright,,,"It was a very large language, relative to others of the day, and I had no idea how to do it.<p>Ironically, I picked C++ to implement, having no idea that it was unimplementable :-)<p>(It took until the aughts for EDG to be the first to do a complete implementation of C++.)",1401495489
7824751,comment,7824655,7824655,1,0,dang,,,"<a href=""https://hn.algolia.com/?q=patriot+missile+failure#!/story/sort_by_date/0/patriot%20missile%20failure"" rel=""nofollow"">https://hn.algolia.com/?q=patriot+missile+failure#!/story/so...</a>",1401495441
7824750,comment,7824570,7824703,3,0,Jtsummers,,,"Not just DoD (though, admittedly, there are a large number of military projects in this list):<p><a href=""http://www.seas.gwu.edu/~mfeldman/ada-project-summary.html"" rel=""nofollow"">http://www.seas.gwu.edu/~mfeldman/ada-project-summary.html</a>",1401495438
7824749,comment,7824321,7824473,2,0,muteh,,,"1) The current title _is_ the title of the linked to document<p>2) Why didn&#x27;t the old one have &#x27;rules&#x27; in it? Removing it looks like editorializing.",1401495424
7824748,comment,7820996,7823021,2,0,jimmaswell,,,"I&#x27;d just update the kernel less if i were you. There&#x27;s not really much of a point updating the kernel all the time for normal use is there?",1401495397
7824747,comment,7823385,7823875,1,0,blueblob,,,"Let me preface this with my thoughts being that this was super cool, but I felt the same way. It is amazing that this was done in the 1400s, computer graphics and everything... I also found it annoying that double click didn&#x27;t zoom.",1401495379
7824745,comment,7824411,7824612,3,0,justizin,,,"That&#x27;s not necessarily true, you don&#x27;t need 10G ethernet to most nodes in practice, and you don&#x27;t typically need dual unless you are trying to run active/passive.  smaller footprint nodes like this often are, themselves, the failure unit.<p>most workloads don&#x27;t need much storage except on the DB end, app servers and esp things like memcache already are run on large non-x86 tiers.  Facebook, notably, uses Tilera machines for memcache last I heard.<p>A TB of RAM, sure, but it&#x27;s a bit greedy to say nothing less than that is of much use, when 128GB of RAM in a single machine is a relatively recent advancement.<p>Also note: these are development kits.  This is presumably to begin targeting ARM, make sure your code runs reliably.  Anything you can do with a TB of RAM and 32 full speed SATA channels you can develop on 4GB of RAM with one drive, as Every_Linux_Box_Ever has proven.",1401495345
7824744,comment,7824570,7824570,51,0,kibwen,,,"As a Rust contributor, I&#x27;m perpetually trying to find people who are familiar with Ada to comment on our design. I know nothing of the language except for that it&#x27;s allegedly designed for both safety and efficiency, which is exactly the niche that we&#x27;re targeting. If there&#x27;s anything that Rust can learn from Ada, we&#x27;d love to know while we still have the leeway to make breaking changes.<p>While we&#x27;re at it, I&#x27;d love to see some Erlang programmers take a look at Rust as well and tell us where we&#x27;re falling down on concurrency. Sadly, both of these languages seem underrepresented in the circles that I frequent.",1401495319
7824743,comment,7823167,7823167,1,0,FLUX-YOU,,,"Mighty spring has pinged me for feedback a few times. They&#x27;re extremely quick to fix things and will sometimes explain why something is a particular way at the moment. I happily went out of my way to put together images and detailed info for things I noticed because of how approachable they are.<p>Props, guys and gals.",1401495190
7824742,comment,7823594,7824138,2,0,crazy1van,,,"I humbly ask that you please reread my comment. I didn&#x27;t say anything about not trusting doctors. Nor did I say anything about vilifying them. I certainly didn&#x27;t mean to be offensive. In fact, I am very much aware that there&#x27;s a real chance at some point in my life I will be in a situation where a doctor will save my life.<p>I said if you have insurance, you can easily walk into most doctors&#x27; office with the sniffles (my poor choice of words for an illness with symptoms, but most likely not needing antibiotics) and walk out with a script for an antibiotic. Perhaps my sample set is very abnormal, but I see this constantly among my friends and colleagues. When they get a cold, they go to the doctor after a few days and leave with a prescription. When I&#x27;ve asked folks about it, it seems mostly out of habit. You feel bad, you go to the doctor. I find it odd, because if I ever get really sick and need antibiotics to keep me alive, I want them to be maximally effective.",1401495184
7824741,comment,7823385,7824277,4,0,bane,,,"It&#x27;s crowded, but you&#x27;re looking up so the crowds aren&#x27;t really that big of a problem.",1401495114
7824740,comment,7823385,7824730,2,0,neltnerb,,,"Thank you, that sentence made me smile.",1401495038
7824739,comment,7824265,7824350,1,0,dclowd9901,,,"It&#x27;s not true to my experience. I did have to be vigilant in my options-checking, but I most assuredly do not upload anything upon using my phone or the apps therein.",1401495030
7824738,comment,7809402,7815412,1,0,michaelmior,,,"VCR seems similar to $httpBackend. The main difference is that it automatically records the HTTP response from the target server the first time tests are executed. Then it allows you to reuse that response in future test runs to save having to manually mock responses.<p>Anyway, sounds like we&#x27;re more or less agreeing :)",1401495011
7824737,comment,7823422,7823422,10,0,noonespecial,,,"I think the disconnect here is that its not unreasonable, illegal, or even particularly surprising that a company like Makerbot might seek these patents, especially in light of their acquisition.<p>Our (the makers) problem is that it was <i>rude</i>. The community supported them in large part <i>because</i> of their declared support of openness. What they&#x27;re doing isn&#x27;t like running a red light because they&#x27;re in a hurry, its more like farting on an elevator. The backlash is justified.",1401495010
7824736,comment,7823385,7824295,10,0,neltnerb,,,"It&#x27;s worth mentioning that white LED flash has essentially zero UV.<p>This shows an LED light spectrum with one cool white LED. The warmer colors have even less of the 450nm peak.<p><a href=""http://saikoled.com/design.html#AAAAAAAAAAAAABAAA"" rel=""nofollow"">http://saikoled.com/design.html#AAAAAAAAAAAAABAAA</a><p>(click on &quot;Actual Brightness&quot; to see the spectrum in mW instead of lumens, I didn&#x27;t implement that in the URL header yet)",1401495008
7824735,comment,7823478,7824540,28,0,tptacek,,,"Give me a break. 12,000 people have signed up for our crypto challenges, in which they write 6-7 batches of 8 crypto exploits each in the language of their choosing --- people have <i>invented new programming languages</i> to do them in, and we&#x27;ve gotten them through all of the challenges --- and, by directly engaging us over email, get both validation of each of their challenge responses and 1:1 support. I am off the charts tired of people acting like my issue with incompetent crypto is a form of &quot;elitism&quot;.<p>The fact that you managed to inject that bogus complaint into this particular story, which, if you&#x27;d read the just 142 words I wrote a little carefully, is obviously the <i>exact opposite</i> of what you&#x27;re &quot;concerned&quot; about, is all the more annoying.<p>What &quot;draws my ire&quot; is cryptographic incompetence. Cryptographic incompetence gets people hurt. I do not give a shit about how those developers feel.<p>For whatever it&#x27;s worth to anyone else reading this: you will rarely ever see me get pissy about an incompetent amateur <i>breaking</i> crypto. <i>Breaking crypto is what you&#x27;re supposed to do to get good at crypto.</i>",1401495006
7824734,comment,7823400,7824354,1,0,buu700,,,"Not exactly; Google just recategorised it in their indexing system as a generic ccTLD (a technically-country-specific TLD treated as though it weren&#x27;t).",1401494947
7824733,comment,7823400,7824068,1,0,sinak,,,"Thanks Craig, but I was barely involved: all the credit should go to Sunlight Foundation and their partners (Govtrack, NY Times) who started the project and did the painstaking work to build the datasets over the course of 2 years.<p>I helped with a tiny tiny piece (the contact-congress repo), and even that was worked on for months before by the folks at Sunlight (in particular Dan Drinkard and Eric Mill).",1401494947
7824732,comment,7822894,7822894,3,0,rwinn,,,"Love it!<p>I wrote a small script that evolves them based on a scoring function, paste in your console and run evolve(1000, score)<p><pre><code>    function evolve(numGenerations, scoringFn, stepInterval) {\n      var children = document.querySelectorAll(&#x27;[id*=child]&#x27;), generation = 0\n      if (stepInterval == null) stepInterval = 10\n\n      function run() {\n        var i, child, ctx, data, score, winner, winningScore = -Infinity\n        for (i = children.length - 1; i >= 0; i--) {\n          child = children[i]\n          ctx = child.getContext(&#x27;2d&#x27;)\n          data = ctx.getImageData(0, 0, 318, 148)\n          score = scoringFn(data)\n          if (score > winningScore) {\n            winningScore = score\n            winner = i\n          }\n        }\n        children[winner].click()\n        if (++generation < numGenerations) setTimeout(run, stepInterval)\n        // console.log(winner, winningScore)\n      }\n\n      run()\n    }\n\n    function score(imageData) {\n      var i, r, g, b, rv = 0,\n          data = imageData.data, l = data.length\n      for (i = 0; i < l; i += 4) {\n        r = 255 - data[i]\n        g = 255 - data[i+1]\n        b = 255 - data[i+2]\n        a = data[i+3] / 255\n        rv += (r + g + b) * a\n      }\n      return rv\n    }</code></pre>",1401494938
7824731,comment,7823946,7823946,1,0,X-Istence,,,"Great resource if you want to start a DNS reflection attack ;-)<p>Sorry, that&#x27;s a terrible joke, let&#x27;s hope people filter egress traffic with IP&#x27;s that don&#x27;t match their network from their ISP&#x27;s.",1401494902
7824730,comment,7823385,7824724,6,0,sitkack,,,"Quakers I think are slightly more percipient. Both are extremely self reflective but Quakers come with a nicer hug.",1401494900
7824729,comment,7821954,7824574,4,0,aaronem,,,"Sounds good for a second, and then you realize that it&#x27;s going to induce a conflict between your visual and proprioceptive senses that&#x27;ll make it impossible to work at best, and probably make you toss up your lunch besides.",1401494876
7824728,comment,7824570,7824570,2,0,bsilvereagle,,,"I think Ada is a really nice language. It&#x27;s not my go to because you have to type so much. Even with vim auto-completion it still feels like I&#x27;m typing a lot of code.",1401494760
7824727,story,,,2,0,danso,"Publishers withdraw more than 120 gibberish papers",http://www.nature.com/news/publishers-withdraw-more-than-120-gibberish-papers-1.14763?WT.mc_id=TWT_NatureNews,,1401494754
7824726,comment,7824570,7824710,6,0,wtallis,,,"This is an especially interesting question given how much smaller and faster Pascal implementations were for DOS than C compilers. What did Ada add that was so complex (and how&#x27;s it compare to the complexity that C++ added to C)?",1401494738
7824725,comment,7824378,7824614,2,0,shykes,,,"That&#x27;s assuming Docker doesn&#x27;t expand its interface to allow for more parts of the platform to be interoperable :)<p>The whole point of Docker is to introduce simple interfaces to important components of distributed systems, and get a critical  mass of people to agree on it, producing interoperability. So far we did this for packaging and sandboxed execution of individual components, with some success. We plan on doing this for other areas in the future, including clustering, stack composition, application networking, service discovery, authentication and access control, etc. This will allow rival implementations to compete in each of these areas, without creating fragmentation. I don&#x27;t want a World where &quot;CoreOS containers&quot; can&#x27;t talk to &quot;Atomic containers&quot; or &quot;Mesos containers&quot; because we couldn&#x27;t agree on a common interface - we can do better than that.<p>We are pretty open about that plan. The Deis guys know this and are making the bet that embracing &quot;Docker-native&quot; interoperability is good for them.",1401494735
7824724,comment,7823385,7824688,2,0,neltnerb,,,"... except for you know, Buddhism. Which has a center in certainly every major US city.",1401494636
7824723,comment,7821954,7824575,3,0,madengr,,,"Maybe, but then you&#x27;ve got the lag and pixilation.  Seems to be a solution in search of a problem.  Still nothing nicer than human eyes looking through good glass of a stereo inspection microscope.  Really not even the eyes, but the same posture for hours on end hurting the neck muscles.  I suppose you can get used to it, but with a wire bonder there is not much leeway in adjusting the microscope position.  Then again, for a guy manually wire bonding LEDs in China, it beats toiling in a rice patty.<p>Even the USB microscope cameras are garbage.  Much better pictures just holding a digital pocket camera up to the eyepiece.",1401494633
7824722,comment,7822057,7823775,2,0,ColinDabritz,,,"Ah, yep, nailed it.",1401494632
7824721,comment,7824589,7824712,1,0,jrod2121,,,"Where would we go to get these types of insurance? We are a LLC (2 members, no employees).",1401494619
7824720,comment,7824570,7824570,25,0,jacquesm,,,"I think the biggest factor why Ada never &#x27;made it&#x27; was that the compilers that were available were priced ridiculously.<p>One of the big drivers in language popularity in the long run is how many people can become familiar with a language by using it, and by having all the implementations be terribly expensive you&#x27;re almost automatically limiting the number of people exposed.<p>I think companies that did this (much less so today than in the past) saw the languages as their profit centers, not the eco systems. Microsoft, Borland, Zortech and a whole pile of others were in a never ending battle to get the programmers on board. Every computer came with at least one programming language pre-installed (usually some form of BASIC). What you did after learning BASIC (and some of its limitations) was dictated by need and funds.<p>For most people that meant that their second language was some variety of assembler. For others to re-implement Forth (since that was doable). A C compiler was something you could still buy on a regular salary.<p>To get exposure to Lisp, ADA, Modula-2 or any one of a whole bunch of other high level languages required shelling out significant bucks. So during what we might refer to as my &#x27;formative years&#x27; as a programmer none of these really nice languages made it to my computers.",1401494609
7824719,comment,7823385,7823873,3,0,neltnerb,,,"Only thing that I would change, would be to add Easter eggs.",1401494577
7824718,story,,,1,0,wukan,"Darma – The world's first smart cushion",http://darma.co/,,1401494576
7824717,story,,,5,0,jmount,"Fighting resource leaks in R glm()",http://www.win-vector.com/blog/2014/05/trimming-the-fat-from-glm-models-in-r/,,1401494541
7824716,comment,7823501,7824332,1,0,serf,,,">I would meet every deadline, for each missile and each mine,\nBy land and by the sea.\nAnd my storage would be pooling,\nWhile my tasks were busy dueling,\nIf I only had GC.<p>pretty good. made me laugh at least.",1401494526
7824715,comment,7822652,7823251,2,0,jacobolus,,,"How does this compare to Soonmin Bae’s work from a few years ago? (I can go read the paper, but maybe you have a quick summary?)<p>(Another of Frédo Durand’s grad students who graduated a while back, <a href=""http://people.csail.mit.edu/soonmin/photolook/"" rel=""nofollow"">http://people.csail.mit.edu/soonmin/photolook/</a>)<p>Do you have any plans for future improvements which might reduce the really distracting color ringing artifacts you get in this current work?<p>Are there any photographers whose style doesn’t transfer as well? (The ones you chose all use very high contrast and harsh lighting, with an emphasis on fine structure detail.)",1401494522
7824714,comment,7822920,7823382,1,0,gwern,,,"Sexism is sometimes its own punishment - with a hiring system like <i>that</i>, how many good candidates do you think were rejected?",1401494498
