ID,Type,Story,Parent,Points,Comments,Author,Title,URL,Content,Created
7881883,comment,7880379,7881857,0,0,dragonwriter,,,"> And yes, you can start coding after 22, but it&#x27;s an uphill battle.<p>&quot;Getting an undergraduate degree other than CS&quot; isn&#x27;t the same thing as &quot;start programming after graduating&quot;.",1402549188
7881882,comment,7881263,7881263,1,0,johne20,,,"As a parent, I still can&#x27;t believe Netflix doesn&#x27;t offer better parental controls.  All we want is a whitelist of programs that our kids can watch.<p>Children programming is by far more than 90% of our Netflix usage.",1402549184
7881881,story,,,19,12,mike_esspe,"Black Man Driving Wife to Work Accused of Being Illegal Cab Driver: Lawsuit",http://www.dnainfo.com/new-york/20140611/flushing/black-man-driving-wife-work-accused-of-being-illegal-cab-driver-lawsuit,,1402549115
7881880,comment,7879756,7881769,1,0,neurobro,,,"I can&#x27;t say for sure. My only experience with a browser OS was an early Chromebook. There it was possible to develop an app in an online IDE, then download and install it. (I had to do this to build a rudimentary text editor that could save locally, although I believe there are usable editor apps available now.)<p>If there&#x27;s no way to do something similar on Firefox OS, then I see that as a much worse hindrance to the ecosystem than the income demographic they are targeting.",1402549113
7881879,comment,7881584,7881842,5,0,jchendy,,,"Better is subjective. There are many people who will find Google&#x27;s much easier to understand and use for simple needs.",1402549088
7881878,comment,7881653,7881653,3,0,cellis,,,"Use this: npm --registry <a href=""http://registry.npmjs.eu/"" rel=""nofollow"">http://registry.npmjs.eu/</a>",1402549017
7881877,comment,7881171,7881576,2,0,snowwrestler,,,"S corps pass through profits, which are reported only once, on the owner&#x27;s personal income tax statement. It avoids the double taxation of a C corporation.",1402548993
7881876,comment,7879869,7880096,2,0,dkural,,,"There isn&#x27;t much to &quot;sell&quot;. They&#x27;re metal+concrete installations.",1402548980
7881875,story,,,3,0,priteshjain,"Efficient way to calculate active Users – Helpshift Engineering Blog",https://engineering.helpshift.com/2014/active-users/?utm_content=bufferea65d&utm_medium=social&utm_source=twitter.com&utm_campaign=buffer,,1402548973
7881874,comment,7878679,7880004,2,0,pavement,,,"$23,000 is still a pretty penny.",1402548969
7881873,comment,7880676,7880676,2,0,busterc,,,"Just yesterday, while developing a Cordova hybrid app intended to target iOS, Android & Windows Phone 8, this very notion became unsettlingly apparent for me. BTW, <a href=""http://icons8.com"" rel=""nofollow"">http://icons8.com</a> is a great place to do icon recon.<p>Personally, I like the iOS 6 icon over the iOS 7 version. They&#x27;re almost the same, except the new one places too much emphasis on &quot;up.&quot; For example, when using the Meme Producer app and you want to save the picture to your photo library, the app uses the iOS 7 &quot;action&quot; icon but it feels awkward to then immediately go to the &quot;download&quot; icon to actually save. <a href=""http://i.imgur.com/YtVd5WZ.jpg"" rel=""nofollow"">http://i.imgur.com/YtVd5WZ.jpg</a>",1402548942
7881872,comment,7881629,7881629,1,0,mindcrime,,,"I&#x27;m not actively involved in anything in a volunteer capacity at the moment, but for pretty much the entire decade of the 90&#x27;s I was a volunteer firefighter.<p>Now, firefighting is too big a time sink for me, especially in terms of being as active as I was back then.  But if I could free up some time to do <i>something</i> volunteer related, my first choice would be to volunteer as a tutor for the local Literacy Council.<p>I&#x27;ve also toyed with trying to squeeze in some time to teach some free programming classes at the local hackerspace, including maybe a kid centric thing using Scratch or something of that ilk.  But right now I work a full-time job AND am working on a startup, so I&#x27;ve kinda put that stuff on the backburner for a while.",1402548923
7881871,comment,7881788,7881788,0,0,Gustomaximus,,,"This is a super interesting area. I think it&#x27;s one of those technologies that will really open the door for some cool tech to follow.",1402548915
7881870,comment,7881171,7881171,5,0,lacero,,,"This article is basically the conclusion of the book the millionaire next door. The authors comb through statistics of the rich and interviews with wealthy people.<p>Building a business is probably the best way to make a large lump sum of money. Unfortunately the business is more likely than not to fail before bearing fruit and even after successfully running the business for large profits over time competition, laws, and factors out of your control usually kill the business. Due to the inherent risks and stress involved the book states that most successful people would not advise their children to start businesses but to get professional degrees, especially the kind that can work for themselves or consult such as law, medicine and accounting. Not so much the non-professional jobs such as business management.",1402548912
7881869,comment,7881692,7881692,10,0,ChuckMcM,,,"Is this surprising to anyone, structurally it is exactly the same as the mortgage issue in 2009 with Freddie and Fannie. The government finances the lending of money (by absorbing the risk) and gives banks money at a few percent which they loan out at 5 - 6% or more. You combine that with for profit universities which have discovered that the bank and their interests are aligned, they charge what ever they want for tuition, the banks make sure the students can get that in the form of guaranteed loans and non-dismissable loans, and the students play their part by putting themselves into indentured servitude. There is no other way for this to play out.<p>I&#x27;ve written my congress critters and suggested they notify the banks that they are going to make loans dischargable in bankruptcy in 4 years, they are going to change the guarantee to be 60 cents to the dollar. Its going to get very very painful.",1402548887
7881868,comment,7881373,7881621,1,0,BorisMelnik,,,"was the dog OK?",1402548833
7881867,comment,7881859,7881859,1,0,breadbox,,,"I have to say, if the audiobook bundle just threw in a digital copy of the actual text -- a file that would be measured in kB instead of GB, I might add -- then I would be all over that. But audio-<i>only</i>? I doubt I&#x27;ll bother.<p>Audiobooks are great for some people, but for me it&#x27;s like one step removed from watching the movie instead of reading the book.",1402548779
7881866,comment,7881171,7881417,1,0,daemin,,,"I probably should have made myself clearer, and I guess I didn&#x27;t take the US situation into account (I&#x27;m living in Sydney).<p>When I ran the numbers through my head before making the original comment I assumed the savings would be 25-50% of take-home pay, so with the necessary taxes taken out. Which I would argue should still be more than a measly 6% of the total.<p>The other point to make is that a mortgage would count as savings, since you&#x27;re paying off a rather large purchase as opposed to paying rent. That and most people would be putting the savings away to buy a residence in the first place.",1402548768
7881864,comment,7881653,7881653,3,0,pbadger2,,,"I&#x27;d be more surprised if you had posted that NPM was up.",1402548677
7881863,story,,,2,0,joeblau,"C, Go, Swift",http://hyperpolyglot.org/c,,1402548662
7881862,comment,7881680,7881680,1,0,Xangis,,,"Xamarin gives partial Visual Basic support along with full support for C#.",1402548639
7881861,comment,7878949,7878949,4,0,sushirain,,,"The biggest difference the memristor brings is to Machine Learning. The memristor is a first step towards a hardware implementation of Hebb&#x27;s rule - &quot;neurons that fire together wire together&quot;. Hebb&#x27;s rule variants are used in machine learning algorithms to do things like web-search, image/object recognition, etc. (Specifically, Hebb&#x27;s rule can be used to compute PCA.)<p>It&#x27;s interesting to note that the brain does not have separate components for memory and computation. Every neuron computes and stores at the same time.",1402548606
7881860,comment,7878742,7881439,2,0,cheepin,,,"Ever tried Dragdis?",1402548567
7881859,story,,,1,1,breadbox,"Humble Audiobook Bundle",https://www.humblebundle.com/books,,1402548532
7881858,story,,,1,0,peterkchen,"YouTube Gets a New Tech Boss, From Google",http://recode.net/2014/06/11/youtube-gets-a-new-tech-boss-from-google/,,1402548452
7881857,comment,7880379,7881175,2,0,vellum,,,"<i>Anyhow, I&#x27;m not sure any of that is relevant -- why is the requirement for a particular degree, or a requirement to commit early for a degree, a barrier for women entering the field?</i><p>When discussing women in tech, people bring up how the candidate pool mirrors the pipeline.  See the recent discussion on Google.  <a href=""https://news.ycombinator.com/item?id=7813310"" rel=""nofollow"">https://news.ycombinator.com/item?id=7813310</a><p><i>Are you arguing that women are inherently less likely to commit early?</i><p>Guys are more likely to start coding in high school or earlier, so they&#x27;re the ones starting freshman year. For example, the number of women who take the AP CS test is ~18%, which is close to the % of CS degree grads who are women.<p><a href=""http://www.exploringcs.org/resources/cs-statistics"" rel=""nofollow"">http://www.exploringcs.org/resources/cs-statistics</a><p>If you want to graduate in 4 years, you have to start your CS program freshman year.  You can switch later, but you&#x27;re going to have to pay for more semesters, or work harder and cram in more units. And yes, you can start coding after 22, but it&#x27;s an uphill battle.",1402548438
7881856,comment,7879808,7879808,1,0,danelectro,,,">how . . . did you decide<p>I like to build laboratories, working in an institution would not be as rewarding to me unless I build it myself or it reflects my vision.<p>>why . . . did you decide<p>so I could do better practical (paying) work, including better fundamental science (far-future payoff) than was allowed in established academic or industrial institutions.<p>>when did you decide<p>ASAP.<p>Independent and self-funded, I did not miss as much unrestricted work than I would have in academic or industrial labs which are much more restricted.<p>I consider myself fortunate that I did serve large industrial outfits which were able to pay the bills for so long using only 1 percent of my technical abilities.<p>Don&#x27;t try this at home.",1402548432
7881855,comment,7881171,7881759,2,0,jsaxton86,,,"Yeah, I think we&#x27;re pretty much on the same page. I think we both agree that established startups probably provide the best balance between risk and reward, but I&#x27;m less optimistic about the potential reward, especially for an engineer.<p>I joined the company I currently work for about a year after they raised a series C round. Most importantly, I get a pretty competitive base salary, but I also have some stock options. Even in the best case scenarios I think I&#x27;m looking at new car money, not mid-six figures. From talking with other coworkers, joining shortly after the series B round would have increased my options by roughly a factor of 3, in which case that &quot;new car money&quot; becomes &quot;down payment on a house&quot; money. Which is great, I&#x27;m not complaining at all, but it&#x27;s not enough such that anyone post-series B that I know will be making a few hundred thousand per year.",1402548428
7881854,story,,,1,0,mbrubeck,"First 'Bitcoin 2.0' Crowd Sale Was A Wildly Successful $7 Million Disaster",http://www.forbes.com/sites/kashmirhill/2014/06/03/mastercoin-maidsafe-crowdsale/,,1402548382
7881853,comment,7881373,7881707,5,0,croggle,,,"Cool logic... the money you have in your savings account that you haven&#x27;t touched for two years should be given to charity. Thank you for your donation.",1402548362
7881852,comment,7880723,7881550,1,0,adobriyan,,,"In back then USSR liberal loonies cried that &quot;freedom of choice between 2 or more candidates in elections&quot; is all you need.",1402548359
7881851,comment,7881171,7881830,1,0,phlyingpenguin,,,"As a successfully graduated grad student, I disagree. It is possible, but not at all easy, healthy or sustainable.",1402548336
7881849,comment,7881171,7881527,1,0,cliftonk,,,"In Texas salaries average around 80% of what they are in CA. No state income tax. Rent is around 1k (albeit higher in Austin). Food, gas, etc is less expensive. Saving 50% of post-tax income is very doable.",1402548260
7881848,comment,7881373,7881707,3,0,tlb,,,"Mining companies often sit on mines, not because they&#x27;re trying to manipulate the market, but because the mineral isn&#x27;t economic to extract yet. You can, for example, buy a gold mine today where the cost to extract gold is $2000/oz, and wait until the price goes above that before starting operations.",1402548254
7881847,comment,7878742,7880769,1,0,lips,,,"It started as Simplenote, but was acquired (methinks) by Automattic (WordPress) at some point, and the underlying tech was turned into <a href=""https://simperium.com"" rel=""nofollow"">https://simperium.com</a>",1402548251
7881846,comment,7878949,7878949,2,0,goblin89,,,"This computer may take as long as a decade to build, according to the article. Why did HP choose to reveal their hand so early? Isn&#x27;t it preferable to take everyone (especially competitors) by surprise?",1402548217
7881845,comment,7880723,7881388,1,0,nitrogen,,,"Maybe, every now and then, someone has to try an apparently futile approach just to remind everybody that the system is still broken.",1402548203
7881844,comment,7878510,7880234,1,0,27182818284,,,">Actually travelling to the surface world would be akin to driving for hours across the state. It&#x27;s a trip and would be planned for accordingly, and happen rarely.<p>I must be missing something. 10,000ft is 1.8ish miles. That&#x27;s like an 8 minute bike ride not a cross-state drive. Even if it took 30 minutes by elevator, that&#x27;s a reasonable commute in cities like Chicago.",1402548196
7881843,comment,7867634,7878133,1,0,tel,,,"Records-of-closures is pretty much what I&#x27;m talking about. There is a notion of identity when those records are recursive, though the state management is still manual (as you&#x27;d expect).<p><pre><code>    data Complex = { rotate :: Degrees -> Complex }\n\n    -- thus\n    -- rotate :: Complex -> Degrees -> Complex\n</code></pre>\nwhere `rotate` is a state transformer and thus produces a notion of identity.",1402548102
7881842,comment,7881584,7881584,5,0,sillysaurus3,,,"A much better alternative is <a href=""http://www.bitcoinwisdom.com"" rel=""nofollow"">http://www.bitcoinwisdom.com</a><p>Here&#x27;s what it looks like: <a href=""http://i.imgur.com/RttHnFO.png"" rel=""nofollow"">http://i.imgur.com/RttHnFO.png</a><p>Here are the settings I use:<p><a href=""http://i.imgur.com/AYYIDW7.png"" rel=""nofollow"">http://i.imgur.com/AYYIDW7.png</a><p><a href=""http://i.imgur.com/6a4jy4z.png"" rel=""nofollow"">http://i.imgur.com/6a4jy4z.png</a>",1402548055
7881840,comment,7879577,7881645,1,0,codezero,,,"Awesome, sounds equal parts fun and frustrating, a true rogue-like :P",1402548043
7881839,comment,7879955,7881715,1,0,Synroc,,,"Rush hours maybe? Although there may be higher competition during those hours.",1402548020
7881838,comment,7879955,7881623,1,0,trhway,,,">In response to the Commission’s inquiries, we surveyed our members regarding coverage issues in the above described situations. It appears that the industry standard for personal auto insurance policy contracts is to exempt from insurance coverage claims involving vehicles used for transporting passengers for a charge. Thus, in situations where a vehicle is insured as a private vehicle and is used to transport passengers for a fee, no insurance coverage would exist…<p>and now grand entry of a police doing traffic stop on a UberX/Lyft car with a fare - no coverage at that moment , i.e. driving without insurance....",1402547984
7881837,comment,7881373,7881693,3,0,windowsworkstoo,,,"OT but I don&#x27;t care, as I love being reminded how small the world is...I lived in Arana Hills in the 90&#x27;s/2000&#x27;s and went to Ferny Hills primary. I can imagine this would be easily possible in that area :)",1402547974
7881836,comment,7881263,7881649,3,0,Pxtl,,,"Oh God, not Clifford - Louis CK is spot on about Clifford: <a href=""http://m.youtube.com/watch?v=_Eix1CDVHYE"" rel=""nofollow"">http://m.youtube.com/watch?v=_Eix1CDVHYE</a>",1402547961
7881835,comment,7881584,7881584,6,0,simonsarris,,,"Here&#x27;s an Onion headline for you:<p><i>Google Finance Now Showing Bitcoin Price inside Flash Widget.</i><p>Oh wait.",1402547924
7881834,comment,7881373,7881776,3,0,wavefunction,,,"It&#x27;s Jamaica, the beach&#x27;s &quot;value&quot; is not shared with the greater Jamaican society.  Maybe if it were the sand would still be there.",1402547759
7881833,story,,,1,0,learc83,"Cantor, a reliable 'yes' vote for raising the H-1B visa cap, is unseated",http://www.computerworld.com/s/article/9249043/Cantor_a_reliable_yes_vote_for_raising_the_H_1B_visa_cap_is_unseated,,1402547755
7881832,comment,7876067,7878481,1,0,dredmorbius,,,"It happens more often than you&#x27;d think, and as I noted, even static screenshots or images won&#x27;t reflect the dynamic nature of that graphic.<p>Those are both issues you could address with small multiples, a Tufte method.",1402547726
7881831,story,,,2,0,hglaser,"Predicting Exponential Growth With SQL",https://www.periscope.io/blog/predicting-exponential-growth-with-sql.html,,1402547720
7881830,comment,7881171,7881527,2,0,hotpockets,,,"Its ridiculously easy to live off about $20,000.  You don&#x27;t even have to try very hard.  Source: any graduate student.",1402547702
7881829,comment,7879942,7881528,1,0,pdkl95,,,"Website owners can still get most of their metrics without google the same way we did it before google existed: they can analyze their Apache/Nginx logfiles.<p>Stats is hard? Find some software that does if for you. Better yet, figure out how to do some of it yourself (it&#x27;s not paritc8ularly hard). Or hire some statisticians. This way, you free your business from being dependent on a 3rd party.",1402547648
7881828,comment,7865188,7868733,1,0,davidu,,,"You&#x27;re suggesting that 8 people giving references are lying, or are scared of the candidate.<p>I find that hypothesis totally absurd.",1402547605
7881827,comment,7881680,7881680,2,0,adamredwoods,,,"although a small user base, Monkey-x is quite fun (and compiles to native iOS!):<p><a href=""http://www.monkey-x.com"" rel=""nofollow"">http://www.monkey-x.com</a>",1402547582
7881826,comment,7865188,7868418,1,0,davidu,,,"How so?",1402547551
7881825,comment,7881186,7881736,1,0,ticktocktick,,,"If you are using Linux...<p>You can use this...<a href=""https://github.com/lmartinking/webscreensaver"" rel=""nofollow"">https://github.com/lmartinking/webscreensaver</a>",1402547530
7881824,comment,7876758,7878770,1,0,gunrockmaster,,,"ah you found a link to it. excellent.",1402547520
7881823,comment,7876758,7877451,1,0,gunrockmaster,,,"If you are willing to post an email address, or someway to get it to you, I can get you the paper.",1402547462
7881822,comment,7881584,7881584,9,0,hueving,,,"This is a nice surprise since Google finance is essentially a dead product. I don&#x27;t think it has changed for 5+ years. Not to mention the awful Android app that can&#x27;t even sync a large set of portfolios...",1402547462
7881821,comment,7881263,7881742,1,0,burkaman,,,"That rumor was mostly false. There have been &quot;overtures&quot;, so someone at Netflix is interested, but there is no planned production.<p><a href=""http://larrynemecek.blogspot.ca/2014/06/hold-your-horsestheres-no-netflix-cbs.html"" rel=""nofollow"">http://larrynemecek.blogspot.ca/2014/06/hold-your-horsesther...</a>",1402547385
7881820,comment,7881518,7881808,1,0,ChrisAntaki,,,"Well said. If one&#x27;s plan is to stay in SF long term, and they can afford a house they&#x27;re happy with, they should go for it.",1402547357
7881819,comment,7881171,7881527,1,0,smm2000,,,"Looking at pre-tax saving rate for high income individuals in California is useless - top marginal tax rate is ~53% so often it&#x27;s mathematically impossible to save 50% pre tax. Looking at saving rate post tax makes much more sense. Though you should always utilize 401k, 529k and other tax-efficient methods to save of course.",1402547314
7881817,comment,7877147,7880064,1,0,yoklov,,,"This is <i>exactly</i> what people should use WebGL for. Software skinning sucks, esp. if you can avoid it (e.g. with a vertex shader).<p>(That said, there are plenty of other areas for using SIMD in JS)",1402547235
7881816,comment,7880119,7880119,3,0,cma,,,"I think spaces like this would do well to incorporate projected augmented reality ala CastAR:  <a href=""https://www.youtube.com/watch?v=GpmKq_qg3Tk"" rel=""nofollow"">https://www.youtube.com/watch?v=GpmKq_qg3Tk</a><p>You could collaborate, sharing the same view, or each individual could project different views, or mix and match.",1402547169
7881815,comment,7881263,7881787,1,0,burkaman,,,"Releasing all the episodes at once is definitely a good idea for a kids show. Parents can schedule in the show whenever they want, they can use an episode as a reward or push one back as a punishment, they just get maximum control over their kid&#x27;s entertainment.<p>For House of Cards, Orange is the New Black, etc. you can make the argument that weekly episodes would be better, but for a kids show I think there is no question that more control is the best strategy.",1402547167
7881814,comment,7879955,7880659,2,0,aianus,,,"I&#x27;ve only had one &#x27;bad&#x27; experience with Uber (driver didn&#x27;t speak English properly and went to the wrong address and couldn&#x27;t issue me a refund). I left a low rating and Uber contacted me out of nowhere and proactively offered me an apology and a refund. I also heard they&#x27;re pretty ruthless about firing drivers with low ratings.<p>Meanwhile I&#x27;ve had a regular cab driver double-swipe my credit card and one who did a u-turn from the right lane without checking his blind spot and nearly killed us both.",1402547140
7881813,comment,7880119,7881270,5,0,enneff,,,"I don&#x27;t think it&#x27;s distasteful. He lays the blame where appropriate: it was his own &quot;terrible mistake&quot;.",1402547118
7881812,comment,7879542,7881551,1,0,michaelbuckbee,,,"Well, the main reason was that I didn&#x27;t realize that AWS RDS was offering Postgres now (looks like it is still in beta, but awesome news nonetheless).",1402547098
7881811,comment,7881263,7881792,4,0,dragonwriter,,,"Its more their weapon against being deprived of profitability by competitors bidding up the prices of content from outside producers (and, especially, those competitors locking up exclusive deals). When Netflix was mostly alone in their market, they didn&#x27;t really need their own programming, but once there was competition, they did, independent of ISPs.<p>Its the same thing that HBO went through on cable.",1402547077
7881810,comment,7880676,7880987,2,0,abruzzi,,,"what I don&#x27;t like about the explosion of share menus us that email has been subordinated to the share menu.  I may be a constituency of one, but email is the only way I share.  So instead of tapping or clicking &quot;email&quot;, I have to tap &quot;share&quot; then email.",1402547054
7881809,comment,7881171,7881700,2,0,richardking,,,"Not in this case, because a lot of business fail in a year or two, and a lot businesses survive for 10, 20+ years.<p>I&#x27;ll bet there&#x27;s a lot of &#x27;$ made&#x27; graphs for entrepreneurs that don&#x27;t go up much, or even go down; and a few that are hockey-sticks. There&#x27;s really no point of averaging the two out into a scenario that rarely/never happens.",1402546995
7881808,comment,7881518,7881518,4,0,pdx6,,,"It depends on your goals. If you plan to live here forever, then you should buy, no question. If you plan to stay for just a few years, the taxes, transaction fees, and closing costs will eat you alive.<p>Now a better question is if you plan to stay 7 years or more, which is the &quot;normal&quot; amount of time people stay before moving on to a larger home from their starter home. Real Estate markets have about an 8 year cycle, so this fits well for this model of buying.<p>Also keep in mind are the taxes. In San Francisco, there is a special assessment if you sell a house worth more than 850k or so, and it steps up the more your house sells for (but there is a rebate if you get solar panels, hint hint). California takes 12.7% of your profit, which nearly kiss the $250k/$500k Fed tax exemption for living in a property for 3 out of 5 years.",1402546993
7881807,comment,7881171,7881486,3,0,smm2000,,,"There is zero reason to tell close personal friend that you have more than $1M in assets unless your friend have comparable assets. People are jealous and telling somebody that you have much higher salary (especially if are in the same industry) or you have a lot of assets is the sure way to destroy friendship.",1402546980
7881806,comment,7881518,7881518,2,0,steven2012,,,"The OP forgot about inflation and its effects on the model.  It will probably have a much more profound effect that number of housing starts.",1402546956
