ID,Type,Story,Parent,Points,Comments,Author,Title,URL,Content,Created
7881805,comment,7880676,7880887,7,0,x0054,,,"Perhaps its more logical to refer to all of these types of action as &quot;broadcast&quot; rather than &quot;share&quot; actions. You are &quot;broadcasting&quot; a picture to facebook, or a link to the file via twitter, or the actual file via email. By referring to these actions as broadcast rather than share actions, you convey to the user that they are relinquishing power over that data, once the genie is out, you are not stuffing him back in. A good icon would be a radio antenna broadcasting things. Just a thought.",1402546950
7881804,comment,7881629,7881629,2,0,invinceable,,,"Start with the bigger picture and decide what is a big problem you see and want to be a part of the solution. Once you know that, you can look at the different things you can do to help eradicate that problem.<p>For me it was helping the homeless. There are many ways to help homeless people, but I think the best way is showing them that someone still cares just if even to only help serve a meal. The St. Vincent de Paul Society has many things here you can do. I suggest serving meals where you get a chance to interact with them. The meal is great way to help at a basic level but where you can do these people the most good is to just smile and ask how their day is going... Show them kindness. Give them hope.<p>That is the way I feel I can best help the homeless at this moment.",1402546937
7881803,story,,,1,0,duvok,"Expresscoin Launches to Become Coinbase for the Unbanked",http://www.coindesk.com/expresscoin-launches-become-coinbase-unbanked/?utm_source=feedburner&utm_medium=feed&utm_campaign=Feed%3A+CoinDesk+%28CoinDesk+-+The+Voice+of+Digital+Currency%29,,1402546921
7881802,comment,7878802,7880130,2,0,victorhooi,,,"Actually, from what I&#x27;ve seen, the Node.JS community definitely seems more...immature,<p>I don&#x27;t deal much with them, but the Perl community definitely seems much more mature.<p>And I deal more with the Python community, and they&#x27;ve always been decent and welcoming to all.<p>The whole Joyent-crucifying-Ben fiasco, and the fallout showed that even though they might be adults, and core contributors, they weren&#x27;t actually very mature, or even seem like particularly nice people.<p>Maybe that&#x27;s just how it played out, and behind closed doors, they&#x27;re super nice people, but it certainly didn&#x27;t do them any favours posting that inflammatory blog post of theirs.",1402546864
7881801,comment,7881266,7881266,1,0,gobengo,,,"Obligatory post to <a href=""http://en.wikipedia.org/wiki/Betteridge&#x27;s_law_of_headlines"" rel=""nofollow"">http://en.wikipedia.org/wiki/Betteridge&#x27;s_law_of_headlines</a>",1402546832
7881800,comment,7881263,7881785,3,0,silencio,,,"I&#x27;ve been watching it recently because I randomly discovered that Netflix had the old episodes, usually over lunch or around dinner or when I want to take a break.<p>The last MSB episode ever was about computers, complete with cocky nerd that is convinced that his code was flawless. ;)<p>The timing for this couldn&#x27;t be better - I adore the show so much and it&#x27;s especially timely to do a reboot because Ms. Frizzle was a fantastic female scientist role model for me when I was young and now kids (and when I have kids) will get to experience a newer, less dated version of her now :)",1402546802
7881799,comment,7880723,7881383,2,0,tendom,,,"Well, the bulk of the governments today can be classified as Democracy, Monarchy, and Constitutional Monarchy.  On the whole, if we average the types of government, you&#x27;ll find that Constitutional Monarchy actually has a higher middle class wealth, more freedom, and less &#x27;mysterious disappearances&#x27; than the republics.  I&#x27;ve seen some pretty bad republics in my travels.",1402546728
7881798,story,,,2,0,adventured,"What Every Startup-Friendly City Needs (Hint: It's Not Google Buses)",http://www.bloomberg.com/news/2014-06-11/what-every-startup-friendly-city-needs-hint-it-s-not-google-buses-.html,,1402546726
7881797,comment,7879121,7880407,1,0,eob,,,"Academic here: sharelatex went down before a major conference deadline a few months back. I just use `git` and `make` for my latex workflow, but I learned several colleagues down the hall use sharelatex when they all shouted simultaneously :) (everything worked out OK for them though)",1402546702
7881795,story,,,1,0,morganhankins,"Go Seigen Turns 100",http://gogameguru.com/go-seigen-turns-100-today/,,1402546643
7881794,comment,7879955,7880972,2,0,x0x0,,,"do you live in nyc?  rush hour is when it&#x27;s hard to get a cab in manhattan.  and while the effectiveness can vary, calling 311 in the backseat if the driver refuses to deliver was effective in my one experience",1402546635
7881793,story,,,2,0,massappeal,"Ode to the Founder",https://startupsanonymous.com/story/ode-founder/,,1402546625
7881792,comment,7881263,7881785,3,0,ams6110,,,"Either way, Netflix&#x27;s strategy to produce original programming that people want is their weapon against ISPs trying to build their own on-demand offerings and throttling Netflix.",1402546618
7881791,comment,7881263,7881728,7,0,cwyers,,,"A few years ago, I went all cord-cutter for a while, so just Netflix over the Xbox. I finally caved and got cable back. My daughter, who was around five at the time, was watching some Nick show she hadn&#x27;t seen before (I think it was Ni Hao Kai-Lan) the first day we got cable back. When it was over, my daughter looked at me and said, &quot;I liked that, I wanna watch another episode!&quot; I had to explain to her that with cable, you didn&#x27;t get to choose what you watched like Netflix, you just picked a channel and whatever they were showing was what you got. I don&#x27;t ever think I have felt as old as I did in that moment.",1402546538
7881790,comment,7881653,7881653,4,0,farslan,,,"One reason where Go&#x27;s lazy approach is wonderful. It doesn&#x27;t need to depend to any centralized server.",1402546491
7881789,comment,7880676,7880676,1,0,Tloewald,,,"The writer misses the fact that Apple has a more general and consistent concept of &quot;sharing&quot; (and has had consistently for nearly a decade -- before iOS and before the iOS sharing icon) than the others.<p>Share -- exemplified by iPhoto -- means share <i>by</i> <i>any</i> <i>means</i> (e.g. email, youtube, twitter, facebook, burning a DVD). Thus, Apple&#x27;s icon makes perfect sense -- more sense than the Y -- based on this. You might be sharing with one specific person, or everyone. The point is that you&#x27;re sending stuff OUT.<p>Most of the others treat sharing as something special that is &quot;distribute by any method except the other things we have icons for&quot;.",1402546475
7881788,story,,,35,16,throwwit,"How Smart Meters Can Reveal Behavior at Home, What We Watch on TV",http://www.bloomberg.com/news/2014-06-10/your-outlet-knows-how-smart-meters-can-reveal-behavior-at-home-what-we-watch-on-tv.html,,1402546473
7881787,comment,7881263,7881263,2,0,quackerhacker,,,"Netflix is really amazing to me!\nI am SO impressed by their model and the plethora of data that they can just sift through (I love analytics and data mining).<p>Netflix has went from dvds by mail, to video content distribution, to an ACTUAL broadcast network. While I love their selection, I hope that they release their episodes once a week. I&#x27;d imagine it would capture an audience instead of marathoners.<p>From an investment standpoint, I can only imagine it being a matter of time before all the data they have (like audience retention time, device types, and internet speeds which can easily provide an assumption of demographic) be put to use for  video ad campaigns.<p>Simply awesome business model!",1402546454
7881786,comment,7881584,7881584,3,0,ekianjo,,,"When you ask for the &quot;All&quot; range in Time, you get a very strange chart. I wonder what&#x27;s wrong.",1402546453
7881785,comment,7881263,7881728,7,0,Swizec,,,"Alternative explanation: drunk and/or high people looking for easy-to-process entertainment.<p>Hell, I&#x27;d rewatch Magic School Bus even if I wasn&#x27;t drunk. That was a <i>great</i> show.",1402546451
7881784,comment,7878870,7878870,1,0,ja27,,,"It was a lot more than an hour (two days of making lasagna).",1402546412
7881783,comment,7881171,7881718,1,0,rdl,,,"I&#x27;d call that &quot;post economic&quot;, but $5-10mm pretax (which is more likely what an employee gets at a Google as an engineer hired before IPO who stays through IPO for 4y) is not enough, after taking care of one&#x27;s personal expenses, to really fund serious startups.<p>My definition of &quot;rich&quot; is being able to do something (fund businesses) which you fundamentally can&#x27;t do while earning a salary.  You could do that at an extremely limited scale either as a well paid employee or as 5-15mm exited founder.<p>It&#x27;s a pointless semantic argument, though.  My real argument is that founders are making 10, 100, or 1000x what others are making in virtually all positive outcomes, and not actually doing badly in negative outcomes (sometimes better, due to soft landings; sometimes worse, due to forgone salary).",1402546411
7881782,comment,7879121,7879121,1,0,mythealias,,,"From stackexchange: <a href=""https://tex.stackexchange.com/questions/553/what-packages-do-people-load-by-default-in-latex"" rel=""nofollow"">https://tex.stackexchange.com/questions/553/what-packages-do...</a>",1402546397
7881781,comment,7881653,7881724,3,0,antoncohen,,,"&quot;Guru Meditation&quot; is part of a default error message in Varnish, a caching HTTP proxy. Fastly (NPM&#x27;s CDN) uses Varnish.<p>The Guru Meditation error originated with Amiga: <a href=""http://en.wikipedia.org/wiki/Guru_Meditation"" rel=""nofollow"">http://en.wikipedia.org/wiki/Guru_Meditation</a>",1402546396
7881780,comment,7879950,7881656,1,0,dragonwriter,,,"> California, also called Noua Albion [sic, should probably be Nova Albion?]<p>&#x27;u&#x27; and &#x27;v&#x27; were allographs for the same letter in medieval Latin (and English, etc.) -- though they became separate in around the 16th Century in English. Maybe transliteration of Latin into German kept &quot;u&quot; where we would use &quot;v&quot; longer?(Nova Albion is basically &quot;New Britain&quot; in Latin)",1402546358
7881779,comment,7880676,7880887,1,0,twelvechairs,,,"Exactly. If you can&#x27;t make an icon for it chances are the concept is too vague to be understood.",1402546282
7881778,story,,,3,0,duvok,"Yahoo Finance Now Showing Bitcoin Price",http://finance.yahoo.com/q?s=BTCUSD=X,,1402546258
7881777,comment,7879955,7881537,2,0,hashbanged,,,"It sounds like being a postdoc stressed him.",1402546231
7881776,comment,7881373,7881373,1,0,trhway,,,">The bulk of the sand in the 0.5-hectare beach, of approximately 500 truckloads, was found missing in July 2008<p>10000 tons - an amount of sand that could have been brought by a midsize ship from a place like Morocco/Sahara (if we discard any other closer sources). At $20/mt that would be $200K - may be more expensive than real estate price of the beach, yet considering overall value of the beach for the society...",1402546230
7881775,comment,7880723,7881458,1,0,patcon,,,"This is great perspective. Thanks.",1402546188
7881774,comment,7881263,7881263,1,0,tokipin,,,"nice! reminds me of the recent Reading Rainbow kickstarter :D",1402546143
7881773,comment,7864813,7874746,1,0,meepmorp,,,"What&#x27;s lion taming like as a career?",1402546135
7881772,comment,7862487,7870434,1,0,akg_67,,,"Most STEM graduate programs will typically pay you to go to school and waive all or major portion of tuition fees. You don&#x27;t need to repay anything. You might burn a few bridges at most. I have gone to graduate school where some of my classmates who came from other countries quit within one or two semesters and started working for companies full time.",1402546102
7881771,story,,,1,0,java-only," Endorsed Standards Override Mechanism in Java ",http://www.java-only.com/LoadTutorial.javaonly?id=123,,1402546094
7881770,comment,7881373,7881621,4,0,cfontes,,,"This happens every single day in Brazil.<p>Most of my friends had their whole houses wiped out on holidays. Once a year it happens to one of my friends that have houses on non closed streets at least.",1402546087
7881769,comment,7879756,7881686,1,0,cpeterso,,,"Can people actually write apps using only a Firefox OS device? I&#x27;m not being flippant. I think this is an interesting question for sustainability of the Firefox OS ecosystem.",1402546079
7881768,comment,7881653,7881653,9,0,peterwwillis,,,"Mirrors, anyone? CPAN has like 50,000,000 mirrors. NPM could get at least three.",1402546078
7881767,comment,7881584,7881584,4,0,vijayboyapati,,,"Anyone know where they&#x27;re getting their market data for price history and volume? Perhaps not as important after the collapse of Gox, but the market is still illiquid enough that there can be substantial spreads between exchanges.",1402546076
7881766,comment,7878949,7878949,1,0,jayantsethi,,,"Can someone please explain how can light be used to transfer data in computers?",1402546074
7881765,comment,7879955,7881523,5,0,aianus,,,"Why is that even a thing?",1402546042
7881764,comment,7877147,7877503,3,0,lgeek,,,"> architectures that don&#x27;t support NEON (they often lack them in Marvell and Allwinner).<p>I&#x27;m probably nitpicking here, but:<p>* All Allwinner SoCs have NEON[0]<p>* Most current ARMv7 processors have NEON. Of the current ARM cores, only Cortex-A5 and Cortex-A9 don&#x27;t have mandatory NEON support (it&#x27;s optional). Cortex-A5 is intended for embedded applications. Of the existing Cortex-A9 processors, AFAIK the only somewhat popular one without NEON support is NVIDIA Tegra 2, which is retired. Out of the third party cores, all Qualcomm and Apple ones have NEON support.<p>[0] <a href=""http://linux-sunxi.org/Allwinner_SoC_Family"" rel=""nofollow"">http://linux-sunxi.org/Allwinner_SoC_Family</a>",1402545990
7881763,comment,7879869,7880386,3,0,nandemo,,,"> Did Brazilian diets change recently to include a bunch of meat?<p>Yes, for some values of &quot;recently&quot; (past 20 years).<p>We had a sort of economic renaissance in the 90s, when the government finally managed to control hyperinflation amongst other reforms (slashing tariffs, privatization of several state companies, etc).<p>One of the consequences is that people started eating more meat. The chart in this page shows the chicken consumption per capita (in kg):<p><a href=""http://revistaepoca.globo.com/Revista/Epoca/0,,EDG51460-6009,00-O+ANO+DO+FRANGO.html"" rel=""nofollow"">http://revistaepoca.globo.com/Revista/Epoca/0,,EDG51460-6009...</a>",1402545987
7881762,comment,7878679,7880695,2,0,blahber,,,"/sad<p>I think multimedia computing, as introduced by Amiga did more for AI, speaking in terms of games, than the Lisp Machines. I do think the jack of all trades approach is useful for sharing data across computers and professions.<p>It&#x27;s sad to see the demise of the professional multimedia computer to tablets and tablet-laptops.",1402545961
7881761,story,,,2,0,priteshjain,"2.3.0 Released | RubyGems.org",http://blog.rubygems.org/2014/06/10/2.3.0-released.html,,1402545919
7881760,comment,7878417,7879812,1,0,nemothekid,,,"Are you from the UK? I feel you may have a higher standard of taxi drivers that is far above expectations that you would expect stateside.<p>If I wasn&#x27;t comfortable letting my daughter ride an uber, I sure as hell wouldn&#x27;t be comfortable letting my daughter ride a taxi. Thus far, Uber has consistently provided a far better and comfortable ride than a standard taxi. If regulation hasn&#x27;t prevented taxi drivers that have, in my experience talked on the phone while driving, lied to me and said they don&#x27;t accept credit cards, or are just plain hard to flag down. From my, single POV, Uber drivers are that much better and the belief that regulation has 1.) created an acceptable minimum taxi service (it hasn&#x27;t) 2.) will ensure Uber has a high quality (it already does) is one I can&#x27;t fully swallow.<p>Uber already does a great job of vetting their drivers (I&#x27;ve heard drivers who receive even a few bad ratings are sacked) and honestly if the service was so dangerous it wouldn&#x27;t be such a sought after alternatives to Taxis.",1402545907
7881759,comment,7881171,7881706,2,0,timr,,,"If you&#x27;re in a company that&#x27;s series B+, a $180M liquidation event is a fail, and you shouldn&#x27;t expect to make anything.<p>I&#x27;m not counting angel rounds as a series A here. I&#x27;m talking about the big rounds that are invested to scale the business of an already-successful product.  Companies that take these kinds of rounds can still fail, but the rate is nowhere near the same as for an early stage startup.  And there&#x27;s still upside in it for the employees: if you get .01% at a $100M series B valuation, and the company eventually IPOs for $1B, you&#x27;ve walked away with a grant worth $100,000.<p>We&#x27;re only a factor of ~4 apart -- make that .02% and a $2B exit (or .01% at 50M for a $2B exit, or...), and you&#x27;re basically there.  And we haven&#x27;t even talked about raises and/or retention grants, yet. So perhaps &quot;certainly&quot; was a strong choice of words, but it isn&#x27;t totally ridiculous, either.  Being a later stage employee at a hot company is a pretty good deal.",1402545867
7881758,comment,7881653,7881723,2,0,bhouston,,,"There should be a general backup NPM service somewhere though.  Just like there are with Linux distro package systems.  Maybe it could be a few hours behind in terms of replication, but generally that is good enough for nearly everyone.",1402545843
7881756,comment,7879756,7880736,2,0,soapdog,,,"Firefox OS has 22 carriers and 5 manufacturers last time I counted: LG, Alcatel, ZTE, Huawei, Geeksphone, Spreadtrum and Sony said it was working on a device but no one saw it...<p>The carriers include: Telefonica, DT, Telenor and more...<p>This is not a fly-by-night project, it has already launched in 14 countries.",1402545795
7881755,comment,7880379,7880719,1,0,zaqokm,,,"Who says it is broken ? Most of all what is actually broken ?<p>We know the outcome, there are fewer woman in IT. However the problem is normally touted in 2 ways .... the first that woman are discriminated against .... and the second that woman need to be more active.<p>I think the author&#x27;s approach is a great one, ignore the diatribe and get in there and do. If woman are being treated as second class then doing shows that it is a wrong opinion, if woman are less active then having them do is also solving the issue.<p>However if the issue is caused by factors such as a lack of interest in the industry by women, or the lack of study in the field by woman, then how are going to &quot;fix&quot; it, force women into tech ?<p>There are many industries where woman are a majority, should we &quot;fix&quot; these industries also ? Maybe all these tech savvy people who are focused on the tech industry can come up with some sort of algorithm to &quot;fix&quot; all of this issues.",1402545768
7881754,comment,7879950,7881656,5,0,nkoren,,,"That &quot;fortress&quot; was actually a small mission, built in 1697, which served as the capital of Spanish California for a while. It&#x27;s still there; I visited many years ago.<p><a href=""http://en.wikipedia.org/wiki/Misi%C3%B3n_Nuestra_Se%C3%B1ora_de_Loreto"" rel=""nofollow"">http://en.wikipedia.org/wiki/Misi%C3%B3n_Nuestra_Se%C3%B1ora...</a><p>The modern town itself left a modest but pleasant impression. The nearby beaches, however, are positively epic!",1402545755
7881753,comment,7880676,7880676,1,0,breadbox,,,"There is no doubt in my mind that the &quot;milkshake&quot; one is the most sticky, and once it caught on people would definitely remember it, which is really what you need to make an icon become universal. Getting it to catch on in the first place ... that&#x27;s probably not going to happen.",1402545718
7881752,comment,7879756,7880988,3,0,soapdog,,,"nor is mozilla selling anything... mozilla is a global community dedicated to the betterment of the web. We don&#x27;t have shareholders, we&#x27;re only accountable to you, the normal web user that we&#x27;d like to help and protect ;-)<p>Cue: Google for &quot;Mozilla is my dinossaur&quot;",1402545667
7881751,comment,7879942,7880863,4,0,A_COMPUTER,,,"If only it were even just the apps. Check out this blog post by the Tor project and look at what it takes simply securing the OS:<p><a href=""https://blog.torproject.org/blog/mission-impossible-hardening-android-security-and-privacy"" rel=""nofollow"">https://blog.torproject.org/blog/mission-impossible-hardenin...</a><p>Of particular interest to me was how the captive portal detection reports back to Google everywhere you connect even if everything else is disabled.",1402545655
7881750,comment,7881266,7881493,1,0,antonwinter,,,"lol iOS rebelling against its maker.  apple.guru",1402545625
