ID,Type,Story,Parent,Points,Comments,Author,Title,URL,Content,Created
2710900,comment,2710660,2710846,1,0,h34t,,,"Indeed, solo founder here :).<p>Good points re: settings UI. Will fix shortly.<p>Hmm will think about the New Overlap flow. I wanted there to be more space than the search field allows, and also to make sure people review the options available.<p>Originally I had a single text box that would automatically find/create an overlap for whatever you typed in... but I want people to review existing overlaps first. If a similar overlap is already popular it would make sense to join that one.",1309376388
2710899,comment,2709811,2709811,2,0,lkrubner,,,"This is my current apartment:<p><a href=""http://www.flickr.com/photos/squidiculous/sets/72157625985445247/"" rel=""nofollow"">http://www.flickr.com/photos/squidiculous/sets/7215762598544...</a><p>It does not look that nice right now. Those photos were taken by the previous tenant, who was an artist and put some time into the place. Still, I love this apartment. I pay $1,600 a month for it. I'm in Brooklyn (16 Waverly Ave, right by the old Naval Yards, about 12 blocks outside of Dumbo).<p>I agree with the person who said the main cost savings in New York is that you do not need a car. I get everywhere with my bicycle. When it is raining, I take the MTA. The unlimited MTA is about $100 a month, which is slightly more than $3 a day for unlimited travel by subway and bus. Not a bad deal.",1309376368
2710898,story,,,1,0,janeeta,"Best Android Keyboards",http://www.netshet.org/find-the-right-android-keyboard-for-you/,,1309376358
2710897,comment,2708758,2710557,1,0,r00fus,,,"You mean no google replacement translation API?  What about bing or mygengo or wordlingo?",1309376341
2710896,comment,2709737,2709872,1,0,hoprocker,,,"Don't worry -- remember how craigslist used to only be for SF? You start your project static, then develop towards dynamicism. We'll be playing Fourcraft in Paris, Tokyo, and Buenos Aires, and they may even get enough of a playerbase to <i>really</i> take it international (Africa has control of Minnesota!).",1309376320
2710895,story,,,1,0,e1ven,"Old Spice Ad agency launches Portland-based YC-style microincubator. ",,,1309376303
2710894,story,,,8,0,drhodes,"Fed raises debit card fee cap to 21 cents from 12",http://www.bloomberg.com/news/2011-06-29/visa-mastercard-gain-as-fed-raises-debit-card-fee-cap-to-21-cents-from-12.html,,1309376302
2710893,story,,,4,0,j_baker,"The Web Is Full Of Links Waiting To Happen, Apture HotSpots Makes Them Happen",http://techcrunch.com/2011/06/29/apture-hotspots/,,1309376301
2710892,comment,2710659,2710659,-4,0,pittsburgh,,,"One of my pet peeves is when people say that they have a MySpace instead of saying they have a MySpace account.<p>I wonder how many of those people will hear that somebody sold MySpace for $35 million and get excited thinking they're about to become rich by selling their MySpace too! :-)",1309376293
2710891,comment,2709635,2709898,1,0,naqabas,,,"Exactly. Just like this company called Beluga - <a href=""http://belugapods.com/"" rel=""nofollow"">http://belugapods.com/</a>. They use 'pods' instead of circles.",1309376279
2710890,comment,2710346,2710346,2,0,jggube,,,">> ""Its our job to help translate their vision to the development team in a way that they can understand and accept.""<p>>> ""Similarly, we need to speak on behalf the developers to help reign in the designers, at times. If they are coming up with concepts that will be extremely difficult or time consuming to implement, we can explain the limitations of the technology and the complexity involved in implementing their designs""<p>I dislike this stereotype that developers can't communicate and work side-by-side with designers, and vice versa. It seems the writer thinks developers can't communicate or speak and need someone to translate for them, like they're a machine. It's quite disparaging, actually.<p>I also see a danger in having a middleman, so to speak. Things can get lost in translation.",1309376267
2710889,story,,,1,0,JustOutsourcing,"Amazon May Terminate California Associates",http://www.justoutsourcing.com/wp/2011/06/amazon-may-terminate-california-associates/,,1309376265
2710888,comment,2710521,2710810,2,0,jerf,,,"Rebrand it, sell it as ""retro"", deal with the fact you won't be Facebook. Lately the nostalgia lifecycle seems to be measured in months, so I'm actually half serious here.",1309376253
2710887,comment,2710390,2710770,3,0,slug,,,"They were plugged into mains power, as the first page says:<p>""For all testing, the Watts Up Pro power meter was used(...) as the power meter was attached to each system's power supply.""<p>That meter measures AC power, which means that for laptop use, as you say, the tests are meaningless.",1309376209
2710886,comment,2710235,2710569,1,0,cma,,,"Fork doesn't work for much in python; for example if you want to create a bunch of data and then fork a bunch of processes to calculate stuff using the data (say the data is a bunch of word count indexes or something), you can't even read the data from the python processes without triggering copy-on-write.  This is because all these little reference counts are scattered throughout the data and they get changed just by reading.",1309376206
2710885,comment,2710521,2710758,2,0,NoPiece,,,"You are right, looking around some more, it looks like $1 billion was never reached. News Corp didn't break MySpace financials out, so all I can find some quotes from News Corp earnings calls. Looks like 2008 numbers were in the ~$200 million range per quarter, ""FIM/MySpace: $225M, up 23% y/y, up consecutively from $210M in Q3, but still not as high as $233M in Q2.""<p><a href=""http://www.techfeed24.com/2008/08/05/news-corp-q4-tv-terrible-as-promised-myspace-revenues-up-profits-down-nws/"" rel=""nofollow"">http://www.techfeed24.com/2008/08/05/news-corp-q4-tv-terribl...</a>",1309376192
2710884,comment,2709720,2710612,1,0,bugsy,,,"That's a very interesting post. The problem is that in such extreme cases as North Korea, if the government is setting up this discussion list or has any access to it there is no possibility that the conversation was really anonymous. If the government doesn't have access, then mere silent participation without informing would be considered treason. Even if there was anonymous speech going on, Jung merely needs to approach each participant one by one and have them identify which statements were theirs. By a process of elimination, you find who the dissidents are, even if they refuse to talk.",1309376185
2710883,comment,2709769,2710773,1,0,chrisjsmith,,,"Thank you for articulating my point better than me.",1309376182
2710882,comment,2709769,2709769,1,0,PilateDeGuerre,,,"Local food or less meat is a false dichotomy, for one.  What is really important is an understanding that personal consumption choices are no substitute for political change and that political change does not necessarily, and often does not, follow personal change.<p>Derrick Jensen has written extensively on this issue, and has a fantastic and short essay, ""Forget Shorter Showers"" [1].  It could easily have been called ""Forget Local Food or Less Meat"".<p>[1] <a href=""http://www.orionmagazine.org/index.php/articles/article/4801/"" rel=""nofollow"">http://www.orionmagazine.org/index.php/articles/article/4801...</a>",1309376155
2710881,comment,2710874,2710874,1,0,benologist,,,"Aren't they like 6 months old?  That's a pretty incredible path to public.",1309376134
2710880,comment,2710623,2710623,16,0,nostromo,,,"We were expecting this and were already preparing to relocate out of California.  Since our team is largely virtual, switching to Washington as our primary place of business is very easy -- just a few documents and a new address.  California in no way benefits from this -- in fact I think they just did Seattle and other tech communities a big favor.",1309376126
2710879,comment,2709163,2710800,1,0,phpnode,,,"No, I've been mulling this over for a few months, yesterday we just decided to build a site and launch. I did see your post though, how are you getting on?",1309376110
2710878,comment,2710390,2710657,1,0,chrisjsmith,,,"No the problem is that ACPI is a poor piece of design to abstract what is effectively a stinking great turd of an architecture.<p>You just simply don't get these problems on non-x86 systems.  (I speak from experience with MIPS, ARM and SPARC btw).",1309376049
2710877,comment,2710390,2710852,5,0,aristidb,,,"Did you mean ""de facto"" when you wrote ""de jure"", and vice versa? Windows is the de facto standard, and ACPI is the de jure standard; you wrote the opposite.",1309376047
2710876,comment,2709737,2710859,2,0,gavingmiller,,,"IIRC the developers do .NET for their day jobs, and Canada (where they're from) doesn't have the same Android penetration as the USA. But I agree, bizarre choice.",1309376038
2710874,story,,,3,1,ssclafani,"LivingSocial Is Talking To Bankers About Going Public At A $15 Billion Valuation",http://www.businessinsider.com/livingsocial-is-talking-to-bankers-about-going-public-at-a-15-billion-valuation-2011-6?op=1,,1309376028
2710873,comment,2710660,2710811,6,0,Shenglong,,,"If this works out as you expect, I'll definitely be looking forward to it. Your problem identification is spot on, even if we have different thoughts on the solution!",1309376024
2710872,story,,,1,0,selfloathingr,"Nothing to do with Google but funny about Russians",http://www.russiansanonymous.com/hunting-for-russians/,,1309376023
2710871,comment,2709720,2710673,7,0,bugsy,,,"Thanks for the response. I'll mostly skip the first three paragraphs of use of anonymity that is good, but I will say it is a bit weird that version control advocacy required anonymity. If there is fear of reprisal from something that most normal developers reasonably advocate for, then there is a culture of fear present, which is nearly always based on past experiences of punishment. Something to look into and perhaps fix there.<p>The last paragraph is where you give an example of bad use of anonymity. You state a situation where someone says X sucks, and it is known that X does suck. This you say is harmful use. But it is not harmful. The person says X sucks, and X does suck. Since you know that X sucks, you yourself and others must know why it sucks. Saying it is not only wrong but <i>harmful</i> to <i>state what is obvious and known</i> at your firm is yet another indication that you have a corporate environment of fear and reprisals. Obviously someone doing ""harm"" should be gotten rid of, therefore, accepting your assertion it is harm, the person should be eliminated. Not considered though is that the person is obviously NOT doing harm and that stating so is unfounded propaganda to squash an unpopular statement of truth.",1309376003
2710870,story,,,1,0,linkedsin,"Wall street and linkedin",,"A prominent CT Hedge fund is going to publish a survey of 3000 diverse linkedin users interviewed about usage that will greatly damage the premise of the ipo.IOW,no one actually uses it and it more resembles a chain letter than a growing business. Are any hackers in possession of logs from linkedin that prove the same?",1309375984
2710869,comment,2710296,2710296,17,0,raganwald,,,"In one paragraph, the author lauds the fact that Google+ will send email to people who aren't on it, effectively spam for your friends: <i>G+'s email notification handling is particularly elegant. It gives you the choiceon by defaultto let your friends who aren't on yet know there's something going on.</i><p>In another paragraph, the author lauds how Google+ doesn't clutter your mail inbox: <i>Don't mess with the Gmail inbox. When Buzz invaded my Gmail inbox with a flood of social-networky conversations, my first instinct was ""Turn it off!""</i><p>I guess the message is that if you sign up, Google+ won't annoy <i>you</i>, but it will give you the tools to annoy your friends so their product can be ""viral.""",1309375977
2710868,comment,2710853,2710853,3,0,rishi,,,"Are they doing this for tax reasons?",1309375975
2710867,comment,2709723,2709723,3,0,tomkarlo,,,"One thing they don't talk about if you're buying customers: the delay between paying for customers and getting paid by them can run you out of business even if your LTV exceeds your Customer Acquisition Costs. (Conversely, if you can get paid by your customers before you have to pay for them, you're golden.) Note that I mean actual cash in hand, not transactions - you have to include the inevitable delays from whatever payment system you're using. I wrote a bit about this a while back on my blog: <a href=""http://www.karlo.org/2009/04/maximizing-your-online-business-part-three-user-acquisition.html"" rel=""nofollow"">http://www.karlo.org/2009/04/maximizing-your-online-business...</a>",1309375975
2710866,comment,2707380,2708881,1,0,huhtenberg,,,"FontSpring uses auto-hinting [1], which is a well-known approach and it <i>is</i> a step forward. It still though vastly inferior to manual hinting and tends to produce artifacts of other kinds. Also there appears to be no ClearType-specific version of it at the moment.<p>[1] <a href=""http://www.fontspring.com/fontface"" rel=""nofollow"">http://www.fontspring.com/fontface</a> - first table, 3rd row down",1309375933
2710865,comment,2709293,2709777,1,0,wazoox,,,"It was about 2 months ago I'd say. Well, maybe it was a bad day for the service....",1309375916
2710864,comment,2710296,2710296,10,0,xster,,,"Google Profiles is not available for your organization.
nuff said",1309375912
2710863,comment,2710346,2710789,1,0,rimantas,,,"I've done hundreds of CSS layouts and never ever used a clear div.
And even if one is used it is not usually visible, so UX Designer has nothing to do with it.",1309375902
2710862,comment,2709769,2710630,4,0,chrisjsmith,,,"It's all down to climate science being more akin to religion that science.<p>Science is based on building a hypothesis, building a supporting model that produces a reliable theory, then wrinse and repeat.<p>Climate science is based on building a hypothesis, marketing it, claiming that a theory is going to kill us all, fucking up the numbers when asked to prove it and then sticking your fingers in your ears and ridiculing your peers when a competing hypothesis appears.<p>There are models for the weather systems on this planet.  They simply don't work.  We can't predict the weather very well and never have been able to.  That is the same for just about everything that climate science has come up with.  Back in the 70s and 80s we were facing an ice age.  Now it's back to global warming.<p>We just don't understand why the planet works like it does.  We like to pretend we do and make a big kerfaffle about how advanced we are as a species and how we can control our fate, yet it's a thing much larger than the lifespan of the entire human race and it has no respect for us.<p>I don't believe in god - why would I?  It's not observable.  Atoms, internal combusion engines and evolution are all observable and we have models which are <i>recreatable</i>.",1309375892
2710861,comment,2710296,2710832,3,0,murz,,,"> Perhaps allowing them to interact with Facebook<p>There's no way facebook would play along with that.",1309375888
2710860,comment,2710632,2710632,1,0,lifto,,,sweetness,1309375862
2710859,comment,2709737,2710714,3,0,Goronmon,,,"Huh, no Android but Windows Phone and iPhone support. That's the first time I've seen that combo.",1309375828
2710858,comment,2710296,2710818,5,0,ugh,,,"Im not disagreeing with your assessment of the grandparents comment but the argument you are making isnt much of an argument.<p>What does embracing free mean? Does it mean anything? It sounds like meaningless drivel.",1309375799
2710857,comment,2709769,2710630,5,0,randallsquared,,,"I think for skeptics of anthropogenic warming, the main problem is that proponents appear to be  interested in politics as much as or more than in science.  This just isn't the case for internal combustion, black holes, or even evolution.<p>Also, it's easy to fully agree that warming has been happening (over hundreds of years, at least), and still be skeptical that humans are driving the change, what with the Medieval Warm, the Little Ice Age, etc.",1309375789
2710856,comment,2710836,2710836,2,0,benologist,,,"Quantcast you can just embed their beacon to be directly measured, the rest I think you're SOL <i>but</i> you can just rely on Quantcast - ""We use their tracker so their measurements are accurate"".",1309375784
2710855,comment,2710521,2710722,4,0,ebiester,,,"Even a year ago, I'd agree with you. However, Soundcloud and others have really eaten into Myspace's indie music positioning. news corp could have merged Myspace with their other entertainment offerings. Every show of theirs would have a myspace page, and the visual editing operations become more corporate-friendly. Monetize by offering advanced analytics and moderation capabilities to make it another public presence for your entertainment property, from the independent band to The Simpsons.<p>Provide a host of consultants to get the most from your social media.<p>It could be done still, but News Corp would have provided a bigger appeal.",1309375775
2710854,comment,2710659,2710659,5,0,trotsky,,,"So much for the $200MM they were trying to pass it off for less than five months ago. [1]<p>I don't know their numbers, but doesn't it seem likely that 35 is less than 1x revenue?<p>[1] <a href=""http://www.bloomberg.com/news/2011-02-04/news-corp-may-get-200-million-for-sale-of-myspace-mocospace-ceo-says.html"" rel=""nofollow"">http://www.bloomberg.com/news/2011-02-04/news-corp-may-get-2...</a>",1309375769
2710853,story,,,128,161,richcollins,"Amazon will end affiliate program in California if new law passes",http://www.boingboing.net/2011/06/29/amazon-kills-associa.html,,1309375762
2710852,comment,2710390,2710657,2,0,eropple,,,"That's a problem of a failure to code to what is, not to what one thinks it should be.<p>As I've said before when this comes up--Windows is, for better or for worse, the <i>de facto</i> standard. Alternative operating systems (and Linux is very, very alternative, in this sort of use scenario) that don't recognize and acknowledge the <i>de facto</i> standard's effective supplanting of the <i>de jure</i> standard are Doing It Wrong.<p>edit: Swapped my <i>jure</i>s and <i>facto</i>es. Shouldn't post while writing code...",1309375748
2710851,story,,,19,1,jfong,"Amazon: Notice of Contract Termination Due to Potential New California Law",,"Hello,<p>For well over a decade, the Amazon Associates Program has worked with thousands of California residents. Unfortunately, a potential new law that may be signed by Governor Brown compels us to terminate this program for California-based participants. It specifically imposes the collection of taxes from consumers on sales by online retailers - including but not limited to those referred by California-based marketing affiliates like you - even if those retailers have no physical presence in the state.<p>We oppose this bill because it is unconstitutional and counterproductive. It is supported by big-box retailers, most of which are based outside California, that seek to harm the affiliate advertising programs of their competitors. Similar legislation in other states has led to job and income losses, and little, if any, new tax revenue. We deeply regret that we must take this action.<p>As a result, we will terminate contracts with all California residents that are participants in the Amazon Associates Program as of the date (if any) that the California law becomes effective. We will send a follow-up notice to you confirming the termination date if the California law is enacted. In the event that the California law does not become effective before September 30, 2011, we withdraw this notice. As of the termination date, California residents will no longer receive advertising fees for sales referred to Amazon.com, Endless.com, MYHABIT.COM or SmallParts.com. Please be assured that all qualifying advertising fees earned on or before the termination date will be processed and paid in full in accordance with the regular payment schedule.<p>You are receiving this email because our records indicate that you are a resident of California. If you are not currently a resident of California, or if you are relocating to another state in the near future, you can manage the details of your Associates account here. And if you relocate to another state in the near future please contact us for reinstatement into the Amazon Associates Program.<p>To avoid confusion, we would like to clarify that this development will only impact our ability to offer the Associates Program to California residents and will not affect their ability to purchase from Amazon.com, Endless.com, MYHABIT.COM or SmallParts.com.<p>We have enjoyed working with you and other California-based participants in the Amazon Associates Program and, if this situation is rectified, would very much welcome the opportunity to re-open our Associates Program to California residents. We are also working on alternative ways to help California residents monetize their websites and we will be sure to contact you when these become available.<p>Regards,<p>The Amazon Associates Team",1309375744
2710850,story,,,15,2,bchjam,"Why Biz Stone Really Left Twitter",http://www.fastcompany.com/1763873/why-biz-stone-really-left-twitter,,1309375730
2710849,comment,2710296,2710736,4,0,Hostile,,,"Can you elaborate on where you heard this?<p>I've seen it implied that no invites are planned until after the ""field test"", and who knows how long that period might be.",1309375716
2710848,comment,2710296,2710732,0,0,uast23,,,"Isn't it already well past its DOA phase! I think DOA is too big a word to be used for a product which has already kept the entire tech community waiting for months - <a href=""http://www.readwriteweb.com/archives/google_to_launch_major_new_social_network_called_c.php"" rel=""nofollow"">http://www.readwriteweb.com/archives/google_to_launch_major_...</a>",1309375674
2710847,story,,,2,0,alphadoggs,"The math of the Rubiks cube",http://web.mit.edu/newsoffice/2011/rubiks-cube-0629.html,,1309375644
2710846,comment,2710660,2710660,1,0,tdoggette,,,"Are you the founder? (If you are, we have 11 things in common!) This is a really neat idea, and the post does a good job explaining it. I just signed up and I'm playing around.<p>A brief note: the ""Show me [Safe for all ages|Moderate\Unsure|Restricted] overlaps"" is awkwardly phrased-- if I select Restricted, is the site gonna be all sex, all the time, or will I still get the unrestricted overlaps?<p>Also in that little settings pane, having to click OK after selecting from a dropdown is annoying-- I expect it to work like other dropdowns, where it stays like I left it if I click somewhere else.<p>I like that after searching for an overlap and not finding it, I can click ""New Overlap"" and it auto-populates, but does that need to be a separate text field? The transition feels a little awkward, and it needs to be very smooth to encourage people to create new overlaps.<p>I'm still playing with it, but I think it's a very neat concept that could get big.<p>EDIT: Okay, if I ""Me Too"" and overlap, I get to see who else did too, over on the right, but it's still one more click to open up our overlaps, a scan through the list, some typing, and another click before I can send them a message about how we both like Nutella. What if there were a message button by each person that I could use right after I ""Me Too"" something to talk to them about it?<p>Sorry if this is disorganized and long, I'm just adding as I go through the site.",1309375631
2710845,comment,2710659,2710659,5,0,heyrhett,,,"How do I get ""Tom"" in my google+ circle?",1309375628
2710844,comment,2709834,2710738,13,0,arethuza,,,"BT Infinity (40Mbps down, 10 up) is 18 a month with a 40GB cap and 25.60 for unlimited.",1309375611
2710843,comment,2708361,2710419,2,0,georgieporgie,,,"<i>There's a good reason I said ""simply""</i><p>Uh...<p><i>you can easily get 10-20% above the EPA highway rating</i>",1309375609
2710842,story,,,4,0,bretthopper,"IE10 Platform Preview 2 is Out with More HTML5 and CSS3 Goodness",http://blogs.msdn.com/b/scriptjunkie/archive/2011/06/29/ie10-platform-preview-is-out-with-more-html5-and-css3-goodness.aspx,,1309375604
2710841,comment,2709870,2709870,20,0,dfischer,,,"Myspace is sold and friendster relaunches? We're not in a bubble, we're in a circle!",1309375582
2710840,comment,2710790,2710790,1,0,trevin,,,"I've found clear calls to action that lead users to a custom landing page on your site work. The key is to tailor everything to the FB experience, design of the landing page on your site included.",1309375582
2710839,comment,2709834,2709834,2,0,absconditus,,,"This does not seem like much of an explanation. CLECs have existed in the US for over a decade now. In Chicago many of us have about a dozen options. None of them are very competitive with EU providers when it comes to price. A few are probably comparable when it comes to speed.<p>I have noticed that even when there is competition most people will stick with Comcast or AT&T and bitch about it.<p><a href=""http://en.wikipedia.org/wiki/Competitive_local_exchange_carrier"" rel=""nofollow"">http://en.wikipedia.org/wiki/Competitive_local_exchange_carr...</a>",1309375559
2710838,story,,,42,23,padrack,"50 Million Myspace Profiles Now Belong to an Ad Targeting Firm",http://www.betabeat.com/2011/06/29/myspace-sold-ad-targeting-specific-media/,,1309375540
2710837,comment,2710623,2710813,1,0,kposehn,,,"Yeah, the affiliate termination notifications are already rolling in today. Got a bunch already.",1309375537
