ID,Type,Story,Parent,Points,Comments,Author,Title,URL,Content,Created
2710836,story,,,1,2,thewordpainter,"Ask HN: How to correct incorrect reporting from traffic counters?",,"I imagine a lot of lurkers (myself included) tend to use compete, quantcast & alexa for tracking other sites. When it comes to your personal site not being reporting correctly, have you ever tried to correct any holes in their data? We're offering  to send them private info on our growth at http://gorankem.com , but compete says they have their own methodology for computing (??)<p>I'd hate to hear that prospective investors or the like are going off of those charts when their samples are often not fully accurate.<p>Anybody had issues in the past? Gotten them resolved?",1309375532
2710835,story,,,1,0,bwb,"My New Startup: FTP API For keeping scripts updated, backups, security etc",http://www.webpub.com/,"Looking for some feedback and so on! We built an api for FTP and then on top of that have built a tool that keeps WordPress and eventually other scripts fully up to date. And we are adding features so that people can install themes with the click of a button, customized install packages, backups, security monitoring and a lot more!<p>Looking for feedback etc!",1309375491
2710834,story,,,4,0,apievangelist,"Apigee Delivers API PCI-DSS Compliance",http://blog.apievangelist.com/2011/06/29/apigee-delivers-on-api-pci-dss-compliance/,,1309375486
2710833,story,,,9,1,adityakothadiya,"Tell HN: Amazon terminates Associate program in California",,"Just received this email from Amazon -<p>""For well over a decade, the Amazon Associates Program has worked with thousands of California residents. Unfortunately, a potential new law that may be signed by Governor Brown compels us to terminate this program for California-based participants. It specifically imposes the collection of taxes from consumers on sales by online retailers - including but not limited to those referred by California-based marketing affiliates like you - even if those retailers have no physical presence in the state.<p>We oppose this bill because it is unconstitutional and counterproductive. It is supported by big-box retailers, most of which are based outside California, that seek to harm the affiliate advertising programs of their competitors. Similar legislation in other states has led to job and income losses, and little, if any, new tax revenue. We deeply regret that we must take this action.<p>As a result, we will terminate contracts with all California residents that are participants in the Amazon Associates Program as of the date (if any) that the California law becomes effective. We will send a follow-up notice to you confirming the termination date if the California law is enacted. In the event that the California law does not become effective before September 30, 2011, we withdraw this notice. As of the termination date, California residents will no longer receive advertising fees for sales referred to Amazon.com, Endless.com, MYHABIT.COM or SmallParts.com. Please be assured that all qualifying advertising fees earned on or before the termination date will be processed and paid in full in accordance with the regular payment schedule.""",1309375484
2710832,comment,2710296,2710732,15,0,bdhe,,,"<i>People will stop caring before anyone gets a chance to use it.</i><p>This point is brought up often, but I thought it worth reiterating here. One of the biggest differences between GMail and Wave was that even though GMail ended up being released (very) slowly to the public, you could interact with other email users without them needing to get on to GMail.<p>Unfortunately the same is <i>not</i> true with their current offering of Google+. I wonder if there is anyway for them to balance ""extensive testing, and careful releases"" with ""getting a quorum so that the early adopters find it useful"". Perhaps allowing them to interact with Facebook so that they can still interact with their friends from Google+ without needing everyone on it (along the lines of GMail).",1309375457
2710831,story,,,6,0,craigkerstiens,"Interview with Brad Feld",http://blog.shelfluv.com/2011/06/interview-brad-feld/,,1309375456
2710830,comment,2710769,2710769,1,0,ilkhd2,,,"Yes. Everybody knows everything about somebody else.
And privacy does not matter.",1309375444
2710829,comment,2710535,2710535,2,0,spydum,,,"Seemed more like a plug for opposition of America Invents Act than some new wireless tech to me..<p>Not to say they haven't made some astounding break-through, but I didn't get the impression that they revealed anything of substance. They claim to have some experimental radios working that are able to beat Shannon's law, but reveal no details around it.",1309375442
2710828,comment,2709720,2710464,3,0,dbs11,,,"Thanks for the interest, all good points.<p>Even in smaller groups though, people may be able to consciously subvert their mannerisms and still get their point across. Not saying it will be easy, but I wouldn't rule it out.<p>I agree with the plausible deniability point, but i think it can theoretically apply equally to small (and by small i mean at least 10 ppl) and large groups alike. There are many ideas that are not too controversial, but just touchy enough that plausible deniability would be sufficient to overcome the anxiety barrier. This would only work for comments that a user would have no problem being suspected of saying, as long as noone could categorically prove it.",1309375409
2710827,comment,2707221,2709350,1,0,glhaynes,,,"Your point is excellent; it's a shame you had to spoil it with all the personal stuff.",1309375389
2710826,comment,2710346,2710346,4,0,dfischer,,,"This is what I am, and I call this a front-end developer. UX traits are needed.",1309375376
2710825,comment,2708361,2708846,1,0,ChuckMcM,,,"Absolutely, the electricity -> chemical -> electricity cycle gets less power out than you put in.<p>The fuel cycle is still 
fossil fuel -> (stuffs) -> car moves.<p>There are many ways to change around the (stuffs) part of the equation. The claim is that converting fossil fuel to electricity in bulk is much more efficient than converting it into mechanical work locally through exothermic chemical reactions.<p>We could keep trying to detail efficiencies (or non-efficiencies) in the problem but as Glieck pointed out in his Chaos book, you can compute the length of the British coastline by drawing a line around the island and get one number, or you can zoom in and include the bays and harbors and protrusions and get another number, all the way to going around each grain of sand on the beach and getting yet another number. Clearly the closer you look at the coastline length the 'longer' it gets, but that extra length is misleading.",1309375375
2710824,comment,2709635,2710367,2,0,sciurus,,,"<a href=""http://www.frontmotion.com/Firefox/"" rel=""nofollow"">http://www.frontmotion.com/Firefox/</a><p>They also provide a patched version of Firefox that supports management via Group Policy and a tool that lets you generate a MSI of firefox bundled with extensions.",1309375370
2710823,comment,2710535,2710535,18,0,aphyr,,,"""They don't use wireless energy.""<p>Please tell me more about your magical energy-free signal propagation!<p>In all seriousness, Shannon's entropy limit only applies to a single variable, modulated at a certain frequency. The only reason we apply this limit to radio is because we treat each radio frequency in a given zone as a single variable. In fact, you're perfectly free to use directed antennas or interferometry to establish multiple communication variables on the same frequency.<p>Ah, and indeed, at 1:19, Perlman mentions each cell phone on a separate spatial domain.<p>Since they say it's a single cell phone antenna, I'm guessing we're looking at multiple towers and interferometry between them, possibly taking advantage of the intensity dropoff with distance and timing data for spatial discrimination.",1309375369
2710822,comment,2710659,2710820,26,0,pavel_lishin,,,"""Those employees who will be let go will be notified by being defriended by the Tom account.""",1309375356
2710821,comment,2709834,2710715,9,0,bobo888,,,"Well, back then we didn't see it as a business. Of course there were also people who knew what they were doing, but if I remember well, my network started with three teenagers wanting to play Quake and Need for Speed. Then more and more people joined... hundreds of them.<p>Internet access wasn't  a priority (most users wanted it for IRC, and there were very few local websites/services anyway). As long as we could share movies and play games, everything was fine.<p>Today things changed. I think that most users want 100 mbps internet access instead of 10 mbps internet + 1000 mbps LAN. But I'm confident that, if the ISPs fail, people could build their own networks as long as the State doesn't interfere.<p>The problem with US seems to be that the Government is bullying (through all kinds of regulation) small ISPs in order to protect the big guys.<p>---------- EDIT: 
I have to admit that (in 2003 or so) it felt good when a big telco, with a budget of millions, could barely provide 128 kbps, while the small ISP which I joined was providing 512 kbps internet access + 100 mbps LAN. 
Today I'm a subscriber of that big telco, because they managed to pull their stuff together and now provide a really good service (at least in my area). 
But Gov regulation had noting to do with it. It was the competition: improve your service or die. Plain and simple.",1309375326
2710820,comment,2710659,2710659,4,0,bugsy,,,"> In conjunction with the deal, we are conducting a series of restructuring initiatives, including a significant reduction in our workforce.<p>It actually takes some balls to come out and say that in the first email.",1309375318
2710819,comment,2710346,2710346,5,0,waterflame,,,"So basically what I understood at the end, is that your UX developer role... is fun!? and exiting?!<p>Let me tell you what a UX developer is.
UX developers are people that couldn't find themselves neither as designers or as developers and got stuck in between. Those became so many over the years; people interested not in being perfect at doing one thing, but at being intermediate in everything.
Others are project managers who gained some experience in handling projects, but got bored of all the wire-framing, analysis and actually doing nothing (at least the majority), so they decided to get more involved in projects on a technical/creative level.<p>The first group, the stuck-in-between, become UX designers/developers with a few technical tricks. The second group, the managers, became UX analysts and experts.<p>So, in reality, your job as UX designer/developer, is to make real Designers dumb, by not letting them learn how to create usable designs, but designs that follow your lead and your wire-frames which eventually affect real Designers creativity. Or maybe real Designers are too dumb to learn how to offer the user a good experience!
The UX developers, on the other hand, don't have an actual role. So if you're doing the wire-framing, the analysis, the content management, the information architecture, can you please specify what is a project manager doing?
Plus, if your skills enables you to prototype certain features, what if you're involved in a super complex project, who's gonna prototype now?
I know, the one who actually does the prototyping and is actually a real Programmer that knows his language very well and knows its actual limitations. Not the ones UX developers heard about.<p>The real definition for your job is ripped of from something every human should learn how to do and that's communication.",1309375291
2710818,comment,2710296,2710788,2,0,r00fus,,,"Your hyperbole can be deflated with a single argument.<p>Google embraces ""free"" while both Microsoft and Wal*Mart do not.",1309375282
2710817,story,,,1,0,jfruh,"Why did Biz Stone leave Twitter? 5 (possible) reasons",http://www.itworld.com/software/178733/so-why-biz-stone-leaving-twitter,,1309375281
2710816,comment,2708733,2710283,2,0,__Joker,,,"Hey, Can you explain or point to rational for these assertions ?",1309375231
2710815,comment,2710296,2710788,9,0,sukuriant,,,"Why?<p>If someone produces a good product, and they have generally pleasant business practices (and don't have glaringly bad ones, too), why does it matter if it is a large company or a small one?",1309375222
2710814,comment,2710535,2710535,2,0,dmbass,,,"So are we supposed to believe that incumbent tech companies have no investments in new tech?<p>Canon is not working (or already passed) on the same stuff as Lytro?
Samsung is not working (or already passed) on the same stuff as Nanosys?
Cisco (or whoever) is not working (or already passed) on this type of stuff?<p>Anybody have examples of modern (within 10 years) stealthy startups/incubators that invented new hardware that revolutionized something?",1309375218
2710813,comment,2710623,2710623,8,0,inconditus,,,"Amazon will cancel their Affiliate program for California if this happens, just got this email:<p><a href=""http://pastebin.com/yRLUf0Zg"" rel=""nofollow"">http://pastebin.com/yRLUf0Zg</a>",1309375214
2710812,comment,2709115,2709993,2,0,chopsueyar,,,"I will make the appropriate changes.  We appreciate your feedback.",1309375203
2710811,comment,2710660,2710764,10,0,h34t,,,"Of course, feedback is most welcome.<p>It's not that you need to have a lot in common with someone to get along. The hypothesis of the app is simply that the least-awkward way to <i>begin</i> a conversation <i>is</i> by starting out with the common ground you share. From this warm introduction, it's then easy to move on to other topics.<p>And, the awkwardness I'm trying to overcome is the small kind--how to make the first comment, how to send that first message. I personally find blank message screens intimidating.",1309375197
2710810,comment,2710521,2710722,1,0,dasil003,,,"It has value in it, but I don't know what strategy could turn it around.  Social networking adoption is a lot about fashion, and with the opinion that MySpace is old, tired, ugly and boring having crossed the chasm years ago, it seems a very tough sell to turn that around.",1309375168
2710809,comment,2710296,2710296,2,0,uast23,,,"It's surprising when people find it difficult to understand the importance of email/some kind of notification for the activity on your social profile, but the this cannot be the only reason to be credited with the failure of Wave. I still feel that Wave is a great product and it could not catch up just because it was ahead of its time. And the few admirers could not use it because others were not ready to use it. A lot of new age collaboration tools do the same what Wave did long time ago.",1309375164
2710808,comment,2709811,2710180,5,0,nostromo,,,"Thanks to increasing focus on public transportation and ZipCar, cars aren't just optional in New York anymore.  I've lived in New York, Seattle, and San Francisco with no car.<p>In both Seattle and SF my cost of living was significantly less than it was in New York <i>and</i> my standard of living was much higher.",1309375127
2710807,comment,2709769,2710366,4,0,DougWebb,,,"They're able to provide much more energy as a food source, too. That means we'd have to eat several pounds of veggies to replace the energy we get from one pound of meat. If you're going to compare the cost of growing animals vs veggies, you've got to account for needing more veggies.<p>It's a complex equation because there are a lot of factors that have to come into play to do a fair comparison. It's probably as complex to model, and as sensitive to input-variable selection, as predicting global weather patterns.",1309375121
2710806,comment,2709834,2710134,0,0,hammock,,,"I actually did read the article. I wrote that comment before there were any comments, in anticipation of comments in support of subsidized broadband. It was a risky venture, for sure. Heh",1309375059
2710805,comment,2710235,2710388,1,0,masklinn,,,"> Is it to make currently-unsafe Python code automatically correct? Or is it to keep the GIL semantics, but make it faster?<p>Neither. It's to improve concurrency in the interpreter (there currently is none whatsoever due to the GIL), so that multithreaded software can scale on multiple cores performing Python bytecode execution.<p>Currently, the GIL means the Python interpreter can only execute Python code in a single OS thread at a time (C extensions such as I/O systems can release the GIL). The result is that, even with a number of (OS) threads spawned in the interpreter, you don't get much parallelism benefits. And even if only one thread performs computation and the rest does I/O, there are churning issues with the GIL (I recommend checking David Beazley's research and presentations on the subject[0]).<p>[0] <a href=""http://dabeaz.com/blog.html"" rel=""nofollow"">http://dabeaz.com/blog.html</a> section ""The GIL""",1309375038
2710804,story,,,2,0,mrseb,"IE10 preview 2 released: HTML5 drag-and-drop, web workers, and more",http://www.extremetech.com/internet/88630-internet-explorer-10-preview-2-released-drag-and-drop-web-workers-and-more,,1309375015
2710803,comment,2710296,2710732,3,0,SolarUpNote,,,"Just tried to sign up, and got a ""Server Temporarily Unavailable"" error screen. That was unexpected :P",1309375009
2710802,comment,2706357,2707787,1,0,dkarl,,,"Working out that way is synonymous with Crossfit for most people the same way desktop computing is synonymous with Windows and OSX for most people.  They didn't invent it, but they deserve a lot of credit for making it convenient for people to just sign up for a class and do it.  Most of the people griping about Crossfit getting too much credit weren't doing anything to make it accessible and convenient for people until Crossfit came along and proved there was a market for it.  If I wanted to train that way before Crossfit, I would have had to:  find a suitable place to work out, buy or construct some of the equipment, schedule sessions with a personal trainer to make sure I was doing the exercises correctly, recruit friends to work out with me, and so on.  And there certainly would have been compromises.  Most gyms aren't set up to allow you to do a set of cleans, drop your weights, and then run 400 meters without dodging cars or pedestrians.  (Hell, most don't let you drop weights, period.  As far as I am aware, there are only two commercial gyms in my city that have bumper plates, not including the four (at least) Crossfit locations, and one of them is a specialized Oly training facility that costs more than Crossfit.)  With Crossfit, I just show up, pay attention, work hard, and have fun.  It's a great service.",1309374996
2710801,comment,2707089,2708417,1,0,pittsburgh,,,"Howard Roark (of Ayn Rand's Fountainhead) would hate where Apple is taking their design.<p>From the book:<p>""His buildings are austere, logical, perfect, eacha single thought in stone. He believes that buildings, like men, have souls, and that no part of a building should in any way betray its soul. No building should borrow its parts from others or apologize for its own shape. No building should present a false front.""
<p>And another quote:<p>""The buildings in these drawings are like none ever built on earth. They seem severe and simple at rst glance, but closer observation reveals the strict tension of thought and method, a cold, beautiful logic behind each wall and pillar.Every building seems to have a soul.""<p>I hope Apple turns down the woodgrain knob and cranks up the cold, beautiful, and logical knob in their future designs.",1309374995
2710800,comment,2709163,2709163,1,0,ibdknox,,,"Out of curiosity, was this inspired by my service?<p><a href=""http://iwbyp.chris-granger.com/"" rel=""nofollow"">http://iwbyp.chris-granger.com/</a>",1309374983
2710799,story,,,5,0,jpzeni,"Hacker House: Free Live-in Technology Incubator in Waterloo, Ontario",http://www.hackerhouse.ca,,1309374960
2710798,story,,,1,0,uladzislau,"How Google's Panda Update Changed SEO Best Practices Forever",http://www.seomoz.org/blog/how-googles-panda-update-changed-seo-best-practices-forever-whiteboard-friday,,1309374944
2710797,comment,2710296,2710296,1,0,rubergly,,,"<p><pre><code>  I will love Google+ when and if all my friends show up and 
  stick around.
</code></pre>
Isn't the phrase usually ""if and when""? I wonder if this was switched on purpose.",1309374932
2710796,comment,2709811,2710267,1,0,ebiester,,,"That's not surprising in the southwest, due to transportation costs.",1309374904
2710795,story,,,1,0,rishisab,"Get free and relevant Twitter followers in just 1 minute",http://traffup.net/twitter/,,1309374892
2710794,comment,2708595,2710709,2,0,Confusion,,,"Hmmm, I usually argue this the other way around: if you could be sued for bugs in your software, many software products would probably be better designed, better tested and more usable.",1309374872
2710793,comment,2710535,2710535,12,0,juiceandjuice,,,"Sounds like interferometric based MIMO from the description.  Not breaking Shannon's law in that case.",1309374868
2710792,comment,2710225,2710744,6,0,dazmax,,,"It could also skew the other way. Previously, I would often refrain from voting up a good comment if its score was already ""high enough"", so that my vote on an equally good but lower-rated comment would have relatively more weight.",1309374834
2710791,comment,2710521,2710521,7,0,billpaetzke,,,"Just FYI, we are hiring ex-Myspace developers at Leads360. We've hired four ex-Myspacers in the past six months.  Our technology stack is similar, so the learning curve is only slight. And we have lots of interesting and challenging projects to do.  Located in El Segundo; full-time local only.<p>If you got laid off or are ready to jump ship, then email Bill at bpaetzke@leads360.com.",1309374827
2710790,story,,,2,1,skarayan,"What is the best way to monetize a Facebook page?",http://www.quora.com/What-is-the-best-way-to-monetize-a-Facebook-page,,1309374809
2710789,comment,2710346,2710346,-2,0,snorkel,,,"That's right, it takes skill to make pretty wizzy things that don't scale.<p>UX Designer: Here's the mockup.<p>App dev: Did you notice the page layout falls apart when you resize the browser? You need to add a few float clear divs to fix it.<p>UX Designer: Oh. Uh, how do you do that? Can you fix it?<p>App dev: Yes. Now go away.",1309374789
2710788,comment,2710296,2710296,-4,0,mrschwabe,,,"You know what would be great?  A new social network NOT created by Google. The company is the Wal-Mart of tech; the modern day Microsoft of the internet.  Let's join something created by entrepreneurs, not conglomerates.",1309374785
2710787,comment,2710535,2710775,5,0,chopsueyar,,,"Also, transmitting 30 miles.  Is this an unlicensed frequency?",1309374785
2710786,comment,2708595,2709589,2,0,Confusion,,,"There are may problems for which nobody is to blame. They are emergent phenomena of a system, to which all parts contributed. Assigning blame is not necessary to start solving the problem and attempting to assign blame is counterproductive.",1309374711
2710785,comment,2698026,2698598,1,0,bricestacey,,,"It seems to be a WGBH (Boston area PBS station) documentary from the 80s. All the libraries around here have it (we have two copies), but only on VHS, betamax, or film. It's likely out of print and you're probably best off downloading it online.<p>If you're at a university, you could probably order it through interlibrary loan. There are actually a lot of libraries with this item and it'll likely be loaned (we do international loans all the time).",1309374691
2710784,comment,2708758,2709420,1,0,ljlolel,,,"on my @jperla.com account, I have a working page.  Did you set up a google profile?  I don't know why we have different results.",1309374690
2710783,comment,2710296,2710732,4,0,nextparadigms,,,"I think they need to strike a balance between releasing invites very slowly, and releasing too many at once, making them pointless. But I'm also dying to get one and I can't even from Google employees because they don't have any invites to give right now. So hopefully they'll give the first batch some invites so they can invite everyone else who is eager to join.<p>But they should have at least one more level of private-mode before they go public. They need to make sure the early adopter community is tight first, kind of like Quora did. Imagine what would've happened if Quora went public from like day one. It would've basically killed the product. Or what if everyone knew about HN from day one? Facebook, too, was once only for college students. The early community needs to be very strong before it gets diluted by the masses.<p>The early adopters help shape the product before the ""unwashed masses"" join it, and I think they should give enough time to early adopters to get used to it, get to <i>love</i> it and have enough time to tell everyone how cool it is and how much they love it <i>before</i> they can actually invite everyone else and make it public.",1309374679
2710782,story,,,1,0,alexanderb,"How to start using Git in SVN-based organization",http://www.beletsky.net/2011/06/how-to-start-using-git-in-svn-based.html,,1309374663
2710781,story,,,1,0,akarambir,"Which Countries Have An Internet Kill Switch?",http://www.newtechie.com/2011/06/which-countries-have-internet-kill.html,,1309374612
2710780,comment,2710164,2710164,1,0,Natsu,,,"Part of me wonders if the big name firm was only a PR stunt to generate news and angle for a settlement.  My other theory is that they found out something about their client that made them want out of the case.  There could be other reasons, too, of course, but it makes me wonder.",1309374593
