ID,Type,Story,Parent,Points,Comments,Author,Title,URL,Content,Created
2710779,comment,2709206,2709381,1,0,zrgiu,,,"there is. I've been running android-x86 builds for a while now, without much problems. On some builds the internet connectivity doesn't work, but that seems to happen less and less.",1309374590
2710778,comment,2710521,2710668,3,0,ssharp,,,"Revenues != profits. If you don't know, or even have a decent estimate of, profits, it's hard to really judge the deal. However, I don't think Murdoch went into this deal planning that he'd have a $540 million capital loss in just five or six years.",1309374578
2710777,comment,2710660,2710660,4,0,bkudria,,,"This is actually pretty interesting.",1309374544
2710776,comment,2710346,2710346,38,0,geebee,,,"As a developer, I have to admit that I feel a lot of ambivalence about this emerging discipline.  It's taken a long time to convince the world of the benefits of a ""developer driven culture"", but I think it's critical to avoid putting developers into a box where they are simply executing specs.   I see a lot of that creeping back in through the new concept of a ""UX Developer"".<p>Here are the three big quotes that are making me nervous:<p>""Its our job to help translate their vision to the development team in a way that they can understand and accept""<p>""Similarly, we need to speak on behalf the developers to help reign in the designers, at times.""<p>""However, for the traditional developer the application works if it executes all of the items listed in the functional specs. The focus of the traditional developer is centered on tasks rather than goals.""<p>Oh man.  So the role of a UX developer is to stand in between the developers and designers and represent the interests of each for us?  All the while, assuming that the mindset of a ""traditional"" developer is to be myopically focused on tasks rather than goals?<p>Everything I read about UX as a skill set I like.  Developers and Designers should be focused on goals. We should strive to acquire the skills and mindset that are often associated with ""UX"" (good developers were doing this long before ""UX"" became a term or job category).<p>Everything I read about UX as an actual job role, I don't like.  I can't stand the idea of a worker in my organization deciding that developers are focused on tasks and need someone running interference between them and the users and designers.<p>As I've pointed out in other discussions around UX on HN, one key question is to ask yourself: would this person be useful on a small team?  A developer or designer with lots of ""UX"" skill would be even more useful on a small team.  But the type of person described through this post?  Not really, and could even do harm by mucking up the relationship between developers, designers, and the things that they actually need to be exposed to to write good software.<p>In short, I believe that UX is a great addition to a developer or designer's skill set, but I'm not at all convinced that it would be a great job category.",1309374543
2710775,comment,2710535,2710535,5,0,zwieback,,,"I very much hope I'm wrong but it sounds pretty fishy to me. When the guy in the audience asked the question about what modulation this new radio uses he got a marketing babble answer unworthy of a university audience.<p>Working in sensor networks we could really use one of these breakthrough technologies and in the past year or two I've heard at least three vendors give the exact same pitch but as of today there's no technical detail that gives me much hope.",1309374533
2710774,comment,2709720,2710054,1,0,qq66,,,"Is it an internal tool or an off-the-shelf product? Could you tell me the name? I might be interested in deploying that here.",1309374490
2710773,comment,2709769,2710630,8,0,jquery,,,"Being skeptical of political crusades and trendy beliefs is very different from being a ""denier"".  We can scarcely predict the weather one day in advance. Being skeptical of global climate predictions spanning decades is hardly on the same level as denying the internal combustion engine. And even if you accept the premise of global warming, as I do, it's a big stretch to make lifestyle recommendations based on that, and an even bigger stretch to start regulating personal eating habits.",1309374476
2710772,comment,2710420,2710637,1,0,tamberg,,,"+1. Using Unicode in URIs is a <i>very</i> bad idea. It's essential that an URI can be written by hand on a napkin and entered into a computer again later, without any ambiguity.",1309374466
2710771,comment,2710659,2710727,21,0,sanswork,,,AOL/TW?,1309374461
2710770,comment,2710390,2710390,2,0,ori_b,,,"If the power usage really is anywhere near as high as the graph says -- 30 to 45 watts range -- then the laptops aren't going to get much battery life. That is a lot of power to be using.<p>I suspect that they were testing on the plugged into wall socket power profile, where speed is the main concern, and not power usage. Power consumption changes when the laptop is running off of battery.<p>Edit: My X200 Tablet runs at about 12 watts on Linux right now, on battery.",1309374456
2710769,story,,,2,1,alvivar,"Why Your Life is About to Change, Mobile, Location, Social, Trend Convergence",http://blog.localmind.com/post/7049993961/why-your-life-is-about-to-change-mobile-location,,1309374410
2710768,story,,,32,30,shawndumas,"Breaking news: advertsing company wants your personal information",http://www.marco.org/2011/06/29/google-plus,,1309374375
2710767,comment,2710420,2710526,1,0,GICodeWarrior,,,"If you empty the input for the URL path, it will generate a URL for you with a unicode character(s).",1309374370
2710766,story,,,2,0,borisfowler,"Ten Steps to Build Real Startup Team Engagement ",http://www.caycon.com/blog/2011/06/ten-steps-to-build-real-startup-team-engagement/,,1309374369
2710765,comment,2709720,2710571,1,0,gnosis,,,"Web-based IRC clients have existed for a long time.  To use them all you have to do is point your browser at a website.  The usernames assigned by these clients are usually something like ""guest0"", ""guest1"", etc.  That's probably anonymous enough.<p>You could connect to any number of public IRC servers already set up all over the world.  Then simply join the channel of your choice.  No bots necessary.<p>As far as invitations go and teaching people what to do, you're going to have to do that any way.  With existing web-based IRC clients it's as simple as pointing your friends/colleagues to the website and telling them to join channel #whatever.",1309374365
2710764,comment,2710660,2710660,14,0,Shenglong,,,"Does this really overcome awkwardness? I don't think awkwardness is ever a function of not having enough common interests. I've had brilliant dinners with girls who've had zero interest in theoretical physics, and yet, I talked about it for a good half of the dinner. Reciprocally, I have very little interest in shoes, but I've been fascinated by explanations of shoes.<p>Yet, there have been times where we share the same interests, but the other person is especially boring. It doesn't matter what interests you share, if the other person can't elaborate on their interests or offer insight/comments.<p>Also, sometimes I like talking to people with completely different interests. One of my favorite persons actually is my exact polar opposite. We get along great, but we share 0 common interests.<p>I'm pointing this out as a consideration factor, not because I don't like your project. I think you do have a good start... but feedback never hurts? :)",1309374356
2710763,comment,2710117,2710117,1,0,brudgers,,,"Learning Photoshop quickly is analogous to learning Visual Studio quickly. It's not the software that makes the difference, it's the wetware; and no tutorial is going to give you years of experience and a good eye for aesthetics.<p>So just fire that baby up and start drawing.",1309374348
2710762,comment,2710101,2710670,1,0,spahl,,,"Do you use luwak to store the videos or are they small enough?",1309374340
2710760,comment,2710101,2710549,2,0,spahl,,,"Out of curiosity, did you try riak_search as a solr replacement?",1309374256
2710759,comment,2710296,2710296,6,0,ryanisinallofus,,,"Judging from the previews and looking over a co-worker's shoulder this finally looks like a social, singular interface for many of Google's products.<p>Iv'e been hoping they would stop thinking of themselves as many different products and start viewing themselves as users do: just one Google. Each product is really just a feature. Facebook does this right and I hope Google does too.",1309374254
2710758,comment,2710521,2710750,2,0,marcf,,,"The $1B in revenue is only an estimate based on projections and a continued growth trajectory.  Not saying it isn't true, but it isn't a solid source for their actual revenue.<p>Did News Corporation annual filings every break out revenue from MySpace?  Given that News Corporation is a public company, there should be solid numbers somewhere.",1309374215
2710757,comment,2709834,2710473,2,0,chopsueyar,,,"One man's robber baron is another man's philanthropist.<p>Did you ever use Windows Millennium Edition?",1309374146
2710756,story,,,2,0,borisfowler,"Follow Seven Rules for a Creative Startup Culture",http://www.caycon.com/blog/2011/06/follow-seven-rules-for-a-creative-startup-culture/,,1309374121
2710755,comment,2710659,2710726,23,0,hydrazine,,,"Groupon!<p>I kid, I kid.. But seriously.",1309374110
2710754,comment,2709723,2710139,1,0,msc,,,"<a href=""http://en.wikipedia.org/wiki/There_ain%27t_no_such_thing_as_a_free_lunch"" rel=""nofollow"">http://en.wikipedia.org/wiki/There_ain%27t_no_such_thing_as_...</a>",1309374054
2710753,story,,,1,0,jameshighsmith,"Powering The Cloud",http://www.blog.wa.tt/powering-the-cloud,,1309374040
2710752,story,,,3,0,senatorbolton,"Old Spice Ad Agency Looking For Startups To Fund/Mentor/House",http://piepdx.com/,,1309374015
2710751,comment,2710659,2710726,18,0,thirsteh,,,"Facebook, now that Google+ is here :P",1309374014
