ID,Type,Story,Parent,Points,Comments,Author,Title,URL,Content,Created
48557,comment,48532,48538,0,0,aswanson,,,"That's nice, but I would prefer an all orange with just a huge white 'Y'.  Just my preference.",1188525454
48556,comment,48184,48184,0,0,wastedbrains,,,"Still around since 1999, but it still sucks seriously does anyone even use epinions. I have never found it useful while searching and comparing products online.<p>I guess that is a good thing since we are working on a competitor of sorts.",1188525329
48555,comment,48509,48550,0,0,andres,,,"I asked Paul if we could use his code but it was too much work to integrate it into Octopart so we wrote it from scratch in python.",1188525291
48554,comment,48553,48553,0,0,rms,,,"<a href=""http://www.paulgraham.com/america.html"" rel=""nofollow"">http://www.paulgraham.com/america.html</a><p>""I think what holds back European hackers is simply that they don't meet so many people who've done it. You see that variation even within the US. Stanford students are more entrepreneurial than Yale students, but not because of some difference in their characters; the Yale students just have fewer examples.<p>I admit there seem to be different attitudes toward ambition in Europe and the US. In the US it's ok to be overtly ambitious, and in most of Europe it's not. But this can't be an intrinsically European quality; previous generations of Europeans were as ambitious as Americans. What happened? My hypothesis is that ambition was discredited by the terrible things ambitious people did in the first half of the twentieth century. Now swagger is out. (Even now the image of a very ambitious German presses a button or two, doesn't it?)<p>It would be surprising if European attitudes weren't affected by the disasters of the twentieth century. It takes a while to be optimistic after events like that. But ambition is human nature. Gradually it will re-emerge.""",1188525273
48553,story,,,10,28,weebro,"Silicon Valley aside, why are Americans more willing to risk a startup?",,"I'm based in the UK and am hoping to apply to YC in Oct. We are currently looking for strong hackers to co-found with us, if they like the idea.  We cannot, however, find anyone in the UK even remotely interested.  The concept of 'it's not what you do but when you do it' simply does not exist here.  What does the US have that we don't?",1188525128
48551,comment,48294,48503,0,0,oditogre,,,"Will do. And BTW, Octopart is now in my bookmarks toolbar at work, so please follow this essay's advice and don't die. :)",1188524955
48550,comment,48509,48509,0,0,joshwa,,,"Looks like it's built on the same codebase as news.yc...",1188524672
48549,comment,48294,48460,0,0,rms,,,"I'm an undergraduate in college, studying industrial engineering. I ask myself regularly what the point is, because I have absolutely no desire to work as an industrial engineer. You may remember industrial engineers as the efficiency experts from films such as Office Space and American Beauty.<p>So I know the thing to do is to drop out and move to the Valley. But the only socially acceptable way I had to do that was acceptance into Y Combinator, or angel funding from someone else.<p>So for now, my company is in Pittsburgh. It's going to be really easy to ""not die"" because there is absolutely no way for my company to fail because we have no expenses. Unless we get sued and can't afford to defend ourselves. While we're not dying, we should start making money. So if we have enough revenue to support a Bay Area or NYC lifestyle, we would happily move the company there, regardless of college education.",1188524083
48548,comment,48294,48404,0,0,dfens,,,"Three words: ""Working for Families""",1188523939
48547,comment,48509,48509,0,0,rokhayakebe,,,"Cool. So the hardware nuts go there and talk about building stuff, then they look for the parts on the site before buying it from the site. ",1188523744
48546,comment,48509,48509,0,0,andres,,,"The idea behind the site was to be more oriented towards forums than news stories. Basically, we wanted to provide a way for somebody to ask design questions to a community of smart hardware hackers. Of course, cool hardware stories are hard to come by so they make great submissions as well.",1188523504
48545,story,,,1,3,kashif,"Google's Orkut Revamped.",http://www.orkut.com,,1188523214
48544,comment,48294,48342,0,0,electric,,,"I have two kids, my wife works, I used to work at a high tech company and we had to save up for a couple of years before going the startup route.  Now it is all startup -- so that is good.  <p>We gave up a lot financially to be here.  If you have kids and a family it does take a lot more work, but it is not impossible.  Just work it out with your wife.<p><p>  \n",1188523157
48543,comment,48537,48537,0,0,kkim,,,"... of the 769 companies in his study.",1188523087
48542,story,,,3,0,kkim,"Making Ubuntu boot in 19 seconds",http://lightningcrash.blogspot.com/2007/08/making-ubuntu-boot-in-19-seconds.html,,1188522952
48541,comment,48509,48509,0,0,bolt,,,"It looks like there is some more info about their news site here:\n<a href=""http://news.octopart.com/faq"" rel=""nofollow"">http://news.octopart.com/faq</a>",1188522859
48540,story,,,1,0,kkim,"Wikirage: What's hot now on Wikipedia",http://www.wikirage.com/,,1188522843
48539,comment,48408,48408,0,0,kansando,,,"You know the Boston area VCs insist on replacing the founding CEOs. Are they nuts?\n",1188522829
48538,comment,48532,48532,0,0,pg,,,"We have them; we just don't sell them.<p><a href=""http://www.flickr.com/photos/80819445@N00/1166586940/in/set-72157601547542240/"" rel=""nofollow"">http://www.flickr.com/photos/80819445@N00/1166586940/in/set-...</a><p>(That's Xobni founder Adam Smith I think.)",1188522778
48537,story,,,13,5,bouncingsoul,"Interesting stats on tech startups – only 16% fail?",http://robbieallen.com/blog/mit-sdm/2005/10/ed-roberts-author-entrepreneur.html,,1188522542
48536,comment,48294,48294,0,0,wesleyb,,,"Inspiring (as always).\n",1188522482
48535,comment,48284,48295,0,0,Darmani,,,"Correction: JavaScript embedded in web pages cannot process images. Mozilla Rhino most certainly can, and I'm pretty sure Mozilla SpiderMonkey can as well if given XPConnect (or similar).",1188522210
