ID,Type,Story,Parent,Points,Comments,Author,Title,URL,Content,Created
33556,comment,33505,33518,0,0,rms,,,"Tagging would be an enormous improvement here, it's been a long standing request for reddit, too.",1184104676
33555,comment,33553,33553,0,0,aston,,,"edit: I think there's a certain degree of hype involved.",1184104545
33554,comment,33524,33544,0,0,aston,,,"If I were LinkedIn, I'd hold off until Facebook IPO's. Rising tide lifts all ships and whatnot.<p>Until Facebook makes some significant business-friendly changes to their site, I think LinkedIn still has plenty of room to exist and/or grow.",1184104037
33553,story,,,1,3,transburgh,"When did Facebook and LinkedIn become competitors?",http://www.startuphustle.com/2007/07/10/when-did-facebook-and-linkedin-become-competitors/,,1184103758
33552,comment,33514,33533,0,0,aston,,,"I think the bigger story is less about computationally hard problems, but about<p>1) finding a problem being solved the wrong way by the world and setting out to solve it the right way <p>2) the pains of dealing with all of the proprietary (and often annoying) deals and details in a well-established industry.<p>PS: It's easy to miss, but the interesting link here is <a href=""http://www.demarcken.org/carl/papers/ITA-software-travel-complexity/img0.html"" rel=""nofollow"">http://www.demarcken.org/carl/papers/ITA-software-travel-com...</a>
",1184103391
33551,comment,33305,33375,0,0,jaggederest,,,"They did! Some rails guys tried to splinter out a prototype at the 11th hour but were convinced not to.<p>Now we'll never know whether rails would have helped",1184102849
33550,story,,,1,0,amichail,"Justin.tv suggestions",http://mindrosity.blogspot.com/2007/07/justintv-suggestions.html,,1184101623
33549,comment,33465,33485,0,0,shiro,,,"I agree that it's silly to have a ""programming language"" degree.  However, isn't it a basic requirement to be fluent in the language to think in?  English literature major would require fluent English, math major would require fluent to read mathematic notations, etc.  Teaching concepts to those who don't know the language well to describe them seems impossible to me.
",1184101306
