ID,Type,Story,Parent,Points,Comments,Author,Title,URL,Content,Created
8822804,comment,8822515,8822748,0,0,alkonaut,,,"It will be widespread like https has made encrypted web browsing wide spread: when it requires zero effort and zero knowledge.",1420117185
8822803,comment,8822062,8822134,0,0,rtpg,,,"Here&#x27;s the thing I don&#x27;t get. By default, you&#x27;re receiving bitcoin and sending out dollars/yen. By default, there should be no discrepancies! I feel like you would need to be actively incompetent and trying to do tricky things for this to go out of sync.<p>If I had a box, accepted apples and oranges, and would give them back to the owner if asked(taking some slices as payment fees, but at transaction) , at what point can things disappear? The only thing I can think of is race condition style things, but that&#x27;s a single point of failure right?<p>Maybe I&#x27;m missing some complexity here",1420117149
8822802,comment,8820226,8822161,0,0,ashark,,,"Scrabble is a game that&#x27;s ruined for casual players as soon as someone in the group memorizes all the permissible two-letter words and a bunch of the obscure three-letter words.<p>It&#x27;s like the kid who owns the only copy of Street Fighter II in his class and, after a few weeks, can&#x27;t find <i>anyone</i> who will play it with him.",1420117096
8822801,comment,8822062,8822405,0,0,hga,,,"Exactly.  I have a friend who while high school in the &#x27;60s worked in one of those highway restaurants, if you travel in the right parts of the US you&#x27;d remember their name.<p>Of all their cashiers she had the highest &quot;volatility&quot;, you might say, from day to day.   That conceptually annoyed her superiors, but they loved her because she <i>never</i> made a big mistake, and her daily errors averaged out very nicely.",1420117085
8822800,story,,,1,0,antouank,"Hardware Accelerated CSS: The Nice vs. The Naughty",http://calendar.perfplanet.com/2014/hardware-accelerated-css-the-nice-vs-the-naughty/,,1420116987
8822799,comment,8822387,8822508,0,0,pja,,,"There&#x27;s a bug in the system somewhere breaking voice calls altogether on the Nexus 4 which is apparently triggered by a recent change to Google Play Services. Mostly the people affected are using third party ROMs (CyanogenMod et al), but I believe it&#x27;s also affecting some stock devices. Might be the same problem?<p>Right now it&#x27;s a choice between having a working phone with only partially functioning Google Apps or working Google Apps with the phone not being, well, a phone. Hopefully the CM crowd will be able to come up with a bugfix / workaround of some sort that doesn&#x27;t involve stopping half the Google Apps from working properly.<p>(CM bug: <a href=""https://jira.cyanogenmod.org/browse/CYAN-5728"" rel=""nofollow"">https://jira.cyanogenmod.org/browse/CYAN-5728</a> )",1420116986
8822798,story,,,7,2,evanx,"What is Redis?",https://github.com/evanx/vellum/wiki/redis_intro,,1420116978
8822797,story,,,13,0,jarek-foksa,"Web Performance APIs",http://calendar.perfplanet.com/2014/fast-forward-performance-the-future-looks-bright/,,1420116946
8822796,comment,8822387,8822711,0,0,ce4,,,"I&#x27;m a bit skeptical that your comparison of to the ipad1 is a good one. After all you just compared (one of?) the first viable tablets from the very start of the tablet market where innovation/iteration was much higher to a smartphone that appeared 5 years into the smartphone era where innovation/cycle is now much lower.<p>You can still install the latest Android version via aftermarket firmware for the first Samsung Galaxy S1. That phone was released in June 2010, only two years into the smartphone era. It will turn 5 soon and still runs great. Only downside is its small system partitions.",1420116789
8822795,comment,8822098,8822420,0,0,bshimmin,,,"But no <HTML> tag and no DOCTYPE.  Things were definitely a bit woolly pre-1995, when the first proper HTML spec (version 2.0...) was published.",1420116780
8822794,comment,8820763,8821350,0,0,facepalm,,,"I haven&#x27;t finished it, but not because it&#x27;s boring. It&#x27;s one of those books where I feel I have to start over reading more carefully after a few chapters. Unfortunately that makes it likely to be procrastinated away.
I&#x27;m determined to finish it this year, though.<p>Perhaps a better starting point would be the books of Dan Ariely, in terms of readability.",1420116757
8822793,comment,8820178,8820621,0,0,peterfirefly,,,"Would it be better if India was broken up into much smaller states, possibly more or less along the current internal borders?  Is India really seen as a country by the Indians or is it seen more like a bunch of unwanted outside overlords ruling over your local part of India, whichever that might be?<p>I&#x27;m asking partly because I live in the EU where we are explicitly trying to create a big, state-like construction for most of our continent.  In most cases I feel mostly like a &quot;Dane&quot; or &quot;Scandinavian&quot; or &quot;Northern European&quot; but in some cases I am actually starting to feel like an EU citizen, like we are all in it together, for example regarding Russia&#x27;s behaviour in the Ukraine and elsewhere.<p>It is probably not correct to call the EU a country or a state yet but we are getting closer.  On the other hand, if the Republic of India is actually a country then the European Union is too, isn&#x27;t it?",1420116633
8822792,comment,8820040,8822626,0,0,shutupalready,,,"What happened exactly?<p>How much did you lose (if you don&#x27;t mind saying)?<p>How long was it before you noticed?<p>Do you think you were (a) individually targeted as a BTC holder, or (b) do you think someone was port scanning the Internet and stumbled onto you?<p>If (a), how did they know you might have BTC?  If (b), is it actually commonplace for automated attacks to seek BTC wallets these days?",1420116627
8822791,comment,8820178,8822754,0,0,possibilistic,,,"Terrorist can be a loaded word in a political context. We have terms like &quot;freedom fighter&quot;, &quot; revolutionary&quot;, and &quot;rebel&quot;, but these don&#x27;t quite have neural connotations either.<p>&quot;Insurgent&quot; is used by the media quite frequently, but pundits have twisted this word into little more than an alias for &quot;terrorist&quot;. My brain subconsciously makes this mapping despite my knowledge of a contrary meaning; I think maybe language is too pliable in politics.<p>Maybe we need yet new language to escape the difficulty of communicating without biases inherent in the vocabulary (our minds already do enough to short-circuit logic already without the English language making the matter worse). &quot;Terrorism&quot; and &quot;unrest&quot; are at such a forefront in the global consciousness that the whole subject is deserving of the few extra mental bytes that would be needed to disambiguate the mess.<p>If I were in charge of such a task, I would try to borrow words associated with certain well-known historical anecdotes in a hope that the pundits wouldn&#x27;t simply redefine the words from under us. Hopefully such vocabulary would have enough of a semantic anchor in our generation to dispel such attempts, conscious or not.<p>To press on the issue further, it seems like it would be wise to engineer our language in a way that leads to better thinking. I suppose that would be too artificial to ever be accepted though.",1420116614
8822790,comment,8819622,8822097,0,0,fredwilson,,,correct,1420116602
8822789,comment,8821722,8822368,0,0,nkozyra,,,"Unfortunately, as is the case with all social networks, the functionality is secondary.  Ubiquity is the game and sometimes that momentum is established just by being first.",1420116575
8822788,comment,8822573,8822573,0,0,eps,,,"Very nice read.<p>Basically, when a MacBook is booted it allows random code to be executed from an attached Thunderbolt device (in a form of a legacy mechanism of Option ROM). The Option ROM is loaded unconditionally, including the case when the host system is rebooted to update its firmware. During such upgrade its primary on-board ROM is writable, so the exploit can write itself in it, replace RSA key used to verify firmware upgrades and thus prevent re-flashing the host with any official updates. Additionally, all this is possible because ROM includes only rudimentary self-integrity checks (in a form of CRC32) and proper crypto-signature checks are only applied during the update and not on every boot.<p>This particular exploit is pluggable by making firmware not use Option ROM during upgrades, which is a fix being deployed by Apple. Meanwhile you may want to superglue your TB port.",1420116572
8822787,comment,8819622,8821911,0,0,fredwilson,,,"yes, absolutely. when you do something every day for 25 years, you get good at. i could not do it one bit when i started out. it&#x27;s a learned skill not something you are born with",1420116562
8822786,comment,8819622,8821372,0,0,fredwilson,,,"ha! that&#x27;s great. i don&#x27;t think i&#x27;m going to do that though.",1420116507
8822785,comment,8821212,8822739,0,0,unimportant,,,"I doubt all of this takes much bandwidth though and I doubt they&#x27;re willing to invest huge sums for something everyone will have access to anyway after it&#x27;s completion.",1420116496
8822784,comment,8822515,8822695,0,0,1337biz,,,"Let me enhance the argument 
Joe Shmoe: &quot;I recently read that dark net users are 90% pedophiles. So is this an email service for pedophiles only?&quot;",1420116441
8822783,comment,8822515,8822748,0,0,nickik,,,"Thats why its the goal of darkmail to push it so its used by gmail and organsiations like that.",1420116411
8822782,comment,8822332,8822541,0,0,esalman,,,"+1. Also, these are not so easy to bypass for people with not-so-high level of technical skills.",1420116351
8822781,comment,8820178,8820445,0,0,honeybooboo123,,,"Oh come on. Whenever the public actually demands something, the government&#x27;s response is always batons, tear-gas and rubber bullets (and some torture thrown in for good measure, of course).<p>You call that customer service? Imagine McDonald&#x27;s tasing you for complaining about not getting what you ordered.<p>-That&#x27;s exactly how governments behave. As a recent example, China and HK declare that from now on, Hong Kong&#x27;s electoral candidates will be chosen by the tyrants in Beijing. HK&#x27;s citizens protest. HK&#x27;s police forces brutalize the citizens.",1420116337
8822780,comment,8822062,8822572,0,0,hga,,,"Nah, Enron&#x27;s <i>prominence</i> is purely political, it was useful for various narratives.  There are far worse examples, and Mt. Gox sounds like it&#x27;s in the running.<p>E.g. there&#x27;s cheating on your general ledger (which at 50,000 feet might be the sort of thing Enron did), then there&#x27;s <i>not keeping a general ledger at all</i>, which is being posited in this discussion.<p>Even I, who&#x27;s never run a company, but did watch my parents run some while I was growing up, know how essential it is to keep a general ledger.  Otherwise you have no real idea what your financial state is.",1420116333
8822779,comment,8819622,8821385,0,0,fiatjaf,,,"And that is awful, right? We got rid of files by the same way we could get rid of files 20 years ago: by not having them anymore, burning them, storing our information in other people&#x27;s files.",1420116317
8822778,comment,8822062,8822134,0,0,tim333,,,"An alternative explanation could be that Karpeles, who was convicted of fraud in 2010, decided to stick with the fraud thing from the start.",1420116304
8822777,comment,8821722,8822300,0,0,Kiro,,,"> Instagram has restrictions on the aspect ratio of pictures.<p>I definitely think this is one of the reasons Instagram is so popular, together with the low resolution. It lowers the bar for when a picture is as good as it gets which makes people more prone of posting it.",1420116250
8822776,comment,8822573,8822573,0,0,MrGando,,,"Great read to start 2015, it&#x27;s been a while since I read something of that quality.",1420116217
8822775,comment,8821808,8822671,0,0,chongli,,,"Of course it can be pure, so long as the shared data is not mutated. Functional languages such as Haskell don&#x27;t copy values all over the place when calling functions, they pass in pointers.",1420116093
8822774,comment,8822342,8822342,0,0,draven,,,"One of the issues with roundabouts here (France) is that almost nobody is using their turn signals or use the wrong one (they activate the left one entering the roundabout and keep it on, making you think they&#x27;ll keep on turning around when they&#x27;re about to exit the roundabout.) When you&#x27;re waiting to enter a roundabout it makes you wait a bit longer when a car is already turning around.",1420116083
8822773,comment,8822387,8822524,0,0,pja,,,"<i>Running into all sorts of problems with &#x27;Mail app&#x27; and now &#x27;Gmail app&#x27; using a third-party imap server. Lots of message with an HTML body or attachements are displayed blank.</i><p>Google really, really wants you to use GMail, so the development effort they put into supporting other email setups is of the &quot;just enough to make the sale&quot; variety.<p>My solution to this specific AOSP issue is to use K9 Mail which (in my experience) is far better than the stock Android Mail app. (It was forked from the AOSP Mail app some years ago IIRC & has an active development community & github repo.)<p>I don&#x27;t have any solutions to your other (perfectly reasonable) complaints unfortunately.",1420116076
8822772,story,,,1,0,sunpazed,"What is the world doing right now? Post a photo and tell your story",http://cliquefy.com/i6S4EC1n6oO,,1420116064
8822771,comment,8821722,8822029,0,0,logicallee,,,"could you elaborate or be more specific?",1420115986
8822770,comment,8820503,8821748,0,0,_benedict,,,"1) The constant time claim for deletion is actually completely unrelated to the size of the list. Even if the list grew infinitely (only a fraction of all deletes were realised), the deletion would certainly be constant time since we explicitly bound it. Iteration would incur the cost, and reimpose the true structure as it went.<p>2) Regardless of the number of competing deletes, we always successfully remove <i>some</i> of the nodes we intended to - the question is only if an older delete in the same interval selected the same terminal node in one direction as a newer delete, and overrides the newer delete&#x27;s pointer modification to reintroduce some nodes it had removed. Such an interleaving should be rare, especially as the range grows, since the newer delete both started later and had more work to do. The main risk is in situations where a thread is suspended in the middle of making its modification, in which case it could conceivably reintroduce a large range of previously removed nodes.",1420115983
8822769,story,,,1,0,Anchor,"Loose Coupling and the Big Picture (2012)",http://blog.ploeh.dk/2012/02/02/LooseCouplingandtheBigPicture/,,1420115973
8822768,comment,8820178,8820178,0,0,tiatia,,,"You have to realize that some countries don&#x27;t have internet. Like China, China does not have internet. They probably don&#x27;t even know what Internet is. They think if they can order something from Taobao then this is Internet. Regarding communication (phone, internet, postal mail) China is not even a third world country since third world countries actually have internet.<p>Now the Indian government tries to compete with China who has the most fucked up communications. Good luck!",1420115970
8822767,comment,8822573,8822726,0,0,eps,,,"Described exploit requires a reboot, so it doesn&#x27;t matter if the computer is locked or not.",1420115890
8822766,comment,8819159,8822058,0,0,the_why_of_y,,,"It&#x27;s definitely possible to bootstrap the JVM in-process but there are quite some steps to it and it requires a bunch of platform dependent code to locate and load the library via LoadLibrary(jvm.dll) / dlopen(libjvm.so).  IIRC the JNI functions all have C linkage so it should be easy to do from Rust.",1420115837
8822765,comment,8822387,8822387,0,0,amorphid,,,"My Nexus 4 was pretty unstable when it got updated to Lollipop.  I have one specific memory of trying to use navigate from Point A to Point B on my first day of work at a new job, only to have Google Maps crash about every 3 minutes.  It seems to have gotten better with recent updates.  At least Google Maps isn&#x27;t crashing anymore.",1420115782
8822764,comment,8822515,8822743,0,0,adrianN,,,"Any security measure you take can only make attacks harder. If you have a really determined adversary nothing will protect you forever. Compared to the current status quo e-mail encryption even if the private keys are only kept moderately private would be a huge improvement.",1420115641
8822763,comment,8822342,8822730,0,0,kerridge0,,,"Haha, same here. (edit: not planning on visiting Swindon again after the first visit which involved some trouble with the &#x27;magic&#x27; roundabout)<p>I was in turn: confused (as I wasn&#x27;t expecting it), amused (as I had recently read a Wikipedia article about it), distracted (as I tried to explain it to my partner), shocked (when I got stopped by a policeman having inadvertently driven through a pedestrian traffic light), and angry (when I got 3 points on my license). I tried to explain that I had been distracted by the roundabout but to no avail.",1420115569
8822762,comment,8820763,8822318,0,0,WalterBright,,,"Yes, that one is good too, but it covers different material.",1420115508
8822760,comment,8822062,8822157,0,0,DCoder,,,"Reddit seems to have some info from the print edition already: <a href=""https://www.reddit.com/r/Bitcoin/comments/2qyyy9/tokyo_metro_police_fraud_causes_disappearance_of/cnay4w5"" rel=""nofollow"">https://www.reddit.com/r/Bitcoin/comments/2qyyy9/tokyo_metro...</a>",1420115431
8822759,story,,,1,0,makuchaku,"I scored 80% on my own 2014 objectives. Here's what is in store for 2015",http://www.makuchaku.in/blog/i-scored-80-on-my-2014-objectives-some-new-ones-for-2015,,1420115403
8822758,comment,8822387,8822522,0,0,kawsper,,,"That is one sad thread. Very embarrassing for Google that they don&#x27;t seem able to respond and to resolve such issues.",1420115401
8822757,comment,8820967,8822207,0,0,hga,,,"Ha!  In my early days of computing, when we had to walk to school uphill both ways, 5 miles in the snow, going from punch cards in 1977 to line editors was <i>fantastic</i>, I first used original &quot;ed&quot; in 1978, with it&#x27;s one error message of &quot;?&quot; (it was developed in the days when 110 baud Teletype terminals put an <i>extreme</i> premium on every character typed and printed), some random ones in micros, then EMACS was a fantastic improvement in 1979-80.  And I haven&#x27;t looked back.",1420115397
8822756,story,,,1,0,signa11,"Implementing Linked Lists with Contiguous Arrays",https://cwzx.wordpress.com/2014/12/31/implementing-linked-lists-with-contiguous-arrays/,,1420115360
8822755,story,,,39,55,remotorboater,"Japan records lowest number of births on record as population shrinks",http://www.theguardian.com/world/2015/jan/01/japan-suffers-lowest-number-of-births-on-record-as-population-shrinks,,1420115349
8822754,comment,8820178,8822096,0,0,bigbugbag,,,"> All terrorists suck<p>Being the descendant in a family that was host of several terrorists, I have to disagree with you. See once the war was over and nazi germany got booted out, all those terrorists in my family instantly turned into resistance heroes.<p>Turns out those terrorists in my family were just ordinary people who got into this for reason as simple as having a bike allowing them to move around and relay messages, sort of an internet over bike and some of them got caught and executed for that.",1420115331
8822753,comment,8822387,8822711,0,0,possibilistic,,,"I know it&#x27;s not feasible at present, but I&#x27;d like to imagine a smartphone that I could consider a high end professional tool. A device like that needs no software or UI changes outside of an occasional patch; hardware fast enough that I couldn&#x27;t imagine a need for replacing it. A Thinkpad or Nikon, and just as much an extension of my person. Like vim, using the device would feel a bit like playing the piano--something I bend and mold, that also bends and molds me.<p>I&#x27;m not at all satisfied with this stuff yet--not to the level I described. Currently these phones are indespensible (much like trips to the dentist), but what I really want is for them to feel like an extension of my soul (like a fine car). Things are too buggy, too consumer, and moving much too fast. I imagine we&#x27;ll eventually hit a plateau, because I want that phone.",1420115316
8822752,comment,8819085,8820722,0,0,justincormack,,,"You can build NetBSD to be statically linked [1]. It is not the default, but it is trivial to do, one line config change. Note that you can build NetBSD from source on any system, eg Linux or OSX and then boot it in a VM,  so you dont really need a binary &quot;distro&quot;.<p>[1] <a href=""https://www.netbsd.org/docs/guide/en/chap-build.html#chap-build-environment-static-build"" rel=""nofollow"">https://www.netbsd.org/docs/guide/en/chap-build.html#chap-bu...</a>",1420115248
8822751,comment,8820503,8821952,0,0,_benedict,,,"I&#x27;m not sure if you read the article or not, but I try (and perhaps fail) to make clear that this is not so much eventual consistency in the distributed systems sense, since every accessor sees the same <i>data</i> (if not the same <i>structure</i>), but there are strong parallels with eventual consistency - in fact the same algorithm would work unchanged in an eventually consistent store, if it supported garbage collection. So I felt it helped to put readers in the right mindset.<p>Since only the structure is &quot;eventually consistent&quot; - the data that is represented by the structure is the same to every accessor, and is reliably (and efficiently) derived from all possible structural states, it behaves as much like its sequential counterpart as any other non-blocking data structure does.<p>Modern computer are eventually consistent systems by virtue of the caching layers (and local registers) - only once modifications make it to a shared cache are they globally visible. Much like with EC stores that support some kind of atomic read-modify-write operation, such an operation on a CPU incurs extra cost. However unlike in those systems, CPUs can read-modify-write non-transactionally very quickly, so the window for stepping on toes is low. In this structure, usually the desired outcome will be the actual outcome. So it can simply be cheaper to deal with the non-desired outcomes gracefully instead of ensuring they never occur.",1420115215
8822749,story,,,1,0,omritoppol,"Invasive phone tracking: New SS7 research blows the lid off mobile security",http://www.zdnet.com/article/invasive-phone-tracking-new-ss7-research-blows-the-lid-off-personal-security/,,1420115013
8822748,comment,8822515,8822515,0,0,okasaki,,,"I don&#x27;t think email encryption will ever be more widespread than it is today. People simply don&#x27;t care, and even those few that can be convinced to use it will invariably do something that invalidates the whole exercise like bring their key to a public library, use it on their phone, resend the entire conversation in plain text accidentally, lose the key and generate a new one with you having no way to verify that it&#x27;s not actually mitm, etc. All of this has happened to me.",1420114944
8822747,comment,8822332,8822481,0,0,Tobu,,,"Name-checking terrorists is so thin it&#x27;s transparent.<p>Also, the SourceForge link was for pastebin source code[0] and not an actual pastebin.<p>IMHO it was a lazy request from the copyright lobby, which is seeking to criminalize anonymous text and links.  They don&#x27;t care that it&#x27;s insane, the world isn&#x27;t changed by being reasonable; at worst they&#x27;d have shifted the Overton window and made the other wing of the lobby look sane.  The politicians barely care, and another level of jaded drones didn&#x27;t bother to contact anybody[1], put up a DNS block and went home.<p>[0] <a href=""https://news.ycombinator.com/item?id=8820591"" rel=""nofollow"">https://news.ycombinator.com/item?id=8820591</a><p>[1] <a href=""https://news.ycombinator.com/item?id=8820289"" rel=""nofollow"">https://news.ycombinator.com/item?id=8820289</a>",1420114896
8822745,comment,8822515,8822515,0,0,Rapzid,,,"Freedom Mail.",1420114784
8822744,comment,8822687,8822687,0,0,Livven,,,"I released this app a couple weeks ago, but the initial submission [1] did not get any traction here so I thought I&#x27;d resubmit it. Hope that&#x27;s okay.<p>All the various sections and categories on HN are supported – the front page, new, show, shownew, ask, best, active, jobs. There&#x27;s an integrated browser with mobilizer support, and you can instantly switch between the browser and comments with a simple swipe. Comment threads are color-coded and collapsible.<p>This is my first non-trivial project that I actually finished and released, so I&#x27;d appreciate any feedback.<p>[1] <a href=""https://news.ycombinator.com/item?id=8663913"" rel=""nofollow"">https://news.ycombinator.com/item?id=8663913</a>",1420114779
8822743,comment,8822515,8822515,0,0,lottin,,,"I&#x27;d love that e-mail encryption became widespread, but I&#x27;m doubtful that it&#x27;ll ever happen. I think keeping private keys private may prove to be an impossible task. Systems are too insecure. Even security experts may fall victim to sophisticated attacks. Let alone the other 99.9% who are not security experts.",1420114766
8822742,comment,8821015,8822611,0,0,nateberkopec,,,"Is it? Python is <i>exactly the same</i>. It has no language spec (defined by its implementatation), and it has a BDFL who hasn&#x27;t pushed for one.",1420114750
