ID,Type,Story,Parent,Points,Comments,Author,Title,URL,Content,Created
8822741,comment,8821722,8822200,0,0,GamblersFallacy,,,"Daily repeat traffic.",1420114741
8822740,story,,,2,0,xvirk,"Anyone actually ever seen the full Doge photo set?",http://imgur.com/gallery/OCgbS,,1420114699
8822739,comment,8821212,8822666,0,0,peteretep,,,"4th sentence:
&quot;but the investors and companies eager to send information—stock trades, wire transfers—are so intent on earning a fraction-of-a-second advantage over competitors that the US $850 million price tag for the approximately 15,600-kilometer cable may well be worth it.&quot;",1420114632
8822738,comment,8820178,8821910,0,0,walshemj,,,"Ah like SPAD&#x27;s (Special Advisors) are they considered temporary civil servants it seems odd that an unelected &quot;advisor&quot; is making policy and being quoted in the media though.",1420114617
8822737,comment,8819042,8819721,0,0,frowaway001,,,"You can just disallow the compilation of anything where null appears, as well as plenty of other style issues.<p>The language gives you plenty of tools to enforce the appropriate coding style for a given project.",1420114607
8822735,comment,8821212,8822666,0,0,arethuza,,,"London and Tokyo are two of the worlds top financial centers - I don&#x27;t think this has much to do with general internet access and everything to do with trading.<p><a href=""http://en.wikipedia.org/wiki/Financial_centre"" rel=""nofollow"">http://en.wikipedia.org/wiki/Financial_centre</a><p>[NB The article makes this pretty clear]",1420114583
8822732,comment,8822387,8822571,0,0,chdir,,,"There was a relevant article recently [1], [2] talking about similar issues & maker movement[3]. Also reminds me of camera manufacturers trying to stay on top of innovation by convincing customers to buy higher megapixels.<p>[1] <a href=""http://www.engadget.com/2014/12/29/the-cure-for-our-disposable-times/"" rel=""nofollow"">http://www.engadget.com/2014/12/29/the-cure-for-our-disposab...</a><p>[2] <a href=""http://www.telegraph.co.uk/news/science/science-news/11298927/Young-people-are-lost-generation-who-can-no-longer-fix-gadgets-warns-professor.html"" rel=""nofollow"">http://www.telegraph.co.uk/news/science/science-news/1129892...</a><p>[3] <a href=""http://en.wikipedia.org/wiki/Maker_movement"" rel=""nofollow"">http://en.wikipedia.org/wiki/Maker_movement</a>",1420114484
8822731,comment,8819614,8821964,0,0,IkmoIkmo,,,"Puts us in the top 15 with the usual suspects. United Kingdom was a surprising one for me though, would not have expected it to be better than say Finland or the Netherlands.<p><a href=""http://en.wikipedia.org/wiki/List_of_countries_by_traffic-related_death_rate"" rel=""nofollow"">http://en.wikipedia.org/wiki/List_of_countries_by_traffic-re...</a>",1420114480
8822729,comment,8822573,8822573,0,0,csirac2,,,"An amazing write-up. Although I am using my EE training a lot more at work these days, and I&#x27;ve designed my fair share of MCU (and USB, FPGA, analog...) projects I&#x27;ve never found the time to dip into learning even a fraction of the detail presented here on low-level modern x86 architecture.<p>For me, reading this really hammers home just how feasible evil maid type attacks really are (considering attacks aimed at defeating Eg. Full disk encryption). But at the same time, if I am still typing the passphrase for my encrypted disks at each boot, simply filming me use my laptop would seem easier... So using that logic, I have been working on passwordless unlock before fiddling with the very tedious task of maintaining a SecureBoot Linux installation.<p>Can anyone say how strong the x86/TPM-equipped machines out there are against malicious firmware updates, assuming one has their BIOS admin password set?",1420114318
8822728,story,,,2,0,ingve,"Significant Software Development Developments of 2014",http://marxsoftware.blogspot.com/2014/12/big-news-2014.html,,1420114233
8822727,comment,8822515,8822695,0,0,motters,,,"Sadly, I completely agree with this. From a wider public relations perspective beyond the realm of hackerdom calling it &quot;darkmail&quot; hands an easy propaganda win to the authoritarians.<p>Instead of dark scariness emphasise safety, security, protection, freedom, etc.",1420114224
8822726,comment,8822573,8822669,0,0,lloeki,,,"I seem to recall that FireWire ports were disabled in some way when the system was locked (tip: show Keychain Access icon in menubar to have a manual lock at a click&#x27;s distance) and that such attacks therefore required the computer to be unlocked.<p>Did I dream about that feature, and is that applicable to Thunderbolt?",1420114199
8822725,comment,8822062,8822617,0,0,jarcane,,,"99.9808%, given those figures. Some numbers I can find online pin it at 99.97%, which in either case is comparable but greater to that of Communist China (99.93%).",1420114125
8822724,comment,8821722,8821722,0,0,barnacs,,,"Let&#x27;s waste an enormous amount of resources to create Yet Another Messaging App. That&#x27;s exactly what the industry and humanity in general needs to advance!",1420114106
8822723,story,,,51,72,csomar,"Ask HN: What are your predictions for 2015?",,"In the spirit of the old threads, let&#x27;s predict what will happen in 2015<p>2014: https://news.ycombinator.com/item?id=6994370<p>2013: none?<p>2012: https://news.ycombinator.com/item?id=3395201<p>2011: https://news.ycombinator.com/item?id=1970023<p>2010: https://news.ycombinator.com/item?id=1025681<p>Please use lists (even a long bullet list) instead of very long paragraphs.",1420114085
8822722,comment,8821068,8822122,0,0,blfr,,,"That&#x27;s a great sentiment, the same that is behind conservation in general. Most people, however, don&#x27;t enjoy being poor and western is the only culture with a proven track record of basic material prosperity.",1420114080
8822721,comment,8822151,8822316,0,0,rhys91,,,"Is the profit from exchanging from BTC to USD or a discount source of gift cards.",1420114060
8822720,comment,8820178,8820258,0,0,minusSeven,,,"Well they only need to remove the offensive stuff from the Indian version of those websites. This is something I know google can not sure about pastebin and github.",1420114052
8822719,comment,8819614,8822694,0,0,century19,,,"I disagree.  I think that forcing people to wear helmets would result in less people cycling, defeating the purpose.  Being able to hop on and hop of your bike while not carrying a helmet around is great.  I don&#x27;t think anyone would want helmets introduced.  If you are doing high speed cycling on a racing bike then you need a helmet, but if you are going to the shops to get milk on a city bike with no gears I don&#x27;t think it adds anything.<p>Of course safety is important.  Not having lights on your bike in winter is very dangerous (drivers can&#x27;t see you in their mirrors) and the police do frequent random stops and issue fines.<p>Anecdotally a friend of mine was in a very bad cycling accident (hit by a bus).  She had no helmet and it wouldn&#x27;t have helped.  After months of rehab for her broken leg she is cycling again without a helmet.  Of course she could have fallen differently and a helmet would have helped, but most of the damage was caused by the collision and not the fall.",1420114012
8822718,comment,8819120,8820887,0,0,fxtentacle,,,"That&#x27;s a good question.. and I don&#x27;t know the answer myself:<p>The shop site is run by FastSpring because I didn&#x27;t want to have to deal with all the VAT weirdness in the EU. Maybe that&#x27;s why they asked you, so they can decide wether to charge you VAT or not.",1420114004
8822717,comment,8819085,8821558,0,0,zokier,,,"And if developers would just write bug-free code then also life would be much simpler. Sadly neither of these things is going to happen, so we need to deal with it somehow.",1420113942
8822715,comment,8813883,8822188,0,0,gpvos,,,"I don&#x27;t know about you, but I boil water several times every day. I don&#x27;t go outside to freezing temperatures every day. So this is all relative.<p>In fact, the heater I have at work has a nice digital temperature display, and it works nicely as an indication how long to wait, a bit like a charging/loading indication...",1420113889
8822714,comment,8819120,8820158,0,0,fxtentacle,,,:),1420113845
8822713,comment,8822573,8822669,0,0,spacefight,,,"+1 for using the term &quot;weaponize&quot;.",1420113661
8822712,story,,,3,0,datashovel,"Dave Barry's Year in Review 2014",http://www.miamiherald.com/living/liv-columns-blogs/dave-barry/article4940373.html,,1420113611
8822711,comment,8822387,8822651,0,0,IkmoIkmo,,,"It&#x27;s a bit like asking if I&#x27;d want to use an Ipad 1 which is less than 5 years old. If Apple focused on iterating on iOS 5 and kept it running on an iPad 1, and all the developers in the world were developing for the iPad 1, I think we&#x27;d be much worse off. We also mustn&#x27;t forget there&#x27;s compounding development. i.e. if you have a 1-year release cycle on small updates (4 -> 4S, 5 -> 5S) and a 2-year release cycle for major updates, you compound developments much faster than a 5-year cycle as you can do mini-experiments every year, see how the response is and act on it. Touch ID is a great example, used as an alternative to unlocking with pin on the 5S, well received, then integrated into Apple Pay for in-store payments, appstore payments, paypal payments etc.<p>Does that mean we&#x27;re &#x27;to blame&#x27;? Well in a way, yes. But I don&#x27;t really feel it&#x27;s a big problem. It&#x27;s a side-effect of something awesome: new technology iterating fast. If you compare mobile tech between 2008 - 2014, I&#x27;m pretty amazed. But you offered a pretty extreme 5-year case. I think most obviously would say no to that. But software problems being deprecated on a 2-year old phone (that should have already been resolved anyway) is pretty weak and I don&#x27;t think it&#x27;s got much to do with consumers. That&#x27;s a business choice for which I think enough resources should be made available to fix, unless it&#x27;s not important. But we&#x27;re talking a Voip call for a smartphone here, it doesn&#x27;t get much more elementary than that. It&#x27;s just bad practice and I don&#x27;t think we are to blame for that. I wouldn&#x27;t expect a Voip call to echo madly from an HTC or Apple phone and then not get fixed in the 2 years after.",1420113609
