ID,Type,Story,Parent,Points,Comments,Author,Title,URL,Content,Created
10784324,comment,10784089,10784300,0,0,lsiunsuex,,,"Oddly - I find remodeling / manual labor to be very relaxing - the last 12x12 bedroom in our house is begging to be gutted and remodeled.<p>It&#x27;s amazingly relaxing and quite the workout throwing a hammer into a plaster and lath wall and just doing demolition for 8 hours.<p>Painting a room, too, is relaxing - which is on my list of stuff from the wife to get done.",1450890988
10784323,comment,10782942,10783961,0,0,dragontamer,,,"Ignorant article writes fighting words to click-bait readers.<p>I listen to CSPAN every day, and heard Clinton say these words. Read the Washington Post criticism on this issue, which was more balanced.<p><a href=""https://www.washingtonpost.com/news/the-switch/wp/2015/12/22/clinton-and-trump-are-looking-for-an-easy-out-on-the-internet-dont-give-it-to-them/"" rel=""nofollow"">https://www.washingtonpost.com/news/the-switch/wp/2015/12/22...</a><p>Or even <i></i>better<i></i>, listen to Clinton so that you get the story straight from the horse&#x27;s mouth. To see the game of &quot;telephone&quot; amplifying wtfs throughout the echochaimber bothers me severely. The technology exists to get your news directly from the source.<p>Why do you need a reporter from Vice to tell you what your opinion should be on something Clinton said? Why don&#x27;t you just listen to what Clinton said herself, and then make an opinion?<p>At worst, Clinton simply demonstrated her extreme ignorance on this issue. She has no idea how encryption works, and was just saying words. She knows enough that she doesn&#x27;t want to &quot;break&quot; encryption however, she&#x27;s simply calling for computer scientists to think about the issue.",1450890987
10784321,comment,10784089,10784089,0,0,mapcars,,,"How to play on ocarina.",1450890971
10784320,comment,10780896,10784150,0,0,jrs235,,,"I don&#x27;t believe it is illegal for a collection agency to try to collect on a debt that is beyond SOL. If you were to not realize the debt was past SOL and made a partial payment the debt would instantly no longer be past SOL. Which is why some agencies will try to get a debtor to pay on debts beyond the SOL.<p>However, if you know that the debt is beyond SOL you may tell the collection agency to stop contacting you. If the collector continues to call you after you send them your letter, they may be violating the Fair Debt Collection Practices Act[1][4] and you may be able to sue the collector for damages[2][3].<p>[1] <a href=""http://www.consumerfinance.gov/askcfpb/1405/how-can-i-stop-debt-collectors-contacting-me.html"" rel=""nofollow"">http://www.consumerfinance.gov/askcfpb/1405/how-can-i-stop-d...</a><p>[2] <a href=""http://www.fair-debt-collection.com/rules/civil-liability-13.html"" rel=""nofollow"">http://www.fair-debt-collection.com/rules/civil-liability-13...</a><p>[3] <a href=""http://www.nolo.com/legal-encyclopedia/damages-fdcpa-violations.html"" rel=""nofollow"">http://www.nolo.com/legal-encyclopedia/damages-fdcpa-violati...</a><p>[4] <a href=""http://www.nolo.com/legal-encyclopedia/illegal-debt-collection-practices.html"" rel=""nofollow"">http://www.nolo.com/legal-encyclopedia/illegal-debt-collecti...</a>",1450890953
10784319,comment,10783711,10784287,0,0,encoderer,,,"Over a 4 year grant? This is just a guess, I don&#x27;t have the IRS database at my hands. Maybe $200-300k after-tax sounds more reasonable? Like I said above -- &quot;with some luck&quot;",1450890939
10784318,comment,10784089,10784140,0,0,dvcc,,,"The one thing I would advise when learning React is to learn React and then learn some variation of flux. It really helped everything set in for me.",1450890933
10784317,comment,10783071,10783286,0,0,Shivetya,,,"Well drones are ideally suited to eventually being equipped with light weight sensors to prevent collisions. If the tech could be on cameras, I think it was ultrasonic, surely it has improved enough that even simply avoidance systems are possible.",1450890933
10784316,comment,10782897,10783034,0,0,mkobit,,,"I am not sure if I saw it HN recently, but there is an article by Phusion [1] talking about the init process and how to handle it with Docker. They have a base image, baseimage-docker [2], that is supposed to solve that problem.<p>[1]: <a href=""https://blog.phusion.nl/2015/01/20/docker-and-the-pid-1-zombie-reaping-problem/"" rel=""nofollow"">https://blog.phusion.nl/2015/01/20/docker-and-the-pid-1-zomb...</a>\n[2]: <a href=""https://phusion.github.io/baseimage-docker/"" rel=""nofollow"">https://phusion.github.io/baseimage-docker/</a>",1450890931
10784315,story,,,17,13,londont,"Gusto (formerly ZenPayroll) Is Valued at $1B in New Funding Round",http://www.buzzfeed.com/williamalden/gusto-is-valued-at-1-billion-in-new-funding-round,,1450890929
10784314,story,,,2,0,dnetesn,"A Real-Life Trader Talks About “The Big Short”",http://nautil.us/blog/a-real_life-trader-talks-about-the-big-short,,1450890928
10784313,comment,10783071,10783301,0,0,UK-AL,,,"The fact that he deviated out of his defined zone then back again, several times probably means this wasn&#x27;t some malfunction of the device.<p>He was risking it for better shots.<p>If he was in his zone, then malfunctioned then it would not have crashed there.",1450890893
10784311,comment,10783071,10783429,0,0,kuschku,,,"In Germany it’s a traffic offense if (a) you are less than 50m away from the next traffic light, or (b) you create a risky situation in traffic.<p>At 3am with no traffic light near you, or the traffic lights being off? just go.",1450890887
10784310,comment,10782855,10782855,0,0,david927,,,"<i>One thing abundantly clear is that syntax matters.</i><p>I feel this is like reading 100 years ago about how to make your own new type of horse & buggy, with tips like &quot;make sure the reigns are well-fitted,&quot; when what you want to invent is a car.<p>The future doesn&#x27;t belong to syntax because the future isn&#x27;t text.  The same people that would blanch at sending a string argument of &quot;ONE&quot; or &quot;TWO&quot; are indifferent about the fact that they send in &quot;IF&quot; to start a condition.<p>The reason you wouldn&#x27;t send in &quot;ONE&quot; or &quot;TWO&quot; is because it makes it stiffer, more brittle and harder to manage.  What can we say about the software we write?  That it&#x27;s stiff, brittle and hard to manage.<p>It&#x27;s not that the future has no textual syntax at all, of course.  An expression of 3+4*5 will always be easiest to express just that way.  But we need to pull back from our gregarious, wide-mouthed babbling into something more meta, or I should say, more data, than text.",1450890886
10784309,comment,10783434,10784104,0,0,bitwize,,,"Not only do customers <i>not care</i>, in blind testing young people <i>prefer</i> the sound of MP3 artifacts.<p>It&#x27;s this generation&#x27;s &quot;warm sound&quot;.",1450890871
10784308,comment,10783711,10784180,0,0,ryporter,,,"According to the article, employees had the opportunity to sell their &quot;worthless&quot; shares for $3/share.",1450890856
10784307,comment,10783711,10783779,0,0,pinewurst,,,"Also can you imagine being an employee at that meeting?<p>Not only are your share values decimated (literally), you&#x27;re now working for walking dead BlackBerry assuming you&#x27;re not soon laid-off.",1450890847
10784306,comment,10784016,10784016,0,0,ruraljuror,,,"I used How to Think Like a Computer Scientist[1] in conjunction with MIT&#x27;s OCW class for non-cs majors. I only did the assigned reading from the class, so I didn&#x27;t read it straight through, but I think it might be worth checking out. That class is awesome. It is what I would recommend, but I was pretty motivated.<p>[1] <a href=""http://www.greenteapress.com/thinkpython/html/index.html"" rel=""nofollow"">http://www.greenteapress.com/thinkpython/html/index.html</a><p>[2]\n<a href=""http://ocw.mit.edu/courses/electrical-engineering-and-computer-science/6-00sc-introduction-to-computer-science-and-programming-spring-2011/Syllabus/"" rel=""nofollow"">http://ocw.mit.edu/courses/electrical-engineering-and-comput...</a>",1450890805
10784305,story,,,1,0,nathyloo,"Looking for alpha users for a web app that automatically generates web pages",,"Hi, \nWe created Tylio, a web application to generate Smart Pages, auto-designed and self-constructed by our patent-pending technology. \nThe app will be released in alpha mode within 5 weeks and we need alpha users to provide valuable feedback. \nWhere should we look for them? We are already on Betalist. Any other path we should follow? \nThanks for your advice!\nhttps://www.tylio.com",1450890789
10784304,comment,10784089,10784089,0,0,leephillips,,,"I often feel that the American programmer would profit more from learning, say, Latin than from learning yet another programming language.\n-- Edsger Dijkstra \n<a href=""https://www.cs.utexas.edu/users/EWD/transcriptions/EWD06xx/EWD611.html"" rel=""nofollow"">https://www.cs.utexas.edu/users/EWD/transcriptions/EWD06xx/E...</a>",1450890771
10784303,comment,10781205,10782621,0,0,swalsh,,,"In the US probably fear of invoices",1450890751
10784302,story,,,2,0,thinkdevcode,"TDD is hard when you dont know why youre using it",http://dextermiguel.com/2015/12/18/tdd-is-hard/,,1450890743
10784301,comment,10776019,10782648,0,0,joshvm,,,"Anyone care to elaborate on the downvote? Given that the parent seemed surprised that it was possible to factorise a &#x27;big&#x27; number quickly on a modern PC, I thought I&#x27;d elaborate.<p>Brute force search is O(N), the sieve of Eratosthenes is O(N log(log(N))). The Quadratic sieve is good up to 100 digits and runs in O(exp(sqrt(log n log log n))). Some utilities you can use for this are YAFU, MSIEVE or GGNFS.",1450890734
10784300,comment,10784089,10784089,0,0,littletimmy,,,"Buy a fiddle. Learn to play it.<p>Seriously. You just got off work, and you want to go back into learning more tech? You do know about the breadth of human experience right? Unplug, read a good book, watch movies, learn to cook Indian food, go skiing...<p>How vulgar is a life that must be productive at all times.",1450890734
10784299,comment,10784089,10784089,0,0,OldSchoolJohnny,,,"I would suggest you do something much more comprehensive and do this:\n<a href=""https://www.coursera.org/learn/learning-how-to-learn"" rel=""nofollow"">https://www.coursera.org/learn/learning-how-to-learn</a><p>I&#x27;ve never taken any course that was more useful and a lot of other people feel the same way.",1450890727
10784297,comment,10773524,10779872,0,0,geocar,,,"You may find this difficult to believe, but this approach helps me find bugs and repetition.<p>I have noticed every page I scroll causes a comprehensive loss of around 90%, so in reading something that is 10 pagefuls long, I might only be able to produce a tiny part of the program.<p>Your milage may vary.<p>I find not scrolling, and just moving my eyes, I rapidly absorb the program, and I find most bugs just by reading the code. This practice is absolutely impossible for me if I have to scroll very far and made difficult by scrolling at all.<p>I do not know how to do this except to write horizontally.",1450890709
10784296,comment,10771539,10780918,0,0,ixtli,,,"Please correct me if I&#x27;m wrong, but the guidelines only seem to state:<p>> Be civil. Don&#x27;t say things you wouldn&#x27;t say in a face-to-face conversation. Avoid gratuitous negativity.<p>I guess this is the point where we&#x27;d be arguing about taste, but it seems to me that while textfile&#x27;s comment was clearly negative, it was well constructed and well thought out. Not to mention it was in the _exact_ same tone as the article he&#x27;d written years ago that the conversation was about. In this case we should be very careful not to immediately jump on people being upset or negative. It&#x27;s a powerful tool that, in this case, is being used wisely. I think a bruised sensibility here and there is a worthwhile risk in the name of maintaining a network like HN that accepts dissent and spirited disagreement.<p>As a slight tangent, in reading the guidelines I found that more than an attempt to tone-police, they are an attempt to lower the noise:signal ratio. The reason I feel that this discussion is important is because it&#x27;s the reply, not textfile&#x27;s response, that adds noise to the discussion even if you feel targeted by the authors response.",1450890684
10784295,comment,10775969,10783971,0,0,mariodiana,,,"No, I think you are right. My understanding is that Swift is supposed to scale down, as you say, and performance there is critical. I was considering things from the point of view of higher level programming. Thanks.",1450890683
10784294,comment,10783986,10783986,0,0,A3mercury,,,"Php with Laravel. It&#x27;s easy to get up and running and the MVC framework keeps everything nice and organized. Eloquent queries are a tad weird to get use to but it cuts back on heavy looking query statements. Plus you&#x27;ll get to use php7!<p><a href=""https://laravel.com"" rel=""nofollow"">https://laravel.com</a>",1450890678
10784293,story,,,1,0,sdf_pubnix,"Japanese synthesizer music on a wax cylinder",https://www.youtube.com/watch?v=WHzK3_deuuE,,1450890673
10784292,comment,10782855,10784183,0,0,Avshalom,,,"&quot;the only people&quot; implies that non-lispers is a category that is not equal to &quot;almost everyone&quot;",1450890646
10784291,comment,10783434,10784131,0,0,fndrplayer13,,,"This is exactly what I thought while reading this. I don&#x27;t think todays consumers care about that stuff. I think maybe they did somewhat more when we all had the original iPods or napster or whatever, but those days are long since past. I think these days most consumers are back to focusing on the picture and audio quality without regard to &quot;geeky&quot; numbers. I&#x27;m an engineer who has spent quite a bit of time dealing with video encoding in my career, and to be honest, I&#x27;ve never really bothered looking much into what Netflix, Google Play, iTunes, etc send my way. Thats because the quality is always good enough.",1450890645
10784290,comment,10784089,10784089,0,0,dustingetz,,,"React, React Native,\nClojureScript<p>HaskellBook.com",1450890644
10784289,comment,10777087,10777087,0,0,traviswebb,,,"FYI, Another HN post linked to the same thread a few days ago: <a href=""https://news.ycombinator.com/item?id=10755557"" rel=""nofollow"">https://news.ycombinator.com/item?id=10755557</a>",1450890604
10784288,comment,10784089,10784243,0,0,Hortinstein,,,"> 1. Learn the basics of how to architect a small distributed system that is fault tolerant, resilient and reliable. You can&#x27;t learn it all in 11 days, but man you can make a big dent and it is to me one of the most fun and challenging problems to solve.<p>There was a great tutorial for something like this that google published last month using kubernetes and docker that involves setting up several minecraft servers in a cluster.  Would be a great into to docker/kubernetes<p><a href=""http://googlecloudplatform.blogspot.com/2015/11/containerizing-in-the-real-world-of-Minecraft.html"" rel=""nofollow"">http://googlecloudplatform.blogspot.com/2015/11/containerizi...</a>",1450890595
10784287,comment,10783711,10784237,0,0,Avshalom,,,"A few hundred grand net absolutely is real wealth. To anybody really. But how many people are seeing a few hundred grand after-taxes (after taxes!)?",1450890580
10784286,story,,,5,0,soci,"How the US Gov Legally Stole Millions from Kim Dotcom",https://www.techdirt.com/articles/20150326/18041530458/how-us-government-legally-stole-millions-kim-dotcom.shtml,,1450890570
10784285,comment,10784089,10784263,0,0,grinich,,,"Sounds cool-- what are you reading?",1450890563
10784284,comment,10784089,10784089,0,0,ReadEvalPost,,,"I&#x27;m in a similar situation and I&#x27;m planning on dominating in Stockfighter during that time :-)",1450890559
10784283,comment,10771567,10782076,0,0,jandrese,,,"I hate when the salesguys are then put off because you made them go through the apparently difficult process of generating a quote and then didn&#x27;t buy their product.<p>If you had given me even a ballpark price up front I wouldn&#x27;t have wasted your salesman&#x27;s time!",1450890531
10784282,comment,10772141,10783196,0,0,melted,,,"Turd of a language, but very popular.",1450890502
10784281,comment,10782942,10782942,0,0,lectrick,,,"Can we get around provider monopoly fees with some sort of new wireless option? perhaps a new cell provider that isn&#x27;t actually a cell provider, it&#x27;s just a wireless data pipe provider that calls itself a cell provider to fit within the existing FCC regulatory scheme (and to easily switch to it from existing cellphones?) Could that be a startup?",1450890495
10784280,comment,10783199,10784128,0,0,pc86,,,"> <i>But don&#x27;t you think the wildlife are equally important?</i><p>The implicit end of that sentence is &quot;equally important to the hundreds of millions of Africans living there.&quot; And to that, emphatically no.<p>People are more important. Full stop. I am no anti-environmental activist. I want to see renewable energy take over fossil fuels, I want to see conscientious business taking environmental factors into account at all steps of production. But given the 100% false dichotomy of &quot;African development&quot; or &quot;animals&quot; I am going to pick the one that helps one of the most impoverished, war-torn regions on the planet every time.",1450890482
10784279,comment,10774752,10782253,0,0,grandalf,,,"> Nor should they<p>Of course not as the only criterion.  But the messages in question were not spam, they were legitimate emails with DKIM, Domainkeys, SPF, long term non-spam IP address, etc.",1450890478
10784278,comment,10783711,10784174,0,0,hkmurakami,,,"Not exactly true since select bigcos pay quite well these days.",1450890458
10784277,comment,10783711,10783711,0,0,dsugarman,,,"I imagine this is going to be a lot worse now with unicorn craze.  It seems like to some, any liquidation terms were acceptable to get to the $1b valuation mark.",1450890452
10784276,comment,10781731,10784212,0,0,ikeboy,,,"You&#x27;re going to need more citations to make a claim like that. Which specific part of the ruling do you disagree with on legal grounds, and cite the relevant laws/treaties/precedent etc.",1450890447
10784275,comment,10781646,10781646,0,0,whateveracct,,,"scalaz-stream does all this and way more and way better while actually being &quot;composable&quot;",1450890423
10784274,comment,10784089,10784232,0,0,Hortinstein,,,"do you have any good intro tutorials?<p>A chatbot that could receive pictures and describe them back would be pretty cool!",1450890423
10784273,comment,10783711,10784174,0,0,ajsharma,,,"Wealthfront article mentioned (i think) <a href=""https://blog.wealthfront.com/college-vs-retirement-savings-silicon-valley/"" rel=""nofollow"">https://blog.wealthfront.com/college-vs-retirement-savings-s...</a>",1450890386
10784272,comment,10783711,10784155,0,0,mathgeek,,,"Interesting. In what ways? Enron was a public company that committed fraud.",1450890380
10784271,comment,10783711,10783711,0,0,sbov,,,"Ultimately the problem seems to be preferred shares driving the valuation of common shares.  They obviously aren&#x27;t the same, so I don&#x27;t know why it happens.  I&#x27;m not a lawyer so I don&#x27;t know if there&#x27;s a way around this.",1450890371
10784270,comment,10780939,10781629,0,0,dingaling,,,"Launch abort locations for Shuttle launches from Canaveral included Shannon in Ireland and the Azores off Spain.  Both would seem ideal for recovery of eastbound first stages.",1450890360
10784269,comment,10783219,10783760,0,0,MuEta,,,"I can see that being an issue. I&#x27;m in the same habit with LOTR, ASOIAF and Harry Potter, reading each series once every two years or so, and it crushes my ability to read a lot of new books. I&#x27;ve avoided rereading Discworld so far because I know that it will never be as magical as the first read through.<p>But oh god, Baroque Cycle was unparalleled from a character-building perspective. I loved every second of it.",1450890357
10784267,comment,10784221,10784223,0,0,leephillips,,,"Directly addressed in the article.",1450890342
10784266,comment,10784089,10784168,0,0,Hortinstein,,,"would you mind elaborating what your use case for docker was and how otto may have replaced it?",1450890336
10784265,story,,,1,0,marcacyr,"Using Ideas from Domain Design/Architecture in JS",https://medium.com/@marcacyr/domain-architecture-software-engineering-23a0510ebdf#.9vz3c9nkn,,1450890335
10784264,comment,10782855,10783468,0,0,nbardy,,,"When I first started writing Lisp I was put off by how simple the syntax was. Everything looks the same and it was so hard to tells things apart. After working with Lisp for a long enough time I began to love the simplicity. Everything is so simple, nothing gets in the way of reading code.",1450890326
10784263,comment,10784089,10784089,0,0,veddox,,,"How about Ancient Greek? No kidding - that&#x27;s what I&#x27;m working on this break.",1450890311
10784262,comment,10783199,10783684,0,0,Symmetry,,,"Africa has actually been averaging over 5% growth for the last decade too, which was indeed quite a change and really nice.",1450890306
10784261,story,,,2,0,drewvolpe,"Microsoft Wins ImageNet 2015 with a 150-Layer Neural Network",http://people.idsia.ch/~juergen/microsoft-wins-imagenet-through-feedforward-LSTM-without-gates.html,,1450890294
10784260,comment,10781646,10784042,0,0,samuell,,,"Btw, I should also give a shoutout to Vladimir Vivien&#x27;s Automi library, also posted on the GopherAcademy blog some days ago: <a href=""https://blog.gopheracademy.com/advent-2015/automi-stream-processing-over-go-channels"" rel=""nofollow"">https://blog.gopheracademy.com/advent-2015/automi-stream-pro...</a><p>It takes an interesting, slightly different approach, in my view especially for slightly lower-level operations compared to the &quot;scipipe&quot; pattern above. For example, it looks like something I&#x27;d use for implementing the internals of components in my pattern.",1450890294
10784259,comment,10782819,10783778,0,0,jandrese,,,"Looks like they also snagged homedespot.com.",1450890253
10784258,comment,10784089,10784122,0,0,lsiunsuex,,,"i have been kicking around an idea for the last 2 months; it&#x27;s been on hold due to time constraints (day job / my own side project thats been going on for 4 years now / freelance)<p>got it to the point where i bought a domain, setup the server and laid out the layout / initial feature set.<p>I could definitely build it in 2-3 days if i sat down and focused.",1450890248
10784257,comment,10771169,10780844,0,0,wycx,,,"7&quot; 4:3 monochrome CRT screens; membrane keyboard covers; 286 in a desktop case on its side on the floor, gummed up with spilled soda...",1450890247
10784256,comment,10783199,10783671,0,0,dangerpowpow,,,"GDP should be depreciated.",1450890242
10784255,comment,10783711,10783711,0,0,jerf,,,"Is there some other industry where, when a company stumbles, its employees don&#x27;t get hurt? I live in Michigan, and when the car industry &quot;stumbled&quot; everyone I locally know at least knew someone who got hit, at the <i>very very</i> least with long-term stagnant wages even as their responsibilities amped up to cover the missing people, and they were the ones who came out relatively unscathed.<p>I mean, the details of the article are all fine and dandy and interesting (no sarcasm, there&#x27;s nothing wrong with the facts and they&#x27;re at least worth a story), but the headline and framing seem to imply that there&#x27;s some sort of alternative?<p>The only problem unique to the tech-unicorns here is exercising stock options when you can&#x27;t pay for the taxes. Don&#x27;t do that.",1450890240
10784254,comment,10784089,10784140,0,0,Hortinstein,,,"yeah, this has been at the top of my list.  I found a good tutorial a while back I have been meaning to go through showing how to build a character voting app (inspired by facesmash) for EVE Online characters.<p>It shows how to build a full stack app using React,Flux,Mongo,Node,Socket.io<p><a href=""http://sahatyalkabov.com/create-a-character-voting-app-using-react-nodejs-mongodb-and-socketio/"" rel=""nofollow"">http://sahatyalkabov.com/create-a-character-voting-app-using...</a>",1450890238
10784253,comment,10782118,10784211,0,0,mgamache,,,"you are correct. Airports are just the testing ground, body scanners will be in use in many venues in the near future. I suspect that cost is the only barrier currently.",1450890229
10784252,comment,10782942,10784049,0,0,njorth,,,"Broadband access is very much a freedom thing if Comcast is your only option.<p>I live in one of America&#x27;s wealthiest cities and the undisputed tech capital of the east coast, yet finding a decent ISP is difficult bordering on impossible.<p>There&#x27;s exactly one good ISP in my city called netBlazr, but they don&#x27;t service my neighborhood. So we get Comcast instead: bandwidth rates approaching a tenth of advertised speeds, outright throttling for certain services, cheap hardware with limited firmware, ubiquitous surveillance, and no legal recourse at all.<p>Freedom.",1450890169
10784251,comment,10783434,10784206,0,0,SwellJoe,,,"Has that ever happened? I mean, have there been consumer revolts over bit rate that have cost Apple or Amazon customers? Pono and Tidal don&#x27;t seem to be killing the existing players, but perhaps I&#x27;m just not up to speed on the state of the industry.",1450890162
