ID,Type,Story,Parent,Points,Comments,Author,Title,URL,Content,Created
10784509,comment,10780579,10781383,0,0,farzher,,,"We&#x27;re using LÖVE for Pocket Rumble<p>The game supports lag-free rollback netplay using GGPO, and Steam matchmaking with ELO leaderboards<p>And since LÖVE uses lua, mod support is no problem to implement, so we&#x27;ll have steam workshop support too\n(It&#x27;s not released on Steam yet but will be soon!)<p><a href=""https://www.youtube.com/watch?v=EL63nVwisAs"" rel=""nofollow"">https://www.youtube.com/watch?v=EL63nVwisAs</a>",1450892910
10784507,story,,,1,0,CrankyBear,"Security theater comes to CES",http://www.computerworld.com/article/3018076/personal-technology/security-theater-comes-to-ces.html,,1450892883
10784506,comment,10783533,10784138,0,0,nanofortnight,,,"And McDonnell Douglas did a vertical hop of a rocket in 1993 with DC-X.",1450892882
10784505,comment,10783711,10784465,0,0,ditonal,,,"Absolutely not! I do, however, think it&#x27;s extremely questionable when VCs lobby for taxpayer money to fund for-profit bootcamps that they invest in to train people for the skills their companies need. It&#x27;s outsourcing the cost of training to the taxpayer, all while driving up the value of their bootcamp investments. Instead, these companies should drop their &quot;we&#x27;re a poor startup that needs people who can hit the ground running&quot;, and actually train people themselves. These &quot;startups&quot; are funded by extremely well-off VCs who could afford it. They shouldn&#x27;t ask the middle class to pay for it for them.<p>Democrats and VCs have a very tight nit relationship.<p><a href=""http://www.latimes.com/business/technology/la-fi-tn-obamas-100-million-plan-to-boost-hightech-training-hiring-20150309-story.html"" rel=""nofollow"">http://www.latimes.com/business/technology/la-fi-tn-obamas-1...</a><p><a href=""http://www1.nyc.gov/office-of-the-mayor/news/114-15/mayor-bill-de-blasio-nyc-tech-talent-pipeline-industry-partners-commitments-to"" rel=""nofollow"">http://www1.nyc.gov/office-of-the-mayor/news/114-15/mayor-bi...</a>",1450892867
10784503,comment,10781205,10781901,0,0,dragonwriter,,,"> But it&#x27;s only pointing out that Chipotle makes a bit deal about its ingredients and how they are good for you<p>I think its more accurate to say that Chipotle makes a big deal about how its ingredients follow the latest food fashion trends.",1450892841
10784502,comment,10782811,10783826,0,0,eastdakota,,,"Correct. All our customers can disable SHA-1 fallback from our control panel. While a US-based bank, for instance, may decide it&#x27;s better based on their risk assessment to not SHA-1, a Syrian-based refugee organization may reasonably have a different risk assessment and therefore decide to support it.",1450892838
10784501,story,,,1,0,edward,"Nigeria bans credit card use abroad",http://www.bbc.co.uk/news/world-africa-35151347,,1450892832
10784500,comment,10782443,10782881,0,0,Kenp77,,,"Awesome, thank you!",1450892831
10784499,story,,,1,0,DodgyEggplant,"The most viewed business of software talks of all time",http://thebln.com/talk/playlist-the-most-viewed-business-of-software-talks-of-all-time/,,1450892822
10784498,comment,10783711,10784163,0,0,tptacek,,,"Typically, when you leave a company that issued you incentive options, you are forced to execute within 90 days or forfeit the shares entirely.",1450892822
10784497,comment,10780150,10781945,0,0,hobarrera,,,"I&#x27;m still using the old approach, which is adding a local directory as a docker volume, where all my artefacts are stored.<p>nginx then serves them under a unique path.<p>I would very much like to see gitlab offer the ability to get artifacts via some API so I can remove all that hackery.",1450892801
10784496,comment,10783199,10783199,0,0,xiaoma,,,"And it completely leaves out Taiwan. It&#x27;s a developed, democratic country with both a population and PPP GDP on par with Australia.<p>Whatever the political motivations, this is just shoddy scholarship.",1450892791
10784495,comment,10780896,10784320,0,0,toomuchtodo,,,"Who should I be going to in order to have legislation drafted, sponsored, and co-sponsored in the US to prohibit the pursuit of debt that is time-barred (and enforce penalties for attempting to do so)?<p>This is a problem that needs to be fixed. I would like to find someone who is willing to help fix it.",1450892779
10784494,comment,10783711,10784329,0,0,wdewind,,,"> Did it not ring a bell that a company that can&#x27;t give him cash but can instead offer compensation out of thin air in the form of options is in trouble?<p>This is not an accurate heuristic for &quot;how good is a company doing.&quot;  There are many legitimate reasons you&#x27;d want to pay someone in stock instead of cash.<p>> And then there are the golden handcuffs were an employee is scared to leave because their options have too high a fair market value and their tax costs would be considerable.<p>This is definitely something to consider.  If your options agreement allows you to early exercise you can avoid all of the tax penalty and remove the golden handcuffs if you exercise immediately (before you have realized a gain) and file your 83-b with the IRS.  If it doesn&#x27;t allow early exercise you probably don&#x27;t want anything to do with it.<p>> I recommend joining young companies that are willing to pay you a lot of cash for your exceptional ability and experience (execution is critical at this stage across the entire company from engineering to sales) and maybe take it easy on the option grants. Some stock is fun but don&#x27;t count on getting rich on it.<p>I&#x27;d recommend learning as much about business as possible, and consider working at a startup an investment, and you an investor.  If you aren&#x27;t comfortable investing then you shouldn&#x27;t be working in startups.  There is basically no reason to work at a startup if you aren&#x27;t favoring the equity ($, work-life balance, perks etc. are all going to be better at BigCo).",1450892773
10784493,comment,10783711,10784379,0,0,jonas21,,,"> The real unicorn, for an employee, is a middle- to late-stage company which has successfully executed, is growing, and ideally hasn&#x27;t had any formal external valuation events.<p>And, like a real unicorn, it doesn&#x27;t exist. At least not in today&#x27;s funding environment.",1450892743
10784492,comment,10782855,10784310,0,0,commentzorro,,,"This is the ??? (I don&#x27;t know what to describe it as) post here. You took the one sentence I just loved from the article and pooped on it. Then tried to tie it in with details of a non syntax related item and process. Next, you said a two character syntax for describing something as complex as an if statement was somehow too much burden?!<p>Not sure what the future of programming languages is. But if humans are involved I suspect there will be a visual representation. And that means syntax. And that syntax will matter then just as it does now.",1450892739
10784491,story,,,1,4,Gideonnn,"Ask HN: How to show my girlfriend programming is awesome?",,"Hello HN,<p>I have been programming for almost six years now and I&#x27;m almost done with my bachelor&#x27;s degree, so I&#x27;m comfortable programming in a variety of languages.<p>To someone who does not know what programming is, or how it works, it is quite hard to understand what I am going to do for a living for (hopefully) the rest of my life. But my girlfriend asked me to teach her a bit about programming.<p>So right now I am trying to construct some kind of introduction to programming for someone who does not have a technical or mathematical background at all.<p>For me it was using YouTube and books to teach myself, though that does not work for someone who just wants the taste. What should I start with?<p>I was thinking about Python, easy enough to hide some abstraction to start with, and an easy transition between console and the web in case she likes it.<p>Please give me some tips to show the fun side in programming to a total newb!",1450892738
10784490,comment,10783983,10783983,0,0,yankoff,,,"Generating Sequences With Recurrent Neural Networks  \n<a href=""http://arxiv.org/abs/1308.0850"" rel=""nofollow"">http://arxiv.org/abs/1308.0850</a><p>Generating Text with Recurrent Neural Networks  \n<a href=""http://www.cs.utoronto.ca/~ilya/pubs/2011/LANG-RNN.pdf"" rel=""nofollow"">http://www.cs.utoronto.ca/~ilya/pubs/2011/LANG-RNN.pdf</a><p>Bitcoin whitepaper  \n<a href=""https://bitcoin.org/bitcoin.pdf"" rel=""nofollow"">https://bitcoin.org/bitcoin.pdf</a><p>Ethereum paper \n<a href=""http://gavwood.com/Paper.pdf"" rel=""nofollow"">http://gavwood.com/Paper.pdf</a>",1450892732
10784489,comment,10783711,10784272,0,0,TDL,,,"I believe before the collapse Enron&#x27;s management would berate employees who sold stock in their 401-ks.  Management actively mislead their own employees.  I&#x27;ve heard this from a number of sources (including a family friend who left Enron a couple years before the collapse.)  Obviously, take my comment with a grain of salt since it&#x27;s mostly based on anecdote.",1450892732
10784488,comment,10783711,10784451,0,0,Xcelerate,,,"Where can one learn about these?",1450892727
10784487,comment,10783711,10784118,0,0,alttab,,,"To your point though, and to press it further - if companies require that you exercise your options in a window after they vest or they expire - they were never really options to begin with. In essence, the vesting schedule on expiring options is a timeline for you forking over risk-filled cash or forfeit part of your &quot;compensation.&quot;<p>The advice seems to suggest if their options expire if you don&#x27;t buy them at a certain point (except for leaving the company, which makes sense), say no and ask for cash. If they can&#x27;t pay, now you know where you really stand.",1450892715
10784486,comment,10784089,10784089,0,0,bluedino,,,"What do you want to make? Make that. Don&#x27;t learn another language just for the sake of learning one.<p>For example, o you only know Objective C and want to make a web app? Then learn a web programming stack.",1450892698
10784485,comment,10783711,10784180,0,0,rlucas,,,"> Tech employees need to wake up about common vs preferred shares, and that the former are worthless.\n> ...\n> They are worthless because they are designed, as a financial instrument, to be fake equity with no real protection from dilution and liquidation preference.<p>You&#x27;ve muddled orthogonal concepts together here.<p>1. Common shares are <i>not</i> worthless.  In general, just ask any founder who&#x27;s had a successful exit.  Founder shares (unless purchased along side financial investors for hard cash) are always common shares; if your straw man were correct, then there would be no wealthy founders.<p>2. Liquidation preference is a negotiated term which <i>does</i> have a rational basis for existing.  Whenever you&#x27;re putting in a larger proportion of the company&#x27;s cash than the ownership you&#x27;re buying, it is crucial to have protection against someone essentially liquidating the company for the cash.  Say investor X is putting in $8 into a company that has $2 in the bank, but X is only buying 10% of the company.  If the company is liquidated for that $10 tomorrow, X gets back $1 and the common stockholders get $9.  (There are other protections against a perverse liquidation incentive, too, but this is the economic one.)<p>3. The &quot;real protection&quot; from dilution is raising reasonable tranches of capital at a monotonically increasing series of valuations, which valuations actually correspond to a clearing price between bid and ask.  Three key items here: &quot;reasonable tranche,&quot; &quot;monotonically increasing,&quot; and &quot;clearing price.&quot;<p>a. Reasonable tranche: raise reasonable sized rounds, because huge rounds create weirdness (lopsided power, outsized compensatory &quot;asks&quot; by investors, etc.).<p>b. Monotonically increasing: needless to say, down rounds are the big dilution problems.  Sometimes they happen because life isn&#x27;t perfect and problems come up.  Sometimes they happen because the company screwed up and raised too much at too high a valuation previously.<p>c. Clearing price: if the company and investor actually agree on the &quot;true&quot; valuation then it&#x27;s easy.  If they still try to force a deal where the company wants a crazy &quot;optical&quot; valuation that the investor doesn&#x27;t really see, then you&#x27;ll get layering-on of sweeteners to make the effective valuation much much lower than the notional, but all kinds of terrible side effects may accrue.",1450892698
10784484,comment,10781830,10783563,0,0,rodionos,,,"I like analytics if the price is less than 50ms per request. We use GA and statcounter for analytics anyways. Charts that show how much static traffic you saved are nice, but with bandwidth close to free, it&#x27;s not a big deal. CDN analytics need to be better than GA at which point I will not only trade off latency but convert to premium all the way.",1450892693
10784483,comment,10783533,10784245,0,0,gfodor,,,"The point was that the measurement is what it can impart on a payload (presumably one going UP.) So your point doesn&#x27;t seem relevant.",1450892685
10784482,story,,,1,0,afridi,"Which states do Product Hunt makers live in?",https://medium.com/p/a12e338df1b4,,1450892681
10784481,comment,10780579,10783240,0,0,talles,,,"That&#x27;s some invaluable info. Thanks!",1450892655
10784480,comment,10782811,10782926,0,0,kuschku,,,"Also, pre-Gingerbread was abandoned by everyone nowadays.<p>Even Gingerbread has been abandoned in the last 18 months.",1450892643
10784479,comment,10780939,10781788,0,0,skykooler,,,"It would probably use much less fuel to boost the trajectory to land in Florida than to turn around and fly back to Texas.",1450892624
10784478,comment,10783305,10783890,0,0,daveloyall,,,"In March 2013, in Boston, Mr. Moglen publicly blamed the ever-receding launch date of the FreedomBox on a fire at the dev&#x27;s house.<p>Or something like that.  I wasn&#x27;t really paying attention!<p>The whole thing sounded like vaporware, and I hadn&#x27;t yet heard him speak about matters of privacy law and software freedom--topics on which he is on far better footing!",1450892623
10784477,comment,10782855,10784310,0,0,pjc50,,,"Writing is approximately five thousand years old. Symbolic algebra is about a thousand. Text will be with us for our lifetimes.",1450892615
10784476,comment,10781205,10782923,0,0,dragonwriter,,,"The impression you got is, well, somewhat distorted. While 48 million are estimated to get sick from foodborne diseases annually, only 128,000 are hospitalized [0]; while the ratio between 513 sick in the Chipotle outbreaks to the 48 million annual sick from food borne diseases is miniscule (on the order of 1 in 100,000), the ratio between even the 20 hospitalized (of 53 sick) in the <i>E. coli</i> outbreaks in the whole set of Chipotle outbreaks to the 128,000 hospitalized annually from foodborne diseases is (while still small, by itself) a lot bigger than the ratio of the Chipotle-sick to the annual total sick (1 in 6,000 instead of 1 in 100,000).<p>(Also, the annual total sick-from-foodborne-illness count is an <i>estimate</i>, the sick-from-the-Chipotle-outbreak count is <i>confirmed</i>.)<p>[0] <a href=""http://www.cdc.gov/foodsafety/foodborne-germs.html"" rel=""nofollow"">http://www.cdc.gov/foodsafety/foodborne-germs.html</a>",1450892613
10784475,comment,10782897,10783077,0,0,nickpsecurity,,,"&quot;and everything offers Ubuntu debs&quot;<p>This, great hardware support, and decent stability are the main reason I use Debian-based distros. Almost anything is a deb away.",1450892583
10784474,comment,10782855,10784310,0,0,bmm6o,,,"To be fair, Dr Dobbs&#x27; audience is working engineers, not PL researchers, and even researchers haven&#x27;t had much success in non-text languages.",1450892578
10784472,comment,10782969,10784441,0,0,StavrosK,,,"Just write the next thing in Python 3, there&#x27;s not really that much to learn right away as much as there are minor surprises that you can very quickly get up to speed on as you encounter them.",1450892559
10784470,comment,10783199,10784256,0,0,headsupftw,,,Deprecated?,1450892507
10784469,comment,10782969,10784422,0,0,StavrosK,,,"Huh, voluptuous looks pretty much exactly the same as schema. Or at least a subset of it, as it doesn&#x27;t have And/Or/Use, as far as I can see.",1450892488
10784468,comment,10783533,10784138,0,0,schwap,,,"Uh, Grasshopper went < .5 miles up, Blue Origin went <i>into space</i>.",1450892447
10784467,comment,10783199,10784361,0,0,RhodesianHunter,,,"No we aren&#x27;t. Birth rates slow to replacement levels or lower in first world countries. Look at Japan, or the US and Germany which are only growing due to immigration.",1450892434
10784466,comment,10782811,10783847,0,0,codezero,,,"I haven&#x27;t done a survey, but at a previous startup it was 24 months, though you could get a new one after 12 months with approval from a manager that would basically always be approved if you asked.<p>At my current company there&#x27;s no policy, but every new hire is given a new MacBook Pro.<p>Given the normal costs of employing someone, a new laptop every year is a tiny fraction of the overall compensation so in general, it should be a non issue.",1450892411
10784465,comment,10783711,10784180,0,0,woah,,,"Most of this seems like a reasonable comment, but are you actually angry that people are learning to code?",1450892400
10784464,comment,10783711,10784308,0,0,dradbdgj,,,"Throwaway account, reporting on the secondary market!<p>Companies will often do everything in their power, including running roughshod over their contractural and legal obligations, to prevent employees from selling stock on the secondary market. If they&#x27;re not total jerks, they will encourage you to participate in &quot;internal buybacks&quot;. Unfortunately, these buybacks are run as a service for investors, presenting them massively undervalued in exchange for loyalty.<p>Regulators have just begun to take interest in the abuse of transfer agency by privately-held companies distributing shares in lieu of compensation. Similar attention should be paid to the information provided to prospective employees at the time of hire, when the decision to accept stock in lieu of cash is made.",1450892400
10784463,comment,10782969,10784403,0,0,StavrosK,,,"I see what you mean, but it&#x27;s the key that&#x27;s optional, not the value.",1450892380
10784462,story,,,26,1,aerialcombat,"Show HN: My friend made this game all by himself in a year",http://forums.toucharcade.com/showthread.php?t=278299&page=2,,1450892376
10784461,comment,10782969,10784207,0,0,sandGorgon,,,"Yes - unfortunately I have and I failed miserably.\nThese days I&#x27;m trying to see if there&#x27;s a docker build that can build a great numpy (with all optimizations). Interestingly there are even docker images to call cuda APIs from python.",1450892372
10784460,comment,10783071,10783071,0,0,GizaDog,,,"Really sad to see media trying to make UAV&#x27;s look bad. Instead of investigating why it happened they just want to ban them.<p>Governments can use real drones to kill people and still allowed to continue the death and destruction.<p>People need to get some perceptive here. I&#x27;ve been flying over 11 years and not one issue ever!",1450892369
10784459,comment,10774865,10778109,0,0,simonh,,,"Opening up space to new markets must be an essential component of their strategy. If they charged say 90% of the cost for non-reusable launches but their rockets were reusable, they would only need to manufacture a dozen or so vehicles, plus a few a year as replacements. To maintain economies if scale in their factory, they need to have a sustained production line and that means at even a steady pace, with high re usability they will soon be awash with rockets. They will have to bring prices down just to keep their fleet operating.",1450892358
10784458,comment,10783983,10783983,0,0,ipunchghosts,,,"&quot;Development and Validation of a Biomarker for Diarrhea-Predominant Irritable Bowel Syndrome in Human Subjects&quot;<p><a href=""http://journals.plos.org/plosone/article?id=10.1371/journal.pone.0126438"" rel=""nofollow"">http://journals.plos.org/plosone/article?id=10.1371/journal....</a><p>Large cohort study done determining what the biological mechanism are of IBS (irritable bowel syndrome).<p>Defines a new test, IBSChek which can be used to determine if a patient has a subtype of IBS.  Anyone can get this test done now.",1450892357
10784457,story,,,1,0,masonicb00m,"Browser tabs support BFS; what about DFS?",https://medium.com/@masonicboom/a-better-back-button-for-the-web-ab067244a1a1,,1450892347
10784456,comment,10782920,10783913,0,0,Hortinstein,,,"I had never heard of this show, after looking at the reviews, it might be my christmas binge watch. Hope to see a Feynman cameo at some point!",1450892345
10784455,comment,10782443,10782443,0,0,petegrif,,,"Apparently forgot to pay his service provider.",1450892329
10784454,comment,10783711,10783711,0,0,willyk,,,"For those interested in this topic, I suggest reading &#x27;Venture Deals&#x27; by Brad Feld. While it&#x27;s broader than this topic, it does cover some of the legal/technical elements of vc funding and exits, which help when trying to understand outcomes such as this (i.e., preferred vs common shares, etc).\n<a href=""http://www.amazon.com/Venture-Deals-Smarter-Lawyer-Capitalist/dp/1118443616"" rel=""nofollow"">http://www.amazon.com/Venture-Deals-Smarter-Lawyer-Capitalis...</a>",1450892321
10784452,comment,10782879,10782879,0,0,brudgers,,,"Related: <a href=""https://eng.lyft.com/automated-style-review-with-linty-fresh-17c6cd9d2c3b#.aaht2yybt"" rel=""nofollow"">https://eng.lyft.com/automated-style-review-with-linty-fresh...</a>",1450892309
10784451,comment,10783711,10784180,0,0,nissimk,,,"Information asymetry is the way people get screwed over in financial transactions.  Most potential startup employees have no idea what common or preferred shares are.  Let alone all of the other details like dilution, liquidation preference, tax implications of employee stock options and lack of liquidity in private securities.  Potential startup employees should learn about these things and understand how to protect themselves.  I&#x27;m sure the startups prefer to hire sheeple.",1450892308
10784450,comment,10783533,10783533,0,0,nanofortnight,,,"A more apt comparison is this: A single SpaceX F9 rocket can lift <i>three</i> Blue Origin New Shepards <i>into orbit</i> at 200km altitude (vs merely touching space at 100km) and then <i>come back to land</i>.",1450892297
10784449,comment,10784089,10784089,0,0,Fuxy,,,"I&#x27;m in a similar boat as you and my list this year is is Docker, gitlab-ci documentation and getting started on a personal project I want to do.<p>Mostly docker and gitlab-ci is on the list because I want to use them in development.",1450892294
10784448,comment,10782762,10783705,0,0,zenogais,,,"They rediscovered what Nietzsche wrote about 100+ years ago. High-ranking individuals in any society cooperate with each other more readily than with lower ranked individuals (The Gay Science, Book 1 Aphorism 13 - and many others)",1450892286
10784447,comment,10782942,10784133,0,0,cinquemb,,,"I don&#x27;t see why they just cant keep subverting encryption through all the usual suspects (vulns, social engineering, etc…). The whole encryption debate just seems like silly posturing on the part of company/ngo&#x27;s officials and governments… especially since all of the aforementioned still want to use their shiny new tech products.",1450892258
10784446,comment,10783711,10784430,0,0,S4M,,,">  And, usually they were acquired by other investors&#x27; or board members&#x27; companies (at a loss).<p>Holy shit is that even legal? It seems like a giant conflict of interest.",1450892253
10784445,comment,10782762,10784176,0,0,Torgo,,,"<a href=""https://en.wikipedia.org/wiki/The_Tyranny_of_Structurelessness"" rel=""nofollow"">https://en.wikipedia.org/wiki/The_Tyranny_of_Structurelessne...</a><p>From a feminist perspective some complaints are that lack of structure creates a vacuum in which sociopaths and bullies can run free. Also it doesn&#x27;t have the capacity to enact top-down diagnostic and corrective action to combat institutional or otherwise widespread behavior deficits (for example discrminatory or sexist attitudes.)",1450892253
10784444,comment,10784044,10784044,0,0,johansch,,,"Apple has a very weak service portfolio (edit: for a company of their stature. When compared to e.g. Yahoo they are doing great!). Their strength is in client UX. Of course they will defend encryption, it&#x27;s in their financial interest do so.",1450892239
10784443,comment,10774432,10775554,0,0,kuschku,,,"Btw, I’ll suggest the movie &quot;Das Leben der Anderen&quot;.<p>Even today in German schools the GDR and the Nazi time are some of the most important topics in history class, including us visiting the places, talking to eye witnesses, etc.<p>That leaves quite an impression.",1450892238
10784442,comment,10768792,10774302,0,0,pasbesoin,,,"Thank you for that suggestion.  :-)",1450892235
10784441,comment,10782969,10782969,0,0,krylon,,,"I haven&#x27;t used Python in a while, but I shall once more look into it. Python was always fun.  Guess I&#x27;ll do that over christmas, see where it takes me.<p>I might even get around to learning Python 3 after only ... what? seven-or-so years?",1450892233
