ID,Type,Story,Parent,Points,Comments,Author,Title,URL,Content,Created
10784569,comment,10781610,10783137,0,0,norswap,,,"That&#x27;s certainly the legal doctrine. Personally, I don&#x27;t happen to agree with it.",1450893570
10784568,comment,10783711,10784180,0,0,ThrustVectoring,,,"I see basically two kinds of equity compensation.<p>The first is &quot;what the founders have, but less of it.&quot; It&#x27;s very difficult for the founders to make a boatload of money off the company without also compensating you. These have some sort of value - if the founders want to make $10MM off it, you&#x27;re getting something like $100K.<p>The second is everything else. There&#x27;s an obvious incentive to screw over the &quot;founders don&#x27;t have this&quot; class of equity, so I value these at zero. This includes the vast majority of stock options.",1450893567
10784567,comment,10782942,10783646,0,0,jabgrabdthrow,,,"Oddly those are my two of my three go-to examples of government intervention fucking the consumer...",1450893546
10784566,comment,10782263,10784045,0,0,harryh,,,"1 & 2 have almost nothing to do with it.<p>Most prisoners are in jail for violent offenses that have been crimes for most of human history.",1450893541
10784565,comment,10782762,10783408,0,0,nhaehnle,,,"Make that 100% of the American (or really any state&#x27;s) public. Do you think your life would just go on without any troubles at all if government suddenly disappeared?<p>I guess what I&#x27;m trying to say is that <i>everybody</i>[0] depends on the social structures around them (which includes the government). It&#x27;s just that for whatever reasons, often pretty arbitrary ones, there is a consensus narrative which labels some of those dependencies as &quot;bad&quot; and others as &quot;good&quot; (or &quot;normal&quot;). Then people invent lots of after-the-fact rationalizations and categories to try to ignore the &quot;good&quot; dependencies and focus only on the &quot;bad&quot; ones.<p>[0] There may be some persons out in the woods who live in a cabin they built using their bare hands, with only the tools that they built themselves, without using oil-based fuels or something like the weather forecast. I&#x27;d say it&#x27;s safe to ignore those persons for the purpose of this discussion, if they even exist.",1450893527
10784564,comment,10782855,10784183,0,0,munificent,,,"> The only people who refer to it as parens hell seem to be non-lispers.<p>Confirmation bias.",1450893520
10784563,comment,10782942,10784447,0,0,pdkl95,,,"Why? Because <i>this isn&#x27;t just about encryption!</i> Crypto is just the current attack strategy.<p>Technology <i>in general</i> has moved a lot of power away from government to the big players in the tech industry. An easy example is the somewhat-recent articles[1] about the <i>political power</i> that Facebook has with their ability to influence people... and influence elections. Obviously, Google could do the same.<p>This shift in power is what scares people who&#x27;s only goal is to be re-elected. Therefor, they see internet corporations like Facebook and Google - and by extension most of the tech industry to varying degrees - as the <i>enemy</i>.<p>[1] <a href=""http://www.bloomberg.com/politics/articles/2014-11-04/how-facebook-hopes-to-influence-the-election"" rel=""nofollow"">http://www.bloomberg.com/politics/articles/2014-11-04/how-fa...</a>",1450893492
10784562,comment,10783533,10784117,0,0,Trisell,,,"You can continue to down vote me, but none of these examples went into &#x27;space&#x27;. Also I reiterate my point, that the average person is not going to know or care that grasshopper went up and down 2440 ft in 2013. Or that others had a rocket that went up a few hundred feet and then landed in 1993. They will remember that Blue Origin just did this and that SpaceX did it second.",1450893482
10784561,comment,10781610,10782917,0,0,dsp1234,,,"When looking at the emails from both cases, have you taken into account that the adversarial nature of the Viacom vs YouTube vs non-adversarial nature of the emails from the MegaUpload case?<p>Specifically, emails from the YouTube case are available from both sides (emails that show YouTube in a good light presented by YouTube, and emails that show YouTube in a negative light presented by Viacom), but in the MegaUpload case the only emails are from the indictment (and thus are likely to be hand picked for the purposes of helping secure the indictment).",1450893465
10784560,comment,10784462,10784462,0,0,minimaxir,,,"25 upvotes in 17 minutes?<p>Don&#x27;t ask friends for upvotes.",1450893450
10784559,comment,10771169,10781008,0,0,wallyhs,,,"We use an iPad based SASS POS, and editing the menu is a pain. Every time I start to edit something, I have to wait 60 seconds while it pulls in the list of <i>every</i> item on the menu. If I want to edit five specific menu items, I don&#x27;t want to wait for the entire list of items to load five times. Updating prices or costs on our menu literally takes three of us an entire day to pull off. We&#x27;ve been meaning to clean out some discontinued items from the menu, but... that would take three of us an entire day to do.<p>We do retail alcohol in addition to restaurant food, so we have a lot of items on our menu. I don&#x27;t like how the menu is organized, but it would be too slow and painful to reorganize at this point.<p>I would kill for an API so that I could make mass numbers of menu edits by script. I would require some sort of a testing environment for that, though.",1450893444
10784558,comment,10784089,10784089,0,0,willyk,,,"Given your skillset, I&#x27;d pick React over Scala or Docker. If you&#x27;re into PHP/Wordpress, you could also look at Drupal 8, which was just released. Given your CSS/JSS/Angular skills, you could also look at Meteor for apps.<p>All that said, from a blank slate perspective, I&#x27;d suggest learning Phoenix (<a href=""http://www.phoenixframework.org"" rel=""nofollow"">http://www.phoenixframework.org</a>), and in turn Elixir. Phoenix is great framework for building moderns apps, in that it&#x27;s open source, database & frontend agnostic, leveraging the battle-tested Erlang VM, highly scaleable (WhatApp built w/Erlang), and real-time (via Channels). Good overview video here: <a href=""https://vimeo.com/131633172"" rel=""nofollow"">https://vimeo.com/131633172</a>",1450893444
10784557,comment,10778773,10780879,0,0,taejo,,,"bcrypt and HMAC fill different roles and have different security properties: bcrypt is a key-derivation function, and HMAC is a message authentication code. They&#x27;re not comparable. In particular, HMAC should be used with a high-quality key; bcrypt is for deriving high-quality keys from lower-quality keys.",1450893418
10784556,story,,,1,0,nikbackm,"Confusing gotcha: PSECURITY_DESCRIPTOR is not a pointer to a SECURITY_DESCRIPTOR",https://blogs.msdn.microsoft.com/oldnewthing/20151223-00/?p=92701,,1450893414
10784555,comment,10780579,10781334,0,0,dragonwriter,,,"> They wouldn&#x27;t even have functional languages without C.<p>The functional paradigm is, as are some language families in which the use of the paradigm is idiomatic (esp. the Lisp family), older than (or roughly contemporary with and independent of, as in the case of ML) C. So, no, this is clearly not the case.",1450893406
10784554,comment,10784044,10784523,0,0,pluckytree,,,"Agreed, but the article is focused on why these companies that <i>have</i> done significant things to protect users with encryption technologies haven’t been a lot more vocal like Tim Cook has. This issue is so important to them and to everyone that they could spare a little time to speak their minds. Otherwise it just looks like that &quot;kooky Apple&quot; going against the grain. Who cares, they are going out of business soon, right?",1450893384
10784553,story,,,1,0,pbhowmic,"The Distressed-Debt Trades That Obliterated Bonus Checks in 2015",http://www.bloomberg.com/news/articles/2015-12-23/the-distressed-debt-trades-that-obliterated-bonus-checks-in-2015,,1450893380
10784552,comment,10784044,10784044,0,0,slg,,,"I can&#x27;t be the only one who thinks it is pessimistic to say &quot;if you put a back door in, that back doors for everybody, for good guys and bad guys.&quot;  Very few people even seem to recognize this as a problem let alone are working to solve it.  Maybe we should stop laughing at Clinton and her &quot;Manhattan Project&quot; comment; that might be the only way to get enough tech people on the problem to actually solve it.",1450893373
10784551,comment,10783983,10783983,0,0,racoonear,,,"Deep Residual Learning for Image Recognition <a href=""http://arxiv.org/abs/1512.03385"" rel=""nofollow"">http://arxiv.org/abs/1512.03385</a><p>Batch Normalization <a href=""http://jmlr.org/proceedings/papers/v37/ioffe15.pdf"" rel=""nofollow"">http://jmlr.org/proceedings/papers/v37/ioffe15.pdf</a><p>Deep Neural Decision Forests <a href=""http://research.microsoft.com/pubs/255952/ICCV15_DeepNDF_main.pdf"" rel=""nofollow"">http://research.microsoft.com/pubs/255952/ICCV15_DeepNDF_mai...</a><p>Spatial Transformer Networks <a href=""https://papers.nips.cc/paper/5854-spatial-transformer-networks"" rel=""nofollow"">https://papers.nips.cc/paper/5854-spatial-transformer-networ...</a>",1450893372
10784550,story,,,2,0,nradov,"Ukrainian startup: We’ve solved long-range wireless charging",http://arstechnica.com/information-technology/2015/12/ukrainian-startup-xe-claims-to-have-solved-wireless-charging/,,1450893360
10784549,comment,10783711,10784485,0,0,dikaiosune,,,"I&#x27;m not well-versed enough in investment to reply to your comment on purely financial grounds, but I still see a problem -- how often are those steps actually taken in practice? How would it even be possible for an employee to know that the founders have taken (and will continue to take) responsible steps with their funding rounds?<p>Part of the issue at question is whether it&#x27;s worth it for employees to bet on founders having done (and continuing to do) the right things with regards to investment. So when assessing the risk/reward of equity over cash, an employee now has to not only examine the marketability of a company&#x27;s product and sales, but also whether they can trust the founders, board, or whoever to be responsible with equity dilution and valuations.<p>Given the huge variety of unknowns (and <i>very</i> high risk of dilution or lack of a liquidity event), as a non-startup-employed observer I have to say I&#x27;m very confused as to why startup employees take effective pay cuts for stocks.",1450893343
10784548,comment,10783434,10784401,0,0,colanderman,,,"It is a bit disingenuous to compare video codec quality using stills.  One can simply choose a key frame (= no temporal compression) to compare, and they&#x27;d likely be identical regardless of how well the codecs compress motion in non-key frames.<p>(Not sure if the video clarifies this point since I cannot watch it right now.)",1450893336
10784547,story,,,2,0,khanam,"DOCKER-3-tier-java-app-nginx-tomcat-mysql-automation on any Cloud",https://www.linkedin.com/pulse/docker-3-tier-java-app-nginx-tomcat-mysql-automation-any-amjad-afanah,,1450893336
10784546,comment,10783711,10783711,0,0,keithpeter,,,"UK resident here: why were employees paying tax on the nominal value of the shares? Is it not possible to structure the compensation so that tax is payable when the shares are sold (capital gains) or on any <i>dividends</i> paid on the shares?",1450893334
10784545,comment,10782855,10782855,0,0,pjc50,,,"My own opinion about PL research is that programming is <i>concept serialisation</i>: the programmer has a model of the system (or part thereof) in their head, and the role of the language is to turn that into a byte sequence that is amenable to both being turned into machine instructions and being de-serialised into the heads of other programmers.<p>But different programmers have different abstractions in their heads, and find different things intuitive. That&#x27;s why things like ColorForth and APL exist; to a tiny fraction of people and problem sets they&#x27;re intuitive, to the rest obtuse. I suspect this is why people keep thinking Lisp is going to take over the world despite 30+ years of this not happening.",1450893305
10784544,story,,,1,0,ramsich,"Do you think this is a good start to build beautiful UI kit over bootstrap?",http://rsuikit.nailfashionsweden.se/index.html,,1450893280
10784543,comment,10776587,10781860,0,0,arca_vorago,,,"It&#x27;s an accurate point that needs to be made imho.",1450893272
10784542,comment,10783711,10784412,0,0,diziet,,,"What most likely happened was that investors together owned closer to 80% of the business and possibly had liquidation overhangs and some sort of anti-dilution that ended up in a similar situation.<p>That&#x27;s what liquidation preferences and overhangs do for companies that raise 100m+, they eat in the common.",1450893261
10784541,comment,10783711,10784329,0,0,nostrademons,,,"Employees do have access to an investment to an investment nobody else does.  It&#x27;s just that they need to do due diligence on par with or better than an investor to avoid getting taken advantage of.<p>I&#x27;ve turned down more startup jobs than I can count.  When I interview at a startup, I thoroughly research their market, their competitors, their product, and their business model.  I ask questions about how they came up with the idea, and how they know other people want it, and what questions they asked when they did their market research, and how the idea has evolved in response to new information.  How did the team meet?  What&#x27;s the company culture like, and what do they value?  I ask about financials - are they profitable?  What&#x27;s their runway?  What&#x27;s their revenue and revenue growth rate?  Is it recurring revenue or revenue for one-off contracts?  What&#x27;s their churn rate?  I ask about funding - who is their VC?  How many rounds have they taken, what&#x27;s the preference overhang, how many more do they anticipate taking?  (And then in my head, I&#x27;m running over the financials to see if this squares with their growth & revenue plans.)<p>If they&#x27;re cagey about this, I walk.  Some companies are, and that&#x27;s their right, and I&#x27;m not going to work for them.  Others are very impressed that I&#x27;m doing this level of due diligence, because it shows that I view my time there as an investment, and will invest the same level of diligence and effort into the job itself.<p>Equity compensation itself is not the problem.  Equity itself is great for employees - they have an information advantage over every other shareholder of the company (including the VCs), and if they&#x27;re an early hire, they can have a meaningful effect on the value of that equity.  But to take advantage of this, they need to do due diligence <i>as if they were an investor</i> - they are, after all, they&#x27;re investing their time, which is far more valuable than a VC&#x27;s money.  Equity is much more highly levered than salary - its value depends on how events play out, not just on what you&#x27;ve agreed beforehand - and so you should make sure you have enough information to make a reasonable guess at its value before accepting it.",1450893229
10784540,comment,10782762,10783758,0,0,zappo2938,,,"Republicans are also much older than Democrats. A very large portion of Republicans are retired and collect social security which is paid for by younger more likely to be liberal Democrats who don&#x27;t have to time to volunteer because they are working to support their families and pay into social security to support retired people who just happen to be more likely Republican. The popular conservative argument against a basic income is that people will just suck the tit of big government and be lazy. That retired people on social security volunteer with their guaranteed minimum income is proof that a basic income does work. People instinctively care about other people and they do not want to be bored. Thank you for pointing that out.",1450893221
10784538,story,,,2,0,aethertap,"China 'social credit': Beijing sets up huge system",http://www.bbc.com/news/world-asia-china-34592186,,1450893204
10784537,comment,10783711,10784387,0,0,jerf,,,"Unions can&#x27;t do anything about the company you&#x27;re working for running out of resources. That&#x27;s not what they are for.",1450893202
10784536,comment,10776587,10781719,0,0,arca_vorago,,,"Yeah, I am aware of that, and frankly their track record for GPL compliance is shitty too, but it was a comprimise of sorts. It seems really sad to me that it&#x27;s 2015 and we still don&#x27;t have an allprotocol router/firewall thats enterprise ready and open source... maybe that&#x27;s just my naively idealistic side speaking though.",1450893200
10784535,comment,10784044,10784044,0,0,harryf,,,"You might expect Amazon to take a stance to reassure AWS customers. Their AWS sales people like to tout AWS&#x27;s encryption capabilities and the fact that they weren&#x27;t part of Snowdens leak",1450893199
10784534,comment,10781830,10782267,0,0,kabdib,,,"I&#x27;d love to be able to &quot;drop&quot; a connection without sending a FIN to the attacker. Leave them hanging on a timeout.",1450893192
10784533,comment,10783711,10784485,0,0,ditonal,,,"Thank you for the informative response.<p>1) Ok, Google/FB common shares were worth something. Those are extreme outliers in exits, and had ethical founders. But founders have another option if they drive the common share value to nothing - retention bonuses. They can say, ok we will make all the common shares worthless, but you can just give me a huge package as part of the aquisition. So employees can&#x27;t rely on founders looking after common shares out of self-interest. If you read the article, it looks like that&#x27;s extremely similar to what happened in this case.<p>2) All these financial experts can figure out a way to protect their necks without leaving the employees necks under the axe.<p>3) Real protection would also be voting rights, which generally preferred shares get a lot more of, and then less tangible things like invitation to board meetings, something mere employees accept is absurd to expect. As long as employees agree to sacrifice compensation while being told they&#x27;re not investors and don&#x27;t deserve to be treated like one, they&#x27;re getting hoodwinked.",1450893187
10784532,comment,10783983,10783983,0,0,travjones,,,"&quot;Unified-theory-of-reinforcement neural networks do not simulate the blocking effect&quot;<p>Sci-hub link: <a href=""http://www.sciencedirect.com.sci-hub.io/science/article/pii/S0376635715300267"" rel=""nofollow"">http://www.sciencedirect.com.sci-hub.io/science/article/pii/...</a>",1450893171
10784531,comment,10784044,10784444,0,0,pluckytree,,,"It’s in the financial interest of much of the technology industry to vociferious campaign for encryption, but they don’t. If Google stopped using any encryption, don&#x27;t you think their business would suffer?<p>It may be in their Apple’s financial interests to do so, but it’s also the right thing to do. As you (partially) say, they care about the user experience. That experience includes taking steps to protect user information and they’ve had a long track record of doing just that. They did this long before it probably had any noticeable effect on the bottom line.",1450893165
10784530,story,,,1,0,Trisell,"Judge Dismisses Lawsuit Against Apple Over iMessage Delivery to Androids",http://www.businessinsider.com/ruling-android-imessage-case-against-apple-2015-8?op=1,,1450893160
10784529,comment,10778628,10782336,0,0,GeorgeHahn,,,"Alternatively, if you need a bit more power, there&#x27;s Fadecandy from @scanlime: <a href=""https://github.com/scanlime/fadecandy"" rel=""nofollow"">https://github.com/scanlime/fadecandy</a>",1450893156
10784528,comment,10783001,10784095,0,0,toomuchtodo,,,"Backup codes you&#x27;ve printed out and stored safely, as is usually done with 2 factor auth.",1450893141
10784527,comment,10773457,10781486,0,0,AnimalMuppet,,,"So is it fair to say that you are proving to the compiler that your function will return a sorted list (rather than you handing an arbitrary function to the compiler, and the compiler decides whether it returns a sorted list)?",1450893140
10784526,comment,10784044,10784514,0,0,lectrick,,,"And Martin Fowler has one of the best posts I&#x27;ve ever read on why privacy is important for a democracy: <a href=""http://martinfowler.com/articles/bothersome-privacy.html"" rel=""nofollow"">http://martinfowler.com/articles/bothersome-privacy.html</a>",1450893140
10784525,comment,10783711,10783960,0,0,ryanSrich,,,"There are several options one must weigh when they are deciding on job offers.<p>Where you work is so important and yet so many people seem to put such little effort into negotiation, risk assessment, runway, overall comp, etc. etc.<p>If you&#x27;re taking equity in place of a market rate salary you better to be absolutely 100% sure you know you&#x27;re taking a massive risk and forfeiting real dollars for hypothetical dollars that 9.999/10 will never exist.<p>Note: A great read about equity <a href=""http://blog.alexmaccaw.com/an-engineers-guide-to-stock-options"" rel=""nofollow"">http://blog.alexmaccaw.com/an-engineers-guide-to-stock-optio...</a>",1450893133
10784523,comment,10784044,10784044,0,0,tptacek,,,"You mean like how Google got ECC forward-secure TLS deployed across the whole Internet?<p>I have nothing but respect for Apple&#x27;s stance with regard to cryptography, but Google has been more instrumental in getting strong crypto deployed on the Internet, and, just as importantly, in sweeping the minefield of crappy 90s crypto that defined most Internet crypto until recently.",1450893034
10784522,comment,10783533,10784468,0,0,fvdfogi,,,"Blue Origin technically went into space for about ~30 seconds. The space officially starts at the Karman line (100 kilometers) and they reached 100.5 kilometers for a split second.",1450893012
10784521,comment,10774432,10775888,0,0,kuschku,,,"Interesting idea.<p>Because Felix von Leitner (Fefe) has been arguing the same. Every time he tries to discuss something, he gets long, carefully argued info via email, and completely retarded insults via Twitter.",1450892994
10784520,comment,10782942,10784323,0,0,pdkl95,,,"What &quot;telephone&quot; game - the &quot;straight from the horse&#x27;s mouth&quot; version (which I read yesterday) includes a <i>direct threat</i> to the tech industry.<p>> Clinton simply demonstrated her extreme ignorance<p>The <i>first Crypto War</i> over the Clipper Chip and years of key escrow debate was part of <i>Bill</i> Clinton&#x27;s administration. There probability that <i>Hillary</i> Clinton being &quot;extremely ignorant&quot; about encryption is laughably small.<p>> calling for computer scientists to think about the issue<p>She knew what the computer scientist position was <i>15-20 years ago</i>.",1450892981
10784519,story,,,1,0,DrQuack,"Ask HN: How often does your team collaborate with a team in a different company?",,"and how (any tools or processes?) do you do it? I&#x27;m generally asking about development teams, but all answers are welcome.",1450892971
10784518,comment,10783533,10784468,0,0,logical42,,,"They actually had a successful 1km test.",1450892970
10784517,comment,10782969,10784403,0,0,HeyImAlex,,,"Think about it in terms of composability of validators; &quot;having a key&quot; is a property of the dict/object, not the value that is stored there. I feel your intuition, but experience says otherwise.",1450892968
10784516,comment,10783983,10783983,0,0,marcodena,,,"Spotify – Large Scale, Low Latency, P2P Music-on-Demand Streaming <a href=""http://www3.cs.stonybrook.edu/~phillipa/CSE390/spotify-p2p10.pdf"" rel=""nofollow"">http://www3.cs.stonybrook.edu/~phillipa/CSE390/spotify-p2p10...</a><p>and many others but this is the one I liked the most",1450892966
10784514,comment,10784044,10784044,0,0,georgestephanis,,,"Bruce Schneier has one of the best posts I&#x27;ve ever read on why Encryption is important here: <a href=""https://www.schneier.com/blog/archives/2015/06/why_we_encrypt.html"" rel=""nofollow"">https://www.schneier.com/blog/archives/2015/06/why_we_encryp...</a> -- great resource to share to people who don&#x27;t understand it.",1450892956
10784513,comment,10784044,10784444,0,0,coob,,,"Weak Service Portfolio?<p>Off the top of my head:<p>SSO ID Service  /  \nCloud Photo Storage  /  \nCloud Document Sync  /  \nCloud Backup  /  \nEmail  /  \nInstant Messaging  /  \nMusic Store  /  \nMusic Streaming Service  /  \nCloud Music Service  /  \nMovie/TV Store  /  \nApp Store  /  \nPush Notifications  /  \nPayments  /  \nVideo Conferencing  /  \nGame Centre  /  \neBook Store  /  \nShared Calendaring  /  \nNotes  /  \nLarge File Sharing  /  \nPersonal Assistant  /  \nMaps<p>Weak?",1450892929
10784512,comment,10783711,10784126,0,0,TDL,,,"I would say it is much worse when that stock is your employer&#x27;s.  Yet, people still gladly take their employers stock (or options) as compensation (whether straight up comp or in a retirement plan.)",1450892923
10784511,comment,10783711,10784041,0,0,tptacek,,,"The premise of this argument is that the people who earned those options remain employees until the company gets liquid. If you leave, you&#x27;re usually required to execute.",1450892921
10784510,comment,10781205,10782526,0,0,dragonwriter,,,"> The anti-gmo thing is a stupid fad. Unfortunately, they have to follow it<p>Plenty of restaurants, including large chains, are not. They choose to follow (and, at the same time, promote) it, they don&#x27;t &quot;have to&quot;.",1450892914
