ID,Type,Story,Parent,Points,Comments,Author,Title,URL,Content,Created
10784440,comment,10782762,10784176,0,0,schoen,,,"The article you&#x27;re thinking of is called &quot;The Tyranny of Structurelessness&quot;.<p><a href=""https://en.wikipedia.org/wiki/The_Tyranny_of_Structurelessness"" rel=""nofollow"">https://en.wikipedia.org/wiki/The_Tyranny_of_Structurelessne...</a>",1450892218
10784439,comment,10783199,10784148,0,0,fauigerzigerk,,,"<i>>There&#x27;s absolutely no indication that an industrialized people are happier than a people living as hunter-gatherers, for example. Just let Africa be.</i><p>I think it&#x27;s for Africans to decide how happy they are watching their children die from diarrhea so that zebras have more space. They will make their choice, but for the overwhelming majority of Africans the choice is not between being a hunter-gather society once again and destroying wildlife. That&#x27;s a fantasy.<p>There are much more important (and realistic) choices to make, such as how many children to have, how to beat corruption, how to skip some of the more polluting sorts of development models, how to finance modern infrastructure that enables a modern economy, not just one based purely and digging up commodities until boom turns to bust.<p>The way to avoid destruction of wildlife is to have to have good policies, good education, good infrastructure and modern industries like IT, telecoms, finance, pharma or entertainment.<p>In order to go back to hunter-gatherer societies, the first thing you&#x27;d have to do is kill 95% of the population. Doesn&#x27;t sound like a happy solution to me, but if you are so fond of it, please start doing it in your own country and just let Africa be.",1450892210
10784438,story,,,1,0,hallieatrobohub,"Registration Now Open for #ICRA16’s Airbus Shopfloor Challenge",http://robohub.org/registration-now-open-for-icra16s-airbus-shopfloor-challenge/,,1450892207
10784437,comment,10781610,10783028,0,0,adrianmacneil,,,"Unsure about NZ, but at least in the US, &quot;structuring&quot; your payments in a way that would avoid AML checks is a crime by itself, regardless of whether you obtained the money legally.",1450892162
10784436,comment,10780162,10780909,0,0,garethsprice,,,"It&#x27;s a working class Caribbean neighborhood right now but was originally built as housing for middle-class Victorian clerics, so there&#x27;s a lot of beautiful but run down buildings & great transport links (ie. ripe for gentrification).<p>In the 90s it was extremely rough (race riots), now it&#x27;s fairly safe and the artisanal coffee shops and trendy restaurants are creeping southwards as the city&#x27;s population continues to grow & get priced out of other areas.<p>Guessing a flop house packed with affluent young tech bros is going to throw some gasoline on the Crown Heights hyper-gentrification fire, for better or worse.",1450892155
10784435,comment,10784435,10784010,0,0,jrs235,,,"Not only this but most single member LLCs will require personal liability or co-signer [usually from the single member] for any loans or debt. So if the LLC doesn&#x27;t pay, the single member will have be liable.",1450892152
10784434,comment,10783434,10784131,0,0,martinald,,,"Aren&#x27;t they also saying that 5800kb/s is not enough for some bits of some movies?<p>I&#x27;ve definitely noticed this - on 1080 full bluray files the bitrate swings enormously - from 2mbit/sec up to 50mbit/sec (so much so my Chromecast wifi can&#x27;t keep up in high action scenes).<p>So I definitely think they will be able to make improvements to their 1080p content (and definitely 4k content - I don&#x27;t think 25mbit/sec CBR is enough IMO).",1450892122
10784433,story,,,1,0,eyaltoledano,"How to acquire customers Facebook ads stop working",https://medium.com/@eyaltoledano/how-to-acquire-customers-when-facebook-ads-stop-working-6739daaa19a9#.3q8tqk6xo,,1450892120
10784432,comment,10783711,10784382,0,0,sokoloff,,,"You pay the strike price in cash and you get the shares. Your &quot;basis&quot; in the shares is the strike price (what you invested).<p>You base your AMT tax calculation on the difference between the fair market value and the strike price (that&#x27;s the &quot;phantom income&quot;).<p>When you sell the shares, your realized capital gains is based on the original basis and you may have AMT basis that&#x27;s different.<p>If you exercise and immediately sell, AMT doesn&#x27;t factor in.<p>Concretely (and picking semi-random numbers): If your strike price is $10/sh, the FMV is $25/share, and you have options on 1000 shares, you&#x27;d pay $10K to exercise, get 1000 shares, and have $15K in AMT income to consider.<p>If those shares later soared to $40 and you sold, you&#x27;d have a capital gains of ~$30K ($40K proceeds minus $10K basis minus commissions and fees).<p>If those shares instead crashed to $0, you&#x27;d have possibly paid AMT on the phantom income and you definitely lost the $10K in cash.",1450892114
10784431,comment,10773849,10775680,0,0,StillBored,,,"I don&#x27;t think 6502 is a particularly good arch for someone wanting to learn x86 assembly to start with. Its simply to restrictive, the lack of registers, mul, div, the lack of a decent accumulator, all the zero page tricks, etc all are pointless &quot;tricks&quot; for learning a more modern architecture. If you want something simple, but more modern, ARMv4 (AKA arm7tdmi) is probably a good bet. Its only got a handful of instructions (unlike v8 which does away with the predication). Plus, its 32-bit, and the predication might be a little confusing but probably wont damage a beginner like the 6502. I say this as someone who learned 6502 assembly with an apple ][ and then moved to to a 286, and it felt like learning assembly all over again without all the restrictions.",1450892098
10784430,comment,10783711,10784180,0,0,ap22213,,,"There is extremely good advice in the parent post.  For those new to the game, please read it closely.<p>I&#x27;ve been with 5 startups over the last 15 years.  Each had developed good, commercially-viable, revenue-generating tech.  But, in all cases, instead of going IPO, each was acquired.  And, usually they were acquired by other investors&#x27; or board members&#x27; companies (sometimes at a loss).  I would love to know the actual statistics for how many &#x27;ground floor&#x27; developers get rich on options, but I&#x27;m guessing that it&#x27;s very few.<p>Startup culture is cool - I love it.  They give me piles of money to experiment and develop new stuff and build new products.  If you have an &#x27;inventor mindset&#x27;, like a casual work culture, and like to see shit get done, it&#x27;s a great way to go.  But, unless you&#x27;re a founder or very early employee, make sure you negotiate for market-rate compensation with reasonable working hours.<p>Of course, this all depends on the specific company and its board, but generally the options game is a scam.  I&#x27;ve made a decent amount of money over the last 15 years - enough to retire on.  But, very, very little of that was from a big startup cash-out.  Instead, I just negotiated my salary and benefits effectively, saved a ton, and invested as much as I could.<p>Compound interest is your friend; your employer&#x27;s stock options? not so much.",1450892095
10784429,story,,,1,0,tokenadult,"Diagonalization and Other Mathematical Wonders",http://blogs.ams.org/blogonmathblogs/2015/12/21/mind-blowing-math-reminiscence/,,1450892093
10784427,story,,,2,0,DiabloD3,"Regeneration of the aged thymus by a single transcription factor",http://dev.biologists.org/content/141/8/1627.short,,1450891990
10784426,comment,10782855,10784246,0,0,umanwizard,,,"C has basically the same preprocessor, and ctags works mostly fine.",1450891981
10784425,comment,10783199,10784361,0,0,pc86,,,"Given the choice between lifting hundreds of millions of people out of poverty and offering huge economic opportunity to a stagnant global economy and some arbitrary (and disputed) danger to wildlife, development is the only choice.<p>The snarky answer is probably something about how lions would not be setting up Human Preserves if the situations were reversed.",1450891981
10784424,comment,10781610,10783885,0,0,tajen,,,"An example of crime which can be punished twice: Use of prostitution <i>in a foreign country</i> is illegal for an Australian. However, the law was created with international compatibility in mind.",1450891971
10784423,comment,10784089,10784089,0,0,ctomaybe,,,"I would learn to connect more closely with my family and friends. Do some maintenance on your relationships. You may find down the line that the longer you wait to invest the kind of time you have right now, the less effect it might have.",1450891963
10784422,comment,10782969,10784096,0,0,fidget,,,"For those of us more dictionary oriented, there is <a href=""https://pypi.python.org/pypi/voluptuous"" rel=""nofollow"">https://pypi.python.org/pypi/voluptuous</a> (which is OK for the most part, as long as you are only trying to do validation, and nothing too crazy)",1450891953
10784421,comment,10784411,10784411,0,0,MrGrillet,,,"Thinking about making this into a multi-player gaming app...",1450891944
10784420,story,,,1,0,johnsan,"A go-kart powered by a Boeing jet engine could be yours",http://mashable.com/2015/12/23/go-kart-boeing-jet-engine/,,1450891944
10784419,story,,,5,2,christopherDam,"Ask HN: What side project do you want to start on these Christmas Holidays?",,,1450891933
10784418,comment,10781205,10781205,0,0,daniel-levin,,,">> The CDC says Chipotle has been very cooperative in the E. coli investigation, but that the company is having trouble telling the agency which batches of ingredients went to which stores at which times. “The system they have is not able to solve the problem we have at hand. It’s not granular enough,” says Ian Williams, chief of the CDC’s outbreak response and prevention branch. He notes that “traceability from the farm to the point of service” should be improved throughout the food industry. In recent years, the agency has been able to find the contaminated ingredients in fewer than half of all multistate outbreaks.<p>To me this suggests a very simple solution. Legislate that each ingredient parcel must come with an audit trail. Assign to each parcel a reference number - a UUID or hash - that can be used to trace back its entire life and history. The solution seems so obvious that there are probably significant obstacles against doing so that I am not aware of. If such a system is implemented, then the next time a contamination breaks out, the source can be quickly identified and eliminated, then apologies can be made, and business can resume as normal.<p>>> The spread of norovirus in Simi Valley and Boston was caused by breaches of protocol, Ells says<p>Eliminating contamination entirely is a highly desirable goal, but outbreaks will likely continue occur regardless of anti-contamination measures. As a result, it makes sense to make it as easy as possible to shut down outbreaks before they become crises.",1450891932
10784417,story,,,1,0,drewda,"Worldtimebuddy: schedule meetings across timezones",http://www.worldtimebuddy.com/,,1450891926
10784416,comment,10783711,10784169,0,0,sokoloff,,,"Mostly correct, with one correction:<p>You can apply carried forward capital losses against 100% of your capital gains PLUS an additional $3000 in each future year.",1450891925
10784415,comment,10783071,10783285,0,0,musha68k,,,"In addition to applying Hanlon&#x27;s Razor more liberally I&#x27;d encourage you to let go of the nationalist worldview if only for the sake of not feeding the trolls.<p>Thank you,<p>a fellow European (specifically, from Austria as well)",1450891925
10784414,comment,10783219,10783878,0,0,ocfx,,,"Aha I get that way with the end of most books. I just power through the last 20 percent of it in one sitting. Must... have... closure...",1450891915
10784413,comment,10782811,10783943,0,0,ianlevesque,,,"Modern browsers are removing SHA-1 support. The MITM would not be able to downgrade them to something they&#x27;ve removed.",1450891913
10784412,comment,10783711,10783711,0,0,kevinpet,,,"Can anyone provide any info on what actually happened here? The article says that the preferred was &quot;worth&quot; more, which is a pretty vague statement. I interpret this as meaning that they didn&#x27;t convert because their liquidation preferences guaranteed a higher payout. What seems relevant to me, and anyone else who works at a pre-IPO startup, is what were the things to look for ahead of time.<p>According to Crunchbase, Good raised $291M in 4 rounds. Assuming those investors owned 40% of the business, then at $1.1B, common was splitting $660M (preferred would convert). At $425M, assuming 1x liquidation preference, common is splitting $134M, an 80% decrease. I think you could get to the numbers in the article assuming 1x participating or something similar.<p>This should have been pretty predictable to employees. You will not get rich if your company sells for only 1.4x the total amount invested.",1450891909
10784408,story,,,2,0,nprincigalli,"Plan 9: The Way the Future Was (from the Art of Unix Programming, by ESR)",http://catb.org/~esr/writings/taoup/html/plan9.html,,1450891880
10784407,comment,10783711,10783711,0,0,jackgavigan,,,"It&#x27;s interesting to compare this article with the coverage of the acquisition at the time.<p><i>&quot;When Good Technology announced Friday that it had sold itself to its long-standing rival BlackBerry for $425 million in cash, it was a moment of triumph for Good CEO Christy Wyatt.&quot;</i> - \n<a href=""http://uk.businessinsider.com/how-christy-wyatt-sold-good-to-blackberry-2015-9"" rel=""nofollow"">http://uk.businessinsider.com/how-christy-wyatt-sold-good-to...</a>",1450891876
10784406,story,,,1,0,wj,"Building a product vs. building a business",http://blog.startopz.com/building-a-product-vs-building-a-business/,,1450891872
10784405,comment,10783711,10784360,0,0,nemo44x,,,"It&#x27;s true, the media loves the story of the regular folks who struck gold when their company went public and that resonates with typical employees who don&#x27;t understand the financial constructs that make up many VC deals.",1450891863
10784404,comment,10782942,10784086,0,0,nyae,,,"Please don&#x27;t make that argument about gun-free zones. In what world can we expect a person bent on mass homicide to respect municipal ordinance? Shooter: &quot;Oh this sign says no guns? Darn, guess I&#x27;ll abandon my murder spree then.&quot;<p>You&#x27;re not serious right? Or maybe you just haven&#x27;t yet explained what you really meant?",1450891841
10784403,comment,10782969,10784096,0,0,bpicolo,,,"Optional being an attribute of the key rather than the value is pretty bizarre to me, I&#x27;ve seen that patten a couple times. Feels like the wrong way to go about it",1450891811
10784402,story,,,1,0,DiabloD3,"Estimating the NIH Efficient Frontier",http://journals.plos.org/plosone/article?id=10.1371/journal.pone.0034569,,1450891794
10784401,comment,10783434,10784251,0,0,jonhohle,,,"The opposite has happened. Steve Jobs introduced H.264 as providing significantly higher quality at the same or lower bitrate. He shows an still from an existing MPEG-4 video and then a much higher resolution still from an H.264 encoded MPEG-4 video and claims that they require the same bitrate. He brings out Frank Casanova who goes on for 5 minutes or so about quality at lower bitrates. [0]<p>IIRC, Apple also sold AAC as requiring lower bandwidth for the same quality, but I don&#x27;t recall when that was.<p>0 - <a href=""https://youtu.be/dPCNUExWR6I?t=3271"" rel=""nofollow"">https://youtu.be/dPCNUExWR6I?t=3271</a>",1450891788
10784400,comment,10781610,10782239,0,0,takeda,,,"I&#x27;m still puzzled how he can be extradited if he is not US citizen and did not commit any crime on US soil.",1450891759
10784399,comment,10783305,10783757,0,0,lwyr,,,"Our dependence on technology enables new vectors of control and I am not as optimistic about the ability of laws to guarantee these will not be abused. Trust in government as an agent of freedom is a very recent (not to mention regional) development. I say we err on the side of freedom and don&#x27;t tempt government too much with opportunities for technology-assisted totalitarianism.",1450891735
10784396,comment,10783711,10783711,0,0,ChuckMcM,,,"I remember clearly when I was in a similar situation with the sale of a company I helped start in 1999. All this gain on paper which required (because of the Alternative Minimum Tax rule) that I pay taxes on gains I had not realized. And then later realizing an actual loss. And the decade afterwards of getting $3,000/year that I could claim against my taxes.<p>The only reason I&#x27;m not still claiming my $3,000 a year is that we had some gains that could be offset by those losses in 2007 and 2008. Of course there are the much higher fees to have your taxes prepared.<p>I agree with the Times that it is the non-executive employees who get the worst of it, both because it may be the only investment they have (other than their 401k) and they may not have any experience in managing risk.<p>For example, the article mentions, and my own experience mimics, that the executives are in a bind when it comes to discussing company performance and prospects. Legal risks abound if they mislead and existential risks abound if they demoralize the company. It would be especially problematic when the company has started the IPO process as Good had.<p>Then there is the greed factor that comes in on everyone&#x27;s part. The board turns down an $825M offer because they feel it is their duty, given they expect the company is worth more than that. Employees don&#x27;t cash out some of their holding at $3/share expecting a bigger IPO lift. Both angry because nobody came from the future to tell them, hey this is the best offer you are ever going to get for this stock, take it. And so they &quot;ride&quot; the value down and get angrier and angrier but its hard to know at whom.<p>When this happened to me, I was holding 10,000 shares of Sun stock that had been $60 a share in 2000, that was going down and down and down. It later reverse split 3:1 (so down to 3,333 shares) and sold for $9.50 a share to Oracle or about $32,000. I was really angry at myself for &quot;losing&quot; so much money. Of course it wasn&#x27;t that I had &quot;lost&quot; the money, I never had it, it was all on paper, I just hadn&#x27;t converted at the time because I was hoping to convert when it was even &quot;more&quot;. Or put another way, my greed kept me from selling something which could have paid off my mortgage at the time.",1450891702
10784395,comment,10782443,10783277,0,0,JesseAldridge,,,"I&#x27;ve had similar problems.  I think it&#x27;s an anxiety thing.  Ever tried mindfulness meditation?  Basically you just sit for 20 to 40 minutes and focus on your breathing.  It&#x27;s been working well for me.  I would also look into Cognitive Behavioral Therapy if I were you.",1450891700
10784394,comment,10783434,10784251,0,0,swang,,,"There is no actual &quot;revolt&quot; because both Apple and Amazon make sure it doesn&#x27;t happen by using CBR. You&#x27;re right in that consumers don&#x27;t care about it all that much.<p>But let&#x27;s say Amazon decides to go with VBR to save space and download speed, now there&#x27;s an easy way for Apple to attack Amazon. &quot;We never dip below a certain quality. Amazon does. We care. Amazon doesn&#x27;t&quot;<p>Maybe that ad/slogan works, or maybe it doesn&#x27;t. But if you&#x27;re Amazon would you be willing to risk some weird consumer backlash over it? And if you&#x27;re Apple it is an easy point to attack, and if it doesn&#x27;t work, no harm no foul (and then secretly also switch to VBR and announce it at the next Apple conference!)",1450891670
10784393,comment,10783711,10783779,0,0,djloche,,,"The &quot;deal makers&quot; didn&#x27;t drive down the value of the company. Good did it themselves. They were hemorrhaging money. They did not have the stronger position at the negotiation table.",1450891662
10784392,comment,10782855,10784234,0,0,ufo,,,"Lua avoids this issue because it does not allow an statement to be just an expression.",1450891641
10784391,comment,10781830,10782809,0,0,ngrilly,,,"Hi John,<p>I remember listening to your talk at dotGo 2014 :-)<p>I tried CloudFlare in November 2012 (3 years ago, and not 1 year ago as I wrote in my previous comment). At that time, the origin server was hosted by Typhon in France. I remember that after having enabled CloudFlare, the latency was significantly increased. I haven&#x27;t kept the specific timings, but to give you an idea, the response time was like 100 ms without CloudFlare and 500 ms through CloudFlare.<p>That said, it was a long time ago and I can guess things have changed a lot since. So I did a new test today. The origin server is hosted by DigitalOcean in Amsterdam. The median response time from my machine is around 100 ms. After enabling CloudFlare, I cannot see a significant difference in response time. The median response time, and the distribution of response time, looks very similar.<p>I guess that during the last few years you have expanded your network and your connections with the major hosting providers (Amazon, Google Cloud, DigitalOcean, Linode, etc.). Maybe it explains the difference between today&#x27;s test and 3 years ago?<p>In general, is it useful and/or recommended to use CloudFlare in front a fully dynamic service, for example a HTTP-JSON API, with no static content (no images, no stylesheets, no scripts), and thus no need for the CDN feature?",1450891633
10784390,comment,10783447,10784216,0,0,wink,,,"I see a lot more &quot;skepticism&quot; than outright hatred.<p>There&#x27;s been a few not-so-cool security problems, that&#x27;s what I usually hear from people being turned off. Plus the amount of really bad plugins...<p>My only personal gripes are that it&#x27;s not fun to develop themes and plugins, so I stopped using it years ago for my main website. Still using it though.",1450891619
10784389,comment,10783711,10784319,0,0,Avshalom,,,"You have not yet actually made a guess you&#x27;ve just kept asserting that &quot;a lot of money&quot; is &quot;a lot of money&quot; and I agree. A lot of money is a lot money. I just think that modulo nobody is actually seeing a lot of money from start-up employee equity.",1450891614
10784387,comment,10783711,10784255,0,0,justinph,,,"At least with the auto industry, the unions were able to offer some protections for the worker. How many programmers belong to a union?",1450891578
10784386,comment,10782855,10783732,0,0,nickpsecurity,,,"Anyone who used Modula-3...<p><a href=""https://en.wikipedia.org/wiki/Modula-3"" rel=""nofollow"">https://en.wikipedia.org/wiki/Modula-3</a><p>...knows that one can have key features of C++ for systems programming with an easy-to-parse, safer, and [for a time] more efficient language. The SPIN OS team even modified it with type-safe linking so one could hotload code into the OS. What I saw there was &quot;hotload code into running system&quot; w/ associated benefits during updates. Or safer, better JIT. ;)<p>Anyway, combined with LISP-style macros & irritating parts removed (eg uppercase, verbosity), you get a system language that blows C++ away in productivity (esp w/ DSL&#x27;s), compiler efficiency, maintenance, and possibly run-time efficiency. The world might have went in a different direction but they better be honest about parsing pain they created. And all the productivity opportunities lost due to that.",1450891574
10784385,comment,10775969,10783964,0,0,dilap,,,"(Oops, I meant table view, not scroll view. Thanks.)<p>I agree with you on the specifics, but somehow still reach different conclusions. :)<p>Edit: I guess if you take the lense of wanting  Swift to replace the combination of ObjC + plain C, what you&#x27;re saying makes sense.<p>It&#x27;s a shame though if you end up losing the very-helpful ability to dynamically modify system provided behavior.<p>And even for relatively performance intensive stuff, like table scrolling, objc is plenty fast.<p>Every language obviously has its domain of performance-appropriateness -- C too will hit its limits; x264 w/o the asm optimizations is ungodly slow, for example.<p>I just think for &quot;apps&quot;, generally, objc is a speedy language. Empirically this is true. Explanations that call for this being true &quot;despite the language&quot; are suspicious to me; if it&#x27;s not the language, what&#x27;s the magic pixie dust?<p>And personally I suspect the swift folks aren&#x27;t going the more static route because of actual real-world user-facing performance walls they&#x27;ve run into, but because that&#x27;s what they&#x27;re into -- they&#x27;re C++/static language/compiler guys.<p>Last example: Look at the most performance constrained stuff apple is currently doing, the watch. Think that&#x27;s Swift? I&#x27;m pretty sure it&#x27;s not.",1450891574
10784384,story,,,2,0,DiabloD3,"Is the FDA Too Conservative or Too Aggressive? Analysis of Clinical Trial Design [pdf]",http://cancerx.mit.edu/wp-content/uploads/2014/03/FDATooConservativeBDA2015wp.pdf,,1450891563
10784383,comment,10782897,10784134,0,0,detaro,,,"Agree in general, but you can overdo it with splitting services up. E.g. would you really run a extra container just for a cronjob that runs once a night to e-mail some data from a database? Esp. if you run on a platform where you essentially pay per container that seems like a waste.",1450891544
