ID,Type,Story,Parent,Points,Comments,Author,Title,URL,Content,Created
10028385,comment,10027332,10028085,0,0,dang,,,"> Ah I just knew I would see mention of &quot;beta male&quot; strewn somewhere in this shithole thread. You are a moron :)<p>Hi there, please take a moment to get (or re-get) up to speed with HN&#x27;s standards for commenting:<p><a href=""https://news.ycombinator.com/newsguidelines.html"" rel=""nofollow"">https://news.ycombinator.com/newsguidelines.html</a><p><a href=""https://news.ycombinator.com/newswelcome.html"" rel=""nofollow"">https://news.ycombinator.com/newswelcome.html</a><p>It&#x27;s critical that comments here be civil and substantive, even when someone else&#x27;s comments aren&#x27;t, indeed even when they seem like a moron. Otherwise discussions get sucked into the tedious downward spiral that this site exists to try to avoid.<p>Normally we&#x27;d ban a new account that posts comments like that, since we get a lot of them, mostly by serial trolls. But you&#x27;ve already posted a couple of interesting comments, so I&#x27;d like to give you the benefit of the doubt.",1439061980
10028384,comment,10026695,10027396,0,0,orting,,,">  It is not a question of if but when<p>You can say that about almost anything, and the world is still full of factory workers.<p>As a PhD student in medical imaging, you must also know that getting fully automating segmentation methods to work to the standard required in the clinic is really hard. And once you solve it for one clinic you will likely not be able to transfer the trained model to another clinic, because scan parameters, patients and workflow are different.<p>But when we solve the segmentation task, I think most radiologist will clap their hands and move on.",1439061979
10028383,comment,10027822,10028107,0,0,krasin,,,"Unlike skateboards, the four wheels on this platform make almost a square. There&#x27;s a chance that it can handle pot holes better, since three wheels will still be enough. But yeah, I share your feelings about edges.",1439061979
10028382,comment,10026022,10028327,0,0,slr555,,,"Sure about that?<p>Look at the five year survival rates for innovative treatments. Granted not all of them and not every time, but to generalize to &quot;months&quot; is a gross mis-characterization not borne out by a thorough review of the literature.",1439061955
10028381,comment,10027438,10027945,0,0,tobr,,,"Watched the video you linked. I think it&#x27;s saying the opposite, i.e. failure or success is more due to marketing and PR than to how great the game is.<p>Not sure if that&#x27;s entirely true, but it doesn&#x27;t seem to support your argument.",1439061935
10028380,comment,9971262,9974867,0,0,rospaya,,,"Stuff like this:<p><a href=""http://gizmodo.com/319318/nokias-haptikos-technology-makes-physical-keyboards-obsolete-hopefully"" rel=""nofollow"">http://gizmodo.com/319318/nokias-haptikos-technology-makes-p...</a>",1439061934
10028379,comment,10025567,10028009,0,0,nickpsecurity,,,"Yeah, that and some basic functions are all they use it for. A write up way back indicated they though Mach was a mistake. So, the alternatives were a better microkernel or full monolithic. One unofficial project tried to port it to L4. Not sure what Apple&#x27;s stance is under Tim Cook, though.",1439061926
10028378,comment,10027566,10028368,0,0,msie,,,"If, I may ask, what type of job are you doing? Rails? Javascript? Managing vs programming? TIA",1439061896
10028377,comment,10027102,10027102,0,0,clebio,,,"Not sure really what you consider signal versus noise, as it depends a lot of what your interest or experience with a particular subject is. But at any rate:<p>Naturalist, Edward O. Wilson",1439061878
10028376,comment,10027566,10027566,0,0,elchief,,,"I interviewed with PoF and BuildDirect for a data science job. PoF did a 3-against-1 behavioral interview with no whiteboard.<p>The BD interview was supposed to be a friendly tech phone chat but actually was a grilling by an HR lady that knew nothing about tech.<p>What I&#x27;m trying to say is these companies don&#x27;t know what the fuck they&#x27;re doing.",1439061834
10028375,comment,10027566,10027566,0,0,mahyarm,,,"Your a new grad from uvic, UBC or SFU.  Recruiters from Seattle are contacting you.  You interview at Seattle, and get a job offer.  The Seattle recruiters tell you the visa process is easy with this TN thing.  You have no idea what the job market is like so you go interview in Vancouver.<p>Your shocked to find out that the pay is literally half in Vancouver.  Housing is also half in Seattle, everything is cheaper in Seattle.  You really can&#x27;t tell the difference between the two cities otherwise, and home is 3 hours away.  You do the sensible thing and move to Seattle.<p>2 years later, you work for microsoft or some company down the bay area and start getting your green card. Later on you see that the average income in vancouver is comparable the average income of Reno,NV.<p>Anyone with half a brain who is from the area will move to Seattle.",1439061780
10028374,comment,10027854,10028268,0,0,skeuomorf,,,"Hmm, Egypt by any chance?",1439061754
10028372,comment,10027358,10027358,0,0,rgbrenner,,,"He doesn&#x27;t care about security.. so there&#x27;s no point in explaining it. Just start talking about the fines. It&#x27;s a PCI DSS issue... so if anything happens, he&#x27;s out $50k from each of the four credit card companies (first time, minimum fine) + the cost of an audit + the any losses the banks weren&#x27;t able to recoup with chargebacks + the bank&#x27;s cost of reissuing credit cards.<p>Hundreds of thousands of dollars in losses the first time this happens. Next time it&#x27;s even higher (escalating PCI fines).<p>If that doesn&#x27;t convince him to use Stripe, or at least spend $10 on an SSL cert, I don&#x27;t know what will.",1439061706
10028371,comment,10027566,10028341,0,0,msie,,,"Yes, employers would say Vancouver is such a nice place to live that that&#x27;s part of the compensation package. So, if you want to mountain bike and snowboard, all in one day, then this is your place. :-)",1439061700
10028370,comment,10027332,10027873,0,0,sagichmal,,,"<p><pre><code>    > What do you call people who use social justice as an \n    > excuse to harass and belittle people who have different \n    > opinions than them?\n</code></pre>\nStrawmen :)",1439061650
10028369,comment,10020827,10027589,0,0,travjones,,,"&quot;What goes on in the mind&quot; is behavior. It can be studied scientifically but one can run into the &quot;private event&quot; problem. That is, what goes on in the mind is a private event only observable to the subject. In many psychological experiments, what goes on in the mind is inferred from observable behavior. This is problematic.",1439061608
10028368,comment,10027566,10028205,0,0,van_developer,,,"At my level CAD $120k/yr is average salary I&#x27;ve been offered locally, with no options, though after taxes that&#x27;s $87k/yr and my rent is $24k/yr for a one bed condo so I would have $63k to spend per year. Instead I make remotely USD $160k, which is $210k CAD, and it goes to a consulting corporation that I write off everything I can including rent so pay much less taxes to my incredibly corrupt provincial government. I also have standard options everybody else in SV gets.<p>Edit: I work for a startup that advertised here in the monthly who&#x27;s hiring threads.",1439061588
10028367,comment,10026713,10027714,0,0,uxcn,,,"No, memory bus transfers happen in word sizes.  This is why caches sometimes use <i>critical word first</i>.<p>However, straddling word boundaries is problematic.",1439061571
10028366,comment,10026022,10026022,0,0,slr555,,,"Consider the following individual when you think about this question:<p><a href=""http://www.wwltv.com/videos/news/health/2015/07/28/trauma-surgeon-saved-countless-lives-before-his-death/30816011/"" rel=""nofollow"">http://www.wwltv.com/videos/news/health/2015/07/28/trauma-su...</a><p>Norman McSwain was one man but through his work developing PHTLS (Pre-Hospital Trauma Life Support) and introducing modern EMS practices to numerous countries around the globe he truly did save countless lives. He has been credited for doing more to reduce the homicide in New Orleans than any mayor or police commissioner because he taught the trauma surgeons that increased survival from penetrating wounds and was an incredibly skilled surgeon himself. His work with the Tactical Combat Casualty Care Committee helped reduce battlefield fatality rates to historic lows.<p>The statistics don&#x27;t take into account the kind of doctor you choose to be. If you choose to join a posh private practice and treat little old ladies who &quot;just don&#x27;t feel quite right&quot; you may not save a lot of lives. But if you choose to be on the front lines, for instance one of the last doctors out of Charity hospital after Katrina, and spread knowledge far and wide you may just save more than &quot;ninety lives&quot;.<p>We all get the same 24 hours in each day. Norman just used them better than most of us.",1439061559
10028365,story,,,3,1,jmount,"Gizmodo on Rob Rhinehart and Soylent",http://gizmodo.com/rob-rhineharts-latest-attempt-to-make-you-buy-soylent-i-1721852606,,1439061547
10028364,comment,10026713,10027756,0,0,Someone,,,"<i>&quot;it requires knowing the range of each value that you&#x27;re storing in the struct (and not just the number of bits).&quot;</i><p>Many high-level languages require programmers to specify what you want to store (&#x27;an integer between -6 and 43, inclusive&#x27;), not how (&#x27;6 bits&#x27;). That typically makes it possible for the compiler to do just that. For example, Pascal has the &#x27;packed&#x27; keyword (<a href=""http://www.gnu-pascal.de/gpc/packed.html"" rel=""nofollow"">http://www.gnu-pascal.de/gpc/packed.html</a>)",1439061536
10028363,comment,10027854,10028253,0,0,rohamg,,,"The thought process with export controls is that bad actors may be able to discover vulnerabilities more easily by having unrestricted access to defensive technologies.",1439061527
10028362,comment,10027332,10028152,0,0,jlarocco,,,"So your workplace doesn&#x27;t use email, source control, instant message, group chat, or any other kind of electronic text communication?<p>But in a way that just emphasizes why &quot;[hug]&quot; would be awkward and borderline inappropriate in a work setting.  How often do coworkers physically hug at work?<p>I&#x27;m not saying it would always be wrong to use &quot;[hug]&quot; (or even physically hug somebody at work), but I&#x27;d expect it to be far less common than in some other settings.",1439061499
10028361,comment,10027358,10028274,0,0,rgbrenner,,,"<i>Set up some forwarding rules in Cloudflare to always to go the HTTPS and of course the cert.</i><p>Please do not do that. That doesn&#x27;t solve the problem at all if the origin server is still serving the content over HTTP. You&#x27;re just lying to visitors by making them think it&#x27;s secure when it&#x27;s really not.<p>Magento is like any other PHP app.. there&#x27;s Apache (or some other webserver) in front of it.. so just setup Apache properly.",1439061459
10028359,comment,10025106,10026590,0,0,rosser,,,"Because US tax law specifically says you&#x27;re subject to it for up to 10 years <i>after</i> renouncing your US citizenship. That&#x27;s not merely intent to violate the &quot;spirit&quot; of the law; that&#x27;s violating the <i>letter</i> of the law.",1439061452
10028358,comment,10026022,10026881,0,0,peterhartree,,,"> Well, trying to subscribe bounces over to a different subscription page that asks to fill out a name and university, but to leave the university blank if it does not apply. But trying to submit that form fails with a validation error that university field cannot be blank.<p>That&#x27;s my bad - thanks for reporting this bug, and I&#x27;m sorry for the hassle. I&#x27;ve just pushed a fix.",1439061373
10028357,comment,10028317,10028317,0,0,miles,,,"Found out about &quot;attention deconcentration&quot; in <i>The Disappearance of the World’s Greatest Free Diver</i>[1] which was posted earlier by Thevet[2].<p>The article linked in this submission is by Igor Kusakov. It <i>&quot;attempts to describe specific mental techniques that are related to resolving very complex tasks in software engineering&quot;</i> and <i>&quot;also proposes to treat software engineering itself as research on human thinking because software is meant to simulate thinking.&quot;</i><p>[1] <a href=""http://www.newyorker.com/news/sporting-scene/the-disappearance-of-the-worlds-greatest-free-diver"" rel=""nofollow"">http://www.newyorker.com/news/sporting-scene/the-disappearan...</a><p>[2] <a href=""https://news.ycombinator.com/item?id=10027307"" rel=""nofollow"">https://news.ycombinator.com/item?id=10027307</a>",1439061367
10028355,comment,10027822,10027983,0,0,jchavannes,,,"I&#x27;m not sure why this isn&#x27;t one of the top comments.  The wheel size is a nonstarter.",1439061342
10028354,comment,10025106,10027783,0,0,rosser,,,"Can you meaningfully do things like ecommerce over HamWAN, given the restriction against using encryption on amateur radio bands?<p>Losing that capability would severely limit the internet for most folks...",1439061338
10028353,story,,,152,17,luu,"A collection of postmortems",https://github.com/danluu/post-mortems,,1439061325
10028352,comment,10027566,10028271,0,0,msie,,,"When I was looking for a job in Vancouver the average salary for an intermediate developer was around 70-75k Canadian. Senior devs can go from 85-100k and even higher for American companies with teams in Vancouver. Salesforce has 100k jobs. But a startup in Vancouver doesn&#x27;t have the cash to pay top salaries unlike a startup in Silicon Valley.",1439061309
10028351,comment,10027854,10028194,0,0,peeters,,,"That&#x27;s not up to Sophos to know though.  Companies are required to comply with the regulations, at the penalty of incredibly stiff penalties.  And the cost of paying manual attention to every match would be debilitating. It is much more advantageous for them to automate it and be safe rather than sorry. Their policy of asking for more information on an initial positive match is reasonable.<p>If you want to blame anyone, blame the U.S. agencies who implemented these restrictions.  Sophos is just obeying the law.",1439061306
10028350,comment,10027438,10028060,0,0,fauigerzigerk,,,"<i>>wondering how/if my games are solving real user problems or whether they are only providing distractions.</i><p>Keeping ourselves entertained on this planet is a very real user problem. It has been a core part of all human cultures for millennia. As we become more productive at producing all the essentials for survival, entertainment will take an ever growing share of our economies.<p>Entertainment is the one industry that I&#x27;m sure will still exist in a 100 years and employing people. I would be very surprised if it were not at least 50% of our economies at that point.",1439061279
10028349,comment,10027308,10028306,0,0,zenogais,,,"I&#x27;ll take an initial stab at this.<p>Suitcase word seems to be a nicer name for polysemy - the ability of word to be packed with meanings - which is often surprisingly unproblematic in ordinary speech and writing. Essentially contested concept, on the other hand, takes this polysemy as a starting point but adds another quality - that all those employing a particular usage of the word seem to think that it has a single, correct meaning/usage. Namely theirs. This parallax effect makes the contestation constitutive (essential) to the concept.",1439061272
10028348,comment,10027202,10027798,0,0,klinskyc,,,"plaintextoffenders.com itself works on reports. My extension uses an api (<a href=""https://8ack.de/plato/info/"" rel=""nofollow"">https://8ack.de/plato/info/</a>). The extension regularly caches the list of offenders and checks your current url against the list locally, so neither I nor the api creators can see your browsing history.",1439061251
10028347,comment,10026695,10027234,0,0,orting,,,"Stating it as &quot;thousands of patient images a day&quot; is misleading. It would be the same as saying you inspected &quot;thousands of parts each day&quot;. As the radiologist further down notes, CT scans contains many slices.<p>While computers don&#x27;t get tired, they also have a really hard time solving stuff like annotation tasks automatically. One thing is getting a good enough general performance, another is to never make critical errors. I see a huge potential for ML approaches in health care, but primarily as an aid for the health care professionals and not as a full replacement.",1439061249
10028346,comment,10027822,10028236,0,0,satai,,,"<a href=""https://upload.wikimedia.org/wikipedia/en/e/e6/The_Luggage-Joel_Gustafsson.jpg"" rel=""nofollow"">https://upload.wikimedia.org/wikipedia/en/e/e6/The_Luggage-J...</a>",1439061227
10028344,comment,10027566,10027566,0,0,pookieinc,,,"Aside from the high cost of living in Vancouver, another problem is that Canadians are extremely inward-focused in their efforts to hire individuals from both startups to larger companies.<p>From my own experience this past year: California-born and raised, I was in the market over the last 6 months, looking for software engineering jobs and applied to dozens and dozens of jobs in Vancouver, ranging from tiny startups to large companies. Not only did I receive hardly any callbacks, the ones that did politely mentioned that they were looking for Canadians first, then they&#x27;ll look outside (then never got back to me). When applying to startups / larger companies in the Bay Area, I was interviewing, writing code challenges, etc., constantly as well as courted for positions.<p>On the flip side, for Canadians across their own country, Vancouver does seem like the &quot;hip&quot; place to be. I have tech friends in Toronto, Montreal, and smaller cities and the lot of them are considering heading westward, and understandably so. When I visited Vancouver (Gastown, etc.), it seemed very exciting and full of the startup life. My own couple friends showed me their own startups and it felt very &quot;Silicon Valley&quot;-esque.<p>I should also point out that one of my friends did offer me a position at his company, but the pay was incredibly low (while rent would remain very high), which I believe to be a symptom of most places outside of California (or maybe America, not sure).",1439061152
10028343,comment,10027822,10028145,0,0,jkaunisv1,,,"I like the idea of adding it to the bottom of a walker. Would give more stability for the elderly.",1439061132
10028342,comment,10027867,10028096,0,0,TelmoMenezes,,,"And likewise you can&#x27;t prove a positive. In fact, you can&#x27;t prove anything with statistics, and science is not about proof. Mathematics is about proof. Science is doubt. All theories are forever on probation -- or until they are falsified by new experiments.",1439061132
10028341,comment,10027566,10028292,0,0,ivarv,,,"There are definitely opportunities but salaries are not anywhere near what you can expect from the Valley. For some reason tech employers get away with low wages despite the very high local cost of living.",1439061129
10028340,comment,10023972,10024706,0,0,jhildings,,,"How does this mean that he doesn&#x27;t use it for the thing this thread is addressing ? O_o",1439061123
10028339,comment,10027822,10028236,0,0,mcphage,,,"Kinda, just with (a bit) less eating people :-)",1439061109
10028337,story,,,1,0,rumcajz,"C++ in Coders at Work (2009)",https://gigamonkeys.wordpress.com/2009/10/16/coders-c-plus-plus/,,1439061082
10028336,story,,,17,12,personjerry,"Ask HN: How do you start a bank?",,"Theoretically, if one wanted to, how would one start a bank?<p>Also, are there any conceivable reasons for a startup to be a bank startup?",1439061060
10028335,comment,10027102,10027102,0,0,aurora72,,,"Why nobody mentioned Paul Graham&#x27;s ANSI Common Lisp book? It &#x27;s got almost zero &quot;noise&quot; and full of signals .)",1439061043
10028334,comment,10027822,10027941,0,0,brianobush,,,"I would argue that the typical Japanese consumer walks much more than in the US. Thus, I imagine users would augment their current walking routines. Getting around in a large metropolitan area is the problem, but how you do it can vary. walk+bike, walk+train, cooltoy+walk+train, etc.",1439061038
10028333,story,,,56,7,twakefield,"Plate IQ (YC S15) Turns Paper Invoices into Predictive Insights",http://techcrunch.com/2015/08/08/plate-iq/,,1439061017
10028332,comment,10027102,10027102,0,0,hackuser,,,"There&#x27;s another problem besides poor signal-to-noise, the information in pop-(history, psychology, economics, etc.) books often is simply wrong or deceptive. Even scholarly books can misinform you or give you a very biased perspective; with millions (tens of millions?) of PhD&#x27;s in the world, you can find a book that will say almost anything you like.<p>Thankfully, the experts in each field effectively review the books for you. An there are more widely-respected, serious scholarly works of true genius than you can read in your lifetime. The signal-to-noise generally is very high, misinformation is low, and writing by the very best is often very engaging.<p>In other words, if all you read is the very best humanity has to offer, you still won&#x27;t live long enough to read more than a fraction of it. So why waste your time on anything else?",1439060984
10028331,comment,10027566,10028030,0,0,garyrichardson,,,"I think this is the most important/accurate analysis in this comment thread.<p>Vancouver had a large AAA game industry for a decade or so. It was very much driven by exits -- all the small/medium studios got bought by Microsoft/EA/etc. The fever is over and AAA has all but collapsed in BC (and possibly the world -- I think there&#x27;s been a big shift to indie games).<p>I wonder if the lack of exits is a Canadian vs US culture thing? Is there data that shows fewer exits per capita? Are we Canadians more likely to settle for less? There&#x27;s not that many huge Canadian tech companies, and I can think of a couple that failed due to hubris (RIM, Nortel).",1439060983
10028330,comment,10027202,10027749,0,0,anu_gupta,,,"Looking at his comment history, it&#x27;s very likely he was being sarcastic",1439060981
10028329,comment,10026713,10028073,0,0,Someone,,,"It&#x27;s probably not really more about getting every item in 64 bits than about memory use. That allows one to index each item without doing further bit twiddling: you can simply declare the data as<p><pre><code>   unsigned int64_t *datapoints;\n</code></pre>\nBecause of that, I think I would have combined two 5-valued fields (need 3 bits each) rating and user area into a single 25-valued one (fits in 5 bits), and stored the others as proper bit fields. That gains you the single bit you need to put each item in a 64 bit value, and only complicates accessing two of the fields.",1439060975
10028328,comment,10027822,10027941,0,0,jkaunisv1,,,"It was gimmicky for me until it showed him walking with his mom. My grandmother used to love going for walks but now gets too tired too fast. I&#x27;m not saying I&#x27;d buy one of these just for that use case, but that&#x27;s the moment that made me see realistic applications. Could work well with a &quot;granny grocery cart&quot;, extending the time a person can stay independent as they age without being as cumbersome as a wheelchair.",1439060963
10028327,comment,10026022,10028313,0,0,DanBC,,,"> Now take a look at the recent articles on the UK&#x27;s much hyped NHS and how they are laggards in cancer survival because they do not take advantage of pharma innovations.<p>That&#x27;s definitely not the reason why the NHS has poor cancer outcomes.<p>Those very expensive new cancer meds add a month or so of low quality life (and are used within the NHS).<p>The problem is at the diagnosis end.",1439060958
10028326,comment,10027884,10028227,0,0,anonyfox,,,"The point of erlang <i>isn&#x27;t</i> beating micro benchmarks. Everyone and his dog <i>knows</i> that other techs have better performance.<p>The ease of scaling across machines, fault tolerance and low latency variation are more typical selling points. Besides that, god prevent erlang to become just-another-JVM-language, I embrace competition.",1439060941
10028325,comment,10025106,10027086,0,0,rosser,,,"Finland has an area of 130k mi². The US has an area of 3.7 <i>million</i> mi². As such, it would cost an order of magnitude more, <i>and then some</i>, to provide equivalent service, just based on raw numbers. When you actually look at population density maps of the US, however, and realize just how sparsely populated most of the area between the West Coast and the Mississippi River is, the picture is probably much worse.<p>Look, I&#x27;m not disagreeing with you that broadband access <i>should</i> be a universal thing. I emphatically agree that it should, which I&#x27;d have hoped one might have inferred from my comment, given, you know, that <i>I said exactly that</i>. But <i>should</i>, by itself, won&#x27;t make a damned thing happen. Someone still has to pay for it, and I don&#x27;t see the entrenched mobile (or wired) carriers in the flyover parts of the US jumping up and down with checkbooks in hand.<p>The US, whether for cynical, bureaucratic, pragmatic, or other reasons, doesn&#x27;t have a legal regime mandating that kind of coverage. I wish to hell it did. But calling BS on reality, as time-honored of an internet tradition as that may be, is a pretty lousy place from which to start changing it...",1439060929
10028324,comment,10027822,10028236,0,0,polynomial,,,"So, where is the Arthur C. Clarke matrix for startup product ideas?",1439060905
