ID,Type,Story,Parent,Points,Comments,Author,Title,URL,Content,Created
10028323,comment,10024066,10025800,0,0,lqdc13,,,"Or a sign that you should try something else. Not everyone can succeed at everything. Obviously it is best to recognize that as early as possible in the endeavor.",1439060893
10028322,comment,10027438,10027963,0,0,147,,,"I was exactly like this, until one Christmas I was giving the book The Lean Startup and decided building web applications was more fun and practical.",1439060826
10028321,comment,10027893,10027893,0,0,shahryc,,,"I think the Fed&#x27;s easy money policy of low-interest rates prop    institutional investors to park money with VCs for higher returns --- the combination of low-interest rates & lots of money in the valley enable SVB to capitalize on start-ups, unlike other banks. Curious to know if it was the same during the dot-com bubble",1439060777
10028320,comment,10027867,10028270,0,0,scoofy,,,"Negative and positive claims are not artificial, one is making a claim about positive existence, the other is making claims about lack of existence.<p>Of course we can manufacture the universal quantifier insofar as it&#x27;s a mapping of the existential quantifier. That is to say, proving something is &quot;not nonexistent&quot; is not a statement that requires the universal quantifier, it&#x27;s a claim that has simply mapped the equivalency of the existential quantifier, using the universal one.<p>This is still only a statement about positive knowledge.",1439060774
10028319,comment,10027822,10027943,0,0,sshagent,,,"thats exactly my first thoughts.  Seems a bold claim to travel so far, with such a seemingly small potential battery space",1439060730
10028318,comment,10027867,10028096,0,0,austenallred,,,"I just worry this notion will take off in religious circles without understanding what it means. (And I&#x27;m somewhat religious).",1439060727
10028317,story,,,97,24,miles,"Deconcentration of Attention: Addressing the Complexity of Software (2012)",http://deconcentration-of-attention.com,,1439060722
10028316,comment,10027438,10028031,0,0,ectoplasm,,,"The statement is also true if he hasn&#x27;t seen any games.  It&#x27;s just an anecdote about his experience, that&#x27;s fine.",1439060716
10028315,story,,,69,19,qfx3,"Krill: A terminal feed reader supporting RSS and Twitter",https://github.com/p-e-w/krill,,1439060708
10028314,comment,10028296,10028296,0,0,greenyoda,,,"Just a link to the K&R C book on Amazon.",1439060702
10028313,comment,10026022,10028212,0,0,slr555,,,"Beating up pharma seems to be easy sport but consider this.<p>Have you ever had serious case of bronchitis, or a high fever, or needed any kind of surgery?<p>Guess what? No anesthesia (yes it&#x27;s a drug not just a machine), no antibiotics, very likely no you.<p>Now take a look at the recent articles on the UK&#x27;s much hyped NHS and how they are laggards in cancer survival because they do not take advantage of pharma innovations.<p>Know anyone anyone with hypertension or diabetes? Ask them whether they were well controlled and side effect free on the first drug they were prescribed . That&#x27;s the big reason there are a lot of &quot;me too&quot; drugs that sell. (and while you&#x27;re asking see if they fully compiled with their doctor&#x27;s diet and exercise advice)<p>One size does not fit all.",1439060694
10028312,comment,10027884,10028227,0,0,chrisseaton,,,"The thing I don&#x27;t get about Erlang and BEAM is the idea that having lots of little processes means that your program will scale brilliantly to run in parallel.<p>Programming Erlang (authored by the creator of Erlang) says without any qualification at all that &quot;Concurrent programs are made from small independent processes. Because of this, we can easily scale the system by increasing the number of processes and adding more CPUs.&quot;<p>When I read that I was expecting it to be followed by &quot;ha ha... not really because of algorithmic sequential dependencies and Amdah&#x27;s Law of course!&quot; but it isn&#x27;t!<p>You can have an infinite number of processes but if the dataflow graph they form doesn&#x27;t have any parallelism then Erlang and BEAM aren&#x27;t likely to be able to work any magic to make them so. Even if it did have parallelism it is only going to have so much and you certainly won&#x27;t be able to arbitrarily scale it beyond that by increasing the number of processes.<p>What&#x27;s more the typical advice about mutable shared state in Erlang is to encapsulate it safely in an process - which seems to be a recipe for further serialisation to me and so a crazy thing to promote!",1439060691
10028311,comment,10027575,10027575,0,0,notsony,,,"&quot;Right now, our teams are working across the store to identify areas\nwhere we can phase out gender-based signage to help strike a better\nbalance. For example, in the kids’ Bedding area, signs will no longer\nfeature suggestions for boys or girls, just kids. In the Toys aisles,\nwe’ll also remove reference to gender, including the use of pink, blue,\nyellow or green paper on the back walls of our shelves.&quot;",1439060619
10028310,comment,10027318,10028024,0,0,JoshGlazebrook,,,"They can&#x27;t stop you from using a device that technically works on their network.<p>Say for instance you bring an unlocked AT&T iPhone 6 to Verizon. If you have an existing sim card (all LTE devices have them even on Verizon), you can simply swap your sim card into the device and it will activate automatically and work just fine. However, if you take that device into the store and need to get a sim card, they will refuse to give you one as they only activate devices that are on their whitelist.<p>A way around it would be to just borrow someone else&#x27;s Verizon LTE capable smartphone to activate temporarily to get a sim card and then just swap it into your device you want to use.",1439060606
10028309,comment,10028247,10028247,0,0,elmerfud,,,"This is why your pipes go bang in the walls!<p>When you&#x27;re working with and/or designing these systems all of this is expected.  In any modern country there&#x27;s literally hundreds of regulations steam plants and other systems of the like.  The really interesting thing is that there are mandated multiple mechanical safety mechanisms to prevent catastrophic failure in them.<p>The sad fact is that this is really less of a &quot;black hat&quot; hack and almost always directly related to someone failing to follow safety regulations either in design or implementation.  The cost of mandated safety devices seem to be more than the cost for bribes to the inspectors.",1439060601
10028308,comment,10026022,10026022,0,0,ams6110,,,"<i>Is medicine a good career choice for someone wanting to ‘make a difference’?</i><p>I wish people would stop using that phrase. Stalin &quot;made a difference.&quot;",1439060588
10028307,comment,10027332,10028062,0,0,josteink,,,"You may have missed the memo, but according to new wave feminism, the word &quot;meritocracy&quot; represents discrimination because you <i>don&#x27;t</i> give special treatment to people based on sex, ethnicity etc.<p>I&#x27;m not kidding, and Github had adopted this view as well. [1]<p>Among many, this CoC is seen as a continuation of this largely feminist agenda. And we don&#x27;t think it belong here. Open source I&#x27;d apolitical, meaning you can avoid political issues entirely in a good and neutral environment.<p>Why work so hard to make it political? For what gains?<p>[1] <a href=""http://readwrite.com/2014/01/24/github-meritocracy-rug"" rel=""nofollow"">http://readwrite.com/2014/01/24/github-meritocracy-rug</a>",1439060588
10028306,comment,10027308,10027308,0,0,paulsutter,,,"I prefer Minsky&#x27;s term &quot;suitcase word&quot;, which applies to most of the examples I can think of (consciousness, emotions, morality, justice, fairness, etc).<p>Example: the word &quot;morality&quot; can create difficultly because there are so many tangled layers of meaning that vary from person to person. Alternate, more easily discussed words might be &quot;ethics&quot; (less baggage) or &quot;conduct&quot; (perhaps no baggage).",1439060553
10028305,story,,,3,1,yk,"How Computers Are Changing the Way We Explain the World",http://www.wired.com/2015/08/computers-changing-way-explain-world/,,1439060536
10028304,comment,10026276,10028240,0,0,ThomPete,,,"Thats also my experience.",1439060522
10028303,comment,10022938,10022938,0,0,unicornporn,,,"Related: <a href=""http://simplefocus.com/flowtype/"" rel=""nofollow"">http://simplefocus.com/flowtype/</a>",1439060490
10028302,comment,10027566,10028232,0,0,Tiktaalik,,,"Unfortunately the referendum that would have given Translink (Vancouver&#x27;s transit authority) the steady revenue to expand light rail service deep into the Fraser Valley failed as anti-tax crusaders framed Translink as an ineffective organization.<p>The reality couldn&#x27;t be more different, as Translink is one of the most effective transit systems in western North America and is a model for transit planners. <a href=""https://www.biv.com/article/2015/3/who-takes-transit-work-metro-vancouver-info-graphi/"" rel=""nofollow"">https://www.biv.com/article/2015/3/who-takes-transit-work-me...</a><p>Once one leaves Vancouver proper the Metro Vancouver area has the same sprawling highways as any other region, but Translink&#x27;s service area is massive (imagine every transit service and organization in every town in the Bay Area being one service (ok Bay Area is a bit bigger)) and you can seamlessly go from Vancouver all the way to White Rock at the border within the system on one ticket. The Evergreen line which will connect the system to Port Moody and Coquitlam should come on line in 2016.",1439060470
10028301,comment,10026022,10027933,0,0,ams6110,,,"Most people who go through the extensive training required to be a doctor want more than &quot;modest pay&quot; as a result, and rightly so. And doctor pay is not the cause of the high cost of health care. Doctors could all work for free and all else remaining the same you&#x27;d hardly notice the difference.",1439060455
10028300,comment,10027438,10027945,0,0,tapirl,,,"Success or fail is more related to marketing than game originality and quality.",1439060413
10028299,comment,10025042,10027225,0,0,hn9780470248775,,,"If security were really your &quot;number one goal&quot;, then you would not create a site at all.",1439060407
10028298,comment,10027566,10028083,0,0,van_developer,,,"Vancouver is prob the most multi cultural city on earth and everywhere I&#x27;ve worked here is full of female executives, so American problems with ID politics don&#x27;t manifest here. Just walk the streets for 10mins you will hear a dozen different languages.<p>The problem is I get paid 2x the local salary to work for US startups remotely, and paid in USD a stronger currency. Everybody I know works remotely for Toronto, or US companies so I imagine power execs from around the world don&#x27;t want to come here for the same low compensation and high income tax reasons that force us lowly devs to contract outside the province. I haven&#x27;t seen much local hiring with options either, and if they do offer options they are tiny so why would I dedicate a huge chunk of my life to make somebody else&#x27;s company rich while making half the salary of my clone in SV who has full options.",1439060405
