ID,Type,Story,Parent,Points,Comments,Author,Title,URL,Content,Created
10028436,comment,10022691,10024126,0,0,callmeed,,,"Yes, at one point I was interested in the medical/healthcare space. I put an ad in our local CL (jobs => medical/health). I got responses from a few doctors and even the CEO of one of our local hospitals. While I never pursued anything in this space, I did get some interesting ideas and feedback.<p>Keep in mind, I don&#x27;t live in a large city or CL market–so, if you&#x27;re in a metro, you&#x27;ll probably get a lot of responses.",1439062911
10028435,comment,10027884,10028398,0,0,NhanH,,,"> True, that is a good selling point -- in theory. Indeed BEAM&#x27;s process isolation is better than the JVM&#x27;s on paper. In practice, so many Erlang systems have so much C in them (because Erlang isn&#x27;t fast enough for the data plane), that they can still bring down the entire VM (not as if there aren&#x27;t other ways of doing that even without native code), or they interfere with one another in other ways because of BEAM&#x27;s poor support for shared concurrent data stuctures.<p>From my limited knowledge of Erlang, both of your points seem to be off the mark:<p>- Erlang systems have a lot of C code, but the purposes of BEAM was to manage those individual pieces and have those C component isolated such as they can crashed without causing system-wide issue.<p>- Actor model does not require programmer concurrent data structure to be effective. Actually that&#x27;s the whole point of it...",1439062884
10028434,comment,10023127,10024442,0,0,erikbrodch,,,"haa...let&#x27;s see what the users think about it (:",1439062879
10028433,comment,10027307,10027307,0,0,postila,,,"I&#x27;ve started to learn freediving since 2010 with Natalia and Alexey. All  trainings with them were always amazing. I even decided to move my family to live next to the pool (in Moscow) where they do daily training -- to be able to train more often.<p>Every sea training in Dahab was always a LOT of fun and great experience for my whole life. There was always some magic around Natalia  – you understand that you&#x27;re sitting next to one of the greatest humans in the world, who is able to do smth absolutely incredible and it&#x27;s hard to reflect how deep are the feelings inside you during those moments. Her lectures and discussions were interesting even if you hear it for 2nd or 3rd or 4th time :) I will always remember that parts of my life and it&#x27;s really smth that is absolutely remarkable and amazing.<p>Those freediving trainings changed my life a lot. They changed how I think about anything what surrounds me: you consider any thing like &quot;it&#x27;s a part of the huge world&quot;, you fall in anger much less often, you become more stable, and strong.<p>I also will always remember when I went to just another training in the pool and right after that realized that Natalia just made yet another world (!) record during Russian competition. Or later, In Kalamata, Greece, in 2011, when she did a couple of depth records, in World Championship.. It was BIG. It was EPIC. Always. Every her move.<p>When I moved to San Francisco a couple of years ago, I was missing freediving and Natalia a lot. It&#x27;s strange that there is almost no freedivers in SF and Bay area. I see huge potential in this kind of sport for tech guys in California – we are always sitting with our computers and are lacking some way to reboot our mind. Freediving is GREAT way to get rid of everything useless from your brain at the end of every hard day. But maybe the ocean is too cold, or visibility is low.. Don&#x27;t know, but I hope it&#x27;ll become popular some day in this part of the world.<p>I should say special words about Alexey. This young guy (28 y.o.) is in his very difficult times these days. He should be strong to go through these days and months and years. He is active World Champion and World Record holder (WR: 128m in depth, with monofin only). But this is very personal and not so difficult as another thing – Natalia built probably the strongest local freediving school (thousands of people graduated) and strong national freediving organization – and the question is whether or not he will find enough power to continue this work. It&#x27;s hard time...<p>We all loved (and love and will love) Natalia. We wish all the good to Alexey and his sister, Oksana.<p>R.I.P Natalia. Thank you for all you did for us.",1439062875
10028432,comment,10012360,10013580,0,0,tripzilch,,,"They&#x27;re not haters. This is the type of discussion you should expect when discussing typography. It may seem like endless nit-picking, but it&#x27;s the sum of nit-picking over all the tiny details that adds up to great typographical design.<p>I understand this type of thread doesn&#x27;t really fit HN&#x27;s &quot;no gratuitous negativity&quot; guideline, but IMO there&#x27;s really no other way to constructively discuss typography. The whole field is made of attention to excruciatingly tiny details, but taken together, it adds up to great and beautiful design. It&#x27;s one of the things I love about it.<p>Maybe note that none of the criticisms are entirely dismissive or unnecessarily harsh, but well-argumented, just about tiny details.",1439062833
10028431,comment,10023127,10024303,0,0,erikbrodch,,,"hluska thanks for checking out the website, I would like to refer to a couple of your points:\n1. You chose two newsletters as examples: \nA. Accelerator news: the guy that publish this is the managing director of TechStars London, I can promise you that there are not a lot of people who know about accelerators as he does. That&#x27;s the all point, he gets access to content that someone who is not from the accelerator world wouldn&#x27;t find. \nB. Collection of startups: the curator here is one of the most active and smart angel investors in Israel, this guy has a chance to see so many startups years before others learn about them (invest really early). So you see, the intro doesn&#x27;t really matter here, what maters is the access to the info and both the examples you chose completely proves the value of the service. \n2. As for the chicken and egg problem, this is a challenge, but maybe I&#x27;ll share some numbers with you. We have around 500 curators and 7500 subscriptions to the different newsletters. Here are additional numbers from the past 6 months that gives us good indication that people discover content they wouldn&#x27;t have found easily otherwise: <a href=""https://medium.com/@RefreshBoxx/500-curators-5-000-links-6-months-interesting-stats-from-refreshbox-and-1-insight-we-loved-f9bc25ec92b6"" rel=""nofollow"">https://medium.com/@RefreshBoxx/500-curators-5-000-links-6-m...</a>\n3. I approached to get feedback here because I&#x27;m still in the basics, getting new users is hard, but the main challenge is make the curators to be as active as possible. From discussions with them, we know they want more engagement and that was my question, how can we make subscribers to engage more with the curators. \nAppreciate your feedback and happy to get more!",1439062825
10028430,story,,,1,0,based2,"Monolith by Andromeda Software Development",https://www.youtube.com/watch?v=VD8c8XagJms&feature=youtu.be,,1439062811
10028429,comment,10027332,10027972,0,0,anon3_,,,"Do you expect everyone to water down thoughts with a bullet-point list of qualifiers to have a point?<p>The people causing the social outrage debacles, often <i>can&#x27;t</i> program. They&#x27;re complete outsiders who think they can use social ideas and useful idiots as a vehicle for <i>their own benefit</i>.<p>Many QAers and PM&#x27;s can or have programmed some, at one point, or else they wouldn&#x27;t understand the domain of the problem.<p>Most of the trouble crowd tend to be social marketers and so-called &quot;evangelists&quot; on twitter.<p>They&#x27;re not programmers.<p>These people leading the vanguard of your code of conduct movements - they&#x27;re not even really tech. They&#x27;re happy when you invent these new job positions to give them a paycheck.",1439062773
10028428,comment,10028387,10028387,0,0,jaryd,,,"Website in question: <a href=""http://www.tundefashola.com"" rel=""nofollow"">http://www.tundefashola.com</a><p>&quot;According to information technology experts, www.tundefashola.com, created by the firm for the former governor, is a WordPress website and an upgrade could not have cost more than N300, 000.&quot;",1439062732
10028426,comment,10027884,10028312,0,0,RickHull,,,"> <i>The thing I don&#x27;t get about Erlang and BEAM is the idea that having lots of little processes means that your program will scale brilliantly to run in parallel.</i><p>The point is scaling.  Think in terms of request rate.  If you know you can have millions of processes per machine and they run well in parallel, then you can handle requests with processes and stop worrying.",1439062719
10028425,comment,10027408,10027408,0,0,xapss,,,"What a great read",1439062700
10028424,comment,10024681,10026110,0,0,MagnumOpus,,,"Like another poster said, GWB scored 1206 in his SAT - that is below the 80th percentile. An 80th percentile IQ score is 113 - it will not get you into Yale or Harvard unless you are both a legacy admit as well as a son of a millionaire.",1439062687
10028423,comment,10028199,10028199,0,0,nostrademons,,,"Get a job at a big tech company (Google, Facebook, Microsoft, Yahoo, DropBox, Uber, etc.).  Beyond a certain scale, every problem is distributed, and you&#x27;ll be dealing with distributed systems and their pitfalls as a routine part of your job.<p>It&#x27;s very difficult to tell what is of practical significance vs. what is just theoretically interesting without directly working with a real distributed system storing real data for real users.  For example, master election is something you rarely face in the day-to-day: you build a system once (or just use Zookeeper) and then re-use it for all your systems.  Merkel trees and vector clocks are fairly special-purpose - once in a while you&#x27;ll find a system where they&#x27;re critical, but a lot of the time you don&#x27;t need them.  Versioning problems and choices of ID schemas, however, come up <i>all the time</i>.  Bloom filters are far more useful than the amount of theoretical or blogosphere attention given to them would indicate, sharding functions are important to know, and concurrency & buffering are critical skills.",1439062657
10028422,comment,10026276,10028402,0,0,davidgerard,,,"Oh really? You&#x27;ve verified this yourself? This comment notes the curious lack of evidence <a href=""https://news.ycombinator.com/item?id=10027569"" rel=""nofollow"">https://news.ycombinator.com/item?id=10027569</a>",1439062641
10028421,comment,10027867,10028320,0,0,Retra,,,"A claim about the lack of existence of a thing is equivalent to a claim about the existence of a contradiction (or possibly some other condition) involving that thing. You can convert any negative claim into a positive one by recognizing this. All you need is the ability to identify features (or possibly define them) for the subject in question.<p>And this is also supported by dual nature of existential and universal quantification.",1439062612
10028420,story,,,1,0,jsnathan,"User with Muslim Name Blocked from Downloading Sophos Antivirus",http://www.theregister.co.uk/2015/08/07/sophos_anti_muslim_name_filter,,1439062599
10028419,comment,10027448,10027448,0,0,arjitkp,,,"What about the technical aspects like the coding part?  I am learning Python as of now. Anything else I should get my hands dirty on",1439062568
10028418,comment,10027822,10028238,0,0,kristopolous,,,"need to require non-anonymous payment (credit card etc) because they&#x27;d be very steal-able.<p>Also, train stations.",1439062551
10028417,comment,9995148,9999847,0,0,senderista,,,"One of the few plausible rationales for patents is that they encourage public disclosure of trade secrets.",1439062520
10028416,comment,10027566,10027566,0,0,ryandrake,,,"> But talk to any hot tech entrepreneur in the Lower Mainland and you will hear the same story: While the city is awash in startups, “there is an absolute shortage of experienced and talented senior executive-level people”<p>Ahh, there it is. The mythical &quot;engineer shortage&quot; was bound to pop up, as it does in every single article about tech labor. If there is really a shortage of engineers (supply), then wages (price) would increase to the point where supply met demand. Is this happening?",1439062517
10028415,comment,10027867,10028342,0,0,awptimus,,,"Not true. Given a hypothesis &quot;there exists&quot; the first observed instance is proof of the positive. The inverse however, again, requires you to sample the entire population and collect all data.",1439062501
10028414,comment,10024681,10027387,0,0,tcbawo,,,"I see some mixed data on Ireland.<p>A quick search shows an unemployment rate that just crossed below 10% in April.  From 2000-2008, the unemployment rate ranged 4-5% (with very high unemployment in the 80s and 90s).\n<a href=""http://www.tradingeconomics.com/embed/?s=ieuert&v=201508061744d&d1=19150101&d2=20151231&h=300&w=600"" rel=""nofollow"">http://www.tradingeconomics.com/embed/?s=ieuert&v=2015080617...</a><p>Also, government debt to GDP rose steadily and is near historic highs, although has recently begun to fall:\n<a href=""http://www.tradingeconomics.com/embed/?s=irldebt2gdp&v=201508071422d&d1=19150101&d2=20151231&h=300&w=600"" rel=""nofollow"">http://www.tradingeconomics.com/embed/?s=irldebt2gdp&v=20150...</a><p>By which measure is Ireland in a better position than 2008?",1439062448
10028413,story,,,1,0,alivahab,"Chariot (YC W15) hiring its first dedicated Front End dev/designer",https://angel.co/chariot/jobs/66525-front-end-developer-designer,,1439062437
10028412,story,,,1,0,mikeevans,"SFUSD scrambling to fill classrooms amid teacher shortage",http://www.sfexaminer.com/sfusd-scrambling-to-fill-classrooms-amid-teacher-shortage/,,1439062426
10028411,comment,10027566,10028368,0,0,mahyarm,,,"What is the tax rate?  CA tax rate is about comparable to BC tax rate.  Since your remote, what stops you from moving to Mexico lets say, living beside the beach and paying a lot less in taxes and living expenses?  Family?  Children?",1439062420
10028410,comment,10027356,10027870,0,0,steveklabnik,,,"I see dependency management as orthogonal to static vs dynamic linking, personally. Linking is about producing the final artifact, dependency management is about how you develop the software.<p>Static linking can _also_ be dangerous: with dynamic linking, update your openssl, all your stuff is fixed. With static, you have to recompile every single thing that uses openssl...",1439062418
10028409,comment,10025743,10027926,0,0,omouse,,,"Interestingly enough, the original goal for PayPal as Elon Musk articulates it is that they would end up as infrastructure for all digital transactions which would make fraud much more difficult. <i>All the fraud issues seem to be at the intersection between different methods of transfers.</i> Wire transfers can involve multiple banks and the information for them can be shoddy; there&#x27;s too much room for error and the whole authentication issue, ugh.<p>Paypal or now bitcoin (or the blockchain at least) as the main infrastructure would definitely reduce fraud and errors.",1439062388
10028408,story,,,1,0,elmar,"Venture Firms Fret as Y Combinator Soars",http://genius.com/Eric-newcomer-venture-firms-fret-as-y-combinator-soars-annotated/,,1439062351
10028406,comment,10027307,10027952,0,0,pferde,,,"The murderer is the gardener.",1439062320
10028405,comment,10024958,10026032,0,0,eropple,,,"I log into different Chrome profiles that style the same pages differently. Dumb and easy.",1439062319
10028404,comment,10025106,10027364,0,0,amazon_not,,,"Furthermore, I&#x27;d say that the broadband situation in Finland is substantially different from the US, despite the very low popularion density of Finland.<p>In Finland everybody that wants broadband can get broadband. In fact everybody that wants it has it. 92% of Finns have an Internet connection, either fixed only (22%), mobile broadband only  (i.e. 3G or 4G at 28%) or a combination of both (42%). Source: <a href=""https://www.viestintavirasto.fi/en/aboutthesector/statistics/internetandtelephone/take-upofbroadbandconnections.html"" rel=""nofollow"">https://www.viestintavirasto.fi/en/aboutthesector/statistics...</a><p>Fast broadband (100 Mbps or faster) is actively promoted and developed by the government. All permanent recidences shall be within a mile of an Internet backbone access point where service is available at 100 Mbps or more. This means local residents, co-ops or ISPs will easily be able to hook up anybody at 100 Mbps or more. Since a mile is the maximum distance average loop lenghts will be much shorter.  Source: <a href=""http://www.lvm.fi/pressreleases/4425644/broadband-for-all-2015-project-gathers-steam"" rel=""nofollow"">http://www.lvm.fi/pressreleases/4425644/broadband-for-all-20...</a><p>Funds are actually made available to provide broadband access to not-spots. The last 5% of a population is always hard to reach with fixed broadband, but subsidies are provided to hook up areas which aren&#x27;t commercially viable otherwise. Source: same as above.<p>3G/4G mobile broadband is cheap, unlimited and uncapped with three facilities based operators and a handfull of MVNOs on top of that. 4G is actually faster and cheaper than a xDSL connection. Mobile broadband is thus actually a viable fixed broadband substitute.<p>20% have a fixed broadband connection of 100 Mbps or more. Not as in has access to, but as actual delivered connections. 46% have 10 Mbps or more and 7% 30 Mbps or more. Source: <a href=""https://www.viestintavirasto.fi/en/aboutthesector/statistics/internetandtelephone/fixed-linebroadbandsubscriptionsbyconnectionspeed.html"" rel=""nofollow"">https://www.viestintavirasto.fi/en/aboutthesector/statistics...</a><p>It is left as an excercise for the reader to figure out why Finland does better at broadband than the US despite a low population density.<p>Further required reading: Regulatory capture in telecommunications",1439062267
10028403,comment,10028394,10028394,0,0,cdvonstinkpot,,,"127.0.0.1 connects to itself- the localhost. While 0.0.0.0 doesn&#x27;t connect to anything, it just acts as a passthrough for any address.",1439062237
10028402,comment,10026276,10027244,0,0,semiel,,,"It&#x27;s not the _trappings_ of an organization that are important, it&#x27;s the fact that they have lots of working code. The Ethereum network does exactly what it claims to do, and does it well.",1439062222
10028401,comment,10027358,10028155,0,0,brobinson,,,"This raises an interesting question: how could a person determine if the connection between an edge (say, Cloudflare) and the destination server is actually encrypted?",1439062198
10028400,comment,10027884,10028312,0,0,vezzy-fnord,,,"<i>but it isn&#x27;t!</i><p>Chapter 26 of <i>Programming Erlang, 2nd Edition</i>, Programming Multicore CPUs, quite explicitly notes the problem of avoiding sequential bottlenecks, and even devotes an entire exercise to parallelizing a sequential program.",1439062188
10028399,comment,10027102,10027456,0,0,tomjen3,,,"Reading that article is outrageous. Save thousands of lives a year in every single hospital? And what is the cost? About 2 to 3 million dollars? It would be an absolute bargain at 10 Billion dollars.<p>But we are not doing it. Why? Because we misallocate the founds.",1439062181
10028398,comment,10027884,10028326,0,0,pron,,,"> The ease of scaling across machines<p>What does that have to do with the VM implementation?<p>> fault tolerance<p>True, that is a good selling point -- in theory. Indeed, BEAM&#x27;s process isolation is better than the JVM&#x27;s <i>on paper</i>. In practice, so many Erlang systems have so much C in them (because Erlang isn&#x27;t fast enough for the data plane), that they can still bring down the entire VM (not as if there aren&#x27;t other ways of doing that even without native code), or they interfere with one another in other ways because of BEAM&#x27;s poor support for shared concurrent data structures.<p>> low latency variation<p>Nothing that can&#x27;t be achieved on the JVM. Much of the low-latency Erlang enjoys is because relatively little data is kept on the Erlang heap anyway, and whatever significant amount of data is kept on the Erlang heap, it&#x27;s in non-GCed ETS. If that&#x27;s your way of achieving low latency variation, Erlang can do better on HotSpot.<p>> Besides that, god prevent erlang to become just-another-JVM-language, I embrace competition.<p>If your goal is not to have the best language environment you can but to show the world you have impressive results <i>for the effort you&#x27;ve put in</i>, then that&#x27;s a whole other discussion.<p>And if all you want is competition, you can have Erlang on BEAM <i>and</i> the JVM. Why tie the language to one VM? Many JVM languages also compile to JavaScript, too (Clojure, Kotlin, Scala, Fantom and probably more)",1439062176
10028397,comment,10027854,10028125,0,0,CamperBob2,,,"Yes, it&#x27;s a bullshit/flamebait title.  This would be an <i>excellent</i> opportunity for an admin to step in and edit the title.<p>Those who are modding you down have no clue how the various government lists work, and what the penalties are for exporting anything to someone on them.<p>Yes, as with most US export law, these lists are arbitrary, feckless, and generally stupid, and yes, they contain a lot of very common names.  But the &quot;Muslim&quot;-ness of the name has absolutely nothing to do with anything.  (Exactly what is a &quot;Muslim&quot; name, anyway?  Am I a Christian because my name is John?)",1439062166
10028396,comment,10027822,10028216,0,0,vegabook,,,"Imagine two of these colliding head on in a mall or campus. Potential 15mph head banger. Definitely dangerous and maybe fatal. That&#x27;s why these rules are proliferating. Fact is the radius in which any of these motorised mobility aids is safe is much larger than that of a pedestrian. Our legs, torsos are very strong, with dozens of muscles wired directly to our brains for minimum latency, so we can stop or dodge essentially instantly. These tools are therefore appropriate only in less densely travelled areas (factories, warehouses, etc) or on special pathways with strict traffic rules.",1439062145
10028395,comment,10026022,10028382,0,0,DanBC,,,"Show me one of those treatments not offered on the NHS.<p>(Edit: yes, I am sure about this).<p>EDIT2: for one example where the UK NHS gets things wrong in diagnosis: patient finds a lump, visits GP. That GP then gives a rapid referal to a specialist, who then gives rapid screening requests.<p>What should happen is the GP asks for the rapid screening, and simultaneously makes the rapid referal to specialists.  This would reduce time to diagnosis, and time to start treatment, and both of those are important in outcomes.",1439062135
10028394,story,,,1,1,arash_milani,"What's the difference between 127.0.0.1 and 0.0.0.0?",https://superuser.com/questions/949428/whats-the-difference-between-127-0-0-1-and-0-0-0-0,,1439062123
10028393,comment,10027566,10028344,0,0,mahyarm,,,"I don&#x27;t think the hiring demand or sophistication is high enough for them to consider visas basically, which shows you how immature the software industry is there.  Also very sr. devs in vancouver make less than new grads in the bay area.",1439062115
10028392,comment,10028305,10028305,0,0,FigFruitLoop,,,"When we all use these &quot;genderless no form factor options&quot; I&#x27;ve heard are all the rage nowadays...",1439062109
10028391,story,,,1,1,jseliger,"Perfect Compromise: Welcome to the nerve-wracking reality of being Finland",http://harpers.org/blog/2015/08/perfect-compromise/,,1439062064
10028390,story,,,1,0,based2,"Ada Comparison Chart",http://www.ada2012.org/comparison.html,,1439062062
10028389,comment,10027566,10028375,0,0,msie,,,"Very eloquently put. I would be working in the states if I weren&#x27;t so worried about my parents&#x27; health.",1439062045
10028388,story,,,5,0,based2,"Hold-And-Modify by CNCD and Fairlight",https://www.youtube.com/watch?v=idOK0JlRhZY,,1439062039
10028387,story,,,2,1,passenger,"Nigerian governor builds his personal website for $400000 with taxpayer's money",http://www.premiumtimesng.com/news/headlines/188040-outrage-over-fasholas-spending-of-n78million-lagos-funds-on-own-website.html,,1439062036
10028386,comment,10027566,10027566,0,0,bretthopper,,,"Someone else touched on this below but this article ignores the brain drain problem.<p>It&#x27;s true that Vancouver can attract talent from SF/Seattle easier than Toronto, for example, but conversely it also means Vancouver/BC natives are way more likely to jump to SF/Seattle since they are so close.",1439061985
