ID,Type,Story,Parent,Points,Comments,Author,Title,URL,Content,Created
10028490,comment,10027438,10028023,0,0,thearn4,,,"> Can you name other &quot;career paths&quot; where are more technical & creative challenges open to solve?<p>Fair question. Once I was in graduate school (math program), I went down the scientific/large-scale computing path. It isn&#x27;t a very large field of course, compared to consumer-facing software. It was more of a personal drive.",1439063991
10028488,comment,10027884,10028477,0,0,pron,,,"> Erlang makes it much easier to do well and much harder to screw up.<p>That&#x27;s a feature of the language, not the VM (compare with Clojure, that does a similar thing on the JVM). You could still do all that on a higher-quality VM (simply because the effort put into it is orders-of-magnitude more than into BEAN; not because OpenJDK&#x27;s people are smarter or anything).",1439063970
10028487,story,,,6,3,rsrsrsrs,"Ask HN: How do you choose the next book you'll buy?",,"I just browse Amazon until I find something that interests me. I don&#x27;t really like Goodreads.<p>Usually I have a subject in mind, for example, I want to buy a book on physics. But sometimes I want something more specific, like a book on star interiors or supernovas or exotic stars, and then it is more difficult to find something worth my buck.",1439063951
10028486,story,,,5,2,rosser,"That 'Useless' Liberal Arts Degree Has Become Tech's Hottest Ticket",http://www.forbes.com/sites/georgeanders/2015/07/29/liberal-arts-degree-tech/,,1439063934
10028485,story,,,109,38,rubyn00bie,"When would you choose Erlang? (2013)",http://blog.troutwine.us/2013/07/10/choose_erlang.html,,1439063916
10028484,comment,10027102,10028250,0,0,ridgeguy,,,"I&#x27;ll second these picks as having lots of information wrapped up inside engaging writing.<p>Ignition:  <a href=""http://web.gccaz.edu/~wkehowsk/ignition.pdf"" rel=""nofollow"">http://web.gccaz.edu/~wkehowsk/ignition.pdf</a><p>&quot;Excuse me, sir...&quot;:  ftp://www.fourmilab.ch/pub/etexts/www/gergel/isopropyl_bromide.pdf",1439063839
10028483,story,,,1,0,marcuskaz,"Internet History (1997)",https://mkaz.com/webdev/history/,,1439063808
10028482,comment,10027884,10028426,0,0,pron,,,"Sure, but you can have those millions of processes on the JVM, too <i>and</i> scale better because of better access to shared data than ETS.",1439063771
10028481,comment,10027867,10028415,0,0,duaneb,,,"Depending on what you&#x27;re observing, it&#x27;s only statistical probability you actually observed anything. There is no such thing as an inductive proof; there is no way you can prove anything exists to another person.",1439063764
10028480,story,,,1,0,Vindl,"Win a VIP Tour of the CERN Facilities in Switzerland",https://www.facebook.com/l.php?u=https%3A%2F%2Fgleam.io%2F3W4NZ-ir1mHs%3Fl%3Dhttps%253A%252F%252Fgleam.io%252Ffb%252F3W4NZ377073969089506&h=KAQEtFn2Q,,1439063756
10028479,comment,10027884,10027884,0,0,rubyn00bie,,,"Nice article, and for an Elixir fan, provides a nice little snippet on something I&#x27;ve been having issues with but hadn&#x27;t really put my finger on until I saw it:<p>&quot;[...] and I really dislike that Elixir tries to hide immutability. That does make it slightly easier for beginners, but it’s a leaky abstraction. The immutability eventually bleeds through and then you have to think about it.&quot;<p>I don&#x27;t think it necessarily tries to hide it (at all), but it does have some instances where something feels like a mutable structure. Those can be, at least for me, a bit confusing to reason about if you&#x27;re expecting things both be and look immutable.<p>I suppose now that I know exactly what&#x27;s weird, I should just go dig through the code and figure it out. Problem solved?<p>... One other thing, because I see this in the comments already, is that BEAM isn&#x27;t the tool for every job-- but for some jobs, it is the only tool to do it well. Is the JVM faster at general tasks? Hell yes, but that&#x27;s not the point, it&#x27;s not even why BEAM is around.<p>It&#x27;s about:<p>* Small concurrent workloads. Really long running CPU intensive tasks aren&#x27;t going to be good.<p>* Low latency. Not just low, but with a very very small standard deviation. Your application&#x27;s performance will be consistent.<p>* Fault tolerant.<p>The list goes on, and here&#x27;s a nice summary of it (both bad and good):<p><a href=""http://blog.troutwine.us/2013/07/10/choose_erlang.html"" rel=""nofollow"">http://blog.troutwine.us/2013/07/10/choose_erlang.html</a><p>There are times when I choose the JVM, there are times when I choose BEAM or MRI. I just try choose the right tool for the job, but some tools, make some jobs, very difficult.<p><i>cough</i> ruby <i>cough</i> concurrency <i>cough</i><p>Edit: One thing for people not familiar with BEAM, a &quot;process&quot; is not a Unix process, from the Elixir documentation:<p>&quot;Processes in Elixir are extremely lightweight in terms of memory and CPU (unlike threads in many other programming languages). Because of this, it is not uncommon to have tens or even hundreds of thousands of processes running simultaneously.&quot;",1439063730
10028478,comment,10027822,10028469,0,0,jhardcastle,,,"> The main engineer, Saito and his team at Cocoa Motors plan to launch the WalkCar this autumn and the expected price is somewhere around 800 bucks.",1439063730
10028477,comment,10027884,10028312,0,0,corysama,,,"Everything you are saying is technically correct.  The issue is that Erlang is trying to solve a different problem than you are describing. It sounds like you are hoping to perform some large but single task and are disappointed that Erlang can&#x27;t defeat the Amdahl limitations inherent in your task. That&#x27;s not Erlang&#x27;s goal.<p>Erlang&#x27;s goal is to take problems that are embarrassingly parallel in theory and make them embarrassingly parallel in practice. Serving a billion independent http requests in a distributed, parallel manner can technically be done in Java or C or assembly. But, it&#x27;s very hard to do well and very easy to screw up in painful, confusing, life-wasting ways. Erlang makes it much easier to do well and much harder to screw up.",1439063728
10028476,comment,10027884,10028435,0,0,pron,,,"> Actor model does not require concurrent data structure to be effective. Actually that&#x27;s the whole point of it...<p>That&#x27;s complicated. Actors don&#x27;t require concurrent data structures for the bits that don&#x27;t require concurrent data structures but they do for the bits that do :) That&#x27;s why Erlang has ETS. That&#x27;s why you still need a database.",1439063712
10028475,comment,10027137,10027137,0,0,tyrick,,,"Cute.  I didn&#x27;t know nameservers had so much personality.",1439063707
10028474,comment,10027566,10028375,0,0,rohamg,,,"> Your [sic] shocked to find out that the pay is literally half in Vancouver.<p>I think this is changing. There are great new companies to work for in Vancouver who depend on access to top-tier talent and are willing to pay for it.<p>We [1] have hired several folks from SF and most of our alums tend to head straight to the Valley, so it&#x27;s clear that we&#x27;re competing on the global stage for talent. This by nature means average compensation that must be competitive. Others must be seeing this too.<p>[1] Axiom Zen: <a href=""https://axiomzen.co"" rel=""nofollow"">https://axiomzen.co</a>",1439063702
10028473,story,,,3,1,based2,"Everything is fashion by Ninjadev",http://www.pouet.net/prod.php?which=65978,,1439063690
10028472,comment,10027566,10028411,0,0,van_developer,,,"Friends, family and girlfriend live here but yes I could live anywhere though Vancouver is a good city if you can afford it. My tax rates are prov 40.7% and 27.3% federally though it&#x27;s a marginal and progressive rate depending on income level and ridiculously complicated. I still pay employment insurance and 4.95% CPP too, plus 12% sales tax on almost anything I buy, except for wine which is almost 100% taxed through government owned liquor store markup so your $10 California wine is $26 after tax and exchange plus GST 7%.",1439063672
10028471,comment,10027383,10027383,0,0,bdcravens,,,"What&#x27;s the business model?",1439063613
10028470,story,,,2,0,byg80,"How Snapzu is trying to improve on up/down voting and the “disagree” down vote",http://snapzu.com/drunkenninja/voting-system-overview-of-upcoming-functionality-for-release-53,,1439063611
10028469,comment,10027822,10027822,0,0,namlem,,,"Is it as cheap as these[1] mass produced mini segways that have become popular? The linked products also have a range of 8 miles and a top speed of more than 9mph.<p>[1]<a href=""http://www.amazon.com/s/ref=nb_sb_noss?url=search-alias%3Daps&field-keywords=self%20balancing%20scooter"" rel=""nofollow"">http://www.amazon.com/s/ref=nb_sb_noss?url=search-alias%3Dap...</a>",1439063555
10028468,comment,10027102,10028332,0,0,shadowfox,,,"The question then is: how do you find such books especially as a layman?",1439063550
10028467,comment,10027438,10027438,0,0,geminiradio,,,"Can a great game fail? I guess I&#x27;m finding out right now. It&#x27;s early, it&#x27;s currently scary, and it could still go either way. Pure drama! Our game was released 2 days ago (Spider: Rite of the Shrouded Moon - ShroudedMoon.com). It&#x27;s metacritic&#x27;ing at 94, which is stellar.  It&#x27;s got almost exclusively very very positive reviews on Steam and the App Store. It&#x27;s the sequel to the Game of the Year in 2009, per TouchArcade, the Indie Games Festival, and Apple themselves. Sounds like a guaranteed hit, right?  So far it&#x27;s doing 1/3 the business of any of our prior games, despite an App Store banner (not as good as ones we&#x27;ve had in the past but still - we&#x27;re super spoiled, very few companies get one).  This is definitely our best game, we truly poured our hearts and souls into it, we are a highly respected company (called Tiger Style), and players are responding super well to it.<p>So what&#x27;s different?  Well most notably, there are probably 20-30x more indie development studios in the market than there were when we started in 2008. I&#x27;ve heard hundreds of games come out on the App Store EVERY DAY. Angry Birds 2, one of the biggest properties ever, is free and it came out last week. This feels like a quiet time on Steam, but so far we have little traction there, and you need to demonstrate sales before Steam gives you main carousel promotion. Gaming press is overwhelmed with things to write about, so although they&#x27;ve been interested, we don&#x27;t have many reviews from them yet. We&#x27;ve got lots of Lets Play and YouTubers, but how many sales does 500 views convert into?<p>Honestly, in the past we&#x27;ve been like &quot;It&#x27;s fine. We make great games that people love. We&#x27;ll just release it, and the audience will find it.&quot;  That was true in 2009 when we released Spider: The Secret of Bryce Manor with literally no promotion whatsoever.  It was less true in 2012 when we released Waking Mars (alongside Outwitters, if you&#x27;re out there Alex!), but still the App Store sustained us and the Steam market eventually found and loved us and gave us a few dollars.  But the worry is that in 2015, no matter how good your game is, the audience has way way way way too many amazing games to choose between.<p>We&#x27;re currently far behind, as just one example, a game about programming in Assembly language. It&#x27;s probably amazing, I can&#x27;t wait to try it.  And that&#x27;s the problem.  So many things to play, competing for your attention.<p>SO! What does the dramatic near future look like for us? Well, I think we have major piles of new press reviews coming in on Monday and Tuesday. That will definitely help with awareness.  And we&#x27;re pushing on some of our more unique features in hopes of being recognized as newsworthy (eg - it uses your local real world time and weather and mirrors them in the game, it&#x27;s based on a real historical secret society that you have to research in real life to learn the deepest secrets, many many layers of mystery and gameplay). We&#x27;re asking our tastemaker and other well respected developer friends to help spread the word.  I believe with enough awareness we&#x27;re back in business - it&#x27;s happened for us before. But if that doesn&#x27;t pay off by the end of the week, very few people will write about us after that. So our hope at that point would be to be a &quot;long tail game&quot; that wins awards and winds up on &quot;best games you didn&#x27;t play last year&quot; lists. It might pay the bills, or not, and it certainly isn&#x27;t what we hoped for.<p>Alex - if you&#x27;re out there - I&#x27;ve been in indie 7 years, before the indie revolution really started. I was in mainstream for 11 years before that. It&#x27;s been crazy watching the market as we worked on this game. It&#x27;s hard to target a market this volatile when the game you make takes 2+ years to make. By the time you&#x27;re done, everything is different.  So, yeah, I relate to a lot of what you wrote, and thanks for sharing! -Randy",1439063504
10028466,comment,10026276,10028240,0,0,davidgerard,,,"What I see is Bitcoin fans pointing out the glaring problems in every altcoin, but not admitting that every single one of those problems applies to Bitcoin as well.",1439063501
10028465,comment,10027308,10028349,0,0,paulsutter,,,"How about this: &quot;suitcase word&quot; means one word, different concepts to different people. Which seems aligned with your definition. &quot;Essentially contested concept&quot;, on the other hand, I can&#x27;t think of an example of two people contesting the same concept. I&#x27;m sure examples exist, I&#x27;m just drawing a blank.<p>My own experience is that all the words I listed are surprisingly problematic in conversations / debates. An example of difficulty. Take the question, &quot;can a machine be conscious&quot;? You would expect that the tedious arguing could be shut down with the statement &quot;maybe that&#x27;s like asking whether a submarine can swim.&quot; But there is endless debate on the subject. Consciousness is a suitcase word. And it seems, an &quot;essentially contested concept&quot;, or is it? The utility of the term is still unclear to me. Id love to hear examples, I&#x27;m probably not seeing the full picture.",1439063483
10028464,comment,10027822,10028418,0,0,kaybe,,,"In Brussels you can rent bikes from public transport at numerous stations in the city. Either be a registered citizen or allow them to put 150€ on hold on your credit card (and pay 1.60€ per day as long as no ride is longer than (I think) half an hour). It&#x27;s easy to use and popular, so I don&#x27;t think it&#x27;d be a problem.",1439063449
10028463,comment,10027318,10027837,0,0,philamonster,,,"I&#x27;ve an iPhone 5 purchased in January 2013 with a new battery from iFixit from this past February and there are just certain apps that absolutely kill battery life regardless of which release of iOS 8 I use.<p>Though Apple has made their new software versions for their new hardware I think overall performance since early iOS 6 releases has been consistent on iPhone 5+ with the various exceptions for bugs. The problem I see is with devs for large deployments (Google, MLB, Yahoo, etc.) ONLY take into consideration the new hardware. My MLB.tv subscription which includes At Bat app has become such a drain on my battery since the start of the 2015 season. Even streaming radio broadcasts will use 50% of my battery after 5 or 6 innings with the screen locked as in NOT DISPLAYING ANYTHING! 2 years ago a Red Sox/Yankees game (4+ hours) would use maybe 20%.<p>Weekdays, I get a couple hundred emails plus 10-30 calendar notifications per day from personal and work Google managed domains. Easily that takes up 20-30% over an 8 hour workday with all the fetch. Previous employer with Exchange and push using Active Sync was maybe 10% usage per 8 hours. Weekends of course I rarely see the drain at all in regards to mail.<p>Point is, I know I&#x27;m at EOL with iPhone 5 but I at this point can&#x27;t really blame Apple as stock (and on weekends unless streaming a ball game) battery life is as consistent as the day the phone was purchased.",1439063403
10028462,story,,,1,1,simonebrunozzi,"Billionaires Fund a 'Manhattan Project' for Nutrition and Obesity",http://www.npr.org/sections/thesalt/2012/09/19/161444045/billionaires-fund-a-manhattan-project-for-nutrition-and-obesity,,1439063400
10028461,comment,10027307,10027950,0,0,postila,,,"Every time you drive a car you do sort of it. You cannot concentrate all your attention on one small thing -- you rather should do deconcentration and observe many objects at the same time.<p>Another example is searching mushrooms. If you do concentrate, you&#x27;re not effective.<p>There are much more examples in the life.",1439063374
10028460,comment,10025106,10028404,0,0,rosser,,,"If your point is, &quot;Finland does broadband better than America,&quot; then well done you. It can join the club with just about every other first-world nation on the planet.<p>Meanwhile, I&#x27;m still waiting for anything that looks vaguely like a solution to that problem, and not merely gloating about it.",1439063278
10028458,comment,10025042,10026305,0,0,ProjectEuler,,,"Is there any reason why you&#x27;re intentionally not using the email denoted on the news page?",1439063265
10028457,comment,10027222,10027910,0,0,dastbe,,,"Canonicalization is tough, and requires you to define some common ordering on your units.<p>Systems will use an array of unit powers, so that if the array were defined as <Joules, Seconds, Newtons, Meters>, then acceleration would be <0,-2,0,1> and watts would be <1,-1,0,0>. Addition and subtraction require that your arrays are equal, and multiplication and division are pairwise additive/subtractive.",1439063251
10028456,comment,10027566,10027566,0,0,Animats,,,"161 days of rain per year.",1439063207
10028455,comment,10027102,10028399,0,0,tomjen3,,,"I just did the calculations, if we ignore the money saved and assume the projects total expenses are going to be 4 million, then it only needs to save at least 1198 people to beat the top rated charity on GiveWell (Against Malaria foundation).<p>Looking at the data (<a href=""http://www.nejm.org/doi/full/10.1056/NEJMoa1306801"" rel=""nofollow"">http://www.nejm.org/doi/full/10.1056/NEJMoa1306801</a>) there were 721,800 what they call health care associated infections in 2011 (I couldn&#x27;t find newer data). If the rate goes down at what the article suggest, (75%) then we will save 541350 people a year using this method whereas it would cost more than 1.8 Billion dollars to save the same amount of lives using the Against Malaria foundation.<p>This is almost 500 times as effective!<p>How do we get this knowledge to people who have 2 million dollars to spare?",1439063191
10028454,comment,10023127,10024232,0,0,erikbrodch,,,"Thanks! Do you mean that as the subscriber what would make him/her interact with the curator?",1439063167
10028453,story,,,2,0,JackFr,"Tesla is a compliance company",http://www.wsj.com/articles/tesla-is-a-compliance-company-1438987210,,1439063095
10028452,comment,10027102,10027102,0,0,volaski,,,"&quot;The Master Switch&quot; by Tim Wu. It really changed the way I look at the current tech landscape.",1439063082
10028451,comment,10025106,10027382,0,0,rayiner,,,"There can&#x27;t be any meaningful competition between a private company and a government entity that can tax people to pay off its infrastructure bonds and take land by eminent domain.",1439063072
10028450,comment,10027332,10028307,0,0,DanBC,,,"Meritocracy is sexist because it&#x27;s bullshit. We know it&#x27;s bullshit from the resumé experiments or the blinded orchestra auditions etc.",1439063059
10028449,story,,,30,7,curtis,"How a troubled past turned a Soviet engineer into a valuable spy",http://www.theatlantic.com/international/archive/2015/08/adolf-tolkachev-cia-kgb/400769/?single_page=true,,1439063051
10028448,comment,10027822,10027822,0,0,mrinterweb,,,"The wheels on this device are smaller than I&#x27;d feel safe riding on. Small rocks can stop a skateboard, and when they do, it is much better to be perpendicular rather than facing forward when stopped abruptly. I remember goofing off riding on a board facing forward, and every time the board stopped abruptly, I would fall face forward. Unrelated, they could have picked better music for the video.",1439063044
10028447,comment,10027822,10027822,0,0,Animats,,,"You can&#x27;t stop fast with that thing, except by jumping off. See the video at 0:50. Jump off or face-plant, those are the options. Riders need basic skateboarding skills to use this thing, but skateboarders will be bored by it.<p>The Segway can stop fast without a face plant. That&#x27;s what makes it usable.<p>The BPG Motors transforming motorcycle[1], with both a Segway form and a motorcycle form, seemed to be a really good concept four years ago. They demoed, then the product disappeared. They&#x27;ve come out with a two-tracked off-road standup ATV (the &quot;Shredder&quot;), but it&#x27;s not for urban use.<p>[1] <a href=""https://www.youtube.com/watch?v=odI4WaYEcCU"" rel=""nofollow"">https://www.youtube.com/watch?v=odI4WaYEcCU</a>",1439063042
10028446,comment,10027867,10028209,0,0,jsprogrammer,,,"What proof is valid that a thing cannot exist?<p>The only one I can think of is:<p>1) Exhaustively compare all things that exist, to your objective<p>2) Terminate when identity is detected<p>This brings up all kinds of problems, such as the fundamental: &quot;what is a &#x27;thing&#x27;?&quot;. Can you actually enumerate all of them? How do you validate identity?",1439063034
10028445,comment,10027884,10028398,0,0,vezzy-fnord,,,"Technically the distribution protocol is a property of the runtime system, but it does cooperate with the VM for details like term serialization.<p><i>True, that is a selling point, except that so many Erlang systems have so much C in them (because Erlang isn&#x27;t fast enough for the data plane), that they can still bring down the entire VM (not as if there aren&#x27;t other ways of doing that even without native code).</i><p>This is only the case for NIFs and (linked-in) port drivers, i.e. the facilities that are dynamically linked into the runtime. Regular ports which rely on a byte-oriented interface and are controlled by an Erlang process are safe, as are external nodes (typically, but not necessarily C nodes) which use the erl_interface libraries for marshalling/unmarshalling into and from Erlang terms, and thus can be treated from the programmer&#x27;s perspective like they&#x27;re regular Erlang VM nodes.",1439063029
10028444,comment,10026276,10026997,0,0,AJ007,,,"Who are these people[1] and what credentials do they have to build and run a cryptocurrency platform?<p>[1] <a href=""https://angel.co/ethereum-1"" rel=""nofollow"">https://angel.co/ethereum-1</a>",1439063019
10028443,comment,10027822,10028396,0,0,kaybe,,,"One question is, how fast would they have to be to be useful? Is a speed of 3-5 km/h or even slower already fine? (Maybe for people who cannot walk far due to sickness or age?)",1439063009
10028442,comment,10023127,10023668,0,0,erikbrodch,,,"Thanks, I will do that!",1439063006
10028441,comment,10028150,10028150,0,0,faithfone,,,"Good idea, but where is the blog?",1439062999
10028440,comment,10012360,10012360,0,0,tripzilch,,,"Something wrong with the centering in my Firefox (v39, Linux) browser: <a href=""http://i.imgur.com/8t95PQS.png"" rel=""nofollow"">http://i.imgur.com/8t95PQS.png</a><p>Similar thing happened to the full-width image.<p>I&#x27;ll try to submit it to the Github.",1439062994
10028439,comment,10028231,10028231,0,0,sagichmal,,,"<p><pre><code>    > Godep works differently than the endorsed approach… \n    > Instead of requiring changes to be made to the source \n    > code to support the vendored import path, the GOPATH is \n    > modified to use the vendored folder. \n</code></pre>\nThis isn&#x27;t correct — Godep has two modes, and this is just one of them. The other way is indeed rewriting import paths.<p>This is incorrect on another level, too. Rewriting import paths isn&#x27;t &quot;endorsed&quot; by the Go authors. In fact, Russ Cox, in his GopherCon 2015 keynote, noted that<p><pre><code>    > Our basic proposal was that all tools agree on the \n    > approach of rewriting import paths during vendoring...\n    >\n    > [But] the community spoke with essentially one voice to \n    > say that rewriting import paths during vendoring was not \n    > tenable...\n    >\n    > Keith Rarick posted an alternate proposal for a minimal \n    > change to the go command to support vendoring without \n    > rewriting import paths . . . That proposal will ship as \n    > an experimental feature in Go 1.5 and likely enabled by \n    > default in Go 1.6. \n</code></pre>\n—<a href=""https://blog.golang.org/open-source"" rel=""nofollow"">https://blog.golang.org/open-source</a>",1439062984
10028438,story,,,1,1,sfalbo,"Product Hunt’s Impact on the Launch of GIFpitch",https://medium.com/@716Labs/product-hunt-s-impact-on-the-launch-of-gifpitch-b1d0746159b8,,1439062951
10028437,comment,10027854,10028220,0,0,CamperBob2,,,"They could use the name &quot;Ted Kennedy.&quot;   That&#x27;d show &#x27;em.<p>Oops, no, our wonderful, benevolent, and omniscient government is one step ahead of the curve as usual. <a href=""http://www.washingtonpost.com/wp-dyn/articles/A17073-2004Aug19.html"" rel=""nofollow"">http://www.washingtonpost.com/wp-dyn/articles/A17073-2004Aug...</a>",1439062918
