ID,Type,Story,Parent,Points,Comments,Author,Title,URL,Content,Created
472547,comment,472408,472408,0,0,ErrantX,,,"If you can get more the $50 of sales from it then pay.<p>So long as your not paying <i>for</i> them to give you a positive review (it's a leap of faith I guess) then it's hardly a huge misdemeanor.",1234130383
472546,comment,472408,472440,0,0,bprater,,,"It is now a crime to do a paid review for someone? If so, can you point me to the law stating this?<p>If not, then you are making a big assumption and could hurt someone's business by blasting all over the internet ""just how morally corrupt this person is"".",1234130334
472545,story,,,2,3,dsims,"Can you provide support via twitter?",http://friendfeed.com/e/15d578ea-9cd3-4da2-a93d-fd8e4602739f/The-android-twitter-app-twidroid-says-they-can-t/,,1234130327
472544,comment,466437,467186,0,0,raamdev,,,"Yes it does. Try it. Google ""raamdev"" or ""Raam Dev"".",1234130310
472543,comment,472123,472123,0,0,bprater,,,"My wheel may not fit your hub. While I agree that rebuilding systems is a bad idea, it's also very difficult to get every square peg to fit in the square holes we intend to put them in.<p>One of the bigger problems that could be solved now -- is coming up with a system that gives programmers more insight or code when they are working on a given problem. Until now, it's a crapshoot trying to find, say, a jQuery module that does tooltips in the way I need them displayed.",1234130224
472542,comment,472232,472232,0,0,hapless,,,"Harper's.<p>The modern magazine is a wild mixture of topical essays, edgy literature, and book reviews.  You really never know what you're going to get, but you can count on it being inflammatory.<p>As an added bonus, the (very inexpensive) subscription comes with archives access - everything back to the 19th century beginning.",1234130222
472541,comment,472189,472299,0,0,Herring,,,"Plus that would make HN's RSS not completely suck. ¬¬",1234130200
472540,comment,471777,471836,0,0,tlrobinson,,,"My hospital has an online portal where you can access test results and message doctors... so surely HIPAA doesn't completely prohibit such things?",1234130148
472539,comment,472408,472408,0,0,bisi,,,"There is no right way or wrong way in business . There is only one way - The way that makes money ..<p>If I told that I paid $50 to a review site and it brought me $5000 . Will you ask anybody if you should pay $50 to bring in $5000 ?<p>Big Corporation pay celebrities money to give favourable reviews and endorsments all the time . Nike will only pay Tiger Woods Millions to give a good endorsement . They would be fools to give Tiger Millions to give his honest opinion . Its business .. The only way you will make money from your products or service is to get good reviews . If you are asking people for reviews and they are giving you bad reviews you will never make money .. This is part of marketing .. \nYour number one goal in buisness should be to make money .. If you will lose the $50 then its not a good investment but if you will make money then thats pretty much all that matters .. THERE IS NO CRIME BEING COMMITED.\nIts just business ..",1234130070
472538,comment,472502,472502,0,0,bprater,,,"Does anyone have any technical info on how this is accomplished?",1234130051
472537,comment,472477,472477,0,0,Herring,,,"I don't quite buy his argument about why we need to keep things in unsafe format for a while. If that credit card app can't handle HTML-encoded stuff, how would it handle evil javascript?",1234130017
472536,comment,472502,472528,0,0,gregstoll,,,"Or just do everything twice - if it really runs seven times faster than ""today's best technology"" than it shouldn't be an issue.<p>It's a very interesting idea...wish they had more details in the article.",1234130002
472535,comment,472428,472522,0,0,bd,,,"Oops, I must have missed it while submitting. I deleted my post and posted it as a comment in the other thread.<p>There is some additional information compared to the one in pg's post.",1234129897
472533,comment,472319,472319,0,0,sachinag,,,"Ah, fuck.  Now I have to do a compare and contrast to the YC model docs.<p>[EDIT] Here it is: <a href=""http://www.sachinagarwal.com/quick-compare-and-contrast-of"" rel=""nofollow"">http://www.sachinagarwal.com/quick-compare-and-contrast-of</a><p>[EDIT 2]: Here's the HN thread on my submission of my analysis of the YC documents back when: <a href=""http://news.ycombinator.com/item?id=283469"" rel=""nofollow"">http://news.ycombinator.com/item?id=283469</a>",1234129846
472532,comment,472389,472389,0,0,tolmasky,,,"Bigger text size is also good for not going blind. I've been coding with bigger text for a few months now, fewer headaches too.",1234129842
472531,comment,472378,472378,0,0,bd,,,"Here is another list, a bit different, with more goods and professions and with some additional commentary (though based on the same historical source):<p><a href=""http://www.constantinethegreatcoins.com/edict/"" rel=""nofollow"">http://www.constantinethegreatcoins.com/edict/</a><p>There is some interesting information, for example about soldiers pay and costs, exchange rates or about a death penalty for refusing to sell goods at the stated price.<p>Also silk prices have been crazy: 12,000 denarii for a libra of white silk and a whopping 150,000 denarii for a purple silk (use of which was regulated by the Emperor with misuse punishable by a death penalty).",1234129767
472530,story,,,1,0,tjr,"Art and code - obscure or beautiful code?",http://blog.jaoo.dk/2008/11/21/art-and-code-obscure-or-beautiful-code/,,1234129754
472529,comment,472485,472485,0,0,acangiano,,,"What a major flashback. It's been only 9 years, and it feels like an eternity.",1234129751
472528,comment,472502,472502,0,0,Jebdm,,,"The big problem I see is that if you ever want to do something which has to be precise, you'll have to have two processors.  Perhaps in the future we'll see chips with a ""probability drive"" in addition to the normal cores.<p>Now we've just got to develop an <i>improbability</i> drive...",1234129408
472527,comment,472378,472439,0,0,elai,,,"But do think a lawyer would get that fee every day?   Or only once or a few times per month?",1234129360
472526,comment,472172,472172,0,0,KaiP,,,"Interesting news, although pretty light on the details.  Also, why is the author so angry?",1234129274
472524,comment,472389,472487,0,0,RossM,,,"Lock the doors kids.",1234129153
472523,comment,471660,471816,0,0,jacoblyles,,,"Christianity has had 2,000 years to iron out the obvious contradictions. I am pretty sure that the more mature faiths are consistent if you accept their axioms.<p>I doubt you can think of anything that Augustine and Aquinas didn't. The dudes had nothing else to do but think.",1234129148
472522,comment,472428,472428,0,0,nihilocrat,,,"<a href=""http://news.ycombinator.com/item?id=472378"" rel=""nofollow"">http://news.ycombinator.com/item?id=472378</a>",1234128990
472521,story,,,2,0,snoid,"Palm Pre: preDevCamp, Baltimore",http://www.retrieverweekly.com/blog/2009/02/03/predevcamp-baltimore/,,1234128972
472520,comment,472408,472408,0,0,gscott,,,"ReviewMe.com specializes in this, they do not promise positive reviews just a review.",1234128929
472519,comment,472438,472438,0,0,windsurfer,,,"Windows still doesn't come with a decent word processor or photo editor? And it takes 11 GB? All the other consumer-level operating systems have much more software, and take up much less space. I know there's been a lot of hype around Windows 7, but I just don't see why when I look at what we already have. Compared to Vista, maybe Windows 7 is an improvement. But compared to OS X or Ubuntu or Debian?",1234128904
472518,comment,472001,472182,0,0,gravitycop,,,"<i>what happened to him can happen to anyone, anytime, anywhere.</i><p>Violent confrontation is more likely to occur in a fringe area: <a href=""http://www.nononsenseselfdefense.com/fringe.html"" rel=""nofollow"">http://www.nononsenseselfdefense.com/fringe.html</a><p><i>Fringe areas are places ""in between."" And it is here that criminals usually operate. This is where you are most likely to be attacked, mugged or raped.<p>It isn't until you begin to consciously look for them that you begin to see how many you pass through each day. A fringe area is not inherently dangerous, which is why we don't normally notice them. There is no reason to fear them; it is what lurks there that you need to fear.<p>Fringe areas are usually places that you pass through on you way to and from the crowd. In the middle of the crowd, there are too many people for the criminal to operate safely. Too far from it, there is nobody for him to attack. At the fringes, there are enough people going through that the criminal can find victims, but not enough to effectively hinder him.<p>The main thing to remember is any fringe area is transitional. It is a place that we pass through on our way to something else</i><p>Davidson had positioned himself for violent victimization by walking alone in such a fringe area.<p><i>I was walking back to my hotel, the Hilton, down Ocean Boulevard. It's a 3/4 mile walk. Not a big deal, even with a backpack full of camera gear on my back. It wasn’t pleasant on feet that were sore from the day, but not bad. Mostly, I thought of if as a good way to unwind after a very full day.<p>As I walked under the trees by the civic center, I was grabbed from behind.</i><p>Events, such as conferences, provide easy access to victims: <a href=""http://www.nononsenseselfdefense.com/fringe.html#muggers"" rel=""nofollow"">http://www.nononsenseselfdefense.com/fringe.html#muggers</a><p><i>Leaving an event/location<p>Any place that attracts large numbers of people is usually safe. Leaving such a place, however, is often dangerous . It is not uncommon for criminals to position themselves along the walkways to and from such areas. It doesn't take a rocket scientist to figure out that people leaving an establishment will usually head towards the closest parking lot.<p>It is a simple feat to position oneself along that route in a way where you can successfully mug someone.</i>",1234128871
472517,comment,472389,472481,0,0,scott_s,,,"I thought Monaco was atrocious until I anti-aliased it. It's like an entirely different font - one that I prefer over all others now.",1234128793
472516,story,,,3,0,twampss,"Cocoa with Love: Breadth-first traversal of a graph of Objective-C objects",http://cocoawithlove.com/2009/02/breadth-first-traversal-of-graph-of.html,,1234128786
472515,comment,471660,471699,0,0,jacoblyles,,,"It is interesting that you have marked a philosophy that moves people to lead lives of monastic asceticism as a philosophy that encourages a small identity.",1234128737
472513,comment,472389,472389,0,0,Niten,,,"I'm supposed to master an obscure language element, read through the source code of an open source project, refactor a method, run a static analysis tool, and do all the rest--all within six minutes?<p>I do like the idea for making hard-coded strings stand out, however.",1234128696
472512,comment,472389,472389,0,0,scott_s,,,"I'm writing a translator that generates C code. I'll pass on the ""make hard-coded strings look ugly"" part.",1234128600
472511,comment,471660,471833,0,0,jacoblyles,,,"A central practice of Buddhists in 13th century Japan was to stab other people with swords.<p>Humans have wonderfully malleable minds.",1234128596
472510,story,,,2,0,kqr2,"Rotational illusion",http://www.ritsumei.ac.jp/~akitaoka/rotate-e.html,,1234128587
472509,comment,471660,471748,0,0,jacoblyles,,,">I think that the point of the article is not to ""Keep Your Identity Small"", but to not be a jerk about it<p>Good point. The topics that can be discussed by a group are a function of the civility of its members. Some of the most interesting conversations I've ever had were about religion and politics with civil and mature people.<p>That's a high standard to ask of a group of strangers on the internet, though.",1234128436
472508,comment,472375,472375,0,0,pclark,,,"basically: if you can't make forms as nice as wufoo ... use wufoo.",1234128396
472507,comment,472408,472499,0,0,silencio,,,"haha, not flaming us for charging for an open source app? :)<p>thanks though!",1234128211
472506,comment,472378,472439,0,0,KevBurnsJr,,,"I wouldn't think that would be particularly interesting.  Lawyers make a lot in our culture too.<p>What I find more interesting is the extremely high relative wage for Teachers.",1234128202
472505,comment,472389,472432,0,0,LogicHoleFlaw,,,"An alternative to using a larger font is to use a smaller screen. I've been having a blast writing little stuff on my netbook in bed.",1234128173
472504,comment,472012,472012,0,0,pclark,,,"great in theory, in reality you'll either both be doing it when the other is away or too scared to scold your partner.",1234128100
472503,comment,472378,472442,0,0,fauigerzigerk,,,"What remains comparable is how much humans need to eat in a day. So it could be meaningful to work out how many people a day's wage could feed back then and use that as a baseline to calculate the imaginary USD/DRI exchange rate.",1234128078
472502,story,,,48,32,peter123,"Rice professor sees probabilistic method revolutionizing computing ",http://www.chron.com/disp/story.mpl/metropolitan/6252697.html,,1234128046
472501,comment,472408,472499,0,0,menloparkbum,,,"I also love this game, I used to play the card-based version all the time. I'm just pissed off that you made it for the iPhone before I did!<p>Edit: whoops, I was talking about the OP's game! But, I also love your IRC client. I didn't know it was available for the iPhone, I'll have to check that out...",1234127988
472500,story,,,2,0,Jebdm,"Alter Ego: State pattern implementation for Ruby",http://alter-ego.rubyforge.org/,,1234127946
472499,comment,472408,472480,0,0,charlesju,,,"Totally unrelated to anything.<p>1. I love your program.<p>2. I just bought your iPhone application because you guys deserve at least that much from me.",1234127858
472498,comment,471659,471659,0,0,pclark,,,"Joel never discusses what his designers/support staff/everyone else think of his company. I wonder if they love their office as much as the developers.<p>As a designer, I wouldn't be able to stand a company that values its developers so much higher than everyone else (note: I have no idea if Joel does this, I seriously doubt it, I'm only going via his statements on his site about how his developers get fancy chairs/offices)",1234127819
472497,comment,472408,472408,0,0,vaksel,,,"Throw up a quick blog post talking about this trend for apps. In the post make sure to talk about your app. Then promote the post on reddit/digg and let other blogs know about it.<p>You'll get more exposure for your app than a mere blog post on a 3rd rate blog(gotta be 3rd rate if they only want $50 for a positive post). And who knows, you might get some of those big name blogs to cover your story as an example of how their particular blog is so much better than others that charge money for good stories.",1234127730
472496,comment,457100,470153,0,0,davidsrose,,,"Alain,<p>That's a good question, which I'd answer as follows: (a) just because someone says something on TheFunded doesn't make it gospel [grin], but (b) IN GENERAL, and taken as a rule of thumb, the advice is pretty good.<p>Where it breaks down is in the details, which is why the Angel Capital Association convened a panel to consider this very question, and ultimately came out with a specific, detailed statement on it, which is available online at <a href=""http://www.angelcapitalassociation.org/dir_resources/entrepreneur_fees.aspx"" rel=""nofollow"">http://www.angelcapitalassociation.org/dir_resources/entrepr...</a>.<p>Angelsoft's corporate (and my personal) philosophy is as follows: the primary determinant as to whether it is appropriate to charge a fee of any kind to an entrepreneur to pitch, is the answer to the following question: ""If you represent yourself to be an investor (or group of investors), is your business model based in any way on the fees you charge entrepreneurs?""<p>There are a number of 'venture summits', and 'angel groups' and others who represent themselves as investors and charge large fees (often several thousand dollars, for application, appearance, 'training', presentation, diligence, etc.) to companies, because that's how they make their money, regardless of whether or not the company receives an investment (which it rarely does.) In those cases, the whole point of the business is to make money from the entrepreneur fees.<p>On the other hand, take as an example New York Angels, my own local angel group. We charge a $150 application fee to submit a plan. Is that any part of our business model, and do our members make any money from that fee? ABSOLUTELY NOT! Quite the opposite: while we charge entrepreneurs the $150, we charge OURSELVES $3500 per person per year to allow us to maintain a non-profit organization that enables us to coordinate investments in the first place! So in the case of the 37% of legitimate angel groups that have a similar policy, I/we (obviously) have no problem with the practice.<p>That said, there are two significant problems with your suggestion for contingency-only fees, one legal and one practical:<p>Legally, anyone who charges any type of contingent fee relating to equity financing MUST be a registered broker/dealer with the SEC. There are no exceptions to this, and no wiggle room. Since by definition no legitimate angel group is a Broker/Dealer, adopting this policy would immediately end organized angel investing in the US, and you'd be back to having to find angels at your local country club, or by paying an investment banker (who IS a B/D) to introduce you.<p>The practical problem is the perhaps-unfortunate-but-nonetheless-true fact of the Golden Rule of financing: ""S/he with the gold makes the rules."" If YOU believe that anyone should be able to send you their business plan and expect you to read it, and then invest in them, then by all means YOU should go forth and do it! But if the only people who are willing to make these risky investments are only willing to do so if you follow the procedures they have set up (for reasons which seem sensible to them), then either (a) it's worth it to you to do so, and you will, or (b) it's not worth it and you won't. But there's no percentage in telling such an investor that he or she should do it your way because YOU think it makes sense for THEM.<p>Just to put things in perspective, and show you how things look from the angels' side, Angelsoft currently processes over three thousand (3,000!!) funding applications every month. By investing unholy amounts of time, energy and money, we have now made the process so easy that the temptation is overwhelming for virtually every entrepreneur in the world to want to hit virtually every potential investor in the world with his/her plan. While this is understandable from the entrepreneurial side, it should be apparent that it is completely unworkable from the angel side, particularly considering that angel investing is a part-time activity which (given the risk, effort, et al) is a tenuous practice in the first place.<p>On top of that, another fact that needs to be considered is that the quality of funding applications varies widely (to put it mildly). YOUR plan for FairSoftware.net may be brilliant, incisive, carefully reasoned, and a logical investment for any rational investor...but that would be the exception rather than the rule [grin]. Looked at another way, if angels invest in somewhere between 1% and 5% of deals seeking funding, that means they are in effect (and in aggregate) making a series of value judgments, and rank ordering all 100% of the deals so they can choose those which, in their opinions, are the top 1-5 deals.  A fair argument could be made that they make mistakes, aren't perceptive, have poor vision, etc. etc., and that in reality (as with college admissions), EVERY one of the top 10% should be funded.<p>You could further say that the NEXT 10% down should, in an ideal world, be fundable if we could only match the specific deal to the specific investor under certain specific circumstances. And then, since we are entrepreneurs ourselves with faith in our ilk, let us say that the NEXT 5% we should fund because, even though the plan doesn't make sense and the financials are unrealistic, this might be a really good potential entrepreneur who could break the mold and defy all of our investing experience to date.<p>OK.<p>But...that still leaves a full 75%(!) of aspiring entrepreneurs seeking funding for ideas which are clearly and unequivocally inappropriate for an outside angel investment. In my experience, #26 might be the kind of deal for which I'd conceivably take a meeting, but know within the first minute or two that it simply wasn't fundable; #50 might be a deal which might make sense in theory, but not in practice (""I want to start a new, generic online social network""); #75 is a deal that should never have even been put to paper (""I've got a website that will obviously put Google, Yahoo and Microsoft out of business in six months!""); and #100 is from someone who is not necessarily playing with a full deck (""Send me $100 million to publish my book which will instantly result in world peace."")<p>So, Alain, if you would like to volunteer to read through 3,000 business plans a month and give me a quick write-up on each of them (at your own expense, of course), I would be delighted (and I'm stating this here in public) to give you (subject to appropriate legal structure, etc, etc. etc.) a 1% contingent interest in any investment I end up making in any such deal you send me.<p>You see the problem. :-)<p>So therefore, how can we establish a system, given our free-market, capitalist economy, to try to get smart money into good deals? Having been doing this for nearly a decade, I can attest to the fact that it's not easy. Angelsoft is (I believe) the best approach to date, and we are constantly iterating it to maximize the aggregate return to the entire system, which will in turn help entrepreneurs and investors, and make money for Angelsoft as a commercial entity.<p>But, as with everything else in a free market economy, each player has to make a decision for him or herself as to whether doing something is economically (or otherwise) justifiable. At Angelsoft (unlike ANY other site, service, company or institution) we freely publish our full, live statistics online (at www.angelsoft.net/industry) so that we can be as transparent as possible. We also make our Group Finder (without close second the most comprehensive on the planet) available for free, and we make it trivially easy to apply for free to as many groups as you want. And if, after reviewing our Investor Community posting opportunity, an entrepreneur determines that it makes sense to post his or her plan there for 30 days for $250, then we welcome them. If not, we completely understand, and invite them to continue to use the rest of our tools for free.<p>I apologize for the length of this post, but you were kind enough to ask, so I figured you deserved a full [perhaps too full?] reply.<p>-David S. Rose, CEO, Angelsoft",1234127706
472495,comment,471660,472352,0,0,astine,,,"I believe that if you hold certain opinions, strongly enough, they change who you are. If you truly believe in the  value of altruism (for example) you can't help but become more altruistic. If you don't let your opinions change who you are, it's a fair question to ask, whether you even hold those opinions.<p>Granted, I understand that you are more concerned with making sure people keep a certain emotional distance from their opinions, so that they can maintain a level of objectivity, but I'm not sure that that is always feasible, without adopting a certain kind of passivity or relativism.",1234127615
472494,comment,472376,472376,0,0,scott_s,,,"<i>You might have noticed that this language definition is short on specificity. I haven't specified how big the number can be (such as if it can be bigger than a 32-bit integer) or even if the number can be negative.</i><p>The grammar itself (which, in this case, is expressed in EBNF notation) says nothing about details such as the size of numbers. Grammars only describe what can be <i>said</i>, not what that <i>means</i>.<p>The C grammar, for example, has many different number types. But it's not the grammar which determines if an unsigned long is 32 or 64-bit. That's determined by parts of the language specification outside of the grammar.",1234127614
472493,story,,,2,0,blackswan,"Motion charting of the S&P 100",http://26variable.com/,,1234127563
472492,comment,472408,472475,0,0,aristus,,,"I didn't mention ethics, only pride and taste.",1234127533
472489,comment,472389,472432,0,0,olavk,,,"One good font-related tip: Make comments stand out (dark, bold) rather than fade into the background. Forces me to write better comments, and prevents comment from getting out of sync with the code.",1234127429
472488,comment,471954,471954,0,0,pclark,,,"disable this: A password will be e-mailed to you.<p>make the domain not look like a typosquatting site. Eg, graphics.<p>add ruby syntax ;)",1234127342
472487,comment,472389,472389,0,0,Jebdm,,,"""Sometimes, when I'm looking at the code of a complete stranger, I get that same, weird feeling I get when I'm creeping through my neighbour's house. Picking up their stuff, looking through their fridge.""<p>Um...",1234127332
472486,comment,472408,472476,0,0,timf,,,"It is listed in his profile (which I though was the more accepted approach here).",1234127327
472485,story,,,21,10,mapleoin,"The best GNU/Linux distros of the year 2000",http://www.tuxradar.com/content/archives-best-distros-2000,,1234127305
