ID,Type,Story,Parent,Points,Comments,Author,Title,URL,Content,Created
472484,comment,472389,472389,0,0,fp,,,"Who can do numbers 3, 5 and 8 in <i>six</i> minutes? I guess they will make you a Better Programmer (tm), but will consume slightly more time. Or does the article claim to make me a Better Programmer by just letting me know how to become a Better Programmer?<p>On the positive side: I like the idea of automatic uglification of ""bad"" code.",1234127299
472483,comment,472136,472136,0,0,weaksauce,,,"I think that having your javascript fail gracefully is important. (i.e. click on a link in the slide show and it actually takes you to the next slide.) This is not only for the people that have javascript turned off for whatever reason but also for the search engines. If they cannot navigate to it you will not get ranked. Hook your javascript into the next link after the page has loaded and then override the behavior if they have javascript turned on if they don't then the link will still work because it is a valid link to the next page. There are plenty of resources out there that teach this javascript idiom.<p>Have a good url structure using rewrites such as foo.com/why-ip-cameras-are-bad/ and translate it behind the scenes to whatever slide it maps to.<p>I also agree with inerte that the slides are too text heavy. Make it more succinct for the presentation and people will be more likely to actually read the whole thing. You can go on in more detail on other pages of your site.<p>Overall it looks like an interesting product and I wish you luck.<p>Are you planning a OS X Version?",1234127191
472482,comment,472378,472423,0,0,iamelgringo,,,"Using the prices listed and assuming a 10 hour work day, one denarius was worth:<p><pre><code>   1/4 of a decent beer, or 1/2 of a Egyptian beer\n   1/2 an ounce of Pork Mincemeat\n   1/12th of an Italian pound of Venison\n   1/2 a bath\n</code></pre>\nWith a 10 hour day, laborers made:<p><pre><code>    2.5 denarii an hour for farm labor\n    5 denarii an hour for carpentry\n    2.5 denarii an hour for data entry (scribing)\n    1.5 denarii an hour for entry level teaching\n        (assuming 10 pupils and 10 hour workday</code></pre>",1234127189
472481,comment,472389,472389,0,0,ktharavaad,,,"One thing that really helped me when I code is to switch to a real ""coding font"".<p>Wile the default monospace font on OSX (monaco) is fine, I find that my eyes adjusts better to the ""proggy clean"" fonts (avaiable for free here: <a href=""http://www.proggyfonts.com/"" rel=""nofollow"">http://www.proggyfonts.com/</a> ).<p>With good coding fonts, you are able fit more into the screen, distinguish between 1 and l, 0 and o more easily..etc. Here's a discussion on programming fonts a while back on HN (<a href=""http://news.ycombinator.com/item?id=255257"" rel=""nofollow"">http://news.ycombinator.com/item?id=255257</a>)",1234127168
472480,comment,472408,472408,0,0,silencio,,,"don't do it. we (colloquy, the irc client) submitted promo codes and requests to review to multiple people and review sites, and there was only one website who did exactly what you state. none of the rest wanted payment of any sort (ars technica, tuaw, daring fireball, etc.) and were all too happy to mention and review the app.<p>We've gotten more money from iTunes affiliate links to the application on our page (<a href=""http://mobile.colloquy.info"" rel=""nofollow"">http://mobile.colloquy.info</a>) than in sales from most of the iPhone-specific review sites that we could see. We've also probably made more sales promoting ourselves and providing support on Twitter.<p>(Also, for what it's worth this site in question seems to be super slow if you don't pay up $50 or pay for advertising, it's been a little over two weeks with nothing whatsoever. the promo code we sent will probably expire before they review, heh.)",1234127138
472479,comment,472408,472408,0,0,brandnewlow,,,"Hell no don't pay.  That's crap, for all the reasons you mentioned.<p>How many blogs have you sent your info to? 10?  You should be sending it to 100.<p>I publish a tech blog.  We're small but publish on Google News.  Hit us up.  Can't guarantee we'll review it.  If we do and it stinks we'll say so.  If we do and it's awesome, we'll say so.",1234127100
472478,comment,472452,472452,0,0,critic,,,"What do you think about 100 year languages now? :-)",1234127014
472477,story,,,38,16,blackswan,"Making Wrong Code Look Wrong (2005)",http://www.joelonsoftware.com/articles/Wrong.html,,1234126816
