ID,Type,Story,Parent,Points,Comments,Author,Title,URL,Content,Created
3522349,comment,3520175,3521675,11,0,shagg,,,"If you need an adviser, handler, lawyer or PR person to tell you ""don't blatantly copy/steal other people's shit"", you shouldn't be in business, you should go back to kindergarten.",1327766375
3522348,story,,,6,0,kelseyfalter,"UX: Pinterest style vs. list style",http://markover.me/jan12/pinterest-style-vs-list-style.html,,1327766317
3522347,comment,3522169,3522169,8,0,technoslut,,,"I could see this being hugely successful. The only question is whether people have been conditioned for the sale season. Growing up in a household full of women who buy clothing and accessories all the time, they particularly save up for when holidays approach.",1327766317
3522346,comment,3522049,3522341,-1,0,sp332,,,"I guess I'd trust ads more than random QR codes on blogs. My point is, if the point of a redirect is that you can send people to a different page later in time, then you really can't depend on the QR code taking you where you expect, or even to the same page that it used to go to.",1327766235
3522345,comment,3521817,3522307,26,0,itmag,,,"Conspiracy just means ""in the same spirit"" (from the latin con spirare - breathe together).",1327766221
3522344,comment,3522049,3522317,12,0,sirclueless,,,"You just scanned an unreadable symbol. It could already send you anywhere. Vetting URLs by whether they look like they point at a redirect script seems like overkill.",1327766198
3522343,comment,3520175,3521045,3,0,rskopecek,,,"Allangrant, as you stated you are a back end developer. While that's good to note, it doesn't exclude the outcome that DHH and the community have already commented on.<p>However, I think something that is missing is a little more guidance. Other than the issues others have communicated, the web page showed that your company hasn't established, even in very raw form, it's own style that is best for its users. It's normal to reflect and be inspired by others designs. I would even recommend that you take screenshots of the design styles that speak to you. From that point though, the screen shots should be used as ""internal"" discussion materials that help your company find the essence of its own style. That style should always be taking what's best for your product/service and user base, into the style characteristics.<p>Once you've found your core style, express it and iterate over it using each iteration as a piece of more relavent inspiration to your style (37Signals recently released a cool video on their blog that demonstrates this process through their eyes). The results should make you proud enough to express and share it with your customers. Only at that point do you finally make it public. After that keep iterating over it. If you utilize external inspiration, make sure that you've iterated over it enough that your style doesn't feel like a knockoff. You should be able to identify this easily and odds are, if you've been going through all this it won't be. However, if you have concerns just take screen shots of your style and the screen shots of what externally inspired you,...show them to some people who don't work for your company and weren't involved with the design process. They should be able to 1) pick up on your style and 2) agree that it isn't a knockoff. Given the situation you are in, I would recommend this heavily to help give piece of mind.<p>I realize that you wanted to gain from the lessons learned from 37Signals internal design iteration process as well as other companies. However, if you note what I said above, it means they were focusing ""also"" on their product and their customers. Which means if you directly reflect your design from theirs, you weren't focusing enough on your customers. You might have intended to give your customers a great design experience, but without going through the process above, your website is considered not authentic...and as a result people focus on the their feeling of ""this looks oddly familiar"" instead of focusing on what your product can do for them.<p>Many, if not all of the people who have commented have gone through their own artistic design process to build one or more designs. And at times it can be ""hell"" (fun, but still) to create something that the designer feels is good enough to share/use. It is a compliment that someone is inspired by your design. But when it's closer to a knockoff it can make the designer feel like they sacrificed him/her-self for your free ride. If they intended for it to be given away, then the benefit you receive gives them whatever good feeling they were looking for. I'm sure you have, like many people, worked insane hours that took away from family, friends, and even yourself.<p>I hope humility, honesty, and hard work guide your company to a design that you can be proud of.<p>Good luck and I hope this all helps.",1327766162
3522342,comment,3521770,3522002,1,0,rayhano,,,"What about this Toshiba?<p><a href=""http://reviews.cnet.co.uk/laptops/toshiba-portege-z830-ultrabook-review-50004981/"" rel=""nofollow"">http://reviews.cnet.co.uk/laptops/toshiba-portege-z830-ultra...</a>",1327766092
3522341,comment,3522049,3522281,4,0,iso8859-1,,,"I don't think the majority of users check the URL of the QR code. Why wouldn't you trust the advertiser? I think it's really rare to see an advert that looks innocent, but actually isn't, and at the same time contain a QR code that has a ""malicious-looking"" URL.",1327766073
3522340,comment,3522075,3522117,4,0,bluedanieru,,,"I think it's time a few big players in the tech industry lead the charge toward making shit like this completely impossible. Regulation and lobbying and beltway insider bullshit is their game, and their rules. Eventually that too will change but that change isn't going to come about playing by their rules.<p>The problem is that you can censor the internet in the first place, not that some assholes want to censor it. There are always going to be assholes.",1327766073
3522339,comment,3521959,3521959,1,0,cardmagic,,,"This is a great article exploring what some technology behind PaaS might do, and also a great start, but falls short of true PaaS functionality.<p>* Many PaaS offerings (like AppFog) are not like shared hosting at all, only the free offering hosts people multi-tenant, when you pay you get dedicated VMs<p>* The platform in platform-as-a-service means it connects you to fully managed services (on Heroku there are all the add-ons as well as Postgres, on AppFog there are add-ons and MySQL).<p>* One of the most compelling parts of PaaS is that it is managed by someone else so that you don't get a call at 3am when it is broken<p>Moreover, if you were to run a PaaS on your own, it would make more sense to try Cloud Foundry which has specifically addressed at least the services aspect of the above comments.",1327766033
3522338,comment,3518967,3518967,1,0,its_so_on,,,"if I had never had any exposure to programming, and you told me that a equals ten, b equals twenty, and a equals b, I would say that one of these three equations is obviously false (the system of three equations has no solution), you're full of shit, and probably made a mistake and expect me to put 0,0 for a and b respectively.  Or I would guess randomly or ignore the question.<p>IF I HAD NEVER HAD ANY EXPOSURE TO PROGRAMMING.",1327765981
3522337,comment,3521736,3521736,3,0,hk_kh,,,"This map shows in ""realtime"" when users around the world take or leave bikes in a bike sharing system scheme of their city: <a href=""http://citybik.es/realtime"" rel=""nofollow"">http://citybik.es/realtime</a><p>Or, if you want, here's the popular gif cursor party done in real life <a href=""http://citybik.es/cursor_party"" rel=""nofollow"">http://citybik.es/cursor_party</a>",1327765921
3522336,story,,,5,0,dotmanish,"To Pivot or Not to Pivot",http://techcrunch.com/2012/01/28/to-pivot-or-not-to-pivot/,,1327765905
3522335,comment,3521770,3522109,1,0,rayhano,,,"Oh yes, I completely forgot that you need Mac OS to access the iOS SDK... Makes me want to get an Ultrabook just to thumb my nose at evil Apple...<p>Funny thing is, no one has so far been able to recommend a single make and model apart from the MacBook Air...",1327765888
3522334,comment,3522226,3522226,1,0,thecrumb,,,"RTP area of North Carolina",1327765854
3522333,comment,3522014,3522145,3,0,Vivtek,,,"Oh, God, the German dubs for Star Trek: The Next Generation were <i>horrible</i> - they sounded like the same guy did everybody's voices (OK, except for Troi, fortunately).<p>And I'll never forget the debut of the Cosby Show in Germany and wanting to show my college friends this show I really liked - and realizing that without Bill Cosby's voice, it was utterly, hopelessly worthless.  Not the first time Germans looked at me like I was crazy, but it was a formative experience.",1327765811
3522332,story,,,1,0,NewsPart,"Twitter To Start Censorship, Boycotts Begin",http://newsparticipation.com/twitter-to-start-censorship-boycotts-begin/,,1327765810
3522331,story,,,1,0,sinzone,"Travel API to discover itineraries to get from one point to another",http://www.mashape.com/apis/rome2rio,,1327765735
3522330,comment,3522014,3522312,5,0,corin_,,,"1. Hulu isn't available in the UK\n2. Neither are (legal) streams from US networks",1327765721
3522329,story,,,1,0,jjude,"Documenting Your Decisions",http://www.jjude.biz/2012/01/documenting-your-decisions,,1327765708
3522328,comment,3521982,3522152,1,0,m_for_monkey,,,"That example isn't really good, but think back to the original post: if your browser caches every element of every already rendered page, it can be super fast in case of a page reload/tab reopen.",1327765694
3522327,comment,3522014,3522295,3,0,rickmb,,,"Dutch TV aired BSG <i>months</i> later.<p>Result: everybody that wanted to see the show had already pirated it, and the viewing figures were miserable.<p>This has happened with several popular shows.",1327765679
3522326,comment,3521735,3521735,3,0,soupysoupysoup,,,"When the poorly coded app freezes, the Android menu buttons are often the only escape. This <i>was</i> an advantage in my opinion.",1327765667
3522325,comment,3522014,3522059,2,0,Vivtek,,,"What always ticked me off was the same ""non-American"" rule applied while we were living in Puerto Rico - which is part of the United States.  My kids were watching American cable and weren't able to access the online episodes because we weren't on the continent.",1327765666
3522324,comment,3522075,3522075,2,0,DrJokepu,,,"There is no such thing as ""copyright industry"". The motion picture industry, the phonographic industry, the book publishing industry, the software industry, the video game industry all closely related to copyright yet they are all very different businesses with very different problems, ""screwed up"" very different ways. This is gross oversimplification and I am sad that this level of nave uninformed populism is making it to the top of HN.",1327765664
3522323,comment,3522014,3522059,1,0,rythie,,,"What is particularly annoying, if you like the Facebook account and they tell you about the upcoming episode, for example Big Bang Theory which won't be on for a couple of months.",1327765661
3522322,comment,3522226,3522226,1,0,jeffool,,,"I'd suggest putting ""Ask HN:"" at the front of this. May get you more traction.",1327765661
3522321,comment,3521770,3522221,1,0,rayhano,,,"Is that including Sales Tax?<p>It does hurt a lot when you have such dichotomies...",1327765660
3522320,story,,,1,0,wglb,"Vulcans View 7: Volcanoes Seen From Space",http://www.wired.com/wiredscience/2012/01/vulcans-view-7-volcanoes-seen-from-space/?viewall=true,,1327765632
3522319,comment,3520175,3521707,8,0,designNERD,,,"Wow these guys have absolutely no integrity.",1327765606
3522317,comment,3522049,3522313,-2,0,sp332,,,"But if it's a redirect, it could send me anywhere. That's what I don't like about it.",1327765561
3522316,comment,3522255,3522297,1,0,maxjaderberg,,,"thanks! there are so many crap fb tools out there we need something simple. need ideas for more effects to add though!",1327765512
3522315,comment,3521998,3521998,3,0,rumblestrut,,,"What a great read.<p>I've been fascinated with ISS since learning about TWISST. If you follow @twisst on on Twitter and your location is in your profile, you'll be sent a tweet with where ISS will show up next in your area. It's been fun to take the family outside and look at the space station as it goes by.<p>I am a little jealous, though. I want to go for a ride.",1327765503
3522314,comment,3522014,3522128,1,0,rickmb,,,"That's not really new, here in the Netherlands the gap between US and local broadcasts has now often been reduced to less than a week for certain series.<p>A 3 day window however is still too long for shows with real fans that want to participate in the global conversation. It may work for procedurals and sitcoms, but not for shows with big stories and cliffhangers like Lost, 24 and such.<p>Never mind the fact that you still get all the disadvantages of a commercial broadcast: fixed time, annoying station logo's, subtitles (or dubbing depending on the country) and most of all: incessant commercial breaks.<p>No thanks.",1327765494
3522313,comment,3522049,3522281,4,0,lysol,,,"And if you care that much about the URL you should be able to infer from website.tld/qr that it's a QR code specific URL to track hits.",1327765489
3522312,comment,3522014,3522153,5,0,subpixel,,,"I disagree. I don't own a TV anymore, and probably never will.<p>I want to pull up the shows I want, when I want, and watch them where I want.<p>To do this, I rely on the following services, in order:<p>1. Hulu (I'm happy to deal with ads)<p>2. Network streams (ditto ads)<p>3. The Pirate Bay (when not available through other means)<p>4. Another site dedicated to current/past British TV<p>Re #4 - there's no way, just no way I'm going to wait months to watch a show on PBS that aired on the BBC/ITV/Ch4 yesterday.<p>IMHO, the most lucrative path for the industry to follow would be a subscription model that's tied to usage.<p>* Users buy credit, and that credit is used as they download content.<p>* Current content is more valuable - so the current season of a series costs $X/GB, last season costs $Y/GB, etc.<p>* Every channel/network is in business for themselves (e.g. cut out Apple/Amazon/DirectTV altogether)<p>I'm not holding my breath for that scenario though.",1327765474
3522311,comment,3521817,3521817,-2,0,jballanc,,,"I think anyone whose opinion of Steve Jobs is changed by this knowledge needs to take a good look in the mirror and ask if they are not the hypocrite. Jobs always was a consumate businessman. Before Apple, even, he was scheming his way through a job, getting Wozniak to do his work and going back on his word to split profits.<p>But isn't that what America is all about? Aren't your shoes, clothes, electronics, etc. made by low wage workers at companies run by men and women who are willing to do anything for an extra dollar? Isn't that capitalism? Isn't that their ""fiduciary duty to the shareholders""?<p>In the world of engineering, engineers are a resource just as oil is a resource for an oil company. Do you also get angry when oil companies hire lobbyists to wine-and-dine politicians until they give favorable exploration rights on federal lands to those companies? How is this any different, morally?<p>Ultimately, the really hard question is: would we have the iPod, iPhone, MacBook Air, iPad if Jobs had <i>not</i> done what he did?",1327765433
3522310,comment,3522205,3522285,6,0,elisee,,,"Yes (""Disadvantage of this is that anyone who receives that mail will get registred without their consent if their mail client automatically shows images."").<p>If people do insist on using this method, they should at least add a prominent link to cancel the account in the e-mail.<p>But what if some random e-mail client prefetches the image and the e-mail end up never being read or whatever? This is not robust.",1327765386
3522309,comment,3522164,3522268,4,0,fhwang,,,"Yeah, personally I know a number of solid devs who like feature toggling but the notion has always rubbed me the wrong way. Especially because half the time I'm adding a non-trivial feature, I'm always semi-refactoring the code underneath to deal with the common patterns and concepts that emerge as a result of that addition. But I'm a big refactoring-as-you-go kind of person--I don't know how common this is.<p>Branching is definitely a significant investment for a team. It's best done when you've got somebody in-house who can guide everybody through the etiquette and how to use git to best support it. And if you want to do it all the way then you want to support in multiple places in your development stack -- QA servers, staging servers, CI, etc.<p>But for large units of work that genuinely should stay out of master -- large user-flow rewrites, big code refactorings or database migrations -- I find it a great way to have significant experimentation off to the side and then bring it back into master when it's ready for prime-time.",1327765373
3522308,comment,3522049,3522049,7,0,sp332,,,"Does anyone know of a FF plugin that will decode QR codes in images on a page, and maybe even turn them into live links?  Here's one for Chrome: <a href=""https://chrome.google.com/webstore/detail/bfdjglobiolninfgldchakgfldifphic"" rel=""nofollow"">https://chrome.google.com/webstore/detail/bfdjglobiolninfgld...</a>",1327765372
3522307,comment,3521817,3522267,14,0,michaelochurch,,,"Why I find ""conspiracy theories"" ridiculous: with ""friends"" (above-board entities like corporations, proud of having titled nobility... er, I mean, executives; I forgot that ""America doesn't have a hereditary aristocracy"") like our leading large institutions, who needs enemies? Why invent shadowy evil organizations when there are so many objectively-visible and extremely greedy (if not quite evil, and most often too stupid and poorly-run to pull off the levels of evil we imagine) ones?<p>The evil-evils don't meet in shadowy mansions with bad lighting and creepy piano music. They meet in private parties in Aspen and executive boardrooms and on the boards of ""charities"" that really exist as a scoreboard for the social status of rich people. They also don't have huge orgies. They visit prostitutes half their age whom they pay $1500/night to endure their post-coital crying about their mistakes (such as marrying dumb trophy/corporate wives and having to write high-six-figure donation checks to shove their low-IQ kids into Ivies).<p>There isn't ""one conspiracy to rule them all"", but there are lower-case-c conspiracies all over the place.",1327765353
3522306,comment,3522014,3522084,5,0,rmc,,,"Yep, USA welcome to what Hollywood does to the rest of us.",1327765351
3522305,comment,3521817,3521995,2,0,jbae29,,,"This should just depend on whether you're an exempt or non exempt employee.  Most IT professionals are classified as exempt meaning they do not qualify for overtime.<p>If you're paid hourly, or work as a contractor, you should be paid for all your hours.",1327765345
3522304,comment,3522205,3522205,4,0,dsr_,,,"I use mutt. I'm not the only one. There are also people who read their email in emacs. There are people who turn off image loading in HTML-capable mail readers.<p>All of these are the kind of people you want using your service or software: clueful and security conscious. When they recommend something, people listen. As customers, they're less likely to ask a FAQ and more likely to point out an actionable bug or deficiency.<p>The only problem I have with 'click-to-confirm' email messages is that some services deliver them slowly. If you can fire off an email when I click Register, I can be reading it and cutting-and-pasting the URL or ID code five seconds later. A message that doesn't arrive for ten or fifteen minutes means I have to context-switch away and then back.",1327765335
3522303,comment,3522014,3522150,1,0,rmc,,,"It is probably not illegal to purchase a VPN connection.<p>However check the Netflix terms of use. They may specify that you can only access it if you are located in the USA. If you are using a VPN you are accessing a computer system without authorisation, which is illegal in the USA (and most other countries). You are unlikely to be convicted of it (though it did sorta happen once in the USA).",1327765313
3522302,comment,3521903,3522126,2,0,WillyF,,,"I don't think that both sides have to be willing to walk away for it to be a negotiation. Both sides just have to believe that the other side is willing to walk away.",1327765308
3522301,comment,3521982,3522013,2,0,husted,,,"Exactly, free memory is wasted memory.",1327765300
3522300,story,,,2,0,ukdm,"AT&T discover Jim Henson's 1963 Robot film",http://www.geek.com/articles/geek-cetera/att-discover-jim-hensons-1963-robot-film-20120128/,,1327765270
3522299,story,,,1,0,czer80,"The economics of role playing games",http://www.enworld.org/forum/news/315800-4-hours-w-rsd-escapist-bonus-column.html,,1327765260
3522298,story,,,1,0,instinctis,"Microclicker.com : Domain Info, Seo Report, Monthly Earnings, Seo Analy",http://domof.com/microclicker.com.html,,1327765251
3522297,comment,3522255,3522255,1,0,jcfrei,,,"neat and simple - i like it! unfortunately I just changed my cover photo, so I'm gonna stick with it for a while.",1327765217
3522296,comment,3521735,3522079,1,0,bane,,,"<i>On iOS at least I think the single button is just fine, even preferable, and certainly far easier to understand and more consistent.</i><p>I don't disagree that the right mouse button can take new users a while to come to grips with.<p>The trade off of course is that even in moderately complex tools, a single button can't provide all of the actions a user would likely want to do. In the Mac world this was historically resolved by burying functions under layers of unmemorable keyboard combinations...e.g. command+shift+t or some such or in menus in the menu bar.<p>So the question then becomes, who do you optimize your interface for? The new user that can barely understand the abstraction of moving a physical device that's loosely mapped to screen coordinates? Or the user that needs to get-stuff-done-and-after-all-won't-be-a-new-user-all-that-long.<p>I personally think this move away from the menu button in Android land is a mistake. I already have issues with it on my Tab. With the software button showing up all over the screen or not at all.",1327765215
3522295,comment,3522014,3522257,3,0,rmc,,,"Actually BSG was aired in the UK a few months before the USA. Season 1 started in October 2004 in UK and January 2005 in USA.<p>People in the USA must have pirated it loads before it was shown on TV. And yet the TV numbers were still very impressive. This is evidence that piracy doesn't affect sales/viewing figures.",1327765177
3522294,comment,3521551,3521688,3,0,jedbrown,,,"Note that this chip, when fitted with DDR3-1333, has a theoretical peak system bandwidth of 32 GB/s (achievable peak will be somewhat lower). This hash, running on a single core, claims to process 16.2 GB/s. There are 4 cores (8 threads) on the X5550, so the hash is already limited by memory bandwidth.",1327765161
3522293,comment,3522075,3522117,1,0,epoxyhockey,,,"Yeah, but what's the equivalent of the MPAA/RIAA in the tech industry?  It's crazy how much more money the tech heavyweights have over the music/motion picture industry, yet, the tech industry seems to have almost no influence in politics.  Can't they lobby for <i>not</i> being censored?",1327765131
3522292,comment,3521735,3521934,3,0,phanster,,,"Exactly this. As an android developer, I'll developer my applications for the broadest range of devices that I can support. I know eventually ICS will take off, but for now 80% of the market is >= 2.2.<p>This is just another wrench thrown into the cog of advancing Android development. They pretty much have to break all their conventions before moving forward which is a pain in the ass to work through.<p>Also, if Google actually cared about it's developers, wouldn't it make sense for them to back this decision up with an official library to support an action bar on other OSs? There's third party libraries that you can use but it just goes to show again that Google just doesn't really care which state their developers are in.",1327765120
3522291,story,,,1,1,kschua,"Man who downloaded recipes on how to make explosive devices jailed",http://www.thisislancashire.co.uk/news/9498382.Man_who_downloaded_recipes_on_how_to_make_explosive_devices_jailed/,,1327765105
3522290,comment,3521982,3521982,16,0,betterth,,,"RAM is used by an operating system and managed. You may use 11/16 GB at once, but someone could browse the internet with the same tabs at 3 or 4 GB and be fine. Hell, they could at 2GB and be fine.<p>The operating system plays a huge role in memory usage, many modern ones cache indiscriminately, preload most used applications, etc etc<p>Comparing RAM usage is almost apples and oranges these days, unless we're talking similar setups.",1327765083
3522289,comment,3518559,3521385,1,0,jessriedel,,,"You misunderstood.  The total value of the physical Shuttle itself is $3 billion.  The average cost per trip is $450 million.  The marginal cost per trip isn't available, but it is undoubtably less.  Probably around $200-300 million.",1327765064
3522288,comment,3522255,3522255,1,0,maxjaderberg,,,"and i hope a blog post coming soon on the awesomeness of google apps' image api!",1327765026
3522287,comment,3521982,3522037,1,0,zdw,,,"With memory prices as low as they are right now, you should upgrade if possible.<p>8GB of DDR2/3 from a good vendor has been less than $50 for a while now.",1327764972
