ID,Type,Story,Parent,Points,Comments,Author,Title,URL,Content,Created
3522224,comment,3518967,3518967,6,0,michaelochurch,,,"I alluded to this (believing it was true) and was rebuffed: <a href=""http://news.ycombinator.com/item?id=3434582"" rel=""nofollow"">http://news.ycombinator.com/item?id=3434582</a> . Doesn't seem to be the case.<p>I think that many more people can learn how to program, and become <i>good</i> programmers at that. It's true now that the majority (at least 80%) of programmers are incompetent, but I think that has more to do with environment, tooling, economics, and the short half-life (5-6 years) of a software developer, than intrinsic limitations on ability. I wrote about this here: <a href=""http://michaelochurch.wordpress.com/2012/01/26/the-trajectory-of-a-software-engineer-and-where-it-all-goes-wrong/"" rel=""nofollow"">http://michaelochurch.wordpress.com/2012/01/26/the-trajector...</a> . The tools and freedom that a developer needs to become good (1.5+) are simply not available in average software jobs.<p>I think the big problem is that we teach programming using languages like Java, which are actually very complicated. There's a lot of information in ""public static void main(String[] args)"" that just seems like line noise to a novice, and that people shouldn't even be exposed to until they develop the taste to know when to use OOP and when not (and that takes years, IMO). In teaching, we should start with simple languages like Scheme so we aren't requiring people to lex and parse and generate .class files in their heads before they even know what those terms mean.<p>Scheme and Python are better starting languages, in my opinion, and we should be starting programming education around age 6. We can (and should) expose growing programmers to C, Scala, Clojure, and Haskell later.<p>Also, starting with complex languages and tools (Java-style) means we have to teach in an inverted way. In your first Java exercise, you don't write a <i>program</i>, you write a <i>class</i>. Why? No good reason. There's no intrinsic reason a program has to be a <i>class</i>. This sort of botched, improperly-coupled teaching produces a generation of programmers who think every program must be a class, and who produce shitty AbstractVisitorHandlerFactory programs as a result.<p>This is one thing that annoys me especially in the teaching of Scala-- one of the most exciting languages to come out of the past 10 years, but one that is poorly understood and generally taught quite badly. What angers me especially (I'm writing a Scala tutorial to fix some of these mistakes, probably making others in the process) is when case classes are taught <i>after</i> classes. For example, the O'Reilly book (which is generally quite good) covers <i>traits</i> (a very powerful and highly nuanced advanced OOP feature) in Chapter 4 and <i>case classes</i> in Chapter 6. Case classes, for the uninitiated, are immutable records (data objects) and provide a lot of niceties (automatic .equals and .hashCode, class name as constructor) for free. Since case classes are simpler than full-featured classes, they should be taught <i>first</i>.<p>The right way to teach programming is to teach the simple stuff (immutable records, referentially-transparent functions, mutable state in <i>simple</i> data structures) first, and <i>then</i> provide some insight into when and why you might want to use the more complicated stuff (OOP, type classes in Haskell, functors in OCaml).<p>This is the reason why people who start in functional programming usually become top-5% programmers within ~3 years and people who drink the OOP Kool-Aid almost never do. Mutable state isn't evil, and good ""functional"" programmers use it all the time, but if you don't start with the right (simple) <i>default</i> abstractions-- immutable records and referentially-transparent functions-- you are not learning how to write clean, simple, maintainable code. Not only is this an important engineering skill on its own, but it's also important for the purpose of growth, because reading good code (one's own and others') is a great way to improve as a programmer.",1327763506
3522223,comment,3522014,3522153,1,0,DeanCollinsLCC,,,"Australians have a delayed wait for both American and UK shows....which is why they torrent more per population that anyone.",1327763480
3522222,comment,3522049,3522049,1,0,mnutt,,,"Interesting story, though I don't understand what he says at the end about not being able to redirect the QR Code to another link because the QR Code is the link.  Why not just send a 302 redirect?<p>He sounds like he wouldn't do it on principle, but I don't understand the technical reason why he couldn't.",1327763471
3522221,comment,3521770,3521916,1,0,r4vik,,,"If you're going to be in the US any time soon I just priced up a Vaio Z top of the line and it came to 1400 quid, did the same on the UK site and it was 2400 quid",1327763453
3522220,comment,3522021,3522184,2,0,sp332,,,"In FF, my homepage is Google. In Chrome, I don't need one. Edit: I guess I should mention that I would use the ""search"" bar next to the address bar to Google for stuff (instead of going ""home"" to search), but I prefer to leave that one set to Wikipedia.",1327763453
3522219,comment,3521982,3522203,2,0,mgkimsal,,,"""How would you know how much RAM is going to be needed by a process?""<p>I don't necessarily.  I just know how much RAM I want to be able to give it.<p>I'd love to be able to test apps in lower-RAM scenarios.  Just because I've got 8g or 16g doesn't mean everyone does, but I have no way to test what that experience will be like.<p>Additionally, I may have two processes that are both rather RAM hungry that I need to run.  Give me the option of constraining one of them so that I can give RAM priority to one or the other rather than ""oh, well the OS people are smarter than me, so I guess I have to trust that app 1 will get RAM priority over app 2, or they'll just both have to be equal"".",1327763424
3522218,comment,3521817,3522033,5,0,rapind,,,"I would have applied to one writing ""I'm interested in working for you because my current boss is a douchebag who posts fake jobs to try and get us to apply to them.""",1327763400
3522217,comment,3521959,3522189,3,0,Loic,,,"Mongrel2 is still beta, but with a good process supervisor, it still way more robust than a RoR setup from the early days. Once in a while, it can die, I still need to instrument a bit more to track the conditions where this is the case.<p>On the other hand, ZMQ for the backend is just a pure pleasure and I haven't had a single failure of my components  for more than 1 million real requests involving many ZMQ backend interactions.",1327763288
3522216,comment,3520535,3521557,1,0,nitrogen,,,"The Xtion Pro Live for $200 is depth, RGB, and audio.  The Xtion Pro for $150 is depth only.",1327763253
3522215,comment,3520175,3521045,9,0,dkrich,,,"Please stop using the term ""ghetto testing."" Nobody knows what the hell that means and nobody thinks that that's okay.<p>The proper course is to apologize, take it down, and move on. Not make lame, half-assed excuses which just perpetuate the situation.",1327763239
3522214,comment,3521959,3521959,1,0,silasb,,,"I went through some of your links but didn't find the whole shebang.  Is there a plan to release all of it.<p>I love the detail that we went through when describing it.",1327763196
3522213,story,,,3,0,draegtun,"Rakudo Star 2012.01 released (Perl 6 - New Object Model branch)",http://rakudo.org/2012/01/28/rakudo-star-2012-01-released/,,1327763165
3522212,comment,3521758,3521758,1,0,_delirium,,,"It's a bit old, but imo a really interesting book that still has good insights (and has been very influential) is Douglas McGregor's <i>The Human Side of the Enterprise</i> (1960): <a href=""http://www.amazon.com/gp/product/0071462228/ref=as_li_ss_tl?ie=UTF8&tag=abxxm-20&linkCode=as2&camp=1789&creative=390957&creativeASIN=0071462228"" rel=""nofollow"">http://www.amazon.com/gp/product/0071462228/ref=as_li_ss_tl?...</a><p>It originated the idea that management is based (even if implicitly) on a combination of two competing theories: ""Theory X"", which assumes employees are inclined towards laziness and misdirection, so management is the science and art of controlling, steering, and incentivizing them; and ""Theory Y"", which assumes employees are motivated and self-directed, so management is the science and art of enabling them.",1327763162
3522211,comment,3521959,3522179,1,0,dochtman,,,"Very nice post, thanks! I'm looking at experimenting with Mongrel2 to see if it would be a nice fit at work, where we still use apache2/mod_wsgi (we have modest needs) to interface our Python + CouchDB app. However, we've started adding WebSockets stuff to the system, and it would be nice to run everything in a slightly more coherent matter. We also use ZeroMQ to pump messages around the network (that later get converted into WebSockets frames for web frontend consumption).<p>- Is mongrel2 getting good development? The latest release was in June, and the latest commit in the canonical repo seems to be from July...<p>- Is there good support for RFC-version WebSockets yet?<p>- Is there easy/performant stuff for simple asset serving via mongrel2, or should I use nginx for that?",1327763132
3522210,story,,,1,0,faberkamin," | ",http://www.carmel-heating.co.il,"        -  ,  ,   .",1327763126
3522209,comment,3522164,3522164,4,0,dqminh,,,"Its opposite for us. At work, we dont use branch, only git pull --rebase on master. Any idea on when and why to use branches often ?",1327763117
3522208,story,,,1,0,mhahnel,"Giving a fig for negative research?",http://web.vivavip.com/forum/LiveWire/read.php?i=32497,"Negative data has merits. Consider too the volume of unused data generated in research projects and its possible uses. The question has been where to put it and how can it be re-used?",1327763116
3522207,comment,3522021,3522100,1,0,simondlr,,,"Agreed. It reminds me of the Facebook RWW login fail. <a href=""http://www.readwriteweb.com/archives/facebook_wants_to_be_your_one_true_login.php"" rel=""nofollow"">http://www.readwriteweb.com/archives/facebook_wants_to_be_yo...</a>.<p>To us, this was hilarious, but it painted a picture of how unintuitive the browser abstraction is to some.",1327763115
3522205,story,,,16,14,alentodorov,"A better way of validating an email address",http://alentodorov.posterous.com/a-better-way-of-validating-an-email-address#,,1327763087
3522204,comment,3520856,3520856,4,0,unoti,,,"Where are the bars in San Francisco where people are likely to know what Y Combinator is?  I just moved here and don't know of them.",1327763087
3522203,comment,3521982,3522182,1,0,jiggy2011,,,"How would you know how much RAM is going to be needed by a process?<p>Let's say you load up you video editing program, maybe it only needs 512MB of memory to fit the whole program into memory, now what happens when you load in LOTR directors cut?<p>Especially if you aren't running any other large programs, would it still make sense to restrict it to 300MB (or 1GB , or 2GB etc)?<p>I think it's safer to assume that OS developers know what they are doing and can be trusted to handle memory contention issues better than most of us can.<p>As an aside some programs (like redis , memcached etc) do allow you to restrict the amount of RAM which they use but this is because they are explicitly greedy with memory and are probably used by people with enough skills to measure actual usage and tune accordingly.",1327763068
3522202,story,,,2,0,sp332,"Kinect Russian Roulette (video)",http://vimeo.com/35782736,,1327762996
3522201,story,,,10,1,Mad_Dud,"OpenCV Washing-up Detector",http://imakethin.gs/blog/?p=2613,,1327762857
3522200,story,,,1,0,faberkamin,"Free online games",http://www.dr-games.com/,"Free online games at Dr-Games, 4 New games every day and a lot of categories for children.",1327762851
3522199,comment,3522014,3522014,10,0,stevoski,,,"A friend of mine works in BBC sales. He tells me that selling rights for their TV shows to channels in various countries is highly lucrative for the BBC.<p>He also tells me that he understands this model won't last much longer. But until then, for economic reasons, the BBC doesn't want to make it too easy for you to watch their content directly in your non-UK country without going through a local channel.",1327762849
3522198,comment,3521982,3522180,1,0,jiggy2011,,,"Most likely it's the javascript etc, it may also be holding syntax trees etc in memory too?<p>If it causes the load of another library which nothing else was using that could count especially if it's a different version of jquery etc.<p>If 2 processes are both using the same library and it is linked to their addresses spaces, who's memory usage does it count against?",1327762832
