ID,Type,Story,Parent,Points,Comments,Author,Title,URL,Content,Created
3522286,comment,3521817,3522252,32,0,michaelochurch,,,"I guess I'm cynical, but I'm not surprised. I wouldn't have expected some specific individuals (I thought more of Eric Schmidt; I always liked him) to be involved but the behavior is not shocking. Yes, it's shitty and illegal. No, it's not at all surprising.<p>Let's say that you're talking to an investor and you tell him that you're being courted by another VC and that he needs to act fast. What's the first thing he'll do, if he takes you seriously? Pick up the phone and call the guy (they were classmates in business school, and it's ""bros before schmos"", man.) If there was proper competition, that sort of thing would never happen.<p>Social class is an ugly reality and people in higher social classes <i>always</i> look out for each other first. The <i>real</i> competition is insiders vs. outsiders. Human societies are naturally conspiratorial. I don't know what the solution to this problem is (other than, individually, to just keep working hard and trying to be awesome enough that the general wankbasketry of humanity doesn't matter) but it's obvious that our current regulatory machinery is too thin.",1327764955
3522285,comment,3522205,3522205,9,0,dablya,,,"Comment in the post says it all.",1327764904
3522284,comment,3522021,3522159,2,0,jameshart,,,"No, it doesn't <i>have</i> to be that way, and on mobile devices it often isn't. In a mobile browser a lot of this layering is invisible or only available when called upon by the user. And  consider also whether this excessive contextualisation might have something to do with the success of the 'app' model for accessing services, where the device focuses solely on the task at hand and all that framing goes away completely.",1327764895
3522283,comment,3518967,3518967,1,0,chl,,,"""Two years ago we appeared to have discovered an exciting and enigmatic new predictor of success in a first programming course. We now report that after six experiments, involving more than 500 students at six institutions in three countries, the predictive effect of our test has failed to live up to that early promise. We discuss the strength of the effects that have been observed and the reasons for some apparent failures of prediction.""<p><a href=""http://www.eis.mdx.ac.uk/research/PhDArea/saeed/paper3.pdf"" rel=""nofollow"">http://www.eis.mdx.ac.uk/research/PhDArea/saeed/paper3.pdf</a><p>More:<p><a href=""http://www.eis.mdx.ac.uk/research/PhDArea/saeed/"" rel=""nofollow"">http://www.eis.mdx.ac.uk/research/PhDArea/saeed/</a>",1327764831
3522282,comment,3518086,3518521,2,0,mapster,,,"Check out ""West Virginia Historical Atlas"" 2010, by WV Univ Press. I did the maps.",1327764829
3522281,comment,3522049,3522258,1,0,sp332,,,"As a user, that would really annoy me. I like to know where I'm going before I put a URL in my browser.",1327764811
3522280,comment,3520175,3521707,7,0,WadeF,,,"That logo looks an awful lot like the Luanchbit logo as well. <a href=""http://www.launchbit.com/"" rel=""nofollow"">http://www.launchbit.com/</a>",1327764809
3522279,comment,3522014,3522150,1,0,officemonkey,,,"When I lived in Europe from 2006-2008, I was able to purchase and download episodes online from Apple iTunes with a U.S. Credit Card.<p>I was unable to access Hulu or Netflix streaming when they debuted, which made me sad.",1327764802
3522278,comment,3521982,3522039,2,0,vrdabomb5717,,,"At the same point as you are. I have 8 GB of RAM in my mid-2009 MacBook Pro and usually have one browser running with a number of tabs. I quickly run out of RAM and go to swap, and the only solution I've found so far is to use the <i>purge</i> tool that came with Xcode and manually free up the ""inactive"" RAM that seems to just sit there.",1327764769
3522277,comment,3521817,3522104,5,0,deanproxy,,,"Why not? Everyone has already diluted the meaning of the word ""greed"" successfully. Might as well start on ""evil"" now. :-)<p>But in all fairness, non-poaching agreements are not right. What if every tech company did this? You better hope you never have to leave that company after they hire you... Cause otherwise you'll have to consider a career change.",1327764742
3522276,comment,3520654,3521541,1,0,nitrogen,,,"<i>lucidguppy 55 minutes ago | link [dead]<p>There's a wonderful documentary on the NYC subway. At the end of the director's career - he basically stated he could keep building the subway for as long as he wanted - the subway would still fill to capacity.<p>I think one of the biggest problems was caused by the interstate system that went through cities. I can understand ring roads - but cities like Hartford, Providence, and Worcester are cleaved in two. It's just horrible.</i><p>It looks like your account was killed (maybe due to being inactive for 562 days?).",1327764683
3522275,story,,,1,0,fah12ie,"Chuck Series Finale Recap, notable moments from the finale.",http://garoetbangkit.blogspot.com/2012/01/chuck-series-finale-recap-notable.html,,1327764640
3522274,story,,,2,0,normalocity,"Why RTFM doesn't work",http://technicallyborked.com/2012/1/28/why-rtfm-doesnt-work.html,,1327764625
3522273,comment,3521888,3521888,3,0,elisee,,,"If we're going to keep moving more and more apps from native to Web-based, I think we're going to see a lot more of this (standardizing an existing service to be accessible over HTTP), since WebSockets can't connect to any raw TCP sockets (and they shouldn't, that would be terrible security-wise) and WebRTC has the same approach: a protocol of its own with its own handshake & rules.<p>Better that than have everyone builds its own incompatible HTTP / REST API for common services.<p>I do wonder if there's any big companies like Google which have pledged to support this spec?",1327764615
3522271,comment,3521817,3522052,16,0,abrahamsen,,,"I agree in general, but this one (stifling competition by illegal methods) happens to be within my particular corporate evilness threshold.  Unlike every previous evil Google has been accused of.<p>The problem with a word like evil is that it is so subjective.  For some, obeying repressive laws in China would be the ultimate evil Google has committed. Using Google's own definition of evil, using the entire right side of the search results for self-advertising could be seen as evil.<p>However, ultimately I agree. Since evil is so subjective, very little information is provided by calling out Google in particular for being evil and thus hypocritical.<p>Condemning all the involved companies equally would make more sense.<p>(But I can't help feeling more disappointed Google was part of this).",1327764556
3522269,comment,3518426,3519602,0,0,Vargas,,,"TB = TeraByte\nRAM = Random Access Memory<p>I would have thought TB and RAM were easier than RHEL and NUMA.",1327764546
3522268,comment,3522164,3522237,4,0,dqminh,,,"We faced this situation before. What we do is:\n- When there is a feature that is not done yet, but has some user-facing code, we use feature toggler to disable it on production\n- we deploy quick fix by doing a cherry-pick<p>We discussed about branching a while ago to solve this problem more effectively but still not satisfied with the pros vs cons. For us, branching only makes sense if we switch to use branching completely, and thats quite a big change.",1327764545
3522267,comment,3521817,3522245,14,0,itmag,,,"The idea that small cabals of individuals can act in collusion like this goes against the commonly held view of the economy as an anonymous force of nature that always moves toward efficient equilibrium. But sometimes that's just what happens.",1327764518
3522266,comment,3521903,3522076,2,0,m0nty,,,"It has occurred to me that being in IT is possibly one reason I can do this, but otoh I have noticed that companies increasingly want to ""commoditise"" IT workers, so repeatedly low-ball their offers until they get someone who is willing to work for low pay and goodwill. I must admit, that has sometimes been me, but it won't happen again ;) Also, I have been in situations where I <i>needed</i> work, and I think now it would have helped if I had adopted my current strategy. It's a bit like dating: look too needy, get neglected. Look confident, people think you're worth having.",1327764504
3522265,comment,3521551,3522097,2,0,jedbrown,,,"The issue is whether it is feasible to engineer collisions.",1327764489
3522264,story,,,45,6,gioele,"Origin of the term driver in computer science",http://english.stackexchange.com/a/56208,,1327764444
3522263,story,,,1,0,nitam,"Sebastian Thrun Resigns from Stanford to Launch Udacity",http://www.i-programmer.info/news/150-training-a-education/3658-sebastian-thrun-resigns-from-stanford-to-launch-udacity.html,,1327764431
3522262,comment,3521627,3521627,1,0,kiloaper,,,"This is also significant because it's an ARM tablet. Up until now all the Plasma Active demos I've seen have been on x86 tablets.<p>I see it has Mali-400 GPU. Rumour has it that an open source, reverse-engineered driver is on the way. Things certainly are getting interesting.",1327764430
3522261,comment,3522014,3522244,2,0,Kudos,,,Nope.,1327764421
3522260,comment,3522014,3522197,1,0,hyperbovine,,,"The episodes are available for free on pbs.org. I personally would not pay for it. But then again I was happy to wait for it to show up stateside.",1327764382
3522259,comment,3521817,3521817,6,0,itmag,,,"Gee, I didn't know that employees were akin to the King's game, making it a Bad Thing to poach them.<p>In my world, poaching employees == offering them better options in exchange for the value generating capabilities that they bring to the table. Quid pro quo, and if someone else offers a better quo...",1327764373
3522258,comment,3522049,3522049,8,0,eliaskg,,,"I made the experience that it's never a good idea to point a QR code to a fixed domain. Always create a little redirect app where you can define later on what target the link should point on.<p>So for example point the link to <a href=""http://mysite.com/qr"" rel=""nofollow"">http://mysite.com/qr</a><p>where you have a little redirection-php file that you can edit at all time.",1327764363
3522257,comment,3522014,3522239,3,0,Kudos,,,"They aired Battlestar Galactica a few hours ahead of the US. I'd imagine the narrower gap put an even deeper impact into piracy.",1327764353
3522256,comment,3522014,3522199,2,0,officemonkey,,,"How lucrative? As lucrative as a 1 rental of each episode of Downton Abbey or Dr. Who available the day after it is broadcast?<p>Because that's the price point I would pay to watch a current episode.",1327764333
3522255,story,,,66,29,maxjaderberg,"Show HN: My weekend project, TrickedOutTimeline",http://www.trickedouttimeline.com/,,1327764306
3522254,comment,3519952,3522011,2,0,Symmetry,,,"Hard disk space isn't an issue, but internet bandwidth is.  Also, being able to fit a fairly complete operating system on a CD.",1327764199
3522253,comment,3522075,3522117,4,0,stfu,,,"As long as companies like Twitter are openly embracing country specific censorship I don't see this happening anytime soon. Just looking at the recent developments - Megaupload, Google Profiling and Twitter's new found love for Censoring doesn't make me hopeful that Tech companies will stand up for the interests of their users.",1327764143
3522252,comment,3521817,3522245,43,0,nyellin,,,"We are surprised by the blatant disregard for employee rights and that they would do something so illegal.",1327764133
3522251,comment,3522075,3522075,3,0,kiloaper,,,"Not only censorship but also results manipulation.  \n>Prioritize websites that obtain certification as a licensed site under a recognised scheme<p>It's like pressuring map makers to exclude ""bad areas"" of town where knockoffs are sold, but also only listing the shops that a certain cartel, I mean group, want listed.",1327764093
3522250,comment,3521817,3522033,5,0,lrobb,,,"Not too uncommon... and why people should never apply if the poster uses an anonymous address (ala craigslist).",1327764075
3522249,comment,3521817,3521817,8,0,jcslzr,,,"That is what is funny about all those people that treat conspiracy theories as nuts. Is like corruption must have a limit just because they have not seen it first hand.",1327764032
3522248,comment,3521982,3522219,1,0,jiggy2011,,,"If you want to artificially constrain memory in order to test performance in low memory systems then this is a different use case entirely and I'd be surprised if there is not software available to do this for you.<p>Although you should bear in mind that computers with less memory probably have less everything else (including slower memory busses) so your best bet is to actually find a slower computer and test with that.<p>Most OSes will let you prioritize other processes over others (e.g Linux has ""nice""), whether this is just for CPU preemption priority or whether it does other resources as well I'm not sure.<p>However I think most swapping systems will try and keep the most frequently used pages in RAM , so if one process has preemption priority over another this problem would solve itself as it's memory area would just get accessed more often.<p>Again this is kind of finger in the air stuff so anyone more familiar with OS design should feel free to correct me.",1327763989
3522247,story,,,1,0,djemba,"101 Top Startup Blogs",http://www.dostartup.com/top-startup-blogs/,,1327763984
3522246,comment,3521959,3522214,1,0,Loic,,,"It will be released in parts, the core components are already available:<p>- distributed process manager: \n<a href=""http://projects.ceondo.com/p/diprocd/"" rel=""nofollow"">http://projects.ceondo.com/p/diprocd/</a><p>- the pre-receive hook taking care of packaging and deployment: \n<a href=""http://cdn.ceondo.com/bareku/buildpack-python.tar.gz"" rel=""nofollow"">http://cdn.ceondo.com/bareku/buildpack-python.tar.gz</a><p>If you need something similar, you will most likely adapt it heavily for your own setup, so, I am not sure if a full release is feasible.",1327763904
3522245,comment,3521817,3521817,29,0,michaelochurch,,,"I am surprised that people are surprised by this.<p>Who do VCs spend their skiing trips with: ramen-fed, sleep-deprived startup founders, or other VCs? Of course, they hang out with each other.<p>Same with executives at large companies. They might be nominally ""competitors"", but they've already learned that they have more in common with one another than with employees in the companies they run.",1327763899
3522244,comment,3522014,3522150,2,0,p0ppe,,,"You would probably need a credit card tied to a us-based address as well.",1327763864
3522243,comment,3522014,3522199,3,0,jonnathanson,,,"International sales, distribution, and licensing has been a major cash cow of the TV industry for decades. It works in the other direction, as well, i.e., from the USA to the UK (and to other countries).<p>Your friend is correct in that the appeal of this cash cow is why the industry will fight tooth and nail before they have to put her out to pasture. The model is going to become irrelevant sooner or later, but for the time being, it's still paying off handsomely. It will go, but it won't go quietly.",1327763857
3522242,comment,3518384,3520124,1,0,karlzt,,,"I use Arch with modular kde, which is a balance between minimalism and 'just works'.",1327763853
3522241,comment,3522049,3522222,3,0,rpledge,,,"It points to his top level.  He'd be sending traffic away from his site unless he managed to filter it somehow.",1327763814
3522240,story,,,1,0,suhastech,"Building a truly portable backup service",http://thehorcrux.com/,,1327763806
3522239,comment,3522014,3522059,4,0,coob,,,"With the later seasons of Lost, Sky One (UK) aired the newest episodes the night after their US premiere, supposedly to cut down on Sky losing viewers to pirating.<p>Anecdotally, it worked.",1327763776
3522238,comment,3521982,3522187,2,0,keeperofdakeys,,,"Really, you don't want to randomly waste cpu cycles for nothing, like pre-decompresssing video. It just increases the power usage and heat of the computer. It would also make it harder to skip, since the program needs to finish the portion it is working on.<p>One thing people often don't realise is there isn't really 'wasted' RAM, your OS usually uses the rest to cache things, especially files. File caching can greatly speed up disc reads and writes. (The following only applies to linux, I'm not sure about other OS's; all three have very different memory models). When memory is getting high, a few things can happen (depending on whether you have swap). The file cache is preferentially cleared first, but swapping pages to disc is also considered readily. An interesting thing is that swapped pages aren't deleted from swap straight away, only if they are modified (so swap usually doesn't decrease in size). There is also the Out Of Memory killer, which can kill applications using too much memory. It really is an interesting area. You can read more from this page <a href=""http://tldp.org/LDP/tlk/mm/memory.html"" rel=""nofollow"">http://tldp.org/LDP/tlk/mm/memory.html</a>. Just remember all OS's are different.",1327763756
3522237,comment,3522164,3522209,4,0,fhwang,,,"Branching can often be a good strategy if you have a large team and you don't want large uncompleted chunks of work to block quick fixes & deploys, etc. The situation you want to avoid is:<p>1. Engineers A & B are working on a medium-sized story that's not really done yet, but is in master anyway\n2. Somebody discovers a small but critical bug in production\n3. Engineer C can write a bugfix very soon, but can't deploy it to production because the other story isn't done yet.<p>But if your team never ends up saying ""I'd deploy that but master isn't clean right now due to different changes"", you probably just don't need to branch that much. Maybe your team is smallish or maybe you're capable of always breaking up work into really small increments. It really depends on everybody's situation.<p>Github does something sort of like this internally: <a href=""http://scottchacon.com/2011/08/31/github-flow.html"" rel=""nofollow"">http://scottchacon.com/2011/08/31/github-flow.html</a><p>Branching is more overhead in some circumstances but I've also found they can make things much easier. But I also wish that more people were comparing strategies and trade-offs because this stuff gets subtle and there are really lots of ways to do it.",1327763754
3522236,comment,3522049,3522222,17,0,pilif,,,"Because then his blog would be unavailable? The code points to the root of his domain.<p>And even if he was willing to have his blog redirect to that other site, there's still the issue about all these other misprinted codes. If they point to $randomblog it's mostly funny. If they point (via the redirect) to $possible_competitor, it's much worse",1327763739
3522235,comment,3522060,3522060,1,0,Myrth,,,"> and also the potential to connect to Wi-Fi towers that are miles distantsomething that is impossible with conventional Wi-Fi, mostly because the power of normal Wi-Fi transmitters are limited by the FCC.<p>And my laptop will need to beam back miles away with omnidirectional antenna? That's exactly what I want to have on my lap...",1327763725
3522234,comment,3521982,3522134,2,0,viraptor,,,"Similar to your caching FS trick, it would be cool if Cleancache was exposed to the userspace somehow. (<a href=""http://lwn.net/Articles/386090/"" rel=""nofollow"">http://lwn.net/Articles/386090/</a>)",1327763720
3522233,comment,3522226,3522226,1,0,gamechangr,,,"Nominate: portland, boston, Washington DC, in that order",1327763699
3522232,comment,3515727,3515727,1,0,antlers,,,"Well guys it all looks very nice. I'm just afraid you misjudge the situation. If I'm already working with electronic device why should I draw anything, not just drag&drop UI elements? It seems to be waste of my time.<p>Merits of paper are huge and can't be overvalued.<p>- Paper has no limits, because it has extremely simple user interface. No predefined style, rules and guidelines. No predefined interaction.\n- Paper is vastly collaborative - easy to share, easy to pin on the wall and discuss with team mates.\n- Paper doesn't bond you. You can always easily throw away what you have designed in 5 minutes. You don't need to focus on details!\n- Paper teaches designers that what they have in mind matters, not tools<p>Your tool doesn't address those advantages of paper properly.<p>Adobe created similar app and doesn't achieve much.<p>Besides, problem with conversion from paper into digital wireframes is already resolved. UXPin notepads and UXPin App are quite popular in the UX world.<p>Check out the video:\n<a href=""http://youtu.be/-7VitOBVfCE"" rel=""nofollow"">http://youtu.be/-7VitOBVfCE</a><p>You can start your design process on paper by sticking UI elements on paper to the notepad, take a picture of it, send it to the app and it will be auto-converted.<p>So while your website looks nice and the video is great, your conception seems to miss the point.<p>Sorry about that. I wish you all the best.",1327763655
3522231,comment,3518361,3521429,1,0,vannevar,,,"Is there a good source for historical data on this? The best I could find goes back to 1996, and while the amounts issued in 2006-2010 are high, they don't show the steep hockey-stick climb that we saw in the mortgage crisis, for instance.<p><a href=""http://webcache.googleusercontent.com/search?q=cache:ksi3L1yHTK8J:www.sifma.org/uploadedfiles/research/statistics/statisticsfiles/corporate-us-corporate-issuance-sifma.xls+US+corporate+debt&cd=11&hl=en&ct=clnk&gl=us&client=firefox-a"" rel=""nofollow"">http://webcache.googleusercontent.com/search?q=cache:ksi3L1y...</a>",1327763643
3522230,story,,,2,0,systems_we_make,"HadoopDB: Efcient Processing of Data Warehousing Queries",http://www.systemswemake.com/papers/query-proc,,1327763626
3522229,comment,3518967,3518967,1,0,MikeMacMan,,,"This makes sense. I majored in Japanese in college. There were 3 kinds of students in our language classes:<p>1. Students for whom it came naturally\n2. Students who could be competent if they worked really hard\n3. Students who, no matter how hard they tried, weren't going to learn to speak Japanese. Wasn't gonna happen.<p>Bad teaching methods might result in some #2 types being mischaracterized as hopeless #3's, but I think no amount of pedagogical innovation can overcome the fact that some people just can't do certain things. (Of course, it could be a function of age and brain wiring, since all citizens of Japan, even the stupid ones, have no trouble learning Japanese.)",1327763607
3522228,comment,3521888,3521913,1,0,balakk,,,"Exchange also supports WebDAV - Outlook web access uses(d?) it. In fact, this became one of the easiest ways of integrating with Exchange server. Now that Exchange 2007+ has a full web services API, I hear the DAV stuff has been deprecated.",1327763587
3522227,comment,3521959,3522211,2,0,Loic,,,"1. Zed is coding in bursts, check the develop branch, it is pretty active and a 1.8 is around the corner.<p>2. The same, in the develop branch, there are still some questions on how to best implement it like which parts must be done by the handlers and which by Mongrel2, but the coders involved are good and very pragmatic, I bet the results will be a high quality implementation.<p>3. <a href=""http://notes.ceondo.com"" rel=""nofollow"">http://notes.ceondo.com</a> is served by the ""Dir"" handler, that is, direct static files from disc without going through the asynchronous ZMQ based sequence. It is pretty fast.",1327763559
3522226,story,,,4,16,gamechangr,"#2 startup city: Austin, Boulder, or San Diego?",,"Each city advertises, but what does/is your network/experience?",1327763521
3522225,comment,3521971,3521971,1,0,davewiner,,,"This site is 503 unavailable.",1327763508
