ID,Type,Story,Parent,Points,Comments,Author,Title,URL,Content,Created
2557572,comment,2557461,2557461,10,0,kenjackson,,,"Another answer is it's because most startups are consumer web-focused and MS traditionally hasn't been.<p>ASP.NET was traditionally an enterprise framework.  Which got long in the tooth.  ASP.NET MVC is quite good, but probably just caught up with the leading FOSS with MVC 3. Give it a year.  And in general people aren't doing startups for desktops anymore, although they're still huge in the enterprise, which is why .NET is bigger in the enterprise than for startups.<p>The other big space for startups is mobile, but MS isn't big here at the moment.  Why are startups using Cocoa now?  Well because iOS is huge.  If WP7 becomes huge, guess what happens?  C# becomes a hot language for startups.<p>The author of the referenced blog (not the Piehead one) clearly doesn't understand that domains tend to dominate language.  And further doesn't seem to understand that you try to pick the best tool for the job.  A manager begrudging you for selecting the best tool for the job is not someone you'd want to work for.",1305661526
2557571,comment,2556534,2557306,2,0,Apocryphon,,,"I'm of the current generation, and I'm into owning CDs. As far as music goes, burned albums have been around since middle school and earlier, but to me having the actual jewel case signifies ownership and support of the artist, even if I mostly listen to their music on an mp3 player.<p>But that's just my thing; DVDs I care much less about. I do value physical books significantly, though. The difference is, of course, is that a stack of dead trees is independent of electricity (unlike CDs or DVDs) yet has higher resolution than anything electronic.",1305661507
2557570,comment,2557461,2557461,8,0,pbz,,,"As much as we like to think of ourselves as cold and calculated, able to cut through emotions when making decisions, more often than not we're just like everybody else.",1305661505
2557569,comment,2557155,2557546,4,0,ctdonath,,,"Elsewhere it was clarified that he asked about spending >$20 total on Android apps, not just a single game.",1305661498
2557568,comment,2533506,2533506,1,0,GuruDL,,,bump,1305661471
2557567,comment,2555349,2557531,5,0,guygurari,,,"Applets are terrible but it's not what I'm suggesting. See my reply to mythz.",1305661445
2557566,comment,2556534,2556534,1,0,romey,,,"I wonder if this data will change anything about the argument for net neutrality? The big telecom companies were already complaining about companies like netflix, skype, google etc. making huge piles of money by driving lots traffic and pulling lots of bandwidth for users; I'm sure Comcast wouldn't mind being able to charge customers a premium for a ""Comcast Netflix package"" with faster movie loading times, etc.",1305661444
2557565,comment,2557155,2557501,-1,0,programminggeek,,,"Angry Birds made a lot more than that on iOS before it ever went to Android. Name an Angry Birds like success story that <i>started</i> on Android. All the big apps <i>start</i> on iOS and are ported to Android later.",1305661438
2557564,story,,,1,0,spottiness,"Sizing up the LinkedIn bubble",http://finance.fortune.cnn.com/2011/05/17/sizing-up-the-linkedin-bubble/,,1305661432
2557563,story,,,1,0,mcantelon,"Recorded Future: data mining the past to predict what's coming",https://www.recordedfuture.com/how-media-analytics-works.html,,1305661426
2557562,comment,2557461,2557545,1,0,enjayhsu,,,"I completely agree. Especially with tools like Mono that allow you to run .NET code on Linux/Mac OS X.",1305661414
2557561,comment,2555349,2557484,11,0,guygurari,,,"I have used and written applets, and they are horrible, but it's not what I'm suggesting. Applets run in their own area on the page and can't interact with the rest of the page like javascript does. I'm suggesting to replace the javascript runtime with a JVM runtime, while supporting everything javascript does through an API. Here's the use case I'm imagining:<p>1. When a user starts loading a page (read 'web app') the browser spawns a new JVM for that page. How long does this take? You can bring it down to the price of a fork if you keep a JVM running at all times.<p>2. Instead of running javascript that's embedded in the page, you compile and run Java/JRuby/Jython. Better yet -- have the server precompile the embedded code and send you the bytecode. Load it dynamically into the JVM and run it in the page's thread. With a modern JVM you get JIT for free and the code runs at near-native speeds.<p>3. Want long-running background tasks? No problem -- the JVM code can start its own threads. Suddenly AJAX, and all the other stuff we use to make web apps behave like desktop apps becomes trivial.<p>4. User leaves the page / web app? Kill the JVM.",1305661368
2557560,comment,2557261,2557261,1,0,imasr,,,"I guess they haven't seen War Games (the movie).",1305661342
2557559,comment,2557155,2557155,3,0,programminggeek,,,"Ok, having sold apps on both Android and iOS platforms I can tell you with 100% certainty that the same app will have sales that are an order of magnitude larger on iOS than they will on Android. Android users don't like paying for things as much as iPhone users do.<p>Yes, Angry Birds makes a lot with ads, but they still made more on iOS. I think they had made something like $10 million on iOS before they made $1 on Android.<p>So, yeah go and do Android dev, but you will easily make 5-10x as many sales with the same app on the iTunes app store. Build and app for both and try it.<p>Also, if your app doesn't suck you can make way more selling the app than giving it away. I tested ads and they don't make nearly as much as paid downloads do. Now, I didn't have a top 100 app, so maybe if you have a big hit ad-supported stuff is good money, but if you have a top 100 app you should be making great money either way.<p>I think the one place where there is a good chance of making money in Android land is to do android specific features that the OS should have had in the first place. Like, better UI/widget stuff, better keyboards, and so on. Things that can only be done on android.",1305661341
2557558,comment,2557140,2557246,2,0,tekseven,,,"That's a matter of opinion though, I would much rather take the phone and iPod Classic because I do not wish to deal with the memory cards, especially since most Android phones require you to remove the battery to switch cards.",1305661308
2557557,comment,2556611,2556611,2,0,tony_landis,,,"Anyone here have plans to attend? I am considering...",1305661307
2557556,story,,,2,0,koblas,"Getting a PDP-10 up and running",http://brainwagon.org/2011/05/17/my-trip-down-memory-lane-leads-me-back-to-tops-10-and-the-pdp-10/,,1305661291
2557555,comment,2556959,2557431,3,0,dxbydt,,,"Valuation is not revenue is not profitability. Say your dicey tech stock has a beta of 2 & the S&P500 is expected to make 5% this year. CAPM says you'll have an expected return on capital assets of 10% given the zero risk-free rates we have now. That 10% figure in turn drives a valuation model where you plugin rosy growth probabilities & factor in the exploding populations in the emerging markets & do the all important scenario-analysis on what if just 0.1% of those folks bought my product. That spits out numbers that'll make your head spin. I've seen $1 iphone apps valued at $100 million simply cause that's how the valuation model is set up. Financial math is simply legalized delusion :)",1305661259
2557554,comment,2556340,2556340,3,0,powertower,,,"> 1.There are three states of being. Not knowing, action and completion.<p>To me it would sound better this way:<p>There are three forms of doing: not doing (procrastinating), doing (specific action), and done (moving on).<p>""Being"" is not a ""doing"". Being is <i>existing in the ""now""</i>, without a past, without a future, with no desires, without action. It is a state that is achieved by only a handful of people.",1305661256
2557553,comment,2557069,2557521,7,0,ksuther,,,"That and editing are now at the top of our list. Getting 1.0 out the door was our #1 priority :)",1305661254
2557552,comment,2556590,2557101,5,0,Duff,,,"Global domination is a funny thing. Did Britain impose its ways on the world and change it forever, or did the world change it?<p>The answer is ""all of the above"". Of course many Brits got rich at the expense of the others.",1305661231
2557551,comment,2556959,2557078,2,0,dh,,,"I think you are very wrong in this case. The list is not looking for the largest companies in any of those categories. Clearly those that are huge companies took funding along the way to grow, but the list is of young founders and you can easily generate a list of young founders with huge success that did not take funding.<p>I think the problem with lists like this is it creates a culture of celebrating the funding part only, not the hard work that comes later and the true success that the investor wants.",1305661224
2557550,comment,2556959,2557477,3,0,kmfrk,,,"Quora's on the list. Go figure. :)",1305661212
2557549,comment,2556959,2557477,6,0,tyler,,,"Greplin has to do huge scale information retrieval. This probably counts as engineering. (See: SIGIR)",1305661201
2557548,comment,2556677,2556677,1,0,akharris,,,"loving what nick and bill are building - and if you want to join a smoked fish expedition to brooklyn, you really should.",1305661193
2557547,comment,2553234,2555402,1,0,ChuckMcM,,,"I thought I was done saying my piece but I looked up the references for some friends and they dovetail nicely into 'nl's comment here ...<p><i>I disagree. I think the second-worse nuclear disaster in history is a huge disaster, especially since it looks like it will leave a large area uninhabitable.</i><p>This isn't born out by the monitoring done by the US Dept of Energy [1] and others. There has been some Cesium-137 detected outside the plant, but its in trace amounts rather than large quantities.<p>If you look at the data collected by the DoE you will see two things, first that they haven't detected any deposits that have occurred after March 19th, and second that their highest reading was 91uSV/hr (9.1mRem) which corresponds to 218 mRem/day. which is high (relative to background radiation) and below what is considered a public health hazard of 1000mRm over 4 days. (slide #10 in the link). Third to get that dosage you would have to lay down in the dirt 24/7.<p>So no area outside the plant will be 'uninhabitable' [2] Some places will no doubt be targeted for local decontamination, the Cesium will decay on its own making each year after the accident less of an issue than the day before. Is it great? No.<p><i>It's not, and not by a long way. For example, there was no damage caused by any aftershocks, which was incredibly lucky.</i><p>Actually that wasn't luck, the plant is designed to handle violent earthquakes, it would be astonishing if there were an aftershock greater than the main shock. Anything signficantly less than an 8.0 was part of the design.[3]<p><i>People are told these reactors are safe in the event of a terrorist missile attack - it's pretty clear they are no where near that safe.</i><p>Think about that statement for a moment. The energy released ina  9.0 earthquake is the equivalent to 475 <i>million</i> tons of TNT, or 23,000 bombs the size of the one that hit Nagasaki. [4] If North Korea dropped a nuclear bomb into the plant it would clearly destroy it, but there isn't a terrorist organization on the planet that has the capability of deploying that much energy to the plant.<p>I understand that nuclear power can be a scary thing to some people. But if you take the time to educate yourself on the risks and the engineering which goes into keeping those risks from turning into accidents. It might be possible to get past the fear factor and see them in a more balanced light of power delivered over time vs their risk factors.<p>[1] <a href=""http://blog.energy.gov/content/situation-japan/"" rel=""nofollow"">http://blog.energy.gov/content/situation-japan/</a><p>[2] I am predicating that on no further release of any material which is unlikely given the state of the reactors.<p>[3] <a href=""http://online.wsj.com/article/SB10001424052748703555404576195700301455480.html"" rel=""nofollow"">http://online.wsj.com/article/SB1000142405274870355540457619...</a><p>[4] ""Question: How much energy was released by this [9.0 quake off Indonesian coast] earthquake?<p>Answer: Es 20X10^17 Joules, or 475,000 kilotons (475 megatons) of TNT, or the equivalent of 23,000 Nagasaki bombs. ""<p><a href=""http://earthquake.usgs.gov/earthquakes/eqinthenews/2004/us2004slav/faq.php"" rel=""nofollow"">http://earthquake.usgs.gov/earthquakes/eqinthenews/2004/us20...</a>",1305661147
2557546,comment,2557155,2557240,1,0,FiddlerClamp,,,"From the Cult of Mac article, ""But when I asked how many people had spent 20 bucks on a game in the Android store, there was a big difference.""<p>Please point out how many $20 games there are in the Android market, or for that matter in the iOS market? Not many, I'll bet.",1305661127
2557545,comment,2557461,2557461,15,0,sofuture,,,"<i>The real answer is just as much about our industrys culture as it is about technology. </i><p>No, it's <i>entirely</i> about our industry's culture. Which is a shame. It's a fantastic framework that should and could supplant the JVM. It never will though, thanks to Microsoft's boneheaded choices and the blog posts like 'Why I don't hire .Net developers'.",1305661119
2557544,comment,2555349,2557494,7,0,tlrobinson,,,"The <i>entire point</i> of NaCl is to run native code securely.<p>I won't get into the details because there's tons of information out there (<a href=""http://www.chromium.org/nativeclient/reference/research-papers"" rel=""nofollow"">http://www.chromium.org/nativeclient/reference/research-pape...</a>), but code must be compiled using a special NaCl compiler, then before it's executed the client runs it through the NaCl verifier to ensure it's safe to execute.<p>Of course it's possible there are bugs in NaCl, but Google won't enable it in Chrome by default until they're very confident it's secure.",1305661118
2557543,story,,,1,0,ardentr,"My AppEngine Python project - Aktualni nabidky prace, a job board",http://www.aktualninabidkyprace.cz/,,1305661094
2557542,comment,2556677,2557255,1,0,Marvin_Kennis,,,"So I guess you share your photo's via email still? Really, theres only a few you know would be interested in seeing those, but you share them with all.",1305661093
2557541,story,,,1,0,srikar,"Which technologies get better faster?",http://web.mit.edu/newsoffice/2011/accelerated-discovery-0517.html,,1305661091
2557540,comment,2556959,2556959,3,0,bugsy,,,"Got halfway through the list and gave up. So no one builds products anymore.",1305661086
2557539,comment,2556590,2557023,4,0,Duff,,,"I agree that China no longer fits the traditional definition of ""Communist"". Then again, Maoism didn't quite fit the mold either. China has a strong societal tradition that is different than the west.<p>While they may not be ideologically communist, China does continue to practice the governance style of communist governments. Think about the Soviet Union's model -- a major part of the Soviet story was purging the old in favor of the new, ""scientific"" way. China is doing a similar thing, but through different means. The ""science"" may have been quakery (witness the Aral Sea), but the central planners saw themselves as guided by logic and science, not petty feelings or popularity.",1305661067
2557538,comment,2555349,2555349,3,0,wicknicks,,,"He even ported his tcc compiler to it. Brilliant! I wonder if we could tap into the device file system. Given the increasing number of sensors in mobile phones and no standard way of reading from them, a linux like interface would be awesome.<p><pre><code>  int main (int argc, char **argv)
  {
       int f = open(""/dev/android_accelerometer"");   
       double ax = f.read();
       double ay = f.read();
       double az = f.read();
       printf (""Current 3d acceleration: %d %d %d"", ax, ay, az);
       return 0;
  }</code></pre>",1305661050
2557537,comment,2557463,2557463,1,0,apple_fan,,,"Any comments/suggestions/questions are most welcome.",1305661038
2557536,comment,2557526,2557526,54,0,kylelibra,,,"At first glance I thought the title inferred that Tumblr hadn't increased in traffic in two years, which was very confusing.  A better title would be something along the lines of ""Tumblr now does as much traffic in one day as it used to do in one month.""",1305661036
2557535,story,,,1,0,bproper,"In NYC, Pulic Space is Online",http://dashes.com/anil/2011/05/in-nyc-the-web-is-a-public-space.html,,1305661007
2557534,comment,2557064,2557338,1,0,pavel_lishin,,,"I haven't worked with many other languages, but in my experience, most PHP projects are a tangled mess that are hard enough to figure out when you're an expert, much less a novice. I would recommend a language with a better user-base, and one less susceptible to newbies building big projects. I'd wager that given any 100 PHP projects vs any 100 Rails projects, the rails projects would be easier to read and understand.",1305661003
2557533,story,,,8,33,jme27,"Ask HN: Help Name Our Company - Get $1,000",,"Hey HN,<p>We're a start up in the social gaming space founded about 3 years ago. We're growing quickly and looking to rebrand with a great consumer facing company name. We need your help!<p>The Reward: $1,000 via Paypal to the person who suggests the name we end up using.<p>We're looking for a name that's short, catchy, and memorable. It doesn't need to be related to social gaming, though it can be. Our only requirements are that the .com be available (or seemingly available) for $10K or less and that there are no outstanding trademarks on the name that we'd have to worry about.<p>We'll choose the best name by Friday, May 20th and post the winner.<p>Show us your awesome creativity HN! Looking forward to your suggestions!<p>Please send your submissions to nameourcompany at gmail.com",1305660980
2557532,comment,2556959,2557078,5,0,davidw,,,"> Construct a list of the most successful technology startups however you like<p>At this stage in my life, I'm not so interested in <i>most</i>, but in <i>average</i>, meaning: sure all of the really huge companies took funding, but are people who took funding, on average, more successful?  In other words, I'm more interested to a surer path to a million dollars than an outside shot at 100 million.<p>I don't know the answer, but it's an interesting question.",1305660906
2557531,comment,2555349,2557448,2,0,sehugg,,,"The applet model had/has major issues:<p>* Takes way too long to load the JVM. Deal-breaker for many sites.<p>* Horrible (AWT) and complicated (Swing) UI toolkits that ignored any look-and-feel parity with the rest of the web site or even the web browser itself.<p>* The environment is controlled by Oracle. I don't think they're looking to compete with JS, Flash and Silverlight. Thus web applets (except for niche internal apps) are dead, RIP.",1305660873
2557530,comment,2556611,2556849,8,0,patio11,,,"Understanding this attitude towards both blog posts and previously published content is very, very, very important for people publishing on the Internet, which should be substantially every business on HN.  It came up in discussions with two clients and two prospects just in the last month alone: whatever you make, don't call it a blog post, or it will a) autocommoditize the perceived quality of the piece and b) cause it to start losing value <i>immediately</i> upon publication, which is the exact opposite of what you want.",1305660852
2557529,comment,2556590,2557329,8,0,nonce011,,,"> Do you have cited studies to back this up?<p>At first I thought this was satire. You'll excuse me if I take this in a more interesting direction.<p>Cited studies are not the first and last word on anything, especially when the question is ""are scientists better than everyone else?""<p>Cited studies promote all kinds of false or questionable beliefs, particularly on political issues. As far as finding a study that answers the specific question ""are diverse businesses better run?"", I promise you won't have to look very far or very hard.<p>A common sense, thoughtful argument, backed up by information, trumps studies every time. And, surprisingly, an error-prone poll of a population of average intelligence trumps an intellectual's well-thought-out argument---this is why we have polling stations instead of a politburo.",1305660848
2557528,comment,2556616,2557516,2,0,cuppster,,,"Yes it does, but I'm having so much fun deploying these things, I've created more than one... =)",1305660823
2557527,comment,2555349,2557132,2,0,neurolysis,,,"I mailed him about it earlier, he says he hasn't decided on a license yet.",1305660785
2557526,story,,,19,5,sammville,"July 09, Tumblr Did 250 Million PgV. May 16, 2011: Tumblr Did 250 Million PgV",http://techcrunch.com/2011/05/17/tumblr-pageviews-a-day/,,1305660763
2557525,story,,,1,0,ichilton,"The Best Ruby Books",http://programmingzen.com/ruby-and-rails-recommended-books/,,1305660756
2557524,comment,2556534,2557209,3,0,romey,,,"perhaps, but being paid _something_ if significantly better than getting nothing at all -- let us not forget that in their heyday, CD prices went up to $15-$18 apiece, and people paid because there was simply no other option.I seriously doubt that the record industry wants to made obsolete to everyone but the few vinyl enthusiasts that are still out there.",1305660752
2557523,story,,,1,0,ichilton,"The Best Ruby on Rails Books",http://programmingzen.com/rails-books/,,1305660735
2557522,story,,,3,2,DonnyV,"Alan Cooper, Father of Visual Basic.""windows api was a technical embarrassment""",http://channel9.msdn.com/Series/VisualStudioDocumentary/The-Visual-Studio-Documentary-Alan-Cooper-the-Father-of-Visual-Basic,,1305660711
2557521,comment,2557069,2557069,2,0,rwaliany,,,"FYI, if the developer is reading this, please let me delete events from the widget.",1305660698
2557520,story,,,4,1,yakto,"90 of top 200 sites have no mobile version. Opportunity?",http://blog.programmableweb.com/2011/05/17/90-of-top-200-sites-have-no-mobile-version-says-new-api,,1305660691
2557519,story,,,20,0,mrduncan,"The Curve of Talent",http://epaley.posterous.com/the-curve-of-talent,,1305660668
2557518,comment,2556534,2557469,2,0,Xurinos,,,"And having our more specific needs met.  As a consumer, I have never bought into this idea that I need packaged channels.  I am happily moving along into the on-demand culture, a culture that is also crossed with intelligent recommendation systems tailored to me as opposed to the general viewing public in an area.",1305660666
2557517,comment,2555349,2557494,4,0,nupark2,,,"<a href=""http://www.chromium.org/nativeclient/reference/research-papers"" rel=""nofollow"">http://www.chromium.org/nativeclient/reference/research-pape...</a><p>It's possible that the design could be flawed, but the same is true for browser implementations and mobile application sandboxing.",1305660627
2557516,comment,2556616,2556616,2,0,doorty,,,"And the kicker: The AMI you suggest qualifies as free for a year with a new AWS account. Free hosting for a year to play around with Node. Thanks a lot!",1305660600
2557514,story,,,2,0,jpr,"Beware of online filter bubbles",http://wimp.com/filterbubbles/,,1305660579
2557513,comment,2556856,2557115,3,0,IbJacked,,,"However, the energy costs are upfront and non-recurring.  The number of bit coins produced every 4 years is halved, capping out at about 21,000,000.",1305660533
2557512,comment,2556959,2557078,14,0,replicatorblog,,,"You are right that any truly transformative tech company has raised outside money. However, it seems like there is a shadow tech scene comprised of substantial companies that have self funded. e.g.<p>CSN Stores - $300MM+ annual revenue/ bootstrapped<p>MailChimp - Approaching $100MM/ bootstrapped<p>Club Penguin - $350MM acquisition, heard they had a little angel money, but no VC<p>Ganz/Webkinz - Kind of a startup within a small manufacturing biz, but they have mid 9 figures in revenue.<p>SparkFun/iFixit - Both $20+MM in revenue with no outside investment.<p>Provocraft has $100MM+ in virtual good sales<p>Granted, most of these aren't household names in the tech world, but all thrive based on web tech. I'm sure there are others beyond the ones I know, but there seems to be a playbook that can get a company to $100MM+ without VC.<p>In closing, I agree with your thesis, and Sequoia's old  homepage would back you up 100%, but do you think companies like the ones above are just outliers or are not successful enough?",1305660523
2557511,story,,,1,0,unuzero,"The secret power of bookmarklets",http://www.webdesignerdepot.com/2011/05/the-secret-power-of-bookmarklets/,"Bookmarklets are special links that users can add to their browsers favorites.These special links include code (i.e. not just a target URL), and they trigger various kinds of useful functionality, allowing you to modify and extend any web page.Once you begin using and building your own, you will no longer see web pages as static elements that you have no control over.",1305660515
2557510,comment,2555349,2557260,2,0,rbranson,,,"You're always going to feel hobbled by a standards-based, compatibility-driven platform like the web where you must maintain compatibility with fairly ancient software. This is just the way things are. If it wasn't the web, it'd be whatever layer was used to allow your applications to run across multiple devices.",1305660476
