ID,Type,Story,Parent,Points,Comments,Author,Title,URL,Content,Created
2557630,comment,2555349,2555349,1,0,tectonic,,,"Why is it that whenever I play with a temporary Linux install, I always end up typing ""rm -rf /""?",1305662391
2557629,comment,2557461,2557608,2,0,fleitz,,,"You rock! You've tempted me to start using F# / ASP.NET MVC again.",1305662382
2557628,comment,2557520,2557520,2,0,pedalpete,,,"I don't know that this actually makes any sense.<p>Are we still doing os checks and serving different pages based on the client (I'm not).<p>With modern browsers on smartphones, I think this is mostly not-necessary for the average top 200 site which likely still targest the lowest common-denominator browsers. Mobile browsers are over-powered and very capable to display these sites.<p>It's the smaller early adopter sites that are pushing the envelope and may need to do some sniffing.",1305662369
2557627,comment,2553234,2555166,2,0,ChuckMcM,,,"<i>It will be a closed zone for decades.</i><p>I believe you have misinterpreted the data. The <i>highest</i> measured readings were 91 uSv/hr. That is equivalent to 9.1 mRem/hr (1 mRem = 10 uSv). The lowest dose in the 'red' zone is 19 uSv/hr or 1.9mRem. Public safety is considered to be 'at risk' if you are exposed to > 1000 mRem over 4 days. You can't reach that level in places where they read 91 uSV/hr (best you can do is 9.1<i>24</i>4 or 873.6 mRem/4 days. And where its only 1.9mRem you only get 182 mRem/4 days.<p>The bottom line is that it is <i>safe</i> to go anywhere in the current 80km radius circle, if you are the government and want to minimize radiological hazard you will go through the area that shows the highest activity and identify and clean up any hot spots.<p>That information btw is in the DoE's contribution to this report.<p>The second part you missed is that Cs-134 will be down to noise in less than a decade due to decay which will reduce overall dosage. (I've noticed that no one has published the ratio)<p>So is there contamination from the plant in Japan? Yes.<p>Does is pose a public health risk? For the most part no.<p>Will any part of the area be 'off limits' this time next year? Probably not.<p>Will monitoring continue and specific areas be targeted for decontamination? Almost certainly.",1305662366
2557626,comment,2556270,2557393,4,0,blinks,,,"> You check the ones that you expect.<p>You expect buffer overflows?  Out-of-bounds arguments?  These are the things the GP is referring to, I figure.",1305662360
2557625,comment,2556550,2557611,3,0,SeoxyS,,,"Choosing what criticism to ignore, too, is also a huge skill. Every time someone suggests something, I will take it into consideration. I figure out why they said what they did, and try to get to the core reason. Then I can make an assessment as to whether to implement their suggestion, or whether another solution addresses the core problem.",1305662349
2557623,comment,2555752,2555752,1,0,kongqiu,,,"Our 7 year old likes reading Roald Dahl, Dr. Doolittle, The Great Brain, and Encyclopedia Brown (for fiction), and Macaulay books (The Way Things Work, Built to Last), Usborne History books (The World Wars, The Ancient Greeks), and The Magic School Bus/Ms. Frizzle's Adventures (nonfiction).",1305662327
2557622,comment,2557461,2557615,3,0,jbhelms,,,"Free 1,500 hours of the Small Instance",1305662310
2557621,comment,2556625,2556625,1,0,JacobAldridge,,,"For what it's worth, I was recently involved as a judge [1] for a competition the <i>Telegraph</i> ran searching for ""Britain's Fittest Director"" [2]<p>At no point did I or any of my team get any indication of pressure, preference or favour from the Telegraph. I was a few steps removed from them, but the impression I got was that they had involved a group of expert judges and were planning to back their judgement, and that that's what they did.<p>Perhaps this competition wasn't as high profile, or the finalists [3] not as controversial. I obviously can't speak about the Startup100 awards or the <i>Telegraph</i> in general, only share that my experience was different.<p>[1] My judging was limited to one of the intermediate rounds. They used a pool of similarly trained business experts from Shirlaws to meet with and assess the business fitness of the top contenders. I ran several interviews, and gave my score and some general feedback to the judging coordinator.<p>[2] <a href=""http://www.telegraph.co.uk/finance/yourbusiness/8308565/Competition-Britains-Fittest-Director.html"" rel=""nofollow"">http://www.telegraph.co.uk/finance/yourbusiness/8308565/Comp...</a><p>[3] <a href=""http://www.telegraph.co.uk/finance/yourbusiness/8459412/Britains-Fittest-Director-2011-the-finalists.html"" rel=""nofollow"">http://www.telegraph.co.uk/finance/yourbusiness/8459412/Brit...</a>",1305662299
2557620,comment,2556616,2556616,2,0,vailripper,,,"Great guide, thanks.<p>One issue I've run into trying to push from my windows 7 machine to my instance is a ""Permission denied(publickey)"" error, which I assume is due to a missing SSH key in git for my ec2 instance? Does anyone know how to tell the ec2 alias to use my instance private key when connecting?",1305662286
2557619,comment,2555349,2557448,9,0,neopanz,,,"Agreed. And for those who pull the Java applet as the perfect counter-example, they need to ask themselves: does it take this long to start an Android app?
Of course not! Because you can use the JVM in many different ways to eliminate the load time.
In a way, one could imagine Android has a better example of how to mix OS/Web/Multi-Architecture(CPU)",1305662246
2557618,comment,2557461,2557545,9,0,mpakes,,,"> It's a fantastic framework that should and could supplant the JVM.<p>What makes you feel that .NET is so superior to the JVM? The JVM itself seems like a solid, performant VM platform, and there is a broad selection of languages in Scala, Groovy, Clojure, JRuby, Jython and friends.<p>Disclaimer: I'm platform agnostic and don't currently develop on the JVM or the .NET CLR, so I have no horse in this race. I'm genuinely curious.",1305662240
2557617,story,,,1,0,Remxawy,"  18-5-2011",http://www.almstba.com/vb/showthread.php?t=20355,"  18-5-2011
  18-5-2011
  18-5-2011
  18-5-2011
  18-5-2011
http://www.almstba.com/vb/showthread.php?t=20355
http://www.almstba.com/vb/showthread.php?t=20355",1305662237
2557616,comment,2557461,2557600,7,0,bmj,,,"I agree, and the shop where I'm employed is the same--we do lots of .NET development, but other products are built on other technologies.<p>As far as bad devs go, don't they exist for most platforms?  I mean, is every Ruby programmer a genius?",1305662237
2557615,comment,2557461,2557600,3,0,fleitz,,,"Does bizspark include a discount for Azure?",1305662233
2557614,comment,2556590,2556590,2,0,Apocryphon,,,"And for some reason, many high-profile, that is, thwarted or captured, terrorists are engineers:
<a href=""http://www.nytimes.com/2010/09/12/magazine/12FOB-IdeaLab-t.html?scp=1&amp;sq=Berreby&amp;st=cse"" rel=""nofollow"">http://www.nytimes.com/2010/09/12/magazine/12FOB-IdeaLab-t.h...</a>",1305662185
2557613,comment,2557461,2557587,1,0,MartinCron,,,"It's not accurate, for what it's worth.<p>I'm working on a startup with .NET, and while I do use some parts of the MS Ecosystem (Visual Studio, C#, ASP.NET MVC, SQL Server, IIS) I use plenty of tools that aren't from Microsoft (NUnit, JQuery, Github, ReSharper, TeamCity, DotTrace, DotCover, Selenium).<p>Any good technologist mixes and matches the things that work best for their solution, right?",1305662180
2557612,comment,2557155,2557565,2,0,bockris,,,"I don't know if it will ultimately be a huge success story but I think 'Cordy' <a href=""http://www.cordythegame.com/"" rel=""nofollow"">http://www.cordythegame.com/</a> is fantastic and is Android only.  We bought the full version within a few minutes of playing the trial version.",1305662163
2557611,comment,2556550,2556550,4,0,SeoxyS,,,"As a student at San Francisco's top design school, critiques has become a huge part of school. Every day involves at least one class critique, and it's not uncommon for student to solicit extra critiques from their peers and teachers. A big part of our grade is based on how we do during formal critiques, how we integrate feedback, and the quality of the feedback we give others.<p>After two years of this, I have become much more resilient when it comes to getting feedback. You can tell me anything, I won't take it personally. However, the feedback I give has become harsher, and outside of the school context (especially at workI'm a developer at a startup) I sometimes fear I may be putting people off by being so honest. I do my best to be as constructive as possible, though.",1305662156
2557610,comment,2557461,2557572,2,0,chrisaycock,,,"Agreed. <i>Distribution</i> is the primary concern of most software vendors (big or small), so mobile developers are going to target Android, iPhone, and in some cases BlackBerry. Microsoft's mobile market share today resembles Apple's desktop market share back in the 1990s.",1305662150
2557609,comment,2556590,2556883,11,0,Hawramani,,,"Mentioning a comment he made somewhere else to discredit him is clearly an ad hominem, even if your attack on Chomsky wasn't.<p>Chomsky is wrong on a lot of things. That in no way makes him wrong about everything.",1305662130
2557608,comment,2557461,2557594,7,0,xpaulbettsx,,,">  (e.g. ASP.NET has HAML but not sass)<p>I fixed that this past weekend :)<p><a href=""http://blog.paulbetts.org/index.php/2011/05/16/announcing-sassandcoffee-0-5/"" rel=""nofollow"">http://blog.paulbetts.org/index.php/2011/05/16/announcing-sa...</a>",1305662102
2557607,story,,,1,0,mjgoins,"Calculator implemented in DNS resolver",http://bert.secret-wg.org/Tools/index.html,,1305662045
2557606,comment,2557155,2557473,3,0,jdq,,,"I realize you are talking about Android phone apps, but maybe what Android tablet apps need is a few devs bragging about the money they are making to attract more tablet app developers.  Having less than 100 apps (last figure I heard) doesn't help to sell more tablets.",1305662037
2557605,comment,2557155,2557155,4,0,vladikoff,,,"Just got an Android tablet at Google I/O, starting with development ASAP. Developing for Android 3.0 is impossible without hardware, the emulator is really really slow.<p>There will be more tablet apps when there's more hardware choice and availability.",1305662034
2557604,comment,2555349,2556260,11,0,dkersten,,,"I've always wished that, instead of a ""browser language"", browsers exposed a LOW LEVEL bytecode environment (which browsers are then free to interpret, JIT compile or on-the-fly AOT compile at page load time). It should be reasonably low level, in that it should provide an abstraction from the hardware, but still allow for very efficient execution of lower level code. Then high level languages and frameworks could be layered on top. This way, browser languages would be 1) more efficient if they need to be and 2) more diverse.<p>Its a pity that javascript is so in-grained in client-side web now, as its really a terrible bytecode... Hell, failing the above, I would have liked to see Lua as the default client-side language, rather than Javascript (for reasons I will mention shortly), but of course that will never happen now that Javascript has been the default for fifteen years.<p>The reasons I would like Lua as the default language, besides the fact that LuaJIT is very fast (certainly for number crunching code, especially if you use the FFI to operate on low level structs (I mean, without calling into C) - the FFI is also one of, if not the, simplest FFI I've seen in any language[1]), it is, at least under my impression, a much more consistent language, while being just as flexible, easy to learn and dynamic. The thing I dislike most about Javascript is that it has lots of little gotchas and inconsistencies. Having said that, though, perhaps Lua does too and I just haven't used it enough yet to get bitten by them. Then again, it didn't take long for this to happen in Javascript, so Lua does at least seem to be a little friendlier.<p>[1] Actually, I think Factor's FFI is similarly simple, if my memory serves me correctly",1305661998
2557603,comment,2555349,2557492,5,0,guygurari,,,"Yes, seriously. In what sense are JVMs ""specialized for long-running applications""? If you mean they start slowly, that's hardly the case even if you start from scratch:<p><pre><code>   > time java HelloWorld
   Hello, World!
   java HelloWorld  0.28s user 0.06s system 135% cpu 0.248 total
</code></pre>
In any case, the JVM is just an example (although I still argue it can serve this purpose well). My main point is that the ""correct"" model for the web is a bytecode-running VM inside every browser that lets you do everything javascript does through APIs.",1305661944
2557602,story,,,1,0,bradleyjoyce,"Two UTDallas Grads Seek to Cut Emergency Treatment Time",http://launchdfw.com/startup-profiles/two-utdallas-grads-seek-to-cut-emergency-treatment-time/,,1305661911
2557600,comment,2557461,2557461,34,0,vyrotek,,,"Our startup is based on .Net and hosted on Azure. I don't think I realized just how uncommon this was until we were invited to Microsoft in Redmond and saw the excitement from the developers when they learned that we were a startup.<p>We love the framework. But its definitely not the only stack we use. I also agree that there are <i>bad</i> .Net developers that spoil it for the rest of us. In my opinion, most of the issues seem to be associated with ASP.Net and claiming to be a web developer without understanding how the web actually works. Many of them are so into just using the tools that they never bother to learn Javascript and instead insist on doing Postbacks for everything.<p>I feel that we're starting to see a new side of Microsoft when it comes to the web and startups.<p>Things like ASP.Net MVC, Azure and BizSpark give me hope.",1305661886
2557599,comment,2557461,2557461,-4,0,maxer,,,"plentyoffish.com the worlds largest dating site is based on M$ tech",1305661879
2557598,comment,2557261,2557583,1,0,stcredzero,,,"<i>Submission title: ""Hack us, and we'll bomb you""</i><p>There wasn't an intention to add editorial spin the headline, but it seems my sloppy transcription betrays my feelings on reading it.",1305661863
2557597,comment,2556335,2556585,3,0,Umalu,,,"A lot of cash rich multi-national companies have this foreign cash ""problem."" They earn it overseas and can't bring it back without paying U.S. tax on it, so they leave it there. On page 31 of Google's 10-Q it says that $17 billion of its $37 billion cash hoard at March 31, 2011 was held outside the U.S. and was unlikely to be repatriated to the U.S. for tax reasons. Of course that still leaves them with $20 billion in the U.S., plus whatever they've earned in the U.S. since March 31, 2011, but I guess borrowing an extra $3 billion at ultra-low US Treasury-like rates is an historically cheap way to top up the tank.",1305661855
2557596,story,,,2,0,jgv,"International Strategy for Cyberspace",http://www.whitehouse.gov/sites/default/files/rss_viewer/international_strategy_for_cyberspace.pdf,,1305661852
2557595,comment,2557461,2557562,8,0,timclark,,,"Mono lets you run some .NET code on Linux/Mac OS X. Some of my favourite pieces of Microsoft technology are missing or too broken to use - for example WPF is an excellent tool for building desktop applications but it doesn't work on Mono, F# sort of works until you try doing recursion with abstract data types.",1305661845
2557594,comment,2557461,2557461,6,0,fleitz,,,"I'm using rails for my company but ruby is definitely not my preferred language. Blocks/Procs/Lambdas (why are there three almost identical constructs?) definitely don't compare to function application / currying. I'd much rather write in F# but I'm worried about all the nice to haves that come with the rails stack, like capistrano or the plugins to serve/upload your assets to S3. (e.g. ASP.NET has HAML but not sass)<p>I definitely foresee at some point switching to ASP.NET in a similar manner as twitter is moving over to the JVM / Scala, but rails still has a lot of legs in it for us.",1305661834
2557593,comment,2556625,2557032,1,0,JacobAldridge,,,"My beautiful wife and I were walking past Regents Park (in central London) just before Christmas last year, admiring the houses and wondering aloud what an obscene amount of money it would cost to live or base your office out of any of them. Wonga had two.<p>It was the first we'd heard of them (having been in London only a month or so), but they got a lot of publicity on the Tube in the lead up to New Year's Eve (where they sponsored free public transport for the evening). But even discussions of that promotion were all tinged with 'how could Transport for London / the Mayor's office associate themselves with a company like this?'.<p><i>""Is there any positivity in that brand?""</i><p>None that I've seen. And when they're charging interest rates like they do to afford offices like they do, I doubt any will be forthcoming in the near future.",1305661824
2557592,comment,2557261,2557508,9,0,ceejayoz,,,"In fairness, taking out the internet may represent far greater damage than sinking a warship. A nationwide disruption could cause billions in economic damage, and more targeted attacks on specific infrastructure like dams, water treatment, etc. have the potential to kill as well.<p>Hell, shutting off Google for a few days would probably kill more than 46 people if medical residents aren't able to look stuff up as quickly as they can now.",1305661821
2557591,comment,2556590,2557101,7,0,varjag,,,"> 10% growth every year for a quarter of a century? I regard that as very impressive.<p>They are catching up to status quo. Mostly because they squandered the previous decades scientifically hunting down sparrows and enemies of the state.",1305661763
2557590,comment,2557155,2557565,4,0,kenjackson,,,"iOS had a pretty big headstart.  Read Scoble's recent post on some hot Android apps [1].  They're just now beginning to do high quality apps first on Android.  Momentum has started to shift.  It won't happen instantly, but it does appear to be happening.<p>[1]<a href=""http://scobleizer.com/2011/05/09/what-i-learned-by-interviewing-23-startups-in-past-few-weeks/"" rel=""nofollow"">http://scobleizer.com/2011/05/09/what-i-learned-by-interview...</a><p>The money quote:<p>""But the most interesting set of companies is being built around smartphones and here, for the first time, Apples iOS doesnt have the coolest apps. For instance, Innobell lets you add social apps to a phone call. Only on Android today. TekTrak gives you really great security. But mostly on Android today. And WalkBase lets you track your phones movement through wifi and assisted GPS patterns in the room. Again, only on Android because Apple and Microsoft dont let WalkBase talk to the radios the way Android does.""",1305661755
2557589,comment,2557261,2557508,1,0,stcredzero,,,"<i>And now you're telling me we'll go to war if someone takes out the internet?</i><p>Interesting.  I never thought about someone ""taking out"" the internet.  An internet kill switch would be useful to a government wanting to start a war.  Simply kill the internet, then blame it on the country of your choice.",1305661748
2557588,comment,2552811,2556593,1,0,edw,,,"At least since Jobs has been back. There was some fairly ill-conceived if not exactly malevolently-designed stuff coming out of Cupertino during the interregnum.<p>A recent linked piece nailed Apple's strengths and weaknesses: If Steve uses it, it generally rocks. If it doesn't, it could very well blow e.g. Ping.",1305661739
2557587,comment,2557461,2557461,46,0,bcrescimanno,,,"There is a strong perception (whether accurate or not--and I honestly don't know the answer) that it's the same old story with Microsoft: if you go the .NET route, you've gotta buy into the entire Microsoft ecosystem.  It's not just .NET that you're choosing; you're also choosing Windows servers, IIS, Visual Studio, etc.<p>If that perception is accurate, it's entirely reasonable to say, ""Despite liking a lot of what .NET has to offer, we don't want to buy into one specific company's ecosystem that deeply.""<p>If that perception is inaccurate, then there should be some serious marketing around changing that perception (and not just from MS--but more like this type of grass-roots post).",1305661722
2557586,comment,2556534,2556534,2,0,Apocryphon,,,"List of products/services that show that crusading anti-piracy media publishing companies are full of it: Netflix, Steam, Hulu, O'Reilly Media, that one anime streaming service that was covered previously by Ars Technica... who else?",1305661707
2557585,comment,2557169,2557416,1,0,boucher,,,"Absolutely. Any page in the process served without SSL introduces a vulnerability. None of that is explicitly within the scope of PCI.",1305661705
2557584,story,,,2,0,yodakohl,"The very best algorithm",http://wwww.drunkcoders.wordpress.com/2011/05/17/the-very-best-algorithm/,,1305661703
2557583,comment,2557261,2557261,29,0,GHFigs,,,"Excerpt from actual US policy:
""When warranted, the United States will respond to hostile acts in cyberspace as we would to any other threat to our country.  All states possess an inherent right to self-defense, and we recognize that certain hostile acts conducted through cyberspace could compel actions under the commitments we have with our military treaty partners.  We reserve the right to use all necessary meansdiplomatic, informational, military, and economicas appropriate and consistent with applicable international law, in order to  defend our Nation, our allies, our partners, and our interests.  In so doing, we will exhaust all options before military force whenever we can; will carefully weigh the costs and risks of action against the costs of inaction; and will act in a way that reflects our values and strengthens our legitimacy, seeking broad international support whenever possible."" (pp.18)<p>Ars Headline:
""US warns: hack us, and we might bomb you""<p>Submission title:
""Hack us, and we'll bomb you""",1305661687
2557582,comment,2556844,2556844,2,0,petervandijck,,,"""Handmade"" and you're using stock icons on your own landing page?<p>Apart from that, I think it's a great idea.<p>1. Focus even more. ONLY do landing pages.<p>2. Make sure there are at least 4 examples we can see.<p>3. Set a fixed price.",1305661671
2557581,comment,2557155,2557565,4,0,mcantelon,,,"Android activation rate trends indicates that this will likely  reverse.",1305661640
2557580,comment,2557183,2557183,1,0,ayb,,,"I asked about this on Quora a while back and the general consensus was that such an acquisition was a bad idea.  (Though I think it could be a great opportunity for Amazon to expand into brick and mortar shops at a discounted price.)<p><a href=""http://www.quora.com/Would-it-make-sense-for-Amazon-to-buy-Borders-Books"" rel=""nofollow"">http://www.quora.com/Would-it-make-sense-for-Amazon-to-buy-B...</a>",1305661639
2557579,comment,2556198,2556663,-1,0,trebor,,,"No one person can invent robotic creativity, therefore a team is necessary. If we presume that the team is comprised of members renowned the world over for their robotics and programming work, and are leaders in their field it doesn't guarantee success (even with technology 200 years from now).<p>We cannot even agree what creativity is and where/how it comes from the human brain. Without a full understanding of creativity, which I'm sure a few bus-loads of philosophers and psychologists could never agree upon, that is communicated without flaws to an expert robotics team... I hope you see the ridiculousness of this idea.<p>For all our understanding and consensus on the matter, creativity might as well be magic. And, as much as I've programmed and studied theory... I still don't know how to implement magic.<p>Unless, of course, Ruby or Python already have ""creativity"" metaprogramming?<p><pre><code>    class Robot
      include Creativity

      creative :language, :syllables => 2, :syllabary => %w{ ja ya ri je pi ze ku zo re }
    end</code></pre>",1305661615
2557578,comment,2556590,2556590,5,0,varjag,,,"They are not scientists, they are administrators with science and engineering degrees.",1305661613
2557577,comment,2557261,2557508,0,0,Hawramani,,,"It seems like the US is just adding this to its list of excuses for attacking other countries when it sees a benefit in doing so. They can no longer effectively use the WMD bogeyman, so a new one is needed.",1305661603
2557576,comment,2556590,2556590,5,0,adamc,,,"Having trained as a hydraulic engineer doesn't make Hu Jintao a scientist, it makes him an engineer. There's a difference.",1305661594
2557575,comment,2557069,2557069,2,0,smackfu,,,"Practically speaking, I almost always enter calendar entries on my phone nowadays.  Still, the way it parses the entry in real-time and shows the result is very smart.  I expect Google Calendar to copy it immediately since they already have the natural language parsing, but it can be a bit of a shot in the dark whether it gives the right results.",1305661559
2557574,comment,2556477,2556477,1,0,timclark,,,"Or maybe give the world a break and don't fly!",1305661538
2557573,comment,2556590,2556590,0,0,adamc,,,Having,1305661530
