ID,Type,Story,Parent,Points,Comments,Author,Title,URL,Content,Created
2557445,comment,2557350,2557350,1,0,convmedia,,,"Awesome post. Working on our efforts right now. Thanks!",1305659167
2557444,comment,2557058,2557058,5,0,drndown2007,,,"Nothing against Optimizely (I'll go see what it is after I post), but man I'm getting tired of the cutsey -ly names.  This is one fad I wish would fade away.",1305659128
2557443,comment,2556904,2556904,4,0,petervandijck,,,"Are you willing to pay them decent rates? (ie. 30+$/hr)",1305659122
2557442,story,,,9,1,jdp23,"Why Privacy Matters Even if You Have 'Nothing to Hide'",http://chronicle.com/article/Why-Privacy-Matters-Even-if/127461/,,1305659111
2557441,comment,2556335,2556335,3,0,marcamillion,,,"I would think that this makes sense from a tax perspective. The Interest on debt, according to US tax law, is write-off-able. So when you combine a tax incentive with the fact that the rates are going to be very low, and that they already have a large warchest - this isn't just free money, the gov't is essentially paying them to take this money.<p>This deal is too sweet for any manager - who's fiduciary responsibility is to increase shareholder value - to take advantage of.<p>Reminds me of the Yuri Milner $150K convertible note to YC companies. It's almost that good.<p>Edit: Modigliani and Miller actually devised a 'capital structure' theory that talks about the most efficient mix of debt & equity for a company - given that there are tax incentives for one or the other. So I would imagine that theory had some impact with their decision - <a href=""http://en.wikipedia.org/wiki/Capital_structure"" rel=""nofollow"">http://en.wikipedia.org/wiki/Capital_structure</a>",1305659105
2557440,comment,2555349,2557260,2,0,adrianN,,,"It might just be me, but it seems profoundly silly to implement what basically amounts to a complete operating system in a browser. Why not use something reasonable like the Java or .Net VM to implement your cross platform applications? I think browsers should stay programs to browse webpages and therefore keep their focus on scripting that enables fancier HTML and CSS manipulation. While running Linux in a browser is an impressive feat, to me it is similar in spirit to simulating a Turing machine in the Game of Life.",1305659026
2557439,comment,2557261,2557267,3,0,Hrundi,,,"Depending on country X's relation with the US, they could actively try to prove the attack came from somewhere else.<p>Yes, you can live in country 'A' and route all traffic through a country you hate, 'X', making that country get all the heat.
Country 'X' would then attempt to prove that the attackers came from another country.<p>This is a lost battle... while a country points the blame to other country, that country would forward the blame to yet another country.<p>There is an insane amount of vulnerability scanning/port scanning coming from China. You can bet that one of those remote attackers is bound to hit an improperly protected box in the US.
It may not even be an attacker, it could be a home PC from a botnet, mindlessly port-scanning IP ranges.
Does that mean the US would bomb China?<p>I mean, an attack can come from a single source but be routed behind so many countries, even from the US itself!",1305659021
2557438,story,,,1,0,JoshPic,"The Roundup - Lodsys and phonebooks",http://fifteenandahalf.com/2011/05/17/the-roundup-lodsys-and-phonebooks/,,1305659021
2557437,story,,,2,0,spjwebster,"URL Fragments and Redirects",http://blogs.msdn.com/b/ieinternals/archive/2011/05/17/url-fragments-and-redirects-anchor-hash-missing.aspx,,1305659020
2557436,comment,2556718,2556859,4,0,CodeMage,,,"Brings to mind Paul Graham's ""Why Nerds are Unpopular"":<p><i>And as for the schools, they were just holding pens within this fake world. Officially the purpose of schools is to teach kids. In fact their primary purpose is to keep kids locked up in one place for a big chunk of the day so adults can get things done. And I have no problem with this: in a specialized industrial society, it would be a disaster to have kids running around loose.</i><p>Where I agree with Richard Elmore (the author of the article) and disagree with Paul Graham is that the only alternative to having kids in the school is having them ""running around loose"".",1305659007
2557435,comment,2555867,2556213,4,0,BasDirks,,,"Self-confidence is beautiful.
Modest genius is beautiful.<p>why choose?",1305659004
2557434,comment,2556895,2557388,4,0,jerf,,,"It is important to remember exchange rates are not static. The exchange rate is determined by the supply and demand of the two currencies for exchange. If you suddenly liquidate a lot of BitCoins all at once, you will raise the supply on the BitCoin side and thus drop the BitCoin-to-dollar exchange rate. It is not valid to take the exchange rate, multiply by the number of extant BitCoins, and declare that to be the size of the BitCoin economy in dollars; that will <i>grossly</i> overestimate it.<p>(This has nothing to do with BitCoin <i>qua</i> BitCoin, it's the nature of currency exchange. Because most currencies that people deal with have such enormous economic bases, people tend to reason about them such that they neglect certain terms that they don't have to worry about in practice because of sheer size. If I exchange $100 to Euros, I won't personally budge the exchange rate noticeably. But in a much smaller economy, you can't neglect such things.)",1305659004
2557433,comment,2554506,2555579,1,0,trafficlight,,,"My domains are at Moniker.  SSL Certs at namecheap.com.  I use a couple of VPSes at Prgmr and WebbyNode for hosting.  And most of my mail is with Google.",1305659003
2557432,comment,2556677,2557202,6,0,bricestacey,,,"Did you try not requiring sign ups to respond? Invitees should be able to click yes or no and automatically create an account for them.",1305659002
2557431,comment,2556959,2556959,4,0,run4yourlives,,,"As an ""outsider"", the only thing I really take from this - besides seeing the prominence of YC startups - is that there certainly is a shit ton of money chasing unproven ideas.<p>I mean, all of these products seem on the surface to be viable entities. I suppose that alone is better than what was happening ten years ago. However the issue I have is that the degree they need to succeed <i>just to be a positive return</i> is sometimes bordering on the outlandish.<p>Groupon - a BILLION dollars? Seriously? It's news if an entire industry is worth this much, let alone a single company.<p>Maybe I'm just not getting it, but a lot of this stuff seems to be overvalued in the extreme.",1305658993
2557430,story,,,7,0,llambda,"Supreme Court OKs Warrantless House Search",http://www.wired.com/threatlevel/2011/05/warrantless-house-search/?utm_source=feedburner&utm_medium=feed&utm_campaign=Feed:+wired/index+(Wired:+Index+3+(Top+Stories+2))&utm_content=Google+Feedfetcher,,1305658892
2557429,comment,2557350,2557419,1,0,gaganbiyani,,,"We pay a stipend for the whole summer ($2K). I've heard everything from unpaid to $4K for the summer. More than that for a business intern, in my opinion, is unnecessary and doesn't get you kids who are there for the right reasons.",1305658840
2557428,comment,2556856,2557319,1,0,jrockway,,,"And the motherboard uses 10W, the disk 10W, and the CPU 50W.  We're still not at 700W.",1305658817
2557427,comment,2557366,2557366,1,0,codybmusser,,,"Am I too much a video game nerd if my first thought was, a new Final Fantasy?",1305658813
2557426,comment,2555349,2555588,1,0,VMG,,,"I wonder why he chose this kernel version instead of the latest",1305658811
