ID,Type,Story,Parent,Points,Comments,Author,Title,URL,Content,Created
2557509,comment,2556959,2557078,1,0,rhizome,,,"I'm inclined to think that the management help (or ""help"" depending on one's attitude) that typically accompanies funding plays a significant role here. Funded companies usually get access to market(ing) expertise that solo people don't. I don't think that's an absolute rubric, but it can help companies penetrate.",1305660461
2557508,comment,2557261,2557261,8,0,jxcole,,,"Laughable.<p>On 26 March 2010 the North Korean military launched a torpedo sinking a US ally's warship, killing 46 of it's 108 crew during a time of peace. The Cheonan represented a significant loss to the South Korean people, and though economic relations between the two nations broke down, no real military action was taken by either the US or South Korea.<p>And now you're telling me we'll go to war if someone takes out the internet?",1305660422
2557507,story,,,2,0,evo_9,"Mono team presses on with new startup after Attachmate layoffs",http://arstechnica.com/#!/open-source/news/2011/05/mono-team-presses-on-with-new-startup-after-attachmate-layoffs.ars,,1305660412
2557506,comment,2554745,2555925,1,0,SquareOne,,,"Squareeater has a page about the science from real journals:
<a href=""http://squareeater.com/howitworks.html"" rel=""nofollow"">http://squareeater.com/howitworks.html</a><p>From that page:
<i>We are often asked ""aren't the effects just placebo?"". While there certainly have been users whose response is largely imagined, there have been a number of studies (see research below) published in legitimate scientific journals drawing a correlation between binaural beats and brainwave functions. While the research is insufficient at this point to fully understand how the brain reacts with entrainment, a variety of responses have been well documented.</i>",1305660409
2557505,story,,,1,0,journalmonkey,"(www.monkeyleeks.com)homeless man selected for olympics ",http://www.monkeyleeks.com/index.php?option=com_tpdugg&task=search&Itemid=70,"homeless man selected for 2012 olympics after he launched a pole at a police officer LOL!!
for more stories similar to this visit www.monkeyleeks.com",1305660383
2557504,comment,2556856,2557291,1,0,wmf,,,"Nah, there isn't enough money to be stolen here.",1305660343
2557503,comment,2555349,2557484,8,0,rbranson,,,"While I don't think the JVM is the savior, applets are a far cry from a good example. Applets usually cause the browser to lazy load the entire JVM as a plug-in, from scratch. Very little effort has been put forth to make this process fast. It's likely if the JVM was directly integrated, it would remain resident.",1305660313
2557502,story,,,1,0,amichail,"Ask HN:  Why not provide recommendations for content in any site and any page?",,"For example, if I go to CNN, then the service would recommend CNN content that is likely to interest me on the current page I am visiting and also elsewhere in the site.<p>Does such a service exist?",1305660306
2557501,comment,2557155,2557240,5,0,kenjackson,,,"But Angry Birds is making $1M/month on Android with ads. That's not a bad revenue stream.  And you can do an ad-free version for $1.",1305660277
2557500,story,,,1,0,aivzdog,"Feeling Blue? Why The Most Popular Websites Are Blue",http://www.webcentralstation.ca/2011/05/17/feeling-blue-why-the-most-popular-websites-are-blue/,,1305660275
2557499,comment,2556434,2556434,2,0,NY_USA_Hacker,,,"Do the jobs pay enough to buy two new cars and a nice house and pay for food, clothing, furnishing and running the house (insurance, utilities, maintenance), running the cars (insurance, maintenance, fuel), medical care, recreation, more insurance against risks, children and their education, and saving for retirement?<p>Typically a career will need to last over 40 years.  How long with those jobs last?<p>When such a job ends, then what?<p>What these students will likely find is that the day they buy a house, assuming they can, a guy still in high school, with no college debt, started in plumbing or grass mowing, got his own business, hired a few workers, got customers in the neighborhood of the house, and 10 years later the computer guy got fired and was unemployable and the high school guy was able to buy the house.<p>In the US, being an employee sucks.  Even being a computer science employee sucks.  Instead, it is necessary to start, own, and run a successful business.  The business might be just grass mowing or might be a hot information technology startup that gets a really good 'exit', but, whatever, it is necessary to start, own, and run a successful business.<p>As far as the ""hot"" job market, that's nonsense:  The US is just awash in very well qualified people in software who are absolutely, positively, totally unemployable.  The reason:  They are over 35 years old.<p>Big secret:  US hiring is still back in the days 80 years ago of a Ford factory where the supervisor was to know more and the subordinate was to know much less than the supervisor and there just to add muscle to the work of the supervisor.  These college guys are 'desired' not because of what they do know but because of what they do not:  The hiring managers assume that the college guys are naive, not very well qualified, not competition within the organization, and easily manipulated.<p>Here is a fundamental reason why:  For a 'job', there needs to be someone else who creates it, that is, has the product or service, customers, revenue, building, office, desk and other equipment, other overhead, work to be done, and money to pay.  It is rare for such a person to create a job good enough for the employee to have a good career for 40+ years and do well supporting a family and saving for retirement.  Instead, the person with the chance of a good job is the one who created the job for the college guy.  The guy with the best chance of a 'good job' is the guy who started, owns, and runs that business.  For the college guy, that's the job he wants; that's the career direction he needs to keep in mind.<p>The real opportunity remains the one close to reality:  Start, own, and run a successful business.  For that opportunity, computing can help, but the field is not 'hot'.  E.g., can also do well in plumbing, running several pizza shops, etc.",1305660261
2557498,story,,,2,0,atularora,"Unveiled: Audience powers iPhone 4s impressive noise cancellation  iFixit Blog",http://www.ifixit.com/blog/blog/2011/05/17/unveiled-audience-powers-iphone-4s-impressive-noise-cancellation/,,1305660260
2557497,comment,2556856,2557092,1,0,gburt,,,"The fiat offers, at minimum, a requirement to do transactions in that currency to some minimal degree, as you are required by law to pay taxes (notice that taxes are applied to all exchanges, in theory at least, not just those conducted in the fiat currency) in that currency or go to jail.<p>That is the minimum it offers. It also offers the ability to transact with the government, who is the largest sole consumer in our economy, and a whole host of other things.",1305660251
2557496,story,,,5,1,Anon84,"Social influences kill the wisdom of the crowd",http://arstechnica.com/science/news/2011/05/following-the-crowd-undermines-its-wisdom.ars,,1305660227
2557495,comment,2556198,2557392,2,0,moe,,,"Yes, I don't dispute that we can not build a brain today. But I'd say this is not very different to our inability of building a plane (or understanding how it could possibly work) back in the 1900s.<p>I just checked wikipedia and about 100 years ago (February 1911):<p><pre><code>    The first official air mail flight takes place from Allahabad, India to Naini,     
    India, when Henri Pequet carries 6,500 letters a distance of 13 km.
</code></pre>
Today, 100 years later, I tell you about this event by typing my ""letter"" into a portable device that will soon transmit my message over the shy distance of ~8000 miles, in under 100 milliseconds.<p>So, looking back at what we've achieved in the past 100 years, and unless someone discovers some inherent property of the human brain that prevents it from being replicated (did God add DRM?), I remain pretty optimistic that we will be able to build one soon.",1305660227
2557494,comment,2555349,2557387,4,0,tectonic,,,"I don't know a lot about NaCl but my gut reaction is that it will be insecure and allow my computer to be remotely exploited.  Why am I wrong?",1305660215
2557493,story,,,1,0,gnufs,"Ask HN: What are good examples of personal homepage design?",,"I am looking for ideas on how to design a minimalist personal homepage.<p>Any well implemented, clean and pretty (which is obviously quite subjective) examples you want to share?",1305660204
2557492,comment,2555349,2557448,3,0,rbranson,,,"Seriously? the JVM? You listed the pros, but what about all the cons? Modern JVMs are fast, but highly specialized for long-running applications, which web pages are decidedly not. That's just the tip of the iceberg.",1305660174
2557491,comment,2557350,2557429,1,0,royleban,,,"In most states (perhaps all), you must pay interns at least minimum wage unless they get college credit and you get no benefit to your business from the internship.",1305660160
2557490,comment,2533393,2541536,1,0,dpcan,,,"I don't think this is accurate.<p>The permissions listed seem to pertain to the uses-permissions in the Manifest.<p>If the Manifest doesn't request these permissions, and they aren't allowed, they won't work.  If I don't put the Internet uses-permission in my Manifest, then any Internet calls I make won't work.",1305660158
2557489,comment,2556959,2557344,3,0,tlrobinson,,,"If you read the comment again you'll notice pg doesn't claim the best companies are successful because they took funding, in fact the opposite, perhaps they took funding because they were so successful that they were offered terms they'd be crazy to turn down.<p>Bottom line is some companies may be well suited to take outside funding early on, some might be better off bootstrapping to profitability, but it seems most successful companies in our industry do end up taking funding at some point in their lifetime for one reason or another.<p>Much of the 37signals/anti-VC/whatever crowd fails to recognize that not all companies are created equal. Just because 37signals has done phenomenally well without outside funding (with the exception of Jeff Bezos' investment) doesn't mean that's the right path for all companies. Ditto for Google/Microsoft/etc which did take funding.<p>It's slightly ironic because I don't think the 37signals themselves believe no company should ever take funding, rather they're fighting the perception that you must take funding to start your company.",1305660154
2557488,comment,2555349,2557340,-1,0,mythz,,,">> but how would this be different from Java?<p>It wouldn't suck.",1305660153
2557487,comment,2557058,2557481,1,0,dsiroker,,,"Thanks Ian! Are you interested in joining us? We are actively hiring: <a href=""http://jobs.optimizely.com/"" rel=""nofollow"">http://jobs.optimizely.com/</a>",1305660148
2557486,story,,,2,0,borisfowler,"Entrepreneurs Need Fewer Hot Ideas and More Plans",http://www.caycon.com/blog/2011/05/entrepreneurs-need-fewer-hot-ideas-and-more-plans/,,1305660112
2557485,comment,2556340,2557376,1,0,ctdonath,,,"Did www.jfdi.org ?",1305660065
2557484,comment,2555349,2557448,6,0,mythz,,,"Have you never used Java Applets? (i.e. JVM in the browser) the load time alone makes that a terrible idea. Not too mention the 'breaking the web/page model' and poor UX that ensued.<p>Strange that people actually think Java would be the saviour. Feel free to keep continue to use Java applets if you think they're superior tech, they should still be well supported.",1305660047
2557483,comment,2555349,2556652,3,0,gamache,,,"I love how it begins with ""use strict"";",1305660036
2557482,comment,2543601,2544633,1,0,dpcan,,,"In small areas, the local news website is much more important usually.  I can't imagine much of it would apply if I lived in LA or NY,NY - that or there would just be SO MUCH to follow it wouldn't be worth the time.<p>In my small community, the local news website applies to things happening in my back-yard sometimes.",1305660016
2557481,comment,2557058,2557397,2,0,IanMikutel,,,"Love what Optimizely is doing, keep up the great works guys! I think the A/B testing market is one that'll keep growing for a long time, and tools that make it easier to do will be the catalyst.",1305660012
2557480,story,,,3,0,rcfox,"Javascript PC Emulator",http://bellard.org/jslinux/tech.html,,1305660010
2557479,comment,2554981,2557316,1,0,jessedhillon,,,"I think you misunderstood what I said.<p>First, it's important to understand that include/require_once is useful in PHP because of a particular pattern -- include/require the files containing classes and functions I need; these statements are placed at the top of <i>every</i> script that needs those definitions. It's an error in PHP to declare the same function twice (to redeclare). So if you include script A and B, and both depend on C, then you have to use require_once in A and B when they call in C. This way, anyone calling in both A and B won't trigger a redeclaration error.<p>This use case is not relevant to people using the statements to pull in templates, because you would deliberately place the require statement where you needed it. Someone using the same partial template in the header of a page and in the footer of a page would not care if the template had been invoked before -- ""place this in the footer unless you already placed it somewhere else in the document (or even if you simply included it and threw it away, or emailed it to someone, or anything else at all)"" would be a very poorly written template.<p>So what we have is the case that a set of processing scripts all include the same file at the top and this could potentially trigger redeclaration errors. So instead of addressing the fact that the interpreter cannot distinguish a common pattern (multiple inclusion) from something that really isn't even an error (redeclaration), we have four statements that serve very minor variations of the same function.<p>There are two binary choices here: require or include and once or not once. The distinction between include and require is totally unnecessary -- in what case would you want to optionally include another file, but not even receive notification or change your behavior depending on whether the file was able to be included? The _once distinction is only a guard against redeclaration, and it's beyond me why it matters that something was declared multiple times -- or why the programmer needs to count the number of inclusions.<p>Ideally, calling in a template would be different from calling in essential definitions, and would be treated differently.<p>BTW in Python, the import statement is idempotent -- importing multiple times has the same effect as importing once.",1305659942
2557478,comment,2544516,2546775,1,0,dpcan,,,touch,1305659913
2557477,comment,2556959,2556959,13,0,juiceandjuice,,,"Wow, not one of those has any roots whatsoever in science or engineering, except maybe Meraki.<p>Is this just media selection bias, or is Silicon Valley really just turning into Marketing Valley?",1305659835
2557476,story,,,2,0,luigionline,"Will Anyone WANT An Amazon Tablet? An Argument With Myself",http://www.i4u.com/46596/will-anyone-want-amazon-tablet-argument-myself,,1305659835
2557475,story,,,2,1,sikakkar,"Ask HN: How do Compete.com or Quantcast collect data?",,"I can't find a good explanation to how they product traffic and other data.",1305659820
2557474,comment,2557124,2557124,2,0,arethuza,,,"Honestly, talk to an experienced litigation lawyer, yes it might cost you some money but it can potentially save an awful lot of grief.<p>Trying to handle things yourself and being ""reasonable"" probably won't work - I know from a nasty experience when I was a start up founder and a customer who I was very friendly with turned round one day and sued us over an IP issue - probably the most stressful experience I've ever had.<p>NB If you are in Scotland I can probably recommend a suitable lawyer if you want.",1305659819
2557473,comment,2557155,2557155,8,0,dpcan,,,"Android devs are keeping their financial figures close to the vest I believe, which results in a lot of people thinking there's no money to be made on Android.<p>It's smart.  When the iPhone's App Store launched people were spilling their guts.  Stories left and right of millions being made out of the gate.  Land rush on!<p>This time around, indie devs realized that if they keep their mouths shut about their successes, the competition will take much longer to get there.<p>I will say that I've done very well in the Android Market.  It's been an exciting year, but every week there's new competition, there's more apps to choose from, and my income is getting much harder to maintain.  I'm making about 2/3 as much as I was just back in January, and 1/2 of what I was back in October.<p>I'm creating updates and new apps in hopes of staying the course even as I imagine the landscape is going to change drastically.",1305659797
2557472,comment,2556534,2556534,2,0,ck2,,,"So since netflix is being the single best provider with virtually no ""all you can eat"" competitors and their userbase is ever growing - how long until a price increase?<p>At 25 million subscribers, means for every $1 increase they will get another $300 Million a year. That's too tempting to resist, no?",1305659753
2557471,story,,,1,0,hippich,"Bitcoin Poker Live Show",https://betco.in/static/table.html?game_id=1343&auth=0,,1305659736
2557470,comment,2557261,2557399,1,0,dkarl,,,"Think of how outraged we'd be if Iran responded to Stuxnet by attacking the U.S. or Israel militarily.  In general, hacking (aka ""cyberwarfare"") poses an intelligence challenge to determine whether an attacker is affiliated with or acting on behalf of a state.  If United States infrastructure were attacked by a group of highly skilled individuals inside Iran or China, like you suggested, who had no apparent government connections, it would be very hard to determine whether they had been surreptitiously aided or manipulated by a government intelligence agency, perhaps by anonymously sharing technical information to aid their attack or by infiltrating the group with an agent who pushed them to action and steered them toward particular targets.",1305659726
2557469,comment,2556534,2557071,10,0,MatthewPhillips,,,"Even assuming you're also paying for Hulu Plus, MLB.tv, and a few iTunes/Amazon rentals, you're still spending far less than the average cable subscriber.",1305659708
2557468,comment,2556856,2557370,1,0,Tichy,,,"Of course, my blog post just explains how to implement something like the bitcoin calculator.",1305659598
2557467,comment,2557069,2557069,1,0,bugsy,,,"OK, I'll try it out. iCal is definitely too much of a pain and riddled with numerous serious bugs.<p>In addition to normal language entry and bug fixes, I also need cell phone sync with phones other than iPhone.",1305659594
2557466,comment,2556856,2557093,1,0,weavejester,,,"You'd also need to be pretty certain that no-one's going to come up with a faster algorithm for solving the problem. I can't think of any real-world problems to which all these criteria would apply.",1305659572
2557464,comment,2556959,2557078,2,0,truthseeker,,,"I think the key is 'When did they take the money?' is it before traction or after traction.
Yes, it would be stupid to not take money when it is cheap and you have traction.<p>If majority got funding before traction, that would indicate that VCs/angels are really good at evaluating teams.",1305659456
2557463,story,,,3,1,apple_fan,"Fully Autonomous DIY Surveillance Camera",https://code.google.com/p/surveillance-camera/,,1305659442
2557462,comment,2557261,2557261,3,0,dustingetz,,,"PR. when Japan sends a fleet to Pearl Harbor and bombs us, we know who it was, the crowds ('people') get mad, and we bomb them back. When Chinese hackers target american corporations, there is not nearly so much transparency as to who is behind it (govt sponsored? independent parties? terrorists? businesses?), and the crowds aren't that mad. You can't go starting real-life wars, with killing people and such and the economic consequences thereof, without support of the crowds.<p>Of course if Chinese hackers shut down our utilities/communications, that's certainly a real-life attack, and it will be easier to convince the crowds that we know a enemy government is responsible.",1305659413
2557461,story,,,105,186,trooon,"Why Startups Could Use .NET, But Dont",http://www.piehead.com/blog/2011/05/why-startups-could-use-net-but-dont,,1305659350
2557460,comment,2556856,2557168,2,0,rorrr,,,"The (S&P 500) stock market return:<p>1) Since 1971 (40 years) is roughly 1300%, which is 19.63% annualized (1.1963^40 = 1300).<p>2) Since 1950 (60 years) is roughly 7680%, which is 16.08% annualized (1.1608^60 = 7680)<p><a href=""http://chart.finance.yahoo.com/z?s=%5eGSPC&t=my&q=l&l=on&z=l&p=s&a=v&p=s&lang=en-US&region=US"" rel=""nofollow"">http://chart.finance.yahoo.com/z?s=%5eGSPC&t=my&q=l&...</a>",1305659343
2557459,comment,2556270,2557221,5,0,jrockway,,,"Prove your program works for n=1.  Induct on n.",1305659343
2557458,comment,2556959,2556959,4,0,spencerfry,,,"I've got so many friends that shoulda made this list, but fly under the radar.",1305659318
2557457,comment,2557261,2557439,5,0,karamazov,,,"The US is not going to send missiles in response to some port scanning.  But massive attacks, such as the large-scale attack on Google or stealing data from NASA or other government agencies, will now presumably trigger a strong response.",1305659300
2557455,comment,2556895,2556895,3,0,cube13,,,"Bitcoins are a great consumer currency at this point, considering that it's possible to generate them out of thin air makes it attractive to get.  It's like getting an allowance as a kid-you do some(relatively) trivial work, and get some money from it.  The problem is that it won't always be this way, especially when the mining stops.<p>Normal currencies have a cyclical economy.  A consumer gets money from their job, then spends it somewhere.  The money goes up the supply chain, eventually getting to a bank, which loans it out to a business, who then pays employees.  Bitcoins currently are only used in the first transaction, then exchanged for USD or other currency.  They are acquired by consumers in two ways: mining them, or buying them from a Bitcoin exchange.  After the mining phase ends(or becomes prohibitively expensive), you won't be able to conjure up BTC from thin air.  The only way for a consumer to get BTC is to buy them from an exchange, since the overwhelming majority of people aren't going to actually be paid by their job in BTC.  Also, since it's doubtful that ISPs or hosting providers will accept BTC, the sellers need to exchange their BTC for USD to pay their bills.  So, in the end, this means that the only ones that really win in this economy are the BTC-USD exchanges.",1305659272
2557454,comment,2556895,2557157,7,0,gritzko,,,"<a href=""http://www.pds.ewi.tudelft.nl/~victor/bitcoin.html"" rel=""nofollow"">http://www.pds.ewi.tudelft.nl/~victor/bitcoin.html</a><p>Canned response: Bitcoin is only ""peer-to-peer"" in the sense of the British Peerage system.<p>Early-comer-wins, that's the only advantage I see (for early comers). Bitcoin does not capitalize trust in people and institutions (like regular modern money system does, by the way). It is just a silly pyramid scheme reselling air, fed by hopes of those higher in the pyramid to sell Bitcoins to those lower.",1305659249
2557453,comment,2556340,2556506,1,0,lfx,,,"Whats the diff? Cult, technic, methodology. Same thing, different branding.",1305659233
2557452,comment,2556856,2557115,3,0,nowarninglabel,,,"It's a valid concern, but it would be better to weight it against the current carbon costs of existing currencies.",1305659220
2557451,comment,2554789,2557104,1,0,polyfractal,,,"Very interesting, thanks!  I admit I just made up 10k as a number, I have no idea what libraries typically spend on various acquisitions.  I've contacted my alma mater's library asking similar questions.  Would you mind an email from me about this?",1305659211
2557450,story,,,2,0,luigionline,"Fragmentation Bites Android In the Butt, Makes YOU Less Safe",http://www.i4u.com/46594/fragmentation-bites-android-butt-makes-you-less-safe,,1305659209
2557449,comment,2556856,2557149,5,0,ryandvm,,,"Do you take Bitcoin?",1305659209
2557448,comment,2555349,2556260,12,0,guygurari,,,"Exactly. I never understood why the web community decided to re-invent this wheel. We started with a model for text publishing (HTML), and are trying to evolve it to allow full blown apps. If browsers simply supported the JVM as the browser execution environment, instead of implementing their own javascript engines, we'd have:<p>1. More language independence<p>2. Great performance for games, video (think implementing codecs without the need for browser support), and for crazy things like this.<p>3. Most importantly, the ability to run actual desktop-like apps in the browser at near-native speeds, instead of the mess that is currently required to get web apps to behave like desktop apps. (Nowadays Rails and friends are hiding most of this mess, but it's still there.)",1305659189
2557447,comment,2556959,2556959,0,0,truthseeker,,,"I installed Bump on my iPhone but used it just once.
Any one knows how Bump is doing in terms of traction and usage?",1305659188
2557446,story,,,1,0,apievangelist,"90 of Top 200 Sites Have No Mobile Version, Says New API",http://blog.programmableweb.com/2011/05/17/90-of-top-200-sites-have-no-mobile-version-says-new-api/?utm_source=feedburner&utm_medium=feed&utm_campaign=Feed%3A+ProgrammableWeb+%28ProgrammableWeb%3A+Blog%29,,1305659174
