ID,Type,Story,Parent,Points,Comments,Author,Title,URL,Content,Created
2836154,story,,,1,0,Boldewyn,"Motokai, a dark motif for ChatZilla",http://www.manuel-strehl.de/var/motokai_for_chatzilla.en.html,,1312268380
2836153,comment,2835656,2835787,2,0,getsat,,,"Understood. Thanks again for publishing these!",1312268358
2836152,comment,2835901,2835901,2,0,wensing,,,"$8 billion valuation ...<p><i>That's 40 times the $200 million in yearly revenues that equity research firm Hudson Square recently estimated Twitter takes in.</i>",1312268339
2836151,story,,,1,0,mvs,"Pricing Tables: Examples And Best Practices",http://www.smashingmagazine.com/2008/10/13/pricing-tables-showcase-examples-and-best-practices/,,1312268300
2836150,comment,2835281,2835827,3,0,yummyfajitas,,,"tokenadult, on a different day: ""The methodology ... [comparing aggregate TIMSS scores] you point to repeatedly is laughable.""<p><a href=""http://news.ycombinator.com/item?id=2773391"" rel=""nofollow"">http://news.ycombinator.com/item?id=2773391</a><p>Also, could you define ""competent professional analyst""?",1312268265
2836149,story,,,1,0,fashionme,"Looking for plus size swimsuit manufacturers",http://trade.globalintimatewear.com/buying/50080/Looking_for_plus_size_swimsuit_manufacturers.html,"We have our own designs but would also look into the suppliers library of fabrics & ready-made products.",1312268204
2836148,comment,2832535,2833299,1,0,jodrellblank,,,"Is there such a question?<p>If you jailbreak but continue to make phonecalls, use the AppStore, etc. are you in breach of any of the contracts you signed or licenses you agreed to?",1312268197
2836147,story,,,1,0,vicbrain,"Teebeutel | Taffeebeutel",http://www.bodenbeutel.de.com/teebeutel,"fertigen wir die hchste Qualitt bedruckte und unbedruckte Teebeutel und liefern weltweit. Wir stellen auch Doypacks standbodenbeutel, kaffeebeutel, bodenbeutel, flexible verpackung, zip beutel, PE Beutel, Folien beutel, verschluss beutel, blockbodenbeutel, Polybeutel, plastikbeutel etc.",1312268179
2836146,comment,2833604,2836032,1,0,derrickpetzold,,,"Oh my apologies I wasn't trying to convince anyone of anything if that's what you are thinking. I was only stating fact based on my experience but that's okay just downvote this and make yourself right.",1312268152
2836145,story,,,1,0,StephenFord,"Criminal Lawyers in Roanoke",http://www.ericrolandspencer.com/practice-areas/virginia-criminal-law/,"Criminal Lawyers in Roanoke, Salem, and Vinton VA focuses on criminal law cases such as misdemeanors, felonies, expunging records, and juvenile crimes",1312268140
2836144,comment,2835212,2835212,4,0,mahyarm,,,"The parallels between america vs europe back in the 1800s and china vs america now are very interesting.",1312268108
2836143,comment,2833342,2833342,1,0,jpr,,,"Someone still thinks artificial scarcity is a viable business model?",1312268085
2836142,comment,2834386,2835970,1,0,NickKampe,,,"You stole the words right out of my mouth.",1312268075
2836141,comment,2835656,2835656,3,0,joshu,,,"The first example is called ""pairs trading"". Try extending out the math to multiple sets.<p>I once wrote an ADR arb detector, which even took into account the forward contract for the currency trade.",1312268064
2836140,comment,2835383,2835383,84,0,coffeemug,,,"I think what they're doing is great, but I see two problems with their presentation. First, computer rendering techniques are extremely well understood and well researched. We've picked the low hanging fruit, much of the high hanging fruit, and everything in between. There is no ""groundbreaking new technology"" to be invented. They're converting polygons into voxels (although each voxel is probably a sphere for cheaper computation), and using software ray-tracing to render in real time. Since ray-tracing is trivially parallelizable, the multicore technology is just about there now. A 12-core machine will give just about 20FPS. The reason why they can get away with an incredible amount of detail is that ray-tracing diffuse objects is fairly independent of the number of visible polygons in the scene.<p>The second problem is that 10^4x improvement in level of detail <i>does not</i> mean 10^4x aesthetically pleasing (or in fact, more aesthetically pleasing at all). Ray tracing gets very expensive the moment you start adding multiple lights, specular materials, partially translucent materials, etc. It is very, very difficult to do <i>that</i> in real-time even with standard geometry, let alone with 10^4x more polygons. This is why their level doesn't look nearly as good as modern games despite higher polygon count (compare it to the unreal demo: <a href=""http://www.youtube.com/watch?v=ttx959sUORY"" rel=""nofollow"">http://www.youtube.com/watch?v=ttx959sUORY</a>) They only use diffuse lighting and few lights. In terms of aesthetic appeal of a rendered image, lighting and textures are <i>everything</i>.<p>Furthermore, one of the biggest impacts on how aesthetically pleasing a rendered images looks is made by global illumination. That's also something that's <i>extremely</i> difficult to do in real time with raytracing, but is possible with gpu hardware with tricks. The trouble is, these tricks look much better than raw polygons.<p>Again, I love what they're doing. Real-time ray-tracing is without a doubt the future of graphics, but it would be nice if they were a little less sensational about the technology, and more open about the limitations and open issues.",1312268061
2836139,comment,2836088,2836119,1,0,toast76,,,"BugHerd is about logging bugs/issues on your own website/webapp. It's quite different from notemoz. Unless I'm missing something?",1312268049
2836138,story,,,1,0,mibaba70ki,,http://www.ruliren.info,,1312268031
2836137,comment,2835383,2836043,4,0,sliverstorm,,,"I wouldn't go as far as ""amazingly convincing"". I think they look better after you've been staring at the HL2 world for a while, rather than the real world.",1312267987
2836136,comment,2835072,2835267,1,0,alexmat,,,"You do sound pretty grumpy about the server being down.",1312267974
2836135,story,,,1,0,businessimpex,"Chemical Manufacturers",http://chemicals.businessimpex.com/,"Businessimpex.com is an Online b2b directory of Dyes and chemical manufacturers, chemical suppliers, dyes manufacturer.",1312267943
2836134,comment,2834334,2834334,0,0,tzury,,,"Brian, I am deeply impressed, that is a brave and decent step which leaves all happy competitors far beyond (the competitors should try harder now, techcrunch is not going to help their marketing).<p>You are a great CEO and deserve to direct a Billion Dollar company, no doubt.<p>I just can't wait for my trip to the USA to use AirBNB accommodation (as an HN reader I have decided long ago that in the next trip to US I will not stay in hotels but book with AirBNB)",1312267925
2836133,comment,2835901,2835901,1,0,flipdeadshot,,,"More evidence that were in a buggle",1312267845
2836132,comment,2834300,2834939,3,0,damusnet,,,"it does",1312267840
2836131,comment,2834386,2834386,1,0,NickKampe,,,"The music industry we see today is part of a vastly different environment than the music industry we knew only a decade ago. Thanks to the power of the internet as well as the overwhelming availability of music over peer to peer networks, we now have an industry that is terrified of technology, engages in anti-competitive
business practices, and that is now starved of capital. Yet despite poor sales, terrible product reviews, and a slew of new online music services, the industry still maintains the very same flawed business model theyd implemented in a time in which their industry was thriving.<p>On the other hand, the independent music industry has truly benefited from the power of technology. Modern day independent artists now vary in age, arent signed to a specific record label, and have the ability to produce, promote, market, as well as manage everything entirely by themselves. Even if the opportunity arises for a musician to begin working with major labels, studios, or corporations it carries with it a number of obligations which often greatly affect the ownership, integrity, and general direction of any project in question. Which partly explains why theres currently a substantial market of independent musicians, looking to get their name out, that are willing to give their music away at no cost.<p>For an example on how free music works, look no further than Pretty Lights (<a href=""http://prettylightsmusic.com"" rel=""nofollow"">http://prettylightsmusic.com</a>)  He releases his music at absolutely no cost whatsoever and accepts donations.  He does however place his music on iTunes and other marketplaces for people to also purchase if they're unaware it's available for free or want to support the artist.  He tours nearly year round and has sold out nearly every one of his shows the last two years.<p>Ask any musician where a vast majority of the capital they bring in comes from and they'll tell you it's not in the sales of their tracks.<p><a href=""http://www.informationisbeautiful.net/2010/how-much-do-music-artists-earn-online/"" rel=""nofollow"">http://www.informationisbeautiful.net/2010/how-much-do-mus...</a>",1312267837
2836130,comment,2836108,2836108,1,0,mrb,,,"I presume that this malware exploits a root privilege escalation vuln to record phone calls?<p>During installation, this malware asks for the RECORD_AUDIO permission, but AFAIK this permission is <i>not</i> for allowing applications to record phone calls, but merely recording audio when a call is not in progress.",1312267821
2836129,story,,,1,0,meitoumei,,http://www.fanwencn.com/html/shuxinfanwen/taozhanshu/,,1312267814
2836128,story,,,1,0,brandshoesbuy,"MENS 420 TOP-GREY INFRARED [Radii 420 TOP Shoes] - $73.00",http://radiishoes.isooi.net/mens-420-topgrey-infrared-p-49.html,,1312267807
2836127,comment,2835281,2835580,6,0,yummyfajitas,,,"I don't know who claims the US is the best in the world, but we are certainly close to the top. We score 6 points below Canada (530 vs 524) and 1 point below Germany (at 525).<p>Rankings make sporting events exciting because they exaggerate small differences. They are less useful when looking at statistics for the same reason.",1312267781
2836126,comment,2835288,2835717,1,0,inconditus,,,"What version are you running?",1312267779
2836125,comment,2835015,2835586,4,0,james_fairhurst,,,"I'm currently reading the 1st book after watching the show and wished I'd read it first. Brilliant story and I think the show does an amazing job of converting the books to screen however it would of been great to compare what I interpreted in the books to what they've created on screen.",1312267727
2836124,story,,,57,26,sim0n,"U.S. to Assist Immigrant Job Creators",http://online.wsj.com/article/SB10001424053111904292504576482573203358158.html?mod=googlenews_wsj,,1312267704
2836123,story,,,1,0,rickyrhode,"Florida Permit Test",http://www.floridatlsae.com,"Florida TLSAE Course- Required online 4 Hour FL permit test to get first time learners permit. 100% Guaranteed to Pass. Get Free 50 DMV Practice Questions with Signing Florida TLSAE, DATA Course.",1312267697
2836122,comment,2835656,2836060,6,0,veyron,,,"A friend and I built an iPhone app in pursuit of a new concept, and we did a few field tests, but Apple did not approve the app.  At that point, although we could have continued pushing, we decided it was easier to stop the project and part ways. I decided I didn't want to go back and work for someone else (blame HN for being bitten by the startup bug :)",1312267691
2836121,comment,2835212,2835542,1,0,forensic,,,"Well, someone needs to be friends with NK. I don't think China leaning on NK could really help there. NK would just get more isolated. The solution to North Korea is to stop scaring them so that they will come out of their shell a bit.",1312267682
2836120,comment,2836108,2836108,1,0,nodata,,,"To be fair, this app does explicitly ask for permission to listen to your phone calls, which is a lot more information than the equivalent app would have on a traditional operating system.",1312267668
2836119,comment,2836088,2836088,1,0,doubaokun,,,"You do something like <a href=""http://notemoz.com"" rel=""nofollow"">http://notemoz.com</a><p>""What is the motive for thousands and thousands of such applications which probably no one uses on regular basis? Very frankly, I see such news, go to the site, look up and move elsewhere. Previously I used to register at least. not anymore."" from <a href=""http://www.thinkezy.com/blog/?p=42"" rel=""nofollow"">http://www.thinkezy.com/blog/?p=42</a>",1312267663
2836118,comment,2833945,2834693,1,0,jc123,,,"It would require more thought, but maybe they could consider number of exceptions reported as part of pricing, in addition to page views.",1312267652
2836117,comment,2833342,2834432,5,0,wladimir,,,"<i>Frankly I'm surprised that people haven't cracked the MS DRM just out of spite for this move.</i><p>Because it's not worth it. People that want to pirate simply leech the movie off some torrent, instead of cracking a DRM then still paying for it.",1312267650
2836116,story,,,1,0,ankit319,"WeBid Remote Code Execution Exploit |VIDEO| ~ Insecure Stuff",http://www.insecurestuff.in/2011/08/webid-remote-code-execution-exploit.html#.Tjec7iROK6Y.hackernews,,1312267601
2836115,comment,2835288,2835288,2,0,mildweed,,,"This affects not just themes, but plugins too. Its in the vslider plugin I've used in multiple installs.",1312267590
2836114,comment,2835288,2835826,3,0,dave1010uk,,,"Turning off the ability to execute arbirary code on your server through your webserver will also stop WordPress from being able to get security updates out to the millions of sites using it.<p>While I much prefer going through SHH to manage my sites, there are likely 10x as many WP sites run by people who can only FTP. There isn't really an ideal solution in this situation (apart from education) so I think allowing easy updates by having weaker security may be best. Maybe there is a better solution that still works for FTP. If so, file a ticket.<p>The WordPress Codex is a wiki and it looks like the docs on security could do with some improvements - sign up and help out.",1312267522
2836113,comment,2835212,2835704,11,0,forensic,,,"We can't save the world. Even if our entire country voted for it, we could not save the Chinese from their own policies.<p>They are adults living in a sovereign nation; they are responsible for their own working conditions.<p>I'm not going to feel white-guilt for stuff that happens in a foreign country over which I have zero control.",1312267513
2836112,comment,2835383,2835540,1,0,chipsy,,,"By ""production issues"" I would think ""pipeline"" first of all. It doesn't matter if it's possible to convert a high-res mesh to an optimized voxel format, if the result takes hours of compilation. That is too long an iteration time for a single asset.",1312267500
2836111,story,,,2,2,umenline,"Which options do I have to monetize desktop application like TweetDeck ",,"Hello all
I build desktop application that is integration between Twitter / facebook/ picasa / (can be others ) on speed (build with c++ with much more options).
It is  build first for my use . but then people liked it and started to use it . 
Its still in very early beta . before I publish to it to the public . which options do I have to monetize it.
So it can generate income. 
Thanks",1312267479
2836110,comment,2835394,2835394,1,0,trevelyan,,,"Anti-money-laundering regulations in the United States have resulted in most payment processors refusing to service foreign-incorporated companies. If you expect to collect credit card payments, your first consideration should be incorporating in a country where you will be able to process payments. If you are just looking for legal protection otherwise, the advantage of offshore companies are they're usually black book (no annual audits or requirements to maintain physical offices in-country) etc., so they can provide a convenient form of legal protection from lawsuits while being fairly cheap to operate.",1312267458
2836109,comment,2836024,2836077,2,0,glimcat,,,"A large part of the problem is the ""race to the bottom"" mentality. Users have been taught (by Apple) that software is $0.99 - if not free. You have to get massive user numbers before that becomes profitable, or find another way out of the trap.<p>Google's Market is pretty good, and there's always the option of self-distributing (Swype does this and it is still very popular).<p>I wouldn't use Amazon's App Store after reading things like this. It's less usable for customers and it takes a lot out of the developer's control. However, I've seen developers handling this very badly. For example, they get shocked by the way the Free App promotion works (starting with the fact that it's FREE) and then try to remove the app from the store and deny those customers all further access to updates and the ability to reinstall (which may be wanted reasonably often if you use custom firmware). I don't care if you sold it for $0 or if you got burned by Amazon, that's still a bit of a bait-and-switch.",1312267452
2836108,story,,,8,4,mrb,"Android Malware Records Phone Calls",http://community.ca.com/blogs/securityadvisor/archive/2011/08/01/a-trojan-spying-on-your-conversations.aspx,,1312267436
2836107,comment,2834300,2835528,1,0,jordanlev,,,"You might like Vanilla Forums better:
<a href=""http://vanillaforums.org/"" rel=""nofollow"">http://vanillaforums.org/</a>",1312267401
2836106,comment,2834889,2834889,2,0,nomdeplume,,,"so easy
step 1) so sorry.  You are on wrong OS. try again
step 2) so sorry.  You are on wrong browser.  try again
step 3) so sorry.  You must enable Javascript. try again
step 4) so sorry.  You must be developer.  try again",1312267348
2836105,comment,2835901,2835901,11,0,dmazin,,,"Does this mean they are bleeding money? Why would they need such a huge infusion other than if they have run out of cash?
Well, I don't know.<p>In other words, I think the claim that they 
are spending the money to ""aggressively innovate"" is PR bullshit. They need the money to pay their immense infrastructure bills because their revenue stream so far has been too feeble.",1312267347
2836104,comment,2836088,2836088,1,0,toast76,,,"Quick link - <a href=""http://bugherd.com"" rel=""nofollow"">http://bugherd.com</a>",1312267324
2836103,comment,2835015,2835509,8,0,w1ntermute,,,"> not to stereotype real-life ethnicities (except for maybe the feudal British).<p>This is actually very true. The Seven Kingdoms are based on the Heptarchy (Lancaster --> Lannister, York --> Stark) and so the story is (very) loosely based upon the War of the Roses.",1312267289
2836102,story,,,40,7,Finntastic,"Amazon launches Start-up Challenge",http://www.startupsmart.com.au/finance/2011-08-02/amazon-launches-start-up-challenge.html,,1312267288
2836101,comment,2832390,2833785,2,0,zmalltalker,,,"I've tried doing that, but whenever I'm actually doing work on Android app a really large percentage of my time spent is done working on the UI. Not having the ADT tools for the UI just doesn't make sense to me.",1312267284
2836100,comment,2835383,2835693,5,0,corysama,,,"Because they describe the tech as if was the answer to everything.  It can do specific things very well and other things not at all.  If they toned down the hype and were clear about the limitations, they would get nothing but love.",1312267245
2836098,comment,2835015,2835427,2,0,w1ntermute,,,"Well, you can't make something that everyone likes. The vast majority of people I've talked to have greatly enjoyed the show, and the critics are raving as well. But there are definitely going to be a few people like you for whom it just doesn't work.",1312267141
2836097,story,,,1,0,josh2012,"How to Avail Best Job Opportunities in Pakistan?",http://www.pkjobs.pk/blog/job-interview-how-to-be-relevant-in-it/,"Condition of jobs in Pakistan and all over the world are not up to mark. If you want to know the best way to avail job opportunities in Pakistan then you should click www.pkjobs.pk for details.",1312267092
2836096,comment,2835288,2835288,4,0,davidw,,,"As someone relatively new to Wordpress, I use a hosted instance from Wordpress.com.  How do they handle things like this, and security in general?",1312267079
2836095,comment,2835059,2835059,1,0,jayzee,,,"I do not understand this section: <i>Here's where Mr Myhrvold's Intellectual Ventures comes in. Intellectual Ventures owns a huge portfolio of patents. Quite possibly they also have some sort of patent that covers streaming music over the internet. Intellectual Ventures makes money through a sort of protection racket that helps Spotify defend themselves against companies like PacketVideo</i><p>How can Spotify use IV's patent pool defensively against PacketVideo, a patent troll when they PacketVideo doesn't do anything other than sue? The defensive aspect only comes into play against companies who have other lines of revenue that you can threaten... thoughts?",1312267071
2836094,comment,2835383,2835527,4,0,redthrowaway,,,"It seems they're getting around the RAM issue by procedurally generating their objects. I'm cautiously optimistic, but I want to see it in something approaching a consumer game before I'll believe it.  Carmack seems to think the next-gen consoles might be able to handle it, so if they can push out their SDK within a year, it might just power the next Crisis.  Assuming, that is, the technology is actually useful.",1312267070
2836093,comment,2835110,2835110,1,0,vnuk,,,"""Nothing in these Official Rules will be construed as a representation or agreement that we or our affiliates will not develop or have developed products, concepts, systems or techniques that are similar to or compete with the products, concepts, systems or techniques contemplated by or embodied in any Submission Materials.""<p>Let me see if I got this right. I enter with my project, they like the idea, they cut me off and build my project as their own. And I get 25$ for participating...<p>Is this realistic or am I just being paranoid?",1312267047
2836092,comment,2835383,2836064,6,0,greendestiny,,,"Because it's probably incredibly difficult to do with the added memory and bandwidth restrictions.",1312267019
2836091,comment,2835346,2835800,8,0,Cushman,,,"Don't liewe're all gonna buy TextMate 2 anyway.",1312266974
2836090,comment,2835656,2835923,1,0,veyron,,,"I personally think he was writing those so that someone would stumble across them and hire him. The new employer must have asked him to take them down.",1312266959
2836089,comment,2834820,2834820,1,0,UIZealot,,,"I think the primary problem with Xcode is that huge amount of new code has been added in recent years, and the new code has not had a chance to be thoroughly tested.",1312266959
2836088,story,,,7,5,toast76,"Show HN: BugHerd 3 months later",,"Some of you may recall some months ago we started building an app called BugHerd (http://bugherd.com). At the time we had no pricing, no real market strategy and were having a hard time pitching our concept. A lot of people didn't understand why on earth we'd build a bug tracker when there are dozens of great apps out there already...and really, it was a pretty good point!<p>We're now finding that our greatest use case is a communication tool between technical and non-technical users. e.g. stakeholders, clients, managers. BugHerd is now crossing the divide between QA, Feedback and Bug tracking. We're still a bug tracker at heart, but now we've broadened our appeal to the entire team, not just developers.<p>We'd love to get your feedback!<p>(as a side note, we're currently A/B testing copy and trial options, so my apologies if you get some variation)",1312266937
2836087,comment,2830127,2830127,1,0,Kjeldahl,,,"<p><pre><code>  ;; Shows last used files in menu on emacs startup
  (require 'recentf)
  (recentf-mode 1)
  (setq recentf-max-menu-items 25)
  (global-set-key ""\C-x\ \C-r"" 'recentf-open-files)

  ;; Improves buffer names (gets rid of <2> <3> etc names when filenames
  ;; are identical).
  (require 'uniquify)

  ;; Copies from line above with meta-n, useful for some programming
  ;; languages that force such structures.
  (fset 'prevlinecolcopy
     [up ?\C-  right ?\M-w left down ?\C-y])
  (global-set-key (kbd ""M-n"") 'prevlinecolcopy)</code></pre>",1312266932
2836086,comment,2835212,2835771,2,0,r00fus,,,cite?,1312266930
2836085,story,,,3,1,kjbinu,"24 popular startup advice that misleads entrepreneurs",http://whittleidea.com/blog/,,1312266918
2836083,story,,,1,0,haoyajme,1.76,http://www.ox00.com,,1312266912
2836082,comment,2834334,2834365,4,0,forensic,,,"It's not the same level of challenge as eBay and Paypal. Are Nigerians going to buy houses in SF so they can pretend to have them robbed?<p>eBay and Paypal's #1 way of avoiding fraud is by validating physical addresses. AirBnB has this built in. Something tells me their insurance policy doesn't apply to shacks in Nigeria.",1312266905
2836081,comment,2835346,2835906,4,0,alanh,,,"Unless the program forbids you from adding extra keys, which I do not expect to be the case, you could add dummy keys like<p><pre><code>    { 
      actual_config_item: ""Some value"",
      comment_on_above:   ""Explanation / pseudo-comment""
    }</code></pre>",1312266867
2836080,comment,2835656,2835923,1,0,vitobcn,,,"No idea what happened to it, but I found this backup if anyone is interested:<p><a href=""http://www.opensourcetrader.com/author/wk-selph/"" rel=""nofollow"">http://www.opensourcetrader.com/author/wk-selph/</a>",1312266855
