ID,Type,Story,Parent,Points,Comments,Author,Title,URL,Content,Created
2836079,comment,2835281,2836045,6,0,yummyfajitas,,,"<i>This explanation does not explain why European cultures fare much better.</i><p>Actually, this explanation does work pretty well for that also. Assume for the moment that Americans of European descent and Europeans have similar cultures.<p>Americans of European descent achieve test scores which are comparable to the top European nations + Australia.<p><a href=""http://super-economy.blogspot.com/2010/12/amazing-truth-about-pisa-scores-usa.html"" rel=""nofollow"">http://super-economy.blogspot.com/2010/12/amazing-truth-abou...</a><p>The only reason the US as a whole does not fare as well as most European nations is because it's large proportion of non-Europeans drag the average down.<p>You get similar results when comparing Americans with Asian culture to Asians. Your culture explanation has a lot of explanatory power, and almost certainly more explanatory power than any explanation based on school system.<p><a href=""http://super-economy.blogspot.com/2011/01/how-well-do-above-average-american.html"" rel=""nofollow"">http://super-economy.blogspot.com/2011/01/how-well-do-above-...</a>",1312266776
2836078,comment,2835059,2835740,3,0,reitzensteinm,,,"Actually, it would be very possible for a patent to shape the industry without anybody knowing. Ideas spread quickly, and the better the idea, the faster it will spread.<p>Say AntiLodsys invents micro transactions - which, for the purposes of this post is a non obvious technology that wouldn't have been invented by anyone else anytime soon - and patents a specific implementation of it. Unlike real Lodsys, which bought a junk patent and claims it covers every piece of software that networks, AntiLodsys actually invented something useful, which has value.<p>Sony, Microsoft, IBM etc are given presentations by AntiLodsys, demonstrating the system they've come up with. They all think it is fantastic, and license the technology.<p>From this point on, micro transactions will be seen as the direction that the industry is going in, and AntiLodsys is some obscure technology company that most have never heard of.<p>From there, a whole flood of smaller companies start using micro transactions, violating the patent, and a few years later, AntiLodsys starts sending out legal notices to companies violating its patent. The industry cries foul, because the whole idea of micro transactions is seen as obvious, the way the industry was going, etc. It's painted a patent troll, trying to steal bread from the table of hardworking independent developers.<p>So there's a situation where, if one accepts the premise of patents to begin with, a company nobody has heard of actually does have a legitimate claim.",1312266743
2836077,comment,2836024,2836024,2,0,danielhunt,,,"That's absolutely incredible.
It's also the first I'd heard about difficulties with the Amazon App Store (which, if I remember correctly, was opened to great fanfare about how developer & user friendly it was)<p>It does seem as though Android is an <i>incredibly</i> difficult platform to make money on though.
This site has been littered with complaints (& plenty of iOS-vs-Android posts) about the dev process and lack of buyer activity.<p>I've actually found myself buying more than I otherwise would have, as a result of this sentiment. I want to support Android dev, and my credit card seems like the most logical way to do that.<p>Funnily enough, I've never even considered the Amazon market. I wonder what type of people do...",1312266730
2836076,comment,2835901,2836056,3,0,britta,,,"The last line of the story says ""in the past year, its head count has grown to 600.""",1312266712
2836075,comment,2834889,2835362,1,0,r00fus,,,"These are there because Mac is going touch as well (at first only using the macbook and magic trackpads, but I think there will be a stronger merger between OSX and iOS in terms of user input in coming releases.<p>Guess even a 0-button mouse wasn't enough... the UI hints are all about trackpads and deep touch gestures.",1312266702
2836074,comment,2835059,2835740,2,0,URSpider94,,,"The problem with that argument is that the world in which scores of people are spontaneously re-inventing the same thing, is not the same world in which that invention was made.  It's entirely possible for something to be non-obvious when it is invented, then to become completely obvious later.",1312266673
2836073,comment,2835346,2835346,-2,0,angelortega,,,"Yet another text editor. This is exactly what the world needed.",1312266669
2836072,comment,2832538,2835989,1,0,rbarooah,,,"That's fair enough.  I think this explains the reactions of others in this thread.  The distinction between want and need isn't important to my original point, and I certainly wasn't intending to claim them as objective.  It was a careless choice of words.",1312266641
2836071,comment,2835656,2835977,0,0,veyron,,,"There is a signficant cost to obtain data and most of the seemingly simple trades don't make much money anymore.  Purchasing realtime market data is very expensive, and you generally need to make 1000$ per trading day to break even. It's not easy in this economic climate, especially if you are trading your own money.<p>Amongst other things, dark pools and alternative venues have sucked a lot of liquidity that would traditionally hit the market.<p>The reason the information is available on Wikipedia is because people like me contributed to many of the wiki articles on the topic :)<p>The profitable opportunities themselves are fleeting and tiny, which means only the first few traders actually get the trades they want. This, coupled with the sheer number of firms (in the hundreds) forces traders to do what it takes to minimize their delays, including obtaining lower latency market data, high performance servers and proximity. And yes, some exchanges (like NYSE) definitely play favorites.",1312266584
2836070,story,,,1,0,turfhanceys,"Turf for lawns, lawn turf",http://www.buzzflash.net/?search=http%3A%2F%2Fwww.hanceysturf.com.au%2F,"Hancey's Turf provides professional turf services, and premium quality turf varieties to the Sunshine Coast, Brisbane, Gold Coast surrounds.
Hanceys Turf is dedicated to supplying you with premium quality turf.",1312266544
2836069,comment,2835383,2835383,1,0,andrethegiant,,,"I remember when the first video came out, they said their technology worked ""like Google"" to find the appropriate pixels to display on the screen. No further description of the technology. Seems too vague to be true.",1312266539
2836068,comment,2835059,2835059,2,0,URSpider94,,,"I'm pretty disappointed in an article like this coming from The Economist.  This is nothing more than poorly-researched piling onto the popular anti-patent sentiment.<p>Case In Point 1: If the company suing Spotify is truly a patent troll (i.e. a non-practicing entity), then buying into IV's patent fund would not help them.  Having defensive patents only works when the aggressor has a line of business that could be threatened with patent infringement.<p>Case In Point 2: I have to take issue with Lemley's critique of simultaneous invention.  To name two high-profile cases, consider the Bell-Gray simultaneous invention of the telephone, or Dow and Exxon's slugfest over metallocene-catalyzed polyethylene patent protection in the late 1990's.",1312266506
2836067,story,,,1,0,mlitonkylee,"Handmade Skis and Snowboards",http://www.epicplanks.com/,"Epic Planks produces quality handmade skis and handmade snowboards while focusing on innovation, feedback, and progress. These graphics are sick!",1312266455
2836066,story,,,1,0,arnodnill,"Cheap Divorce Fernandina Beach",http://www.jaxmediator.com/,"Jacksonville Divorce & Divorce Services Jacksonville.Experienced Legal Representation for Individuals and Families.We provide to you the top listings for Divorce Attorney in the Jacksonville.Here are the Divorce mediator Orange Park Florida,Inexpensive divorce orange park,Divorce Mediator St. Johns County.Low cost divorce nassau county Florida.",1312266447
2836065,story,,,1,0,erickhill,"New number one source for cyber attacks - Myanmar?",http://www.zdnetasia.com/myanmar-no-1-source-of-web-attacks-62301402.htm?tag=mantle_skin;content,,1312266406
2836064,comment,2835383,2835987,1,0,redthrowaway,,,"20 fps <i>in software</i>.  They're still finishing hardware rendering.",1312266390
2836063,comment,2835383,2835725,1,0,prof,,,"Yea this looks awesome, i hope he gets fundings. I am listed on the donor-page yay ^^",1312266367
2836062,comment,2835901,2835901,7,0,aresant,,,"Wow, that is a monster bet.<p>From the NVCA's own data that deal alone is nearly equivalent to Q2's top TEN deals:<p><a href=""http://www.nvca.org/index.php?option=com_docman&task=doc_download&gid=775&Itemid=317"" rel=""nofollow"">http://www.nvca.org/index.php?option=com_docman&task=doc...</a><p>You want to talk about ""disruptive"": DST and their limitless oligarch cash coming in and liquidating employees before a traditional liquidity event (public stock).<p>Wow.",1312266357
2836061,comment,2834334,2834334,1,0,azov,,,"So, AirBnb did the right thing (which they would have to implement sooner or later anyway) and got tons of free publicity in process. Not bad after all :) Congrats, Brian, and good luck to your venture!",1312266332
2836060,comment,2835656,2835656,3,0,allenbrunson,,,"115 days ago, you posted that you had quit your job and struck out on your own. Is this the project you've been working on since then?",1312266287
2836059,comment,2835281,2835954,3,0,InclinedPlane,,,"There's this (from a google image search): <a href=""http://atomictango.com/wp-content/uploads/2009/10/spending-per-pupil.jpg"" rel=""nofollow"">http://atomictango.com/wp-content/uploads/2009/10/spending-p...</a>",1312266287
2836058,story,,,1,0,zeng1,"	Nike Free 5.0",http://www.nike-nikefree.com/nike-free-5-0.html,"the very type! Nike is indeed the vanguard of the trend, movement specialists. One pair of Nike Free 5.0 shoes design is to go in front, almost wild, whether it is my casual jeans, or professional training of tight pants, feel Free 5.0 with a special pull wind Ah ~ I was thinking, usually the pants to wear in jeans inside, to the gym, when the outer pants one off, do not have to change shoes! Haha, nice nice ah ~ ~ ~<p>Also recommended to run long-distance running long-distance lover faithful - a perspective to evaluate this shoe: foot care, foot care equivalent Ah! Go, where to keep ~",1312266256
2836057,comment,2835656,2835656,2,0,maximilianburke,,,"What services would you use for executing the trades?",1312266250
2836056,comment,2835901,2835901,4,0,ericd,,,"Wow, the remaining 400 mill is a 200k salary * 500 people * 4 years. Is Twitter past 500 employees?",1312266227
2836055,comment,2835901,2835901,3,0,drpancake,,,"""the 2-year-old startup"" -- nice bit of background research there.",1312266223
2836054,comment,2833604,2835729,3,0,Mithaldu,,,"I don't know about python, but ruby's gems are quite inferior. Just two points:<p>gems has no idea if any specific gem is already installed, so if you ask it to, it will just install over whatever is there, no matter if it's the same or not.<p>Additionally it does not automatically run tests and abort if they fail, so the chance of installing a broken gem over your existing working gem is pretty big.",1312266209
2836053,story,,,3,0,doubaokun,"Ask HN: Ways to show your online products or services",,"How to show your products or services to customer? 
Such as Google AD. Do you have any experience or other efficient way?",1312266208
2836052,story,,,2,0,Suraj-Sun,"Apple Blocks Sale of Galaxy Tab 10.1 In Australia",http://www.zdnet.com.au/apple-blocks-samsung-galaxy-101-in-aus-339319626.htm,,1312266101
2836051,comment,2832538,2832538,1,0,twilsndfdf,,,"First, this guy has a right to his opinion, and that's OK (I work at Google). But Google does not exist to serve ads. It exists to control the internet, to suck money out of it, and to keep other companies from encroaching on its territory. This is why it is attracting attention from Washington.<p>Back to the matter at hand---finding work...hard work...that is fulfilling is not easy, but I think it is worth it. Many people find this outside of what they do for a living, so the only criticism of this piece I have is that it suggests that it is ONLY possible to find fulfillment through the thing you do to pay the rent and put food on the table.<p>I've seen OPower's website. I like it. This is a great idea, and I'm happy to see it take off, so I can see this being very fulfilling work - perhaps the most important work of a lifetime, way more unique and special than one of Google's foot soldiers. But not everyone has that chance, that opportunity, a role like that, and yet everyone has the chance, the opportunity to orient themselves to seek out what is fulfilling to them, to lead a meaningful life, which often involves changing jobs! And I don't think the author understands that this is a universal drive, something which transcends the place of employment.",1312266087
2836050,story,,,1,0,Semteksam,"ICloud Goes Live (as Beta - for Developers)",http://www.macobserver.com/tmo/article/icloud_goes_live_as_beta_-_for_developers/,,1312266030
2836049,comment,2835346,2835941,3,0,Cushman,,,"Eh, I'm not committed to vim as an experience. I still like TextMate's rather point-and-click editing style, and Vico does that compellingly where MacVim... doesn't.",1312266017
2836048,story,,,1,0,79ts5y2f59,,http://www.yhmcsj.com/productshow.asp?pid=25,,1312265956
2836047,comment,2830998,2833925,0,0,vynch,,,"platitude alert!!",1312265907
2836046,comment,2835383,2835383,0,0,cpeterso,,,"But will the games be 100,000x more fun?",1312265879
2836045,comment,2835281,2835281,9,0,kaptain,,,"A lot of the discussion here is focused on teachers because we think that they are the keystone to a quality education. I would argue that teachers are a vital part but they lack the power that family and culture have. In many Asian cultures, the power of the family is crushing and the values that the parents have translate to intense pressure to do well in the education environment. It doesn't matter if your teacher is good; the message is that you will force yourself to succeed in education.<p>Even though Western values are quickly taking root here, (via the movies, music, etc.), there exists a tremendous amount of cultural pressure to ""excel academically"" (for some definition of this idea). I speak mainly for China because that is the education system I'm most familiar with, but I assume that we can find similar patterns in other Asian cultures: mom and dad work 5 am to 8 pm selling egg pancakes for 50 cents a pop on the side of the street while little Johnny (or Jenny) goes to school from 7 am to 4 pm with a two hour break between 12 pm and 2 pm. When they get home, they get to look forward to 6 hours of homework. No going to soccer, maybe some piano lessons if you're rich enough. Certainly no time for video games, making out with your girlfriend, creating a gang, doing drugs (although there are exceptions, I'm speaking in broad generalizations here).<p>But there does not exist this idea that you can be who you want to be, that somehow you can have a good life by developing other talents. There's also not this idea that you have a choice. I've encountered college students that tell me that they /have to/ graduate. This means that if they don't pass their tests, they will find some other way to get their diploma.<p>Compare this to your typical attitudes towards education in America. I'm not saying that one is better than the other, I'm just saying that there is so much pressure engrained in certain cultures ""to do well"" (i.e. score high on a standardized test) that makes it hard for American culture to compete.<p>This explanation does not explain why European cultures fare much better. I'd love to hear what some of the cultural attitudes towards education are from there as well as the strength of family influence.",1312265877
2836044,comment,2830998,2834260,1,0,vynch,,,"do u have a fanpage on facebook..!!",1312265811
2836043,comment,2835383,2835822,3,0,starwed,,,"Surely a lot of that is due, not to lighting/shadows/rendering, but to the incredible subtlety required of the animation?<p>HL2 has some pretty amazingly convincing faces, and that's obviously not because it has the best rendering engine.",1312265787
2836042,story,,,2,0,hybrid11,"Revolutionary ""Unlimited Detail"" Graphics",http://www.youtube.com/watch?v=00gAbgBu8R4&feature=player_embedded,,1312265739
2836041,comment,2835015,2835939,3,0,runevault,,,"Assuming the first five minutes is the same as the prologue of the book, they show up as a significant factor later down the line.",1312265710
2836040,comment,2835110,2835651,1,0,billpaetzke,,,"The Amazon Judging Panel will judge the qualified Entries using the following judging criteria:<p>(a) implementation and integration of the Paid Services;<p>(b) originality and creativity;<p>(c) likelihood of long-term success and scalability; and<p>(d) effectiveness in addressing a need in the marketplace (the Judging Criteria).<p><a href=""http://aws.amazon.com/startupchallenge/rules/"" rel=""nofollow"">http://aws.amazon.com/startupchallenge/rules/</a>",1312265696
2836038,comment,2835901,2835901,18,0,argus,,,"Keep it moving people.. there's no bubble here...",1312265652
2836037,comment,2835188,2835188,2,0,ebaysucks,,,"The amount of money involved is quite substantial.<p>There are rumors that one single person had 25000 bitcoins stored at mybtc. That's a very painful amount of money to be panicking about...<p>Another bad sign is that the company behind mybitcoin.com was apparantly set up off shore and nobody knows who the owner is (AFAIK).<p>Just like MtGox, MyBTC.com simply was the market leader by virtue of being first.",1312265588
2836036,comment,2835015,2835290,6,0,nahname,,,"The show is really for people who have read the books. It is accurate to the first novel and even contains a significant amount of dialog from it, but it doesn't frame things as well as George Martin's writing can. I especially noticed this watching the show with my wife (who has not read the books) and having to continually explain things to her that were obviously lacking in the show. Many of the characters actions and some events only seem aligned with the characters if you understand them from the novels.<p>In short, it lacks the depth that the books provide. This is probably true of most adaptations, but because they appear to be keeping as closely to the book as possible; it is much more noticeable.<p>As an aside, the Wire is my all time favorite television show.",1312265581
2836035,comment,2833060,2835690,1,0,DeusExMachina,,,"Stay tuned. Soon announcements to sign up will be made on Appsterdam website at <a href=""http://appsterdam.rs"" rel=""nofollow"">http://appsterdam.rs</a> and on Mike's blog at <a href=""http://mur.mu.rs"" rel=""nofollow"">http://mur.mu.rs</a>",1312265556
2836034,comment,2832715,2832715,2,0,UIZealot,,,"They sure love showing off screenshots on Mac OS X.  But when are they going to follow the basic Mac OS X convention of putting the close button on the left, and centering the tab titles?",1312265509
2836033,story,,,1,0,castroi1r33,"Men's Joey Flare Black Super T Lasso",http://www.truereligionoutlet2011.com/mens-joey-flare-black-super-t-lasso-p-34.html,,1312265486
2836032,comment,2833604,2835729,1,0,chromatic,,,"<i>I'm not going to google the rest but if they don't have one there is no reason why they can't.</i><p>That somehow fails to convince me that other language ecosystems parallel the CPAN in breadth, scope, maturity, and ecosystem. See CPAN Testers, for example.",1312265485
2836031,comment,2832538,2833725,2,0,Okvivi,,,"The ads are the means to an end, not the other way around. You do what you can to change the world and make a difference, you work on something amazing that you care about, the ads are (often times) your way to fund your ideas while helping other businesses thrive (by bringing in users through buying advertising).",1312265480
2836030,comment,2830026,2836025,1,0,ugh,,,"You are missing half a sentence there.<p>It looks like humans are very capable of understanding non-human-scale nature, just not intuitively.",1312265475
2836029,comment,2835383,2835972,5,0,stickfigure,,,"Maybe, you'd have to be an expert in rendering engines to know.  Too bad none of those work for the patent office or are ever likely to.",1312265392
2836028,comment,2835346,2835531,1,0,subleq,,,"Are there any other modal editors besides vim?",1312265380
2836027,comment,2833604,2834833,2,0,Mithaldu,,,"You should take a look at this: <a href=""http://www.reddit.com/r/perl/comments/j1ekt/writeonly_my_ass/"" rel=""nofollow"">http://www.reddit.com/r/perl/comments/j1ekt/writeonly_my_ass...</a>",1312265369
2836026,comment,2831646,2832333,1,0,NonEUCitizen,,,"It's not necessary to be fluent in German?",1312265358
2836025,comment,2830026,2831169,1,0,omarchowdhury,,,"""Doesn't mean that humans are able to understand..""<p>I guess all of the work in physics, chemistry and other sciences of the past thousands years was all in delusion?<p>Nothing was learned, nothing.",1312265329
2836024,story,,,101,13,neckbeard,"Amazon App Store: Rotten To The Core",http://shiftyjelly.wordpress.com/2011/08/02/amazon-app-store-rotten-to-the-core/,,1312265277
2836023,comment,2833604,2835624,1,0,chromatic,,,"I haven't written a lot of Joose code, but I use anonymous classes and store their constructors as attributes of a lexically scoped object I inject where I need it, so as to avoid global pollution. So far it works nicely.",1312265271
2836022,comment,2835383,2835383,11,0,vrode,,,"I'm sorry, but as much as I respect people both on Reddit and Hacker News, I wonder where does all the enthusiasm come from, when:<p>* demos show nothing new from a technological perspective<p>* the presenter sounds like a door-to-door salesperson<p>* as it seems to me, the only purpose of the demo is to raise a hype and somehow (I still don't understand) they succeeded<p>Euclideon got financed by Australian government.<p>I really hope the board took a critical approach and relied on at least /some/ technical expertise to grant these people A$ 2m. If they made this decision based just on a demo - I'm  moving to Australia at once, where I will invent a technology you have never seen in your whole life before. Ever.",1312265227
2836021,comment,2835346,2835600,1,0,guywithabike,,,"See: <a href=""http://blog.macromates.com/2011/lion-notes/"" rel=""nofollow"">http://blog.macromates.com/2011/lion-notes/</a>",1312265198
2836020,comment,2835346,2835904,1,0,simplify,,,"I personally don't, but I know some programmers who often do.",1312265127
2836019,story,,,1,0,jlkojopo006,"Kids Jordan Shoes For Cheap",http://www.shoes-for.com,,1312265022
2836017,comment,2834820,2835354,1,0,veidr,,,"The main thing wrong with Xcode 4 is that it is incredibly unstable, compared to any other major IDE (Xcode 3 included).<p>It crashes several times every day, without fail. It also does things like bork its own project files such that they can no longer be opened, and the programmer has to roll back to an earlier version and make the changes again.",1312265007
2836016,story,,,1,0,jlkojopo006,"Jordan Shoes For Kids",http://www.cheaperjordanshoes.com,,1312264979
2836015,comment,2836001,2836001,1,0,bazookaBen,,,"link is <a href=""http://bit.ly/rhoHkH"" rel=""nofollow"">http://bit.ly/rhoHkH</a>",1312264932
2836014,comment,2835383,2835978,6,0,greendestiny,,,"Splatting is when you draw with a point cloud but fill in in-between the points to make a solid surface during the rendering. It's only necessary if you get close enough to your point cloud that the points don't map to adjacent pixels.",1312264929
2836013,comment,2835212,2835668,3,0,delackner,,,"Wait, what?  Sony has mostly abandoned their Japanese production of Televisions.  They are made in China.  Maybe you're thinking of Sharp?",1312264919
2836012,comment,2835110,2835651,2,0,cperciva,,,"It's a competition to be the most photogenic AWS-using startup.<p>You get money; Amazon gets publicity (""look at these cool AWS-using startups!"") and information (""huh, I had no idea so many people were doing X... maybe we need to offer X as a service"").",1312264916
2836011,comment,2835346,2835906,7,0,sparky,,,"Sublime Text 2's config files have JSON-like syntax, but allow C (/* */) and C++ (//) style comments.",1312264884
2836010,comment,2835212,2835749,4,0,delackner,,,"In this case ""many"" means a minority.  The majority have voted with their dollars over the past several decades and overwhelmingly chosen products that are manufactured wherever is cheapest.",1312264855
2836009,story,,,23,14,jayzee,"Government Hankers for Hackers",http://www.nytimes.com/reuters/2011/08/02/technology/tech-us-usa-hackers.html?hp,,1312264849
2836008,comment,2829924,2831567,1,0,trusko,,,"I could consider writing mobile app where you would be able to attach the picture and complain. I want to keep my app generic.<p>I am not really looking for how to monetize the app. Well, I mean it woud be nice to see that happening, but so far it's just for fun.",1312264845
