ID,Type,Story,Parent,Points,Comments,Author,Title,URL,Content,Created
8782335,comment,8770732,8771851,0,0,thesz,,,"What will work for 1MHz won&#x27;t work for 10MHz and for even 50MHz you often need to redesign PCB. Breadboards stop working at about 10MHz - you will experience transient errors that will prevent your design from working properly at all.<p>Hardware is full of side effects, the higher are frequency and smaller the components, the harder they are manifesting themselves.",1419233000
8782334,comment,8775337,8775452,0,0,hmans,,,"Unless you need one of the new features on offer, there is no reason why you would need to upgrade right away. It&#x27;s perfectly okay to give a new Rails release a couple of months to settle, including gems that need to be compatible with it.",1419232987
8782333,comment,8781768,8781768,0,0,tomh,,,"I&#x27;m surprised no one has mentioned F*cked Company so far: <a href=""https://en.wikipedia.org/wiki/Fucked_Company"" rel=""nofollow"">https://en.wikipedia.org/wiki/Fucked_Company</a><p>I graduated from ArsDigita University in 2001. Right time, right place to see stuff completely implode. I must have sent 100+ resumes during 2001, and temped at Harvard for a while until getting a job through a friend in Feb 2002, in Java development. It wasn&#x27;t great, so I kept up the job search and finally went to grad school in 2003 while finding a part-time consulting job, also in Java. That kept me afloat until I graduated in 2006, and moved out of the USA.<p>Looking back, the companies acted like they could do no wrong, and it bit them hard. ArsDigita was a dot-com darling for a while, but it did crazy things like sign ten-year leases for a branch office that could seat 20-30 people and they had 2-3 actual employees in that city.<p>I remember in ArsDigita University, we weren&#x27;t based in the actual office but a place about a metro stop away (where ITA Software based themselves a decade later, yay lisp), in the basement. We started the program in September, and one day in March we were let into a larger, nicer office on the first floor and were told that AD also rented this part as well, anticipating another 20 or so programmers would work here as well. It remained empty until we moved out of the space later that year.",1419232964
8782332,comment,8780820,8780820,0,0,draugadrotten,,,"Update on twitter: <a href=""https://twitter.com/CthulhuSec"" rel=""nofollow"">https://twitter.com/CthulhuSec</a>
&quot;People have taken my mere suspicions way too seriously. I haven&#x27;t even mentioned a specific agency and the theories are already flowing.&quot;<p>Update on tor-talk:
<a href=""https://lists.torproject.org/pipermail/tor-talk/2014-December/036078.html"" rel=""nofollow"">https://lists.torproject.org/pipermail/tor-talk/2014-Decembe...</a><p>In the first original email, he writes &quot;At this moment in time I am under no gagging orders or influence from external parties/agencies. If no update is provided within 48 hours you may draw your own conclusions.&quot;<p>Please may I call your attention that this canary paragraph is missing from the latest tor-talk update. Draw your own conclusions.",1419232962
8782331,comment,8781131,8781589,0,0,kijiki,,,"10 mm wafers?  Were they ever that small?  I&#x27;ve never heard of less than 1 inch...",1419232944
8782329,comment,8781768,8781768,0,0,InclinedPlane,,,"Super terrible. First off, there were far fewer tech companies total. Worse, the internet was still immature. Which had a couple consequences.<p>One, there were just fewer jobs and yet a lot of people competing for them, so it was especially hard if you didn&#x27;t have a strong resume. Second, remote work was uncommon so if you didn&#x27;t already live in a tech hub city you were pretty screwed. Third, performing the hiring process via the internet was iffy. Going through the process back then often involved stuffing a printed resume into an envelope and mailing it somewhere along with a printed cover letter, then waiting for a return letter or a phone call (which will probably just go to your voicemail or answering machine).<p>Granted, the tech field was a little better but not much, and not universally.",1419232882
8782328,comment,8780402,8781415,0,0,jmnicolas,,,"Maybe I didn&#x27;t know about Alta Vista at the time, I can&#x27;t remember the search engines I was using back then, but what I remember is that every single search was returning thousands of porn results.<p>Google was a revelation, it actually found things !",1419232882
8782327,comment,8781768,8781768,0,0,joeblau,,,"When I went to college in 1999, our guidance counselor told us that for every student graduating with a Computer Science degree, there were 5 companies competing to hire them.  She said &quot;You have a 500% chance of getting a job with a Computer Science degree.&quot;  When I graduated in 2003, 1/3 of my classmates got a job doing software engineering, 1/3 went back to their job they did before they got into college (usually some sort of retail), and the final 1/3 went back to live with their parents and were unemployed.<p>The only area that was really hiring at the time was the Government, and I lived on the east coast so I was able to work for a Government contractor a few months after graduating.  It took quite a bit longer for some of my friends to finally use their degree and some still never have.",1419232860
8782326,comment,8781222,8782306,0,0,cgjaro,,,"Are you denying all these metrics as a whole, and implying that Bitcoin&#x27;s usage is either stagnating or declining?? You can&#x27;t be serious, can you?",1419232826
8782325,comment,8777509,8777576,0,0,jkbennett,,,"Thanks. I updated the summary on my profile and included my email and some of the details suggested in other comments as well (didn&#x27;t realize it was hidden).",1419232776
8782324,comment,8781768,8782248,0,0,hammerdr,,,"I certainly did not read that unclebucknasty was bothered by your phrasing, but rather was sharing a story and encouraging you to branch out into some &quot;not cool&quot; tech that could support you in possible bubble-burst future.<p>New suggestion, though. You should spend your time in school learning how to remove your prejudice. It&#x27;s pretty bad, and will hold you back more than not learning a particular language will.<p>P.S. Just to be clear, I was bothered by your ageism.",1419232736
8782323,story,,,1,0,aaronbrethorst,"The year in media errors and corrections 2014",http://www.poynter.org/news/mediawire/306801/the-year-in-media-errors-and-corrections-2014/#.VJLXRTbBgtA.twitter,,1419232728
8782322,story,,,70,59,kristianp,"Why Bitcoin’s Erratic Price Doesn’t Matter",http://blogs.wsj.com/moneybeat/2014/12/21/why-bitcoins-erratic-price-doesnt-matter/,,1419232725
8782321,comment,8769239,8772271,0,0,FeeTinesAMady,,,"The whole thing really does sound like he didn&#x27;t have any legitimate reasons to be doing that and is just deflecting criticism.",1419232717
8782320,story,,,81,24,sorpaas,"Show HN: My Personal Hacker News Reader",https://github.com/sorpaas/reread,,1419232694
8782319,comment,8781966,8781966,0,0,haidrali,,,"I think road might not be long instead its a U-turn u need to take",1419232648
8782318,comment,8777237,8781826,0,0,dbdr,,,"Suppose an opportunity comes up, but the technical debt in your software makes it exceedingly hard to respond to it. Either you still respond to it (with an obvious high cost), or you let the opportunity pass (and you &quot;pay&quot; the opportunity cost). So in a sense you <i>can</i> be forced to pay back your technical debt, if you include the &quot;cost&quot; of missed opportunities. But you are right that you always have the choice between those two, unlike real debt.<p><a href=""http://en.wikipedia.org/wiki/Opportunity_cost"" rel=""nofollow"">http://en.wikipedia.org/wiki/Opportunity_cost</a>",1419232607
8782316,comment,8780135,8781095,0,0,lectrick,,,"Do you know about Cathode?<p><a href=""http://www.secretgeometry.com/apps/cathode/"" rel=""nofollow"">http://www.secretgeometry.com/apps/cathode/</a>",1419232532
8782315,comment,8779955,8779955,0,0,rmason,,,"The ice business was very big in Michigan.  In fact the only museum in the world about the ice trade is located here in Port Huron:<p><a href=""http://www.knowltonsicemuseum.org/main.html?src=%2F"" rel=""nofollow"">http://www.knowltonsicemuseum.org/main.html?src=%2F</a><p>Port Huron is North of Detroit on the Canadian border across from Sarnia.  I&#x27;ve been there and its definitely worthwhile place to see.",1419232496
8782314,comment,8781522,8782284,0,0,nostrademons,,,"I think the point may be that once you embrace those constraints, there&#x27;s nowhere to go but a language with a fair bit of complexity.  While Go chose simply to not embrace those constraints, and tell developers &quot;You don&#x27;t actually need C++ performance, and you really want a GC, and you should ditch Python entirely instead of trying to embed Go in it.&quot;  Perhaps this is why Go found that their userbase didn&#x27;t actually consist of the expected C++ developers and instead ended up being mostly ex-Pythonistas who are willing to ditch Python entirely for better performance.<p>FWIW, I&#x27;m glad that Rust <i>didn&#x27;t</i> choose that path, as I&#x27;ve tried Go out and found that it really didn&#x27;t work for me as a Python substitute, and am now dreading the day when I (hopefully) will have to rewrite parts of my startup in C++ for performance.  I&#x27;m actually seriously considering Rust as a substitute here, but would like to see more stability in the core language before investing serious time learning it.<p>But I&#x27;m also someone who has never shied away from complexity in a language before, which probably puts me more in the &quot;likes C++, Ruby, and D&quot; camp even though I chose Python as my main scripting language.  One of my main concerns with Rust is whether it will be possible to hire & manage developers who can work effectively in it, since I know that not everyone is as willing to learn new languages and language features as I am.",1419232474
8782313,comment,8779812,8782058,0,0,Rohansi,,,"I&#x27;m always a bit skeptical of the libraries that generate IL. One of the biggest reasons I consider scripting is to support hot swapping, but the CLR doesn&#x27;t do a good job with that.<p>I have used CS-Script before and it&#x27;s decent. The assemblies it generates are eligible for garbage collection (if you use CSScript.Evaluator) but it also has annoying limitations. Everything must be defined before it&#x27;s used and must be in one file.",1419232458
8782312,comment,8781245,8781374,0,0,nightwolf,,,"I just wanted to thank you for ag. It&#x27;s literally the most used command in my shell history and I consider it crucial to my work. So, thanks!",1419232314
8782311,comment,8781768,8781768,0,0,arfliw,,,"As somebody who hired developers at that time, it was far different from today. You could put a job listing up on Craigslist and have an inbox full of 100+ developers, many of whom had great resumes at name brand companies, who were willing to work for a few grand a month. Today it takes $100k+/year to get good people and even that isn&#x27;t enough. You have to give them a reason beyond money to pick you over all of the other offers they are getting. They didn&#x27;t care back then, as long as you could pay them.",1419232242
8782310,story,,,51,1,Thevet,"When Threatened by Worms, Bacteria Summon Killer Fungi",http://phenomena.nationalgeographic.com/2014/12/19/when-threatened-by-worms-bacteria-summon-killer-fungi/,,1419232231
8782309,story,,,2,0,Nicholas_C,"Mensen Ernst",http://en.wikipedia.org/wiki/Mensen_Ernst,,1419232150
8782308,comment,8781114,8781539,0,0,haidrali,,,"82% is really a astonishing number, i think now a days people don&#x27;t want to fill up long sign up forms ( who has time for it ) that&#x27;s why they prefer social sign up ....",1419232134
8782307,story,,,1,0,DAddYE,"N. Korea threatens strikes on US amid hacking claims",http://news.yahoo.com/n-korea-threatens-strikes-us-amid-hacking-claims-015728235.html,,1419232106
8782306,comment,8781222,8782272,0,0,sanswork,,,"So many vanity metrics though.<p>Coinbase and blockchain publish wallet numbers which is used here and is another useless.<p>When they start publishing MAU I&#x27;ll be impressed until then I&#x27;ll just see wallets as a vanity number that is always going up.<p>Number of uniquely used addresses is being inflated by actions like the one I post about above.<p>Merchants and Merchants annual revenue are again vanity metrics.  Merchants like wallets above does not accurately reflect current demand(go look up every story of people trying to travel using coinmap and finding almost all the merchants listed no longer accept bitcoin).  Merchants annual revenue inflates the importance of companies like Overstock and Dish.<p>If VC investment was a good metric to follow we&#x27;d all be using Flooz and Beenz.<p>Hashrate has more to do with the improvements in ASIC miners than growth in usage/adoption.<p>And number of bitcoin repos is silly since everyone in the bitcoin space wants to be a bitcoin developer so the number of vanity repos is astounding.",1419232104
8782305,comment,8781522,8782277,0,0,nostrademons,,,"I&#x27;d revised the post several times before posting it; initially I wanted to label the categories as &quot;OAOOW&quot; (One and Only One Obvious Way) vs. &quot;TMTOWTDI&quot; (There&#x27;s More than One Way To Do It), then I figured that using the labels from &quot;Worse is Better&quot; more accurately captured the intent of the grandparent post, then I went back and re-read &quot;Worse is Better&quot; again to make sure I had a fair characterization of Dick Gabriel&#x27;s argument.  In the process C++ switched categories, but I forgot to update the first mention.<p>...now that I&#x27;m rereading it again, I wonder if my original phrasing was better.  The idea that I want to capture is that there&#x27;s a difference in how these languages approach corner cases: the C/Python approach is to punt and say &quot;We&#x27;re not designed for that&quot;, while the C++/D/Ruby approach is to add a feature to the language to solve that one case.  C++ is basically what happens when you extend a New Jersey school language to cover the corner cases that it originally chose to ignore; that doesn&#x27;t actually make it MIT school (which is more a philosophy on <i>how to design</i> systems, not how they end up), but it does put it in a different category from C and Python.",1419231837
8782304,comment,8780385,8780637,0,0,Bahamut,,,"Not sure why you got downvoted - when I was a junior developer, I got tasked with investigating building a simple app with Backbone, Ember, and Angular in order to determine what to use going forward for the non-profit I was working at (I didn&#x27;t make the call what framework to use, I was just the test monkey for how to implement a simple app in all three frameworks).  Angular turned out to the easiest by far to get work done with exposure to some advanced concepts - Backbone&#x27;s documentation was very confusing since everything was in a flat list with high level details buried in there & not enough explanation, and Ember&#x27;s templating system was very rigid and highly dependent on build processes for someone who had no experience working with tools such as grunt or gulp at the time.<p>React is probably the best candidate to achieve that simplicity along with Angular, although I would give Angular the edge, simply because it does not rely on tooling to build a small app and still benefits just as well from it when it is present.  The documentation, even two years ago, was better than Backbone&#x27;s at the time (and as far as I can tell from a recent study of Backbone, still is) - Ember&#x27;s might have been a little better, but it also threw more stuff at you upfront.<p>The expert can probably work with all of these frameworks just fine - in the end, finding what framework (or no framework) jives with you is the best for your long term development.  Become an expert with one, then experiment with others to draw good ideas from them and incorporate it into your code style, that is what separates the good developers from the rest.",1419231786
8782303,comment,8781407,8782019,0,0,Sivart13,,,"So a helmet allows you to survive cycling incredibly unsafely?<p>Was the student going down a hill? I&#x27;d have to be facing some major deadline to be going 25mph on a bike on a straightaway.",1419231709
8782302,comment,8770659,8771729,0,0,briantrice,,,"Hum. I hear you. I&#x27;ve tracked demos come and go with their hype and lack of delivery.<p>Are they fads, though, inherently, or because of a lack of cultural and financial support? I like to learn from all of them but have no idea how to make a new effort that is worth more than just a splash of publicity.<p>My current bet is on just getting smart software in the hands of a wide audience that don&#x27;t listen to programming culture.<p>What else can one do? Who are we rewarding by the way things work now?",1419231691
8782301,comment,8781522,8782219,0,0,pcwalton,,,"What HKT would let you do is to write a <i>generic</i> &quot;try&quot; function that works for all &quot;error-like things&quot;, instead of having to have a separate try! macro for every error type. Except that that isn&#x27;t the case any longer, because we now have the FromError [1] trait, which means that in practice try! works for custom error types as well.<p>Instead, what HKTs would actually be useful for is something else entirely: generic algorithms that need to (for example) work with different kinds of collections&#x27; iterators and can be specialized for them at runtime, without paying the price of allocating the iterators on the heap. For example, consider a graph algorithm that&#x27;s parameterized over the type of graph. (Note that I&#x27;ve never actually needed to write one of these algorithms in a generic way myself, but I can see it being useful in some circumstances.)<p>What HKT is not there for is Haskell-like monadic &quot;do&quot; notation. That simply isn&#x27;t idiomatic Rust, and I don&#x27;t foresee it becoming so in the future. The try! macro is the way you do this kind of thing, and it&#x27;s already shipping today without HKT as a type system feature.<p>[1]: <a href=""http://doc.rust-lang.org/std/error/"" rel=""nofollow"">http://doc.rust-lang.org/std/error/</a>",1419231610
