ID,Type,Story,Parent,Points,Comments,Author,Title,URL,Content,Created
8782397,story,,,1,0,coolme,"Save the real elf of your phone battery",http://www.yileapp.com/coolme/,,1419235181
8782396,comment,8780135,8782177,0,0,ido,,,"What killed GG is that for the longest time it was swamped with spam. Took them surprisingly long to get on top of that.",1419235132
8782395,comment,8781522,8782045,0,0,markbao,,,"Yes, that&#x27;s what I used—however, I just realized I may have been conflating the difficulty of doing package management in Rust with some packages that I used that were enormously difficult to use or were outdated (speaks to the pre-1.0 thing, I suppose).",1419235125
8782394,comment,8781435,8781598,0,0,msiebuhr,,,"AFAIK, PHK has written quite a bit of the FreeBSD kernel, most of Varnish (and a few other popular bits) in C.<p>I think it&#x27;s safe to say that he&#x27;s forgotten more about C/kernel/low-level/... programming than HN&#x27;ers will ever know.",1419235113
8782391,comment,8781768,8782353,0,0,tomh,,,"There&#x27;s actually a few takes on the history, here: <a href=""https://en.wikipedia.org/wiki/Philip_Greenspun#ArsDigita_histories"" rel=""nofollow"">https://en.wikipedia.org/wiki/Philip_Greenspun#ArsDigita_his...</a><p>But you are right, that CEO was not the right guy for the job. His personality + Philip&#x27;s no-bullshit attitude ended it.",1419234940
8782390,story,,,2,0,antoaravinth,"Does pair programming improve the correctness of software?",http://skeptics.stackexchange.com/questions/25159/does-pair-programming-improve-the-correctness-of-software,,1419234924
8782388,story,,,8,0,yegor256a,"Immutable Objects Are Not Dumb",http://www.yegor256.com/2014/12/22/immutable-objects-not-dumb.html?2014-51,,1419234902
8782387,comment,8781768,8781768,0,0,santacluster,,,"For anyone with actual skill, nothing really changed. But then again, for people with actual skill nothing has really changed throughout the last 25 years, despite the crisis.<p>Yes, there was a huge market through Y2K and the dot-com bubble for people who knew how to operate a keyboard, and that market collapsed. But those people where as much developers as I am a surgeon because I know how to apply a band-aid. Personally I was glad the bubble burst, because it became increasingly harder to avoid landing in a place where most of the &quot;developers&quot; weren&#x27;t utterly incompetent.<p>HN isn&#x27;t a representative audience though. Most of those people wouldn&#x27;t be on the early 2000&#x27;s equivalents of HN either. If this is a bubble and it bursts, most of HN-ers that get affected won&#x27;t be out of work for more than a month.<p>Many may have to take a boring enterprise gig, but that&#x27;s pretty much how the second wave of internet-companies started: bored and with time on their hands, many hackers started to work on what was then called &quot;social software&quot; projects, which eventually resulted in a wave of social media startups.<p>Things may be different in SV, especially when it comes to the balance of wages vs cost of living, but SV is an outlier.",1419234845
8782386,comment,8782202,8782202,0,0,devnonymous,,,"Not too long ago, I saw <a href=""https://www.interviewcake.com/"" rel=""nofollow"">https://www.interviewcake.com/</a> being mentioned here. I found it interesting enough to sign up for it even tho&#x27; I wasn&#x27;t interviewing at the time.<p>I have a little review (/rave) about the site here: <a href=""http://lonetwin.github.io/blog/html/2014/12/09/interview_cake.html"" rel=""nofollow"">http://lonetwin.github.io/blog/html/2014/12/09/interview_cak...</a>",1419234830
8782385,comment,8780550,8781006,0,0,julespitt,,,"Yes, and there&#x27;s more - Portland cement is made of constituent parts, each presumably extracted from different stones (using energy intensive processes) and then precisely recombined in certain ratios. Roman concrete, lime mortar, and Natural cement are made largely from just moderately heating limestone.",1419234817
8782384,comment,8781435,8781600,0,0,msiebuhr,,,"Check his series of posts on the subject: <a href=""http://phk.freebsd.dk/time/index.html"" rel=""nofollow"">http://phk.freebsd.dk/time/index.html</a><p>(TL;DR: Yes, he thought things through and are ntimed is implementing a few new tricks.)",1419234802
8782383,comment,8781131,8781615,0,0,frozenport,,,"No. Chemicals are different, structures are different, design is different (cmos), etching equipment is different. I am at a loss to name a recognizable thing.",1419234769
8782382,story,,,2,0,hannob,"Beginner's Guide to Fuzzing Part 3: Instrumented fuzzing",https://fuzzing-project.org/tutorial3.html,,1419234744
8782380,story,,,4,0,anonfunction,"The Star Wars API Is Live",http://swapi.co//,,1419234726
8782379,comment,8781222,8782326,0,0,sanswork,,,">Are you denying all these metrics as a whole<p>I&#x27;m denying the ones I&#x27;ve commented on are important.<p>>implying that Bitcoin&#x27;s usage is either stagnating or declining<p>I think it is but thats not what I&#x27;m implying.  I&#x27;m implying that people heavily invested in bitcoin tend to use vanity metrics like this.<p>That said the things I look at that make me believe bitcoin is stagnating/declining are things like the continued slide of the price over the year, Bitcoin Black Friday 2014 being a huge failure, Overstock missing their bitcoin sales expectations by 17 million dollars.  Basically every vendor I&#x27;ve seen comment on sales has said there have been pretty much none this year.  The fact that 2014 was meant to be the year of bitcoin and there has been no breakout in the general public.  Everyone seems vaguely aware of bitcoin but no one is investing any time in learning anything about it because it solves problems that most people don&#x27;t care about(freedom) and creates problems they do(security).<p>Now I just see people in the community rallying around remittance and the killer app that will save bitcoin but the actual transfer of funds isn&#x27;t the expensive part of remittance the compliance around the transfer of funds is and the existing services that do remittance cheaper using bitcoin only work now because they are ignoring compliance completely.  They will either get more expensive or be shut down in the near future.",1419234706
8782378,comment,8782320,8782320,0,0,alexivanovs,,,"I think some work needs to be done on how the content flows, at the moment it doesn&#x27;t feel very read worthy, rather - a lot of text stuffed on a single page. Perhaps, adding separate containers/divs for each specific content piece might fix this problem? At the end of the day, I want to read stuff, not browse it. :)",1419234703
8782377,comment,8780550,8781677,0,0,julespitt,,,"I second the recommendation of Diana Kleiner&#x27;s video lectures. Absolutely fantastic, thorough, and well explained.",1419234542
8782376,comment,8780820,8781125,0,0,alexivanovs,,,"It has already happened, you just don&#x27;t know about it, and neither do I. I&#x27;ve had experience in the <i>scene</i> for many years. Though I don&#x27;t go there these days, I can almost guarantee that the big players have long had their databases downloaded and spread throughout multiple nations.<p><i>Your guess is as good as mine...</i>",1419234524
8782375,comment,8780313,8780559,0,0,luoin,,,"FWIW, funding for Tribler has significantly dried up, probably also due to this.<p>When I read about this sequence of severe fundamental security screw-ups in Tribler, it really scares me that Pouwelse has recently started to position himself as a cyber security expert.<p>I don&#x27;t think that TU Delft considers Tribler a publicity stunt, but that they see it as a serious initiative, even though it probably does more harm than good to both its users and the university. Outside the academic papers and review comment process, there often isn&#x27;t much of a feedback channel back into academia and giving the mass of academic conferences, it is only a matter of persistence to get something (bad) accepted.",1419234517
8782374,comment,8780135,8781626,0,0,jonah,,,"And the NSA:<p><a href=""http://article.olduse.net/14337@mgweed.UUCP"" rel=""nofollow"">http://article.olduse.net/14337@mgweed.UUCP</a><p><a href=""http://article.olduse.net/839%40houxf.UUCP"" rel=""nofollow"">http://article.olduse.net/839%40houxf.UUCP</a><p><a href=""http://article.olduse.net/221%40looking.UUCP"" rel=""nofollow"">http://article.olduse.net/221%40looking.UUCP</a><p><a href=""http://article.olduse.net/237%40celerity.UUCP"" rel=""nofollow"">http://article.olduse.net/237%40celerity.UUCP</a>",1419234494
8782373,comment,8782069,8782337,0,0,axg,,,"This game is actually a lot simpler than the one you link to. Just jumping.<p>It was originally inspired by the Chrome T-Rex easter egg (<a href=""https://plus.google.com/+FrancoisBeaufort/posts/LUtLvQYMFZK"" rel=""nofollow"">https://plus.google.com/+FrancoisBeaufort/posts/LUtLvQYMFZK</a>)",1419234464
8782372,comment,8780135,8782316,0,0,stevenrace,,,"Alternately, there is &#x27;cool-retro-term&#x27;:<p><a href=""https://github.com/Swordfish90/cool-retro-term"" rel=""nofollow"">https://github.com/Swordfish90/cool-retro-term</a>",1419234458
8782371,comment,8781407,8781407,0,0,r109,,,"Can they make a model wear the grips pick up your heart rate? PLEASE!?!? This would be the coolest most insanely awesome mod I&#x27;d to to my bike! v2 v2!",1419234358
8782370,comment,8781522,8782239,0,0,wtf_is_up,,,">Go in my opinion is the best proof that our industry is fashion driven.<p>It&#x27;s not though. What is fashionable about Go? Most testimonies I&#x27;ve seen state solid reasons for choosing it. Nobody claims it to be a marvelous language like Haskell. It&#x27;s a simple language that&#x27;s easy to pick up, implement an idea, and deploy. Much like python, but with much greater performance.<p>I don&#x27;t see what fashion has to do with it.",1419234332
8782369,comment,8782322,8782322,0,0,hawkice,,,"The erratic price prevents it from being a store of value or a unit of account. So it is a currency that clocks in as a medium of value transfer only. Even then, the transfer involves another currency on either end in almost all cases.",1419234264
8782368,story,,,1,0,ottot,"Congress Steps in to Protect the Internet",http://www.wsj.com/articles/gordon-crovitz-congress-steps-in-to-protect-the-internet-1419206113,,1419234254
8782367,comment,8777904,8779929,0,0,jaredsohn,,,"One of my first thoughts when I saw this post was that it would be a site where you give it an existing URL-shortened link and it could tell you if it safe to go to it or not.  I&#x27;m thinking such a site may be more useful in that it lets the consumer decide to check for NSFW instead of the producer.<p>Also, this could be pretty useful if associated with a browser extension that changes existing links to use the service.",1419234218
8782366,comment,8782069,8782069,0,0,alexivanovs,,,"This is what inspires me to continue learning more about programming, anyone else feel the same way?",1419234196
8782365,comment,8781522,8781792,0,0,Cyther606,,,"Sums up the appeal of Nim [1], which recently benchmarked favorably to C++ [2].<p><pre><code>    import rdstdin, strutils
    
    let
      time24 = readLineFromStdin(&quot;Enter a 24-hour time: &quot;).split(&#x27;:&#x27;).map(parseInt)
      hours24 = time24[0]
      minutes24 = time24[1]
      flights: array[8, tuple[since: int,
                              depart: string,
                              arrive: string]] = [(480, &quot;8:00 a.m.&quot;, &quot;10:16 a.m.&quot;),
                                                  (583, &quot;9:43 a.m.&quot;, &quot;11:52 a.m.&quot;),
                                                  (679, &quot;11:19 a.m.&quot;, &quot;1:31 p.m.&quot;),
                                                  (767, &quot;12:47 p.m.&quot;, &quot;3:00 p.m.&quot;),
                                                  (840, &quot;2:00 p.m.&quot;, &quot;4:08 p.m.&quot;),
                                                  (945, &quot;3:45 p.m.&quot;, &quot;5:55 p.m.&quot;),
                                                  (1140, &quot;7:00 p.m.&quot;, &quot;9:20 p.m.&quot;),
                                                  (1305, &quot;9:45 p.m.&quot;, &quot;11:58 p.m.&quot;)]
    
    proc minutesSinceMidnight(hours: int = hours24, minutes: int = minutes24): int =
      hours * 60 + minutes
    
    proc cmpFlights(m = minutesSinceMidnight()): seq[int] =
      result = newSeq[int](flights.len)
      for i in 0 .. <flights.len:
        result[i] = abs(m - flights[i].since)
    
    proc getClosest(): int =
      for k,v in cmpFlights():
        if v == cmpFlights().min: return k
    
    echo &quot;Closest departure time is &quot;, flights[getClosest()].depart,
      &quot;, arriving at &quot;, flights[getClosest()].arrive
</code></pre>
[1] <a href=""https://github.com/Araq/Nimrod/wiki/Nimrod-for-C-programmers"" rel=""nofollow"">https://github.com/Araq/Nimrod/wiki/Nimrod-for-C-programmers</a><p>[2] <a href=""https://www.reddit.com/r/programming/comments/2pvf68/armv7_vs_x8664_pathfinding_benchmark_of_c_d_go/cn0fkn1"" rel=""nofollow"">https://www.reddit.com/r/programming/comments/2pvf68/armv7_v...</a>",1419234187
8782364,comment,8780820,8782352,0,0,draugadrotten,,,"The &quot;under no influence&quot; part is missing.",1419234140
8782363,story,,,4,0,rasbt,"Star Wars API: The First Data Viz",http://nbviewer.ipython.org/github/rasbt/pattern_classification/blob/master/data_viz/swapi_viz.ipynb,,1419234111
8782362,comment,8768754,8771012,0,0,FeeTinesAMady,,,"That&#x27;s a really interesting comment, and I think you&#x27;re correct. Look at feminism today vs. back when it was actually relevant. Now, since it can&#x27;t credibly be argued that women are oppressed in Western nations, it&#x27;s turned into a movement about hating men and oppressing them.",1419233958
8782361,comment,8780126,8781503,0,0,x0x0,,,"The blood work at my annual checkup cost $600.  Test blood twice a year, plus send a nurse out to get it, and you&#x27;re in for $1300.<p>Monthly interviewing to monitor diet adds another couple hundred dollars.",1419233920
8782360,comment,8779116,8779918,0,0,hemezh,,,"I also feel that algorithm based recommendation services are not going to be better than humans at least for a long time. Algorithms can recommend related stuff well(?) but that&#x27;s not enough as our tastes keep changing and as you said they don&#x27;t take risk.<p>I am thinking of building a radio like service where the playlist is curated by people listening to it. Do you think it&#x27;s worth building? Any other inputs you&#x27;d like to add?",1419233898
8782359,comment,8781522,8782131,0,0,TheHydroImpulse,,,"> there could be bugs in unsafe code in the standard library<p>For any embedded work or kernels, you wouldn&#x27;t be pulling in the standard library via a `#![no_std]` attribute.<p>But you&#x27;re right that bugs in the compiler could produce safety issues.",1419233896
8782358,comment,8782118,8782209,0,0,hariharan_uno,,,"The link works fine for me. Try loading it again. Oh BTW the OP is not the author of the article.",1419233772
8782357,comment,8781664,8781992,0,0,r109,,,"I&#x27;d like to add that in my specific area of the United States, Washington State, we&#x27;ve seen a huge move from international buyers swooping in on investment properties that became available on the market post-2008. There&#x27;s a big move on Chinese and Canadian investors moving in on foreclosures, low interest rates, and honest to god: cold-hard-cash buyouts (it&#x27;s extremely rare but in my market it&#x27;s happened a few times). I&#x27;m in my mid-twenties and I feel like my significant other and I have to both be working full-time jobs at $20+ an hour to afford a 3 bedroom house anywhere near a reasonable commute from work. We also don&#x27;t want to be stuck with the burden of upkeep maintenance, property tax, and unpredictable economy. Back on the topic of marriage; we&#x27;re still iffy on the idea based off of fear that if our marriage went south we couldn&#x27;t imagine dealing with the divorce; both psychological and financially speaking... However, our financial situation is a bit different in terms of debt and interest rates. We are both afraid of being to far sunken in debt.",1419233735
8782356,comment,8781768,8781845,0,0,kokey,,,"I used to say that the bubble bursting got the people who quickly got themselves an MCSE so they can &#x27;work in IT&#x27; and get paid well while they have no IT skills, to go back to the jobs they should have been doing like sales.<p>That&#x27;s what happened, and many of them then ended up as estate agents.",1419233702
8782355,comment,8777509,8781028,0,0,jkbennett,,,"Thanks for the feedback. Not the best phrase I guess.<p>I also agree that good fit in a team is critical and couldn&#x27;t agree more with your notion of the subconscious coming up with most of the breakthrough ideas. I rely on that heavily using interest, frustration and tinkering as the guideposts, figuring out the right question and then doing something else or nothing at all and letting the big part of the mind do its thing in its own time. Might be the best habit I ever developed.",1419233693
8782354,comment,8780313,8780456,0,0,sschueller,,,"Instead of all these crypto expert complaining about how bad it is why doesn&#x27;t any of them fix it and make a pull request or fork the project if it is at such a dismal state?<p>Maybe the reason so many coders are bad at crypto is because the crypto community is mostly spooks and the rest are unwilling take the time to explain and teach what they know.<p>Instead they spend hours writing and analyzing other peoples work just so they can gloat on how bad it is.",1419233692
8782353,comment,8781768,8782333,0,0,x0x0,,,"Ars Digita was fucked by the ceo VCs brought in.  You can read some very unhappy posts about it from Phil Greenspun.  He took them down, I presume as part of a lawsuit settlement, but you can still find them if you google.<p>Actually, here&#x27;s a copy
<a href=""http://waxy.org/random/arsdigita/"" rel=""nofollow"">http://waxy.org/random/arsdigita/</a>",1419233654
8782352,comment,8780820,8782332,0,0,dmix,,,"Which latest tor-talk update is missing the canary?<p>The one you linked to says:<p>> 7. Again, at this moment in time I am under no gagging orders or unreasonably withholding information under orders.",1419233624
8782351,comment,8781245,8782187,0,0,zobzu,,,"Not all that much to be honest. it has much more features than the clones and is slower in some conditions.<p>I suspect improving grep would have been a better idea than making tools that aren&#x27;t as versatile as grep, but...",1419233608
8782350,comment,8781768,8781768,0,0,x0x0,,,"You all are forgetting FC.  Fucked was the front page of the startup scene.  What was the bubble like?  Discovering you were laid off by reading it on FC.  Thanks to archive for saving all the content.<p>Oh, and having a friend who is a very good engineer (ms cs from mit) take a job for $45k to put a dent in their mortgage.<p><a href=""https://web.archive.org/web/20010201083400/http://fuckedcompany.com/"" rel=""nofollow"">https://web.archive.org/web/20010201083400/http://fuckedcomp...</a>",1419233504
8782349,story,,,29,2,dthal,"A Meadow in the Ocean with 'Flowers' Everywhere",http://www.npr.org/blogs/krulwich/2012/12/17/167469845/suddenly-theres-a-meadow-in-the-ocean-with-flowers-everywhere,,1419233500
8782348,story,,,1,0,appscue,"Simple, Powerful App Promotion Tool for Mobile Developers",http://www.appscue.com,,1419233492
8782347,comment,8776133,8777235,0,0,hellgas00,,,"I see what you are saying, but I would have to guess that it&#x27;s so very rare that the authorities know for sure that a suspect has information to give, that it is almost irrelevant to debate the scenario.<p>Not to mention, the use of the ticking-time bomb scenarios were used to justify use of torture by the CIA. Which entity determines if a suspect has usable information, to stave off &#x27;improper&#x27; use of torture? If you can&#x27;t trust the CIA to make a definitive call in that regards, why even consider torture as an option in any form?",1419233449
8782346,comment,8781768,8782143,0,0,kokey,,,"Unix admin here too.  I also spent more time with Linux and FreeBSD during the dotcom era, but, strangely, for a lot of enterprise companies because I was working more on the security side of things.  When I had to cast my net wider after the bubble burst, and after having moved to a new country, my lack of deep enterprise Solaris experience did bite me.  Fortunately after a few years Red Hat was starting to do really well in the enterprise market and I ended up in banking, where I picked up a bit of Solaris again but I didn&#x27;t really bother too much since the bank was actively getting rid of Solaris.  I suspect many technologies used in the startup world now will get taken on in the enterprise after the bubble burst, but it will certainly take a few years and these companies will be weary of people who doesn&#x27;t have enterprise experience.",1419233419
8782345,comment,8780820,8781662,0,0,adrianN,,,"Ada is a language that is specifically for writing secure code.",1419233354
8782344,comment,8781114,8781114,0,0,dragonwriter,,,"I rather strongly prefer Google Account integration to most other signup options (<i>particularly</i> for a specifically Android-based app), but I&#x27;d prefer service-specific signup to most &quot;social&quot; options.",1419233273
8782343,comment,8781245,8782108,0,0,chingjun,,,"Because we now have [ag](<a href=""https://github.com/ggreer/the_silver_searcher"" rel=""nofollow"">https://github.com/ggreer/the_silver_searcher</a>), which is similar to ack, but much faster",1419233230
8782342,comment,8779821,8780009,0,0,raldi,,,"It&#x27;s emphatically <i>not</i> an interpreter. It&#x27;s a just-in-time, line-by-line compiler.",1419233230
8782341,comment,8781768,8781768,0,0,vpeters25,,,"> What were job-prospects like?<p>The market, at least in Dallas/Austin was barren. The only new job postings on job boards were repost by recruiters looking to pad their portfolios.<p>> How were your wages affected?<p>I keep lowering my expected hourly rate/salary weekly. When I got it down to 50% a recruiter called me back and got me something.<p>> Did recruiters simply cease to exist?<p>All the opportunistic, bad recruiters crawled back to whatever hole they came from. Same with all the unqualified &quot;bandwagon programmers&quot; who cashed on the bubble and gave all of us a bad reputation forcing hiring managers into brutal interviewing processes.<p>Recruiters were let go too, agencies closed or downsized. A few good ones remained.<p>> More to the point, what advice do you have for developers who want to be well-insulated if/when the next crash happens?<p>Well first, you got to have some sort of financial cushion and a plan to cut down expenses to the bone: the day I was laid of on 2001 I canceled my phone, cable, any other superfluous monthly expense. Also moved to smaller apartment as soon as I could. I knew it was going to be rough for a while.<p>Next is to know which industry to aim for: after 9/11 lots of money flowed to military contractors so I started aiming for that industry. I ended up programming for a company that provided services for the military until the market recovered.",1419233185
8782340,comment,8781407,8782019,0,0,Someone,,,"Yes, helmets do provide some protection, but so would helmets for pedestrians, five-point safety belts in cars, safety belts in buses, etc.<p>Unless it was seriously down hill or with a serious tail wind, and she was extremely lucky, I bet she wasn&#x27;t doing 25-30 mph.<p>I think that bet is safe because the world one hour record for women is about <a href=""http://en.m.wikipedia.org/wiki/Hour_record#One_Hour_records_.28female.29"" rel=""nofollow"">http://en.m.wikipedia.org/wiki/Hour_record#One_Hour_records_...</a> 29 mph.<p>Also, a bicycle helmet doesn&#x27;t do much good in a head-on impact at 25 mph. It only gives you a few mm of deceleration distance. So, if the impact was at 25mph, that dent in the car likely did way more for her than her helmet.",1419233171
8782339,comment,8781114,8781114,0,0,haris4063,,,"I prefer social media sign up",1419233078
8782338,comment,8778990,8780217,0,0,Sami_Lehtinen,,,"It&#x27;s wonderful to see posts like this. I&#x27;ve been often very frustrated by exactly similar issues. But this seems to be much more common than I thought.<p>One guy used select max(id) from table; for over 5gb table without id column index, periodically. It took quite a while every time maxing the disk I/O.<p>Usually developers claim that the server doesn&#x27;t have enough memory or it should jave more cores and we should buy enterprise SSDs. Which is simply insane when you could fix the issue very easily.",1419233049
8782337,comment,8782069,8782069,0,0,sirsar,,,"Reminds me of the Impossible Game [0]. Very similar game mechanics, just missing platforms that can be landed on. (Or, at least, I didn&#x27;t get far enough to see them).<p>[0] <a href=""http://www.flukedude.com/theimpossiblegame/"" rel=""nofollow"">http://www.flukedude.com/theimpossiblegame/</a>",1419233032
8782336,comment,8780820,8781429,0,0,Shank,,,"Pretty sure Jake Appelbaum stated at 30c3 that the Mouse Jiggler will cause the system to lock immediately if plugged into Systemd [0].<p>[0]: <a href=""https://www.youtube.com/watch?v=vILAlhwUgIU"" rel=""nofollow"">https://www.youtube.com/watch?v=vILAlhwUgIU</a>",1419233031
