ID,Type,Story,Parent,Points,Comments,Author,Title,URL,Content,Created
8290673,comment,8289577,8290412,1,0,Padding,,,"I&#x27;m curious too.<p>What&#x27;s the &quot;turnover&quot; with those clothes - i.e. how often do you buy new ones and throw out the old ones? Ever gotten any weird looks for running around in mostly the same outfits? What do you do when you need a suit?<p>What do you do about your data? Do you carry any additional HDDs in those backpacks? Don&#x27;t you keep any spare hardware around for when things break to be able to replace them quickly?<p>What about legal documents (birth certificate, graduation certificates, tax declarations, etc.)? Do you store them somewhere safely, or keep them on you?<p>Also, do you have any allergies? One thing I allways seem to have too little of when travelling is napkins/tissues.<p>What do you do for more mundane things like scissors and paper and priting stuff?",1410277125
8290672,comment,8289676,8290513,1,0,bhhaskin,,,"I am very happy to see the throttling.",1410277112
8290671,comment,8290563,8290563,3,0,jk215,,,"Probably anything government tech related.",1410277106
8290670,comment,8287673,8288166,1,0,JimmaDaRustla,,,"Except they don&#x27;t have the CVV, so, no...no it can&#x27;t.",1410277090
8290669,comment,8289679,8289986,1,0,makmanalp,,,"I was wondering the same. Mayavi seems more abstracted vs this is has more low-level opengl guts exposed",1410277090
8290668,story,,,2,0,zimbu668,"ISIS declares war on Twitter",http://www.dailymail.co.uk/news/article-2749247/ISIS-declares-war-Twitter-Terror-group-warns-employees-assassinated-closing-Islamist-propaganda-accounts.html,,1410277086
8290667,story,,,1,0,timsaunders,"What Is the Business Model of Apple's iWallet?",http://www.forbes.com/sites/quora/2014/09/08/what-is-the-business-model-of-apples-iwallet/,,1410277072
8290666,comment,8289363,8289363,1,0,yeukhon,,,"Back in 2008 when I was in high school I picked up computers that were thrown out by the school with 256 or less RAM. The smallest one only had 64mb of RAM! I managed to install Ubuntu 6 on it but I could feel the lag. I found DSL and I had no trouble running it on them at all. The iSO was only 50MB irrc. It was damn small.<p>This was me: <a href=""http://damnsmalllinux.org/static/act-Print/f-1/t-19848.html"" rel=""nofollow"">http://damnsmalllinux.org/static/act-Print/f-1/t-19848.html</a>",1410277060
8290665,story,,,1,0,flaviuss,"10 Examples of Awesome Landing Pages for Mobile Apps",http://blog.mobiversal.com/10-examples-of-awesome-landing-pages-for-mobile-apps.html,,1410277054
8290664,comment,8289577,8289918,2,0,nether,,,"subscribe to reddit.com/r/vandwellers. for pooping, you could resort to biffy bags.",1410277039
8290663,comment,8289363,8289363,2,0,codygman,,,"Does this come with tinyxserver by default? Anyone know how to start it? startx doesn&#x27;t seem to work.",1410276996
8290662,comment,8289577,8290107,1,0,danielweber,,,"There <i>are</i> companies that hire in the top-20 (as opposed to top-5) markets.  They usually have their own idiosyncrasies (like taking 3 weeks to schedule an onsite interview), but they are out there.<p>I&#x27;m on the job hunt now and hiring is still a huge mess as it ever was.",1410276995
8290661,comment,8290067,8290413,0,0,gress,,,"It may be a natural function, but it can be amplified and distorted by institutions and media.  Not all cultures are the same, and there are reasons for that.",1410276988
8290660,comment,8287700,8290054,1,0,constexpr,,,"What&#x27;s completely broken about it? If you use it the way it was intended to be used, as a cache for apps, then it works perfectly fine in my experience. It behaves like a native app that updates itself in the background (Chrome itself does this, for example). If you try to use it as a HTTP cache then yes, it&#x27;s completely the wrong tool for the job and you&#x27;re gonna have a bad time.",1410276987
8290659,comment,8287905,8289977,1,0,mzs,,,Thanks,1410276981
8290658,comment,8289577,8290558,16,0,bsamuels,,,"welcome to modern internet &#x27;journalism&#x27;",1410276980
8290657,comment,8289577,8290206,0,0,yummyfajitas,,,"Just curious, what is &quot;longer periods&quot;? Is celibacy for a year really a plausible outcome for most people in SF? And is it so likely that it makes living in a car worthwhile? I&#x27;m honestly curious.<p>Year-long celibacy is not super uncommon in India, but Indian culture is explicitly set up to make sure women don&#x27;t have sex until their parents get them married off. I&#x27;m really shocked to hear that SF is that bad.",1410276974
8290656,story,,,1,0,erkz,"Facts about iOS8 for App Developers",http://www.instantdevices.com/testdroid/7931/10-facts-about-ios8-how-will-it-be-different-for-app-devs,,1410276970
8290655,comment,8290497,8290497,31,0,AshleysBrain,,,"This is a technical mis-reporting which I can understand, but it worries me a lot more that in the wider press this level of mis-reporting occurs over other issues (finance, healthcare, politics, social change, foreign events etc.) and I don&#x27;t understand enough about them to notice the mis-reporting.",1410276969
8290654,comment,8290067,8290400,3,0,Leszek,,,"The Dalai Lama, Gandhi and Mother Teresa you say? Penn and Teller would be the counter example to your potential counter-evidence: <a href=""https://www.youtube.com/watch?v=o6voAW_Go5Y"" rel=""nofollow"">https://www.youtube.com/watch?v=o6voAW_Go5Y</a>",1410276948
8290653,comment,8287673,8288047,1,0,JimmaDaRustla,,,"Yes, you need the CVV printed on the back of the credit card to make an online purchase.<p>And the CVV on the back, is different than the CVV stored on the magstripe/chip.",1410276947
8290652,comment,8289786,8289786,4,0,t0mas88,,,"This looks like a great idea. For me this was a missing piece two months ago when playing with Docker.<p>However I have strong doubts about the network performance, not only the overhead of the UDP encapsulation (that should be quite small), but mostly the capturing of packets with pcap and then handling them in user-mode. Looks like a lot of context-switches, copying and parsing with non-optimal code paths. Are there any benchmarks available?<p>My feeling is that this will consume large amounts of CPU for moderate network loads and thus be unusable with most NoSQL kind of systems that benefit from clustering across hosts?",1410276939
8290651,comment,8286162,8287245,1,0,lbradstreet,,,"I&#x27;ve spent a fair amount of time in core.async, and I feel like I&#x27;m on the edge of enlightenment here, but I don&#x27;t quite understand how CSP helps with this example. Is the point that you can take multiple puts off the channel in one go? That&#x27;s the only thing I can think of.<p>Maybe you could present the CSP alternative, and a basic example use case?<p>* edit: I guess a basic example is a sliding-buffer that only keeps, and thus only reacts to, the last mouse event. Is this on the right track?",1410276925
8290650,comment,8289577,8290025,2,0,Fuzzwah,,,"I don&#x27;t disagree, but the upside is that it eventually finds its way to HN and generates interesting discussion. This saves me from having to visit quora, businessinsider or yahoo news.",1410276924
8290649,comment,8290067,8290470,2,0,Shish2k,,,"The company I&#x27;m currently working at doesn&#x27;t have any assholes in the dev team; and yet even after hiring every single woman who has ever even <i>applied</i> for a software development role, we have zero women in the team :/",1410276914
8290648,story,,,2,0,danso,"Top Colleges That Enroll Rich, Middle Class and Poor",http://www.nytimes.com/2014/09/09/upshot/top-colleges-that-enroll-rich-middle-class-and-poor.html?abt=0002&abg=1,,1410276906
8290647,comment,8290497,8290598,2,0,bhhaskin,,,"Unfortunately people are lazy.",1410276902
8290646,comment,8290466,8290575,1,0,ale7714,,,"Two months. Yes, you&#x27;re right my main concern shouldn&#x27;t be the image that I&#x27;m projecting. Thanks for writing.",1410276888
8290645,comment,8289718,8289718,1,0,aaron-lebo,,,"Are they using assets from the original game (if so, are they legally available), or is everything open source and original content?",1410276869
8290644,story,,,3,0,Scogle,"Why automated journalism will save lives",https://medium.com/@scogle/why-automated-journalism-will-save-lives-213397cc6358,,1410276863
8290643,story,,,1,0,daegloe,"Early Intervention in Babies May Eliminate Autism Symptoms by Toddlerhood",http://www.forbes.com/sites/alicegwalton/2011/12/09/living-life-with-autism-ii-perspectives/,,1410276855
8290641,comment,8290067,8290626,1,0,FfejL,,,"You call women coders &quot;girls&quot; while calling men coders &quot;male.&quot;<p>Yes, I see sexism.",1410276835
8290640,comment,8288119,8288464,1,0,chaostheory,,,"Angels may be better than VCs, but the thing about angel investing, besides say Ron Conway, is that they&#x27;re not always guaranteed to be great either in terms of integrity.",1410276812
8290639,comment,8289517,8290596,2,0,avsm,,,"While I enjoy a spot of reverse engineering as much as the next hacker, it&#x27;s probably easier just to ask them for the protocols in this case; try <a href=""http://twitter.com/nickludlam"" rel=""nofollow"">http://twitter.com/nickludlam</a>",1410276797
8290638,comment,8290067,8290555,2,0,DanBC,,,"People thought she was not a programmer even though she wrote a book about programming interviews.",1410276793
8290637,comment,8290242,8290242,3,0,davidw,,,"Is there a tutorial for using org-mode only for a simple TODO list that anyone can recommend?  I had a brief look around, but don&#x27;t have the time to read the entire manual at the moment.",1410276783
8290636,comment,8290314,8290314,3,0,robinhowlett,,,"STATS was recently sold by Fox Sports and the Associated Press to the SF-based private-equity firm Vista Equity Partners. The rumored sale price was around $200M.<p>We work with STATS data daily and their products are excellent, albeit very expensive.",1410276777
8290635,story,,,3,0,tkfx,"Java 9 – The Ultimate Feature List",http://www.takipiblog.com/java-9-the-ultimate-feature-list,,1410276770
8290634,comment,8290035,8290491,4,0,rgejman,,,"I really don&#x27;t think this is a big deal. I&#x27;ve had the same MTA card in my wallet for over a year (and a previous one like it for a year before that). I just top it off with $50-60 a month and there&#x27;s no issue.<p>I appreciate that this might be bothersome to some tourists, but my experience is that most tourists who buy MTA cards don&#x27;t calculate exactly how many rides they&#x27;re going to take in a several day visit to NYC.",1410276754
8290633,comment,8290466,8290603,1,0,ale7714,,,"Thanks, this makes sense.",1410276753
8290632,story,,,1,0,soniaparker,"Pangu 1.2.1 jailbreak announced for windows fixing crash issue",http://cydiamate.net/pangu-1-2-1-jailbreak-download/#.VA8dYvmSxuw,,1410276724
8290631,comment,8285994,8286922,1,0,maxbrown,,,"&quot;You have 24 hours to give me more than 24 hours&quot; ?",1410276699
8290630,comment,8290283,8290283,11,0,lbradstreet,,,"I am seriously glad that this is a thing. I donated after the original bountysource, and seeing the momentum I may just donate again.",1410276673
8290628,comment,8288682,8290583,2,0,potatolicious,,,"Agree in general - though I&#x27;d stop short of questioning if the person needs to re-evaluate whether or not they should be in the program.<p>A <i>lot</i> of high school students come into university with no job-finding skills, which are going to be critical to their future success. Job-finding, interview, and general industry skills are hard won through experience.<p>Like failing a course, failing to demonstrate rudimentary job skills should hold you back until you can gain these skills. For some people this takes longer than others (1A + 1B unemployment at Waterloo is somewhat rare), but repeatedly being unemployed is not necessarily a sign that someone doesn&#x27;t belong entirely.<p>Knowing little about his friend, my first reaction is that maybe he should&#x27;ve stuck it out. Waterloo is a tremendous place to gain job skills - there is no more fertile ground to test resumes and interview skills at volume than it - I personally had over 70 interviews under my belt by the time I left that school.",1410276657
8290627,comment,8289273,8289273,1,0,j45,,,"I see a lot of great discussion but not much centered around hosting itself. I do agree with Brennan and have been pricing how he described for some time,  it works. Value based pricing always works with the right kind of clients.<p>Along the way I was able to run a website that delivered the retail customer website of a billion dollar company using my code.<p>How something as silly as hosting helped make it happen..<p>I have hosted customer apps and sites in a datacenter since about 98.  Networking, security was something that there was little choice to avoid picking up  in addition to software development.<p>Forget about today, even 15 years ago (man it&#x27;s weird typing that), hosting was quickly becoming outdated.  Yet, there was still an earnest need that was going unfulfilled.<p>The need I see repeatedly is for complex/custom hosting of Web apps and websites instead of the basic ones.<p>Example today? Even something as simple as Wordpress is a pain to reliably host when there is traffic for the average person. Someone deciding to master WP has lead to a fantastic startup with WPEngine which sits on the premium end compared to it&#x27;s peers.<p>This isn&#x27;t for everyone: assuming you have the ability to develop your skills as needed, and with the right support, you can tackle your slice of the complex/custom/app hosting market.<p>Even small businesses with custom workflow or website apps often end up needing their own vps or dedicated server to maintain. If you&#x27;re this passionate about hosting,  I&#x27;m trusting that you have or are pursuing dedicated hosting skills.<p>Putting together a managed server hosting package that may or may not provide application level support can be quite stable income assuming the line is clearly drawn between code induced issues vs infrastructure induced issues.<p>How much is on the other side?<p>On the low end I have changed a few hundred a month,  all the way up to a few thousand a month, so a customer can have a sys and app admin rolled into one.<p>The right kind of customers definitely have a peace of mind budget, where they want the discipline and consistent availability of someone who cares about them more than a contractor.  The bottom rung of customers don&#x27;t scale very easily, either.",1410276612
8290625,comment,8284835,8287378,1,0,aidenn0,,,"See the issue is you and I have <i>very</i> different ideas of what work needs to be done:<p>I don&#x27;t use higher-order mathematical primitives in my work, so that&#x27;s out.  I avoid threading like the plauge (even in non-lisp code), and I&#x27;ve never had to sacrifice a single goat to get quicklisp to work.",1410276601
8290624,comment,8289577,8290335,2,0,awjr,,,"I was heavily into SWOTOR at the time and that was a driver for an increase in my battery capacity, but honestly, the place I worked at was pretty chilled and I could sit and play after work if I wanted (on my laptop).<p>There is nothing to prevent you having one wall of your van being a white projector screen. You just need to consider how you power such an environment for a night of gaming.<p>TBH it&#x27;s not that unfeasible to have a projector mounted on the roof and a pull down screen.....one worth thinking about.",1410276601
8290623,comment,8285872,8289246,1,0,canterburry,,,"That is exactly what I have been doing and it has worked up to a certain point. Contractors have gotten used to this trick and now just look for that one phrase and skip the rest.<p>I just wish it wasn&#x27;t necessary.",1410276595
8290622,story,,,2,0,Jake232,"Kick Google Glass from Network",http://julianoliver.com/output/log_2014-05-30_20-52,,1410276568
8290621,comment,8289718,8289718,3,0,leishulang,,,"when will Starcraft brood war html5 that are capable of 2v2 online multiplayer available?",1410276563
8290620,comment,8289517,8289711,1,0,chaostheory,,,"Chumbys still work (probably because bunnie seems benevolent). Even when its servers were turned off for a while, they still worked; you just couldn&#x27;t choose a different clock face.",1410276561
8290618,comment,8285994,8290477,1,0,maxbrown,,,"I learned this recently, the most interesting part of which was that the founders stand silent in front of the investors for at least a few minutes while the lighting and sounds and such are set.<p>I wonder, don&#x27;t you think the shot clock offer is real even though they&#x27;ve been talking longer than we&#x27;ve seen?",1410276554
8290617,comment,8290563,8290606,5,0,jacquesm,,,"That&#x27;s accountability by definition. Your ass will be on the firing line for every decision that doesn&#x27;t work out, whether done by those below you or above you doesn&#x27;t matter.<p>You&#x27;re labelled mr. or mrs. Expendable.",1410276548
8290616,comment,8290067,8290302,1,0,gress,,,"Not everyone is equally antisocial.",1410276534
8290615,comment,8287673,8288337,1,0,JimmaDaRustla,,,"That&#x27;s not the same CVV.<p>Edit: Even having the track 2 data won&#x27;t do you any good in reproducing an EMV card. The only way reproducing a mag stripe EMV card is useful, is if it is used at a non-EMV terminal and mag stripe is the only option.<p>I believe Europe has complete banished mag stripe now.",1410276528
8290614,comment,8288555,8289128,2,0,kourt,,,"I see your point.\nBut I love that it&#x27;s <i>one feature at a time</i>, rather than being placed between two columns of links to other stories, other photos, automatically-playing videos, and ads.",1410276501
8290613,comment,8290563,8290563,2,0,jacquesm,,,"Bankrobber?<p>You&#x27;re not just asking for a high paid job with low accountability, you&#x27;re also asking for a place where you don&#x27;t have to learn (so a stagnant field) without advancement that&#x27;s an area of the cube that is totally empty as far as I know.<p>I suggest you get off your ass for the next 10 years, save like mad and then retire from your savings at as low an expense level that you can get away with.",1410276497
8290612,comment,8287673,8288058,1,0,JimmaDaRustla,,,"CVV2/CVC2 (visa/mastercard) generation on the back of the card is COMPLETELY different than the CVV on the chip.<p><a href=""http://en.wikipedia.org/wiki/Card_security_code"" rel=""nofollow"">http://en.wikipedia.org/wiki/Card_security_code</a> Skip down to Types of Codes",1410276495
8290610,comment,8290055,8290562,4,0,pizza234,,,"At this point in time, they still can&#x27;t be compared, because btrfs is still not [considered] production-ready, and subject to significant changes (also performance-related).<p>This is especially important because on use cases where performance differences are significant, that is, not on general desktop usage, the maturity of the FS is funamental, and btrfs is discouraged right now.",1410276446
8290609,comment,8288555,8289361,2,0,tlear,,,"Huge support would be a massive understatement. Half the congress would be for an all out ICBM strike and other half would be for levelling the country and sending it back to stone age.",1410276438
8290608,comment,8284835,8287702,1,0,aidenn0,,,"If you make a dialect without car/cdr the first thing about 30% of lisp hackers will do is write a macro to generate definitions for all of these:<p><a href=""http://www.lispworks.com/documentation/HyperSpec/Body/f_car_c.htm"" rel=""nofollow"">http://www.lispworks.com/documentation/HyperSpec/Body/f_car_...</a>",1410276435
8290607,comment,8288506,8289291,1,0,kevin_thibedeau,,,"I am not a competitive cyclist but remove the hair on my legs with a depilator in the Spring because my leg pelt retains too much heat in the Summer. There is a noticeable improvement in cooling after it is done.<p>While not the most pleasant process, it avoids stubble and the delayed regrowth means the new hair is sufficiently long to begin providing warmth just in time for when cooler Fall temps arrive. I always considered that to be the real reason why the pros do it with road rash being of secondary concern. Those with shorter leg hair just went along and copied their hairier peers.",1410276435
8290606,comment,8290563,8290563,6,0,nilsimsa,,,"Basically any middle management position in a large enough company.",1410276417
8290605,comment,8290067,8290421,1,0,codygman,,,"Programming languages utilize computer science.",1410276411
8290604,story,,,1,0,lelf,"Cancer and C60-Olive Oil in a Mouse Model",https://www.indiegogo.com/projects/cancer-c60-olive-oil-in-a-mouse-model,,1410276383
8290603,comment,8290466,8290560,1,0,antino,,,"Well, I guess mostly by revising work I&#x27;ve done in the past.\nReviewing it and thinking about how it could be improved if I were to apply methods that my coworkers would use.<p>I know it could be difficult for you, but consider just asking them for advice on the systems you&#x27;re building/proposing. If you think they&#x27;re likely to turn down  the ideas you have, you may as well pre-empt that and get down to the business of figuring out a compromise. It may not make you look like some rockstar programmer, but at least you&#x27;ll be learning something as quickly as possible. Also, depending on how down to earth your employers are, appearing humble before your superiors/more experienced colleagues and wanting of knowledge will only cast a good light on you.",1410276378
8290602,comment,8287905,8288117,1,0,automatthew,,,"Hanlon&#x27;s Razor is enemy propaganda.",1410276374
8290600,comment,8282048,8285940,1,0,ssmoot,,,"> The point here is that this is nothing more than a simple writing mistake on the part of the FBI.<p>You say that like it&#x27;s fact. But you&#x27;re assuming.<p>I thought it was noteworthy that I can&#x27;t recall ever seeing that specific error in the wild. Maybe I just missed it. Maybe it&#x27;s a lot more common than I imagine. Maybe not. I don&#x27;t know. Once it was brought to my attention I thought it was noteworthy though.<p>> Pretending<p>I&#x27;m not pretending anything. I gave an additional explanation I felt might be plausible. I&#x27;m sure there are others. I just doubt the plausibility of the one brought forward.<p>> irrational fear<p>Tomato tomato. There&#x27;s no evidence it was a writing mistake, but you&#x27;re presenting it as fact.<p>I guess it all boils down to this: Given domestic spying revelations I think you&#x27;re extremely naive if you think it&#x27;s <i>irrational</i> to think that the FBI might be telling less than the whole truth.<p>Your gut reaction puts you in the camp of people who would volunteer information to a LEO. Which I think should raise a lot more alarm bells than me shrugging my shoulders and suggesting I&#x27;d need actual evidence before taking the FBI at it&#x27;s word.<p>The very idea that you would is blissfully naive IMO. But good luck with that.<p>And if you have an point to make, a little less ad-hom and snark (aka Reddittude) would be appreciated. My original comment was a few wonderings-out-loud, including posing a couple questions for discussion. Nothing in there intended to be snarky. If you want to discuss further, it would be nice if you could approach the conversation with the same level of basic respect.",1410276367
8290599,story,,,2,0,georgecmu,"Kosmos 2495 Re-Entry: Russian Spy Satellite Crashed Over Colorado",http://www.spaceflight101.com/kosmos-2495-re-entry.html,,1410276363
8290598,comment,8290497,8290497,10,0,peeters,,,"Wow, this is incredible how many tech authors were victim to such an obvious oversight.  It really shows how much of modern  news reporting is just a giant game of Telephone, with very few people willing to actually go to the source independently.",1410276352
8290597,comment,8289718,8289718,1,0,abjorn,,,"Now you can grind your life away from the comfort of your own browser.",1410276348
8290596,comment,8289517,8289517,2,0,gioele,,,"Did anybody reverse engineer the Berg/Little printer protocols? OK, I have found this from 2013, not very detailed though: <a href=""https://github.com/pipt/little-printer-payload-inspector"" rel=""nofollow"">https://github.com/pipt/little-printer-payload-inspector</a><p>It think the printer&#x27;s form factor is very nice, much much nicer than the other hacked-up solutions I have seen around.<p>I would pay those £149 for a thermal printer that was so cute and also completely open.",1410276337
8290595,comment,8287673,8288174,1,0,JimmaDaRustla,,,"EMV terminal certification must meet certain PCI standards for one thing. Not sure it would apply in this scenario, it does mention canadian cards affected, but I&#x27;m not sure if that&#x27;s because it was on american machines.<p>Secondly, if EMV was adopted in the USA, the stolen information would become useless because they wouldn&#x27;t be able to use the data to produce fraudulent cards.",1410276322
8290593,comment,8266016,8267870,1,0,mokelly,,,"These guys have a similar concept. Except they really only seek to estimate materials quantities.<p><a href=""http://www.eagleview.com/"" rel=""nofollow"">http://www.eagleview.com/</a><p>I have used their xml files previously to automatically tile roofs with solar panels.",1410276319
8290592,comment,8289886,8289924,1,0,spankalee,,,"I work on Dart at Google. We have used Dart internally for critical applications for over a year now. It&#x27;s pretty mature at this point, even if there are some specific areas that are still evolving (async/await, reflection, js interop to name a few).<p>Dart is significantly better than JavaScript (IMO, of course), that&#x27;s what it was designed for. Mostly it comes down to sane semantics and static analyzability.",1410276302
