ID,Type,Story,Parent,Points,Comments,Author,Title,URL,Content,Created
8290591,comment,8289363,8289741,1,0,mhd,,,"acpid being only one of the tools usually there to interface with power management, I&#x27;m not really up-to-date what Ubuntu uses nowadays. And yes, as with a lot of hardware stuff you&#x27;re going to end up in the kernel in the end, but without <i>any</i> management/supervision software (never mind drivers), you usually won&#x27;t get a quiet and cool laptop. Try starting a barebones arch installation on one these days, without acpid, tlp etc.…",1410276279
8290590,comment,8288555,8289087,4,0,tlear,,,"I think you seriously underestimate Japanese willingness to fight.<p>Lets say China decides to call US bluff and lands Marines on Senkakus tomorrow. To do that they would need to sink multiple Japanese coast guard vessels and kill a lot of Japanese sailors. What next? Obama says something about how he is unhappy. Japan is now probably incapable of direct landing on Senkaku right now IF it is opposed. It is however more then capable to sweeping Chinese planes out of the sky in the area. In the air war tech and training >> numbers. The other aspect of the war will be naval and Japan operates the best submarine fleet in Asia, given freedom they would inflict horrendous losses on Chinese surface fleet.<p>Chillingly at the same time PM of Japan knowing that he was betrayed by US would give an order to weaponize Japanese stockpile of weapon grade material and in a matter of weeks? month? Japan will test multiple fusion devices. Now the real game begins.<p>In reality I do not think that China will play this game now, their leaders are not Putin and Japan is not Ukraine. I think confrontation or war between China and India and/or Japan will happen but not yet. 10-15 years from now?",1410276265
8290589,comment,8290067,8290541,2,0,pkinsky,,,"He didn&#x27;t seem to know who he was talking to when he made those criticisms.",1410276261
8290588,comment,8284483,8284483,1,0,Lidador,,,"Don&#x27;t we all have a friend or two who tries to sell you stuff while we&#x27;re hanging out with friends on a night out?<p>That&#x27;s what buy ads feel like on social networks.",1410276242
8290587,story,,,2,0,utnrj,"Scott Forstall Is Human Too",https://medium.com/@utnrj/scott-forstall-is-human-too-b5bf656d22c3,,1410276209
8290586,story,,,1,0,todd8,"Mopidy is an extensible music server written in Python",http://www.mopidy.com,,1410276198
8290585,comment,8288555,8290565,1,0,mikeash,,,"Thanks, I wasn&#x27;t aware of the historical usage, and it makes me feel a little better about it.",1410276185
8290584,comment,8287673,8287932,1,0,JimmaDaRustla,,,"EMV isn&#x27;t about securing information, it&#x27;s about customer/card validation - validating that the person using the card is who they say they are. Therefore you are secure from fraud - as you said, cards are hard to reproduce.<p>You still need the CVV code to use the card number in a card not present transaction. So not to your point, it is rather secure...<p>EMV would have helped immensely here, especially considering EMV compliant machines are held to PCI standards as well.",1410276168
8290583,comment,8288682,8289865,3,0,ska,,,"My experience hiring from Waterloo co-op is that it is both well run and supports even the most junior students well.<p>The systems design and mechatronics programs there are very strong. Given that your friend was in a competitive engineering program aimed at putting graduates into good industrial positions, the inability to find a position in two terms is probably a good sign they needed to re-evaluate if they were  in the right program for them.<p>There is nothing arbitrary about this, and they communicate it quite well.  It sounds like the system was working as designed, although I understand how this could have been a rough time for your friend.  Then again, that&#x27;s one of the things college is for, and it&#x27;s hardly a unique situation.",1410276157
8290582,comment,8289718,8289718,1,0,Kiro,,,"Where is the actual JS code for the client?",1410276145
8290581,comment,8289577,8290511,2,0,avz,,,"I think one should spend their time on whatever one is passionate about. It seems some people have jobs which are so interesting and engaging that they are essentially aligned with their passions. I think it&#x27;s great!",1410276140
8290580,story,,,1,0,todd8,"Package for Ant Colony Optimization Meta-Heuristic in Python",https://pypi.python.org/pypi/ACO-Pants/0.5.2,,1410276126
8290579,comment,8289676,8289676,1,0,sjs382,,,"This has been out for a while on the Chrome Canary release channel (the nightly build).<p>It&#x27;s really a great tool, and helps a ton with responsive and mobile development.  Kudos to the Chrome team for finally pushing this to the stable release.",1410276120
8290578,story,,,2,0,marmarlade,"Robb Stark – a classic example of poor strategy and execution",https://medium.com/building-and-breaking/the-manager-who-lost-the-north-5bd92cb0a7d4,,1410276118
8290577,story,,,2,1,readerrrr,"Nvidia  Launches Patent Suits Focused on Samsung Galaxy Phones, Tablets",http://blogs.nvidia.com/blog/2014/09/04/nvidia-launches-patent-suits/comment-page-3/#comments,,1410276091
8290576,comment,8290067,8290067,8,0,shittyanalogy,,,"Serious question, what is this representative of?<p>Random internet comments? Unscientific internet polls?<p>I honestly can&#x27;t figure out a reason why any of this is any more relevant or scientific than a youtube comments argument about why some band does or does not suck monkey chode.",1410276079
8290575,comment,8290466,8290466,1,0,seren,,,"How long have you been there ?<p>If you are at a new place, and you don&#x27;t have a clear view of the overall architecture, which parts are in good shape, which are not, etc, it is natural to be less confident in proposing a solution, particularly if people have been there for a long time.<p>However, it should not stop you of asking open ended question like &quot;Why did module X have been developed with Y instead of Z ?&quot; You&#x27;ll probably learn quite a bit on the historical, political or time constraint reasons. And you could stumble upon a good suggestion because no one had the idea or will to change the status quo.<p>The advantage of being new is that you can assess the code base or practice with a &quot;fresh&quot; look. I don&#x27;t think that anyone is expecting you to have the best idea on every proposal, you should maybe relax a little bit on the image you want to project. You can&#x27;t be &quot;the expert&quot; in two months. Try to focus on a very narrow part of the project where you feel you have a related experience or can contribute something meaningful.",1410276070
8290574,story,,,2,0,vinnyglennon,"How much equity to issue to your board of directors and board of advisors",http://www.startupsmack.com/how-much-equity-to-issue-to-your-board-of-directors-and-board-of-advisors/,,1410276068
8290573,comment,8290067,8290526,1,0,pas,,,"SEs need to know results from CS. That might be seen as separate, but knowing results and when to apply which, I think requires one to be at least a bit CS-educated. So, no, they&#x27;re not separate in the ideal case, but obviously, results in CS are arrived at through mathematics and rigorous proofs, whereas resutls in SE are usually produced via code.",1410276048
8290572,comment,8290067,8290421,1,0,scott_s,,,"I&#x27;ve addressed the whole &quot;CS is math&quot; thing so much, I wrote an essay on it: <a href=""http://www.scott-a-s.com/cs-is-not-math/"" rel=""nofollow"">http://www.scott-a-s.com/cs-is-not-math/</a>",1410276039
8290571,comment,8289034,8289034,1,0,macinjosh,,,"This looks seriously awesome. Though, instead of investing all the time, effort, and resources it would take to use this you could use something like 6px.io and keep your focus on your core product.",1410276037
8290570,comment,8290067,8290384,5,0,vadman,,,"I actually went to college with Gayle - she was a TA* in one of my harder, more rigorous classes.  I never got to know her personally, but I find it hard to believe that you can talk to her for an entire hour and not figure out that her knowledge and understanding are way beyond those of a recruiter, even a smart one.  Says more about the listener, IMO.<p>Personal anecdote, take it for what it&#x27;s worth.<p>*TA = teaching assistant, older students hand-picked by professors to conduct help sessions for the current year&#x27;s crop, as well as grade homeworks/exams.  I.e. you need to do  well in a class to qualify.",1410276035
8290569,comment,8289676,8289803,0,0,wil421,,,"Well management doesnt want outside devices on their network so its hard to test an internal app mean for technicians on a VPN.",1410276030
8290568,comment,8289619,8289987,1,0,malloreon,,,"if I&#x27;m any given bitcoin user (which I&#x27;m not), what incentive is for me to actually use it for those purposes?<p>It&#x27;s &quot;deflationary&quot; and &quot;free&quot; (in quotes because every day new coins are created out of thin air, and because the actual cost of processing each transaction is ~$25-40)<p>Let&#x27;s assume it&#x27;s deflationary. I&#x27;m way better off convincing others to spend it while I hoard as much as I&#x27;m able to.<p>The more you believe in bitcoin the less reason there is to ever spend them.",1410276026
8290567,comment,8286504,8289813,1,0,Aqueous,,,"&quot;How exactly would that go? Work -> Get paid in USD -> Convert to BTC -> Send -> your Taiwanese family gets the bitcoins -> Convert them to local currency -> Enjoy!!!&quot;<p>Yes.<p>&quot;You can&#x27;t be serious, indeed the % of people who opted for this solution is probably so big that could feel comfortable in a 24m^2 room.&quot;<p>Here&#x27;s a thread full of people who have tried this very process:<p><a href=""https://bitcointalk.org/index.php?topic=74952.0"" rel=""nofollow"">https://bitcointalk.org/index.php?topic=74952.0</a><p>It is quite easy, and more inexpensive than other forms of international money transfer, to convert money between fiat and bitcoin at this point, in many countries. On Coinbase for me at this point the BitCoins are available instantly after purchase. You should give it a try sometime :-)",1410276001
8290565,comment,8288555,8290297,2,0,krapp,,,"I generally agree with you, but it (likely) refers the the archaic (and somewhat romantic) phrase &quot;blood and treasure&quot;[0] commonly used to describe the cost of war for a nation or state.<p>[0] <a href=""http://www.grammarphobia.com/blog/2013/02/blood-and-treasure.html"" rel=""nofollow"">http://www.grammarphobia.com/blog/2013/02/blood-and-treasure...</a>",1410275991
8290564,comment,8290402,8290402,1,0,ddingus,,,"I have a bit of tape on the back of mine to corrupt the scanner.<p>Sometimes people are required to see the ID.  No worries.  If they go for the scanner, I ask them to return it and use another method to complete the transaction, or cancel the transaction.<p>The tape is there for the ones who ignore me, or move too quickly.",1410275978
8290563,story,,,40,67,lazythrowaway,"Ask HN: High paid job with low accountability?",,"This question is a bit toungue in cheek, but I am wondering if it is possible to shape a career towards the title goal.<p>I am pretty successful in my current work life - Under 25 with a 100k ish total compensation. I&#x27;ve always pushed myself, but lately I just feel lazy.<p>I&#x27;ve heard stories of boring positions in big companies where you don&#x27;t have to do much of anything, you don&#x27;t learn anything, and you don&#x27;t advance, but you can collect high salaries if you get the position and there&#x27;s not a lot of work expectations.<p>Is there a way to reliably get a job with a decent salary, but one can coast along doing very little from 9-5?",1410275974
8290562,comment,8290055,8290320,1,0,aruggirello,,,"But is it, performance-wise?\nHow will ZFS compare to btrfs?",1410275950
8290560,comment,8290466,8290524,1,0,ale7714,,,"How have you handling it so far?. I&#x27;m turning 2 months today. I been reading and documenting a lot on free time but still not enough.",1410275939
8290559,story,,,1,0,busterc,"Show HN: JQuery-slowlane",http://help.com/jquery-slowlane,,1410275939
8290558,comment,8289577,8290380,39,0,tomp,,,"So I guess The Verge doesn&#x27;t care if I copy-paste large chunks of their articles (along with their copyrighted photos) on my web-page? Good to know...",1410275937
8290557,comment,8287905,8288833,1,0,misiti3780,,,"thanks - makes sense",1410275931
8290556,story,,,1,0,dougmccune,"Show HN: 3D Print of the South Napa Earthquake",http://dougmccune.com/blog/2014/09/09/2014-south-napa-earthquake-3d-print/,,1410275919
8290555,comment,8290067,8290067,7,0,cowls,,,"So her talk was on tech interviews and someone thought she was a recruiter? Doesn&#x27;t seem that big a stretch...",1410275917
8290554,comment,8289718,8289718,1,0,u124556,,,"I wonder in how many years we&#x27;ll be able to play WoW or GuildWars2 on our browsers.",1410275900
8290553,comment,8285994,8288847,1,0,maxbrown,,,"I have an equal distaste for exploding offers, but I&#x27;m not sure this will get the desired result :)",1410275889
8290552,story,,,1,0,dnetesn,"Giving the Milky Way a New Sense of Place",http://www.nytimes.com/2014/09/09/science/space/astronomers-give-name-to-network-of-galaxies.html?ref=science,,1410275885
8290551,comment,8288148,8290347,1,0,chanachor,,,"LOL scammer :-p",1410275876
8290550,comment,8289577,8289577,7,0,tsuyoshi,,,"As an executive at a nonprofit, I was renting an apartment several blocks from my office. The apartment building was purchased by a developer who proceeded to convert them to condos. I was offered some money (I think $1500 or so) to end my lease early. I was planning on leaving the country in a few months anyway, so I took the money, and just moved all my belongings into my office.<p>I stored my clothes in an otherwise-unused filing cabinet, took showers at a gym a few blocks away, and slept on the floor, with just a blanket and pillow. The biggest problem was laundry; the nearest laundromat was pretty far away and I didn&#x27;t have a car. I ended up strapping a sack full of clothes to the back of my bicycle and riding a couple miles to the laundromat every weekend.<p>I had a private room with a door that closed, but everyone at the office knew what I was doing. The only conceit was that I claimed that it was only temporary until I could find the right place to move into; in reality I found it so convenient and cheap that I stayed for over a year (until I did, in fact, leave the country). One Friday night, I even had a friend stay over; he slept on a couch in someone else&#x27;s room.<p>Our organization rented a suite in a larger building, and every morning when I woke up and went to the restroom, I saw other people seemingly doing the same thing. One guy even went to the restroom every morning in a bathrobe. From about 6-7AM it reminded me a truck stop restroom, with people brushing their teeth and giving themselves sponge-baths at the sink. There are zoning laws that prohibit people from sleeping in offices, but I think the property manager didn&#x27;t really care as long as everyone was reasonably discreet.<p>There were a few significant disadvantages. First, there was no kitchen. I had an electric kettle that I used to cook ramen, which I would add eggs and canned meat and vegatables to, but that was about it, except for eating out. There were plenty of nice restaurants nearby, and I had plenty of extra money from not paying rent, so it was not a huge problem.<p>Second, personal mail. The US Postal Service has a policy of not forwarding mail, addressed to an individual at a commercial address, to a residential address. This meant that when I forwarded my mail from my apartment to my office, I couldn&#x27;t later forward my mail from my office to somewhere else.<p>Third, the gym was not open on holidays. On Thanksgiving and Christmas, I went to my parents&#x27; house anyway, so I just took a shower there. But for other holidays like Labor Day and Independence Day, I had to do without a shower.<p>I would do it again. Actually, I would even consider just renting an office instead of an apartment to live in. Generally speaking, office space is cheaper, easier to rent, and more centrally located than housing. These days though, I&#x27;m married, and my wife would not be so enthusiastic.",1410275860
8290549,comment,8290067,8290450,2,0,icebraining,,,"<i>Eventually, all the current minorities, including women</i><p>Women are not a minority; not in the US nor in the vast majority of countries.",1410275854
8290548,comment,8284785,8286207,1,0,zymhan,,,"That doesn&#x27;t seem to support music you already have though, which is a pretty big feature of Cloud Tunes.",1410275845
8290547,comment,8288148,8288911,1,0,chanachor,,,"Thanks gregcohn, I read this article last night and now am convinced that this isn&#x27;t good practice. I was surprised that the company that went ahead with these guys actually did because they had been around for sometime.",1410275842
8290546,comment,8282704,8282704,1,0,BFay,,,"...so, if I&#x27;m understanding this correctly, you&#x27;re ultimately just saving local, DRM-free copies of music downloaded from Spotify?<p>Is this basically just Napster in 2014?",1410275838
8290545,story,,,1,0,dnetesn,"Unlike Anything They Have Ever Seen Before",http://www.nytimes.com/2014/09/09/science/unlike-anything-they-have-ever-seen-before.html?ref=science,,1410275831
8290543,story,,,12,0,kneisley,"Unintended consequences of genetic testing",http://www.vox.com/2014/9/9/5975653/with-genetic-testing-i-gave-my-parents-the-gift-of-divorce-23andme,,1410275824
8290542,story,,,1,0,squirrel,"Eliminating Legacy Code at Osper",http://tech.osper.io/post/97047580152/how-to-be-awesome-part-5-eliminate-legacy-code,,1410275818
8290541,comment,8290067,8290067,3,0,techdebt5112,,,"I&#x27;m guessing his assertion that the person of interest is no programmer has more to do with Gayle&#x27;s book being full of platitudes and errors than her sex.",1410275799
8290539,comment,8290067,8290468,2,0,possibilistic,,,"Thanks for raising this point. It&#x27;s absolutely correct, and I agree with both of you.<p>It still irks me when biases are so <i>general</i> and aimed at an entire set of people. I know I do the same internally for some populations or interest groups, but it still makes me mad when I see it done by others on the basis of race, gender, sexual preference, etc. I&#x27;m probably guilty at some level too sometimes... :/",1410275787
8290538,comment,8288148,8288148,1,0,JSeymourATL,,,"There&#x27;s loads of info on packaging and presenting your deal to investors-- spend some time on this project, you can totally hack this on your own.<p>Book recommendation, Oren Klaff&#x27;s Pitch Anything! <a href=""http://pitchanything.com/book/"" rel=""nofollow"">http://pitchanything.com/book/</a>",1410275785
8290537,story,,,2,0,nvr219,"Home Depot Data Breach Could Be the Largest Yet",http://bits.blogs.nytimes.com/2014/09/08/home-depot-confirms-that-it-was-hacked/,,1410275773
8290536,comment,8289577,8289821,2,0,Padding,,,"I&#x27;m curious why the weather argument comes up so often. Aren&#x27;t we, as &quot;software people&quot;, under a roof and in front of a screen most of the time anyways?<p>Then again, I&#x27;m &quot;deep inside&quot; Europe, so I have no idea how bad the weather over there really is.",1410275770
8290534,comment,8290055,8290055,13,0,fiatmoney,,,"I use ZFS on Linux for my file server.  One of the nicest things about it is that the caching algos actually work - they&#x27;re resilient to scans, so I can, for instance, have an intensively used database file that remains in RAM, even while & after doing a linear scan over a large number of files (eg during rsync).  With the standard Linux page replacement algos, linear reads will flush the stuff you&#x27;re actually using out of the page cache.<p>The fact that the caching algos are so good at keeping things in memory is why everyone gets hung up on using ECC RAM with it.",1410275766
8290533,comment,8290283,8290502,24,0,xienze,,,"Agreed.  When the initial fundraising campaign was happening I figured it was just going to fizzle out eventually when the guy driving it got bored.  Boy was I wrong... this is a seriously organized effort.",1410275757
8290532,comment,8289718,8289718,2,0,JonLim,,,"Incredibly impressed.<p>I&#x27;m at work, and it&#x27;s working superbly, with no noticeable lag or stuttering. I... I should stop.<p>Great work!",1410275717
8290531,story,,,1,0,rahimnathwani,"Rakuten of Japan to Buy Ebates, a U.S. Rebate Site, for $1B",http://dealbook.nytimes.com/2014/09/09/rakuten-of-japan-to-buy-ebates-a-u-s-rebate-site-for-1-billion/,,1410275703
8290530,comment,8290067,8290067,8,0,troupe,,,"There are many stereotypes that go along with being a programmer that are negative. There are stereotypes that go along with being a recruiter that are positive. While gender may have something to do with people thinking she is a recruiter it may not be the main factor. If you meet someone who is well spoken, well dressed, writes books on how to interview, knows how to talk about code, etc. might there be a greater chance that their job is something other than writing code every day?",1410275687
8290529,comment,8289718,8289718,1,0,mhd,,,"Hope that this is better code than the OS Ultima Online stuff I looked at years ago. Which looked a lot like decompiled binaries, even the original code…",1410275680
8290528,comment,8290242,8290242,4,0,616c,,,"So I am trying to restart a blog using org-mode.  I think it is the way forward.  Right now, I meaning using it as one subset, a markup language to convert into other representations.  I know org-mode is more featureful than that by a long shot.  I am just curious for this use case for the reason below.<p>Having said that,I am more interested in why, despite the Church of Emacs and Its Holy Love of Parens (that is a joke from an admirer, btw), why pure sexpr is not the way forward for a markup language.  I decided to look into them recently, including cl-who, Scribble (CL, Scheme, and now most popular Racket variants), and other sexpr markup languages.  I did so thinking that, if you want to have a ground-up markup language to convert to anything, would not sexpr-based data be the best for the iconicity Lispers crave.  Is it not that far removed from XML+XLST for this very reason.<p>Does anyone have full-bodied markup that uses sexpr as a source and translates to everything?  I think this would be quite compelling, well maybe only to Lispers.  Would there be a desire for such a thing?",1410275678
8290527,story,,,1,0,dnetesn,"Organized Chaos Makes the Beauty of a Butterfly",http://nautil.us/blog/organized-chaos-makes-the-beauty-of-a-butterfly?utm_source=tss&utm_medium=desktop&utm_campaign=linkfrom_feature,,1410275653
8290526,comment,8290067,8290480,3,0,vonmoltke,,,"> and that&#x27;s a good thing because there doesn&#x27;t seem to be a lot of dedicated &quot;software development&quot; majors in existence.<p>Actually, I think it&#x27;s a bad thing.  The sooner Computer Science and Software Engineering become separate disciplines, the better.",1410275618
8290525,story,,,3,0,joshreads,"Moto 360 needs charging absurdly often",http://www.itworld.com/personal-tech/434790/moto-360-here-and-its-i-feared,,1410275605
8290524,comment,8290466,8290466,1,0,antino,,,"I&#x27;m in the same boat, buddy.\n<i>feels</i>",1410275594
8290523,comment,8289517,8290476,6,0,toomuchtodo,,,"> This is possible, but rare. If your GPS navigator requires &quot;cloud maps&quot;, it will be useless the moment its provider goes out of business or turns off the v1 servers in favour of v2 servers.<p>I have a 10 year old GPS receiver in a box, with no way to update with maps from Garmin, not because Garmin went out of business but because they just choose not to support the device anymore.<p>Do I want to spend hours trying to figure out how to update a 10 year old device? Or would I rather spend $100-$200 on a brand new one with the latest maps?<p>Obsolescence isn&#x27;t a bad thing, its how we move forward. We just need a clean process to recycle the waste that process generates.",1410275591
8290522,comment,8289517,8290141,2,0,Igglyboo,,,"PSO was playable just fine offline and split-screen however. And if anyone is interested SCHTSERV[1] is a PSO private server that is still up. They have gamecube, dreamcast, and PC clients.<p>[1] <a href=""http://www.schtserv.com/"" rel=""nofollow"">http://www.schtserv.com/</a>",1410275588
8290521,story,,,1,0,denzil_correa,"David Blei – pioneer of topic modeling – receives ACM award",http://awards.acm.org/award_winners/blei_3974465.cfm,,1410275588
8290520,comment,8289577,8290218,2,0,awjr,,,"Just make sure it&#x27;s a camper van and not a van ;)",1410275587
8290519,comment,8290067,8290067,1,0,droithomme,,,"Referenced article mentions a case where some random critic on the net criticizes a CEO who writes books touching on recruitment issues from the candidate perspective, claiming they are a recruiter. Random critic essentially argues that CEO is not a programmer since they don&#x27;t have code.<p>I think it&#x27;s a legitimate practice in the field to look at whether someone develops actual code and if their code works in order to evaluate whether or not they are actually a programmer. This is because there are a lot of posers and incompetents in the field. Seeing actual code and/or projects the person has built cuts through a lot of Big Talk and claims.<p>In this particular case, the CEO has listed on her site several projects she developed herself to solve real world problems. This is solid evidence that she is in fact a programmer. Therefore, the random critic&#x27;s claims are without merit.",1410275579
