ID,Type,Story,Parent,Points,Comments,Author,Title,URL,Content,Created
8290735,comment,8287673,8287956,1,0,JimmaDaRustla,,,"PIN verification is performed against the chip first, not online. Although Chip+Signature is possible, it really doesn&#x27;t make sense.<p>Edit: Chip cards provide a Cardholder Verification Method List (CVML) to the terminal. The terminal then decides what method it&#x27;d like to use. Options are PIN online, PIN offline plain text, PIN offline enciphered, Signature, or No Authentication.",1410277623
8290734,comment,8290563,8290617,2,0,ja27,,,"That&#x27;s why they avoid making any decision until absolutely forced to. If it&#x27;s big enough, get your manager to decide. If it&#x27;s small enough, &quot;empower&quot; someone below you to make the decision.",1410277610
8290733,comment,8289273,8290235,2,0,luckyisgood,,,"How about you offer your client that it would be YOU who would help find another person for that other project for your current client, so you form a team of two? If your client is not a developer or a technical person, it&#x27;s 100x harder for them to find a suitable person for the job (and I hear you: you wouldn&#x27;t want to work with Tweedle Dum and Tweedle Dee either nor should you lower your standards). Whatever needs to be done on that task, chances are you would be an ideal dev lead / project manager / senior dev for that task on that project. You could present yourself as a partner on that project who would do some of the work, but that way you&#x27;d be slowly moving away from coding and more in the direction of managing / strategic consulting. That way you can demand more money because you&#x27;re adding more value, and you&#x27;d be responsible for the other person. Recognizing good dev talent is hard, that&#x27;s the hidden value that many developers forget that they bring to the table.<p>And yes, networking helps. I have my own small &quot;mastermind&quot; group and the best thing I get out of it is inspiration, bursting my own bubble I have locked myself into, and decreasing fear of the future. I just wrote about it yesterday on my personal blog, so that part of your comment rang very near and very true to me.<p>In the end, you already know what to do :) I see from your comment that your direction is clear. Good luck with everything!",1410277592
8290732,story,,,237,389,Geee,"Apple – Live – September 2014 Special Event",http://www.apple.com/live/2014-sept-event/,,1410277591
8290731,comment,8290563,8290563,1,0,philrykoff,,,"I believe everyone has their &quot;department they don&#x27;t like&quot; and where you ask yourself: what do they do all day?<p>For me, it&#x27;s Governance. The governance departments of big companies do not produce a product the company sells (maybe it can be argued that they take a role in producing the image of the company, though). If they don&#x27;t do their job properly and other departments of the company do not comply with whatever they are governing, they can always blame that department. And their jobs are well paid as their role is seen as important from a higher management position.",1410277590
8290730,comment,8289786,8290070,1,0,pas,,,"Last time I tried was around 0.8, and aufs was not happy with xfs. I haven&#x27;t tried having /var/lib/docker on ext4 and &quot;/volumes&quot; on xfs, I&#x27;ll try if the need arises.<p>I run a few MongoDBs with volumes, but I&#x27;m not confident that I won&#x27;t accidentally start two with the same volume, or that someone won&#x27;t accidentally delete the volume, or .. or .. or.<p>As I&#x27;ve written to a sibling comment, I don&#x27;t consider it a hard problem, but it hasn&#x27;t been taken care of .. yet!",1410277578
8290729,comment,8290242,8290637,5,0,mhd,,,"The tutorial by David O&#x27;Toole focuses pretty much on TODO lists and simple outlines: <a href=""http://orgmode.org/worg/org-tutorials/orgtutorial_dto.html"" rel=""nofollow"">http://orgmode.org/worg/org-tutorials/orgtutorial_dto.html</a>",1410277573
8290728,comment,8290563,8290563,2,0,notacoward,,,"At many medium-to-large companies, being the CTO or in the office of the CTO fits this bill.  I&#x27;ve worked with many such people who were brilliant and/or hardworking, but I&#x27;ve also worked with many who just liked to fiddle with stuff and either throw it over the fence (where it inevitably had to be rewritten) or just never finish it.  Generally &quot;staff&quot; (as opposed to &quot;line&quot;) positions are a bit like this, because you can basically ride on one person&#x27;s power/reputation and you only have to please them.  A lot of &quot;architects&quot; also have responsibilities so vague that it&#x27;s hard to say whether or not they&#x27;re doing their jobs.<p>Mostly, though, it&#x27;s less a matter of the position than of strategies you can use in any position.  A perennial favorite trick seems to be working on multiple projects reporting in to bosses who never talk to one another.  I&#x27;ve seen people perfect the trick of telling each boss that they&#x27;re working on stuff for the other, until both essentially give up.  At a company where reorgs are frequent so that many people nominally report to managers who have no oversight of their actual work, you can even get people who literally appear nowhere on the org chart but still get paid.  It sounds like a joke or a movie plot, but it&#x27;s true.  I&#x27;ve seen it.  I have to admit I&#x27;ve been tempted to &quot;fall between the cracks&quot; myself, but I&#x27;m just not that kind of guy.",1410277569
8290727,comment,8290242,8290528,1,0,arsenerei,,,"In Clojure:<p><a href=""https://github.com/weavejester/hiccup"" rel=""nofollow"">https://github.com/weavejester/hiccup</a><p><a href=""https://github.com/cgrand/enlive"" rel=""nofollow"">https://github.com/cgrand/enlive</a>",1410277556
8290726,comment,8290563,8290563,2,0,pseudometa,,,"Government/Military contractors are a great place to start looking, particularly where there is a lot of legacy technology.",1410277530
8290725,comment,8290067,8290067,0,0,S_A_P,,,"Its only silicon valley that you will see &quot;C Level&quot; people ranting and dropping Fbombs on a blog. Time and place. Neither seems appropriate to me...",1410277523
8290724,comment,8289718,8290645,1,0,serf,,,"Yes they are using original assets.<p>No it&#x27;s not open source or legal, but Gravity appears to have given up on legally defending the game after eAthena got to a workable stage, as witnessed by innumerable pay-for-items private servers which all profit on original assets created by Gravity.<p><a href=""http://en.wikipedia.org/wiki/EAthena"" rel=""nofollow"">http://en.wikipedia.org/wiki/EAthena</a>",1410277512
8290723,comment,8290136,8290429,2,0,Igglyboo,,,"Neither does any other currency. (credit cards != USD)",1410277512
8290722,comment,8290067,8290698,6,0,verroq,,,"No one is doubting her ability <i>because</i> she&#x27;s female. But you should be allowed to doubt their ability no matter their gender is.",1410277510
8290721,comment,8290563,8290617,4,0,johnward,,,"In mega corps (worked for 2) I have never witnessed a manager or employee being fired for performance. The only times I saw a manager get fired was for sleeping with another manager&#x27;s wife. I&#x27;ve had team members that literally did nothing continue to collect their 2% raises because it&#x27;s cheaper than facing a lawsuit over termination. My last manager (before I left the first mega corp) lost 70% of his team within a 2 month span, including me, due to poor management. I think he was promoted to director or some senior management position now. If you golf with the right people there is always someone else to pass the buck too.",1410277501
8290720,comment,8287700,8289277,1,0,u124556,,,"It would be interesting to see node.js and meteor working with emscripten. Then you can forget javascript and keep it all in c++.",1410277499
8290719,comment,8290563,8290613,4,0,Kurtz79,,,"Bankrobber : high risk, high accountability.<p>Investment Banker, on the other hand...",1410277496
8290718,story,,,1,0,scottmcquin,"The Hidden SaaS Metric: Cost of Cancellation",http://abacusmetrics.com/hidden-saas-metric-cost-cancellation/,,1410277485
8290717,comment,8288555,8288555,0,0,bwilliams18,,,"This is a shitty remake of a NYTimes article:\n<a href=""http://www.nytimes.com/newsgraphics/2013/10/27/south-china-sea/"" rel=""nofollow"">http://www.nytimes.com/newsgraphics/2013/10/27/south-china-s...</a>",1410277465
8290715,comment,8289679,8289679,3,0,fogleman,,,"I&#x27;ve been working on something similar.<p><a href=""https://github.com/fogleman/pg"" rel=""nofollow"">https://github.com/fogleman/pg</a><p>Here are a couple of things I&#x27;ve created using it so far, beyond what&#x27;s in the pg examples folder:<p><a href=""http://www.michaelfogleman.com/hirise/"" rel=""nofollow"">http://www.michaelfogleman.com/hirise/</a><p><a href=""http://www.michaelfogleman.com/gps/"" rel=""nofollow"">http://www.michaelfogleman.com/gps/</a>",1410277442
8290714,comment,8289718,8290645,1,0,andypants,,,"It uses assets from the original game. Tou can download the desktop client and assets for free from the official ragnarok website, but I don&#x27;t know if it&#x27;s legally allowed to use the assets in this way. All the privately run servers also use the original assets.<p>This web client automatically downloads the required assets though. When I used the demo it just worked automatically. I didn&#x27;t need to manually download anything.",1410277424
8290713,comment,8290497,8290497,4,0,egeozcan,,,"How many errors in a simple article a tech writer/blog can get away with is shocking. On the other hand, I don&#x27;t think they have too much incentive to be correct than sensational these days, as with the power of social media, something sensational would bring much more revenue than something rather accurate. Also, even if the facts are later disputed, the short-lived nature of the medium significantly decreases the costs of such humiliation and shortened links do not tell too much about your credibility while click-bait titles are more than enough to bring attention (and therefore ad-revenue).<p>I don&#x27;t know much about online publishing though. These are just my observations as a reader.",1410277421
8290712,comment,8290563,8290617,1,0,pseudometa,,,"In a well run and effecient organization, yes... in a stale, ineffecient organization where incentives are not there, but keeping the status quo is king, then no.  Like others have said, look at government and military contractors.",1410277416
8290711,comment,8288682,8290628,2,0,ska,,,"I&#x27;m not saying they need to leave the program, just that whenever you are struggling with something like this it is a good time to ask &quot;is this for me?&quot;.  Sometimes you do poorly at something because you lack skills, sometimes because your heart really isn&#x27;t in it.<p>If the answer is yes, then next thing is to figure out how to improve in that area.",1410277414
8290710,comment,8290563,8290563,6,0,taternuts,,,"Get a job programming at a medium-large .NET or Java shop that moves slow (the more dated their stack, the better!)",1410277409
8290709,comment,8290497,8290655,5,0,blowski,,,"Agreed, but on a more positive note, it&#x27;s nice that we have easy access to the correct version. The author didn&#x27;t have to contact all the media that got it wrong in the first place and request that they publish a correction.<p>If anyone can publish anything, then there will be a lot more garbage along with the gold. It is scant consolation, but you can&#x27;t really have one without the other.",1410277391
8290708,comment,8290055,8290055,6,0,aidenn0,,,"It&#x27;s interesting that the Debian people feel that ZoL is not a derivative work.<p>I remember a thread where RMS claimed to Bruno Haible that clisp was a derivative work of readline, since it had <i>optional</i> readline support.<p>I always thought that position was untenable, but since Haible was open to licensing clisp under GPL anyway, there wasn&#x27;t a whole lot of pushback.",1410277385
8290707,comment,8290563,8290563,0,0,bsg75,,,Marketing.,1410277377
8290706,comment,8290055,8290610,2,0,derefr,,,"There are many situations where performance is important, and durability is... not. For example, ephemeral CoreOS cloud instances running Docker containers: they use lots of copy-on-write layers, but they don&#x27;t actually need to persist any state across reboots (the layers may as well be stored in volatile memory.) Btrfs is perfectly &quot;production-ready&quot; for this <i>particular</i> use-case, so a [current] performance comparison would be pretty useful.",1410277371
8290705,comment,8289786,8289786,1,0,baq,,,"can you compare this with openvpn, or any other vpn if we&#x27;re at it?",1410277369
8290704,comment,8287896,8288109,1,0,pkroll,,,"Level 2 Upgrade was also the 16K RAM, IIRC. Which I might not, but I know I got both the ROM and RAM upgrade at the same time, and if it&#x27;d been more than $300 I think my parents would have sold ME.",1410277362
8290703,comment,8290242,8290528,3,0,mhd,,,"The difference here is that we&#x27;re not talking about describing data, like XML does (most of the time), where sexpr-based markup is pretty great. For actual markup, SGML wasn&#x27;t all that bad (closing tags are useful if the start of the current section is a few screenfuls away), or the more &quot;do what I mean&quot; approach as commonly used by markdown, asciidoc, rst or org-mode. And while Emacs might be &quot;in love&quot; with lisp, it&#x27;s also all about dwim.<p>(Never mind the texinfo legacy)",1410277357
8290702,story,,,1,0,rubnov,"1630 destinations, 20,000km in 2 months",https://www.facebook.com/PassengerApp/photos/a.310773049101776.1073741828.272755452903536/334937853351962/?type=1&theater,,1410277350
8290701,comment,8290497,8290497,7,0,mikeash,,,"I hope these people are suitably ashamed of themselves.<p>I wrote an article a year ago about the use of an ARM64 CPU in the iPhone 5S and what it meant. In the introduction, I called out several poorly researched articles for getting lots of things wrong. I actually got an e-mail from one of the authors basically whining at me for calling him out in public rather than sending him corrections directly. I was feeling generous, so I went through his article and gave him point-by-point corrections. It ended up being longer than his original article, and nearly every sentence was wrong. I never heard from him again, and the article was never corrected.<p>It&#x27;s a struggle to get visibility for good information. Meanwhile bad information spreads seemingly faster than the speed of light.",1410277332
8290700,comment,8287905,8288390,1,0,krapp,,,">There&#x27;s never been any 3rd party auditing or verification of this that I know of.<p>I think that&#x27;s intended to be a feature and not a bug. With Bitcoin &#x27;third party verification&#x27; means other people no longer use a service after you&#x27;ve generously sacrificed your money to demonstrate their incompetence or malice.",1410277329
8290699,comment,8281482,8290326,1,0,lispm,,,"Personally I would not want to work in a startup problem where I need Java.",1410277325
8290698,comment,8290067,8290691,6,0,DanBC,,,"Obviously it is sexism if you doubt the coding ability of a female because she&#x27;s female.<p>HN fucking sucks for these topics.",1410277308
8290697,comment,8289786,8290115,1,0,pas,,,"I&#x27;m familiar with volumes, and here&#x27;s how I see the problem:<p>On a docker host you have the docker daemon, and whatever auxiliary stuff you need to orchestrate either the containers or the host (update docker itself, and so on), you have space for /var/lib/docker, and that&#x27;s it. Volumes are always somewhere on /host/data. That means you have to make up a scheme and convention, and cook up scripts and add it to your already quite dynamic mental model.<p>If you go and want to manage volumes, you need something for that. And currently everyone and their cats have their own solutions (because there is one they claim to use and one they use, and one they hack on to use later). I&#x27;m not claiming it&#x27;s a hard problem, just that it&#x27;s not taken care of yet.<p>Maybe Flocker will deliver, I haven&#x27;t checked it since it was posted 5 minutes ago :)",1410277305
8290696,story,,,1,0,Multics,"Drug danger and dependence",http://en.wikipedia.org/wiki/File:Drug_danger_and_dependence.svg,,1410277302
8290695,comment,8290563,8290617,5,0,howeyc,,,"That has not been the case everywhere I have worked. Also not anywhere I have been as an outside contractor. Perhaps it&#x27;s the industry.<p>Anyway, all I&#x27;ve seen is a bunch of &quot;Cover Your Ass&quot; and reluctance to make decisions by middle management. I think OP would love such a position. Very little &quot;work,&quot; just a bunch of delegating and meetings to review progress. Be ready to embrace a life of looking at Excel spreadsheets.<p>Middle Management is high enough that you can blame an underling when things go sour, yet high enough that you can command pay for your &quot;value&quot; of managing people.",1410277287
8290694,comment,8290055,8290562,1,0,aidenn0,,,"btrfs is almost painfully slow at times, so hopefully ZFS is a lot better.",1410277282
8290693,comment,8289786,8289897,3,0,Someone1234,,,"Docker hopefully will be a little different in a year as it will offer solid security isolation (which is not the case now).<p>Right now if you run a Docker container and run something within it as root, if that application gets compromised someone can break out of that container and alter the master (due to the way Docker links container-root and system-root, a root user in a container is effectively a root user on the whole system).<p>Docker are working on allowing containers to run entirely in user-mode (thanks to improvements in LXC). This would mean that you can run a process as root within a container, and if that gets compromised there is near zero chance of leveraging that into damaging the master OS (since it will just have normal user privileges).<p>Here&#x27;s an article about their progress (to usermode):<p><a href=""http://s3hh.wordpress.com/2013/07/19/creating-and-using-containers-without-privilege/"" rel=""nofollow"">http://s3hh.wordpress.com/2013/07/19/creating-and-using-cont...</a><p>To quote Docker&#x27;s own documentation[1]:<p>> However, it has been pointed out that if a kernel vulnerability allows arbitrary code execution, it will probably allow to break out of a container — but not out of a virtual machine.<p>In other words, right now, a root process is likely able to escape a Docker container. You can use SELinux, AppArmor, and similar to somewhat mitigate that when it happens but neither are near as powerful as having that usermode isolation on the master.<p>If Docker is able to get usermode containers working, it will be very difficult for a Docker container to either alter other Docker containers or the master system (other than over the network, maybe).<p>[1]<a href=""http://blog.docker.com/2013/08/containers-docker-how-secure-are-they/"" rel=""nofollow"">http://blog.docker.com/2013/08/containers-docker-how-secure-...</a>",1410277281
8290692,comment,8287896,8288455,2,0,pkroll,,,"Parents got me a TRS-80 Model I, 4K RAM, 4K ROM BASIC. Going to the 16K RAM and 16K ROM Microsoft BASIC a little later felt like getting all the power in the world.",1410277255
8290691,comment,8290067,8290576,5,0,verroq,,,"Clearly, people are not allowed to question the coding ability of a female because it&#x27;s sexism.",1410277247
8290690,comment,8287673,8288069,1,0,JimmaDaRustla,,,"You&#x27;re supposed to say CDA now - combined data authentication.",1410277239
8290689,story,,,1,0,pit,Ending,http://robotacid.com/flash/ending/,,1410277233
8290688,comment,8281482,8281970,1,0,samth,,,"Is there something in particular you find &quot;unsexy&quot; about racket-lang.org? Personally, I like it a lot more than clojure.org, but that may just be because I wrote it. :) I&#x27;ve always found the official Clojure web presence to be somewhat staid, by comparison to Scala or Python.",1410277229
8290687,comment,8288682,8290209,2,0,michaelmior,,,"A bad academic reputation is not really a plus, but fortunately this really isn&#x27;t true at Waterloo. At minimum, it depends on what your goals are after graduation. For those wishing to continue on in academia, high quality research is a nice bonus. There are plenty of opportunties for undergrads to get involved in research, and even have this be part of the internship progream.<p>Even for those who don&#x27;t, high quality research tends to attract high quality professors. It&#x27;s true that some of these professors dislike teaching, but I think there are enough who do to make up for it.<p>Disclaimer: I&#x27;m a PhD student at UoW",1410277220
8290686,comment,8285994,8290618,1,0,vxNsr,,,"It might be kinda real, but I think it&#x27;s a lot easier to see coming and prepare for than the show implies. I&#x27;ve only watched the last two seasons of shark tank, but from what I remember the offer always seems to come out of left field, Mark doesn&#x27;t appear interested and then he suddenly makes an offer. I don&#x27;t think it&#x27;s usually like that, but it makes for some great television.",1410277214
8290684,comment,8290035,8290139,1,0,mason55,,,"This generally only hits tourists but there is one place that&#x27; it&#x27;s super annoying.  If you take the AirTrain from JFK to Jamaica you have to pay $5.  The issue is that you can&#x27;t load that $5 onto an unlimited Metrocard (the kind that most locals  use) so you have to get a new one with the associated $1 fee.  Then you get your bonus on top of the $5 so you have a $5.40 Metrocard or whatever it comes out to but you&#x27;ve paid $6 for it and now have 40 useless cents on it once you come out of the Airtrain.",1410277191
8290683,comment,8249379,8250142,1,0,t0mas88,,,"I meant American Express. Acceptance of Mastercard and Visa is fine here, but American Express used to be far behind and is now playing catch-up.<p>And for groceries in Amsterdam for example you&#x27;re going to be searching for quite some time for a supermarket that accepts credit cards. They only accept debit, which is what 99% of the population has as their primary card. Of course everybody has a credit card as well, but that&#x27;s mostly used for online shopping and things like restaurants, not supermarkets.<p>So totally different from the US where any supermarket accepts credit-cards.",1410277191
8290682,comment,8289483,8289483,1,0,bstx,,,"Any KVM vs. Xen PV benchmarks? The Xen (PV)HVM case isn&#x27;t that interesting.",1410277184
8290681,story,,,72,37,kencausey,"Parsing: a timeline",http://jeffreykegler.github.io/Ocean-of-Awareness-blog/individual/2014/09/chron.html,,1410277162
8290680,comment,8290067,8290641,2,0,verroq,,,"Can&#x27;t tell if you are serious.",1410277158
8290679,comment,8287896,8289817,1,0,pkroll,,,"Color? That&#x27;d be the TRS-80 Color Computer, very different from the TRS-80 Model III, which was a (slightly) improved version of the TRS-80 Model I. Different CPU (6809E) in the CoCo, most of the TRS-80s used Z-80s till you got to the Unix machine, which used a 68000.<p>Didn&#x27;t appreciate the CoCo at the time, but a neat machine in retrospect.",1410277157
8290678,comment,8289577,8290359,3,0,tbrownaw,,,"Or, what might they be getting (or think they&#x27;re getting) that they <i>wouldn&#x27;t</i> (think that they would) be able to get elsewhere?<p>Maybe they&#x27;re concerned about lead times for hiring new people (stealing someone from a competitor vs <i>all</i> new employees needing to move first)?<p>Supposedly one of the reasons that Silicon Valley did so well, is that California doesn&#x27;t allow non-compete agreements. Perhaps there&#x27;s actually some benefit to exchanging employees with your competitors more often? (But then, what about the no-poaching agreements that companies were getting sued over recently?)<p>Maybe they&#x27;re concerned that being the only shop in town would make managers more reluctant to fire people who need it (does corporate location preference correlate to corporate culture regarding expected length of service)?<p>Maybe having offices in less expensive locations hurts the company image (for customers, or potential employees, or both) enough that the extra salary cost is worth it?",1410277155
8290677,comment,8287905,8290204,1,0,jokoon,,,"why track him down ?",1410277145
8290676,comment,8289123,8289324,1,0,abinavthakuri,,,"That&#x27;s definitely a good point! Thanks for the heads up. That is something I&#x27;ll take care of.",1410277140
8290675,story,,,8,4,pyderman,"Comprehensive list of API's per market",,"I was wondering if there is a list of all the popular API&#x27;s, be it free or paid, per market.<p>For example I&#x27;m currently working on a startup in the travel industry and would need an API to sync hotel names/addresses and another one to sync flights.<p>Do you know about a collection of API&#x27;s somewhere?",1410277131
